ffff8804067b9b40 1763197989 S Ci:1:043:0 s 80 06 0100 0000 0012 18 <
ffff8804067b9b40 1763198230 C Ci:1:043:0 0 18 = 12011001 00000008 571d01ac 00010102 0001
ffff8804067b9b40 1763198271 S Ci:1:043:0 s 80 06 0200 0000 0009 9 <
ffff8804067b9b40 1763198506 C Ci:1:043:0 0 9 = 09022200 010100a0 32
ffff8804067b9b40 1763198543 S Ci:1:043:0 s 80 06 0200 0000 0022 34 <
ffff8804067b9b40 1763198910 C Ci:1:043:0 0 34 = 09022200 010100a0 32090400 00010301 02000921 10010001 22410007 05810308
ffff8804067b9b40 1763198950 S Ci:1:043:0 s 80 06 0300 0000 00ff 255 <
ffff8804067b9b40 1763199106 C Ci:1:043:0 0 4 = 04030904
ffff8804067b9b40 1763199143 S Ci:1:043:0 s 80 06 0302 0409 00ff 255 <
ffff8804067b9b40 1763199496 C Ci:1:043:0 0 40 = 28034800 49004400 2d006300 6f006d00 70006c00 69006100 6e007400 20004d00
ffff8804067b9b40 1763199533 S Ci:1:043:0 s 80 06 0301 0409 00ff 255 <
ffff8804067b9b40 1763199869 C Ci:1:043:0 0 40 = 28034800 49004400 2d006300 6f006d00 70006c00 69006100 6e007400 20004d00
ffff8804067b9f00 1763200059 S Co:1:043:0 s 00 09 0001 0000 0000 0
ffff8804067b9f00 1763200229 C Co:1:043:0 0 0
ffff88040315f240 1763200344 S Co:1:043:0 s 21 0a 0000 0000 0000 0
ffff88040315f240 1763200477 C Co:1:043:0 0 0
ffff8803e6ff2600 1763200534 S Ci:1:043:0 s 81 06 2200 0000 0041 65 <
ffff8803e6ff2600 1763200978 C Ci:1:043:0 0 65 = 05010902 a1010901 a1000509 19012905 15002501 95057501 81029501 75038103
ffff8803e6ff2780 1763228179 S Ii:1:043:1 -115:8 4 <
ffff88025ad1f6c0 1778149079 S Ci:1:043:0 s 80 06 0100 0000 0012 18 <
ffff88025ad1f6c0 1778149371 C Ci:1:043:0 0 18 = 12011001 00000008 571d01ac 00010102 0001
ffff88025ad1f6c0 1778149404 S Ci:1:043:0 s 80 06 0200 0000 0009 9 <
ffff88025ad1f6c0 1778149617 C Ci:1:043:0 0 9 = 09022200 010100a0 32
ffff88025ad1f6c0 1778149644 S Ci:1:043:0 s 80 06 0200 0000 0022 34 <
ffff88025ad1f6c0 1778149982 C Ci:1:043:0 0 34 = 09022200 010100a0 32090400 00010301 02000921 10010001 22410007 05810308
ffff8803e6ff2780 1778150063 C Ii:1:043:1 -108:8 0
ffff88040533bf00 1778338933 S Ci:1:043:0 s 80 06 0100 0000 0040 64 <
ffff88040533bf00 1778339148 C Ci:1:043:0 0 18 = 12011001 00000008 571d01ac 00010102 0001
ffff8803876b3480 1778410932 S Ci:1:043:0 s 80 06 0100 0000 0012 18 <
ffff8803876b3480 1778411113 C Ci:1:043:0 0 18 = 12011001 00000008 571d01ac 00010102 0001
ffff8803876b3480 1778412965 S Ci:1:043:0 s 80 06 0200 0000 00ff 255 <
ffff8803876b3480 1778413266 C Ci:1:043:0 0 34 = 09022200 010100a0 32090400 00010301 02000921 10010001 22410007 05810308
ffff8803876b3480 1778414974 S Ci:1:043:0 s 80 06 0300 0000 00ff 255 <
ffff8803876b3480 1778415115 C Ci:1:043:0 0 4 = 04030904
ffff8803876b3480 1778416999 S Ci:1:043:0 s 80 06 0302 0409 00ff 255 <
ffff8803876b3480 1778417238 C Ci:1:043:0 0 40 = 28034800 49004400 2d006300 6f006d00 70006c00 69006100 6e007400 20004d00
ffff8803876b3480 1778419536 S Ci:1:043:0 s 80 06 0100 0000 0012 18 <
ffff8803876b3480 1778419738 C Ci:1:043:0 0 18 = 12011001 00000008 571d01ac 00010102 0001
ffff8803876b3480 1778421369 S Ci:1:043:0 s 80 06 0200 0000 0009 9 <
ffff8803876b3480 1778421505 C Ci:1:043:0 0 9 = 09022200 010100a0 32
ffff8803876b3480 1778426055 S Ci:1:043:0 s 80 06 0200 0000 0022 34 <
ffff8803876b3480 1778426363 C Ci:1:043:0 0 34 = 09022200 010100a0 32090400 00010301 02000921 10010001 22410007 05810308
ffff8803876b3480 1778431977 S Co:1:043:0 s 21 0a 0000 0000 0000 0
ffff8803876b3480 1778432108 C Co:1:043:0 0 0
ffff8803876b3480 1778434583 S Ci:1:043:0 s 81 06 2200 0000 0081 129 <
ffff8803876b3480 1778434996 C Ci:1:043:0 0 65 = 05010902 a1010901 a1000509 19012905 15002501 95057501 81029501 75038103
ffff8803876b3480 1778442028 S Ii:1:043:1 -115:8 4 <
ffff88040670bf00 1819677320 S Co:1:043:0 s 21 09 0300 0000 0008 8 = 55010100 00ff075d
ffff88040670bf00 1819677487 C Co:1:043:0 0 8 >
ffff880248738240 1819710392 S Ci:1:043:0 s a1 01 0300 0000 0008 8 <
ffff880248738240 1819710591 C Ci:1:043:0 0 8 = aa020000 00000000
ffff880248738f00 1819739386 S Co:1:043:0 s 21 09 0300 0000 0008 8 = 0b010101 00000e04
ffff880248738f00 1819739590 C Co:1:043:0 0 8 >
ffff8802486c5180 1819755408 S Co:1:043:0 s 21 09 0300 0000 0008 8 = d9e2baee 40d2182f
ffff8802486c5180 1819755655 C Co:1:043:0 0 8 >
ffff88040670bcc0 1819773281 S Co:1:043:0 s 21 09 0300 0000 0008 8 = 01809000 15ff17ff
ffff88040670bcc0 1819773485 C Co:1:043:0 0 8 >
ffff88040670bcc0 1819786655 S Co:1:043:0 s 21 09 0300 0000 0008 8 = 27ffe7ff d7ff97ff
ffff88040670bcc0 1819786846 C Co:1:043:0 0 8 >
ffff880248738cc0 1819803360 S Co:1:043:0 s 21 09 0300 0000 0008 8 = d7fff7ff 27ff57ff
ffff880248738cc0 1819803519 C Co:1:043:0 0 8 >
ffff880248738cc0 1819818408 S Co:1:043:0 s 21 09 0300 0000 0008 8 = f7ff87ff f7ffa7ff
ffff880248738cc0 1819818615 C Co:1:043:0 0 8 >
ffff880248738cc0 1819833502 S Co:1:043:0 s 21 09 0300 0000 0008 8 = 17fff7ff 47ffe7ff
ffff880248738cc0 1819833667 C Co:1:043:0 0 8 >
ffff880248738000 1819850125 S Co:1:043:0 s 21 09 0300 0000 0008 8 = 07ffe7ff f7ff27ff
ffff880248738000 1819850292 C Co:1:043:0 0 8 >
ffff880248738cc0 1819865127 S Co:1:043:0 s 21 09 0300 0000 0008 8 = d7ffb7ff d7ff87ff
ffff880248738cc0 1819865299 C Co:1:043:0 0 8 >
ffff880248738cc0 1819879927 S Co:1:043:0 s 21 09 0300 0000 0008 8 = c7ff17ff f7fff7ff
ffff880248738cc0 1819880110 C Co:1:043:0 0 8 >
ffff880248738000 1819895319 S Co:1:043:0 s 21 09 0300 0000 0008 8 = e7ffb7ff 37ff37ff
ffff880248738000 1819895467 C Co:1:043:0 0 8 >
ffff880402c54240 1819911112 S Co:1:043:0 s 21 09 0300 0000 0008 8 = 97ffb7ff 17fff7ff
ffff880402c54240 1819911221 C Co:1:043:0 0 8 >
ffff88040670ba80 1819926962 S Co:1:043:0 s 21 09 0300 0000 0008 8 = d7ffb7ff a7ff77ff
ffff88040670ba80 1819927102 C Co:1:043:0 0 8 >
ffff88040670ba80 1819945022 S Co:1:043:0 s 21 09 0300 0000 0008 8 = b7ff77ff f7ff27ff
ffff88040670ba80 1819945221 C Co:1:043:0 0 8 >
ffff880248738540 1819958044 S Co:1:043:0 s 21 09 0300 0000 0008 8 = a7ffe7ff 97ffd7ff
ffff880248738540 1819958221 C Co:1:043:0 0 8 >
ffff880248738540 1819974088 S Co:1:043:0 s 21 09 0300 0000 0008 8 = 67ff37ff 57ff97ff
ffff880248738540 1819974223 C Co:1:043:0 0 8 >
ffff880248738540 1819988989 S Co:1:043:0 s 21 09 0300 0000 0008 8 = 57ff07ff 57ff87ff
ffff880248738540 1819989115 C Co:1:043:0 0 8 >
ffff8802486c5e40 1820005028 S Co:1:043:0 s 21 09 0300 0000 0008 8 = 77ff17ff 67ff67ff
ffff8802486c5e40 1820005221 C Co:1:043:0 0 8 >
ffff880402c54900 1820023106 S Co:1:043:0 s 21 09 0300 0000 0008 8 = 27ff37ff 57ffb7ff
ffff880402c54900 1820023221 C Co:1:043:0 0 8 >
ffff8802487383c0 1820035971 S Co:1:043:0 s 21 09 0300 0000 0008 8 = 27ff67ff 47ffc7ff
ffff8802487383c0 1820036096 C Co:1:043:0 0 8 >
ffff8802486c5480 1820053027 S Co:1:043:0 s 21 09 0300 0000 0008 8 = 47ff07ff f7ff47ff
ffff8802486c5480 1820053220 C Co:1:043:0 0 8 >
ffff88040670ba80 1820068064 S Co:1:043:0 s 21 09 0300 0000 0008 8 = 07ff97ff b7ff17ff
ffff88040670ba80 1820068220 C Co:1:043:0 0 8 >
ffff88040670bcc0 1820082977 S Co:1:043:0 s 21 09 0300 0000 0008 8 = 57ff97ff 97ff27ff
ffff88040670bcc0 1820083095 C Co:1:043:0 0 8 >
ffff88040670bc00 1820099010 S Co:1:043:0 s 21 09 0300 0000 0008 8 = f7ff77ff 77ffa7ff
ffff88040670bc00 1820099099 C Co:1:043:0 0 8 >
ffff880402c54300 1820116054 S Co:1:043:0 s 21 09 0300 0000 0008 8 = c7ff47ff b7ffb7ff
ffff880402c54300 1820116224 C Co:1:043:0 0 8 >
ffff880402c54300 1820130956 S Co:1:043:0 s 21 09 0300 0000 0008 8 = 77ffe7ff c7fff7ff
ffff880402c54300 1820131120 C Co:1:043:0 0 8 >
ffff880402c54300 1820146049 S Co:1:043:0 s 21 09 0300 0000 0008 8 = 77ff37ff b7ff97ff
ffff880402c54300 1820146219 C Co:1:043:0 0 8 >
ffff880402c54300 1820161063 S Co:1:043:0 s 21 09 0300 0000 0008 8 = 17ff17ff f7ff87ff
ffff880402c54300 1820161227 C Co:1:043:0 0 8 >
ffff880402c54300 1820178071 S Co:1:043:0 s 21 09 0300 0000 0008 8 = 17ffa7ff 17ffe7ff
ffff880402c54300 1820178237 C Co:1:043:0 0 8 >
ffff880248738e40 1820192922 S Co:1:043:0 s 21 09 0300 0000 0008 8 = 37ff37ff b7fff7ff
ffff880248738e40 1820193094 C Co:1:043:0 0 8 >
ffff880248738e40 1820208036 S Co:1:043:0 s 21 09 0300 0000 0008 8 = f7ffa7ff 67ffd7ff
ffff880248738e40 1820208219 C Co:1:043:0 0 8 >
ffff880248738e40 1820225025 S Co:1:043:0 s 21 09 0300 0000 0008 8 = 27ffe7ff e7ffe7ff
ffff880248738e40 1820225220 C Co:1:043:0 0 8 >
ffff880248738e40 1820239970 S Co:1:043:0 s 21 09 0300 0000 0008 8 = f7ff47ff f7ff37ff
ffff880248738e40 1820240124 C Co:1:043:0 0 8 >
ffff880248738e40 1820255322 S Co:1:043:0 s 21 09 0300 0000 0008 8 = f7ffd7ff c7ff37ff
ffff880248738e40 1820255501 C Co:1:043:0 0 8 >
ffff880248738e40 1820272062 S Co:1:043:0 s 21 09 0300 0000 0008 8 = 97ff87ff 67d7d308
ffff880248738e40 1820272246 C Co:1:043:0 0 8 >
ffff880248738e40 1820286993 S Co:1:043:0 s 21 09 0300 0000 0008 8 = b99f2b6b 3a389980
ffff880248738e40 1820287119 C Co:1:043:0 0 8 >
ffff880248738e40 1820301933 S Co:1:043:0 s 21 09 0300 0000 0008 8 = 932c5fd0 03dc3bb5
ffff880248738e40 1820302113 C Co:1:043:0 0 8 >
ffff880248738e40 1820319063 S Co:1:043:0 s 21 09 0300 0000 0008 8 = 30bed1b1 35db5512
ffff880248738e40 1820319222 C Co:1:043:0 0 8 >
ffff880248738e40 1820334071 S Co:1:043:0 s 21 09 0300 0000 0008 8 = ef887dc4 8464a676
ffff880248738e40 1820334224 C Co:1:043:0 0 8 >
ffff880248738e40 1820348917 S Co:1:043:0 s 21 09 0300 0000 0008 8 = 359245f1 663891b5
ffff880248738e40 1820349095 C Co:1:043:0 0 8 >
ffff8802486c5480 1820364298 S Co:1:043:0 s 21 09 0300 0000 0008 8 = ec386fd5 962e9d15
ffff8802486c5480 1820364502 C Co:1:043:0 0 8 >
ffff880402c54300 1820381055 S Co:1:043:0 s 21 09 0300 0000 0008 8 = feaa2341 91aff7d0
ffff880402c54300 1820381248 C Co:1:043:0 0 8 >
ffff88040670bc00 1820395975 S Co:1:043:0 s 21 09 0300 0000 0008 8 = dd6cefba 1a39ed97
ffff88040670bc00 1820396121 C Co:1:043:0 0 8 >
ffff88040670bc00 1820411002 S Co:1:043:0 s 21 09 0300 0000 0008 8 = fcd545f9 b8de720b
ffff88040670bc00 1820411120 C Co:1:043:0 0 8 >
ffff88040670bc00 1820428057 S Co:1:043:0 s 21 09 0300 0000 0008 8 = 5592fa6a 35c59f43
ffff88040670bc00 1820428244 C Co:1:043:0 0 8 >
ffff88040670bc00 1820442895 S Co:1:043:0 s 21 09 0300 0000 0008 8 = e322c7ae 1fa62d4b
ffff88040670bc00 1820443115 C Co:1:043:0 0 8 >
ffff88040670bc00 1820458015 S Co:1:043:0 s 21 09 0300 0000 0008 8 = 2759ca1b 484ffea1
ffff88040670bc00 1820458099 C Co:1:043:0 0 8 >
ffff8802486c5780 1820475067 S Co:1:043:0 s 21 09 0300 0000 0008 8 = a6e0033a 482394b9
ffff8802486c5780 1820475231 C Co:1:043:0 0 8 >
ffff880402c54240 1820489807 S Co:1:043:0 s 21 09 0300 0000 0008 8 = 67b1da46 f7989778
ffff880402c54240 1820489964 C Co:1:043:0 0 8 >
ffff880402c546c0 1820506712 S Co:1:043:0 s 21 09 0300 0000 0008 8 = 779d95b1 f6b751ba
ffff880402c546c0 1820506905 C Co:1:043:0 0 8 >
ffff880402c54240 1820521754 S Co:1:043:0 s 21 09 0300 0000 0008 8 = 66c9e4a0 259e33ce
ffff880402c54240 1820521849 C Co:1:043:0 0 8 >
ffff88040670b840 1820536775 S Co:1:043:0 s 21 09 0300 0000 0008 8 = ca2a586c 2dff4ff7
ffff88040670b840 1820536991 C Co:1:043:0 0 8 >
ffff88040670b840 1820551615 S Co:1:043:0 s 21 09 0300 0000 0008 8 = b90ee521 f5a1deeb
ffff88040670b840 1820551872 C Co:1:043:0 0 8 >
ffff880248738e40 1820568746 S Co:1:043:0 s 21 09 0300 0000 0008 8 = 51956601 2fdbba56
ffff880248738e40 1820568864 C Co:1:043:0 0 8 >
ffff88040670b840 1820583775 S Co:1:043:0 s 21 09 0300 0000 0008 8 = 32321700 ca1ee355
ffff88040670b840 1820583996 C Co:1:043:0 0 8 >
ffff880402c54600 1820598711 S Co:1:043:0 s 21 09 0300 0000 0008 8 = 002d1a47 7f6afcfd
ffff880402c54600 1820598868 C Co:1:043:0 0 8 >
ffff880248738e40 1820614807 S Co:1:043:0 s 21 09 0300 0000 0008 8 = e421f5b4 47d6ccd4
ffff880248738e40 1820614985 C Co:1:043:0 0 8 >
ffff880248738e40 1820632887 S Co:1:043:0 s 21 09 0300 0000 0008 8 = 0a801056 e10bc055
ffff880248738e40 1820632975 C Co:1:043:0 0 8 >
ffff880248738f00 1820645833 S Co:1:043:0 s 21 09 0300 0000 0008 8 = 220d39f3 4fc7656f
ffff880248738f00 1820645959 C Co:1:043:0 0 8 >
ffff880248738f00 1820662816 S Co:1:043:0 s 21 09 0300 0000 0008 8 = e15f2284 575cf104
ffff880248738f00 1820662997 C Co:1:043:0 0 8 >
ffff880402c546c0 1820677850 S Co:1:043:0 s 21 09 0300 0000 0008 8 = 7f62e0b5 0430ba6c
ffff880402c546c0 1820677998 C Co:1:043:0 0 8 >
ffff880402c546c0 1820692884 S Co:1:043:0 s 21 09 0300 0000 0008 8 = 39d76c68 253dbbf1
ffff880402c546c0 1820692997 C Co:1:043:0 0 8 >
ffff880402c54300 1820709812 S Co:1:043:0 s 21 09 0300 0000 0008 8 = cfd12432 cb901353
ffff880402c54300 1820709980 C Co:1:043:0 0 8 >
ffff880402c54300 1820725383 S Co:1:043:0 s 21 09 0300 0000 0008 8 = 053949da cdcc8743
ffff880402c54300 1820725493 C Co:1:043:0 0 8 >
ffff880402c54300 1820739530 S Co:1:043:0 s 21 09 0300 0000 0008 8 = 234980df 45a7feea
ffff880402c54300 1820739746 C Co:1:043:0 0 8 >
ffff880402c54300 1820755372 S Co:1:043:0 s 21 09 0300 0000 0008 8 = 771253f0 126a0262
ffff880402c54300 1820755475 C Co:1:043:0 0 8 >
ffff880402c540c0 1820771354 S Co:1:043:0 s 21 09 0300 0000 0008 8 = d0f8af73 56724439
ffff880402c540c0 1820771498 C Co:1:043:0 0 8 >
ffff880402c54600 1820786393 S Co:1:043:0 s 21 09 0300 0000 0008 8 = 03336501 f8b317f3
ffff880402c54600 1820786474 C Co:1:043:0 0 8 >
ffff880402c54180 1820801490 S Co:1:043:0 s 21 09 0300 0000 0008 8 = 684eace7 2132f187
ffff880402c54180 1820801623 C Co:1:043:0 0 8 >
ffff8802487383c0 1820819414 S Co:1:043:0 s 21 09 0300 0000 0008 8 = 5ba99ba5 c189efde
ffff8802487383c0 1820819603 C Co:1:043:0 0 8 >
ffff8802487383c0 1820833436 S Co:1:043:0 s 21 09 0300 0000 0008 8 = bef9b271 0966505a
ffff8802487383c0 1820833603 C Co:1:043:0 0 8 >
ffff8802487383c0 1820848473 S Co:1:043:0 s 21 09 0300 0000 0008 8 = 73c450b2 f10af74b
ffff8802487383c0 1820848603 C Co:1:043:0 0 8 >
ffff8802487383c0 1820864426 S Co:1:043:0 s 21 09 0300 0000 0008 8 = e5e83c87 b1cbec79
ffff8802487383c0 1820864624 C Co:1:043:0 0 8 >
ffff8802486c5480 1820882461 S Co:1:043:0 s 21 09 0300 0000 0008 8 = 7e131e40 4a94d99f
ffff8802486c5480 1820882626 C Co:1:043:0 0 8 >
ffff88040670b6c0 1820895471 S Co:1:043:0 s 21 09 0300 0000 0008 8 = 304b04e1 fc618fec
ffff88040670b6c0 1820895603 C Co:1:043:0 0 8 >
ffff88040670ba80 1820912381 S Co:1:043:0 s 21 09 0300 0000 0008 8 = ef66e0a4 cfc68183
ffff88040670ba80 1820912478 C Co:1:043:0 0 8 >
ffff880248738480 1820927409 S Co:1:043:0 s 21 09 0300 0000 0008 8 = 33900776 0d6845fa
ffff880248738480 1820927650 C Co:1:043:0 0 8 >
ffff8802486c56c0 1820942514 S Co:1:043:0 s 21 09 0300 0000 0008 8 = 78cab377 c48119dd
ffff8802486c56c0 1820942626 C Co:1:043:0 0 8 >
ffff88040670bcc0 1820958406 S Co:1:043:0 s 21 09 0300 0000 0008 8 = bf677f7d 465e5929
ffff88040670bcc0 1820958603 C Co:1:043:0 0 8 >
ffff880248738480 1820975419 S Co:1:043:0 s 21 09 0300 0000 0008 8 = 0d8fef90 abe20bd3
ffff880248738480 1820975625 C Co:1:043:0 0 8 >
ffff880248738480 1820989443 S Co:1:043:0 s 21 09 0300 0000 0008 8 = e9bee76c 4c025641
ffff880248738480 1820989604 C Co:1:043:0 0 8 >
ffff880248738480 1821005496 S Co:1:043:0 s 21 09 0300 0000 0008 8 = e0443104 474905ce
ffff880248738480 1821005601 C Co:1:043:0 0 8 >
ffff880248738480 1821020339 S Co:1:043:0 s 21 09 0300 0000 0008 8 = 03c5fafc 00540749
ffff880248738480 1821020475 C Co:1:043:0 0 8 >
ffff880248738480 1821037432 S Co:1:043:0 s 21 09 0300 0000 0008 8 = 65b8542c 9c55ef74
ffff880248738480 1821037606 C Co:1:043:0 0 8 >
ffff880248738180 1821052477 S Co:1:043:0 s 21 09 0300 0000 0008 8 = a0eab322 86917687
ffff880248738180 1821052605 C Co:1:043:0 0 8 >
ffff880248738180 1821070404 S Co:1:043:0 s 21 09 0300 0000 0008 8 = 4ffa729f ece4f6ac
ffff880248738180 1821070627 C Co:1:043:0 0 8 >
ffff880248738180 1821083419 S Co:1:043:0 s 21 09 0300 0000 0008 8 = 93dc4d16 413aef83
ffff880248738180 1821083626 C Co:1:043:0 0 8 >
ffff880248738180 1821098579 S Co:1:043:0 s 21 09 0300 0000 0008 8 = 9059e732 bb16849d
ffff880248738180 1821098752 C Co:1:043:0 0 8 >
ffff880248738600 1821115363 S Co:1:043:0 s 21 09 0300 0000 0008 8 = ef8b434f d40dfd03
ffff880248738600 1821115503 C Co:1:043:0 0 8 >
ffff8802486c5300 1821130400 S Co:1:043:0 s 21 09 0300 0000 0008 8 = 5c644dfe cb4a44ae
ffff8802486c5300 1821130503 C Co:1:043:0 0 8 >
ffff8802486c5300 1821145397 S Co:1:043:0 s 21 09 0300 0000 0008 8 = 07265084 22096a0f
ffff8802486c5300 1821145602 C Co:1:043:0 0 8 >
ffff8802486c5300 1821162422 S Co:1:043:0 s 21 09 0300 0000 0008 8 = 26ea805a 201e2287
ffff8802486c5300 1821162603 C Co:1:043:0 0 8 >
ffff88040533b180 1821177336 S Co:1:043:0 s 21 09 0300 0000 0008 8 = 6f1b70ac 4e6e42ed
ffff88040533b180 1821177479 C Co:1:043:0 0 8 >
ffff88040533b180 1821192373 S Co:1:043:0 s 21 09 0300 0000 0008 8 = a0f99adb fc72480d
ffff88040533b180 1821192479 C Co:1:043:0 0 8 >
ffff88040533b180 1821209445 S Co:1:043:0 s 21 09 0300 0000 0008 8 = f919dcfd bbb9d025
ffff88040533b180 1821209624 C Co:1:043:0 0 8 >
ffff88040533b180 1821224325 S Co:1:043:0 s 21 09 0300 0000 0008 8 = bee2f75a e2652168
ffff88040533b180 1821224499 C Co:1:043:0 0 8 >
ffff88040533b180 1821239363 S Co:1:043:0 s 21 09 0300 0000 0008 8 = b71010ef 0bab9f7e
ffff88040533b180 1821239487 C Co:1:043:0 0 8 >
ffff88040533b180 1821256416 S Co:1:043:0 s 21 09 0300 0000 0008 8 = b23331ed 95555800
ffff88040533b180 1821256627 C Co:1:043:0 0 8 >
ffff88040533b180 1821271319 S Co:1:043:0 s 21 09 0300 0000 0008 8 = fe2ec739 23427afe
ffff88040533b180 1821271498 C Co:1:043:0 0 8 >
ffff88040533b180 1821286347 S Co:1:043:0 s 21 09 0300 0000 0008 8 = f0ba23ec 19e3d97a
ffff88040533b180 1821286502 C Co:1:043:0 0 8 >
ffff88040533b180 1821303421 S Co:1:043:0 s 21 09 0300 0000 0008 8 = 60e3fcd2 24bd6bed
ffff88040533b180 1821303624 C Co:1:043:0 0 8 >
ffff88040533b180 1821318447 S Co:1:043:0 s 21 09 0300 0000 0008 8 = 2b88eaed b1ebcdbf
ffff88040533b180 1821318622 C Co:1:043:0 0 8 >
ffff88040533b180 1821333337 S Co:1:043:0 s 21 09 0300 0000 0008 8 = b1ddeaf1 729cbed1
ffff88040533b180 1821333478 C Co:1:043:0 0 8 >
ffff88040533b180 1821349382 S Co:1:043:0 s 21 09 0300 0000 0008 8 = 56eadfc7 df8fa2f5
ffff88040533b180 1821349509 C Co:1:043:0 0 8 >
ffff88040533b180 1821364416 S Co:1:043:0 s 21 09 0300 0000 0008 8 = 020c0c0d b09cfe72
ffff88040533b180 1821364626 C Co:1:043:0 0 8 >
ffff88040533b180 1821381333 S Co:1:043:0 s 21 09 0300 0000 0008 8 = a3719d92 662c0082
ffff88040533b180 1821381498 C Co:1:043:0 0 8 >
ffff88040533b180 1821396368 S Co:1:043:0 s 21 09 0300 0000 0008 8 = a89e1edc c1bef6d6
ffff88040533b180 1821396496 C Co:1:043:0 0 8 >
ffff88040533b180 1821411403 S Co:1:043:0 s 21 09 0300 0000 0008 8 = 85ea00a4 4962d40f
ffff88040533b180 1821411624 C Co:1:043:0 0 8 >
ffff88040533b180 1821426321 S Co:1:043:0 s 21 09 0300 0000 0008 8 = 34021956 c840b045
ffff88040533b180 1821426499 C Co:1:043:0 0 8 >
ffff88040533b180 1821443369 S Co:1:043:0 s 21 09 0300 0000 0008 8 = b1662294 cc104882
ffff88040533b180 1821443496 C Co:1:043:0 0 8 >
ffff88040533b180 1821458390 S Co:1:043:0 s 21 09 0300 0000 0008 8 = 7be839b2 28a17946
ffff88040533b180 1821458501 C Co:1:043:0 0 8 >
ffff880402c54240 1821474434 S Co:1:043:0 s 21 09 0300 0000 0008 8 = 18325f3a 7255c702
ffff880402c54240 1821474620 C Co:1:043:0 0 8 >
ffff88040670bd80 1821489337 S Co:1:043:0 s 21 09 0300 0000 0008 8 = 8f3ff967 84a1d99f
ffff88040670bd80 1821489499 C Co:1:043:0 0 8 >
ffff88040670bd80 1821504476 S Co:1:043:0 s 21 09 0300 0000 0008 8 = edde51ac fd8ffcf6
ffff88040670bd80 1821504624 C Co:1:043:0 0 8 >
ffff8802487383c0 1821520473 S Co:1:043:0 s 21 09 0300 0000 0008 8 = c335142c be3d9e58
ffff8802487383c0 1821520631 C Co:1:043:0 0 8 >
ffff8802487383c0 1821536317 S Co:1:043:0 s 21 09 0300 0000 0008 8 = a53ad441 705ed306
ffff8802487383c0 1821536499 C Co:1:043:0 0 8 >
ffff880402c54780 1821551417 S Co:1:043:0 s 21 09 0300 0000 0008 8 = aa3986f7 fbb6d2b7
ffff880402c54780 1821551629 C Co:1:043:0 0 8 >
ffff880402c54a80 1821567464 S Co:1:043:0 s 21 09 0300 0000 0008 8 = f1530290 0ea07617
ffff880402c54a80 1821567630 C Co:1:043:0 0 8 >
ffff880402c54a80 1821582973 S Co:1:043:0 s 21 09 0300 0000 0008 8 = 18fb8801 9c8abf44
ffff880402c54a80 1821583105 C Co:1:043:0 0 8 >
ffff880402c54a80 1821598955 S Co:1:043:0 s 21 09 0300 0000 0008 8 = c4793771 5b755051
ffff880402c54a80 1821599125 C Co:1:043:0 0 8 >
ffff880402c54a80 1821614074 S Co:1:043:0 s 21 09 0300 0000 0008 8 = 1e6996bf 4678f1c5
ffff880402c54a80 1821614244 C Co:1:043:0 0 8 >
ffff88040670bd80 1821631998 S Co:1:043:0 s 21 09 0300 0000 0008 8 = 523b0efb 1a3c0d1c
ffff88040670bd80 1821632114 C Co:1:043:0 0 8 >
ffff88040670b480 1821645118 S Co:1:043:0 s 21 09 0300 0000 0008 8 = 11b36ce9 da803342
ffff88040670b480 1821645262 C Co:1:043:0 0 8 >
ffff88040670b480 1821662066 S Co:1:043:0 s 21 09 0300 0000 0008 8 = 0e686183 4c94961d
ffff88040670b480 1821662235 C Co:1:043:0 0 8 >
ffff8802487383c0 1821677080 S Co:1:043:0 s 21 09 0300 0000 0008 8 = 83470376 7cdf8f02
ffff8802487383c0 1821677235 C Co:1:043:0 0 8 >
ffff880248738540 1821692129 S Co:1:043:0 s 21 09 0300 0000 0008 8 = ab0f4ba2 365b193d
ffff880248738540 1821692231 C Co:1:043:0 0 8 >
ffff880402c54a80 1821709554 S Co:1:043:0 s 21 09 0300 0000 0008 8 = 46d5979c 8f16528b
ffff880402c54a80 1821709746 C Co:1:043:0 0 8 >
ffff8802487383c0 1821724618 S Co:1:043:0 s 21 09 0300 0000 0008 8 = 1b7f282e 5bb1fea1
ffff8802487383c0 1821724861 C Co:1:043:0 0 8 >
ffff8802487383c0 1821739489 S Co:1:043:0 s 21 09 0300 0000 0008 8 = 704ba4d4 b5e305a5
ffff8802487383c0 1821739633 C Co:1:043:0 0 8 >
ffff880248738e40 1821754621 S Co:1:043:0 s 21 09 0300 0000 0008 8 = 9147933f 7df5f1b2
ffff880248738e40 1821754860 C Co:1:043:0 0 8 >
ffff880402c54900 1821771581 S Co:1:043:0 s 21 09 0300 0000 0008 8 = 51d8e3d3 d3457457
ffff880402c54900 1821771738 C Co:1:043:0 0 8 >
ffff88040670b180 1821786470 S Co:1:043:0 s 21 09 0300 0000 0008 8 = 8236662b 9fc6de16
ffff88040670b180 1821786612 C Co:1:043:0 0 8 >
ffff88040670b180 1821801503 S Co:1:043:0 s 21 09 0300 0000 0008 8 = 7dec5091 0b7ca9e6
ffff88040670b180 1821801617 C Co:1:043:0 0 8 >
ffff88025ad1fe40 1821817552 S Co:1:043:0 s 21 09 0300 0000 0008 8 = 9f5bbc89 0502efb4
ffff88025ad1fe40 1821817735 C Co:1:043:0 0 8 >
ffff88025ad1fe40 1821833647 S Co:1:043:0 s 21 09 0300 0000 0008 8 = c8362745 bf06f0dc
ffff88025ad1fe40 1821833873 C Co:1:043:0 0 8 >
ffff8802486c5a80 1821848500 S Co:1:043:0 s 21 09 0300 0000 0008 8 = dc05f130 31c990b3
ffff8802486c5a80 1821848612 C Co:1:043:0 0 8 >
ffff880402c54c00 1821864531 S Co:1:043:0 s 21 09 0300 0000 0008 8 = 43a4e166 94a1d5fe
ffff880402c54c00 1821864628 C Co:1:043:0 0 8 >
ffff880402c54c00 1821879608 S Co:1:043:0 s 21 09 0300 0000 0008 8 = 6bc3a038 e6796a7a
ffff880402c54c00 1821879753 C Co:1:043:0 0 8 >
ffff880248738840 1821895481 S Co:1:043:0 s 21 09 0300 0000 0008 8 = 43653bab 6b4e2154
ffff880248738840 1821895647 C Co:1:043:0 0 8 >
ffff8802486c5a80 1821911484 S Co:1:043:0 s 21 09 0300 0000 0008 8 = c063a3f7 28b36ab0
ffff8802486c5a80 1821911610 C Co:1:043:0 0 8 >
ffff880402c54c00 1821927261 S Co:1:043:0 s 21 09 0300 0000 0008 8 = 5ae92e0a 684cdf24
ffff880402c54c00 1821927384 C Co:1:043:0 0 8 >
ffff88040670b180 1821944181 S Co:1:043:0 s 21 09 0300 0000 0008 8 = 8df61505 3954bb3c
ffff88040670b180 1821944363 C Co:1:043:0 0 8 >
ffff88025ad1fe40 1821958201 S Co:1:043:0 s 21 09 0300 0000 0008 8 = 5bdef6bc ee185cf6
ffff88025ad1fe40 1821958374 C Co:1:043:0 0 8 >
ffff88025ad1ff00 1821974251 S Co:1:043:0 s 21 09 0300 0000 0008 8 = c7c95338 9d7bc645
ffff88025ad1ff00 1821974361 C Co:1:043:0 0 8 >
ffff880248738cc0 1821989288 S Co:1:043:0 s 21 09 0300 0000 0008 8 = 59340f36 a0732190
ffff880248738cc0 1821989489 C Co:1:043:0 0 8 >
ffff8803e6fe9d80 1822005191 S Co:1:043:0 s 21 09 0300 0000 0008 8 = 9f6df5a7 16893833
ffff8803e6fe9d80 1822005384 C Co:1:043:0 0 8 >
ffff880402c54900 1822022243 S Co:1:043:0 s 21 09 0300 0000 0008 8 = a7193230 615bfafa
ffff880402c54900 1822022368 C Co:1:043:0 0 8 >
ffff8803e6fe9900 1822036833 S Co:1:043:0 s 21 09 0300 0000 0008 8 = 88b0d8a9 a71bfbab
ffff8803e6fe9900 1822036987 C Co:1:043:0 0 8 >
ffff880402c54a80 1822051736 S Co:1:043:0 s 21 09 0300 0000 0008 8 = d9fd5ca1 540ff27b
ffff880402c54a80 1822051875 C Co:1:043:0 0 8 >
ffff88040670b3c0 1822068779 S Co:1:043:0 s 21 09 0300 0000 0008 8 = 36a017d6 94113a95
ffff88040670b3c0 1822068919 C Co:1:043:0 0 8 >
ffff88040670be40 1822082823 S Co:1:043:0 s 21 09 0300 0000 0008 8 = c18ec7bf db0e5399
ffff88040670be40 1822082999 C Co:1:043:0 0 8 >
ffff880248738b40 1822098656 S Co:1:043:0 s 21 09 0300 0000 0008 8 = 9c8d0c04 5f896019
ffff880248738b40 1822098900 C Co:1:043:0 0 8 >
ffff880248738b40 1822114756 S Co:1:043:0 s 21 09 0300 0000 0008 8 = 71bbed03 9b17a91c
ffff880248738b40 1822114861 C Co:1:043:0 0 8 >
ffff880402c54a80 1822130799 S Co:1:043:0 s 21 09 0300 0000 0008 8 = ed07534b cce3199d
ffff880402c54a80 1822131010 C Co:1:043:0 0 8 >
ffff880402c54a80 1822149216 S Co:1:043:0 s 21 09 0300 0000 0008 8 = 3eb48b22 752abf0a
ffff880402c54a80 1822149361 C Co:1:043:0 0 8 >
ffff88040670be40 1822162402 S Co:1:043:0 s 21 09 0300 0000 0008 8 = 9bdbc601 ddbe4fc7
ffff88040670be40 1822162629 C Co:1:043:0 0 8 >
ffff880402c54780 1822176444 S Co:1:043:0 s 21 09 0300 0000 0008 8 = bae89a14 8d85a0ab
ffff880402c54780 1822176611 C Co:1:043:0 0 8 >
ffff88040670b000 1822192535 S Co:1:043:0 s 21 09 0300 0000 0008 8 = 591981bd d5f92e80
ffff88040670b000 1822192635 C Co:1:043:0 0 8 >
ffff8803e6fe9780 1822208428 S Co:1:043:0 s 21 09 0300 0000 0008 8 = b8045710 47a79786
ffff8803e6fe9780 1822208630 C Co:1:043:0 0 8 >
ffff8803e6fe9780 1822223469 S Co:1:043:0 s 21 09 0300 0000 0008 8 = 1c11de56 38b21fee
ffff8803e6fe9780 1822223639 C Co:1:043:0 0 8 >
ffff88040670b000 1822239524 S Co:1:043:0 s 21 09 0300 0000 0008 8 = 4cfa3b8d 444f2e61
ffff88040670b000 1822239637 C Co:1:043:0 0 8 >
ffff880248738240 1822256434 S Co:1:043:0 s 21 09 0300 0000 0008 8 = 155079e4 c849cf78
ffff880248738240 1822256636 C Co:1:043:0 0 8 >
ffff880248738b40 1822270433 S Co:1:043:0 s 21 09 0300 0000 0008 8 = c7f70341 687d3143
ffff880248738b40 1822270631 C Co:1:043:0 0 8 >
ffff880402c54600 1822287455 S Co:1:043:0 s 21 09 0300 0000 0008 8 = b7a62cbd 895d28c5
ffff880402c54600 1822287631 C Co:1:043:0 0 8 >
ffff880248738b40 1822301621 S Co:1:043:0 s 21 09 0300 0000 0008 8 = be6aa925 d56fab74
ffff880248738b40 1822301865 C Co:1:043:0 0 8 >
ffff88040670b000 1822318451 S Co:1:043:0 s 21 09 0300 0000 0008 8 = b7221379 bdcc55bc
ffff88040670b000 1822318636 C Co:1:043:0 0 8 >
ffff8803e6fe9780 1822333496 S Co:1:043:0 s 21 09 0300 0000 0008 8 = 0302676e f0a3e77b
ffff8803e6fe9780 1822333670 C Co:1:043:0 0 8 >
ffff88040670b180 1822348555 S Co:1:043:0 s 21 09 0300 0000 0008 8 = 061388ed e7b6c284
ffff88040670b180 1822348741 C Co:1:043:0 0 8 >
ffff88040670b180 1822365385 S Co:1:043:0 s 21 09 0300 0000 0008 8 = a8b0ba94 5bdb6f1f
ffff88040670b180 1822365487 C Co:1:043:0 0 8 >
ffff8803a009e000 1822380498 S Co:1:043:0 s 21 09 0300 0000 0008 8 = d7082732 cb7a1985
ffff8803a009e000 1822380618 C Co:1:043:0 0 8 >
ffff88040670b3c0 1822395513 S Co:1:043:0 s 21 09 0300 0000 0008 8 = 02a05c4e f8130f66
ffff88040670b3c0 1822395618 C Co:1:043:0 0 8 >
ffff880248738b40 1822412375 S Co:1:043:0 s 21 09 0300 0000 0008 8 = 9ed0ca9f 6bb74564
ffff880248738b40 1822412488 C Co:1:043:0 0 8 >
ffff880248738b40 1822427415 S Co:1:043:0 s 21 09 0300 0000 0008 8 = a4434793 ec8bd297
ffff880248738b40 1822427613 C Co:1:043:0 0 8 >
ffff880248738b40 1822442725 S Co:1:043:0 s 21 09 0300 0000 0008 8 = 0e7a8dca 0a4b720a
ffff880248738b40 1822442869 C Co:1:043:0 0 8 >
ffff88040670be40 1822459423 S Co:1:043:0 s 21 09 0300 0000 0008 8 = 5f48b899 98c3033a
ffff88040670be40 1822459620 C Co:1:043:0 0 8 >
ffff880248738b40 1822474452 S Co:1:043:0 s 21 09 0300 0000 0008 8 = 1a55ca8a 2c56099c
ffff880248738b40 1822474638 C Co:1:043:0 0 8 >
ffff8803e6fe9780 1822489477 S Co:1:043:0 s 21 09 0300 0000 0008 8 = 479d29d9 a0792c16
ffff8803e6fe9780 1822489616 C Co:1:043:0 0 8 >
ffff8803e6fe9780 1822506411 S Co:1:043:0 s 21 09 0300 0000 0008 8 = f4f01df6 9336b783
ffff8803e6fe9780 1822506514 C Co:1:043:0 0 8 >
ffff8803e6fe9780 1822521453 S Co:1:043:0 s 21 09 0300 0000 0008 8 = b0715508 e7ac1931
ffff8803e6fe9780 1822521619 C Co:1:043:0 0 8 >
ffff8803e6fe9780 1822536517 S Co:1:043:0 s 21 09 0300 0000 0008 8 = 10196066 438c6664
ffff8803e6fe9780 1822536639 C Co:1:043:0 0 8 >
ffff880402c54600 1822553537 S Co:1:043:0 s 21 09 0300 0000 0008 8 = 2c34361e 909bd5d3
ffff880402c54600 1822553644 C Co:1:043:0 0 8 >
ffff880402c54600 1822568437 S Co:1:043:0 s 21 09 0300 0000 0008 8 = 20e1af70 7e354228
ffff880402c54600 1822568621 C Co:1:043:0 0 8 >
ffff8803e6fe9780 1822583485 S Co:1:043:0 s 21 09 0300 0000 0008 8 = 8d940952 fec6ab82
ffff8803e6fe9780 1822583627 C Co:1:043:0 0 8 >
ffff8803e6fe9780 1822600523 S Co:1:043:0 s 21 09 0300 0000 0008 8 = 189665eb c751b5f5
ffff8803e6fe9780 1822600618 C Co:1:043:0 0 8 >
ffff880248738b40 1822615417 S Co:1:043:0 s 21 09 0300 0000 0008 8 = e881481a d4eb2606
ffff880248738b40 1822615494 C Co:1:043:0 0 8 >
ffff880248738240 1822629449 S Co:1:043:0 s 21 09 0300 0000 0008 8 = 2bc61cef e23e6a32
ffff880248738240 1822629639 C Co:1:043:0 0 8 >
ffff880248738240 1822646498 S Co:1:043:0 s 21 09 0300 0000 0008 8 = 9029ae2f f5091066
ffff880248738240 1822646618 C Co:1:043:0 0 8 >
ffff8803e6fe9780 1822661531 S Co:1:043:0 s 21 09 0300 0000 0008 8 = cb42afd2 d19c4c86
ffff8803e6fe9780 1822661618 C Co:1:043:0 0 8 >
ffff8803e6fe9780 1822677449 S Co:1:043:0 s 21 09 0300 0000 0008 8 = 16fc3686 835f75e8
ffff8803e6fe9780 1822677623 C Co:1:043:0 0 8 >
ffff8803e6fe9780 1822692512 S Co:1:043:0 s 21 09 0300 0000 0008 8 = ac173a2c d84a87d8
ffff8803e6fe9780 1822692641 C Co:1:043:0 0 8 >
ffff8803e6fe9780 1822709539 S Co:1:043:0 s 21 09 0300 0000 0008 8 = 4ea81a57 e36ca014
ffff8803e6fe9780 1822709620 C Co:1:043:0 0 8 >
ffff880248738240 1822723420 S Co:1:043:0 s 21 09 0300 0000 0008 8 = c19618d2 7967844f
ffff880248738240 1822723617 C Co:1:043:0 0 8 >
ffff880402c54600 1822740420 S Co:1:043:0 s 21 09 0300 0000 0008 8 = 4c1dd719 b6f01bb0
ffff880402c54600 1822740635 C Co:1:043:0 0 8 >
ffff880402c54600 1822754471 S Co:1:043:0 s 21 09 0300 0000 0008 8 = 3c4ce3dd 7751f052
ffff880402c54600 1822754621 C Co:1:043:0 0 8 >
ffff880402c54600 1822771408 S Co:1:043:0 s 21 09 0300 0000 0008 8 = 62892783 e0e8b3c4
ffff880402c54600 1822771502 C Co:1:043:0 0 8 >
ffff880402c54600 1822786450 S Co:1:043:0 s 21 09 0300 0000 0008 8 = 910a76a4 d6a8b688
ffff880402c54600 1822786636 C Co:1:043:0 0 8 >
ffff880248738cc0 1822802504 S Co:1:043:0 s 21 09 0300 0000 0008 8 = 225b058c 84957196
ffff880248738cc0 1822802643 C Co:1:043:0 0 8 >
ffff8803e6fe9780 1822817533 S Co:1:043:0 s 21 09 0300 0000 0008 8 = 72ddedbc d84bffd9
ffff8803e6fe9780 1822817753 C Co:1:043:0 0 8 >
ffff880402c54180 1822834397 S Co:1:043:0 s 21 09 0300 0000 0008 8 = 6143ac6a 0575a1af
ffff880402c54180 1822834509 C Co:1:043:0 0 8 >
ffff88040670be40 1822849478 S Co:1:043:0 s 21 09 0300 0000 0008 8 = d415a3fe 0158386a
ffff88040670be40 1822849667 C Co:1:043:0 0 8 >
ffff8803e6fe9780 1822864461 S Co:1:043:0 s 21 09 0300 0000 0008 8 = 32309796 0648cdd3
ffff8803e6fe9780 1822864636 C Co:1:043:0 0 8 >
ffff880402c54180 1822881387 S Co:1:043:0 s 21 09 0300 0000 0008 8 = e7423281 132f0ba4
ffff880402c54180 1822881512 C Co:1:043:0 0 8 >
ffff880402c54180 1822895407 S Co:1:043:0 s 21 09 0300 0000 0008 8 = e64f81c5 6a0bc20b
ffff880402c54180 1822895494 C Co:1:043:0 0 8 >
ffff88040670be40 1822912502 S Co:1:043:0 s 21 09 0300 0000 0008 8 = 2131759a 116f642c
ffff88040670be40 1822912621 C Co:1:043:0 0 8 >
ffff880248738cc0 1822927438 S Co:1:043:0 s 21 09 0300 0000 0008 8 = 111265ef 54ff899e
ffff880248738cc0 1822927623 C Co:1:043:0 0 8 >
ffff880248738cc0 1822942459 S Co:1:043:0 s 21 09 0300 0000 0008 8 = 33f288e2 3ff66deb
ffff880248738cc0 1822942624 C Co:1:043:0 0 8 >
ffff8803e6fe9780 1822959512 S Co:1:043:0 s 21 09 0300 0000 0008 8 = 87257e4b 26a26e12
ffff8803e6fe9780 1822959642 C Co:1:043:0 0 8 >
ffff8803e6fe9780 1822974485 S Co:1:043:0 s 21 09 0300 0000 0008 8 = 11d4c630 1fe49007
ffff8803e6fe9780 1822974618 C Co:1:043:0 0 8 >
ffff88040670be40 1822989439 S Co:1:043:0 s 21 09 0300 0000 0008 8 = 597a474f 85b3fc2f
ffff88040670be40 1822989629 C Co:1:043:0 0 8 >
ffff88040670bd80 1823004969 S Co:1:043:0 s 21 09 0300 0000 0008 8 = ed66c99a 75987be7
ffff88040670bd80 1823005151 C Co:1:043:0 0 8 >
ffff8803e6fe9780 1823022740 S Co:1:043:0 s 21 09 0300 0000 0008 8 = dc3d7bb4 5232fdfc
ffff8803e6fe9780 1823022869 C Co:1:043:0 0 8 >
ffff8803e6fe90c0 1823036693 S Co:1:043:0 s 21 09 0300 0000 0008 8 = 3b776d77 43b11632
ffff8803e6fe90c0 1823036926 C Co:1:043:0 0 8 >
ffff880402c54180 1823052746 S Co:1:043:0 s 21 09 0300 0000 0008 8 = a2df156f b15c7dbf
ffff880402c54180 1823052925 C Co:1:043:0 0 8 >
ffff880402c54180 1823067823 S Co:1:043:0 s 21 09 0300 0000 0008 8 = ae16cc5e cc0d8ecf
ffff880402c54180 1823068052 C Co:1:043:0 0 8 >
ffff880405eeb900 1823083666 S Co:1:043:0 s 21 09 0300 0000 0008 8 = 7e0f50b8 05b2c700
ffff880405eeb900 1823083892 C Co:1:043:0 0 8 >
ffff880405eeb840 1823098708 S Co:1:043:0 s 21 09 0300 0000 0008 8 = 38924126 94cc4de5
ffff880405eeb840 1823098899 C Co:1:043:0 0 8 >
ffff880405eeb900 1823114763 S Co:1:043:0 s 21 09 0300 0000 0008 8 = 84bba706 f1f26685
ffff880405eeb900 1823114904 C Co:1:043:0 0 8 >
ffff880405eeb900 1823131623 S Co:1:043:0 s 21 09 0300 0000 0008 8 = 0d7a69e7 5d4dfedb
ffff880405eeb900 1823131885 C Co:1:043:0 0 8 >
ffff880405eeb900 1823146666 S Co:1:043:0 s 21 09 0300 0000 0008 8 = 0512d510 581b2556
ffff880405eeb900 1823146908 C Co:1:043:0 0 8 >
ffff880405eeb900 1823161733 S Co:1:043:0 s 21 09 0300 0000 0008 8 = a09d1cf8 2a2e8d58
ffff880405eeb900 1823161938 C Co:1:043:0 0 8 >
ffff880405eeb900 1823176725 S Co:1:043:0 s 21 09 0300 0000 0008 8 = 9684d5cc 5d6c0eb9
ffff880405eeb900 1823176890 C Co:1:043:0 0 8 >
ffff880405eeb900 1823193689 S Co:1:043:0 s 21 09 0300 0000 0008 8 = a30978ee 3f4f2443
ffff880405eeb900 1823193897 C Co:1:043:0 0 8 >
ffff880248738f00 1823208738 S Co:1:043:0 s 21 09 0300 0000 0008 8 = 08c0e273 63656d36
ffff880248738f00 1823208922 C Co:1:043:0 0 8 >
ffff880248738f00 1823223791 S Co:1:043:0 s 21 09 0300 0000 0008 8 = 0a0fd5a2 1ecf2ec4
ffff880248738f00 1823223898 C Co:1:043:0 0 8 >
ffff880402c54180 1823240688 S Co:1:043:0 s 21 09 0300 0000 0008 8 = 70b4777a 0cc4cd94
ffff880402c54180 1823240894 C Co:1:043:0 0 8 >
ffff880405eeb900 1823255666 S Co:1:043:0 s 21 09 0300 0000 0008 8 = 073dd12b 8b0d5640
ffff880405eeb900 1823255870 C Co:1:043:0 0 8 >
ffff880405eeb900 1823271762 S Co:1:043:0 s 21 09 0300 0000 0008 8 = 208f4f99 3d88f8d9
ffff880405eeb900 1823271884 C Co:1:043:0 0 8 >
ffff880405eeb900 1823286663 S Co:1:043:0 s 21 09 0300 0000 0008 8 = 0e6144de 88a78860
ffff880405eeb900 1823286876 C Co:1:043:0 0 8 >
ffff880405eeb900 1823303720 S Co:1:043:0 s 21 09 0300 0000 0008 8 = abc165c7 17f0fb4c
ffff880405eeb900 1823303874 C Co:1:043:0 0 8 >
ffff880248738f00 1823318761 S Co:1:043:0 s 21 09 0300 0000 0008 8 = d28c4c54 587ded09
ffff880248738f00 1823318900 C Co:1:043:0 0 8 >
ffff880402c54180 1823333790 S Co:1:043:0 s 21 09 0300 0000 0008 8 = e4f8f43b fe7b1f76
ffff880402c54180 1823334023 C Co:1:043:0 0 8 >
ffff880248738f00 1823348763 S Co:1:043:0 s 21 09 0300 0000 0008 8 = 460c4164 7fadf364
ffff880248738f00 1823348876 C Co:1:043:0 0 8 >
ffff880248738f00 1823365758 S Co:1:043:0 s 21 09 0300 0000 0008 8 = df23786b 95e9f01c
ffff880248738f00 1823365901 C Co:1:043:0 0 8 >
ffff8803e6fe90c0 1823380786 S Co:1:043:0 s 21 09 0300 0000 0008 8 = 9c6fc123 bf9842d7
ffff8803e6fe90c0 1823380904 C Co:1:043:0 0 8 >
ffff880402c54180 1823395638 S Co:1:043:0 s 21 09 0300 0000 0008 8 = ed73aa10 bf383845
ffff880402c54180 1823395892 C Co:1:043:0 0 8 >
ffff8803e6fe90c0 1823412738 S Co:1:043:0 s 21 09 0300 0000 0008 8 = 4786a4ea 1cdbc709
ffff8803e6fe90c0 1823412876 C Co:1:043:0 0 8 >
ffff8803e6fe90c0 1823426745 S Co:1:043:0 s 21 09 0300 0000 0008 8 = a354861f 9fa70439
ffff8803e6fe90c0 1823426881 C Co:1:043:0 0 8 >
ffff88025ad1ff00 1823442753 S Co:1:043:0 s 21 09 0300 0000 0008 8 = fc5e084f d856ace1
ffff88025ad1ff00 1823442874 C Co:1:043:0 0 8 >
ffff88025ad1ff00 1823457727 S Co:1:043:0 s 21 09 0300 0000 0008 8 = d37747d0 98b59d7f
ffff88025ad1ff00 1823457872 C Co:1:043:0 0 8 >
ffff88025ad1ff00 1823473756 S Co:1:043:0 s 21 09 0300 0000 0008 8 = ac47462a 76275c86
ffff88025ad1ff00 1823473876 C Co:1:043:0 0 8 >
ffff88025ad1ff00 1823488923 S Co:1:043:0 s 21 09 0300 0000 0008 8 = 90cb689a 4d218fdd
ffff88025ad1ff00 1823489029 C Co:1:043:0 0 8 >
ffff88025ad1ff00 1823505722 S Co:1:043:0 s 21 09 0300 0000 0008 8 = 8ad1f991 baae825f
ffff88025ad1ff00 1823505887 C Co:1:043:0 0 8 >
ffff88025ad1ff00 1823520743 S Co:1:043:0 s 21 09 0300 0000 0008 8 = 2d7da534 a0eba55b
ffff88025ad1ff00 1823520896 C Co:1:043:0 0 8 >
ffff88025ad1ff00 1823536120 S Co:1:043:0 s 21 09 0300 0000 0008 8 = 0bc9fddb a68a0a13
ffff88025ad1ff00 1823536256 C Co:1:043:0 0 8 >
ffff880402c54300 1823551679 S Co:1:043:0 s 21 09 0300 0000 0008 8 = 3dfff794 b651e93f
ffff880402c54300 1823551901 C Co:1:043:0 0 8 >
ffff880402c54300 1823568744 S Co:1:043:0 s 21 09 0300 0000 0008 8 = e03f6ca0 7e9a1e89
ffff880402c54300 1823568879 C Co:1:043:0 0 8 >
ffff880405eeb900 1823582815 S Co:1:043:0 s 21 09 0300 0000 0008 8 = 93fe9af2 f0d2a711
ffff880405eeb900 1823583003 C Co:1:043:0 0 8 >
ffff880248738f00 1823599673 S Co:1:043:0 s 21 09 0300 0000 0008 8 = fc82a2b6 c4fc29e9
ffff880248738f00 1823599909 C Co:1:043:0 0 8 >
ffff880248738f00 1823614707 S Co:1:043:0 s 21 09 0300 0000 0008 8 = 43690ac6 f22d6a97
ffff880248738f00 1823614902 C Co:1:043:0 0 8 >
ffff8803e6fe90c0 1823630742 S Co:1:043:0 s 21 09 0300 0000 0008 8 = 93213a34 3b10d798
ffff8803e6fe90c0 1823630893 C Co:1:043:0 0 8 >
ffff880402c54300 1823645791 S Co:1:043:0 s 21 09 0300 0000 0008 8 = 9e7000c5 a062fdd9
ffff880402c54300 1823645874 C Co:1:043:0 0 8 >
ffff880248738f00 1823661702 S Co:1:043:0 s 21 09 0300 0000 0008 8 = 18eb0e71 e774123f
ffff880248738f00 1823661898 C Co:1:043:0 0 8 >
ffff8803e6fe90c0 1823676833 S Co:1:043:0 s 21 09 0300 0000 0008 8 = 398178e7 1bae6b1e
ffff8803e6fe90c0 1823677035 C Co:1:043:0 0 8 >
ffff8803e6fe9000 1823692781 S Co:1:043:0 s 21 09 0300 0000 0008 8 = 3eef3905 0a0905c3
ffff8803e6fe9000 1823692880 C Co:1:043:0 0 8 >
ffff8803e6fe9000 1823708674 S Co:1:043:0 s 21 09 0300 0000 0008 8 = e64bae62 c792feec
ffff8803e6fe9000 1823708883 C Co:1:043:0 0 8 >
ffff8803e6fe9780 1823723663 S Co:1:043:0 s 21 09 0300 0000 0008 8 = f77c17c6 27ec1b4d
ffff8803e6fe9780 1823723882 C Co:1:043:0 0 8 >
ffff880405eeb900 1823755682 S Co:1:043:0 s 21 09 0300 0000 0008 8 = 550390a1 3937f901
ffff880405eeb900 1823755905 C Co:1:043:0 0 8 >
ffff880405eeb240 1823787764 S Ci:1:043:0 s a1 01 0300 0000 0008 8 <
ffff880405eeb240 1823787901 C Ci:1:043:0 0 8 = aa040000 00000000
ffff8803fab63540 1833473694 S Co:1:043:0 s 21 09 0300 0000 0008 8 = 55010100 00ff075d
ffff8803fab63540 1833473994 C Co:1:043:0 0 8 >
ffff8803fab63480 1833506506 S Ci:1:043:0 s a1 01 0300 0000 0008 8 <
ffff8803fab63480 1833506714 C Ci:1:043:0 0 8 = aa020000 00000000
ffff8803a00d6240 1833536389 S Co:1:043:0 s 21 09 0300 0000 0008 8 = 0b040100 0000101e
ffff8803a00d6240 1833536595 C Co:1:043:0 0 8 >
ffff8803a00d6240 1833552440 S Co:1:043:0 s 21 09 0300 0000 0008 8 = 6b435ab0 117aa8ac
ffff8803a00d6240 1833552605 C Co:1:043:0 0 8 >
ffff8803a00d6240 1833568486 S Co:1:043:0 s 21 09 0300 0000 0008 8 = ffffff01 02ffffff
ffff8803a00d6240 1833568729 C Co:1:043:0 0 8 >
ffff880402c54780 1833583366 S Co:1:043:0 s 21 09 0300 0000 0008 8 = ffffffff ffffffff
ffff880402c54780 1833583460 C Co:1:043:0 0 8 >
ffff880402c54780 1833598752 S Co:1:043:0 s 21 09 0300 0000 0008 8 = ffffffff ffffffff
ffff880402c54780 1833598981 C Co:1:043:0 0 8 >
ffff880402c54600 1833615105 S Co:1:043:0 s 21 09 0300 0000 0008 8 = ffffffff ffffffff
ffff880402c54600 1833615212 C Co:1:043:0 0 8 >
ffff8803fab63480 1833630592 S Co:1:043:0 s 21 09 0300 0000 0008 8 = 80ffffff ffffffff
ffff8803fab63480 1833630732 C Co:1:043:0 0 8 >
ffff88020f097900 1833645497 S Co:1:043:0 s 21 09 0300 0000 0008 8 = ffffffff ffffffff
ffff88020f097900 1833645590 C Co:1:043:0 0 8 >
ffff8804077d1000 1833661498 S Co:1:043:0 s 21 09 0300 0000 0008 8 = ffffffff ffffffff
ffff8804077d1000 1833661587 C Co:1:043:0 0 8 >
ffff880402c54a80 1833676557 S Co:1:043:0 s 21 09 0300 0000 0008 8 = f7fff7f7 fff7f7ff
ffff880402c54a80 1833676711 C Co:1:043:0 0 8 >
ffff880402c54300 1833694406 S Co:1:043:0 s 21 09 0300 0000 0008 8 = f7f7fff7 f7fff7f7
ffff880402c54300 1833694604 C Co:1:043:0 0 8 >
ffff880402c54900 1833707683 S Co:1:043:0 s 21 09 0300 0000 0008 8 = fff7f7ff f7f7fff7
ffff880402c54900 1833707853 C Co:1:043:0 0 8 >
ffff880402c54a80 1833724483 S Co:1:043:0 s 21 09 0300 0000 0008 8 = f7fff7f7 fff7f7ff
ffff880402c54a80 1833724586 C Co:1:043:0 0 8 >
ffff8804077d1f00 1833740419 S Co:1:043:0 s 21 09 0300 0000 0008 8 = f7f7fff7 f7fff7f7
ffff8804077d1f00 1833740615 C Co:1:043:0 0 8 >
ffff8803fab63480 1833755412 S Co:1:043:0 s 21 09 0300 0000 0008 8 = fff7f7ff f7f7fff7
ffff8803fab63480 1833755604 C Co:1:043:0 0 8 >
ffff88020f097600 1833770542 S Co:1:043:0 s 21 09 0300 0000 0008 8 = f7fff7f7 fff7f7ff
ffff88020f097600 1833770713 C Co:1:043:0 0 8 >
ffff8804077d1d80 1833786417 S Co:1:043:0 s 21 09 0300 0000 0008 8 = f7f7fff7 f7fff7f7
ffff8804077d1d80 1833786591 C Co:1:043:0 0 8 >
ffff8803fab63e40 1833801404 S Co:1:043:0 s 21 09 0300 0000 0008 8 = fff7f7ff f7f7fff7
ffff8803fab63e40 1833801586 C Co:1:043:0 0 8 >
ffff8804077d1d80 1833817433 S Co:1:043:0 s 21 09 0300 0000 0008 8 = f7fff7f7 fff7f7ff
ffff8804077d1d80 1833817586 C Co:1:043:0 0 8 >
ffff8803e6e446c0 1833835472 S Co:1:043:0 s 21 09 0300 0000 0008 8 = f7f7fff7 f7fff7f7
ffff8803e6e446c0 1833835586 C Co:1:043:0 0 8 >
ffff880402c54780 1833848402 S Co:1:043:0 s 21 09 0300 0000 0008 8 = fff7f7ff f7f7fff7
ffff880402c54780 1833848606 C Co:1:043:0 0 8 >
ffff880402c54780 1833864477 S Co:1:043:0 s 21 09 0300 0000 0008 8 = f7fff7f7 fff7f7ff
ffff880402c54780 1833864612 C Co:1:043:0 0 8 >
ffff880402c54780 1833880521 S Co:1:043:0 s 21 09 0300 0000 0008 8 = f7f7fff7 f7fff7f7
ffff880402c54780 1833880750 C Co:1:043:0 0 8 >
ffff88020f097300 1833895420 S Co:1:043:0 s 21 09 0300 0000 0008 8 = fff7f7ff f7f7fff7
ffff88020f097300 1833895611 C Co:1:043:0 0 8 >
ffff88020f097300 1833913498 S Co:1:043:0 s 21 09 0300 0000 0008 8 = f7fff7f7 fff7f7ff
ffff88020f097300 1833913610 C Co:1:043:0 0 8 >
ffff8803fab63900 1833926580 S Co:1:043:0 s 21 09 0300 0000 0008 8 = f7f7fff7 f7fff7f7
ffff8803fab63900 1833926736 C Co:1:043:0 0 8 >
ffff88020f097300 1833943421 S Co:1:043:0 s 21 09 0300 0000 0008 8 = fff7f7ff f7f7fff7
ffff88020f097300 1833943591 C Co:1:043:0 0 8 >
ffff88020f097300 1833958423 S Co:1:043:0 s 21 09 0300 0000 0008 8 = f7fff7f7 fff7f7ff
ffff88020f097300 1833958605 C Co:1:043:0 0 8 >
ffff8803e6e44480 1833973434 S Co:1:043:0 s 21 09 0300 0000 0008 8 = f7f7fff7 f7fff7f7
ffff8803e6e44480 1833973612 C Co:1:043:0 0 8 >
ffff8803e6e44f00 1833990557 S Co:1:043:0 s 21 09 0300 0000 0008 8 = fff7f7ff f7f7fff7
ffff8803e6e44f00 1833990738 C Co:1:043:0 0 8 >
ffff8803e6e44240 1834005460 S Co:1:043:0 s 21 09 0300 0000 0008 8 = f7fff7f7 fff7f7ff
ffff8803e6e44240 1834005609 C Co:1:043:0 0 8 >
ffff8803e6e44240 1834020530 S Co:1:043:0 s 21 09 0300 0000 0008 8 = f7f7fff7 f7fff7f7
ffff8803e6e44240 1834020718 C Co:1:043:0 0 8 >
ffff8803e6e44240 1834036532 S Co:1:043:0 s 21 09 0300 0000 0008 8 = fff7f7ff f7f7fff7
ffff8803e6e44240 1834036717 C Co:1:043:0 0 8 >
ffff8803e6e44240 1834054504 S Co:1:043:0 s 21 09 0300 0000 0008 8 = 322da2cc 9e89ed36
ffff8803e6e44240 1834054619 C Co:1:043:0 0 8 >
ffff8803e6e44240 1834067594 S Co:1:043:0 s 21 09 0300 0000 0008 8 = 83bf5bbb 9a1db511
ffff8803e6e44240 1834067739 C Co:1:043:0 0 8 >
ffff8803e6e44f00 1834084469 S Co:1:043:0 s 21 09 0300 0000 0008 8 = 9070ca4f b798b8aa
ffff8803e6e44f00 1834084589 C Co:1:043:0 0 8 >
ffff8803e6e44f00 1834099365 S Co:1:043:0 s 21 09 0300 0000 0008 8 = ed6d7a6f cdd2b240
ffff8803e6e44f00 1834099464 C Co:1:043:0 0 8 >
ffff8803e6e44f00 1834114398 S Co:1:043:0 s 21 09 0300 0000 0008 8 = 1518b992 5896e467
ffff8803e6e44f00 1834114589 C Co:1:043:0 0 8 >
ffff8803e6e44f00 1834131498 S Co:1:043:0 s 21 09 0300 0000 0008 8 = e4861949 f6219388
ffff8803e6e44f00 1834131600 C Co:1:043:0 0 8 >
ffff8803e6e44f00 1834146438 S Co:1:043:0 s 21 09 0300 0000 0008 8 = 1dfef2b4 eca8865d
ffff8803e6e44f00 1834146598 C Co:1:043:0 0 8 >
ffff8803e6e44f00 1834161451 S Co:1:043:0 s 21 09 0300 0000 0008 8 = e47fdd0a a0d18b77
ffff8803e6e44f00 1834161595 C Co:1:043:0 0 8 >
ffff8803e6e44f00 1834178505 S Co:1:043:0 s 21 09 0300 0000 0008 8 = 42393914 1e37f0ba
ffff8803e6e44f00 1834178617 C Co:1:043:0 0 8 >
ffff8803e6e44f00 1834193535 S Co:1:043:0 s 21 09 0300 0000 0008 8 = a610a7b0 95e80cde
ffff8803e6e44f00 1834193719 C Co:1:043:0 0 8 >
ffff8803fab630c0 1834208443 S Co:1:043:0 s 21 09 0300 0000 0008 8 = 601e9050 dae8b5ee
ffff8803fab630c0 1834208594 C Co:1:043:0 0 8 >
ffff8803fab630c0 1834223471 S Co:1:043:0 s 21 09 0300 0000 0008 8 = 26309c7a e2aec9cb
ffff8803fab630c0 1834223590 C Co:1:043:0 0 8 >
ffff880402c54c00 1834240469 S Co:1:043:0 s 21 09 0300 0000 0008 8 = 91463a48 49a4a9a7
ffff880402c54c00 1834240591 C Co:1:043:0 0 8 >
ffff88020f097240 1834255407 S Co:1:043:0 s 21 09 0300 0000 0008 8 = 9f161de7 d0a9b78c
ffff88020f097240 1834255600 C Co:1:043:0 0 8 >
ffff8804077d1cc0 1834272423 S Co:1:043:0 s 21 09 0300 0000 0008 8 = 3187bb1b d991ddd5
ffff8804077d1cc0 1834272610 C Co:1:043:0 0 8 >
ffff8803fab630c0 1834287536 S Co:1:043:0 s 21 09 0300 0000 0008 8 = 8c38ceb7 eba107b2
ffff8803fab630c0 1834287720 C Co:1:043:0 0 8 >
ffff8803fab630c0 1834302406 S Co:1:043:0 s 21 09 0300 0000 0008 8 = daf9d527 3215a5a6
ffff8803fab630c0 1834302595 C Co:1:043:0 0 8 >
ffff880402c54900 1834317450 S Co:1:043:0 s 21 09 0300 0000 0008 8 = a84f92e8 fd9c2d0a
ffff880402c54900 1834317604 C Co:1:043:0 0 8 >
ffff880402c54900 1834334499 S Co:1:043:0 s 21 09 0300 0000 0008 8 = 68f28c0c 41d9958a
ffff880402c54900 1834334615 C Co:1:043:0 0 8 >
ffff880402c54900 1834349573 S Co:1:043:0 s 21 09 0300 0000 0008 8 = ee508cb9 13e2dba5
ffff880402c54900 1834349719 C Co:1:043:0 0 8 >
ffff8803fab630c0 1834364385 S Co:1:043:0 s 21 09 0300 0000 0008 8 = f50922a9 30c37f2f
ffff8803fab630c0 1834364596 C Co:1:043:0 0 8 >
ffff8803a00d6240 1834381441 S Co:1:043:0 s 21 09 0300 0000 0008 8 = 9a731fa9 76fa05d0
ffff8803a00d6240 1834381596 C Co:1:043:0 0 8 >
ffff8803a00d6240 1834396481 S Co:1:043:0 s 21 09 0300 0000 0008 8 = dd161a1c 6afa7684
ffff8803a00d6240 1834396594 C Co:1:043:0 0 8 >
ffff8804077d16c0 1834411404 S Co:1:043:0 s 21 09 0300 0000 0008 8 = 252fed78 b2aade1b
ffff8804077d16c0 1834411598 C Co:1:043:0 0 8 >
ffff8804077d16c0 1834428464 S Co:1:043:0 s 21 09 0300 0000 0008 8 = ba2f38c5 9ae5cdb9
ffff8804077d16c0 1834428595 C Co:1:043:0 0 8 >
ffff8804077d16c0 1834443540 S Co:1:043:0 s 21 09 0300 0000 0008 8 = 4b3adb23 92fad855
ffff8804077d16c0 1834443722 C Co:1:043:0 0 8 >
ffff880402c54c00 1834458350 S Co:1:043:0 s 21 09 0300 0000 0008 8 = 68ab7e43 ac2b173c
ffff880402c54c00 1834458467 C Co:1:043:0 0 8 >
ffff880402c54c00 1834475485 S Co:1:043:0 s 21 09 0300 0000 0008 8 = 078d0beb 2030a78e
ffff880402c54c00 1834475621 C Co:1:043:0 0 8 >
ffff880402c546c0 1834490509 S Co:1:043:0 s 21 09 0300 0000 0008 8 = 02212f75 cab428bd
ffff880402c546c0 1834490617 C Co:1:043:0 0 8 >
ffff880402c546c0 1834505531 S Co:1:043:0 s 21 09 0300 0000 0008 8 = 955ddf4e a8d43d13
ffff880402c546c0 1834505718 C Co:1:043:0 0 8 >
ffff8803fab63540 1834520398 S Co:1:043:0 s 21 09 0300 0000 0008 8 = e269cf79 5fa5112a
ffff8803fab63540 1834520593 C Co:1:043:0 0 8 >
ffff8804077d1d80 1834536425 S Co:1:043:0 s 21 09 0300 0000 0008 8 = 6e23fb0b b5adcf74
ffff8804077d1d80 1834536611 C Co:1:043:0 0 8 >
ffff8803a009ee40 1834552469 S Co:1:043:0 s 21 09 0300 0000 0008 8 = a39a21af 176627b3
ffff8803a009ee40 1834552618 C Co:1:043:0 0 8 >
ffff8804077d1600 1834567418 S Co:1:043:0 s 21 09 0300 0000 0008 8 = 4e944222 12c1cd80
ffff8804077d1600 1834567623 C Co:1:043:0 0 8 >
ffff88020f097000 1834585469 S Co:1:043:0 s 21 09 0300 0000 0008 8 = 210926b5 db9ffbc6
ffff88020f097000 1834585643 C Co:1:043:0 0 8 >
ffff88020f097000 1834599509 S Co:1:043:0 s 21 09 0300 0000 0008 8 = 31a7d7d0 ca57ed46
ffff88020f097000 1834599611 C Co:1:043:0 0 8 >
ffff88020f097000 1834614417 S Co:1:043:0 s 21 09 0300 0000 0008 8 = 764f246c d9356213
ffff88020f097000 1834614605 C Co:1:043:0 0 8 >
ffff88020f097000 1834631415 S Co:1:043:0 s 21 09 0300 0000 0008 8 = 50951d96 27f82015
ffff88020f097000 1834631612 C Co:1:043:0 0 8 >
ffff8804077d1600 1834646466 S Co:1:043:0 s 21 09 0300 0000 0008 8 = fe429bf1 79516e88
ffff8804077d1600 1834646593 C Co:1:043:0 0 8 >
ffff8804077d1cc0 1834661536 S Co:1:043:0 s 21 09 0300 0000 0008 8 = 27d4b732 b5689a7c
ffff8804077d1cc0 1834661745 C Co:1:043:0 0 8 >
ffff8803fab63300 1834677406 S Co:1:043:0 s 21 09 0300 0000 0008 8 = 54fa50a4 67597355
ffff8803fab63300 1834677594 C Co:1:043:0 0 8 >
ffff8803fab63d80 1834692794 S Co:1:043:0 s 21 09 0300 0000 0008 8 = 721a88a3 3fb1cd4a
ffff8803fab63d80 1834692996 C Co:1:043:0 0 8 >
ffff880402c54240 1834708589 S Co:1:043:0 s 21 09 0300 0000 0008 8 = 52cd4523 8ff402e8
ffff880402c54240 1834708740 C Co:1:043:0 0 8 >
ffff880402c54240 1834724381 S Co:1:043:0 s 21 09 0300 0000 0008 8 = 2a5fb229 d0186d8e
ffff880402c54240 1834724470 C Co:1:043:0 0 8 >
ffff8804077d1000 1834739446 S Co:1:043:0 s 21 09 0300 0000 0008 8 = 1352be4e 1b08eff0
ffff8804077d1000 1834739599 C Co:1:043:0 0 8 >
ffff880402c54240 1834755519 S Co:1:043:0 s 21 09 0300 0000 0008 8 = 8bda9a41 b2246d96
ffff880402c54240 1834755661 C Co:1:043:0 0 8 >
ffff8804077d1f00 1834773436 S Co:1:043:0 s 21 09 0300 0000 0008 8 = f4603d44 77be4e5d
ffff8804077d1f00 1834773598 C Co:1:043:0 0 8 >
ffff88020f097600 1834786462 S Co:1:043:0 s 21 09 0300 0000 0008 8 = 1102e1ac 719dfff3
ffff88020f097600 1834786598 C Co:1:043:0 0 8 >
ffff88020f0970c0 1834803511 S Co:1:043:0 s 21 09 0300 0000 0008 8 = 8d0f8564 4c7c715d
ffff88020f0970c0 1834803622 C Co:1:043:0 0 8 >
ffff88020f097600 1834818559 S Co:1:043:0 s 21 09 0300 0000 0008 8 = 758e6c68 d88a9773
ffff88020f097600 1834818725 C Co:1:043:0 0 8 >
ffff880402c54300 1834833458 S Co:1:043:0 s 21 09 0300 0000 0008 8 = bbb59a4c 87eaeb60
ffff880402c54300 1834833601 C Co:1:043:0 0 8 >
ffff88020f0970c0 1834850510 S Co:1:043:0 s 21 09 0300 0000 0008 8 = b4745cb5 f231e825
ffff88020f0970c0 1834850722 C Co:1:043:0 0 8 >
ffff88020f097600 1834865550 S Co:1:043:0 s 21 09 0300 0000 0008 8 = 99eabedc 53ed8f14
ffff88020f097600 1834865745 C Co:1:043:0 0 8 >
ffff88020f097600 1834879685 S Co:1:043:0 s 21 09 0300 0000 0008 8 = 07ec1510 091ae457
ffff88020f097600 1834879871 C Co:1:043:0 0 8 >
ffff88020f097600 1834895476 S Co:1:043:0 s 21 09 0300 0000 0008 8 = 81847533 19ad7069
ffff88020f097600 1834895624 C Co:1:043:0 0 8 >
ffff88020f097600 1834911525 S Co:1:043:0 s 21 09 0300 0000 0008 8 = eb6d3a3a a90cbf9a
ffff88020f097600 1834911724 C Co:1:043:0 0 8 >
ffff8804077d1f00 1834926390 S Co:1:043:0 s 21 09 0300 0000 0008 8 = 0e9a81af 8691e18d
ffff8804077d1f00 1834926474 C Co:1:043:0 0 8 >
ffff8804077d1f00 1834942456 S Co:1:043:0 s 21 09 0300 0000 0008 8 = 19aeae31 9d0decbb
ffff8804077d1f00 1834942600 C Co:1:043:0 0 8 >
ffff8803fab63300 1834958447 S Co:1:043:0 s 21 09 0300 0000 0008 8 = 1d83e5f0 844176f0
ffff8803fab63300 1834958596 C Co:1:043:0 0 8 >
ffff880402c54180 1834973536 S Co:1:043:0 s 21 09 0300 0000 0008 8 = 8ea69334 f0641dcb
ffff880402c54180 1834973745 C Co:1:043:0 0 8 >
ffff88020f097600 1834989452 S Co:1:043:0 s 21 09 0300 0000 0008 8 = c6d7e5d5 3ea20040
ffff88020f097600 1834989621 C Co:1:043:0 0 8 >
ffff88020f097900 1835007524 S Co:1:043:0 s 21 09 0300 0000 0008 8 = 838c4ec2 ed994517
ffff88020f097900 1835007746 C Co:1:043:0 0 8 >
ffff8804077d1cc0 1835020573 S Co:1:043:0 s 21 09 0300 0000 0008 8 = 666c037c 1fdd946c
ffff8804077d1cc0 1835020747 C Co:1:043:0 0 8 >
ffff8804077d1cc0 1835037446 S Co:1:043:0 s 21 09 0300 0000 0008 8 = 75d6809a 1e73992f
ffff8804077d1cc0 1835037600 C Co:1:043:0 0 8 >
ffff8803fab63300 1835052420 S Co:1:043:0 s 21 09 0300 0000 0008 8 = 985a0346 d35884a4
ffff8803fab63300 1835052597 C Co:1:043:0 0 8 >
ffff8804077d1600 1835068539 S Co:1:043:0 s 21 09 0300 0000 0008 8 = 1d3c0ebc 4ff98ae3
ffff8804077d1600 1835068729 C Co:1:043:0 0 8 >
ffff8804077d16c0 1835084439 S Co:1:043:0 s 21 09 0300 0000 0008 8 = 36f7e7d0 44b96357
ffff8804077d16c0 1835084601 C Co:1:043:0 0 8 >
ffff8804077d16c0 1835098413 S Co:1:043:0 s 21 09 0300 0000 0008 8 = 78b61966 8b70cc40
ffff8804077d16c0 1835098597 C Co:1:043:0 0 8 >
ffff8804077d16c0 1835114502 S Co:1:043:0 s 21 09 0300 0000 0008 8 = 5cdaf2f9 9ee90433
ffff8804077d16c0 1835114622 C Co:1:043:0 0 8 >
ffff8804077d16c0 1835130550 S Co:1:043:0 s 21 09 0300 0000 0008 8 = c0780517 1c625196
ffff8804077d16c0 1835130748 C Co:1:043:0 0 8 >
ffff8804077d16c0 1835145449 S Co:1:043:0 s 21 09 0300 0000 0008 8 = 64daa8e1 4a0e7b27
ffff8804077d16c0 1835145623 C Co:1:043:0 0 8 >
ffff880402c54600 1835162523 S Co:1:043:0 s 21 09 0300 0000 0008 8 = 6ffc758e 8f944d74
ffff880402c54600 1835162748 C Co:1:043:0 0 8 >
ffff88020f097900 1835176579 S Co:1:043:0 s 21 09 0300 0000 0008 8 = ea0fcbe7 f58f1963
ffff88020f097900 1835176725 C Co:1:043:0 0 8 >
ffff8804077d16c0 1835192376 S Co:1:043:0 s 21 09 0300 0000 0008 8 = 42f84ccb ad0e33aa
ffff8804077d16c0 1835192473 C Co:1:043:0 0 8 >
ffff88020f097900 1835209502 S Co:1:043:0 s 21 09 0300 0000 0008 8 = c8cf5faa 89137355
ffff88020f097900 1835209630 C Co:1:043:0 0 8 >
ffff8804077d1600 1835224560 S Co:1:043:0 s 21 09 0300 0000 0008 8 = 3262ad0c 8216b545
ffff8804077d1600 1835224726 C Co:1:043:0 0 8 >
ffff8804077d1600 1835239361 S Co:1:043:0 s 21 09 0300 0000 0008 8 = 1ab2a609 31815aad
ffff8804077d1600 1835239475 C Co:1:043:0 0 8 >
ffff8803fab63540 1835256487 S Co:1:043:0 s 21 09 0300 0000 0008 8 = 7c72fbcf 5834c795
ffff8803fab63540 1835256604 C Co:1:043:0 0 8 >
ffff8803fab63540 1835274443 S Co:1:043:0 s 21 09 0300 0000 0008 8 = 3a8d2322 5900e359
ffff8803fab63540 1835274604 C Co:1:043:0 0 8 >
ffff88020f0979c0 1835287453 S Co:1:043:0 s 21 09 0300 0000 0008 8 = 9aa0d9d6 bc2e9c29
ffff88020f0979c0 1835287624 C Co:1:043:0 0 8 >
ffff88020f0979c0 1835301509 S Co:1:043:0 s 21 09 0300 0000 0008 8 = c47a9a55 abf86088
ffff88020f0979c0 1835301623 C Co:1:043:0 0 8 >
ffff88020f0979c0 1835318532 S Co:1:043:0 s 21 09 0300 0000 0008 8 = 46a0291d 770ca6d0
ffff88020f0979c0 1835318750 C Co:1:043:0 0 8 >
ffff8804077d1600 1835333572 S Co:1:043:0 s 21 09 0300 0000 0008 8 = 92cd0d40 120e64aa
ffff8804077d1600 1835333730 C Co:1:043:0 0 8 >
ffff8804077d1600 1835348555 S Co:1:043:0 s 21 09 0300 0000 0008 8 = 7d6c0fe4 95149999
ffff8804077d1600 1835348726 C Co:1:043:0 0 8 >
ffff880402c540c0 1835365526 S Co:1:043:0 s 21 09 0300 0000 0008 8 = c01fbfc3 ba2ac36e
ffff880402c540c0 1835365604 C Co:1:043:0 0 8 >
ffff88020f0979c0 1835380568 S Co:1:043:0 s 21 09 0300 0000 0008 8 = 793aefab 60cf67d2
ffff88020f0979c0 1835380740 C Co:1:043:0 0 8 >
ffff88020f0979c0 1835397491 S Co:1:043:0 s 21 09 0300 0000 0008 8 = a94634fd 0c748ec2
ffff88020f0979c0 1835397601 C Co:1:043:0 0 8 >
ffff88020f0979c0 1835411514 S Co:1:043:0 s 21 09 0300 0000 0008 8 = b5806a30 6501440c
ffff88020f0979c0 1835411623 C Co:1:043:0 0 8 >
ffff88020f097780 1835429577 S Co:1:043:0 s 21 09 0300 0000 0008 8 = e6592e4d b5511ad5
ffff88020f097780 1835429750 C Co:1:043:0 0 8 >
ffff88020f097780 1835443465 S Co:1:043:0 s 21 09 0300 0000 0008 8 = ebf66472 6db3a315
ffff88020f097780 1835443630 C Co:1:043:0 0 8 >
ffff8804077d1600 1835458539 S Co:1:043:0 s 21 09 0300 0000 0008 8 = 55b0b151 9f6af917
ffff8804077d1600 1835458757 C Co:1:043:0 0 8 >
ffff8804077d1e40 1835474110 S Co:1:043:0 s 21 09 0300 0000 0008 8 = 189300b0 842c36fc
ffff8804077d1e40 1835474253 C Co:1:043:0 0 8 >
ffff8804077d1e40 1835489306 S Co:1:043:0 s 21 09 0300 0000 0008 8 = 0fe1ffe9 f6a5fd36
ffff8804077d1e40 1835489500 C Co:1:043:0 0 8 >
ffff8804077d1e40 1835505039 S Co:1:043:0 s 21 09 0300 0000 0008 8 = 768ea16a f5f3f20f
ffff8804077d1e40 1835505260 C Co:1:043:0 0 8 >
ffff88020f097e40 1835521022 S Co:1:043:0 s 21 09 0300 0000 0008 8 = 6fc39c34 24293b22
ffff88020f097e40 1835521226 C Co:1:043:0 0 8 >
ffff88020f097e40 1835536057 S Co:1:043:0 s 21 09 0300 0000 0008 8 = 805eea5e 4ace07df
ffff88020f097e40 1835536226 C Co:1:043:0 0 8 >
ffff88020f097000 1835551662 S Co:1:043:0 s 21 09 0300 0000 0008 8 = 116e4991 d45d0609
ffff88020f097000 1835551881 C Co:1:043:0 0 8 >
ffff8804077d16c0 1835568747 S Co:1:043:0 s 21 09 0300 0000 0008 8 = f0b9bd8b 50c4eb3a
ffff8804077d16c0 1835569003 C Co:1:043:0 0 8 >
ffff880402c54600 1835585515 S Co:1:043:0 s 21 09 0300 0000 0008 8 = cf380c9e f1e8ef5b
ffff880402c54600 1835585731 C Co:1:043:0 0 8 >
ffff8804077d16c0 1835599408 S Co:1:043:0 s 21 09 0300 0000 0008 8 = c3983f30 101d4f2e
ffff8804077d16c0 1835599606 C Co:1:043:0 0 8 >
ffff8803fab63180 1835615393 S Co:1:043:0 s 21 09 0300 0000 0008 8 = c5b9253b a7b1cac6
ffff8803fab63180 1835615507 C Co:1:043:0 0 8 >
ffff880402c54a80 1835630431 S Co:1:043:0 s 21 09 0300 0000 0008 8 = 3330d1cc d560260c
ffff880402c54a80 1835630607 C Co:1:043:0 0 8 >
ffff8803a009e9c0 1835646392 S Co:1:043:0 s 21 09 0300 0000 0008 8 = 4ec61986 5fdfab3a
ffff8803a009e9c0 1835646479 C Co:1:043:0 0 8 >
ffff8803a009e9c0 1835661324 S Co:1:043:0 s 21 09 0300 0000 0008 8 = bbf9181f 2c53a461
ffff8803a009e9c0 1835661476 C Co:1:043:0 0 8 >
ffff8803a009e9c0 1835679384 S Co:1:043:0 s 21 09 0300 0000 0008 8 = 0478abdf c6d9e3e5
ffff8803a009e9c0 1835679602 C Co:1:043:0 0 8 >
ffff8804077d1f00 1835692450 S Co:1:043:0 s 21 09 0300 0000 0008 8 = 16aaf526 defe3cfd
ffff8804077d1f00 1835692612 C Co:1:043:0 0 8 >
ffff88020f097540 1835708371 S Co:1:043:0 s 21 09 0300 0000 0008 8 = c226dce5 c7460736
ffff88020f097540 1835708482 C Co:1:043:0 0 8 >
ffff8804077d1000 1835724417 S Co:1:043:0 s 21 09 0300 0000 0008 8 = 3f398c22 f7a8a1f0
ffff8804077d1000 1835724628 C Co:1:043:0 0 8 >
ffff8804077d1cc0 1835740459 S Co:1:043:0 s 21 09 0300 0000 0008 8 = a465f277 8b0ee9dd
ffff8804077d1cc0 1835740606 C Co:1:043:0 0 8 >
ffff8803fab63e40 1835755516 S Co:1:043:0 s 21 09 0300 0000 0008 8 = 71df4091 c2d7c587
ffff8803fab63e40 1835755630 C Co:1:043:0 0 8 >
ffff8803fab63e40 1835771557 S Co:1:043:0 s 21 09 0300 0000 0008 8 = 050f6db3 7f569cc9
ffff8803fab63e40 1835771731 C Co:1:043:0 0 8 >
ffff8804077d1e40 1835786527 S Co:1:043:0 s 21 09 0300 0000 0008 8 = 2711b433 ca52dc52
ffff8804077d1e40 1835786623 C Co:1:043:0 0 8 >
ffff8803fab63d80 1835801686 S Co:1:043:0 s 21 09 0300 0000 0008 8 = 7f3812f9 4d877428
ffff8803fab63d80 1835801860 C Co:1:043:0 0 8 >
ffff88020f0976c0 1835818482 S Co:1:043:0 s 21 09 0300 0000 0008 8 = 1b87cb05 d9225820
ffff88020f0976c0 1835818603 C Co:1:043:0 0 8 >
ffff8804077d1d80 1835833583 S Co:1:043:0 s 21 09 0300 0000 0008 8 = ee39e3e8 e1460269
ffff8804077d1d80 1835833750 C Co:1:043:0 0 8 >
ffff880402c54900 1835848645 S Co:1:043:0 s 21 09 0300 0000 0008 8 = 4a38a748 fc8bed01
ffff880402c54900 1835848753 C Co:1:043:0 0 8 >
ffff8804077d1600 1835865527 S Co:1:043:0 s 21 09 0300 0000 0008 8 = 6ca8245f 657c1b3c
ffff8804077d1600 1835865624 C Co:1:043:0 0 8 >
ffff8803fab630c0 1835879554 S Co:1:043:0 s 21 09 0300 0000 0008 8 = ee5bad7a 7b178e42
ffff8803fab630c0 1835879753 C Co:1:043:0 0 8 >
ffff88020f0976c0 1835895637 S Co:1:043:0 s 21 09 0300 0000 0008 8 = 545c577c 444fd08f
ffff88020f0976c0 1835895753 C Co:1:043:0 0 8 >
ffff88020f0976c0 1835911506 S Co:1:043:0 s 21 09 0300 0000 0008 8 = 82677e5a e48b6e73
ffff88020f0976c0 1835911609 C Co:1:043:0 0 8 >
ffff8803fab630c0 1835928569 S Co:1:043:0 s 21 09 0300 0000 0008 8 = 426d409f 29267691
ffff8803fab630c0 1835928733 C Co:1:043:0 0 8 >
ffff8803fab63600 1835942589 S Co:1:043:0 s 21 09 0300 0000 0008 8 = c112ffe8 01eeff63
ffff8803fab63600 1835942735 C Co:1:043:0 0 8 >
ffff8803fab63600 1835957561 S Co:1:043:0 s 21 09 0300 0000 0008 8 = 1131e166 ffa89fb3
ffff8803fab63600 1835957750 C Co:1:043:0 0 8 >
ffff8803fab63480 1835973537 S Co:1:043:0 s 21 09 0300 0000 0008 8 = a6555161 dc88f421
ffff8803fab63480 1835973737 C Co:1:043:0 0 8 >
ffff8803fab63480 1835989572 S Co:1:043:0 s 21 09 0300 0000 0008 8 = db3f7db2 f2bc1ea1
ffff8803fab63480 1835989735 C Co:1:043:0 0 8 >
ffff8804077d1e40 1836006522 S Co:1:043:0 s 21 09 0300 0000 0008 8 = 6c65d846 c1e042fc
ffff8804077d1e40 1836006631 C Co:1:043:0 0 8 >
ffff8804077d16c0 1836020497 S Co:1:043:0 s 21 09 0300 0000 0008 8 = fc6f98a0 6c89074c
ffff8804077d16c0 1836020625 C Co:1:043:0 0 8 >
ffff8804077d16c0 1836036609 S Co:1:043:0 s 21 09 0300 0000 0008 8 = 8eba3755 3bbc1a83
ffff8804077d16c0 1836036735 C Co:1:043:0 0 8 >
ffff8804077d16c0 1836051649 S Co:1:043:0 s 21 09 0300 0000 0008 8 = 0ed7f48f 1876abe3
ffff8804077d16c0 1836051735 C Co:1:043:0 0 8 >
ffff8803fab63480 1836069557 S Co:1:043:0 s 21 09 0300 0000 0008 8 = c80a518d 1424ef84
ffff8803fab63480 1836069746 C Co:1:043:0 0 8 >
ffff8803fab63c00 1836082607 S Co:1:043:0 s 21 09 0300 0000 0008 8 = edce9420 e22a9ed4
ffff8803fab63c00 1836082735 C Co:1:043:0 0 8 >
ffff880402c540c0 1836098587 S Co:1:043:0 s 21 09 0300 0000 0008 8 = 134e492d 585e7510
ffff880402c540c0 1836098757 C Co:1:043:0 0 8 >
ffff880402c540c0 1836114625 S Co:1:043:0 s 21 09 0300 0000 0008 8 = b3ebbc30 f48cb4ce
ffff880402c540c0 1836114736 C Co:1:043:0 0 8 >
ffff88020f097300 1836129523 S Co:1:043:0 s 21 09 0300 0000 0008 8 = abbb81b5 53f29f75
ffff88020f097300 1836129632 C Co:1:043:0 0 8 >
ffff8804077d1f00 1836145562 S Co:1:043:0 s 21 09 0300 0000 0008 8 = bc06eedf b9c4ffc1
ffff8804077d1f00 1836145737 C Co:1:043:0 0 8 >
ffff8804077d1f00 1836161614 S Co:1:043:0 s 21 09 0300 0000 0008 8 = 0bca9ee3 8da7a042
ffff8804077d1f00 1836161755 C Co:1:043:0 0 8 >
ffff880402c54180 1836176513 S Co:1:043:0 s 21 09 0300 0000 0008 8 = a236ee8b dc37d2db
ffff880402c54180 1836176681 C Co:1:043:0 0 8 >
ffff8803e6e44480 1836193521 S Co:1:043:0 s 21 09 0300 0000 0008 8 = ee3081b6 d483ea45
ffff8803e6e44480 1836193733 C Co:1:043:0 0 8 >
ffff8803e6e44480 1836208563 S Co:1:043:0 s 21 09 0300 0000 0008 8 = 41d0bed4 498ec08c
ffff8803e6e44480 1836208733 C Co:1:043:0 0 8 >
ffff8803e6e44480 1836223442 S Co:1:043:0 s 21 09 0300 0000 0008 8 = 4fe54f6d 31ce318f
ffff8803e6e44480 1836223628 C Co:1:043:0 0 8 >
ffff8803e6e44480 1836239543 S Co:1:043:0 s 21 09 0300 0000 0008 8 = b36da199 29ae9c82
ffff8803e6e44480 1836239736 C Co:1:043:0 0 8 >
ffff8803e6e44480 1836254986 S Co:1:043:0 s 21 09 0300 0000 0008 8 = 691f6987 f00e676d
ffff8803e6e44480 1836255132 C Co:1:043:0 0 8 >
ffff8803e6e44480 1836270565 S Co:1:043:0 s 21 09 0300 0000 0008 8 = 54e41bf9 eac07aad
ffff8803e6e44480 1836270758 C Co:1:043:0 0 8 >
ffff8803e6e44480 1836286534 S Co:1:043:0 s 21 09 0300 0000 0008 8 = b75773c4 9c0bc070
ffff8803e6e44480 1836286751 C Co:1:043:0 0 8 >
ffff8803e6e44480 1836301660 S Co:1:043:0 s 21 09 0300 0000 0008 8 = be4aee52 342aab3b
ffff8803e6e44480 1836301768 C Co:1:043:0 0 8 >
ffff8803e6e44480 1836318628 S Co:1:043:0 s 21 09 0300 0000 0008 8 = f5425022 00cbaf65
ffff8803e6e44480 1836318758 C Co:1:043:0 0 8 >
ffff8803e6e44480 1836333463 S Co:1:043:0 s 21 09 0300 0000 0008 8 = cdf81e44 f493c49b
ffff8803e6e44480 1836333623 C Co:1:043:0 0 8 >
ffff8803e6e44480 1836348573 S Co:1:043:0 s 21 09 0300 0000 0008 8 = 1cd923e0 2696e65d
ffff8803e6e44480 1836348736 C Co:1:043:0 0 8 >
ffff8803fab63c00 1836365652 S Co:1:043:0 s 21 09 0300 0000 0008 8 = 9b84edae 54e2977d
ffff8803fab63c00 1836365743 C Co:1:043:0 0 8 >
ffff880402c54180 1836380453 S Co:1:043:0 s 21 09 0300 0000 0008 8 = 68514f7d 5bf359a5
ffff880402c54180 1836380628 C Co:1:043:0 0 8 >
ffff8803fab63c00 1836395503 S Co:1:043:0 s 21 09 0300 0000 0008 8 = 84c6deae bf3e37d0
ffff8803fab63c00 1836395628 C Co:1:043:0 0 8 >
ffff8803fab63c00 1836411597 S Co:1:043:0 s 21 09 0300 0000 0008 8 = 542176b8 28a83bcd
ffff8803fab63c00 1836411757 C Co:1:043:0 0 8 >
ffff880402c54180 1836426501 S Co:1:043:0 s 21 09 0300 0000 0008 8 = 22d4b5a5 e00ef7c2
ffff880402c54180 1836426630 C Co:1:043:0 0 8 >
ffff880402c54180 1836443555 S Co:1:043:0 s 21 09 0300 0000 0008 8 = 9b027d91 58bdfea5
ffff880402c54180 1836443763 C Co:1:043:0 0 8 >
ffff88020f097300 1836458567 S Co:1:043:0 s 21 09 0300 0000 0008 8 = 5105742f a3f96ac2
ffff88020f097300 1836458741 C Co:1:043:0 0 8 >
ffff880402c54240 1836473618 S Co:1:043:0 s 21 09 0300 0000 0008 8 = 39ea8546 f878563a
ffff880402c54240 1836473752 C Co:1:043:0 0 8 >
ffff88020f097b40 1836489511 S Co:1:043:0 s 21 09 0300 0000 0008 8 = 2cf15f2e 32e66380
ffff88020f097b40 1836489613 C Co:1:043:0 0 8 >
ffff8803a00d6240 1836505568 S Co:1:043:0 s 21 09 0300 0000 0008 8 = 670ff356 516136dc
ffff8803a00d6240 1836505758 C Co:1:043:0 0 8 >
ffff8803a00d6240 1836520604 S Co:1:043:0 s 21 09 0300 0000 0008 8 = 0c6ef8bf f8fcf6ea
ffff8803a00d6240 1836520738 C Co:1:043:0 0 8 >
ffff8803a00d6240 1836537533 S Co:1:043:0 s 21 09 0300 0000 0008 8 = a1e96880 ef3fd01a
ffff8803a00d6240 1836537637 C Co:1:043:0 0 8 >
ffff8803a00d6240 1836552557 S Co:1:043:0 s 21 09 0300 0000 0008 8 = 8f930242 a1a37430
ffff8803a00d6240 1836552741 C Co:1:043:0 0 8 >
ffff8803a00d6a80 1836567603 S Co:1:043:0 s 21 09 0300 0000 0008 8 = a32fc8c3 9d1898c3
ffff8803a00d6a80 1836567748 C Co:1:043:0 0 8 >
ffff8803a00d6a80 1836583519 S Co:1:043:0 s 21 09 0300 0000 0008 8 = 8eb78156 178072c0
ffff8803a00d6a80 1836583635 C Co:1:043:0 0 8 >
ffff8803a00d6240 1836598565 S Co:1:043:0 s 21 09 0300 0000 0008 8 = 66d8365f 653340e6
ffff8803a00d6240 1836598740 C Co:1:043:0 0 8 >
ffff8803a00d6240 1836614528 S Co:1:043:0 s 21 09 0300 0000 0008 8 = 2472b7d9 857cc24a
ffff8803a00d6240 1836614611 C Co:1:043:0 0 8 >
ffff8803a00d6240 1836629767 S Co:1:043:0 s 21 09 0300 0000 0008 8 = 261b15d2 9419bcd2
ffff8803a00d6240 1836629986 C Co:1:043:0 0 8 >
ffff8803a00d6240 1836646500 S Co:1:043:0 s 21 09 0300 0000 0008 8 = ad9b27eb 56bd77bc
ffff8803a00d6240 1836646629 C Co:1:043:0 0 8 >
ffff8803a00d6240 1836661522 S Co:1:043:0 s 21 09 0300 0000 0008 8 = 5f6e08db b38e3f16
ffff8803a00d6240 1836661628 C Co:1:043:0 0 8 >
ffff8803a00d6240 1836676553 S Co:1:043:0 s 21 09 0300 0000 0008 8 = c44795eb 35a9e445
ffff8803a00d6240 1836676757 C Co:1:043:0 0 8 >
ffff8803a00d6240 1836694543 S Co:1:043:0 s 21 09 0300 0000 0008 8 = ca8af279 8e9c3b81
ffff8803a00d6240 1836694787 C Co:1:043:0 0 8 >
ffff8803a00d6240 1836709573 S Co:1:043:0 s 21 09 0300 0000 0008 8 = 43cf0477 0ee99d55
ffff8803a00d6240 1836709804 C Co:1:043:0 0 8 >
ffff8803a00d6240 1836724617 S Co:1:043:0 s 21 09 0300 0000 0008 8 = 6364f5ec 2f886422
ffff8803a00d6240 1836724792 C Co:1:043:0 0 8 >
ffff880402c54240 1836739512 S Co:1:043:0 s 21 09 0300 0000 0008 8 = 45c9b570 0b63739b
ffff880402c54240 1836739660 C Co:1:043:0 0 8 >
ffff8804077d1d80 1836755490 S Co:1:043:0 s 21 09 0300 0000 0008 8 = 663476b1 e3d9ad48
ffff8804077d1d80 1836755631 C Co:1:043:0 0 8 >
ffff8803fab63480 1836770586 S Co:1:043:0 s 21 09 0300 0000 0008 8 = 260d2df3 983e7b05
ffff8803fab63480 1836770742 C Co:1:043:0 0 8 >
ffff880402c54240 1836786432 S Co:1:043:0 s 21 09 0300 0000 0008 8 = 4c711689 33574881
ffff880402c54240 1836786611 C Co:1:043:0 0 8 >
ffff880402c54240 1836802552 S Co:1:043:0 s 21 09 0300 0000 0008 8 = 81b02f5f 5ee107c2
ffff880402c54240 1836802763 C Co:1:043:0 0 8 >
ffff88020f097b40 1836817559 S Co:1:043:0 s 21 09 0300 0000 0008 8 = d2d1b972 eb09a99e
ffff88020f097b40 1836817752 C Co:1:043:0 0 8 >
ffff8804077d1cc0 1836834638 S Co:1:043:0 s 21 09 0300 0000 0008 8 = 300cbd54 4af3a942
ffff8804077d1cc0 1836834762 C Co:1:043:0 0 8 >
ffff8804077d1f00 1836849525 S Co:1:043:0 s 21 09 0300 0000 0008 8 = f14d83ab 153583ad
ffff8804077d1f00 1836849626 C Co:1:043:0 0 8 >
ffff8803fab63600 1836864568 S Co:1:043:0 s 21 09 0300 0000 0008 8 = 4fb51ab1 875b3733
ffff8803fab63600 1836864769 C Co:1:043:0 0 8 >
ffff880402c54900 1836880610 S Co:1:043:0 s 21 09 0300 0000 0008 8 = e61ad5b4 fe63c8fc
ffff880402c54900 1836880771 C Co:1:043:0 0 8 >
ffff8804077d16c0 1836895442 S Co:1:043:0 s 21 09 0300 0000 0008 8 = 3884c995 7e40c185
ffff8804077d16c0 1836895631 C Co:1:043:0 0 8 >
ffff8803fab63600 1836912571 S Co:1:043:0 s 21 09 0300 0000 0008 8 = 2ab0534b 2f5aac1c
ffff8803fab63600 1836912741 C Co:1:043:0 0 8 >
ffff8803fab63600 1836927659 S Co:1:043:0 s 21 09 0300 0000 0008 8 = 868f8e5e dc0a9b66
ffff8803fab63600 1836927753 C Co:1:043:0 0 8 >
ffff880402c54300 1836942435 S Co:1:043:0 s 21 09 0300 0000 0008 8 = 7ac6df6e 7420a2da
ffff880402c54300 1836942631 C Co:1:043:0 0 8 >
ffff8804077d1d80 1836958541 S Co:1:043:0 s 21 09 0300 0000 0008 8 = 152e6cad 8b5e5945
ffff8804077d1d80 1836958743 C Co:1:043:0 0 8 >
ffff8803fab63c00 1836974581 S Co:1:043:0 s 21 09 0300 0000 0008 8 = cf539e5f d8fc5c47
ffff8803fab63c00 1836974766 C Co:1:043:0 0 8 >
ffff8803fab63c00 1836989622 S Co:1:043:0 s 21 09 0300 0000 0008 8 = 00f7a55e b625ccd2
ffff8803fab63c00 1836989764 C Co:1:043:0 0 8 >
ffff8803fab63c00 1837007548 S Co:1:043:0 s 21 09 0300 0000 0008 8 = 668df29a a576ceb0
ffff8803fab63c00 1837007762 C Co:1:043:0 0 8 >
ffff8803fab63c00 1837020573 S Co:1:043:0 s 21 09 0300 0000 0008 8 = a1c1bc93 c88409fc
ffff8803fab63c00 1837020746 C Co:1:043:0 0 8 >
ffff88020f097d80 1837036596 S Co:1:043:0 s 21 09 0300 0000 0008 8 = b8ed7ddf 67552aa6
ffff88020f097d80 1837036742 C Co:1:043:0 0 8 >
ffff8804077d1e40 1837052527 S Co:1:043:0 s 21 09 0300 0000 0008 8 = 94a374a9 6de462f1
ffff8804077d1e40 1837052618 C Co:1:043:0 0 8 >
ffff880402c54300 1837068569 S Co:1:043:0 s 21 09 0300 0000 0008 8 = 8228242e e9a0e4f6
ffff880402c54300 1837068765 C Co:1:043:0 0 8 >
ffff8803fab63900 1837084617 S Co:1:043:0 s 21 09 0300 0000 0008 8 = b3f5d140 8feb6a20
ffff8803fab63900 1837084765 C Co:1:043:0 0 8 >
ffff880402c54300 1837099514 S Co:1:043:0 s 21 09 0300 0000 0008 8 = bd3608c5 369cafb0
ffff880402c54300 1837099673 C Co:1:043:0 0 8 >
ffff8803fab63900 1837114539 S Co:1:043:0 s 21 09 0300 0000 0008 8 = 1a4d1637 5a80f439
ffff8803fab63900 1837114618 C Co:1:043:0 0 8 >
ffff88020f097d80 1837134018 S Co:1:043:0 s 21 09 0300 0000 0008 8 = a64e8d23 99d37d23
ffff88020f097d80 1837134135 C Co:1:043:0 0 8 >
ffff88020f097cc0 1837146812 S Co:1:043:0 s 21 09 0300 0000 0008 8 = 2383c5ac 37c9132b
ffff88020f097cc0 1837147016 C Co:1:043:0 0 8 >
ffff8803fab63d80 1837161834 S Co:1:043:0 s 21 09 0300 0000 0008 8 = b6e75607 9c0a82df
ffff8803fab63d80 1837161965 C Co:1:043:0 0 8 >
ffff880402c54a80 1837176876 S Co:1:043:0 s 21 09 0300 0000 0008 8 = 6aaca1ff d32f1b23
ffff880402c54a80 1837177012 C Co:1:043:0 0 8 >
ffff88020f097cc0 1837192147 S Co:1:043:0 s 21 09 0300 0000 0008 8 = aab84671 0b4931b1
ffff88020f097cc0 1837192244 C Co:1:043:0 0 8 >
ffff8804077d1600 1837207805 S Co:1:043:0 s 21 09 0300 0000 0008 8 = c921adcf 18589d93
ffff8804077d1600 1837208012 C Co:1:043:0 0 8 >
ffff8804077d1d80 1837223793 S Co:1:043:0 s 21 09 0300 0000 0008 8 = 7cb7809e f1d63ca9
ffff8804077d1d80 1837224010 C Co:1:043:0 0 8 >
ffff8803fab63540 1837238888 S Co:1:043:0 s 21 09 0300 0000 0008 8 = 5c792dfa 312c6e27
ffff8803fab63540 1837238990 C Co:1:043:0 0 8 >
ffff88020f097f00 1837254984 S Co:1:043:0 s 21 09 0300 0000 0008 8 = 661c670f 99399716
ffff88020f097f00 1837255144 C Co:1:043:0 0 8 >
ffff88020f097f00 1837271846 S Co:1:043:0 s 21 09 0300 0000 0008 8 = 7d8aa3a0 8ad0a0d0
ffff88020f097f00 1837272015 C Co:1:043:0 0 8 >
ffff88020f097f00 1837286893 S Co:1:043:0 s 21 09 0300 0000 0008 8 = e55e9d82 8d387587
ffff88020f097f00 1837287016 C Co:1:043:0 0 8 >
ffff88020f097f00 1837301862 S Co:1:043:0 s 21 09 0300 0000 0008 8 = c86bd320 cdac86bd
ffff88020f097f00 1837301992 C Co:1:043:0 0 8 >
ffff8803fab63540 1837318871 S Co:1:043:0 s 21 09 0300 0000 0008 8 = b33407f7 99db48cb
ffff8803fab63540 1837319020 C Co:1:043:0 0 8 >
ffff8803fab63540 1837333878 S Co:1:043:0 s 21 09 0300 0000 0008 8 = 1773bf18 e567b35c
ffff8803fab63540 1837333997 C Co:1:043:0 0 8 >
ffff88020f097d80 1837348914 S Co:1:043:0 s 21 09 0300 0000 0008 8 = ca95c6ab c868c4f1
ffff88020f097d80 1837349020 C Co:1:043:0 0 8 >
ffff88020f0973c0 1837365768 S Co:1:043:0 s 21 09 0300 0000 0008 8 = 863aab69 fee9fa5d
ffff88020f0973c0 1837365993 C Co:1:043:0 0 8 >
ffff880402c54780 1837380840 S Co:1:043:0 s 21 09 0300 0000 0008 8 = 67b73f1f 6568db48
ffff880402c54780 1837381016 C Co:1:043:0 0 8 >
ffff88020f0973c0 1837395852 S Co:1:043:0 s 21 09 0300 0000 0008 8 = 6f961930 81576fae
ffff88020f0973c0 1837395993 C Co:1:043:0 0 8 >
ffff88020f0973c0 1837412799 S Co:1:043:0 s 21 09 0300 0000 0008 8 = 04131311 fa9fc15e
ffff88020f0973c0 1837413018 C Co:1:043:0 0 8 >
ffff88020f0973c0 1837427857 S Co:1:043:0 s 21 09 0300 0000 0008 8 = 6e9fcccc 1b1a637e
ffff88020f0973c0 1837428000 C Co:1:043:0 0 8 >
ffff88020f0973c0 1837442892 S Co:1:043:0 s 21 09 0300 0000 0008 8 = 5c5e2680 5416e904
ffff88020f0973c0 1837443021 C Co:1:043:0 0 8 >
ffff88020f0973c0 1837458069 S Co:1:043:0 s 21 09 0300 0000 0008 8 = 5eaac8de b6d86b3d
ffff88020f0973c0 1837458260 C Co:1:043:0 0 8 >
ffff8804077d1d80 1837474840 S Co:1:043:0 s 21 09 0300 0000 0008 8 = 69909bab 7c140648
ffff8804077d1d80 1837474996 C Co:1:043:0 0 8 >
ffff8804077d1d80 1837489870 S Co:1:043:0 s 21 09 0300 0000 0008 8 = 58504f43 7e775999
ffff8804077d1d80 1837489996 C Co:1:043:0 0 8 >
ffff8803fab63180 1837504952 S Co:1:043:0 s 21 09 0300 0000 0008 8 = 68e0d512 bd200a78
ffff8803fab63180 1837505182 C Co:1:043:0 0 8 >
ffff8804077d1000 1837521824 S Co:1:043:0 s 21 09 0300 0000 0008 8 = ba68e41a dd204082
ffff8804077d1000 1837521994 C Co:1:043:0 0 8 >
ffff8803fab63180 1837551897 S Co:1:043:0 s 21 09 0300 0000 0008 8 = 550343aa 1976d401
ffff8803fab63180 1837552018 C Co:1:043:0 0 8 >
ffff8803fab63180 1837582920 S Ci:1:043:0 s a1 01 0300 0000 0008 8 <
ffff8803fab63180 1837583000 C Ci:1:043:0 0 8 = aa040000 00000000
ffff880403191780 1900442824 S Co:1:043:0 s 21 09 0300 0000 0008 8 = 55010100 00ff075d
ffff880403191780 1900443036 C Co:1:043:0 0 8 >
ffff880403191780 1900473780 S Ci:1:043:0 s a1 01 0300 0000 0008 8 <
ffff880403191780 1900473914 C Ci:1:043:0 0 8 = aa020000 00000000
ffff8803eb86fa80 1900505077 S Co:1:043:0 s 21 09 0300 0000 0008 8 = 0b020101 00000f06
ffff8803eb86fa80 1900505189 C Co:1:043:0 0 8 >
ffff8803ed3329c0 1900521826 S Co:1:043:0 s 21 09 0300 0000 0008 8 = b81ca7f1 013b327d
ffff8803ed3329c0 1900521927 C Co:1:043:0 0 8 >
ffff8803ed3329c0 1900536862 S Co:1:043:0 s 21 09 0300 0000 0008 8 = ffffff01 01ffffff
ffff8803ed3329c0 1900537050 C Co:1:043:0 0 8 >
ffff8802486c5000 1900552156 S Co:1:043:0 s 21 09 0300 0000 0008 8 = ffffffff ffffffff
ffff8802486c5000 1900552294 C Co:1:043:0 0 8 >
ffff880403191780 1900568838 S Co:1:043:0 s 21 09 0300 0000 0008 8 = ffffffff ffffffff
ffff880403191780 1900569044 C Co:1:043:0 0 8 >
ffff880403191780 1900583789 S Co:1:043:0 s 21 09 0300 0000 0008 8 = ffffffff ffffffff
ffff880403191780 1900583913 C Co:1:043:0 0 8 >
ffff8803ed3329c0 1900599055 S Co:1:043:0 s 21 09 0300 0000 0008 8 = 80ffffff ffffffff
ffff8803ed3329c0 1900599195 C Co:1:043:0 0 8 >
ffff880403191780 1900615744 S Co:1:043:0 s 21 09 0300 0000 0008 8 = ffffffff ffffffff
ffff880403191780 1900615933 C Co:1:043:0 0 8 >
ffff880403191780 1900630776 S Co:1:043:0 s 21 09 0300 0000 0008 8 = ffffffff ffffffff
ffff880403191780 1900630938 C Co:1:043:0 0 8 >
ffff880403191780 1900646019 S Co:1:043:0 s 21 09 0300 0000 0008 8 = f7fff7f7 fff7f7ff
ffff880403191780 1900646181 C Co:1:043:0 0 8 >
ffff8803ed3329c0 1900662789 S Co:1:043:0 s 21 09 0300 0000 0008 8 = f7f7fff7 f7fff7f7
ffff8803ed3329c0 1900662944 C Co:1:043:0 0 8 >
ffff8802486c5000 1900677818 S Co:1:043:0 s 21 09 0300 0000 0008 8 = fff7f7ff f7f7fff7
ffff8802486c5000 1900677931 C Co:1:043:0 0 8 >
ffff8802486c5000 1900692855 S Co:1:043:0 s 21 09 0300 0000 0008 8 = f7fff7f7 fff7f7ff
ffff8802486c5000 1900693050 C Co:1:043:0 0 8 >
ffff880403191780 1900709912 S Co:1:043:0 s 21 09 0300 0000 0008 8 = f7f7fff7 f7fff7f7
ffff880403191780 1900710068 C Co:1:043:0 0 8 >
ffff880403191780 1900724816 S Co:1:043:0 s 21 09 0300 0000 0008 8 = fff7f7ff f7f7fff7
ffff880403191780 1900724938 C Co:1:043:0 0 8 >
ffff880403191780 1900739850 S Co:1:043:0 s 21 09 0300 0000 0008 8 = f7fff7f7 fff7f7ff
ffff880403191780 1900740045 C Co:1:043:0 0 8 >
ffff8803ed3329c0 1900756904 S Co:1:043:0 s 21 09 0300 0000 0008 8 = f7f7fff7 f7fff7f7
ffff8803ed3329c0 1900757043 C Co:1:043:0 0 8 >
ffff880403191780 1900771743 S Co:1:043:0 s 21 09 0300 0000 0008 8 = fff7f7ff f7f7fff7
ffff880403191780 1900771934 C Co:1:043:0 0 8 >
ffff8803eb86f300 1900786831 S Co:1:043:0 s 21 09 0300 0000 0008 8 = f7fff7f7 fff7f7ff
ffff8803eb86f300 1900786930 C Co:1:043:0 0 8 >
ffff8802486c5000 1900801870 S Co:1:043:0 s 21 09 0300 0000 0008 8 = f7f7fff7 f7fff7f7
ffff8802486c5000 1900802045 C Co:1:043:0 0 8 >
ffff880403191780 1900817186 S Co:1:043:0 s 21 09 0300 0000 0008 8 = fff7f7ff f7f7fff7
ffff880403191780 1900817313 C Co:1:043:0 0 8 >
ffff8802486c5000 1900833820 S Co:1:043:0 s 21 09 0300 0000 0008 8 = f7fff7f7 fff7f7ff
ffff8802486c5000 1900833940 C Co:1:043:0 0 8 >
ffff8802486c5000 1900848855 S Co:1:043:0 s 21 09 0300 0000 0008 8 = f7f7fff7 f7fff7f7
ffff8802486c5000 1900849046 C Co:1:043:0 0 8 >
ffff880403191780 1900864324 S Co:1:043:0 s 21 09 0300 0000 0008 8 = fff7f7ff f7f7fff7
ffff880403191780 1900864560 C Co:1:043:0 0 8 >
ffff880403191780 1900880768 S Co:1:043:0 s 21 09 0300 0000 0008 8 = f7fff7f7 fff7f7ff
ffff880403191780 1900880936 C Co:1:043:0 0 8 >
ffff880403191780 1900895866 S Co:1:043:0 s 21 09 0300 0000 0008 8 = f7f7fff7 f7fff7f7
ffff880403191780 1900896046 C Co:1:043:0 0 8 >
ffff8803eb86f300 1900910884 S Co:1:043:0 s 21 09 0300 0000 0008 8 = fff7f7ff f7f7fff7
ffff8803eb86f300 1900911043 C Co:1:043:0 0 8 >
ffff8803eb86f300 1900927743 S Co:1:043:0 s 21 09 0300 0000 0008 8 = f7fff7f7 fff7f7ff
ffff8803eb86f300 1900927916 C Co:1:043:0 0 8 >
ffff8803eb86f300 1900942873 S Co:1:043:0 s 21 09 0300 0000 0008 8 = f7f7fff7 f7fff7f7
ffff8803eb86f300 1900943091 C Co:1:043:0 0 8 >
ffff8804037dba80 1900957863 S Co:1:043:0 s 21 09 0300 0000 0008 8 = fff7f7ff f7f7fff7
ffff8804037dba80 1900958066 C Co:1:043:0 0 8 >
ffff8804037dba80 1900974791 S Co:1:043:0 s 21 09 0300 0000 0008 8 = f7fff7f7 fff7f7ff
ffff8804037dba80 1900974946 C Co:1:043:0 0 8 >
ffff8804037db300 1900989450 S Co:1:043:0 s 21 09 0300 0000 0008 8 = f7f7fff7 f7fff7f7
ffff8804037db300 1900989568 C Co:1:043:0 0 8 >
ffff8804037db300 1901005493 S Co:1:043:0 s 21 09 0300 0000 0008 8 = fff7f7ff f7f7fff7
ffff8804037db300 1901005669 C Co:1:043:0 0 8 >
ffff8804037dba80 1901020464 S Co:1:043:0 s 21 09 0300 0000 0008 8 = dbcf3f50 132b559e
ffff8804037dba80 1901020667 C Co:1:043:0 0 8 >
ffff8803eb86f600 1901036421 S Co:1:043:0 s 21 09 0300 0000 0008 8 = 06cbcf3c fc5d5856
ffff8803eb86f600 1901036611 C Co:1:043:0 0 8 >
ffff8803eb86f600 1901051431 S Co:1:043:0 s 21 09 0300 0000 0008 8 = c411a952 91228703
ffff8803eb86f600 1901051553 C Co:1:043:0 0 8 >
ffff8803eb86f600 1901068506 S Co:1:043:0 s 21 09 0300 0000 0008 8 = 15a5f712 dc91c4aa
ffff8803eb86f600 1901068672 C Co:1:043:0 0 8 >
ffff8803eb86f600 1901083349 S Co:1:043:0 s 21 09 0300 0000 0008 8 = ea103463 98050672
ffff8803eb86f600 1901083543 C Co:1:043:0 0 8 >
ffff880403176540 1901098516 S Co:1:043:0 s 21 09 0300 0000 0008 8 = acdeb00e b89bd725
ffff880403176540 1901098684 C Co:1:043:0 0 8 >
ffff880403176540 1901115502 S Co:1:043:0 s 21 09 0300 0000 0008 8 = b51f0e40 dfb7d3b4
ffff880403176540 1901115692 C Co:1:043:0 0 8 >
ffff8803eb86f600 1901130479 S Co:1:043:0 s 21 09 0300 0000 0008 8 = d3e8c70a e77e2eb1
ffff8803eb86f600 1901130667 C Co:1:043:0 0 8 >
ffff8803eb86f600 1901145381 S Co:1:043:0 s 21 09 0300 0000 0008 8 = cad2a7e2 5d5b2cd4
ffff8803eb86f600 1901145552 C Co:1:043:0 0 8 >
ffff8803eb86fcc0 1901162437 S Co:1:043:0 s 21 09 0300 0000 0008 8 = d1784d22 017ca879
ffff8803eb86fcc0 1901162545 C Co:1:043:0 0 8 >
ffff880403176540 1901177519 S Co:1:043:0 s 21 09 0300 0000 0008 8 = 12faad86 4953901f
ffff880403176540 1901177745 C Co:1:043:0 0 8 >
ffff880403176540 1901192377 S Co:1:043:0 s 21 09 0300 0000 0008 8 = 2c7e8fb0 dc1866e9
ffff880403176540 1901192563 C Co:1:043:0 0 8 >
ffff8803ed332e40 1901209477 S Co:1:043:0 s 21 09 0300 0000 0008 8 = b2ac0fa5 1944bf1e
ffff8803ed332e40 1901209693 C Co:1:043:0 0 8 >
ffff8803ed332e40 1901224515 S Co:1:043:0 s 21 09 0300 0000 0008 8 = ac301e50 9015c5aa
ffff8803ed332e40 1901224693 C Co:1:043:0 0 8 >
ffff8803ed332e40 1901239409 S Co:1:043:0 s 21 09 0300 0000 0008 8 = 133afdfc 850fb79d
ffff8803ed332e40 1901239569 C Co:1:043:0 0 8 >
ffff8803ed332e40 1901256468 S Co:1:043:0 s 21 09 0300 0000 0008 8 = 57ffc7dc 737765a9
ffff8803ed332e40 1901256698 C Co:1:043:0 0 8 >
ffff8803ed332e40 1901271498 S Co:1:043:0 s 21 09 0300 0000 0008 8 = db37e685 84d8b6a7
ffff8803ed332e40 1901271675 C Co:1:043:0 0 8 >
ffff880403176600 1901286343 S Co:1:043:0 s 21 09 0300 0000 0008 8 = 759f9a70 1c812511
ffff880403176600 1901286575 C Co:1:043:0 0 8 >
ffff8803ed332e40 1901303401 S Co:1:043:0 s 21 09 0300 0000 0008 8 = f076787a 4d033e86
ffff8803ed332e40 1901303550 C Co:1:043:0 0 8 >
ffff8803ed332900 1901318431 S Co:1:043:0 s 21 09 0300 0000 0008 8 = 8c02e666 62b5234b
ffff8803ed332900 1901318547 C Co:1:043:0 0 8 >
ffff8803eb86fc00 1901335538 S Co:1:043:0 s 21 09 0300 0000 0008 8 = 7b0ba258 57310bc7
ffff8803eb86fc00 1901335672 C Co:1:043:0 0 8 >
ffff8802486c5240 1901349430 S Co:1:043:0 s 21 09 0300 0000 0008 8 = 645c3b5a 5dd6bf04
ffff8802486c5240 1901349557 C Co:1:043:0 0 8 >
ffff8802486c5240 1901364512 S Co:1:043:0 s 21 09 0300 0000 0008 8 = e24794d8 59461d33
ffff8802486c5240 1901364675 C Co:1:043:0 0 8 >
ffff880403176600 1901380495 S Co:1:043:0 s 21 09 0300 0000 0008 8 = 04206626 63e79826
ffff880403176600 1901380675 C Co:1:043:0 0 8 >
ffff8802486c5e40 1901397463 S Co:1:043:0 s 21 09 0300 0000 0008 8 = ccbfbcf7 4965b4d6
ffff8802486c5e40 1901397549 C Co:1:043:0 0 8 >
ffff880403176600 1901412449 S Co:1:043:0 s 21 09 0300 0000 0008 8 = b20077e6 0b2c8cdd
ffff880403176600 1901412553 C Co:1:043:0 0 8 >
ffff8802486c5e40 1901427445 S Co:1:043:0 s 21 09 0300 0000 0008 8 = 2044caef 5ff04efa
ffff8802486c5e40 1901427688 C Co:1:043:0 0 8 >
ffff880403176600 1901443351 S Co:1:043:0 s 21 09 0300 0000 0008 8 = f6f0bdf4 2d27bb92
ffff880403176600 1901443547 C Co:1:043:0 0 8 >
ffff8802486c5e40 1901457499 S Co:1:043:0 s 21 09 0300 0000 0008 8 = 06ebac3a 128caa2c
ffff8802486c5e40 1901457741 C Co:1:043:0 0 8 >
ffff88040333b900 1901473475 S Co:1:043:0 s 21 09 0300 0000 0008 8 = 9622c7ec df9c84f2
ffff88040333b900 1901473688 C Co:1:043:0 0 8 >
ffff88040333b480 1901489525 S Co:1:043:0 s 21 09 0300 0000 0008 8 = e3069195 191ac735
ffff88040333b480 1901489690 C Co:1:043:0 0 8 >
ffff88040333b480 1901505428 S Co:1:043:0 s 21 09 0300 0000 0008 8 = 9a0b64a8 798d86e7
ffff88040333b480 1901505579 C Co:1:043:0 0 8 >
ffff88040333b480 1901520539 S Co:1:043:0 s 21 09 0300 0000 0008 8 = 5f28e9fa 6bbfe521
ffff88040333b480 1901520701 C Co:1:043:0 0 8 >
ffff88040333b480 1901537517 S Co:1:043:0 s 21 09 0300 0000 0008 8 = 495ca344 913e9f9d
ffff88040333b480 1901537678 C Co:1:043:0 0 8 >
ffff88040333b480 1901552362 S Co:1:043:0 s 21 09 0300 0000 0008 8 = 622563a3 3edc823a
ffff88040333b480 1901552565 C Co:1:043:0 0 8 >
ffff88040333b480 1901567396 S Co:1:043:0 s 21 09 0300 0000 0008 8 = 2908d21a fe31ef7d
ffff88040333b480 1901567566 C Co:1:043:0 0 8 >
ffff880403176600 1901583441 S Co:1:043:0 s 21 09 0300 0000 0008 8 = 110eed0d 0b155c0d
ffff880403176600 1901583548 C Co:1:043:0 0 8 >
ffff880403176600 1901598371 S Co:1:043:0 s 21 09 0300 0000 0008 8 = 024382c6 d729d434
ffff880403176600 1901598573 C Co:1:043:0 0 8 >
ffff8803eb86fc00 1901615443 S Co:1:043:0 s 21 09 0300 0000 0008 8 = d538b6f2 874d7563
ffff8803eb86fc00 1901615548 C Co:1:043:0 0 8 >
ffff8803eb86fc00 1901630486 S Co:1:043:0 s 21 09 0300 0000 0008 8 = da808122 7429efad
ffff8803eb86fc00 1901630707 C Co:1:043:0 0 8 >
ffff8803eb86fc00 1901645518 S Co:1:043:0 s 21 09 0300 0000 0008 8 = 53342e4d aaa70948
ffff8803eb86fc00 1901645701 C Co:1:043:0 0 8 >
ffff8803eb86fc00 1901662435 S Co:1:043:0 s 21 09 0300 0000 0008 8 = f971de4a 6b761d11
ffff8803eb86fc00 1901662564 C Co:1:043:0 0 8 >
ffff8803eb86fc00 1901678481 S Co:1:043:0 s 21 09 0300 0000 0008 8 = 74d70459 ab869807
ffff8803eb86fc00 1901678678 C Co:1:043:0 0 8 >
ffff8802486c5e40 1901693505 S Co:1:043:0 s 21 09 0300 0000 0008 8 = e50ae799 93907ecd
ffff8802486c5e40 1901693674 C Co:1:043:0 0 8 >
ffff8803ed332d80 1901708373 S Co:1:043:0 s 21 09 0300 0000 0008 8 = 5e332590 018de22a
ffff8803ed332d80 1901708561 C Co:1:043:0 0 8 >
ffff880403176600 1901723434 S Co:1:043:0 s 21 09 0300 0000 0008 8 = 667e2da9 043c708b
ffff880403176600 1901723551 C Co:1:043:0 0 8 >
ffff880403176600 1901740458 S Co:1:043:0 s 21 09 0300 0000 0008 8 = 789bc3af 629fe57e
ffff880403176600 1901740551 C Co:1:043:0 0 8 >
ffff8802486c5e40 1901755420 S Co:1:043:0 s 21 09 0300 0000 0008 8 = 833f7e55 147c9336
ffff8802486c5e40 1901755602 C Co:1:043:0 0 8 >
ffff8802486c5e40 1901770420 S Co:1:043:0 s 21 09 0300 0000 0008 8 = 69a34ab0 c7dee00c
ffff8802486c5e40 1901770548 C Co:1:043:0 0 8 >
ffff8802486c5e40 1901787504 S Co:1:043:0 s 21 09 0300 0000 0008 8 = 8201e8b9 5a94c6fa
ffff8802486c5e40 1901787705 C Co:1:043:0 0 8 >
ffff8802486c5e40 1901802547 S Co:1:043:0 s 21 09 0300 0000 0008 8 = 181c6bce 65af5320
ffff8802486c5e40 1901802684 C Co:1:043:0 0 8 >
ffff8802486c5e40 1901817629 S Co:1:043:0 s 21 09 0300 0000 0008 8 = eab7bc30 ae062841
ffff8802486c5e40 1901817801 C Co:1:043:0 0 8 >
ffff880403176600 1901834496 S Co:1:043:0 s 21 09 0300 0000 0008 8 = ac1b1584 b4b3fb44
ffff880403176600 1901834677 C Co:1:043:0 0 8 >
ffff880403176600 1901849463 S Co:1:043:0 s 21 09 0300 0000 0008 8 = 84938754 269517b6
ffff880403176600 1901849695 C Co:1:043:0 0 8 >
ffff880403176600 1901864361 S Co:1:043:0 s 21 09 0300 0000 0008 8 = 8cf1768d 6bced944
ffff880403176600 1901864550 C Co:1:043:0 0 8 >
ffff8803eb86fc00 1901880476 S Co:1:043:0 s 21 09 0300 0000 0008 8 = 55091900 1a453344
ffff8803eb86fc00 1901880725 C Co:1:043:0 0 8 >
ffff8803eb86fc00 1901896516 S Co:1:043:0 s 21 09 0300 0000 0008 8 = 6033fde3 80232b2c
ffff8803eb86fc00 1901896677 C Co:1:043:0 0 8 >
ffff8803eb86fc00 1901911402 S Co:1:043:0 s 21 09 0300 0000 0008 8 = a4cc8250 1f585b17
ffff8803eb86fc00 1901911589 C Co:1:043:0 0 8 >
ffff8803eb86fc00 1901926438 S Co:1:043:0 s 21 09 0300 0000 0008 8 = 0db35ac3 2c157044
ffff8803eb86fc00 1901926553 C Co:1:043:0 0 8 >
ffff8803eb86fc00 1901943501 S Co:1:043:0 s 21 09 0300 0000 0008 8 = f9ce0f9f 0e52ad98
ffff8803eb86fc00 1901943699 C Co:1:043:0 0 8 >
ffff8803eb86fc00 1901958546 S Co:1:043:0 s 21 09 0300 0000 0008 8 = bb847ca7 e447671a
ffff8803eb86fc00 1901958703 C Co:1:043:0 0 8 >
ffff880403176300 1901973545 S Co:1:043:0 s 21 09 0300 0000 0008 8 = 1b435087 fef48975
ffff880403176300 1901973696 C Co:1:043:0 0 8 >
ffff880403176540 1901991610 S Co:1:043:0 s 21 09 0300 0000 0008 8 = d2fa914a 609c1077
ffff880403176540 1901991819 C Co:1:043:0 0 8 >
ffff880403176540 1902004765 S Co:1:043:0 s 21 09 0300 0000 0008 8 = 109d14e3 44448e96
ffff880403176540 1902004928 C Co:1:043:0 0 8 >
ffff8802486c5e40 1902021592 S Co:1:043:0 s 21 09 0300 0000 0008 8 = f8a608a7 9737a968
ffff8802486c5e40 1902021699 C Co:1:043:0 0 8 >
ffff8802486c5e40 1902036626 S Co:1:043:0 s 21 09 0300 0000 0008 8 = 20906bcf 79839a28
ffff8802486c5e40 1902036825 C Co:1:043:0 0 8 >
ffff8802486c5e40 1902051676 S Co:1:043:0 s 21 09 0300 0000 0008 8 = 135d91f9 c07ab136
ffff8802486c5e40 1902051825 C Co:1:043:0 0 8 >
ffff8802486c5e40 1902067578 S Co:1:043:0 s 21 09 0300 0000 0008 8 = d10fa2a6 7434cd95
ffff8802486c5e40 1902067700 C Co:1:043:0 0 8 >
ffff8802486c5540 1902086065 S Co:1:043:0 s 21 09 0300 0000 0008 8 = 4c301abb 520ae76c
ffff8802486c5540 1902086181 C Co:1:043:0 0 8 >
ffff8802486c5540 1902098147 S Co:1:043:0 s 21 09 0300 0000 0008 8 = eb4c4902 4a1a8688
ffff8802486c5540 1902098301 C Co:1:043:0 0 8 >
ffff8802486c5e40 1902114171 S Co:1:043:0 s 21 09 0300 0000 0008 8 = 0974d3a8 03c84ad7
ffff8802486c5e40 1902114305 C Co:1:043:0 0 8 >
ffff8803ed332f00 1902130084 S Co:1:043:0 s 21 09 0300 0000 0008 8 = 75bc2fbf 543964ec
ffff8803ed332f00 1902130180 C Co:1:043:0 0 8 >
ffff8802486c5a80 1902145182 S Co:1:043:0 s 21 09 0300 0000 0008 8 = f1bb2abb cbd81a80
ffff8802486c5a80 1902145328 C Co:1:043:0 0 8 >
ffff8802486c5a80 1902162223 S Co:1:043:0 s 21 09 0300 0000 0008 8 = b50f63f7 29d345ed
ffff8802486c5a80 1902162431 C Co:1:043:0 0 8 >
ffff8802486c5a80 1902177136 S Co:1:043:0 s 21 09 0300 0000 0008 8 = ebd8ce2f e19dd4b3
ffff8802486c5a80 1902177306 C Co:1:043:0 0 8 >
ffff8802486c5e40 1902193170 S Co:1:043:0 s 21 09 0300 0000 0008 8 = 323a3405 9e6c49f5
ffff8802486c5e40 1902193327 C Co:1:043:0 0 8 >
ffff8803ed332f00 1902208217 S Co:1:043:0 s 21 09 0300 0000 0008 8 = 1edeaf7f bcba39fb
ffff8803ed332f00 1902208306 C Co:1:043:0 0 8 >
ffff8803eb86f180 1902224122 S Co:1:043:0 s 21 09 0300 0000 0008 8 = b5703186 ccc6cfaf
ffff8803eb86f180 1902224307 C Co:1:043:0 0 8 >
ffff8803eb86f180 1902239098 S Co:1:043:0 s 21 09 0300 0000 0008 8 = f121fc66 13124822
ffff8803eb86f180 1902239188 C Co:1:043:0 0 8 >
ffff8803e9bf30c0 1902256225 S Co:1:043:0 s 21 09 0300 0000 0008 8 = 42242852 0ae57507
ffff8803e9bf30c0 1902256310 C Co:1:043:0 0 8 >
ffff8803eb86f180 1902271066 S Co:1:043:0 s 21 09 0300 0000 0008 8 = 0b3223df ddc83e35
ffff8803eb86f180 1902271179 C Co:1:043:0 0 8 >
ffff8803e9bf33c0 1902286225 S Co:1:043:0 s 21 09 0300 0000 0008 8 = 23082a86 ed0a1b27
ffff8803e9bf33c0 1902286457 C Co:1:043:0 0 8 >
ffff8803e9bf33c0 1902303151 S Co:1:043:0 s 21 09 0300 0000 0008 8 = 54e6d325 503f9c7d
ffff8803e9bf33c0 1902303335 C Co:1:043:0 0 8 >
ffff8803e9bf33c0 1902318244 S Co:1:043:0 s 21 09 0300 0000 0008 8 = dd10857d 4ebbe07a
ffff8803e9bf33c0 1902318454 C Co:1:043:0 0 8 >
ffff8802486c5e40 1902333125 S Co:1:043:0 s 21 09 0300 0000 0008 8 = f14ffcb3 e4191f85
ffff8802486c5e40 1902333328 C Co:1:043:0 0 8 >
ffff8802486c5e40 1902350182 S Co:1:043:0 s 21 09 0300 0000 0008 8 = 376fc8d1 44b823ab
ffff8802486c5e40 1902350333 C Co:1:043:0 0 8 >
ffff8802486c5e40 1902365171 S Co:1:043:0 s 21 09 0300 0000 0008 8 = 4ac0cc45 503bc81a
ffff8802486c5e40 1902365323 C Co:1:043:0 0 8 >
ffff880403176480 1902380055 S Co:1:043:0 s 21 09 0300 0000 0008 8 = 3997c15e 240682a6
ffff880403176480 1902380178 C Co:1:043:0 0 8 >
ffff880403176480 1902397172 S Co:1:043:0 s 21 09 0300 0000 0008 8 = 07ccb3d4 8bc6d545
ffff880403176480 1902397336 C Co:1:043:0 0 8 >
ffff8803eb86f000 1902412214 S Co:1:043:0 s 21 09 0300 0000 0008 8 = 2a3c813e 87e8dd95
ffff8803eb86f000 1902412307 C Co:1:043:0 0 8 >
ffff880403176e40 1902427050 S Co:1:043:0 s 21 09 0300 0000 0008 8 = 0e465f9c cc1ec653
ffff880403176e40 1902427180 C Co:1:043:0 0 8 >
ffff8803eb86f6c0 1902442525 S Co:1:043:0 s 21 09 0300 0000 0008 8 = 905055cd 43e052e3
ffff8803eb86f6c0 1902442680 C Co:1:043:0 0 8 >
ffff8801eff40480 1902459142 S Co:1:043:0 s 21 09 0300 0000 0008 8 = 8542c018 8ae658cc
ffff8801eff40480 1902459306 C Co:1:043:0 0 8 >
ffff8801eff40480 1902474172 S Co:1:043:0 s 21 09 0300 0000 0008 8 = 3307cea6 70b1423b
ffff8801eff40480 1902474306 C Co:1:043:0 0 8 >
ffff8801eff40480 1902489127 S Co:1:043:0 s 21 09 0300 0000 0008 8 = d5110403 7b018c7e
ffff8801eff40480 1902489309 C Co:1:043:0 0 8 >
ffff8801eff40480 1902506190 S Co:1:043:0 s 21 09 0300 0000 0008 8 = 1ad4b9a2 645e4a89
ffff8801eff40480 1902506315 C Co:1:043:0 0 8 >
ffff8801eff40480 1902521223 S Co:1:043:0 s 21 09 0300 0000 0008 8 = a4489a58 9792a073
ffff8801eff40480 1902521331 C Co:1:043:0 0 8 >
ffff8801eff40480 1902536056 S Co:1:043:0 s 21 09 0300 0000 0008 8 = 8b6927df b62b4af7
ffff8801eff40480 1902536180 C Co:1:043:0 0 8 >
ffff8801eff40480 1902553171 S Co:1:043:0 s 21 09 0300 0000 0008 8 = d9b93253 15fc13f5
ffff8801eff40480 1902553346 C Co:1:043:0 0 8 >
ffff8801eff40480 1902568239 S Co:1:043:0 s 21 09 0300 0000 0008 8 = 0dba65b6 3e9b60f0
ffff8801eff40480 1902568445 C Co:1:043:0 0 8 >
ffff8801eff40480 1902583122 S Co:1:043:0 s 21 09 0300 0000 0008 8 = 9b76bb6d 6ce2a590
ffff8801eff40480 1902583329 C Co:1:043:0 0 8 >
ffff8801eff40480 1902600159 S Co:1:043:0 s 21 09 0300 0000 0008 8 = 68fa03c2 1270ec1f
ffff8801eff40480 1902600308 C Co:1:043:0 0 8 >
ffff8801eff40480 1902615193 S Co:1:043:0 s 21 09 0300 0000 0008 8 = 51d56362 5326540e
ffff8801eff40480 1902615336 C Co:1:043:0 0 8 >
ffff8801eff40480 1902630157 S Co:1:043:0 s 21 09 0300 0000 0008 8 = a39bd1df 89ad8d70
ffff8801eff40480 1902630362 C Co:1:043:0 0 8 >
ffff8801eff40480 1902647148 S Co:1:043:0 s 21 09 0300 0000 0008 8 = a266992d c0ed5e7c
ffff8801eff40480 1902647367 C Co:1:043:0 0 8 >
ffff8801eff40480 1902662186 S Co:1:043:0 s 21 09 0300 0000 0008 8 = 0551dc27 3a95220d
ffff8801eff40480 1902662308 C Co:1:043:0 0 8 >
ffff8801eff40480 1902677216 S Co:1:043:0 s 21 09 0300 0000 0008 8 = 75fd0d0a ec984423
ffff8801eff40480 1902677332 C Co:1:043:0 0 8 >
ffff8801eff40480 1902694161 S Co:1:043:0 s 21 09 0300 0000 0008 8 = 140f74f6 fdacc961
ffff8801eff40480 1902694346 C Co:1:043:0 0 8 >
ffff8801eff40480 1902709111 S Co:1:043:0 s 21 09 0300 0000 0008 8 = f2aead72 4ccbc58f
ffff8801eff40480 1902709205 C Co:1:043:0 0 8 >
ffff8801eff40480 1902724172 S Co:1:043:0 s 21 09 0300 0000 0008 8 = 970728e7 e9b5e218
ffff8801eff40480 1902724328 C Co:1:043:0 0 8 >
ffff8801eff40480 1902741120 S Co:1:043:0 s 21 09 0300 0000 0008 8 = 7ecaa921 986ade8b
ffff8801eff40480 1902741334 C Co:1:043:0 0 8 >
ffff8801eff40480 1902756155 S Co:1:043:0 s 21 09 0300 0000 0008 8 = 96adc7d3 53b10b1c
ffff8801eff40480 1902756311 C Co:1:043:0 0 8 >
ffff8801eff40480 1902771205 S Co:1:043:0 s 21 09 0300 0000 0008 8 = c2e66f13 c796d021
ffff8801eff40480 1902771332 C Co:1:043:0 0 8 >
ffff8801eff40480 1902788122 S Co:1:043:0 s 21 09 0300 0000 0008 8 = 58b360d8 d4e52598
ffff8801eff40480 1902788312 C Co:1:043:0 0 8 >
ffff8801eff40480 1902803089 S Co:1:043:0 s 21 09 0300 0000 0008 8 = a3d4af81 10b3189e
ffff8801eff40480 1902803203 C Co:1:043:0 0 8 >
ffff8801eff40480 1902818180 S Co:1:043:0 s 21 09 0300 0000 0008 8 = 630d424f 42d44df7
ffff8801eff40480 1902818336 C Co:1:043:0 0 8 >
ffff8801eff40480 1902835174 S Co:1:043:0 s 21 09 0300 0000 0008 8 = 4aa757e7 e963788b
ffff8801eff40480 1902835327 C Co:1:043:0 0 8 >
ffff8801eff40480 1902850128 S Co:1:043:0 s 21 09 0300 0000 0008 8 = 7feefcd3 b540e3e5
ffff8801eff40480 1902850338 C Co:1:043:0 0 8 >
ffff8801eff40480 1902865164 S Co:1:043:0 s 21 09 0300 0000 0008 8 = 1db29601 0a8becb4
ffff8801eff40480 1902865338 C Co:1:043:0 0 8 >
ffff8801eff40480 1902880207 S Co:1:043:0 s 21 09 0300 0000 0008 8 = b2c85d40 832c854c
ffff8801eff40480 1902880345 C Co:1:043:0 0 8 >
ffff8801eff40480 1902895177 S Co:1:043:0 s 21 09 0300 0000 0008 8 = c289dcc8 6b4db423
ffff8801eff40480 1902895330 C Co:1:043:0 0 8 >
ffff8801eff40480 1902912160 S Co:1:043:0 s 21 09 0300 0000 0008 8 = 444f74b1 43dc1357
ffff8801eff40480 1902912331 C Co:1:043:0 0 8 >
ffff8801eff40480 1902927229 S Co:1:043:0 s 21 09 0300 0000 0008 8 = 22fdd878 410b5025
ffff8801eff40480 1902927334 C Co:1:043:0 0 8 >
ffff8801eff40480 1902944055 S Co:1:043:0 s 21 09 0300 0000 0008 8 = bc769080 ccd2ac71
ffff8801eff40480 1902944186 C Co:1:043:0 0 8 >
ffff8801eff40480 1902959155 S Co:1:043:0 s 21 09 0300 0000 0008 8 = 6323788d 036a7e43
ffff8801eff40480 1902959373 C Co:1:043:0 0 8 >
ffff8801eff40480 1902974174 S Co:1:043:0 s 21 09 0300 0000 0008 8 = e06f3f49 36d1af46
ffff8801eff40480 1902974381 C Co:1:043:0 0 8 >
ffff8801eff40480 1902989160 S Co:1:043:0 s 21 09 0300 0000 0008 8 = ec4cebc0 6a4b3d49
ffff8801eff40480 1902989329 C Co:1:043:0 0 8 >
ffff8801eff40480 1903006193 S Co:1:043:0 s 21 09 0300 0000 0008 8 = b7ae52e6 d7ddbac0
ffff8801eff40480 1903006333 C Co:1:043:0 0 8 >
ffff8801eff40480 1903021169 S Co:1:043:0 s 21 09 0300 0000 0008 8 = 640da10e 6bd2cc41
ffff8801eff40480 1903021314 C Co:1:043:0 0 8 >
ffff8801eff40480 1903036208 S Co:1:043:0 s 21 09 0300 0000 0008 8 = 8ae6d772 4738ad0a
ffff8801eff40480 1903036335 C Co:1:043:0 0 8 >
ffff8801eff40480 1903053132 S Co:1:043:0 s 21 09 0300 0000 0008 8 = b33848b0 3f62aa78
ffff8801eff40480 1903053322 C Co:1:043:0 0 8 >
ffff8801eff409c0 1903067876 S Co:1:043:0 s 21 09 0300 0000 0008 8 = de091c49 5c66a78f
ffff8801eff409c0 1903068067 C Co:1:043:0 0 8 >
ffff8801eff40a80 1903082811 S Co:1:043:0 s 21 09 0300 0000 0008 8 = fee1d023 5b9e9777
ffff8801eff40a80 1903082934 C Co:1:043:0 0 8 >
ffff8801eff40a80 1903100797 S Co:1:043:0 s 21 09 0300 0000 0008 8 = 7a4bb206 2d2906fb
ffff8801eff40a80 1903100974 C Co:1:043:0 0 8 >
ffff8801eff40a80 1903113916 S Co:1:043:0 s 21 09 0300 0000 0008 8 = ad596720 7769910a
ffff8801eff40a80 1903114061 C Co:1:043:0 0 8 >
ffff8801eff40a80 1903130884 S Co:1:043:0 s 21 09 0300 0000 0008 8 = 661f6683 11846a38
ffff8801eff40a80 1903131066 C Co:1:043:0 0 8 >
ffff8801eff40480 1903145909 S Co:1:043:0 s 21 09 0300 0000 0008 8 = 68347ca4 8ae6d73c
ffff8801eff40480 1903146065 C Co:1:043:0 0 8 >
ffff8801eff40480 1903160790 S Co:1:043:0 s 21 09 0300 0000 0008 8 = e93749dc a0bbb271
ffff8801eff40480 1903160962 C Co:1:043:0 0 8 >
ffff8801eff40a80 1903176831 S Co:1:043:0 s 21 09 0300 0000 0008 8 = 1446bfe8 ca77e857
ffff8801eff40a80 1903176965 C Co:1:043:0 0 8 >
ffff8801eff40a80 1903193887 S Co:1:043:0 s 21 09 0300 0000 0008 8 = 8987a86b b050fc12
ffff8801eff40a80 1903194065 C Co:1:043:0 0 8 >
ffff8801eff40a80 1903209797 S Co:1:043:0 s 21 09 0300 0000 0008 8 = daa11f69 b0c184e8
ffff8801eff40a80 1903209939 C Co:1:043:0 0 8 >
ffff8801eff40a80 1903224780 S Co:1:043:0 s 21 09 0300 0000 0008 8 = 0d4114cb 5907a9c4
ffff8801eff40a80 1903224955 C Co:1:043:0 0 8 >
ffff8801eff40a80 1903239858 S Co:1:043:0 s 21 09 0300 0000 0008 8 = 1f98cae0 f1a5a8b8
ffff8801eff40a80 1903239938 C Co:1:043:0 0 8 >
ffff8801eff40a80 1903254999 S Co:1:043:0 s 21 09 0300 0000 0008 8 = 7ed95ad9 f1e25574
ffff8801eff40a80 1903255188 C Co:1:043:0 0 8 >
ffff8801eff40a80 1903271765 S Co:1:043:0 s 21 09 0300 0000 0008 8 = 8cbe2f4a 854795d2
ffff8801eff40a80 1903271938 C Co:1:043:0 0 8 >
ffff8801eff40a80 1903286854 S Co:1:043:0 s 21 09 0300 0000 0008 8 = 21028aad 0f24e24d
ffff8801eff40a80 1903286942 C Co:1:043:0 0 8 >
ffff8801eff40a80 1903301888 S Co:1:043:0 s 21 09 0300 0000 0008 8 = 07e6fee1 a30bc983
ffff8801eff40a80 1903302087 C Co:1:043:0 0 8 >
ffff8801eff40a80 1903317054 S Co:1:043:0 s 21 09 0300 0000 0008 8 = 7daef3a5 8a516db8
ffff8801eff40a80 1903317213 C Co:1:043:0 0 8 >
ffff8801eff40a80 1903333849 S Co:1:043:0 s 21 09 0300 0000 0008 8 = b723261f c2920454
ffff8801eff40a80 1903333961 C Co:1:043:0 0 8 >
ffff8801eff40a80 1903348888 S Co:1:043:0 s 21 09 0300 0000 0008 8 = 5a112559 7a2b5662
ffff8801eff40a80 1903349066 C Co:1:043:0 0 8 >
ffff8801eff40a80 1903363719 S Co:1:043:0 s 21 09 0300 0000 0008 8 = 03c9d4c1 98c04311
ffff8801eff40a80 1903363812 C Co:1:043:0 0 8 >
ffff8804031769c0 1903380780 S Co:1:043:0 s 21 09 0300 0000 0008 8 = bf9eeda7 35b63c35
ffff8804031769c0 1903380940 C Co:1:043:0 0 8 >
ffff8803eb86f6c0 1903395844 S Co:1:043:0 s 21 09 0300 0000 0008 8 = 92697ac0 1eb7c7c5
ffff8803eb86f6c0 1903395940 C Co:1:043:0 0 8 >
ffff8803eb86f6c0 1903410884 S Co:1:043:0 s 21 09 0300 0000 0008 8 = f2075ba7 5334fe5d
ffff8803eb86f6c0 1903411062 C Co:1:043:0 0 8 >
ffff8803eb86f6c0 1903427824 S Co:1:043:0 s 21 09 0300 0000 0008 8 = 4bd8c459 89dc0ebb
ffff8803eb86f6c0 1903427962 C Co:1:043:0 0 8 >
ffff8803eb86f6c0 1903442856 S Co:1:043:0 s 21 09 0300 0000 0008 8 = 7b40beb7 a928ba43
ffff8803eb86f6c0 1903442960 C Co:1:043:0 0 8 >
ffff8802486c5e40 1903457911 S Co:1:043:0 s 21 09 0300 0000 0008 8 = 5528a306 51d1d77d
ffff8802486c5e40 1903458067 C Co:1:043:0 0 8 >
ffff8802486c5e40 1903473811 S Co:1:043:0 s 21 09 0300 0000 0008 8 = 207ca56f 5156cf94
ffff8802486c5e40 1903473962 C Co:1:043:0 0 8 >
ffff8803eb86f6c0 1903489857 S Co:1:043:0 s 21 09 0300 0000 0008 8 = 17ac4681 2d7821d7
ffff8803eb86f6c0 1903489948 C Co:1:043:0 0 8 >
ffff8803eb86f6c0 1903504882 S Co:1:043:0 s 21 09 0300 0000 0008 8 = e92ddfad 9fc0de3a
ffff8803eb86f6c0 1903505067 C Co:1:043:0 0 8 >
ffff8802486c5e40 1903521791 S Co:1:043:0 s 21 09 0300 0000 0008 8 = 39f71bc7 14f62cd4
ffff8802486c5e40 1903521977 C Co:1:043:0 0 8 >
ffff8801eff40a80 1903536830 S Co:1:043:0 s 21 09 0300 0000 0008 8 = 1d077b8a 2ca9c461
ffff8801eff40a80 1903536942 C Co:1:043:0 0 8 >
ffff8801eff40a80 1903551809 S Co:1:043:0 s 21 09 0300 0000 0008 8 = a0dcd212 3cac75bf
ffff8801eff40a80 1903551941 C Co:1:043:0 0 8 >
ffff8801eff40a80 1903567780 S Co:1:043:0 s 21 09 0300 0000 0008 8 = 42fcc861 ce95a172
ffff8801eff40a80 1903567985 C Co:1:043:0 0 8 >
ffff8801eff40a80 1903583826 S Co:1:043:0 s 21 09 0300 0000 0008 8 = 756f59dd 1e3ebd22
ffff8801eff40a80 1903583987 C Co:1:043:0 0 8 >
ffff8801eff40a80 1903598857 S Co:1:043:0 s 21 09 0300 0000 0008 8 = 1f4054ce 9c46d41a
ffff8801eff40a80 1903598970 C Co:1:043:0 0 8 >
ffff8801eff40a80 1903615776 S Co:1:043:0 s 21 09 0300 0000 0008 8 = 1d01dfe2 6f8f02ca
ffff8801eff40a80 1903615961 C Co:1:043:0 0 8 >
ffff8801eff40a80 1903630815 S Co:1:043:0 s 21 09 0300 0000 0008 8 = bd46f0ab eec0fb44
ffff8801eff40a80 1903630943 C Co:1:043:0 0 8 >
ffff8801eff40a80 1903645798 S Co:1:043:0 s 21 09 0300 0000 0008 8 = 4127d41e 27c284c0
ffff8801eff40a80 1903645940 C Co:1:043:0 0 8 >
ffff8804065d83c0 1903660931 S Co:1:043:0 s 21 09 0300 0000 0008 8 = 61c1aa14 5a45f619
ffff8804065d83c0 1903661079 C Co:1:043:0 0 8 >
ffff8803eb86f6c0 1903677802 S Co:1:043:0 s 21 09 0300 0000 0008 8 = c7b3e6cb 7d3ac04f
ffff8803eb86f6c0 1903677965 C Co:1:043:0 0 8 >
ffff8803eb86f6c0 1903692838 S Co:1:043:0 s 21 09 0300 0000 0008 8 = 92a3d164 b858e406
ffff8803eb86f6c0 1903692963 C Co:1:043:0 0 8 >
ffff8803eb86f6c0 1903709834 S Co:1:043:0 s 21 09 0300 0000 0008 8 = d5b80564 e79a7704
ffff8803eb86f6c0 1903709941 C Co:1:043:0 0 8 >
ffff8803eb86f6c0 1903724796 S Co:1:043:0 s 21 09 0300 0000 0008 8 = 181ff334 1dbd23b5
ffff8803eb86f6c0 1903724944 C Co:1:043:0 0 8 >
ffff8802486c5e40 1903739823 S Co:1:043:0 s 21 09 0300 0000 0008 8 = d4895fa3 1ec5a7a8
ffff8802486c5e40 1903739965 C Co:1:043:0 0 8 >
ffff8802486c5e40 1903754920 S Co:1:043:0 s 21 09 0300 0000 0008 8 = faaae162 e2765411
ffff8802486c5e40 1903755070 C Co:1:043:0 0 8 >
ffff8802486c5e40 1903771778 S Co:1:043:0 s 21 09 0300 0000 0008 8 = 6ab96485 17dd8f47
ffff8802486c5e40 1903771943 C Co:1:043:0 0 8 >
ffff8802486c5e40 1903786751 S Co:1:043:0 s 21 09 0300 0000 0008 8 = 7ef5a807 9ec75346
ffff8802486c5e40 1903786940 C Co:1:043:0 0 8 >
ffff8804031769c0 1903801824 S Co:1:043:0 s 21 09 0300 0000 0008 8 = 7e1cc244 0a47ae2c
ffff8804031769c0 1903801956 C Co:1:043:0 0 8 >
ffff8804065d83c0 1903818910 S Co:1:043:0 s 21 09 0300 0000 0008 8 = 2bf3997e 263242be
ffff8804065d83c0 1903819096 C Co:1:043:0 0 8 >
ffff8804065d83c0 1903833739 S Co:1:043:0 s 21 09 0300 0000 0008 8 = 38c3695b 6ea4c4e2
ffff8804065d83c0 1903833834 C Co:1:043:0 0 8 >
ffff8804065d83c0 1903848836 S Co:1:043:0 s 21 09 0300 0000 0008 8 = cad94163 937a7e24
ffff8804065d83c0 1903848961 C Co:1:043:0 0 8 >
ffff8804065d83c0 1903865896 S Co:1:043:0 s 21 09 0300 0000 0008 8 = fd038785 fad8cf33
ffff8804065d83c0 1903866091 C Co:1:043:0 0 8 >
ffff8804065d83c0 1903880799 S Co:1:043:0 s 21 09 0300 0000 0008 8 = 60177191 3ca3a763
ffff8804065d83c0 1903880966 C Co:1:043:0 0 8 >
ffff8804065d83c0 1903895819 S Co:1:043:0 s 21 09 0300 0000 0008 8 = 756e8bbd a5060e2b
ffff8804065d83c0 1903895965 C Co:1:043:0 0 8 >
ffff8804031769c0 1903912915 S Co:1:043:0 s 21 09 0300 0000 0008 8 = 34633622 b7ef9ca7
ffff8804031769c0 1903913092 C Co:1:043:0 0 8 >
ffff8804031769c0 1903927731 S Co:1:043:0 s 21 09 0300 0000 0008 8 = 87d7253e a5910015
ffff8804031769c0 1903927836 C Co:1:043:0 0 8 >
ffff8804031769c0 1903942814 S Co:1:043:0 s 21 09 0300 0000 0008 8 = ceaee071 dbe27b5a
ffff8804031769c0 1903942947 C Co:1:043:0 0 8 >
ffff8804031769c0 1903959866 S Co:1:043:0 s 21 09 0300 0000 0008 8 = 5b514383 731c647c
ffff8804031769c0 1903959971 C Co:1:043:0 0 8 >
ffff8802486c5e40 1903974910 S Co:1:043:0 s 21 09 0300 0000 0008 8 = f52cfe1a bf3ea427
ffff8802486c5e40 1903975072 C Co:1:043:0 0 8 >
ffff8804031769c0 1903989813 S Co:1:043:0 s 21 09 0300 0000 0008 8 = 562f1546 c48a3a2a
ffff8804031769c0 1903989943 C Co:1:043:0 0 8 >
ffff8804031769c0 1904006858 S Co:1:043:0 s 21 09 0300 0000 0008 8 = af4f60f8 bb06b6f9
ffff8804031769c0 1904006969 C Co:1:043:0 0 8 >
ffff8804031769c0 1904021898 S Co:1:043:0 s 21 09 0300 0000 0008 8 = 21050984 90fdbf2b
ffff8804031769c0 1904022092 C Co:1:043:0 0 8 >
ffff8804031769c0 1904036792 S Co:1:043:0 s 21 09 0300 0000 0008 8 = 44cc1325 657e90fc
ffff8804031769c0 1904036972 C Co:1:043:0 0 8 >
ffff8804065d83c0 1904054821 S Co:1:043:0 s 21 09 0300 0000 0008 8 = a2a4cf77 0eda74ca
ffff8804065d83c0 1904054962 C Co:1:043:0 0 8 >
ffff8804065d8f00 1904068054 S Co:1:043:0 s 21 09 0300 0000 0008 8 = 3a9367fd 9428509a
ffff8804065d8f00 1904068216 C Co:1:043:0 0 8 >
ffff8803eb86ff00 1904084710 S Co:1:043:0 s 21 09 0300 0000 0008 8 = 0021559a b4c21892
ffff8803eb86ff00 1904084836 C Co:1:043:0 0 8 >
ffff8803eb86f6c0 1904099745 S Co:1:043:0 s 21 09 0300 0000 0008 8 = 59daeb1a 60c8567e
ffff8803eb86f6c0 1904099962 C Co:1:043:0 0 8 >
ffff8802486c5000 1904114821 S Co:1:043:0 s 21 09 0300 0000 0008 8 = a1cecba8 3b9aa84d
ffff8802486c5000 1904114965 C Co:1:043:0 0 8 >
ffff8804065d8e40 1904130702 S Co:1:043:0 s 21 09 0300 0000 0008 8 = a7126e57 1f604093
ffff8804065d8e40 1904130843 C Co:1:043:0 0 8 >
ffff8804065d8780 1904145743 S Co:1:043:0 s 21 09 0300 0000 0008 8 = 2e3e9f9c 98836408
ffff8804065d8780 1904145839 C Co:1:043:0 0 8 >
ffff8804065d8e40 1904160821 S Co:1:043:0 s 21 09 0300 0000 0008 8 = 6deeffd1 6833ef05
ffff8804065d8e40 1904160960 C Co:1:043:0 0 8 >
ffff8804065d8e40 1904177872 S Co:1:043:0 s 21 09 0300 0000 0008 8 = 8d4481b1 03e1cc0c
ffff8804065d8e40 1904178094 C Co:1:043:0 0 8 >
ffff8804065d8e40 1904192768 S Co:1:043:0 s 21 09 0300 0000 0008 8 = 2f63ede0 13c4803e
ffff8804065d8e40 1904192968 C Co:1:043:0 0 8 >
ffff8804065d8e40 1904207838 S Co:1:043:0 s 21 09 0300 0000 0008 8 = e5f35f62 f3579ee4
ffff8804065d8e40 1904207947 C Co:1:043:0 0 8 >
ffff8804065d8e40 1904224890 S Co:1:043:0 s 21 09 0300 0000 0008 8 = b6a2c721 36d852e9
ffff8804065d8e40 1904225073 C Co:1:043:0 0 8 >
ffff8804065d8e40 1904239759 S Co:1:043:0 s 21 09 0300 0000 0008 8 = 9e9f686a 1fc8d95d
ffff8804065d8e40 1904239969 C Co:1:043:0 0 8 >
ffff8804065d8e40 1904255296 S Co:1:043:0 s 21 09 0300 0000 0008 8 = 091e5b6f 286f06f2
ffff8804065d8e40 1904255473 C Co:1:043:0 0 8 >
ffff8803eb86f6c0 1904271849 S Co:1:043:0 s 21 09 0300 0000 0008 8 = 5dd90cc5 7d57bd80
ffff8803eb86f6c0 1904271972 C Co:1:043:0 0 8 >
ffff8803eb86f6c0 1904286686 S Co:1:043:0 s 21 09 0300 0000 0008 8 = 6f8bbae4 80ce7983
ffff8803eb86f6c0 1904286821 C Co:1:043:0 0 8 >
ffff8803eb86f6c0 1904301780 S Co:1:043:0 s 21 09 0300 0000 0008 8 = 0a76faac 4667c799
ffff8803eb86f6c0 1904301954 C Co:1:043:0 0 8 >
ffff8803eb86f6c0 1904318839 S Co:1:043:0 s 21 09 0300 0000 0008 8 = 6edc32dc 1677cb07
ffff8803eb86f6c0 1904318969 C Co:1:043:0 0 8 >
ffff8802486c5000 1904333905 S Co:1:043:0 s 21 09 0300 0000 0008 8 = cc881f9b ef9ab833
ffff8802486c5000 1904334094 C Co:1:043:0 0 8 >
ffff8804031760c0 1904348770 S Co:1:043:0 s 21 09 0300 0000 0008 8 = cd4452f1 012e5a29
ffff8804031760c0 1904348950 C Co:1:043:0 0 8 >
ffff8804065d8e40 1904365771 S Co:1:043:0 s 21 09 0300 0000 0008 8 = 0b61ad4d 30d58e19
ffff8804065d8e40 1904365974 C Co:1:043:0 0 8 >
ffff8804031760c0 1904380799 S Co:1:043:0 s 21 09 0300 0000 0008 8 = 9435e8ff 96f5c6d5
ffff8804031760c0 1904380949 C Co:1:043:0 0 8 >
ffff8804065d8e40 1904395704 S Co:1:043:0 s 21 09 0300 0000 0008 8 = 6c9710bd 00398855
ffff8804065d8e40 1904395840 C Co:1:043:0 0 8 >
ffff8804065d8e40 1904412761 S Co:1:043:0 s 21 09 0300 0000 0008 8 = 0a630520 6e0fee35
ffff8804065d8e40 1904412965 C Co:1:043:0 0 8 >
ffff8802486c59c0 1904427794 S Co:1:043:0 s 21 09 0300 0000 0008 8 = d8fafa26 962a2633
ffff8802486c59c0 1904427948 C Co:1:043:0 0 8 >
ffff8804031760c0 1904442689 S Co:1:043:0 s 21 09 0300 0000 0008 8 = b5c0f6b0 6000f1b4
ffff8804031760c0 1904442824 C Co:1:043:0 0 8 >
ffff8804031760c0 1904459747 S Co:1:043:0 s 21 09 0300 0000 0008 8 = 759e5703 684b253e
ffff8804031760c0 1904459971 C Co:1:043:0 0 8 >
ffff8804065d8e40 1904474782 S Co:1:043:0 s 21 09 0300 0000 0008 8 = 5d804c49 818a2dfd
ffff8804065d8e40 1904474952 C Co:1:043:0 0 8 >
ffff8804065d8e40 1904489816 S Co:1:043:0 s 21 09 0300 0000 0008 8 = aad75810 2f7f8641
ffff8804065d8e40 1904489950 C Co:1:043:0 0 8 >
ffff8804065d8e40 1904520757 S Co:1:043:0 s 21 09 0300 0000 0008 8 = 5503b77f a4568802
ffff8804065d8e40 1904520968 C Co:1:043:0 0 8 >
ffff8802486c59c0 1904553723 S Ci:1:043:0 s a1 01 0300 0000 0008 8 <
ffff8802486c59c0 1904553828 C Ci:1:043:0 0 8 = aa040000 00000000
ffff8803e325fe40 1929911004 S Co:1:043:0 s 21 09 0300 0000 0008 8 = 55010100 00ff075d
ffff8803e325fe40 1929911174 C Co:1:043:0 0 8 >
ffff8803e325fe40 1929955927 S Ci:1:043:0 s a1 01 0300 0000 0008 8 <
ffff8803e325fe40 1929956064 C Ci:1:043:0 0 8 = aa020000 00000000
ffff8803e325f780 1929974081 S Co:1:043:0 s 21 09 0300 0000 0008 8 = 0b030101 00001018
ffff8803e325f780 1929974291 C Co:1:043:0 0 8 >
ffff8803ed332000 1929992056 S Co:1:043:0 s 21 09 0300 0000 0008 8 = 5cd90a74 46fd5984
ffff8803ed332000 1929992192 C Co:1:043:0 0 8 >
ffff8803ed332f00 1930005069 S Co:1:043:0 s 21 09 0300 0000 0008 8 = ffffff01 00ffffff
ffff8803ed332f00 1930005191 C Co:1:043:0 0 8 >
ffff8803ed160540 1930022125 S Co:1:043:0 s 21 09 0300 0000 0008 8 = ffffffff ffffffff
ffff8803ed160540 1930022316 C Co:1:043:0 0 8 >
ffff8803e6cd7a80 1930037172 S Co:1:043:0 s 21 09 0300 0000 0008 8 = ffffffff ffffffff
ffff8803e6cd7a80 1930037311 C Co:1:043:0 0 8 >
ffff8803ed332c00 1930052100 S Co:1:043:0 s 21 09 0300 0000 0008 8 = ffffffff ffffffff
ffff8803ed332c00 1930052354 C Co:1:043:0 0 8 >
ffff8803ed332c00 1930068049 S Co:1:043:0 s 21 09 0300 0000 0008 8 = 80ffffff ffffffff
ffff8803ed332c00 1930068167 C Co:1:043:0 0 8 >
ffff8803ed332000 1930083218 S Co:1:043:0 s 21 09 0300 0000 0008 8 = ffffffff ffffffff
ffff8803ed332000 1930083442 C Co:1:043:0 0 8 >
ffff8803ed332000 1930100054 S Co:1:043:0 s 21 09 0300 0000 0008 8 = ffffffff ffffffff
ffff8803ed332000 1930100192 C Co:1:043:0 0 8 >
ffff8803ed332000 1930115025 S Co:1:043:0 s 21 09 0300 0000 0008 8 = f7fff7f7 fff7f7ff
ffff8803ed332000 1930115182 C Co:1:043:0 0 8 >
ffff8803ed332000 1930130369 S Co:1:043:0 s 21 09 0300 0000 0008 8 = f7f7fff7 f7fff7f7
ffff8803ed332000 1930130568 C Co:1:043:0 0 8 >
ffff8803ed160240 1930147029 S Co:1:043:0 s 21 09 0300 0000 0008 8 = fff7f7ff f7f7fff7
ffff8803ed160240 1930147217 C Co:1:043:0 0 8 >
ffff8803e6cd73c0 1930162083 S Co:1:043:0 s 21 09 0300 0000 0008 8 = f7fff7f7 fff7f7ff
ffff8803e6cd73c0 1930162199 C Co:1:043:0 0 8 >
ffff8803e6cd73c0 1930177497 S Co:1:043:0 s 21 09 0300 0000 0008 8 = f7f7fff7 f7fff7f7
ffff8803e6cd73c0 1930177698 C Co:1:043:0 0 8 >
ffff8803e6cd73c0 1930194162 S Co:1:043:0 s 21 09 0300 0000 0008 8 = fff7f7ff f7f7fff7
ffff8803e6cd73c0 1930194320 C Co:1:043:0 0 8 >
ffff8803e6cd73c0 1930209019 S Co:1:043:0 s 21 09 0300 0000 0008 8 = f7fff7f7 fff7f7ff
ffff8803e6cd73c0 1930209188 C Co:1:043:0 0 8 >
ffff8803e6cd73c0 1930224100 S Co:1:043:0 s 21 09 0300 0000 0008 8 = f7f7fff7 f7fff7f7
ffff8803e6cd73c0 1930224297 C Co:1:043:0 0 8 >
ffff8803e6cd73c0 1930241145 S Co:1:043:0 s 21 09 0300 0000 0008 8 = fff7f7ff f7f7fff7
ffff8803e6cd73c0 1930241309 C Co:1:043:0 0 8 >
ffff8803e6cd73c0 1930255991 S Co:1:043:0 s 21 09 0300 0000 0008 8 = f7fff7f7 fff7f7ff
ffff8803e6cd73c0 1930256169 C Co:1:043:0 0 8 >
ffff8803e6cd7480 1930271092 S Co:1:043:0 s 21 09 0300 0000 0008 8 = f7f7fff7 f7fff7f7
ffff8803e6cd7480 1930271194 C Co:1:043:0 0 8 >
ffff8803e6cd7a80 1930286284 S Co:1:043:0 s 21 09 0300 0000 0008 8 = fff7f7ff f7f7fff7
ffff8803e6cd7a80 1930286444 C Co:1:043:0 0 8 >
ffff8803ed332000 1930302171 S Co:1:043:0 s 21 09 0300 0000 0008 8 = f7fff7f7 fff7f7ff
ffff8803ed332000 1930302322 C Co:1:043:0 0 8 >
ffff8803ed332000 1930319085 S Co:1:043:0 s 21 09 0300 0000 0008 8 = f7f7fff7 f7fff7f7
ffff8803ed332000 1930319193 C Co:1:043:0 0 8 >
ffff8803ed160540 1930334154 S Co:1:043:0 s 21 09 0300 0000 0008 8 = fff7f7ff f7f7fff7
ffff8803ed160540 1930334325 C Co:1:043:0 0 8 >
ffff8803ed160540 1930349157 S Co:1:043:0 s 21 09 0300 0000 0008 8 = f7fff7f7 fff7f7ff
ffff8803ed160540 1930349306 C Co:1:043:0 0 8 >
ffff88040749f840 1930366052 S Co:1:043:0 s 21 09 0300 0000 0008 8 = f7f7fff7 f7fff7f7
ffff88040749f840 1930366175 C Co:1:043:0 0 8 >
ffff8803e6cd7180 1930381103 S Co:1:043:0 s 21 09 0300 0000 0008 8 = fff7f7ff f7f7fff7
ffff8803e6cd7180 1930381301 C Co:1:043:0 0 8 >
ffff8803e6cd7480 1930396149 S Co:1:043:0 s 21 09 0300 0000 0008 8 = f7fff7f7 fff7f7ff
ffff8803e6cd7480 1930396307 C Co:1:043:0 0 8 >
ffff8803e6cd7180 1930413042 S Co:1:043:0 s 21 09 0300 0000 0008 8 = f7f7fff7 f7fff7f7
ffff8803e6cd7180 1930413172 C Co:1:043:0 0 8 >
ffff8803e6cd7480 1930428088 S Co:1:043:0 s 21 09 0300 0000 0008 8 = fff7f7ff f7f7fff7
ffff8803e6cd7480 1930428196 C Co:1:043:0 0 8 >
ffff8803e6cd7480 1930444143 S Co:1:043:0 s 21 09 0300 0000 0008 8 = f7fff7f7 fff7f7ff
ffff8803e6cd7480 1930444300 C Co:1:043:0 0 8 >
ffff8803e6cd7480 1930459044 S Co:1:043:0 s 21 09 0300 0000 0008 8 = f7f7fff7 f7fff7f7
ffff8803e6cd7480 1930459198 C Co:1:043:0 0 8 >
ffff8803e6cd7480 1930473228 S Co:1:043:0 s 21 09 0300 0000 0008 8 = fff7f7ff f7f7fff7
ffff8803e6cd7480 1930473426 C Co:1:043:0 0 8 >
ffff8803e6cd7480 1930490132 S Co:1:043:0 s 21 09 0300 0000 0008 8 = 83d3b197 7efa6609
ffff8803e6cd7480 1930490301 C Co:1:043:0 0 8 >
ffff8803e6cd7480 1930505115 S Co:1:043:0 s 21 09 0300 0000 0008 8 = 7284c1e1 beb1e7a7
ffff8803e6cd7480 1930505316 C Co:1:043:0 0 8 >
ffff8803e6cd7480 1930520044 S Co:1:043:0 s 21 09 0300 0000 0008 8 = 6bea0a83 fbfdce97
ffff8803e6cd7480 1930520173 C Co:1:043:0 0 8 >
ffff8803e6cd7480 1930537054 S Co:1:043:0 s 21 09 0300 0000 0008 8 = 7498fe9e ad086fc5
ffff8803e6cd7480 1930537172 C Co:1:043:0 0 8 >
ffff8803e6cd70c0 1930552147 S Co:1:043:0 s 21 09 0300 0000 0008 8 = d93235ca 51d20553
ffff8803e6cd70c0 1930552301 C Co:1:043:0 0 8 >
ffff8803ed332d80 1930566996 S Co:1:043:0 s 21 09 0300 0000 0008 8 = a6f3ea91 e7af2c15
ffff8803ed332d80 1930567172 C Co:1:043:0 0 8 >
ffff8803ed332d80 1930584094 S Co:1:043:0 s 21 09 0300 0000 0008 8 = 2f297ef2 73c86714
ffff8803ed332d80 1930584196 C Co:1:043:0 0 8 >
ffff8803ed332d80 1930599139 S Co:1:043:0 s 21 09 0300 0000 0008 8 = 8ab5f2e0 7e98990e
ffff8803ed332d80 1930599300 C Co:1:043:0 0 8 >
ffff8803ed332d80 1930614070 S Co:1:043:0 s 21 09 0300 0000 0008 8 = 128e6fc3 936e8ef2
ffff8803ed332d80 1930614173 C Co:1:043:0 0 8 >
ffff88040749f840 1930630015 S Co:1:043:0 s 21 09 0300 0000 0008 8 = e43dc0f4 c4ef7166
ffff88040749f840 1930630196 C Co:1:043:0 0 8 >
ffff88040749f840 1930645151 S Co:1:043:0 s 21 09 0300 0000 0008 8 = 6361d543 25935543
ffff88040749f840 1930645301 C Co:1:043:0 0 8 >
ffff8803e6cd70c0 1930662104 S Co:1:043:0 s 21 09 0300 0000 0008 8 = b62a4073 4e25af15
ffff8803e6cd70c0 1930662317 C Co:1:043:0 0 8 >
ffff8803e6cd70c0 1930677002 S Co:1:043:0 s 21 09 0300 0000 0008 8 = 46dfb9ba dc46d99e
ffff8803e6cd70c0 1930677190 C Co:1:043:0 0 8 >
ffff8803e6cd7180 1930692036 S Co:1:043:0 s 21 09 0300 0000 0008 8 = 435a9c44 efe98e52
ffff8803e6cd7180 1930692190 C Co:1:043:0 0 8 >
ffff8803ed1603c0 1930709174 S Co:1:043:0 s 21 09 0300 0000 0008 8 = 1e8967af aad672db
ffff8803ed1603c0 1930709303 C Co:1:043:0 0 8 >
ffff88040749f840 1930724036 S Co:1:043:0 s 21 09 0300 0000 0008 8 = 0fed3f8e b8298994
ffff88040749f840 1930724185 C Co:1:043:0 0 8 >
ffff88040749f840 1930739087 S Co:1:043:0 s 21 09 0300 0000 0008 8 = 8e1d6ae8 c3d2bd10
ffff88040749f840 1930739264 C Co:1:043:0 0 8 >
ffff88040749f840 1930756136 S Co:1:043:0 s 21 09 0300 0000 0008 8 = dc42d4b8 fd145b92
ffff88040749f840 1930756304 C Co:1:043:0 0 8 >
ffff88040749f840 1930770980 S Co:1:043:0 s 21 09 0300 0000 0008 8 = 799a8c6d 9a099594
ffff88040749f840 1930771192 C Co:1:043:0 0 8 >
ffff8803ed1603c0 1930786076 S Co:1:043:0 s 21 09 0300 0000 0008 8 = adf7466a 521a0043
ffff8803ed1603c0 1930786195 C Co:1:043:0 0 8 >
ffff88040749f840 1930803137 S Co:1:043:0 s 21 09 0300 0000 0008 8 = 023fda85 e18914ff
ffff88040749f840 1930803303 C Co:1:043:0 0 8 >
ffff8803e6cd70c0 1930818109 S Co:1:043:0 s 21 09 0300 0000 0008 8 = c6ecc189 88eab1dd
ffff8803e6cd70c0 1930818318 C Co:1:043:0 0 8 >
ffff8803ed332d80 1930833096 S Co:1:043:0 s 21 09 0300 0000 0008 8 = 8c8c9db6 8ca39627
ffff8803ed332d80 1930833311 C Co:1:043:0 0 8 >
ffff8803ed332d80 1930850179 S Co:1:043:0 s 21 09 0300 0000 0008 8 = a940af3d b471ead8
ffff8803ed332d80 1930850306 C Co:1:043:0 0 8 >
ffff8803ed1603c0 1930865141 S Co:1:043:0 s 21 09 0300 0000 0008 8 = b93f61c7 cee5b523
ffff8803ed1603c0 1930865304 C Co:1:043:0 0 8 >
ffff88040749f840 1930880050 S Co:1:043:0 s 21 09 0300 0000 0008 8 = 1a52bcee 28e166ec
ffff88040749f840 1930880192 C Co:1:043:0 0 8 >
ffff88040749f840 1930897134 S Co:1:043:0 s 21 09 0300 0000 0008 8 = 6e57f0c0 191d4d4b
ffff88040749f840 1930897305 C Co:1:043:0 0 8 >
ffff8803ed1603c0 1930912148 S Co:1:043:0 s 21 09 0300 0000 0008 8 = 1bc0d141 77a7200d
ffff8803ed1603c0 1930912304 C Co:1:043:0 0 8 >
ffff8803ed1603c0 1930926980 S Co:1:043:0 s 21 09 0300 0000 0008 8 = cc1356e8 205c7835
ffff8803ed1603c0 1930927175 C Co:1:043:0 0 8 >
ffff88040749f840 1930942285 S Co:1:043:0 s 21 09 0300 0000 0008 8 = ef6a1b1f 75725375
ffff88040749f840 1930942445 C Co:1:043:0 0 8 >
ffff88040749f840 1930959167 S Co:1:043:0 s 21 09 0300 0000 0008 8 = 37f2dfc5 d8f092b8
ffff88040749f840 1930959325 C Co:1:043:0 0 8 >
ffff8803ed1603c0 1930974109 S Co:1:043:0 s 21 09 0300 0000 0008 8 = 1a6e04ae 33317a9a
ffff8803ed1603c0 1930974300 C Co:1:043:0 0 8 >
ffff8803ed1603c0 1930989030 S Co:1:043:0 s 21 09 0300 0000 0008 8 = 53b4131f 726735ec
ffff8803ed1603c0 1930989178 C Co:1:043:0 0 8 >
ffff88040749f840 1931006123 S Co:1:043:0 s 21 09 0300 0000 0008 8 = 5e2d3854 05145032
ffff88040749f840 1931006305 C Co:1:043:0 0 8 >
ffff88040749f840 1931021164 S Co:1:043:0 s 21 09 0300 0000 0008 8 = 0157c0fd 62913d26
ffff88040749f840 1931021334 C Co:1:043:0 0 8 >
ffff88040749f840 1931036088 S Co:1:043:0 s 21 09 0300 0000 0008 8 = bf44a0ba 7f8ad135
ffff88040749f840 1931036203 C Co:1:043:0 0 8 >
ffff8803e6cd7540 1931053050 S Co:1:043:0 s 21 09 0300 0000 0008 8 = 641af0a5 5a7ec400
ffff8803e6cd7540 1931053179 C Co:1:043:0 0 8 >
ffff88040749f540 1931070327 S Co:1:043:0 s 21 09 0300 0000 0008 8 = 7f9369c6 734136da
ffff88040749f540 1931070443 C Co:1:043:0 0 8 >
ffff88040749f540 1931083214 S Co:1:043:0 s 21 09 0300 0000 0008 8 = e17ced9e 4e7b264e
ffff88040749f540 1931083317 C Co:1:043:0 0 8 >
ffff8803e6cd70c0 1931099190 S Co:1:043:0 s 21 09 0300 0000 0008 8 = 2138fd9f f428fb98
ffff8803e6cd70c0 1931099302 C Co:1:043:0 0 8 >
ffff8803ed1603c0 1931114448 S Co:1:043:0 s 21 09 0300 0000 0008 8 = 1a3c43b0 7119fe29
ffff8803ed1603c0 1931114562 C Co:1:043:0 0 8 >
ffff88040749f240 1931130213 S Co:1:043:0 s 21 09 0300 0000 0008 8 = 699308ac 556fdb26
ffff88040749f240 1931130303 C Co:1:043:0 0 8 >
ffff8803ed332000 1931146289 S Co:1:043:0 s 21 09 0300 0000 0008 8 = f25abce2 352526e7
ffff8803ed332000 1931146430 C Co:1:043:0 0 8 >
ffff8803ed160180 1931161284 S Co:1:043:0 s 21 09 0300 0000 0008 8 = 59437494 2985d27b
ffff8803ed160180 1931161450 C Co:1:043:0 0 8 >
ffff8803e6cd7540 1931177331 S Co:1:043:0 s 21 09 0300 0000 0008 8 = 8b14657a 4eafb920
ffff8803e6cd7540 1931177441 C Co:1:043:0 0 8 >
ffff8803e6cd7540 1931192258 S Co:1:043:0 s 21 09 0300 0000 0008 8 = 35266c3f 431819cd
ffff8803e6cd7540 1931192444 C Co:1:043:0 0 8 >
ffff8803e6cd7540 1931209280 S Co:1:043:0 s 21 09 0300 0000 0008 8 = 49e98700 ae0613aa
ffff8803e6cd7540 1931209431 C Co:1:043:0 0 8 >
ffff8803ed1603c0 1931224323 S Co:1:043:0 s 21 09 0300 0000 0008 8 = 7f5d5bd2 b7172c94
ffff8803ed1603c0 1931224453 C Co:1:043:0 0 8 >
ffff88040749f240 1931241175 S Co:1:043:0 s 21 09 0300 0000 0008 8 = d098ae3b 8ab9ce9c
ffff88040749f240 1931241320 C Co:1:043:0 0 8 >
ffff8803e6cd7180 1931256255 S Co:1:043:0 s 21 09 0300 0000 0008 8 = fa45ecb5 d7b2c787
ffff8803e6cd7180 1931256440 C Co:1:043:0 0 8 >
ffff8803ed332a80 1931271358 S Co:1:043:0 s 21 09 0300 0000 0008 8 = 0120a531 5297c64e
ffff8803ed332a80 1931271582 C Co:1:043:0 0 8 >
ffff8803ed332a80 1931288219 S Co:1:043:0 s 21 09 0300 0000 0008 8 = aa7d0b90 3557e39d
ffff8803ed332a80 1931288362 C Co:1:043:0 0 8 >
ffff8803ed332a80 1931301173 S Co:1:043:0 s 21 09 0300 0000 0008 8 = 00c1772a bcaf1656
ffff8803ed332a80 1931301302 C Co:1:043:0 0 8 >
ffff88040749f240 1931318296 S Co:1:043:0 s 21 09 0300 0000 0008 8 = d1e6e249 a6b5bc0d
ffff88040749f240 1931318433 C Co:1:043:0 0 8 >
ffff88040749f240 1931333330 S Co:1:043:0 s 21 09 0300 0000 0008 8 = 30f96eac b950188b
ffff88040749f240 1931333430 C Co:1:043:0 0 8 >
ffff88040749f240 1931348221 S Co:1:043:0 s 21 09 0300 0000 0008 8 = f29ddd06 3cbcce4d
ffff88040749f240 1931348329 C Co:1:043:0 0 8 >
ffff88040749f240 1931365287 S Co:1:043:0 s 21 09 0300 0000 0008 8 = 3487167f 7d096704
ffff88040749f240 1931365433 C Co:1:043:0 0 8 >
ffff8803e6cd7180 1931380318 S Co:1:043:0 s 21 09 0300 0000 0008 8 = d102a530 4b9bd215
ffff8803e6cd7180 1931380436 C Co:1:043:0 0 8 >
ffff8803ed160b40 1931395226 S Co:1:043:0 s 21 09 0300 0000 0008 8 = ee6a3aa9 7aa9df19
ffff8803ed160b40 1931395331 C Co:1:043:0 0 8 >
ffff8803ed160b40 1931412269 S Co:1:043:0 s 21 09 0300 0000 0008 8 = 71b3276d 64c0c45d
ffff8803ed160b40 1931412454 C Co:1:043:0 0 8 >
ffff8803ed160b40 1931427300 S Co:1:043:0 s 21 09 0300 0000 0008 8 = 83e2e472 643f9b60
ffff8803ed160b40 1931427455 C Co:1:043:0 0 8 >
ffff8803ed160b40 1931442338 S Co:1:043:0 s 21 09 0300 0000 0008 8 = 13908da4 5bdae05a
ffff8803ed160b40 1931442454 C Co:1:043:0 0 8 >
ffff8803ed160b40 1931459252 S Co:1:043:0 s 21 09 0300 0000 0008 8 = 546c6160 2e1af5b1
ffff8803ed160b40 1931459433 C Co:1:043:0 0 8 >
ffff88040749f240 1931473342 S Co:1:043:0 s 21 09 0300 0000 0008 8 = 3cb843fc 44d99f83
ffff88040749f240 1931473458 C Co:1:043:0 0 8 >
ffff88040749f240 1931490267 S Co:1:043:0 s 21 09 0300 0000 0008 8 = 06c93a3c 0ac98822
ffff88040749f240 1931490451 C Co:1:043:0 0 8 >
ffff88040749fe40 1931506294 S Co:1:043:0 s 21 09 0300 0000 0008 8 = af8af2dc 71ecbe91
ffff88040749fe40 1931506431 C Co:1:043:0 0 8 >
ffff88040749fe40 1931521217 S Co:1:043:0 s 21 09 0300 0000 0008 8 = 7af73b0a 6c1a300a
ffff88040749fe40 1931521307 C Co:1:043:0 0 8 >
ffff88040749fe40 1931536251 S Co:1:043:0 s 21 09 0300 0000 0008 8 = 6ea487eb 7580367a
ffff88040749fe40 1931536430 C Co:1:043:0 0 8 >
ffff8803e6cd7180 1931553239 S Co:1:043:0 s 21 09 0300 0000 0008 8 = d4356e14 071e0801
ffff8803e6cd7180 1931553490 C Co:1:043:0 0 8 >
ffff8803ed332a80 1931568277 S Co:1:043:0 s 21 09 0300 0000 0008 8 = bce62c10 23474374
ffff8803ed332a80 1931568511 C Co:1:043:0 0 8 >
ffff88040749fe40 1931583303 S Co:1:043:0 s 21 09 0300 0000 0008 8 = 770320de cd236adc
ffff88040749fe40 1931583448 C Co:1:043:0 0 8 >
ffff88040749fe40 1931600220 S Co:1:043:0 s 21 09 0300 0000 0008 8 = 1d6f4d72 8e2d61f7
ffff88040749fe40 1931600314 C Co:1:043:0 0 8 >
ffff8803ed160b40 1931615250 S Co:1:043:0 s 21 09 0300 0000 0008 8 = 061fda32 f2b7f2b5
ffff8803ed160b40 1931615457 C Co:1:043:0 0 8 >
ffff8803ed160b40 1931630237 S Co:1:043:0 s 21 09 0300 0000 0008 8 = 539d9378 096449ba
ffff8803ed160b40 1931630451 C Co:1:043:0 0 8 >
ffff8803e6cd7180 1931645299 S Co:1:043:0 s 21 09 0300 0000 0008 8 = 64876815 e8ab7ae0
ffff8803e6cd7180 1931645452 C Co:1:043:0 0 8 >
ffff8803ed332a80 1931662185 S Co:1:043:0 s 21 09 0300 0000 0008 8 = 6110ebca 2858f8b4
ffff8803ed332a80 1931662326 C Co:1:043:0 0 8 >
ffff88040749f240 1931677269 S Co:1:043:0 s 21 09 0300 0000 0008 8 = b47dd5ce 640c1df6
ffff88040749f240 1931677456 C Co:1:043:0 0 8 >
ffff8803e6cd7600 1931694337 S Co:1:043:0 s 21 09 0300 0000 0008 8 = 8ba7804d bcbaa81b
ffff8803e6cd7600 1931694437 C Co:1:043:0 0 8 >
ffff8803e6cd7600 1931709240 S Co:1:043:0 s 21 09 0300 0000 0008 8 = 587d6be6 562a38cd
ffff8803e6cd7600 1931709482 C Co:1:043:0 0 8 >
ffff8803e6cd7600 1931724275 S Co:1:043:0 s 21 09 0300 0000 0008 8 = 5380bb2a da79d368
ffff8803e6cd7600 1931724458 C Co:1:043:0 0 8 >
ffff8803e6cd7600 1931739303 S Co:1:043:0 s 21 09 0300 0000 0008 8 = f547b721 f495637d
ffff8803e6cd7600 1931739476 C Co:1:043:0 0 8 >
ffff8803e325f780 1931755155 S Co:1:043:0 s 21 09 0300 0000 0008 8 = 7dfc49c7 d4c33650
ffff8803e325f780 1931755321 C Co:1:043:0 0 8 >
ffff8803e325f780 1931770284 S Co:1:043:0 s 21 09 0300 0000 0008 8 = 6cdb8289 af1a7b5b
ffff8803e325f780 1931770447 C Co:1:043:0 0 8 >
ffff8803e325f780 1931787259 S Co:1:043:0 s 21 09 0300 0000 0008 8 = 0ab714ca 3d07cacb
ffff8803e325f780 1931787435 C Co:1:043:0 0 8 >
ffff8803e325f780 1931804185 S Co:1:043:0 s 21 09 0300 0000 0008 8 = e277d763 3bc99b00
ffff8803e325f780 1931804312 C Co:1:043:0 0 8 >
ffff8803e325f780 1931817359 S Co:1:043:0 s 21 09 0300 0000 0008 8 = 4093471c e8f5cc10
ffff8803e325f780 1931817448 C Co:1:043:0 0 8 >
ffff8803e325f780 1931834296 S Co:1:043:0 s 21 09 0300 0000 0008 8 = b89a0336 8af21d43
ffff8803e325f780 1931834447 C Co:1:043:0 0 8 >
ffff8803e325f780 1931849329 S Co:1:043:0 s 21 09 0300 0000 0008 8 = a0ad4ee3 e97bb596
ffff8803e325f780 1931849457 C Co:1:043:0 0 8 >
ffff8803e325f780 1931864220 S Co:1:043:0 s 21 09 0300 0000 0008 8 = 92038fca d0229d3a
ffff8803e325f780 1931864312 C Co:1:043:0 0 8 >
ffff8803e325f780 1931881278 S Co:1:043:0 s 21 09 0300 0000 0008 8 = ed65d386 91c94213
ffff8803e325f780 1931881435 C Co:1:043:0 0 8 >
ffff8803e325f780 1931896322 S Co:1:043:0 s 21 09 0300 0000 0008 8 = 53b24726 8029f53c
ffff8803e325f780 1931896459 C Co:1:043:0 0 8 >
ffff8803e325f780 1931911179 S Co:1:043:0 s 21 09 0300 0000 0008 8 = 2a5ac1ac 754d6d80
ffff8803e325f780 1931911326 C Co:1:043:0 0 8 >
ffff8803e325f780 1931928280 S Co:1:043:0 s 21 09 0300 0000 0008 8 = 1ee43690 4c1641e0
ffff8803e325f780 1931928443 C Co:1:043:0 0 8 >
ffff88040749f240 1931943297 S Co:1:043:0 s 21 09 0300 0000 0008 8 = 9b6a433c 66b77012
ffff88040749f240 1931943454 C Co:1:043:0 0 8 >
ffff8803e6cd7600 1931958138 S Co:1:043:0 s 21 09 0300 0000 0008 8 = 551aa790 2838dbfe
ffff8803e6cd7600 1931958328 C Co:1:043:0 0 8 >
ffff8803ed332a80 1931975241 S Co:1:043:0 s 21 09 0300 0000 0008 8 = c2b6c55d 79f5c841
ffff8803ed332a80 1931975453 C Co:1:043:0 0 8 >
ffff8803ed332a80 1931990280 S Co:1:043:0 s 21 09 0300 0000 0008 8 = 9d1224ec 471e5fac
ffff8803ed332a80 1931990436 C Co:1:043:0 0 8 >
ffff8803ed332a80 1932005310 S Co:1:043:0 s 21 09 0300 0000 0008 8 = 639af177 00372fc4
ffff8803ed332a80 1932005446 C Co:1:043:0 0 8 >
ffff88040749f240 1932022279 S Co:1:043:0 s 21 09 0300 0000 0008 8 = d7cc79ac 1b97a842
ffff88040749f240 1932022440 C Co:1:043:0 0 8 >
ffff8803e6cd7600 1932037273 S Co:1:043:0 s 21 09 0300 0000 0008 8 = 80b8b22f 8eeb9f92
ffff8803e6cd7600 1932037443 C Co:1:043:0 0 8 >
ffff8803e6c509c0 1932053185 S Co:1:043:0 s 21 09 0300 0000 0008 8 = 2885b117 58b2cf55
ffff8803e6c509c0 1932053313 C Co:1:043:0 0 8 >
ffff8803e6cd7240 1932068063 S Co:1:043:0 s 21 09 0300 0000 0008 8 = 5ded336d f7c055e1
ffff8803e6cd7240 1932068185 C Co:1:043:0 0 8 >
ffff8803e6cd7240 1932083097 S Co:1:043:0 s 21 09 0300 0000 0008 8 = f1be17b3 f0be32be
ffff8803e6cd7240 1932083329 C Co:1:043:0 0 8 >
ffff8803ed332a80 1932099159 S Co:1:043:0 s 21 09 0300 0000 0008 8 = 7c59e059 4ca6cb2a
ffff8803ed332a80 1932099322 C Co:1:043:0 0 8 >
ffff8803ed160240 1932115091 S Co:1:043:0 s 21 09 0300 0000 0008 8 = d6353547 174a6a94
ffff8803ed160240 1932115212 C Co:1:043:0 0 8 >
ffff88040749f540 1932130143 S Co:1:043:0 s 21 09 0300 0000 0008 8 = a05b6359 e2ccbc22
ffff88040749f540 1932130314 C Co:1:043:0 0 8 >
ffff88040749f540 1932145168 S Co:1:043:0 s 21 09 0300 0000 0008 8 = bae9d8dc 4024522d
ffff88040749f540 1932145315 C Co:1:043:0 0 8 >
ffff88040749f240 1932166071 S Co:1:043:0 s 21 09 0300 0000 0008 8 = cd91a713 4aa022c1
ffff88040749f240 1932166189 C Co:1:043:0 0 8 >
ffff88040749f240 1932176427 S Co:1:043:0 s 21 09 0300 0000 0008 8 = c01909b6 1d5d0620
ffff88040749f240 1932176560 C Co:1:043:0 0 8 >
ffff88040749f540 1932192474 S Co:1:043:0 s 21 09 0300 0000 0008 8 = 45dbd870 59d13a3e
ffff88040749f540 1932192560 C Co:1:043:0 0 8 >
ffff8803e6cd7540 1932207512 S Co:1:043:0 s 21 09 0300 0000 0008 8 = 4b45135f a343e044
ffff8803e6cd7540 1932207686 C Co:1:043:0 0 8 >
ffff8803e6cd7540 1932223484 S Co:1:043:0 s 21 09 0300 0000 0008 8 = 8b585f96 214f7e0f
ffff8803e6cd7540 1932223705 C Co:1:043:0 0 8 >
ffff8803ed332000 1932239518 S Co:1:043:0 s 21 09 0300 0000 0008 8 = fe2a839c 02647cb1
ffff8803ed332000 1932239721 C Co:1:043:0 0 8 >
ffff8803ed332000 1932254655 S Co:1:043:0 s 21 09 0300 0000 0008 8 = 6366e9ec f548a9ed
ffff8803ed332000 1932254837 C Co:1:043:0 0 8 >
ffff8803ed332000 1932272484 S Co:1:043:0 s 21 09 0300 0000 0008 8 = bcc92274 b091b5bd
ffff8803ed332000 1932272710 C Co:1:043:0 0 8 >
ffff88040749f540 1932287517 S Co:1:043:0 s 21 09 0300 0000 0008 8 = cfa56119 692bb6cd
ffff88040749f540 1932287710 C Co:1:043:0 0 8 >
ffff88040749f540 1932302556 S Co:1:043:0 s 21 09 0300 0000 0008 8 = a761fc30 5ed7a5ff
ffff88040749f540 1932302712 C Co:1:043:0 0 8 >
ffff8803ed160240 1932317594 S Co:1:043:0 s 21 09 0300 0000 0008 8 = 13f4f004 4ea9dfe8
ffff8803ed160240 1932317819 C Co:1:043:0 0 8 >
ffff8803ed160240 1932334452 S Co:1:043:0 s 21 09 0300 0000 0008 8 = 246f5c54 ff87a74f
ffff8803ed160240 1932334568 C Co:1:043:0 0 8 >
ffff8803ed160240 1932349490 S Co:1:043:0 s 21 09 0300 0000 0008 8 = b17203d4 b9aea1b3
ffff8803ed160240 1932349707 C Co:1:043:0 0 8 >
ffff8803ed160240 1932364523 S Co:1:043:0 s 21 09 0300 0000 0008 8 = d4b3cdaa c72e57c3
ffff8803ed160240 1932364708 C Co:1:043:0 0 8 >
ffff8803e6cd7540 1932381490 S Co:1:043:0 s 21 09 0300 0000 0008 8 = 6c7d44f0 fb6bb6e5
ffff8803e6cd7540 1932381721 C Co:1:043:0 0 8 >
ffff8803e6cd7540 1932395520 S Co:1:043:0 s 21 09 0300 0000 0008 8 = 9b2d1936 299d90b2
ffff8803e6cd7540 1932395693 C Co:1:043:0 0 8 >
ffff88040749fb40 1932412570 S Co:1:043:0 s 21 09 0300 0000 0008 8 = 48b59fff a94f1977
ffff88040749fb40 1932412856 C Co:1:043:0 0 8 >
ffff88040749fb40 1932427458 S Co:1:043:0 s 21 09 0300 0000 0008 8 = 9c1b4c42 d8e16cb4
ffff88040749fb40 1932427589 C Co:1:043:0 0 8 >
ffff88040749fb40 1932442512 S Co:1:043:0 s 21 09 0300 0000 0008 8 = 87f93de9 9508059f
ffff88040749fb40 1932442693 C Co:1:043:0 0 8 >
ffff88040749fb40 1932458498 S Co:1:043:0 s 21 09 0300 0000 0008 8 = 3afcb153 c64a469f
ffff88040749fb40 1932458706 C Co:1:043:0 0 8 >
ffff8803e6cd7540 1932473780 S Co:1:043:0 s 21 09 0300 0000 0008 8 = ad678bd3 d285f5d3
ffff8803e6cd7540 1932473948 C Co:1:043:0 0 8 >
ffff8803ed160180 1932489439 S Co:1:043:0 s 21 09 0300 0000 0008 8 = 1890d331 2768ba8a
ffff8803ed160180 1932489566 C Co:1:043:0 0 8 >
ffff8803ed3320c0 1932506545 S Co:1:043:0 s 21 09 0300 0000 0008 8 = 7c5f3326 b4f6a4cb
ffff8803ed3320c0 1932506689 C Co:1:043:0 0 8 >
ffff8803e6cd7540 1932520570 S Co:1:043:0 s 21 09 0300 0000 0008 8 = 19d47ce2 6d08a3cd
ffff8803e6cd7540 1932520721 C Co:1:043:0 0 8 >
ffff8803e6cd7540 1932537483 S Co:1:043:0 s 21 09 0300 0000 0008 8 = f7802187 ccc90d7e
ffff8803e6cd7540 1932537594 C Co:1:043:0 0 8 >
ffff8803e6cd7540 1932552518 S Co:1:043:0 s 21 09 0300 0000 0008 8 = 6009b8ae 4c3a1bfe
ffff8803e6cd7540 1932552712 C Co:1:043:0 0 8 >
ffff8803e6cd7540 1932567607 S Co:1:043:0 s 21 09 0300 0000 0008 8 = 62a97edf efae6b23
ffff8803e6cd7540 1932567834 C Co:1:043:0 0 8 >
ffff8803ed160180 1932584518 S Co:1:043:0 s 21 09 0300 0000 0008 8 = 4fadd21b b74d7df5
ffff8803ed160180 1932584719 C Co:1:043:0 0 8 >
ffff8803ed160180 1932599477 S Co:1:043:0 s 21 09 0300 0000 0008 8 = 3ff8b754 2e933930
ffff8803ed160180 1932599586 C Co:1:043:0 0 8 >
ffff8803e325f780 1932616536 S Co:1:043:0 s 21 09 0300 0000 0008 8 = 8b7f55f1 e1d066c7
ffff8803e325f780 1932616707 C Co:1:043:0 0 8 >
ffff8803e6cd7540 1932629529 S Co:1:043:0 s 21 09 0300 0000 0008 8 = 51cd764d dea8325e
ffff8803e6cd7540 1932629707 C Co:1:043:0 0 8 >
ffff8803e6cd7540 1932646465 S Co:1:043:0 s 21 09 0300 0000 0008 8 = f57e0b36 3c92aecd
ffff8803e6cd7540 1932646574 C Co:1:043:0 0 8 >
ffff8803ed3320c0 1932663568 S Co:1:043:0 s 21 09 0300 0000 0008 8 = 9cc6a771 915b51a2
ffff8803ed3320c0 1932663704 C Co:1:043:0 0 8 >
ffff8803ed160180 1932676559 S Co:1:043:0 s 21 09 0300 0000 0008 8 = b1ea0132 7ba2729d
ffff8803ed160180 1932676707 C Co:1:043:0 0 8 >
ffff88040749fb40 1932692485 S Co:1:043:0 s 21 09 0300 0000 0008 8 = 62c374a7 1a5bd134
ffff88040749fb40 1932692599 C Co:1:043:0 0 8 >
ffff8803ed160180 1932708539 S Co:1:043:0 s 21 09 0300 0000 0008 8 = 2241806c 934f0d0f
ffff8803ed160180 1932708695 C Co:1:043:0 0 8 >
ffff8803e6cd7540 1932724595 S Co:1:043:0 s 21 09 0300 0000 0008 8 = 27e34816 8d992d8b
ffff8803e6cd7540 1932724818 C Co:1:043:0 0 8 >
ffff8803e6cd70c0 1932739417 S Co:1:043:0 s 21 09 0300 0000 0008 8 = eb4213aa b4281939
ffff8803e6cd70c0 1932739566 C Co:1:043:0 0 8 >
ffff8803ed160180 1932756507 S Co:1:043:0 s 21 09 0300 0000 0008 8 = ad85ce25 3b41205e
ffff8803ed160180 1932756710 C Co:1:043:0 0 8 >
ffff880406d3ac00 1932770509 S Co:1:043:0 s 21 09 0300 0000 0008 8 = efec87f4 54fc7272
ffff880406d3ac00 1932770711 C Co:1:043:0 0 8 >
ffff880406d3ac00 1932787436 S Co:1:043:0 s 21 09 0300 0000 0008 8 = f848f17b b8c4a5a4
ffff880406d3ac00 1932787588 C Co:1:043:0 0 8 >
ffff880406d3ac00 1932801764 S Co:1:043:0 s 21 09 0300 0000 0008 8 = 517ee591 24d93252
ffff880406d3ac00 1932801949 C Co:1:043:0 0 8 >
ffff880406d3ac00 1932817546 S Co:1:043:0 s 21 09 0300 0000 0008 8 = 4a0addff d8d0f793
ffff880406d3ac00 1932817719 C Co:1:043:0 0 8 >
ffff880406d3ac00 1932834601 S Co:1:043:0 s 21 09 0300 0000 0008 8 = 74787907 1810b5af
ffff880406d3ac00 1932834819 C Co:1:043:0 0 8 >
ffff880406d3ac00 1932848485 S Co:1:043:0 s 21 09 0300 0000 0008 8 = 26ebfcd9 ad5591a3
ffff880406d3ac00 1932848590 C Co:1:043:0 0 8 >
ffff880406d3ac00 1932866080 S Co:1:043:0 s 21 09 0300 0000 0008 8 = fa98ce1d 632f95a0
ffff880406d3ac00 1932866195 C Co:1:043:0 0 8 >
ffff880406d3ac00 1932880499 S Co:1:043:0 s 21 09 0300 0000 0008 8 = 4f49fa6e 8a812e8b
ffff880406d3ac00 1932880724 C Co:1:043:0 0 8 >
ffff880406d3ac00 1932895358 S Co:1:043:0 s 21 09 0300 0000 0008 8 = c8ddafdb 7705ae7d
ffff880406d3ac00 1932895443 C Co:1:043:0 0 8 >
ffff880406d3ac00 1932911406 S Co:1:043:0 s 21 09 0300 0000 0008 8 = c9c4c067 02c4c942
ffff880406d3ac00 1932911570 C Co:1:043:0 0 8 >
ffff880406d3ac00 1932926444 S Co:1:043:0 s 21 09 0300 0000 0008 8 = ff862688 08a01adc
ffff880406d3ac00 1932926588 C Co:1:043:0 0 8 >
ffff880406d3ac00 1932942352 S Co:1:043:0 s 21 09 0300 0000 0008 8 = d73b7ba9 e8cc9dff
ffff880406d3ac00 1932942459 C Co:1:043:0 0 8 >
ffff880406d3ac00 1932959461 S Co:1:043:0 s 21 09 0300 0000 0008 8 = 03127faa 08513594
ffff880406d3ac00 1932959641 C Co:1:043:0 0 8 >
ffff880406d3ac00 1932974493 S Co:1:043:0 s 21 09 0300 0000 0008 8 = fbcd955d 50892639
ffff880406d3ac00 1932974599 C Co:1:043:0 0 8 >
ffff880406d3ac00 1932989528 S Co:1:043:0 s 21 09 0300 0000 0008 8 = 77414509 aba599bd
ffff880406d3ac00 1932989727 C Co:1:043:0 0 8 >
ffff880406d3ac00 1933004634 S Co:1:043:0 s 21 09 0300 0000 0008 8 = f8d8bae9 8b291da6
ffff880406d3ac00 1933004898 C Co:1:043:0 0 8 >
ffff880406d3ac00 1933021413 S Co:1:043:0 s 21 09 0300 0000 0008 8 = 3e1143ac 646d22ad
ffff880406d3ac00 1933021590 C Co:1:043:0 0 8 >
ffff880406d3ab40 1933036740 S Co:1:043:0 s 21 09 0300 0000 0008 8 = d1fcd3f4 2e1c7e3e
ffff880406d3ab40 1933036948 C Co:1:043:0 0 8 >
ffff880406d3ad80 1933051624 S Co:1:043:0 s 21 09 0300 0000 0008 8 = 7bc183d9 e5b6eafb
ffff880406d3ad80 1933051823 C Co:1:043:0 0 8 >
ffff880406d3ad80 1933067616 S Co:1:043:0 s 21 09 0300 0000 0008 8 = ca180d65 0b108438
ffff880406d3ad80 1933067821 C Co:1:043:0 0 8 >
ffff88040749fb40 1933083658 S Co:1:043:0 s 21 09 0300 0000 0008 8 = 91d05117 22d04d7f
ffff88040749fb40 1933083819 C Co:1:043:0 0 8 >
ffff8803e6cd7f00 1933098615 S Co:1:043:0 s 21 09 0300 0000 0008 8 = 664ad263 35f4aa0b
ffff8803e6cd7f00 1933098838 C Co:1:043:0 0 8 >
ffff8803e6cd7000 1933114591 S Co:1:043:0 s 21 09 0300 0000 0008 8 = 23fd382e 4e4be54e
ffff8803e6cd7000 1933114839 C Co:1:043:0 0 8 >
ffff8803ed332000 1933129910 S Co:1:043:0 s 21 09 0300 0000 0008 8 = 67f2ce55 fff8ac6e
ffff8803ed332000 1933130138 C Co:1:043:0 0 8 >
ffff88040749f840 1933145733 S Co:1:043:0 s 21 09 0300 0000 0008 8 = 13480325 dbf48ec2
ffff88040749f840 1933145827 C Co:1:043:0 0 8 >
ffff8803e6cd7000 1933161581 S Co:1:043:0 s 21 09 0300 0000 0008 8 = d0afebe2 fc8a8357
ffff8803e6cd7000 1933161838 C Co:1:043:0 0 8 >
ffff8803ed160240 1933176737 S Co:1:043:0 s 21 09 0300 0000 0008 8 = 86efbc42 7ddb636f
ffff8803ed160240 1933176850 C Co:1:043:0 0 8 >
ffff8803ed160240 1933193729 S Co:1:043:0 s 21 09 0300 0000 0008 8 = e46054f1 ff5a6bff
ffff8803ed160240 1933193823 C Co:1:043:0 0 8 >
ffff88040749f540 1933208568 S Co:1:043:0 s 21 09 0300 0000 0008 8 = dd71b00d 274fbe2e
ffff88040749f540 1933208694 C Co:1:043:0 0 8 >
ffff8803ed332300 1933223604 S Co:1:043:0 s 21 09 0300 0000 0008 8 = 272374aa 1c56e0db
ffff8803ed332300 1933223839 C Co:1:043:0 0 8 >
ffff8803ed332300 1933239706 S Co:1:043:0 s 21 09 0300 0000 0008 8 = bd8d684d 0bdf3a15
ffff8803ed332300 1933239844 C Co:1:043:0 0 8 >
ffff88040749f540 1933255617 S Co:1:043:0 s 21 09 0300 0000 0008 8 = 5c58f672 a4ae9ba3
ffff88040749f540 1933255847 C Co:1:043:0 0 8 >
ffff8803e6cd73c0 1933273711 S Co:1:043:0 s 21 09 0300 0000 0008 8 = 0742b008 9d5ab37c
ffff8803e6cd73c0 1933273847 C Co:1:043:0 0 8 >
ffff8803e6cd73c0 1933286695 S Co:1:043:0 s 21 09 0300 0000 0008 8 = 849ec6f1 2cd0984e
ffff8803e6cd73c0 1933286846 C Co:1:043:0 0 8 >
ffff8803ed160240 1933303694 S Co:1:043:0 s 21 09 0300 0000 0008 8 = dfd09286 8fcf44f9
ffff8803ed160240 1933303845 C Co:1:043:0 0 8 >
ffff8803ed160240 1933318653 S Co:1:043:0 s 21 09 0300 0000 0008 8 = e4d30e0f 866c1212
ffff8803ed160240 1933318824 C Co:1:043:0 0 8 >
ffff88040749f540 1933334712 S Co:1:043:0 s 21 09 0300 0000 0008 8 = a8b55a4d d58d4663
ffff88040749f540 1933334847 C Co:1:043:0 0 8 >
ffff8803ed160240 1933349080 S Co:1:043:0 s 21 09 0300 0000 0008 8 = ff173af2 c5708568
ffff8803ed160240 1933349202 C Co:1:043:0 0 8 >
ffff8803e6cd76c0 1933364573 S Co:1:043:0 s 21 09 0300 0000 0008 8 = 04b09325 a22357d2
ffff8803e6cd76c0 1933364724 C Co:1:043:0 0 8 >
ffff88040749f540 1933380687 S Co:1:043:0 s 21 09 0300 0000 0008 8 = 97c9f300 3c0caa05
ffff88040749f540 1933380834 C Co:1:043:0 0 8 >
ffff88040749f540 1933396720 S Co:1:043:0 s 21 09 0300 0000 0008 8 = d8c00814 6860509c
ffff88040749f540 1933396846 C Co:1:043:0 0 8 >
ffff88040749f240 1933413636 S Co:1:043:0 s 21 09 0300 0000 0008 8 = af8726e2 7fae7ee1
ffff88040749f240 1933413847 C Co:1:043:0 0 8 >
ffff8803ed160240 1933427670 S Co:1:043:0 s 21 09 0300 0000 0008 8 = 4625c462 db534c58
ffff8803ed160240 1933427826 C Co:1:043:0 0 8 >
ffff8803ed160240 1933442734 S Co:1:043:0 s 21 09 0300 0000 0008 8 = 8b31fd7e 5f053a33
ffff8803ed160240 1933442852 C Co:1:043:0 0 8 >
ffff88040749f240 1933458605 S Co:1:043:0 s 21 09 0300 0000 0008 8 = b05c1195 ee4ba8dd
ffff88040749f240 1933458727 C Co:1:043:0 0 8 >
ffff8803e6cd76c0 1933473691 S Co:1:043:0 s 21 09 0300 0000 0008 8 = ade6e4fb f1015a72
ffff8803e6cd76c0 1933473829 C Co:1:043:0 0 8 >
ffff8803ed332300 1933489687 S Co:1:043:0 s 21 09 0300 0000 0008 8 = bb267b76 d3d7fc43
ffff8803ed332300 1933489845 C Co:1:043:0 0 8 >
ffff88040749fe40 1933506596 S Co:1:043:0 s 21 09 0300 0000 0008 8 = d80584c0 87d09a55
ffff88040749fe40 1933506846 C Co:1:043:0 0 8 >
ffff88040749fe40 1933521631 S Co:1:043:0 s 21 09 0300 0000 0008 8 = 4881cd09 fec525e0
ffff88040749fe40 1933521826 C Co:1:043:0 0 8 >
ffff88040749fe40 1933536666 S Co:1:043:0 s 21 09 0300 0000 0008 8 = 102cca74 b3e2f3d2
ffff88040749fe40 1933536848 C Co:1:043:0 0 8 >
ffff88040749fe40 1933551749 S Co:1:043:0 s 21 09 0300 0000 0008 8 = 7bac1298 22263e4c
ffff88040749fe40 1933551899 C Co:1:043:0 0 8 >
ffff88040749fe40 1933568621 S Co:1:043:0 s 21 09 0300 0000 0008 8 = 973be0fe 4ae5a222
ffff88040749fe40 1933568833 C Co:1:043:0 0 8 >
ffff88040749fe40 1933583649 S Co:1:043:0 s 21 09 0300 0000 0008 8 = b72794a7 3148a15d
ffff88040749fe40 1933583852 C Co:1:043:0 0 8 >
ffff88040749fe40 1933598662 S Co:1:043:0 s 21 09 0300 0000 0008 8 = f1513286 5fc920ba
ffff88040749fe40 1933598827 C Co:1:043:0 0 8 >
ffff88040749fe40 1933615600 S Co:1:043:0 s 21 09 0300 0000 0008 8 = 9fafe000 5fb9e92a
ffff88040749fe40 1933615849 C Co:1:043:0 0 8 >
ffff8803ed160240 1933630593 S Co:1:043:0 s 21 09 0300 0000 0008 8 = e0cc6971 43bc2a52
ffff8803ed160240 1933630823 C Co:1:043:0 0 8 >
ffff8803e6cd7240 1933645718 S Co:1:043:0 s 21 09 0300 0000 0008 8 = 1645bfa8 1f4af30a
ffff8803e6cd7240 1933645824 C Co:1:043:0 0 8 >
ffff8803e6c509c0 1933662735 S Co:1:043:0 s 21 09 0300 0000 0008 8 = 674c7267 8a2eb9e0
ffff8803e6c509c0 1933662829 C Co:1:043:0 0 8 >
ffff8803e6c509c0 1933677646 S Co:1:043:0 s 21 09 0300 0000 0008 8 = 3f273ce6 2308d795
ffff8803e6c509c0 1933677855 C Co:1:043:0 0 8 >
ffff8803e6c509c0 1933692918 S Co:1:043:0 s 21 09 0300 0000 0008 8 = cab07850 08cd0a9d
ffff8803e6c509c0 1933693102 C Co:1:043:0 0 8 >
ffff8803e6c509c0 1933709683 S Co:1:043:0 s 21 09 0300 0000 0008 8 = 7cd5a443 5f44f2a1
ffff8803e6c509c0 1933709843 C Co:1:043:0 0 8 >
ffff8803ed332000 1933725583 S Co:1:043:0 s 21 09 0300 0000 0008 8 = 8b17e451 cf8896ff
ffff8803ed332000 1933725843 C Co:1:043:0 0 8 >
ffff8803ed160240 1933740678 S Co:1:043:0 s 21 09 0300 0000 0008 8 = 720c8083 058bdf46
ffff8803ed160240 1933740828 C Co:1:043:0 0 8 >
ffff8803e6cd7f00 1933755713 S Co:1:043:0 s 21 09 0300 0000 0008 8 = 6edf63d3 328f1abc
ffff8803e6cd7f00 1933755848 C Co:1:043:0 0 8 >
ffff88040749f240 1933770602 S Co:1:043:0 s 21 09 0300 0000 0008 8 = 02cd9cb0 89ad78da
ffff88040749f240 1933770850 C Co:1:043:0 0 8 >
ffff8803ed332e40 1933786081 S Co:1:043:0 s 21 09 0300 0000 0008 8 = 75a8df7c c4518fcc
ffff8803ed332e40 1933786205 C Co:1:043:0 0 8 >
ffff8803ed332e40 1933802656 S Co:1:043:0 s 21 09 0300 0000 0008 8 = 5056030f 9ebad9f4
ffff8803ed332e40 1933802846 C Co:1:043:0 0 8 >
ffff8803ed332e40 1933817741 S Co:1:043:0 s 21 09 0300 0000 0008 8 = e3508333 587c3266
ffff8803ed332e40 1933817854 C Co:1:043:0 0 8 >
ffff8803e6cd7f00 1933832624 S Co:1:043:0 s 21 09 0300 0000 0008 8 = c0260027 36ff5c6b
ffff8803e6cd7f00 1933832848 C Co:1:043:0 0 8 >
ffff8803ed160240 1933849678 S Co:1:043:0 s 21 09 0300 0000 0008 8 = 3cf8bb1f 01ff7d01
ffff8803ed160240 1933849859 C Co:1:043:0 0 8 >
ffff8803ed160240 1933864722 S Co:1:043:0 s 21 09 0300 0000 0008 8 = f3fc1dc0 850c9d57
ffff8803ed160240 1933864850 C Co:1:043:0 0 8 >
ffff88040749f240 1933879671 S Co:1:043:0 s 21 09 0300 0000 0008 8 = 42fd31a6 130a2a53
ffff88040749f240 1933879851 C Co:1:043:0 0 8 >
ffff8803e6cd7f00 1933896676 S Co:1:043:0 s 21 09 0300 0000 0008 8 = cdd826e1 feb0760e
ffff8803e6cd7f00 1933896855 C Co:1:043:0 0 8 >
ffff8803ed160e40 1933911717 S Co:1:043:0 s 21 09 0300 0000 0008 8 = f9fed072 1f0b3655
ffff8803ed160e40 1933911853 C Co:1:043:0 0 8 >
ffff8803ed160e40 1933926606 S Co:1:043:0 s 21 09 0300 0000 0008 8 = 71f726d0 53fa0328
ffff8803ed160e40 1933926865 C Co:1:043:0 0 8 >
ffff88040749f240 1933943658 S Co:1:043:0 s 21 09 0300 0000 0008 8 = a3dcc367 fab2db3c
ffff88040749f240 1933943830 C Co:1:043:0 0 8 >
ffff8803ed3326c0 1933959709 S Co:1:043:0 s 21 09 0300 0000 0008 8 = 41da6715 78399e7a
ffff8803ed3326c0 1933959851 C Co:1:043:0 0 8 >
ffff8803ed3326c0 1933990651 S Co:1:043:0 s 21 09 0300 0000 0008 8 = 5503c5c1 ee744003
ffff8803ed3326c0 1933990852 C Co:1:043:0 0 8 >
ffff8803ed3323c0 1934022749 S Ci:1:043:0 s a1 01 0300 0000 0008 8 <
ffff8803ed3323c0 1934022954 C Ci:1:043:0 0 8 = aa040000 00000000
ffff8803ed1603c0 1973457619 S Co:1:043:0 s 21 09 0300 0000 0008 8 = 55010100 00ff075d
ffff8803ed1603c0 1973457815 C Co:1:043:0 0 8 >
ffff8803a0249600 1973502644 S Ci:1:043:0 s a1 01 0300 0000 0008 8 <
ffff8803a0249600 1973502796 C Ci:1:043:0 0 8 = aa020000 00000000
ffff8803e6e446c0 1973521632 S Co:1:043:0 s 21 09 0300 0000 0008 8 = 0b010101 00000e04
ffff8803e6e446c0 1973521798 C Co:1:043:0 0 8 >
ffff8803a0055e40 1973536681 S Co:1:043:0 s 21 09 0300 0000 0008 8 = d9974d58 0a95050c
ffff8803a0055e40 1973536805 C Co:1:043:0 0 8 >
ffff8803a0055900 1973551724 S Co:1:043:0 s 21 09 0300 0000 0008 8 = 01809000 15ff67ff
ffff8803a0055900 1973551924 C Co:1:043:0 0 8 >
ffff8803e6e446c0 1973568604 S Co:1:043:0 s 21 09 0300 0000 0008 8 = c7ff87ff 67ffe7ff
ffff8803e6e446c0 1973568816 C Co:1:043:0 0 8 >
ffff8803eb86fcc0 1973583676 S Co:1:043:0 s 21 09 0300 0000 0008 8 = 97ffd7ff f7ff77ff
ffff8803eb86fcc0 1973583821 C Co:1:043:0 0 8 >
ffff8803eb86fcc0 1973598630 S Co:1:043:0 s 21 09 0300 0000 0008 8 = 57ffc7ff f7ffd7ff
ffff8803eb86fcc0 1973598812 C Co:1:043:0 0 8 >
ffff8803eb86fcc0 1973615558 S Co:1:043:0 s 21 09 0300 0000 0008 8 = 67ff57ff 07ffb7ff
ffff8803eb86fcc0 1973615674 C Co:1:043:0 0 8 >
ffff8803a02499c0 1973630620 S Co:1:043:0 s 21 09 0300 0000 0008 8 = 27ff97ff 07ff17ff
ffff8803a02499c0 1973630796 C Co:1:043:0 0 8 >
ffff8803a02499c0 1973645750 S Co:1:043:0 s 21 09 0300 0000 0008 8 = 37ff57ff 47ffb7ff
ffff8803a02499c0 1973645919 C Co:1:043:0 0 8 >
ffff8803e6e446c0 1973662550 S Co:1:043:0 s 21 09 0300 0000 0008 8 = 87ffc7ff 07ff67ff
ffff8803e6e446c0 1973662689 C Co:1:043:0 0 8 >
ffff8803a02499c0 1973677590 S Co:1:043:0 s 21 09 0300 0000 0008 8 = d7ffa7ff e7ff97ff
ffff8803a02499c0 1973677817 C Co:1:043:0 0 8 >
ffff8803a02499c0 1973692670 S Co:1:043:0 s 21 09 0300 0000 0008 8 = b7ff27ff 37fff7ff
ffff8803a02499c0 1973692855 C Co:1:043:0 0 8 >
ffff8803a02499c0 1973709579 S Co:1:043:0 s 21 09 0300 0000 0008 8 = 87ffc7ff b7ff47ff
ffff8803a02499c0 1973709726 C Co:1:043:0 0 8 >
ffff8803a02499c0 1973724618 S Co:1:043:0 s 21 09 0300 0000 0008 8 = a7ffc7ff 67ffa7ff
ffff8803a02499c0 1973724826 C Co:1:043:0 0 8 >
ffff8803a02499c0 1973739659 S Co:1:043:0 s 21 09 0300 0000 0008 8 = 07ff37ff b7ff37ff
ffff8803a02499c0 1973739811 C Co:1:043:0 0 8 >
ffff8803ed332000 1973756535 S Co:1:043:0 s 21 09 0300 0000 0008 8 = 27ff77ff 17ff57ff
ffff8803ed332000 1973756670 C Co:1:043:0 0 8 >
ffff8803ed332000 1973771554 S Co:1:043:0 s 21 09 0300 0000 0008 8 = c7ff17ff 87ffe7ff
ffff8803ed332000 1973771689 C Co:1:043:0 0 8 >
ffff8803ed332e40 1973786619 S Co:1:043:0 s 21 09 0300 0000 0008 8 = 97ff67ff 67ffc7ff
ffff8803ed332e40 1973786851 C Co:1:043:0 0 8 >
ffff8803eb86fcc0 1973803517 S Co:1:043:0 s 21 09 0300 0000 0008 8 = 77ff97ff d7ff37ff
ffff8803eb86fcc0 1973803692 C Co:1:043:0 0 8 >
ffff8803a02499c0 1973818559 S Co:1:043:0 s 21 09 0300 0000 0008 8 = 67ffa7ff 17ffd7ff
ffff8803a02499c0 1973818674 C Co:1:043:0 0 8 >
ffff8803a02499c0 1973833586 S Co:1:043:0 s 21 09 0300 0000 0008 8 = 87ff77ff 07ffe7ff
ffff8803a02499c0 1973833677 C Co:1:043:0 0 8 >
ffff8803eb86f300 1973850637 S Co:1:043:0 s 21 09 0300 0000 0008 8 = 67ff97ff 77ff37ff
ffff8803eb86f300 1973850796 C Co:1:043:0 0 8 >
ffff8803e31079c0 1973865583 S Co:1:043:0 s 21 09 0300 0000 0008 8 = a7ff77ff b7ff57ff
ffff8803e31079c0 1973865735 C Co:1:043:0 0 8 >
ffff8803e31079c0 1973880639 S Co:1:043:0 s 21 09 0300 0000 0008 8 = a7ff67ff a7ffb7ff
ffff8803e31079c0 1973880820 C Co:1:043:0 0 8 >
ffff8803e31079c0 1973895706 S Co:1:043:0 s 21 09 0300 0000 0008 8 = 77ff17ff 07ffa7ff
ffff8803e31079c0 1973895823 C Co:1:043:0 0 8 >
ffff8803ed3329c0 1973912581 S Co:1:043:0 s 21 09 0300 0000 0008 8 = 77ff87ff 57ffc7ff
ffff8803ed3329c0 1973912693 C Co:1:043:0 0 8 >
ffff8803ed3329c0 1973927619 S Co:1:043:0 s 21 09 0300 0000 0008 8 = 97ffd7ff 37ff87ff
ffff8803ed3329c0 1973927824 C Co:1:043:0 0 8 >
ffff8803c7fc3480 1973942590 S Co:1:043:0 s 21 09 0300 0000 0008 8 = 57ff77ff c7ff37ff
ffff8803c7fc3480 1973942817 C Co:1:043:0 0 8 >
ffff8803a0249d80 1973959524 S Co:1:043:0 s 21 09 0300 0000 0008 8 = a7ffb7ff 47ffb7ff
ffff8803a0249d80 1973959691 C Co:1:043:0 0 8 >
ffff8803eb86f300 1973974586 S Co:1:043:0 s 21 09 0300 0000 0008 8 = 47ffb7ff f7ff67ff
ffff8803eb86f300 1973974710 C Co:1:043:0 0 8 >
ffff8803eb86f300 1973989620 S Co:1:043:0 s 21 09 0300 0000 0008 8 = 57fff7ff 57ff37ff
ffff8803eb86f300 1973989820 C Co:1:043:0 0 8 >
ffff8803eb86f300 1974004658 S Co:1:043:0 s 21 09 0300 0000 0008 8 = 37ffe7ff 87fff7ff
ffff8803eb86f300 1974004815 C Co:1:043:0 0 8 >
ffff8803eb86f300 1974021567 S Co:1:043:0 s 21 09 0300 0000 0008 8 = 57ff37ff 17ff17ff
ffff8803eb86f300 1974021674 C Co:1:043:0 0 8 >
ffff8803eb86f300 1974036567 S Co:1:043:0 s 21 09 0300 0000 0008 8 = a7ffc7ff a7ff47ff
ffff8803eb86f300 1974036691 C Co:1:043:0 0 8 >
ffff8803eb86fc00 1974054049 S Co:1:043:0 s 21 09 0300 0000 0008 8 = 57ff57ff 67ce2f01
ffff8803eb86fc00 1974054175 C Co:1:043:0 0 8 >
ffff8803eb86fcc0 1974068928 S Co:1:043:0 s 21 09 0300 0000 0008 8 = 4bcf01a7 cddbc49b
ffff8803eb86fcc0 1974069177 C Co:1:043:0 0 8 >
ffff8803c7fc3480 1974083897 S Co:1:043:0 s 21 09 0300 0000 0008 8 = d8d92cad ef207861
ffff8803c7fc3480 1974084052 C Co:1:043:0 0 8 >
ffff8803c7fc3480 1974098997 S Co:1:043:0 s 21 09 0300 0000 0008 8 = 9cd2766e 1978db76
ffff8803c7fc3480 1974099197 C Co:1:043:0 0 8 >
ffff8803c7fc3480 1974114838 S Co:1:043:0 s 21 09 0300 0000 0008 8 = 42dec206 ba3181d1
ffff8803c7fc3480 1974115047 C Co:1:043:0 0 8 >
ffff8803c7fc3480 1974129932 S Co:1:043:0 s 21 09 0300 0000 0008 8 = 5d57b429 e68f84bf
ffff8803c7fc3480 1974130202 C Co:1:043:0 0 8 >
ffff8803c7fc3480 1974146933 S Co:1:043:0 s 21 09 0300 0000 0008 8 = e24a399c d449005f
ffff8803c7fc3480 1974147192 C Co:1:043:0 0 8 >
ffff8803a0249600 1974161103 S Co:1:043:0 s 21 09 0300 0000 0008 8 = aaf8fdb8 60099425
ffff8803a0249600 1974161303 C Co:1:043:0 0 8 >
ffff8803c7fc39c0 1974177887 S Co:1:043:0 s 21 09 0300 0000 0008 8 = f254f4ec 88eee659
ffff8803c7fc39c0 1974178048 C Co:1:043:0 0 8 >
ffff8803ed3320c0 1974192990 S Co:1:043:0 s 21 09 0300 0000 0008 8 = dd89d53a f10c1d98
ffff8803ed3320c0 1974193192 C Co:1:043:0 0 8 >
ffff8803ed3320c0 1974208027 S Co:1:043:0 s 21 09 0300 0000 0008 8 = ef7398b7 61e86750
ffff8803ed3320c0 1974208188 C Co:1:043:0 0 8 >
ffff8803eb86fcc0 1974224917 S Co:1:043:0 s 21 09 0300 0000 0008 8 = 9223fd0d 44ff7246
ffff8803eb86fcc0 1974225074 C Co:1:043:0 0 8 >
ffff8803eb86fcc0 1974239895 S Co:1:043:0 s 21 09 0300 0000 0008 8 = 935d07fb 293ef512
ffff8803eb86fcc0 1974240049 C Co:1:043:0 0 8 >
ffff8803eb86fcc0 1974255168 S Co:1:043:0 s 21 09 0300 0000 0008 8 = a41c7bd1 4489279f
ffff8803eb86fcc0 1974255311 C Co:1:043:0 0 8 >
ffff8803eb86fcc0 1974270836 S Co:1:043:0 s 21 09 0300 0000 0008 8 = d90b63f7 ec3644ad
ffff8803eb86fcc0 1974271071 C Co:1:043:0 0 8 >
ffff8803eb86fcc0 1974287949 S Co:1:043:0 s 21 09 0300 0000 0008 8 = 2d0b8f65 1c910d51
ffff8803eb86fcc0 1974288205 C Co:1:043:0 0 8 >
ffff8803c7fc39c0 1974302987 S Co:1:043:0 s 21 09 0300 0000 0008 8 = fcb2112a f5584672
ffff8803c7fc39c0 1974303201 C Co:1:043:0 0 8 >
ffff8803c7fc39c0 1974318066 S Co:1:043:0 s 21 09 0300 0000 0008 8 = 88c8bee8 383e394b
ffff8803c7fc39c0 1974318195 C Co:1:043:0 0 8 >
ffff8803c7fc39c0 1974332971 S Co:1:043:0 s 21 09 0300 0000 0008 8 = 77cab254 ce6a30ee
ffff8803c7fc39c0 1974333179 C Co:1:043:0 0 8 >
ffff8803c7fc39c0 1974350002 S Co:1:043:0 s 21 09 0300 0000 0008 8 = 5169cbb8 42f7fcbd
ffff8803c7fc39c0 1974350180 C Co:1:043:0 0 8 >
ffff8803eb86fcc0 1974365021 S Co:1:043:0 s 21 09 0300 0000 0008 8 = 040a2a73 447473f1
ffff8803eb86fcc0 1974365182 C Co:1:043:0 0 8 >
ffff8803a0249600 1974380009 S Co:1:043:0 s 21 09 0300 0000 0008 8 = 6245b775 2664eb16
ffff8803a0249600 1974380202 C Co:1:043:0 0 8 >
ffff8803a0249600 1974396985 S Co:1:043:0 s 21 09 0300 0000 0008 8 = a0689cc6 60bdc28b
ffff8803a0249600 1974397178 C Co:1:043:0 0 8 >
ffff8803a0249600 1974412000 S Co:1:043:0 s 21 09 0300 0000 0008 8 = d8f4c8fe 0d6ad804
ffff8803a0249600 1974412200 C Co:1:043:0 0 8 >
ffff8803a0249600 1974426897 S Co:1:043:0 s 21 09 0300 0000 0008 8 = 851d6bcc 6ecb1109
ffff8803a0249600 1974427075 C Co:1:043:0 0 8 >
ffff8803a0249600 1974443955 S Co:1:043:0 s 21 09 0300 0000 0008 8 = 0b4c7e71 6431d676
ffff8803a0249600 1974444200 C Co:1:043:0 0 8 >
ffff8803eb86fcc0 1974459022 S Co:1:043:0 s 21 09 0300 0000 0008 8 = 2e9e3a44 f86593fb
ffff8803eb86fcc0 1974459199 C Co:1:043:0 0 8 >
ffff8803eb86fcc0 1974474128 S Co:1:043:0 s 21 09 0300 0000 0008 8 = 98649e2e d521389c
ffff8803eb86fcc0 1974474309 C Co:1:043:0 0 8 >
ffff8803c7fc39c0 1974490940 S Co:1:043:0 s 21 09 0300 0000 0008 8 = 56a3ec2e cb93bb31
ffff8803c7fc39c0 1974491204 C Co:1:043:0 0 8 >
ffff8803eb86f780 1974505996 S Co:1:043:0 s 21 09 0300 0000 0008 8 = 5a942ad4 4cdf92e4
ffff8803eb86f780 1974506180 C Co:1:043:0 0 8 >
ffff8803c7fc39c0 1974521030 S Co:1:043:0 s 21 09 0300 0000 0008 8 = f823a4c7 f09c3bb8
ffff8803c7fc39c0 1974521200 C Co:1:043:0 0 8 >
ffff8803c7fc39c0 1974537933 S Co:1:043:0 s 21 09 0300 0000 0008 8 = 6b726642 f254b5fe
ffff8803c7fc39c0 1974538068 C Co:1:043:0 0 8 >
ffff8803c7fc39c0 1974552960 S Co:1:043:0 s 21 09 0300 0000 0008 8 = 4f55c490 b30606e0
ffff8803c7fc39c0 1974553200 C Co:1:043:0 0 8 >
ffff8803c7fc39c0 1974568001 S Co:1:043:0 s 21 09 0300 0000 0008 8 = 26d5d496 34a6b6d8
ffff8803c7fc39c0 1974568201 C Co:1:043:0 0 8 >
ffff8803a0249600 1974584943 S Co:1:043:0 s 21 09 0300 0000 0008 8 = d6b0f147 9f995138
ffff8803a0249600 1974585081 C Co:1:043:0 0 8 >
ffff8803a0249600 1974599983 S Co:1:043:0 s 21 09 0300 0000 0008 8 = 27d53830 bd3ce7a2
ffff8803a0249600 1974600204 C Co:1:043:0 0 8 >
ffff8803c7fc39c0 1974614989 S Co:1:043:0 s 21 09 0300 0000 0008 8 = 48ea0cec 7e5c8d8f
ffff8803c7fc39c0 1974615182 C Co:1:043:0 0 8 >
ffff8803c7fc39c0 1974630054 S Co:1:043:0 s 21 09 0300 0000 0008 8 = 49c894ae 76bddbca
ffff8803c7fc39c0 1974630204 C Co:1:043:0 0 8 >
ffff8803a0249600 1974644903 S Co:1:043:0 s 21 09 0300 0000 0008 8 = a0fb39bc 5c956ef4
ffff8803a0249600 1974645078 C Co:1:043:0 0 8 >
ffff8803a0249600 1974661988 S Co:1:043:0 s 21 09 0300 0000 0008 8 = a6452bf0 8c106500
ffff8803a0249600 1974662258 C Co:1:043:0 0 8 >
ffff8803eb86f600 1974677007 S Co:1:043:0 s 21 09 0300 0000 0008 8 = 191bdb38 84cce6b6
ffff8803eb86f600 1974677214 C Co:1:043:0 0 8 >
ffff8803c7fc39c0 1974692342 S Co:1:043:0 s 21 09 0300 0000 0008 8 = 9a248115 695c9832
ffff8803c7fc39c0 1974692459 C Co:1:043:0 0 8 >
ffff8803ed3320c0 1974708964 S Co:1:043:0 s 21 09 0300 0000 0008 8 = 2ebf951e 81c72964
ffff8803ed3320c0 1974709205 C Co:1:043:0 0 8 >
ffff8803eb86f600 1974723996 S Co:1:043:0 s 21 09 0300 0000 0008 8 = bf7b587c b808c88f
ffff8803eb86f600 1974724204 C Co:1:043:0 0 8 >
ffff8803c7fc39c0 1974738992 S Co:1:043:0 s 21 09 0300 0000 0008 8 = 9a9e4a6d 1e8ea9cc
ffff8803c7fc39c0 1974739183 C Co:1:043:0 0 8 >
ffff8803c7fc39c0 1974755894 S Co:1:043:0 s 21 09 0300 0000 0008 8 = f1a1b3c4 65bb8687
ffff8803c7fc39c0 1974756077 C Co:1:043:0 0 8 >
ffff8803a0249600 1974770928 S Co:1:043:0 s 21 09 0300 0000 0008 8 = 58b11d65 65671bff
ffff8803a0249600 1974771071 C Co:1:043:0 0 8 >
ffff8803a0249600 1974786055 S Co:1:043:0 s 21 09 0300 0000 0008 8 = 4a2ed6cb 995ca7c9
ffff8803a0249600 1974786186 C Co:1:043:0 0 8 >
ffff8803c7fc39c0 1974802937 S Co:1:043:0 s 21 09 0300 0000 0008 8 = a32d7183 a2da6f4b
ffff8803c7fc39c0 1974803177 C Co:1:043:0 0 8 >
ffff8803ed3320c0 1974817993 S Co:1:043:0 s 21 09 0300 0000 0008 8 = 26f843b0 c2133d42
ffff8803ed3320c0 1974818195 C Co:1:043:0 0 8 >
ffff8803ed3320c0 1974833013 S Co:1:043:0 s 21 09 0300 0000 0008 8 = f68be888 60aedb3f
ffff8803ed3320c0 1974833202 C Co:1:043:0 0 8 >
ffff8803eb86f600 1974849926 S Co:1:043:0 s 21 09 0300 0000 0008 8 = 1f16bed4 88459b24
ffff8803eb86f600 1974850082 C Co:1:043:0 0 8 >
ffff8803eb86f600 1974864983 S Co:1:043:0 s 21 09 0300 0000 0008 8 = 0d806772 69e9d0a9
ffff8803eb86f600 1974865203 C Co:1:043:0 0 8 >
ffff8803c7fc39c0 1974880038 S Co:1:043:0 s 21 09 0300 0000 0008 8 = 11e049d4 d79b54db
ffff8803c7fc39c0 1974880210 C Co:1:043:0 0 8 >
ffff8803c7fc39c0 1974896872 S Co:1:043:0 s 21 09 0300 0000 0008 8 = e1040f80 cad3029a
ffff8803c7fc39c0 1974897074 C Co:1:043:0 0 8 >
ffff8803a0249600 1974911969 S Co:1:043:0 s 21 09 0300 0000 0008 8 = 16ec2790 dbfb3b19
ffff8803a0249600 1974912187 C Co:1:043:0 0 8 >
ffff8803a0249cc0 1974926989 S Co:1:043:0 s 21 09 0300 0000 0008 8 = ae4d4432 ccf2635f
ffff8803a0249cc0 1974927184 C Co:1:043:0 0 8 >
ffff8803a0249cc0 1974943848 S Co:1:043:0 s 21 09 0300 0000 0008 8 = 8a11dc27 fe8b63ca
ffff8803a0249cc0 1974944095 C Co:1:043:0 0 8 >
ffff8803a0249cc0 1974958932 S Co:1:043:0 s 21 09 0300 0000 0008 8 = efd4a945 fb0e2789
ffff8803a0249cc0 1974959079 C Co:1:043:0 0 8 >
ffff8803eb86f600 1974973947 S Co:1:043:0 s 21 09 0300 0000 0008 8 = 07672af7 ecb4201f
ffff8803eb86f600 1974974181 C Co:1:043:0 0 8 >
ffff8803eb86f600 1974989085 S Co:1:043:0 s 21 09 0300 0000 0008 8 = 5f4e22ba 212dc1e5
ffff8803eb86f600 1974989205 C Co:1:043:0 0 8 >
ffff8803c7fc39c0 1975005874 S Co:1:043:0 s 21 09 0300 0000 0008 8 = 694415a0 8f1c0487
ffff8803c7fc39c0 1975006073 C Co:1:043:0 0 8 >
ffff8803eb86f600 1975020971 S Co:1:043:0 s 21 09 0300 0000 0008 8 = f9b3cfcf 4b97e484
ffff8803eb86f600 1975021188 C Co:1:043:0 0 8 >
ffff8803eb86ff00 1975037962 S Co:1:043:0 s 21 09 0300 0000 0008 8 = ca3fdf01 11aae1b0
ffff8803eb86ff00 1975038205 C Co:1:043:0 0 8 >
ffff8803a0249cc0 1975052889 S Co:1:043:0 s 21 09 0300 0000 0008 8 = f93b1603 c2d382b3
ffff8803a0249cc0 1975053060 C Co:1:043:0 0 8 >
ffff8803eb86ff00 1975067921 S Co:1:043:0 s 21 09 0300 0000 0008 8 = 862f0b38 e085cc89
ffff8803eb86ff00 1975068058 C Co:1:043:0 0 8 >
ffff8803c7fc3480 1975082953 S Co:1:043:0 s 21 09 0300 0000 0008 8 = d85a9916 12a7ce02
ffff8803c7fc3480 1975083183 C Co:1:043:0 0 8 >
ffff8803ed332d80 1975098800 S Co:1:043:0 s 21 09 0300 0000 0008 8 = 372c5da5 a4141742
ffff8803ed332d80 1975098945 C Co:1:043:0 0 8 >
ffff8803ed332d80 1975114057 S Co:1:043:0 s 21 09 0300 0000 0008 8 = 52ca3a05 061b3c41
ffff8803ed332d80 1975114191 C Co:1:043:0 0 8 >
ffff8803eb86f000 1975130935 S Co:1:043:0 s 21 09 0300 0000 0008 8 = b98dd7e7 4afe564a
ffff8803eb86f000 1975131209 C Co:1:043:0 0 8 >
ffff8803eb86f000 1975146023 S Co:1:043:0 s 21 09 0300 0000 0008 8 = 62811e11 a8757f7d
ffff8803eb86f000 1975146188 C Co:1:043:0 0 8 >
ffff8803e6cd7f00 1975160882 S Co:1:043:0 s 21 09 0300 0000 0008 8 = 27e7bddd fc2a5a4e
ffff8803e6cd7f00 1975161061 C Co:1:043:0 0 8 >
ffff8803e6cd7f00 1975177938 S Co:1:043:0 s 21 09 0300 0000 0008 8 = 44b5a6b8 443d8a06
ffff8803e6cd7f00 1975178186 C Co:1:043:0 0 8 >
ffff8803e6cd7f00 1975192980 S Co:1:043:0 s 21 09 0300 0000 0008 8 = db1391a5 25c03740
ffff8803e6cd7f00 1975193186 C Co:1:043:0 0 8 >
ffff8803c7fc3480 1975207863 S Co:1:043:0 s 21 09 0300 0000 0008 8 = 71de77b9 65398f6b
ffff8803c7fc3480 1975208085 C Co:1:043:0 0 8 >
ffff8803c7fc3480 1975224884 S Co:1:043:0 s 21 09 0300 0000 0008 8 = 7027169f 7125414c
ffff8803c7fc3480 1975225076 C Co:1:043:0 0 8 >
ffff8803ed332d80 1975239905 S Co:1:043:0 s 21 09 0300 0000 0008 8 = a5b37214 d671027b
ffff8803ed332d80 1975240080 C Co:1:043:0 0 8 >
ffff8803c7fc3480 1975255019 S Co:1:043:0 s 21 09 0300 0000 0008 8 = c27b506a c9020ae4
ffff8803c7fc3480 1975255184 C Co:1:043:0 0 8 >
ffff8803c7fc3480 1975273937 S Co:1:043:0 s 21 09 0300 0000 0008 8 = dc2bbb06 a22c9545
ffff8803c7fc3480 1975274119 C Co:1:043:0 0 8 >
ffff8803c7fc3480 1975286950 S Co:1:043:0 s 21 09 0300 0000 0008 8 = eba581e4 5a3c65b4
ffff8803c7fc3480 1975287208 C Co:1:043:0 0 8 >
ffff8803a0249540 1975301996 S Co:1:043:0 s 21 09 0300 0000 0008 8 = 4f7db510 13f03d18
ffff8803a0249540 1975302209 C Co:1:043:0 0 8 >
ffff8803c7fc3480 1975318933 S Co:1:043:0 s 21 09 0300 0000 0008 8 = 477c2c2d 8ffc65ad
ffff8803c7fc3480 1975319084 C Co:1:043:0 0 8 >
ffff8803c7fc3480 1975333941 S Co:1:043:0 s 21 09 0300 0000 0008 8 = 7a1f03f0 b5852a83
ffff8803c7fc3480 1975334208 C Co:1:043:0 0 8 >
ffff8803c7fc3480 1975348983 S Co:1:043:0 s 21 09 0300 0000 0008 8 = 711815a4 11a75dfe
ffff8803c7fc3480 1975349196 C Co:1:043:0 0 8 >
ffff8803c7fc3480 1975363854 S Co:1:043:0 s 21 09 0300 0000 0008 8 = 19ca87a6 53f2d255
ffff8803c7fc3480 1975364078 C Co:1:043:0 0 8 >
ffff8803eb86f000 1975380928 S Co:1:043:0 s 21 09 0300 0000 0008 8 = 43ce3fe7 cde6e015
ffff8803eb86f000 1975381064 C Co:1:043:0 0 8 >
ffff8803eb86f000 1975395954 S Co:1:043:0 s 21 09 0300 0000 0008 8 = 2573666f f87de69d
ffff8803eb86f000 1975396188 C Co:1:043:0 0 8 >
ffff8803c7fc3480 1975412881 S Co:1:043:0 s 21 09 0300 0000 0008 8 = d838ebd6 ed9fc2a1
ffff8803c7fc3480 1975413065 C Co:1:043:0 0 8 >
ffff8803c7fc3480 1975427912 S Co:1:043:0 s 21 09 0300 0000 0008 8 = da5201cc eead59aa
ffff8803c7fc3480 1975428065 C Co:1:043:0 0 8 >
ffff8803c7fc3480 1975442954 S Co:1:043:0 s 21 09 0300 0000 0008 8 = 8c2a9e90 ddf91592
ffff8803c7fc3480 1975443206 C Co:1:043:0 0 8 >
ffff8803ed1603c0 1975458071 S Co:1:043:0 s 21 09 0300 0000 0008 8 = b4defd7a c14a600a
ffff8803ed1603c0 1975458185 C Co:1:043:0 0 8 >
ffff8803ed1603c0 1975473891 S Co:1:043:0 s 21 09 0300 0000 0008 8 = fabd1b74 465b2b16
ffff8803ed1603c0 1975474067 C Co:1:043:0 0 8 >
ffff8803ed1603c0 1975490956 S Co:1:043:0 s 21 09 0300 0000 0008 8 = 6ccd3b7b 3c5b6c8e
ffff8803ed1603c0 1975491188 C Co:1:043:0 0 8 >
ffff8803ed1603c0 1975506013 S Co:1:043:0 s 21 09 0300 0000 0008 8 = fc476420 156c999d
ffff8803ed1603c0 1975506184 C Co:1:043:0 0 8 >
ffff8803ed1603c0 1975520879 S Co:1:043:0 s 21 09 0300 0000 0008 8 = ff18df0b 6a263044
ffff8803ed1603c0 1975521084 C Co:1:043:0 0 8 >
ffff8803ed1603c0 1975536026 S Co:1:043:0 s 21 09 0300 0000 0008 8 = ae60bc74 741331d5
ffff8803ed1603c0 1975536206 C Co:1:043:0 0 8 >
ffff8803ed1603c0 1975551902 S Co:1:043:0 s 21 09 0300 0000 0008 8 = a6f44caa 9533a17a
ffff8803ed1603c0 1975552060 C Co:1:043:0 0 8 >
ffff8803ed1603c0 1975568881 S Co:1:043:0 s 21 09 0300 0000 0008 8 = 6adda68f cf7806ae
ffff8803ed1603c0 1975569070 C Co:1:043:0 0 8 >
ffff8803ed1603c0 1975583916 S Co:1:043:0 s 21 09 0300 0000 0008 8 = ded92518 4948efc1
ffff8803ed1603c0 1975584068 C Co:1:043:0 0 8 >
ffff8803ed1603c0 1975598941 S Co:1:043:0 s 21 09 0300 0000 0008 8 = cbd8e7cf d0006c56
ffff8803ed1603c0 1975599211 C Co:1:043:0 0 8 >
ffff8803ed1603c0 1975615867 S Co:1:043:0 s 21 09 0300 0000 0008 8 = 607e4d53 516d90e6
ffff8803ed1603c0 1975616066 C Co:1:043:0 0 8 >
ffff8803ed1603c0 1975630899 S Co:1:043:0 s 21 09 0300 0000 0008 8 = ada57fd4 6253f43d
ffff8803ed1603c0 1975631066 C Co:1:043:0 0 8 >
ffff8803ed1603c0 1975645962 S Co:1:043:0 s 21 09 0300 0000 0008 8 = 29dae79a b8e935fa
ffff8803ed1603c0 1975646190 C Co:1:043:0 0 8 >
ffff8803ed1603c0 1975662986 S Co:1:043:0 s 21 09 0300 0000 0008 8 = 2bddb37d b0597311
ffff8803ed1603c0 1975663186 C Co:1:043:0 0 8 >
ffff8803ed1603c0 1975677843 S Co:1:043:0 s 21 09 0300 0000 0008 8 = 7223556c c942d24a
ffff8803ed1603c0 1975677940 C Co:1:043:0 0 8 >
ffff8803ed1603c0 1975692925 S Co:1:043:0 s 21 09 0300 0000 0008 8 = 9f5605e9 2538fbc2
ffff8803ed1603c0 1975693088 C Co:1:043:0 0 8 >
ffff8803ed1603c0 1975710018 S Co:1:043:0 s 21 09 0300 0000 0008 8 = b8d23c89 0e409967
ffff8803ed1603c0 1975710214 C Co:1:043:0 0 8 >
ffff8803ed1603c0 1975724890 S Co:1:043:0 s 21 09 0300 0000 0008 8 = a5283876 6d56df7e
ffff8803ed1603c0 1975725085 C Co:1:043:0 0 8 >
ffff8803ed1603c0 1975739917 S Co:1:043:0 s 21 09 0300 0000 0008 8 = b49c7dee 53e9fe1e
ffff8803ed1603c0 1975740064 C Co:1:043:0 0 8 >
ffff8803ed1603c0 1975756978 S Co:1:043:0 s 21 09 0300 0000 0008 8 = 17a850c4 725cb2b4
ffff8803ed1603c0 1975757212 C Co:1:043:0 0 8 >
ffff8803ed1603c0 1975771863 S Co:1:043:0 s 21 09 0300 0000 0008 8 = 63793ddc a385b47f
ffff8803ed1603c0 1975772066 C Co:1:043:0 0 8 >
ffff8803ed1603c0 1975786905 S Co:1:043:0 s 21 09 0300 0000 0008 8 = 117090b1 5f304714
ffff8803ed1603c0 1975787092 C Co:1:043:0 0 8 >
ffff8803ed1603c0 1975801878 S Co:1:043:0 s 21 09 0300 0000 0008 8 = fea0ddd1 489baed9
ffff8803ed1603c0 1975802063 C Co:1:043:0 0 8 >
ffff8803ed1603c0 1975818927 S Co:1:043:0 s 21 09 0300 0000 0008 8 = ed547a5e a0f9b18c
ffff8803ed1603c0 1975819062 C Co:1:043:0 0 8 >
ffff8803ed1603c0 1975833835 S Co:1:043:0 s 21 09 0300 0000 0008 8 = 0288018d cff11ebc
ffff8803ed1603c0 1975833937 C Co:1:043:0 0 8 >
ffff8803ed1603c0 1975848926 S Co:1:043:0 s 21 09 0300 0000 0008 8 = 476dd128 df1e444c
ffff8803ed1603c0 1975849086 C Co:1:043:0 0 8 >
ffff8803ed1603c0 1975865936 S Co:1:043:0 s 21 09 0300 0000 0008 8 = 29e88c0d 018e77f5
ffff8803ed1603c0 1975866187 C Co:1:043:0 0 8 >
ffff8803ed332d80 1975880826 S Co:1:043:0 s 21 09 0300 0000 0008 8 = f91198ae 074691c2
ffff8803ed332d80 1975880957 C Co:1:043:0 0 8 >
ffff8803a0249540 1975895881 S Co:1:043:0 s 21 09 0300 0000 0008 8 = 6db6a192 e9bb6e94
ffff8803a0249540 1975896067 C Co:1:043:0 0 8 >
ffff8803ed332d80 1975912921 S Co:1:043:0 s 21 09 0300 0000 0008 8 = 1fd713d1 43586d9e
ffff8803ed332d80 1975913085 C Co:1:043:0 0 8 >
ffff8803ed332d80 1975927826 S Co:1:043:0 s 21 09 0300 0000 0008 8 = 0b2aa29a d4fcf3e8
ffff8803ed332d80 1975927958 C Co:1:043:0 0 8 >
ffff8803c7fc3480 1975942884 S Co:1:043:0 s 21 09 0300 0000 0008 8 = 1397c4ae ff7beace
ffff8803c7fc3480 1975943091 C Co:1:043:0 0 8 >
ffff8803a02496c0 1975957879 S Co:1:043:0 s 21 09 0300 0000 0008 8 = 7dbb34e4 4b1b3c80
ffff8803a02496c0 1975958083 C Co:1:043:0 0 8 >
ffff8803a02496c0 1975974863 S Co:1:043:0 s 21 09 0300 0000 0008 8 = 71676fa5 e5165b82
ffff8803a02496c0 1975974967 C Co:1:043:0 0 8 >
ffff8803a02496c0 1975989881 S Co:1:043:0 s 21 09 0300 0000 0008 8 = 7d20386f 1b1dba2b
ffff8803a02496c0 1975990069 C Co:1:043:0 0 8 >
ffff8803ed332d80 1976004924 S Co:1:043:0 s 21 09 0300 0000 0008 8 = 139f1654 e0d15328
ffff8803ed332d80 1976005075 C Co:1:043:0 0 8 >
ffff8803eb86ff00 1976020579 S Co:1:043:0 s 21 09 0300 0000 0008 8 = 0850d37b 4d4921f8
ffff8803eb86ff00 1976020715 C Co:1:043:0 0 8 >
ffff8803eb86ff00 1976036498 S Co:1:043:0 s 21 09 0300 0000 0008 8 = 15d4fd9c 1b91a56f
ffff8803eb86ff00 1976036694 C Co:1:043:0 0 8 >
ffff8803c7fc3480 1976051516 S Co:1:043:0 s 21 09 0300 0000 0008 8 = 58816685 2c276436
ffff8803c7fc3480 1976051693 C Co:1:043:0 0 8 >
ffff8803ed332000 1976069587 S Co:1:043:0 s 21 09 0300 0000 0008 8 = d1e0a699 027f6547
ffff8803ed332000 1976069745 C Co:1:043:0 0 8 >
ffff8803ed332e40 1976084439 S Co:1:043:0 s 21 09 0300 0000 0008 8 = e82c954e 457eb573
ffff8803ed332e40 1976084565 C Co:1:043:0 0 8 >
ffff8803ed332e40 1976099519 S Co:1:043:0 s 21 09 0300 0000 0008 8 = e3d7d4ad 3f00e4df
ffff8803ed332e40 1976099694 C Co:1:043:0 0 8 >
ffff8803ed332000 1976114564 S Co:1:043:0 s 21 09 0300 0000 0008 8 = 720643d4 61548880
ffff8803ed332000 1976114694 C Co:1:043:0 0 8 >
ffff8803ed332e40 1976129766 S Co:1:043:0 s 21 09 0300 0000 0008 8 = 26128b75 bdbdb7a4
ffff8803ed332e40 1976129946 C Co:1:043:0 0 8 >
ffff8803ed332e40 1976145495 S Co:1:043:0 s 21 09 0300 0000 0008 8 = f3079357 8cf18f6b
ffff8803ed332e40 1976145700 C Co:1:043:0 0 8 >
ffff8803eb86ff00 1976162535 S Co:1:043:0 s 21 09 0300 0000 0008 8 = b4270dd1 a89cb048
ffff8803eb86ff00 1976162694 C Co:1:043:0 0 8 >
ffff8803c7fc3480 1976177593 S Co:1:043:0 s 21 09 0300 0000 0008 8 = a566e854 11dbbe83
ffff8803c7fc3480 1976177695 C Co:1:043:0 0 8 >
ffff8803c7fc3480 1976192419 S Co:1:043:0 s 21 09 0300 0000 0008 8 = e8eddde0 6ac3e2b7
ffff8803c7fc3480 1976192586 C Co:1:043:0 0 8 >
ffff8803c7fc3480 1976207505 S Co:1:043:0 s 21 09 0300 0000 0008 8 = 039ae58c 7ada4856
ffff8803c7fc3480 1976207709 C Co:1:043:0 0 8 >
ffff8803a02490c0 1976224583 S Co:1:043:0 s 21 09 0300 0000 0008 8 = 5e7cbf01 ae9ba023
ffff8803a02490c0 1976224699 C Co:1:043:0 0 8 >
ffff8803a02490c0 1976239470 S Co:1:043:0 s 21 09 0300 0000 0008 8 = c7596dfd 93f59fb5
ffff8803a02490c0 1976239601 C Co:1:043:0 0 8 >
ffff8803a02490c0 1976255091 S Co:1:043:0 s 21 09 0300 0000 0008 8 = f02ab5d2 5fca7df8
ffff8803a02490c0 1976255221 C Co:1:043:0 0 8 >
ffff8803eb86ff00 1976271561 S Co:1:043:0 s 21 09 0300 0000 0008 8 = ee9ba2e6 687277ad
ffff8803eb86ff00 1976271713 C Co:1:043:0 0 8 >
ffff8803eb86ff00 1976286609 S Co:1:043:0 s 21 09 0300 0000 0008 8 = ba8e0333 a9374de7
ffff8803eb86ff00 1976286717 C Co:1:043:0 0 8 >
ffff8803eb86ff00 1976301433 S Co:1:043:0 s 21 09 0300 0000 0008 8 = b298e9c6 41d9c38f
ffff8803eb86ff00 1976301566 C Co:1:043:0 0 8 >
ffff8803eb86ff00 1976318546 S Co:1:043:0 s 21 09 0300 0000 0008 8 = 17802b42 f50921df
ffff8803eb86ff00 1976318693 C Co:1:043:0 0 8 >
ffff8803eb86ff00 1976333597 S Co:1:043:0 s 21 09 0300 0000 0008 8 = 8ec5e35d acf0b5e8
ffff8803eb86ff00 1976333722 C Co:1:043:0 0 8 >
ffff8803eb86ff00 1976348483 S Co:1:043:0 s 21 09 0300 0000 0008 8 = a116f060 f0a84e0e
ffff8803eb86ff00 1976348572 C Co:1:043:0 0 8 >
ffff8803c7fc3480 1976365538 S Co:1:043:0 s 21 09 0300 0000 0008 8 = 3dd974a8 72bfc189
ffff8803c7fc3480 1976365737 C Co:1:043:0 0 8 >
ffff8803c7fc3480 1976380564 S Co:1:043:0 s 21 09 0300 0000 0008 8 = 33a75629 85b966e4
ffff8803c7fc3480 1976380697 C Co:1:043:0 0 8 >
ffff8803ed332e40 1976395461 S Co:1:043:0 s 21 09 0300 0000 0008 8 = bacdbfe8 9f8d997f
ffff8803ed332e40 1976395574 C Co:1:043:0 0 8 >
ffff8803eb86ff00 1976412530 S Co:1:043:0 s 21 09 0300 0000 0008 8 = e9cb9f7f dd243c0f
ffff8803eb86ff00 1976412696 C Co:1:043:0 0 8 >
ffff8803a02490c0 1976427562 S Co:1:043:0 s 21 09 0300 0000 0008 8 = 40d7279c 7ee0311a
ffff8803a02490c0 1976427728 C Co:1:043:0 0 8 >
ffff8803ed332000 1976442405 S Co:1:043:0 s 21 09 0300 0000 0008 8 = 1e584f80 6511e37e
ffff8803ed332000 1976442587 C Co:1:043:0 0 8 >
ffff8803c7fc3480 1976459514 S Co:1:043:0 s 21 09 0300 0000 0008 8 = 4a6d4f81 9a7fbce9
ffff8803c7fc3480 1976459773 C Co:1:043:0 0 8 >
ffff8803ed332c00 1976474554 S Co:1:043:0 s 21 09 0300 0000 0008 8 = 6c66288a c7e5ae61
ffff8803ed332c00 1976474692 C Co:1:043:0 0 8 >
ffff8803ed332c00 1976489586 S Co:1:043:0 s 21 09 0300 0000 0008 8 = 92471a97 bd72adbc
ffff8803ed332c00 1976489706 C Co:1:043:0 0 8 >
ffff8803c7fc3480 1976506500 S Co:1:043:0 s 21 09 0300 0000 0008 8 = ae4a2d3c ef493126
ffff8803c7fc3480 1976506698 C Co:1:043:0 0 8 >
ffff8803a02490c0 1976521530 S Co:1:043:0 s 21 09 0300 0000 0008 8 = 155cab1e f300b6a0
ffff8803a02490c0 1976521697 C Co:1:043:0 0 8 >
ffff8803ed332c00 1976536586 S Co:1:043:0 s 21 09 0300 0000 0008 8 = 019da277 07233d7d
ffff8803ed332c00 1976536716 C Co:1:043:0 0 8 >
ffff8803eb86f600 1976552537 S Co:1:043:0 s 21 09 0300 0000 0008 8 = 0de36494 87afcbe5
ffff8803eb86f600 1976552766 C Co:1:043:0 0 8 >
ffff8803c7fc3480 1976568514 S Co:1:043:0 s 21 09 0300 0000 0008 8 = bd360958 7999e754
ffff8803c7fc3480 1976568700 C Co:1:043:0 0 8 >
ffff8803a02490c0 1976583572 S Co:1:043:0 s 21 09 0300 0000 0008 8 = f552eab8 04471e1a
ffff8803a02490c0 1976583721 C Co:1:043:0 0 8 >
ffff8803a02490c0 1976600483 S Co:1:043:0 s 21 09 0300 0000 0008 8 = 7f2a253f f31481db
ffff8803a02490c0 1976600594 C Co:1:043:0 0 8 >
ffff8803a02490c0 1976615510 S Co:1:043:0 s 21 09 0300 0000 0008 8 = 88621e8a 35cf230e
ffff8803a02490c0 1976615718 C Co:1:043:0 0 8 >
ffff8803c7fc3480 1976630547 S Co:1:043:0 s 21 09 0300 0000 0008 8 = 22d2facb 5d3a9e80
ffff8803c7fc3480 1976630698 C Co:1:043:0 0 8 >
ffff8803c7fc3480 1976645695 S Co:1:043:0 s 21 09 0300 0000 0008 8 = c1082447 248d8dd0
ffff8803c7fc3480 1976645822 C Co:1:043:0 0 8 >
ffff8803c7fc3480 1976662454 S Co:1:043:0 s 21 09 0300 0000 0008 8 = c0c5cada e4f211f2
ffff8803c7fc3480 1976662574 C Co:1:043:0 0 8 >
ffff8803c7fc3480 1976677538 S Co:1:043:0 s 21 09 0300 0000 0008 8 = db7c5f70 1d094eaf
ffff8803c7fc3480 1976677722 C Co:1:043:0 0 8 >
ffff8803c7fc3480 1976694523 S Co:1:043:0 s 21 09 0300 0000 0008 8 = b5d8198c f263ed21
ffff8803c7fc3480 1976694694 C Co:1:043:0 0 8 >
ffff8803c7fc3480 1976709506 S Co:1:043:0 s 21 09 0300 0000 0008 8 = 513572c3 ab099a3a
ffff8803c7fc3480 1976709719 C Co:1:043:0 0 8 >
ffff8803a02490c0 1976724523 S Co:1:043:0 s 21 09 0300 0000 0008 8 = 9b24a940 32f4853c
ffff8803a02490c0 1976724710 C Co:1:043:0 0 8 >
ffff8803a02490c0 1976739590 S Co:1:043:0 s 21 09 0300 0000 0008 8 = deea403f 9895e440
ffff8803a02490c0 1976739700 C Co:1:043:0 0 8 >
ffff8803c7fc3480 1976756502 S Co:1:043:0 s 21 09 0300 0000 0008 8 = 4e007e94 904d6db1
ffff8803c7fc3480 1976756720 C Co:1:043:0 0 8 >
ffff8803c7fc3480 1976771515 S Co:1:043:0 s 21 09 0300 0000 0008 8 = 7e92ec24 f0f3decf
ffff8803c7fc3480 1976771703 C Co:1:043:0 0 8 >
ffff8803c7fc3480 1976786490 S Co:1:043:0 s 21 09 0300 0000 0008 8 = e801da68 3653772f
ffff8803c7fc3480 1976786572 C Co:1:043:0 0 8 >
ffff8803c7fc3480 1976803464 S Co:1:043:0 s 21 09 0300 0000 0008 8 = 6a63d9ef feab7c38
ffff8803c7fc3480 1976803596 C Co:1:043:0 0 8 >
ffff8803c7fc3480 1976818493 S Co:1:043:0 s 21 09 0300 0000 0008 8 = c50040db 8f2eb5a6
ffff8803c7fc3480 1976818596 C Co:1:043:0 0 8 >
ffff8803c7fc3480 1976833536 S Co:1:043:0 s 21 09 0300 0000 0008 8 = 1ed5a961 4d84f009
ffff8803c7fc3480 1976833721 C Co:1:043:0 0 8 >
ffff8803c7fc3480 1976848577 S Co:1:043:0 s 21 09 0300 0000 0008 8 = 7f13734b 46467c44
ffff8803c7fc3480 1976848723 C Co:1:043:0 0 8 >
ffff8803c7fc3480 1976865435 S Co:1:043:0 s 21 09 0300 0000 0008 8 = 559f4178 a884ae10
ffff8803c7fc3480 1976865571 C Co:1:043:0 0 8 >
ffff8803c7fc3480 1976880537 S Co:1:043:0 s 21 09 0300 0000 0008 8 = f1927759 47405e79
ffff8803c7fc3480 1976880708 C Co:1:043:0 0 8 >
ffff8803c7fc3480 1976895560 S Co:1:043:0 s 21 09 0300 0000 0008 8 = 0ab8c273 19f3695e
ffff8803c7fc3480 1976895713 C Co:1:043:0 0 8 >
ffff8803a02490c0 1976912418 S Co:1:043:0 s 21 09 0300 0000 0008 8 = 38138fe1 bb052ff3
ffff8803a02490c0 1976912588 C Co:1:043:0 0 8 >
ffff8803eb86f600 1976927506 S Co:1:043:0 s 21 09 0300 0000 0008 8 = 785790d2 ec571440
ffff8803eb86f600 1976927701 C Co:1:043:0 0 8 >
ffff8803c7fc3480 1976942551 S Co:1:043:0 s 21 09 0300 0000 0008 8 = ad6d3d05 10bb00a2
ffff8803c7fc3480 1976942697 C Co:1:043:0 0 8 >
ffff8803a02490c0 1976959602 S Co:1:043:0 s 21 09 0300 0000 0008 8 = 1af34e52 ac78e147
ffff8803a02490c0 1976959775 C Co:1:043:0 0 8 >
ffff8803ed332c00 1976974508 S Co:1:043:0 s 21 09 0300 0000 0008 8 = ebb84422 eec826b4
ffff8803ed332c00 1976974743 C Co:1:043:0 0 8 >
ffff8803ed332c00 1976989541 S Co:1:043:0 s 21 09 0300 0000 0008 8 = ac42dff4 245c4340
ffff8803ed332c00 1976989730 C Co:1:043:0 0 8 >
ffff8803eb86f780 1977004782 S Co:1:043:0 s 21 09 0300 0000 0008 8 = ce4aa7d8 42d53298
ffff8803eb86f780 1977004975 C Co:1:043:0 0 8 >
ffff8803eb86f780 1977021502 S Co:1:043:0 s 21 09 0300 0000 0008 8 = 273c66f6 5e4bef3c
ffff8803eb86f780 1977021763 C Co:1:043:0 0 8 >
ffff8803eb86f600 1977036536 S Co:1:043:0 s 21 09 0300 0000 0008 8 = 70baaa06 36c8f9fe
ffff8803eb86f600 1977036702 C Co:1:043:0 0 8 >
ffff8803eb86f600 1977051569 S Co:1:043:0 s 21 09 0300 0000 0008 8 = c71846d7 a7ccd688
ffff8803eb86f600 1977051700 C Co:1:043:0 0 8 >
ffff8803a0249b40 1977067427 S Co:1:043:0 s 21 09 0300 0000 0008 8 = 2de0d0cb 35c88dd5
ffff8803a0249b40 1977067574 C Co:1:043:0 0 8 >
ffff8803eb86fcc0 1977085547 S Co:1:043:0 s 21 09 0300 0000 0008 8 = 074d2257 87a52bb4
ffff8803eb86fcc0 1977085712 C Co:1:043:0 0 8 >
ffff8803eb86fcc0 1977098552 S Co:1:043:0 s 21 09 0300 0000 0008 8 = 9fd2db85 ea3c414b
ffff8803eb86fcc0 1977098723 C Co:1:043:0 0 8 >
ffff8803eb86f600 1977116246 S Co:1:043:0 s 21 09 0300 0000 0008 8 = a292dc73 ccde6390
ffff8803eb86f600 1977116323 C Co:1:043:0 0 8 >
ffff8803eb86fcc0 1977130586 S Co:1:043:0 s 21 09 0300 0000 0008 8 = a2e7ced4 41cca8cf
ffff8803eb86fcc0 1977130709 C Co:1:043:0 0 8 >
ffff8803a0249b40 1977145639 S Co:1:043:0 s 21 09 0300 0000 0008 8 = 94dd996c 80bd2f29
ffff8803a0249b40 1977145826 C Co:1:043:0 0 8 >
ffff88027c064780 1977162670 S Co:1:043:0 s 21 09 0300 0000 0008 8 = 50b6ec96 645d9611
ffff88027c064780 1977162853 C Co:1:043:0 0 8 >
ffff88027c064780 1977177582 S Co:1:043:0 s 21 09 0300 0000 0008 8 = 1667bac0 edca82cf
ffff88027c064780 1977177714 C Co:1:043:0 0 8 >
ffff8803c7fc3480 1977192608 S Co:1:043:0 s 21 09 0300 0000 0008 8 = 0517b9eb be171cff
ffff8803c7fc3480 1977192702 C Co:1:043:0 0 8 >
ffff8803eb86fc00 1977209661 S Co:1:043:0 s 21 09 0300 0000 0008 8 = a4a5e42e 9fcb9011
ffff8803eb86fc00 1977209826 C Co:1:043:0 0 8 >
ffff8803a0249000 1977224579 S Co:1:043:0 s 21 09 0300 0000 0008 8 = 5c21f832 fb628fc9
ffff8803a0249000 1977224723 C Co:1:043:0 0 8 >
ffff8803ed332000 1977239616 S Co:1:043:0 s 21 09 0300 0000 0008 8 = fa4ff8b6 61c8ccbe
ffff8803ed332000 1977239841 C Co:1:043:0 0 8 >
ffff8803ed332000 1977256655 S Co:1:043:0 s 21 09 0300 0000 0008 8 = 2f29aa0a 04e381dd
ffff8803ed332000 1977256840 C Co:1:043:0 0 8 >
ffff8803eb86f300 1977271554 S Co:1:043:0 s 21 09 0300 0000 0008 8 = 115c1a95 3d08e9e5
ffff8803eb86f300 1977271705 C Co:1:043:0 0 8 >
ffff8803eb86f300 1977286522 S Co:1:043:0 s 21 09 0300 0000 0008 8 = 99c81451 0783c4eb
ffff8803eb86f300 1977286719 C Co:1:043:0 0 8 >
ffff8803c7fc3480 1977303634 S Co:1:043:0 s 21 09 0300 0000 0008 8 = 2502ad4c 8011d9d5
ffff8803c7fc3480 1977303850 C Co:1:043:0 0 8 >
ffff8803a0249000 1977318681 S Co:1:043:0 s 21 09 0300 0000 0008 8 = f6d4b927 6c676ee1
ffff8803a0249000 1977318854 C Co:1:043:0 0 8 >
ffff8803eb86f300 1977333511 S Co:1:043:0 s 21 09 0300 0000 0008 8 = b2ba5399 b3abcf1d
ffff8803eb86f300 1977333701 C Co:1:043:0 0 8 >
ffff8803a0249000 1977350646 S Co:1:043:0 s 21 09 0300 0000 0008 8 = e1655beb dff8cfee
ffff8803a0249000 1977350850 C Co:1:043:0 0 8 >
ffff8803ed332000 1977365648 S Co:1:043:0 s 21 09 0300 0000 0008 8 = 7139f17b a2dd408c
ffff8803ed332000 1977365850 C Co:1:043:0 0 8 >
ffff8803eb86f300 1977380556 S Co:1:043:0 s 21 09 0300 0000 0008 8 = 34d1fd3c 4cdc7b82
ffff8803eb86f300 1977380725 C Co:1:043:0 0 8 >
ffff8803eb86f300 1977395618 S Co:1:043:0 s 21 09 0300 0000 0008 8 = 5e77a932 57ecdd31
ffff8803eb86f300 1977395726 C Co:1:043:0 0 8 >
ffff8803eb86f300 1977412649 S Co:1:043:0 s 21 09 0300 0000 0008 8 = 0aafe3f8 ddfa464c
ffff8803eb86f300 1977412831 C Co:1:043:0 0 8 >
ffff8803eb86f300 1977427489 S Co:1:043:0 s 21 09 0300 0000 0008 8 = b5abdd3c 1e629a5b
ffff8803eb86f300 1977427578 C Co:1:043:0 0 8 >
ffff8803c7fc3480 1977442691 S Co:1:043:0 s 21 09 0300 0000 0008 8 = bfd68f3f fe79413a
ffff8803c7fc3480 1977442832 C Co:1:043:0 0 8 >
ffff8803a0249000 1977457615 S Co:1:043:0 s 21 09 0300 0000 0008 8 = ef4c3257 8304a999
ffff8803a0249000 1977457705 C Co:1:043:0 0 8 >
ffff8803a0249000 1977474604 S Co:1:043:0 s 21 09 0300 0000 0008 8 = ee5ec46f 58c0c17b
ffff8803a0249000 1977474702 C Co:1:043:0 0 8 >
ffff8803eb86f300 1977489576 S Co:1:043:0 s 21 09 0300 0000 0008 8 = c9118984 4fda7eb9
ffff8803eb86f300 1977489733 C Co:1:043:0 0 8 >
ffff8803a0249000 1977504601 S Co:1:043:0 s 21 09 0300 0000 0008 8 = 719d8629 d876587f
ffff8803a0249000 1977504726 C Co:1:043:0 0 8 >
ffff8803ed332a80 1977549556 S Co:1:043:0 s 21 09 0300 0000 0008 8 = 5503de6a 84476b02
ffff8803ed332a80 1977549733 C Co:1:043:0 0 8 >
ffff8803eb86fa80 1977568646 S Ci:1:043:0 s a1 01 0300 0000 0008 8 <
ffff8803eb86fa80 1977568855 C Ci:1:043:0 0 8 = aa040000 00000000
ffff8803876b3480 2005166572 C Ii:1:043:1 -71:8 0
ffff8803a0249cc0 2005215758 S Ci:1:043:0 s 80 06 0100 0000 0040 64 <
ffff8803a0249cc0 2005215973 C Ci:1:043:0 -32 0
