ffff8801efc46240 4019346777 S Ci:1:041:0 s 80 06 0100 0000 0012 18 <
ffff8801efc46240 4019346986 C Ci:1:041:0 0 18 = 12011001 00000008 571d01ac 00010102 0001
ffff8801efc46240 4019347005 S Ci:1:041:0 s 80 06 0200 0000 0009 9 <
ffff8801efc46240 4019347232 C Ci:1:041:0 0 9 = 09022200 010100a0 32
ffff8801efc46240 4019347240 S Ci:1:041:0 s 80 06 0200 0000 0022 34 <
ffff8801efc46240 4019347630 C Ci:1:041:0 0 34 = 09022200 010100a0 32090400 00010301 02000921 10010001 22410007 05810308
ffff8803d55683c0 4019347664 C Ii:1:041:1 -108:8 0
ffff8802486996c0 4019548059 S Ci:1:041:0 s 80 06 0100 0000 0040 64 <
ffff8802486996c0 4019548251 C Ci:1:041:0 0 18 = 12011001 00000008 571d01ac 00010102 0001
ffff8803c7d1a0c0 4019615172 S Ci:1:041:0 s 80 06 0100 0000 0012 18 <
ffff8803c7d1a0c0 4019615362 C Ci:1:041:0 0 18 = 12011001 00000008 571d01ac 00010102 0001
ffff8803c7d1a0c0 4019617062 S Ci:1:041:0 s 80 06 0200 0000 00ff 255 <
ffff8803c7d1a0c0 4019617361 C Ci:1:041:0 0 34 = 09022200 010100a0 32090400 00010301 02000921 10010001 22410007 05810308
ffff8803c7d1a0c0 4019619102 S Ci:1:041:0 s 80 06 0300 0000 00ff 255 <
ffff8803c7d1a0c0 4019619244 C Ci:1:041:0 0 4 = 04030904
ffff8803c7d1a0c0 4019621110 S Ci:1:041:0 s 80 06 0302 0409 00ff 255 <
ffff8803c7d1a0c0 4019621485 C Ci:1:041:0 0 40 = 28034800 49004400 2d006300 6f006d00 70006c00 69006100 6e007400 20004d00
ffff8803c7d1a0c0 4019626064 S Ci:1:041:0 s 80 06 0100 0000 0012 18 <
ffff8803c7d1a0c0 4019626237 C Ci:1:041:0 0 18 = 12011001 00000008 571d01ac 00010102 0001
ffff8803c7d1a0c0 4019630659 S Ci:1:041:0 s 80 06 0200 0000 0009 9 <
ffff8803c7d1a0c0 4019630861 C Ci:1:041:0 0 9 = 09022200 010100a0 32
ffff8803c7d1a0c0 4019636622 S Ci:1:041:0 s 80 06 0200 0000 0022 34 <
ffff8803c7d1a0c0 4019636863 C Ci:1:041:0 0 34 = 09022200 010100a0 32090400 00010301 02000921 10010001 22410007 05810308
ffff8803c7d1a0c0 4019642027 S Co:1:041:0 s 21 0a 0000 0000 0000 0
ffff8803c7d1a0c0 4019642125 C Co:1:041:0 0 0
ffff8803c7d1a0c0 4019646584 S Ci:1:041:0 s 81 06 2200 0000 0081 129 <
ffff8803c7d1a0c0 4019646982 C Ci:1:041:0 0 65 = 05010902 a1010901 a1000509 19012905 15002501 95057501 81029501 75038103
ffff8803c7d1a0c0 4019654016 S Ii:1:041:1 -115:8 4 <
ffff880403191840 4065973801 S Co:1:041:0 s 21 09 0300 0000 0008 8 = 55010100 00ff075d
ffff880403191840 4065973881 C Co:1:041:0 0 8 >
ffff8803e300a0c0 4066005929 S Ci:1:041:0 s a1 01 0300 0000 0008 8 <
ffff8803e300a0c0 4066006140 C Ci:1:041:0 0 8 = aa020000 00000000
ffff880402c54300 4066036616 S Co:1:041:0 s 21 09 0300 0000 0008 8 = 0b010101 00000e04
ffff880402c54300 4066036879 C Co:1:041:0 0 8 >
ffff880403191840 4066051663 S Co:1:041:0 s 21 09 0300 0000 0008 8 = 9d2a7915 1d4c747f
ffff880403191840 4066051931 C Co:1:041:0 0 8 >
ffff8804031919c0 4066067553 S Co:1:041:0 s 21 09 0300 0000 0008 8 = 04809000 21019001
ffff8804031919c0 4066067640 C Co:1:041:0 0 8 >
ffff880402c54300 4066085632 S Co:1:041:0 s 21 09 0300 0000 0008 8 = 21809001 237f9002
ffff880402c54300 4066085770 C Co:1:041:0 0 8 >
ffff880402c546c0 4066100695 S Co:1:041:0 s 21 09 0300 0000 0008 8 = 23fb7ffb 4ffb1ffb
ffff880402c546c0 4066100883 C Co:1:041:0 0 8 >
ffff880402c546c0 4066114540 S Co:1:041:0 s 21 09 0300 0000 0008 8 = 0ffbbffb dffb4ffb
ffff880402c546c0 4066114631 C Co:1:041:0 0 8 >
ffff880402c546c0 4066129923 S Co:1:041:0 s 21 09 0300 0000 0008 8 = 6ffbaffb 6ffb8ffb
ffff880402c546c0 4066130010 C Co:1:041:0 0 8 >
ffff8804031919c0 4066146642 S Co:1:041:0 s 21 09 0300 0000 0008 8 = effbaffb cffbfffb
ffff8804031919c0 4066146902 C Co:1:041:0 0 8 >
ffff8804031919c0 4066161736 S Co:1:041:0 s 21 09 0300 0000 0008 8 = 1ffb6ffb 5ffb3ffb
ffff8804031919c0 4066161906 C Co:1:041:0 0 8 >
ffff8804031919c0 4066176909 S Co:1:041:0 s 21 09 0300 0000 0008 8 = 4ffbeffb 1ffb6ffb
ffff8804031919c0 4066177054 C Co:1:041:0 0 8 >
ffff8804031919c0 4066193613 S Co:1:041:0 s 21 09 0300 0000 0008 8 = cffb1ffb affb2ffb
ffff8804031919c0 4066193774 C Co:1:041:0 0 8 >
ffff8804031919c0 4066208660 S Co:1:041:0 s 21 09 0300 0000 0008 8 = 8ffb4ffb 7ffbbffb
ffff8804031919c0 4066208901 C Co:1:041:0 0 8 >
ffff8804031919c0 4066223993 S Co:1:041:0 s 21 09 0300 0000 0008 8 = 2ffbfffb 5ffb8ffb
ffff8804031919c0 4066224161 C Co:1:041:0 0 8 >
ffff880403191600 4066240626 S Co:1:041:0 s 21 09 0300 0000 0008 8 = 0ffb1ffb 6ffbeffb
ffff880403191600 4066240905 C Co:1:041:0 0 8 >
ffff8803e300a480 4066255646 S Co:1:041:0 s 21 09 0300 0000 0008 8 = cffb5ffb fffbfffb
ffff8803e300a480 4066255902 C Co:1:041:0 0 8 >
ffff8803ed3a9c00 4066270618 S Co:1:041:0 s 21 09 0300 0000 0008 8 = effbaffb 0ffb3ffb
ffff8803ed3a9c00 4066270786 C Co:1:041:0 0 8 >
ffff8803ed3a9c00 4066287657 S Co:1:041:0 s 21 09 0300 0000 0008 8 = affb3ffb 7ffb5ffb
ffff8803ed3a9c00 4066287915 C Co:1:041:0 0 8 >
ffff8803ed3a9c00 4066302700 S Co:1:041:0 s 21 09 0300 0000 0008 8 = 5ffb9ffb 6ffbcffb
ffff8803ed3a9c00 4066302907 C Co:1:041:0 0 8 >
ffff8803ed3a9c00 4066319611 S Co:1:041:0 s 21 09 0300 0000 0008 8 = 9ffbeffb 9ffbeffb
ffff8803ed3a9c00 4066319783 C Co:1:041:0 0 8 >
ffff8803ed3a9c00 4066334598 S Co:1:041:0 s 21 09 0300 0000 0008 8 = 3ffb9ffb 2ffb0ffb
ffff8803ed3a9c00 4066334768 C Co:1:041:0 0 8 >
ffff880403191600 4066349668 S Co:1:041:0 s 21 09 0300 0000 0008 8 = effb5ffb 2ffb2ffb
ffff880403191600 4066349951 C Co:1:041:0 0 8 >
ffff8803ed3a9c00 4066364724 S Co:1:041:0 s 21 09 0300 0000 0008 8 = 8ffbdffb 0ffb4ffb
ffff8803ed3a9c00 4066364906 C Co:1:041:0 0 8 >
ffff8803ed3a9c00 4066381633 S Co:1:041:0 s 21 09 0300 0000 0008 8 = 9ffbaffb fffb0ffb
ffff8803ed3a9c00 4066381763 C Co:1:041:0 0 8 >
ffff8803ed3a9c00 4066396609 S Co:1:041:0 s 21 09 0300 0000 0008 8 = effb6ffb 1ffb2ffb
ffff8803ed3a9c00 4066396759 C Co:1:041:0 0 8 >
ffff8803ed3a9c00 4066411704 S Co:1:041:0 s 21 09 0300 0000 0008 8 = 4ffbcffb fffbaffb
ffff8803ed3a9c00 4066411910 C Co:1:041:0 0 8 >
ffff8803ed3a9c00 4066428621 S Co:1:041:0 s 21 09 0300 0000 0008 8 = 1ffbbffb 8ffb0ffb
ffff8803ed3a9c00 4066428764 C Co:1:041:0 0 8 >
ffff8803ed3a9c00 4066443602 S Co:1:041:0 s 21 09 0300 0000 0008 8 = 5ffbbffb fffbbffb
ffff8803ed3a9c00 4066443762 C Co:1:041:0 0 8 >
ffff8803ed3a9c00 4066458633 S Co:1:041:0 s 21 09 0300 0000 0008 8 = 8ffb5ffb 0ffbbffb
ffff8803ed3a9c00 4066458885 C Co:1:041:0 0 8 >
ffff8803ed3a9c00 4066473674 S Co:1:041:0 s 21 09 0300 0000 0008 8 = 9ffb4ffb dffbeffb
ffff8803ed3a9c00 4066473885 C Co:1:041:0 0 8 >
ffff8803ed3a9c00 4066490648 S Co:1:041:0 s 21 09 0300 0000 0008 8 = dffb3ffb 5ffbdffb
ffff8803ed3a9c00 4066490910 C Co:1:041:0 0 8 >
ffff8803ed3a9c00 4066505639 S Co:1:041:0 s 21 09 0300 0000 0008 8 = affb6ffb 7ffb9ffb
ffff8803ed3a9c00 4066505761 C Co:1:041:0 0 8 >
ffff8803ed3a9c00 4066520657 S Co:1:041:0 s 21 09 0300 0000 0008 8 = 2ffb2ffb 9ffb3ffb
ffff8803ed3a9c00 4066520903 C Co:1:041:0 0 8 >
ffff8804031919c0 4066537581 S Co:1:041:0 s 21 09 0300 0000 0008 8 = bffbcffb effb1ffb
ffff8804031919c0 4066537769 C Co:1:041:0 0 8 >
ffff8803e300a480 4066552615 S Co:1:041:0 s 21 09 0300 0000 0008 8 = cffb8ffb 2ffbbffb
ffff8803e300a480 4066552783 C Co:1:041:0 0 8 >
ffff8803e300a480 4066567710 S Co:1:041:0 s 21 09 0300 0000 0008 8 = bffb4ffb effb8ffb
ffff8803e300a480 4066567957 C Co:1:041:0 0 8 >
ffff8803e300a480 4066584571 S Co:1:041:0 s 21 09 0300 0000 0008 8 = dffbbffb affb5ffb
ffff8803e300a480 4066584785 C Co:1:041:0 0 8 >
ffff8803e300a480 4066599667 S Co:1:041:0 s 21 09 0300 0000 0008 8 = 0f0071ff 87ffc7ff
ffff8803e300a480 4066599890 C Co:1:041:0 0 8 >
ffff8803ed3a9c00 4066614701 S Co:1:041:0 s 21 09 0300 0000 0008 8 = 47ff57ff e7ff07ff
ffff8803ed3a9c00 4066614910 C Co:1:041:0 0 8 >
ffff8803ed3a9c00 4066631696 S Co:1:041:0 s 21 09 0300 0000 0008 8 = e7ff37ff 97ff97ff
ffff8803ed3a9c00 4066631896 C Co:1:041:0 0 8 >
ffff880402c540c0 4066646624 S Co:1:041:0 s 21 09 0300 0000 0008 8 = 07ff27ff 27ff07ff
ffff880402c540c0 4066646822 C Co:1:041:0 0 8 >
ffff880402c54540 4066661633 S Co:1:041:0 s 21 09 0300 0000 0008 8 = e7ffe7ff 57ffa7ff
ffff880402c54540 4066661767 C Co:1:041:0 0 8 >
ffff880403191600 4066676694 S Co:1:041:0 s 21 09 0300 0000 0008 8 = d7ff47ff c7ff57ff
ffff880403191600 4066676910 C Co:1:041:0 0 8 >
ffff880403191600 4066693620 S Co:1:041:0 s 21 09 0300 0000 0008 8 = b7ff47ff 77ff47ff
ffff880403191600 4066693766 C Co:1:041:0 0 8 >
ffff880403191600 4066708660 S Co:1:041:0 s 21 09 0300 0000 0008 8 = 67ffe7ff 97ff57ff
ffff880403191600 4066708930 C Co:1:041:0 0 8 >
ffff880403191600 4066723708 S Co:1:041:0 s 21 09 0300 0000 0008 8 = 27ffb7ff 37ffc7ff
ffff880403191600 4066723909 C Co:1:041:0 0 8 >
ffff880403191600 4066740571 S Co:1:041:0 s 21 09 0300 0000 0008 8 = 47ff77ff 47ff67ff
ffff880403191600 4066740781 C Co:1:041:0 0 8 >
ffff8803e300a300 4066755657 S Co:1:041:0 s 21 09 0300 0000 0008 8 = 07ffd7ff 77ff27ff
ffff8803e300a300 4066755890 C Co:1:041:0 0 8 >
ffff8803e300a300 4066770901 S Co:1:041:0 s 21 09 0300 0000 0008 8 = e7ff87ff 57ffe7ff
ffff8803e300a300 4066771042 C Co:1:041:0 0 8 >
ffff8803e300a300 4066787552 S Co:1:041:0 s 21 09 0300 0000 0008 8 = a7ffe7ff 57ff57ff
ffff8803e300a300 4066787679 C Co:1:041:0 0 8 >
ffff8803e300a300 4066802641 S Co:1:041:0 s 21 09 0300 0000 0008 8 = 97ff27ff 17ff47ff
ffff8803e300a300 4066802766 C Co:1:041:0 0 8 >
ffff8803e300a300 4066817643 S Co:1:041:0 s 21 09 0300 0000 0008 8 = 07ff77ff d7ff07ff
ffff8803e300a300 4066817890 C Co:1:041:0 0 8 >
ffff8803e300a300 4066834675 S Co:1:041:0 s 21 09 0300 0000 0008 8 = 97ff17ff 67ff37ff
ffff8803e300a300 4066834907 C Co:1:041:0 0 8 >
ffff8803e300a300 4066849645 S Co:1:041:0 s 21 09 0300 0000 0008 8 = a7ffb7ff 17ffd7ff
ffff8803e300a300 4066849918 C Co:1:041:0 0 8 >
ffff8803ed3a9c00 4066864692 S Co:1:041:0 s 21 09 0300 0000 0008 8 = 27ffd7ff 27ff47ff
ffff8803ed3a9c00 4066864912 C Co:1:041:0 0 8 >
ffff880403191600 4066881712 S Co:1:041:0 s 21 09 0300 0000 0008 8 = 07ff07ff 17ff17ff
ffff880403191600 4066881916 C Co:1:041:0 0 8 >
ffff8803ed3a9c00 4066896566 S Co:1:041:0 s 21 09 0300 0000 0008 8 = 07ffa7ff c7ff57ff
ffff8803ed3a9c00 4066896667 C Co:1:041:0 0 8 >
ffff8803ed3a9c00 4066911642 S Co:1:041:0 s 21 09 0300 0000 0008 8 = b7ff87ff 17ff07ff
ffff8803ed3a9c00 4066911890 C Co:1:041:0 0 8 >
ffff8803ed3a9c00 4066928675 S Co:1:041:0 s 21 09 0300 0000 0008 8 = 67ff57ff a7ff07ff
ffff8803ed3a9c00 4066928888 C Co:1:041:0 0 8 >
ffff8803ed3a9240 4066943554 S Co:1:041:0 s 21 09 0300 0000 0008 8 = 97ff97ff 07ffa7ff
ffff8803ed3a9240 4066943782 C Co:1:041:0 0 8 >
ffff880403191600 4066958648 S Co:1:041:0 s 21 09 0300 0000 0008 8 = d7ff97ff c7ff67ff
ffff880403191600 4066958912 C Co:1:041:0 0 8 >
ffff8803e300a0c0 4066975713 S Co:1:041:0 s 21 09 0300 0000 0008 8 = 87ff27ff 37fff7ff
ffff8803e300a0c0 4066975893 C Co:1:041:0 0 8 >
ffff8803e300a0c0 4066990732 S Co:1:041:0 s 21 09 0300 0000 0008 8 = 27ffa7ff 17ff47ff
ffff8803e300a0c0 4066990898 C Co:1:041:0 0 8 >
ffff8803ed3a9540 4067005614 S Co:1:041:0 s 21 09 0300 0000 0008 8 = 97ff77ff a7ff67ff
ffff8803ed3a9540 4067005770 C Co:1:041:0 0 8 >
ffff8803ed3a9540 4067020606 S Co:1:041:0 s 21 09 0300 0000 0008 8 = e7ff97ff 07ffd7ff
ffff8803ed3a9540 4067020764 C Co:1:041:0 0 8 >
ffff8803ed3a9900 4067038624 S Co:1:041:0 s 21 09 0300 0000 0008 8 = 17ff77ff 97ffc7ff
ffff8803ed3a9900 4067038765 C Co:1:041:0 0 8 >
ffff8803ed3a9900 4067053603 S Co:1:041:0 s 21 09 0300 0000 0008 8 = 87ff07ff 17ff17ff
ffff8803ed3a9900 4067053766 C Co:1:041:0 0 8 >
ffff8803e300a000 4067068590 S Co:1:041:0 s 21 09 0300 0000 0008 8 = 37ff47ff 27ff37ff
ffff8803e300a000 4067068765 C Co:1:041:0 0 8 >
ffff8803ed3a9000 4067083666 S Co:1:041:0 s 21 09 0300 0000 0008 8 = 67ff87ff 47ff67ff
ffff8803ed3a9000 4067083924 C Co:1:041:0 0 8 >
ffff8803e300a480 4067099582 S Co:1:041:0 s 21 09 0300 0000 0008 8 = 97ffb7ff a7ff0fff
ffff8803e300a480 4067099770 C Co:1:041:0 0 8 >
ffff8803e300a480 4067114604 S Co:1:041:0 s 21 09 0300 0000 0008 8 = c7ff1fff 97ffdfff
ffff8803e300a480 4067114788 C Co:1:041:0 0 8 >
ffff8803e300a480 4067129642 S Co:1:041:0 s 21 09 0300 0000 0008 8 = b7ffdfff 27ff2fff
ffff8803e300a480 4067129768 C Co:1:041:0 0 8 >
ffff8803e300a480 4067146514 S Co:1:041:0 s 21 09 0300 0000 0008 8 = b7ffafff a7ffefff
ffff8803e300a480 4067146652 C Co:1:041:0 0 8 >
ffff8803ed3a96c0 4067161538 S Co:1:041:0 s 21 09 0300 0000 0008 8 = 87ff6fff 07ff7fff
ffff8803ed3a96c0 4067161640 C Co:1:041:0 0 8 >
ffff880403191780 4067176629 S Co:1:041:0 s 21 09 0300 0000 0008 8 = 67ff9fff e7ffffff
ffff880403191780 4067176796 C Co:1:041:0 0 8 >
ffff8803ed3a96c0 4067193690 S Co:1:041:0 s 21 09 0300 0000 0008 8 = b7ff4fff 57ff9fff
ffff8803ed3a96c0 4067193895 C Co:1:041:0 0 8 >
ffff880402c540c0 4067208616 S Co:1:041:0 s 21 09 0300 0000 0008 8 = 97ff3fff 77ff9fff
ffff880402c540c0 4067208818 C Co:1:041:0 0 8 >
ffff880402c540c0 4067223617 S Co:1:041:0 s 21 09 0300 0000 0008 8 = 97ff3fff 97ff1fff
ffff880402c540c0 4067223770 C Co:1:041:0 0 8 >
ffff880402c540c0 4067240679 S Co:1:041:0 s 21 09 0300 0000 0008 8 = 37ff7fff 67ff5fff
ffff880402c540c0 4067240916 C Co:1:041:0 0 8 >
ffff880402c540c0 4067255567 S Co:1:041:0 s 21 09 0300 0000 0008 8 = 27ffffff c7ff3fff
ffff880402c540c0 4067255790 C Co:1:041:0 0 8 >
ffff880402c540c0 4067270601 S Co:1:041:0 s 21 09 0300 0000 0008 8 = e7ff0fff 47ffefff
ffff880402c540c0 4067270817 C Co:1:041:0 0 8 >
ffff880402c540c0 4067285654 S Co:1:041:0 s 21 09 0300 0000 0008 8 = d7ff1fff 67ff2fff
ffff880402c540c0 4067285912 C Co:1:041:0 0 8 >
ffff880402c540c0 4067302640 S Co:1:041:0 s 21 09 0300 0000 0008 8 = 57ff1fff c7ff0fff
ffff880402c540c0 4067302891 C Co:1:041:0 0 8 >
ffff880403191780 4067317593 S Co:1:041:0 s 21 09 0300 0000 0008 8 = 07ff6fff b7ffcfff
ffff880403191780 4067317772 C Co:1:041:0 0 8 >
ffff8803a009e540 4067332677 S Co:1:041:0 s 21 09 0300 0000 0008 8 = d7ffdfff f7ff8fff
ffff8803a009e540 4067332918 C Co:1:041:0 0 8 >
ffff8803a009e540 4067349633 S Co:1:041:0 s 21 09 0300 0000 0008 8 = 77ff4fff 07ff1fff
ffff8803a009e540 4067349786 C Co:1:041:0 0 8 >
ffff8803a009e540 4067364594 S Co:1:041:0 s 21 09 0300 0000 0008 8 = f7ffefff f7ff5fff
ffff8803a009e540 4067364773 C Co:1:041:0 0 8 >
ffff8803a009e540 4067379618 S Co:1:041:0 s 21 09 0300 0000 0008 8 = c7ff7fff 97ff8fff
ffff8803a009e540 4067379772 C Co:1:041:0 0 8 >
ffff8803a009e540 4067396671 S Co:1:041:0 s 21 09 0300 0000 0008 8 = c7ffefff 87ff6fff
ffff8803a009e540 4067396904 C Co:1:041:0 0 8 >
ffff8803a009e540 4067411582 S Co:1:041:0 s 21 09 0300 0000 0008 8 = f7ff4fff e7ffbfff
ffff8803a009e540 4067411781 C Co:1:041:0 0 8 >
ffff8803a009e540 4067426746 S Co:1:041:0 s 21 09 0300 0000 0008 8 = a7ffcfff 37ffcfff
ffff8803a009e540 4067426904 C Co:1:041:0 0 8 >
ffff8803a009e540 4067443680 S Co:1:041:0 s 21 09 0300 0000 0008 8 = f7ff4fff 37ffdfff
ffff8803a009e540 4067443920 C Co:1:041:0 0 8 >
ffff8803a009e540 4067458697 S Co:1:041:0 s 21 09 0300 0000 0008 8 = 67ff9fff 57ffbfff
ffff8803a009e540 4067458905 C Co:1:041:0 0 8 >
ffff8803a009e540 4067473537 S Co:1:041:0 s 21 09 0300 0000 0008 8 = 07ffbfff 07ff0fff
ffff8803a009e540 4067473651 C Co:1:041:0 0 8 >
ffff8803a009e540 4067490596 S Co:1:041:0 s 21 09 0300 0000 0008 8 = 37ffbfff f7ff3fff
ffff8803a009e540 4067490788 C Co:1:041:0 0 8 >
ffff8803a009e540 4067505691 S Co:1:041:0 s 21 09 0300 0000 0008 8 = 67ff1fff a7ff3fff
ffff8803a009e540 4067505896 C Co:1:041:0 0 8 >
ffff8803a009e540 4067520580 S Co:1:041:0 s 21 09 0300 0000 0008 8 = b7ff8fff e7ffdfff
ffff8803a009e540 4067520772 C Co:1:041:0 0 8 >
ffff8803a009e540 4067537647 S Co:1:041:0 s 21 09 0300 0000 0008 8 = a7ff9fff 87ff3fff
ffff8803a009e540 4067537826 C Co:1:041:0 0 8 >
ffff8803a009e540 4067552629 S Co:1:041:0 s 21 09 0300 0000 0008 8 = b7ffffff e7ffbfff
ffff8803a009e540 4067552778 C Co:1:041:0 0 8 >
ffff8803a009e540 4067567516 S Co:1:041:0 s 21 09 0300 0000 0008 8 = 47ff9fff 17ff9fff
ffff8803a009e540 4067567663 C Co:1:041:0 0 8 >
ffff8803a009e540 4067584626 S Co:1:041:0 s 21 09 0300 0000 0008 8 = b7ffafff 27ff8fff
ffff8803a009e540 4067584795 C Co:1:041:0 0 8 >
ffff8803a009e540 4067599664 S Co:1:041:0 s 21 09 0300 0000 0008 8 = 272ad1d3 6b06fe94
ffff8803a009e540 4067599908 C Co:1:041:0 0 8 >
ffff8803a009e540 4067614501 S Co:1:041:0 s 21 09 0300 0000 0008 8 = ee971316 fe2822a9
ffff8803a009e540 4067614668 C Co:1:041:0 0 8 >
ffff8803a009e540 4067631622 S Co:1:041:0 s 21 09 0300 0000 0008 8 = dbdb7893 e0bd6852
ffff8803a009e540 4067631772 C Co:1:041:0 0 8 >
ffff8803e300a480 4067646646 S Co:1:041:0 s 21 09 0300 0000 0008 8 = ef285d15 1b5e1f75
ffff8803e300a480 4067646782 C Co:1:041:0 0 8 >
ffff8803e300a480 4067661687 S Co:1:041:0 s 21 09 0300 0000 0008 8 = 98636578 e01b9cc8
ffff8803e300a480 4067661921 C Co:1:041:0 0 8 >
ffff8803e300a480 4067678592 S Co:1:041:0 s 21 09 0300 0000 0008 8 = 27a4f730 02f6b758
ffff8803e300a480 4067678774 C Co:1:041:0 0 8 >
ffff8803e300a480 4067693629 S Co:1:041:0 s 21 09 0300 0000 0008 8 = 53babdc1 78674d04
ffff8803e300a480 4067693783 C Co:1:041:0 0 8 >
ffff8803e300a480 4067708681 S Co:1:041:0 s 21 09 0300 0000 0008 8 = b4a32447 ddd9be00
ffff8803e300a480 4067708919 C Co:1:041:0 0 8 >
ffff8803ed3a96c0 4067723514 S Co:1:041:0 s 21 09 0300 0000 0008 8 = 4716e1ee f12a6e54
ffff8803ed3a96c0 4067723646 C Co:1:041:0 0 8 >
ffff880402c54300 4067740636 S Co:1:041:0 s 21 09 0300 0000 0008 8 = eefc6878 172d455c
ffff880402c54300 4067740774 C Co:1:041:0 0 8 >
ffff8803e300a480 4067755662 S Co:1:041:0 s 21 09 0300 0000 0008 8 = eff075bc d7293149
ffff8803e300a480 4067755894 C Co:1:041:0 0 8 >
ffff8803e300a480 4067770678 S Co:1:041:0 s 21 09 0300 0000 0008 8 = 73c48524 5b58a19d
ffff8803e300a480 4067770930 C Co:1:041:0 0 8 >
ffff8803e300a480 4067787621 S Co:1:041:0 s 21 09 0300 0000 0008 8 = 06fd5c2c f46b09b0
ffff8803e300a480 4067787798 C Co:1:041:0 0 8 >
ffff8803e300a480 4067802649 S Co:1:041:0 s 21 09 0300 0000 0008 8 = 1b547fe8 9503632f
ffff8803e300a480 4067802800 C Co:1:041:0 0 8 >
ffff8803ed3a96c0 4067817820 S Co:1:041:0 s 21 09 0300 0000 0008 8 = 8736b97c 5538ab99
ffff8803ed3a96c0 4067817927 C Co:1:041:0 0 8 >
ffff880403191780 4067834549 S Co:1:041:0 s 21 09 0300 0000 0008 8 = 044298a3 ef1460c3
ffff880403191780 4067834656 C Co:1:041:0 0 8 >
ffff880403191780 4067849643 S Co:1:041:0 s 21 09 0300 0000 0008 8 = aed0ef2b 43170854
ffff880403191780 4067849900 C Co:1:041:0 0 8 >
ffff8803ed3a96c0 4067864670 S Co:1:041:0 s 21 09 0300 0000 0008 8 = 87665376 d4b2aa48
ffff8803ed3a96c0 4067864798 C Co:1:041:0 0 8 >
ffff880402c54300 4067879513 S Co:1:041:0 s 21 09 0300 0000 0008 8 = f443a0f9 4ace536e
ffff880402c54300 4067879648 C Co:1:041:0 0 8 >
ffff8803ed3a96c0 4067896623 S Co:1:041:0 s 21 09 0300 0000 0008 8 = 3fd674be ef4494eb
ffff8803ed3a96c0 4067896795 C Co:1:041:0 0 8 >
ffff8803ed3a96c0 4067911669 S Co:1:041:0 s 21 09 0300 0000 0008 8 = 1545b1e3 346501b7
ffff8803ed3a96c0 4067911919 C Co:1:041:0 0 8 >
ffff8803ed3a96c0 4067926558 S Co:1:041:0 s 21 09 0300 0000 0008 8 = 08e9fd1b 2c71b11e
ffff8803ed3a96c0 4067926681 C Co:1:041:0 0 8 >
ffff8803ed3a96c0 4067943616 S Co:1:041:0 s 21 09 0300 0000 0008 8 = 0ccf432a 0e22c33f
ffff8803ed3a96c0 4067943797 C Co:1:041:0 0 8 >
ffff8803ed3a96c0 4067958658 S Co:1:041:0 s 21 09 0300 0000 0008 8 = fc37326b b521d58e
ffff8803ed3a96c0 4067958924 C Co:1:041:0 0 8 >
ffff8803ed3a96c0 4067973951 S Co:1:041:0 s 21 09 0300 0000 0008 8 = 1516bb4c 218d8c53
ffff8803ed3a96c0 4067974157 C Co:1:041:0 0 8 >
ffff8803ed3a96c0 4067990549 S Co:1:041:0 s 21 09 0300 0000 0008 8 = 779695cf f579112a
ffff8803ed3a96c0 4067990648 C Co:1:041:0 0 8 >
ffff8803ed3a96c0 4068005637 S Co:1:041:0 s 21 09 0300 0000 0008 8 = a992ba08 f96c9083
ffff8803ed3a96c0 4068005778 C Co:1:041:0 0 8 >
ffff8803ed3a96c0 4068020670 S Co:1:041:0 s 21 09 0300 0000 0008 8 = 141de9a4 98e1ba22
ffff8803ed3a96c0 4068020923 C Co:1:041:0 0 8 >
ffff880403191300 4068037540 S Co:1:041:0 s 21 09 0300 0000 0008 8 = 84fa245e 61c7429e
ffff880403191300 4068037648 C Co:1:041:0 0 8 >
ffff880403191300 4068052638 S Co:1:041:0 s 21 09 0300 0000 0008 8 = ad233289 880162e4
ffff880403191300 4068052775 C Co:1:041:0 0 8 >
ffff880403191300 4068067679 S Co:1:041:0 s 21 09 0300 0000 0008 8 = a2451c8b 64e555b3
ffff880403191300 4068067924 C Co:1:041:0 0 8 >
ffff880403191300 4068084595 S Co:1:041:0 s 21 09 0300 0000 0008 8 = 5d40b25f f0bfdc1f
ffff880403191300 4068084785 C Co:1:041:0 0 8 >
ffff8803e300a480 4068098720 S Co:1:041:0 s 21 09 0300 0000 0008 8 = 3caa0510 4c4cbb11
ffff8803e300a480 4068098905 C Co:1:041:0 0 8 >
ffff8803ed3a96c0 4068115793 S Co:1:041:0 s 21 09 0300 0000 0008 8 = 804bec43 3b413bc4
ffff8803ed3a96c0 4068115900 C Co:1:041:0 0 8 >
ffff8803ed3a9240 4068130630 S Co:1:041:0 s 21 09 0300 0000 0008 8 = ce9f82ab a5c4a747
ffff8803ed3a9240 4068130918 C Co:1:041:0 0 8 >
ffff8803ed3a9240 4068145741 S Co:1:041:0 s 21 09 0300 0000 0008 8 = b059a494 15f0d2ff
ffff8803ed3a9240 4068145903 C Co:1:041:0 0 8 >
ffff8803e300a3c0 4068161723 S Co:1:041:0 s 21 09 0300 0000 0008 8 = 14dd765c 3a538e24
ffff8803e300a3c0 4068161917 C Co:1:041:0 0 8 >
ffff8803e300a6c0 4068176880 S Co:1:041:0 s 21 09 0300 0000 0008 8 = c9c3ddf3 68723441
ffff8803e300a6c0 4068177024 C Co:1:041:0 0 8 >
ffff880402c546c0 4068192696 S Co:1:041:0 s 21 09 0300 0000 0008 8 = 07590360 154121b7
ffff880402c546c0 4068192915 C Co:1:041:0 0 8 >
ffff880402c54300 4068210068 S Co:1:041:0 s 21 09 0300 0000 0008 8 = e61fd83d 5fae3538
ffff880402c54300 4068210175 C Co:1:041:0 0 8 >
ffff880402c54300 4068224679 S Co:1:041:0 s 21 09 0300 0000 0008 8 = e44b8e38 8315544e
ffff880402c54300 4068224922 C Co:1:041:0 0 8 >
ffff880402c54300 4068239519 S Co:1:041:0 s 21 09 0300 0000 0008 8 = 61451a92 65cae6d4
ffff880402c54300 4068239655 C Co:1:041:0 0 8 >
ffff880402c54300 4068254573 S Co:1:041:0 s 21 09 0300 0000 0008 8 = 242ab8a2 0d95597a
ffff880402c54300 4068254664 C Co:1:041:0 0 8 >
ffff880402c54300 4068271671 S Co:1:041:0 s 21 09 0300 0000 0008 8 = d64b6650 26309c44
ffff880402c54300 4068271959 C Co:1:041:0 0 8 >
ffff880402c54300 4068286573 S Co:1:041:0 s 21 09 0300 0000 0008 8 = 83ac659d 7fc9a409
ffff880402c54300 4068286780 C Co:1:041:0 0 8 >
ffff8803ed3a9840 4068302553 S Co:1:041:0 s 21 09 0300 0000 0008 8 = 1f88be18 8c84e9f6
ffff8803ed3a9840 4068302794 C Co:1:041:0 0 8 >
ffff880402c54300 4068317650 S Co:1:041:0 s 21 09 0300 0000 0008 8 = fdcab968 e4f7e80a
ffff880402c54300 4068317830 C Co:1:041:0 0 8 >
ffff8804031919c0 4068333676 S Co:1:041:0 s 21 09 0300 0000 0008 8 = 579365c7 c2aea099
ffff8804031919c0 4068333922 C Co:1:041:0 0 8 >
ffff8804031919c0 4068348596 S Co:1:041:0 s 21 09 0300 0000 0008 8 = cbb91582 86a717cb
ffff8804031919c0 4068348781 C Co:1:041:0 0 8 >
ffff8804031919c0 4068365644 S Co:1:041:0 s 21 09 0300 0000 0008 8 = da44de7c 33d5d41c
ffff8804031919c0 4068365800 C Co:1:041:0 0 8 >
ffff8804031919c0 4068380684 S Co:1:041:0 s 21 09 0300 0000 0008 8 = 6af11dab f19f65dd
ffff8804031919c0 4068380929 C Co:1:041:0 0 8 >
ffff880402c54300 4068395576 S Co:1:041:0 s 21 09 0300 0000 0008 8 = 43b1ed98 8b60d9b0
ffff880402c54300 4068395682 C Co:1:041:0 0 8 >
ffff8804031919c0 4068412642 S Co:1:041:0 s 21 09 0300 0000 0008 8 = 9329b3e1 f0e7440d
ffff8804031919c0 4068412805 C Co:1:041:0 0 8 >
ffff8803ed3a9840 4068427619 S Co:1:041:0 s 21 09 0300 0000 0008 8 = 6c3295b8 b4f740c1
ffff8803ed3a9840 4068427783 C Co:1:041:0 0 8 >
ffff880403191840 4068442515 S Co:1:041:0 s 21 09 0300 0000 0008 8 = 4358fc63 8ec6686c
ffff880403191840 4068442673 C Co:1:041:0 0 8 >
ffff8803e300a6c0 4068459622 S Co:1:041:0 s 21 09 0300 0000 0008 8 = 715d18bc d97fde00
ffff8803e300a6c0 4068459782 C Co:1:041:0 0 8 >
ffff8803e300a6c0 4068474663 S Co:1:041:0 s 21 09 0300 0000 0008 8 = b3b55ab0 15c2c447
ffff8803e300a6c0 4068474927 C Co:1:041:0 0 8 >
ffff8803ed3a9840 4068489699 S Co:1:041:0 s 21 09 0300 0000 0008 8 = ac09f9c2 6621c45c
ffff8803ed3a9840 4068489906 C Co:1:041:0 0 8 >
ffff8803ed3a9840 4068506614 S Co:1:041:0 s 21 09 0300 0000 0008 8 = 60b66f88 12a38b2e
ffff8803ed3a9840 4068506782 C Co:1:041:0 0 8 >
ffff8803ed3a9840 4068521655 S Co:1:041:0 s 21 09 0300 0000 0008 8 = b94dfb2a 04434703
ffff8803ed3a9840 4068521912 C Co:1:041:0 0 8 >
ffff8804031910c0 4068537633 S Co:1:041:0 s 21 09 0300 0000 0008 8 = 031320e8 4e6f2ff1
ffff8804031910c0 4068537791 C Co:1:041:0 0 8 >
ffff8804031910c0 4068552535 S Co:1:041:0 s 21 09 0300 0000 0008 8 = 72812293 a18bf964
ffff8804031910c0 4068552669 C Co:1:041:0 0 8 >
ffff880403191840 4068567571 S Co:1:041:0 s 21 09 0300 0000 0008 8 = 99c38e11 d46e639d
ffff880403191840 4068567794 C Co:1:041:0 0 8 >
ffff880402c54240 4068583612 S Co:1:041:0 s 21 09 0300 0000 0008 8 = f23bb1dc 65e2ad2f
ffff880402c54240 4068583798 C Co:1:041:0 0 8 >
ffff8804031913c0 4068599520 S Co:1:041:0 s 21 09 0300 0000 0008 8 = 5cfd1d81 f1271c82
ffff8804031913c0 4068599679 C Co:1:041:0 0 8 >
ffff8804031913c0 4068614557 S Co:1:041:0 s 21 09 0300 0000 0008 8 = 96532a23 bc6e7752
ffff8804031913c0 4068614663 C Co:1:041:0 0 8 >
ffff8804031913c0 4068632633 S Co:1:041:0 s 21 09 0300 0000 0008 8 = c63870f8 2e608b2f
ffff8804031913c0 4068632779 C Co:1:041:0 0 8 >
ffff8804031913c0 4068646511 S Co:1:041:0 s 21 09 0300 0000 0008 8 = f6de50c8 5296a8fd
ffff8804031913c0 4068646669 C Co:1:041:0 0 8 >
ffff8804031913c0 4068661546 S Co:1:041:0 s 21 09 0300 0000 0008 8 = 942b6a73 57202374
ffff8804031913c0 4068661654 C Co:1:041:0 0 8 >
ffff8804031913c0 4068678608 S Co:1:041:0 s 21 09 0300 0000 0008 8 = f036266a 1101d59e
ffff8804031913c0 4068678794 C Co:1:041:0 0 8 >
ffff880402c54240 4068693649 S Co:1:041:0 s 21 09 0300 0000 0008 8 = bfcc2e33 77af995e
ffff880402c54240 4068693780 C Co:1:041:0 0 8 >
ffff88027c0640c0 4068708556 S Co:1:041:0 s 21 09 0300 0000 0008 8 = 9ceff0e7 2596d0e5
ffff88027c0640c0 4068708657 C Co:1:041:0 0 8 >
ffff88027c0649c0 4068724582 S Co:1:041:0 s 21 09 0300 0000 0008 8 = 84531fb6 d994de3d
ffff88027c0649c0 4068724797 C Co:1:041:0 0 8 >
ffff88027c064900 4068739608 S Co:1:041:0 s 21 09 0300 0000 0008 8 = 58e2305f f77cabc0
ffff88027c064900 4068739779 C Co:1:041:0 0 8 >
ffff88027c0640c0 4068755686 S Co:1:041:0 s 21 09 0300 0000 0008 8 = 5d37dfbb 079625a0
ffff88027c0640c0 4068755903 C Co:1:041:0 0 8 >
ffff88027c0640c0 4068771572 S Co:1:041:0 s 21 09 0300 0000 0008 8 = bd25aa31 341bbb5f
ffff88027c0640c0 4068771798 C Co:1:041:0 0 8 >
ffff88027c0640c0 4068785635 S Co:1:041:0 s 21 09 0300 0000 0008 8 = 042f5341 cdbbe256
ffff88027c0640c0 4068785779 C Co:1:041:0 0 8 >
ffff88027c0640c0 4068801635 S Co:1:041:0 s 21 09 0300 0000 0008 8 = a60f60fc c6189330
ffff88027c0640c0 4068801798 C Co:1:041:0 0 8 >
ffff88027c0649c0 4068817543 S Co:1:041:0 s 21 09 0300 0000 0008 8 = 76329c88 364ac86e
ffff88027c0649c0 4068817664 C Co:1:041:0 0 8 >
ffff8804031913c0 4068832590 S Co:1:041:0 s 21 09 0300 0000 0008 8 = 2f38969e d95b04e2
ffff8804031913c0 4068832794 C Co:1:041:0 0 8 >
ffff880403191840 4068850631 S Co:1:041:0 s 21 09 0300 0000 0008 8 = ed771f0d 8dcbca36
ffff880403191840 4068850796 C Co:1:041:0 0 8 >
ffff880403191840 4068865547 S Co:1:041:0 s 21 09 0300 0000 0008 8 = b276ce37 d70c2265
ffff880403191840 4068865657 C Co:1:041:0 0 8 >
ffff880403191840 4068879568 S Co:1:041:0 s 21 09 0300 0000 0008 8 = e4747d91 5d051a3f
ffff880403191840 4068879796 C Co:1:041:0 0 8 >
ffff880403191840 4068896654 S Co:1:041:0 s 21 09 0300 0000 0008 8 = cbe1cb26 6a9141e8
ffff880403191840 4068896921 C Co:1:041:0 0 8 >
ffff8803ed3a9540 4068911538 S Co:1:041:0 s 21 09 0300 0000 0008 8 = 15e19a12 70fe2c57
ffff8803ed3a9540 4068911657 C Co:1:041:0 0 8 >
ffff880403191840 4068926560 S Co:1:041:0 s 21 09 0300 0000 0008 8 = 54ce9009 8090f3d9
ffff880403191840 4068926665 C Co:1:041:0 0 8 >
ffff8804031910c0 4068942599 S Co:1:041:0 s 21 09 0300 0000 0008 8 = 7db599d0 d2feb28d
ffff8804031910c0 4068942794 C Co:1:041:0 0 8 >
ffff8803ed3a9840 4068958014 S Co:1:041:0 s 21 09 0300 0000 0008 8 = 69d662c0 41f20be7
ffff8803ed3a9840 4068958158 C Co:1:041:0 0 8 >
ffff880402c54540 4068973542 S Co:1:041:0 s 21 09 0300 0000 0008 8 = 5627dd48 cd8ba02f
ffff880402c54540 4068973656 C Co:1:041:0 0 8 >
ffff8804031910c0 4068990068 S Co:1:041:0 s 21 09 0300 0000 0008 8 = 65d0c16a 1add9c02
ffff8804031910c0 4068990160 C Co:1:041:0 0 8 >
ffff8804031910c0 4069005708 S Co:1:041:0 s 21 09 0300 0000 0008 8 = 1bae093b ee6d29ce
ffff8804031910c0 4069005931 C Co:1:041:0 0 8 >
ffff8804031910c0 4069020597 S Co:1:041:0 s 21 09 0300 0000 0008 8 = e2d27265 b5b8f958
ffff8804031910c0 4069020819 C Co:1:041:0 0 8 >
ffff8804031910c0 4069036644 S Co:1:041:0 s 21 09 0300 0000 0008 8 = 8600ffa7 feabbf38
ffff8804031910c0 4069036797 C Co:1:041:0 0 8 >
ffff8803e300a300 4069051675 S Co:1:041:0 s 21 09 0300 0000 0008 8 = bb337751 fd2ab559
ffff8803e300a300 4069051931 C Co:1:041:0 0 8 >
ffff8803e300a300 4069068529 S Co:1:041:0 s 21 09 0300 0000 0008 8 = 9416e4cb 098b167b
ffff8803e300a300 4069068685 C Co:1:041:0 0 8 >
ffff8803e300a300 4069083587 S Co:1:041:0 s 21 09 0300 0000 0008 8 = 0c8a140d 1e1aa3b3
ffff8803e300a300 4069083798 C Co:1:041:0 0 8 >
ffff8803e300a300 4069098640 S Co:1:041:0 s 21 09 0300 0000 0008 8 = 7f251926 5a9521e8
ffff8803e300a300 4069098785 C Co:1:041:0 0 8 >
ffff8803e300a300 4069114506 S Co:1:041:0 s 21 09 0300 0000 0008 8 = 2fafcbb8 82afd755
ffff8803e300a300 4069114657 C Co:1:041:0 0 8 >
ffff880402c54540 4069129668 S Co:1:041:0 s 21 09 0300 0000 0008 8 = c2a54278 7c8f120c
ffff880402c54540 4069129908 C Co:1:041:0 0 8 >
ffff880402c54540 4069146671 S Co:1:041:0 s 21 09 0300 0000 0008 8 = c0b85fb0 d450a36f
ffff880402c54540 4069146933 C Co:1:041:0 0 8 >
ffff880402c54540 4069161707 S Co:1:041:0 s 21 09 0300 0000 0008 8 = 184d43be 39815db7
ffff880402c54540 4069161931 C Co:1:041:0 0 8 >
ffff880402c54540 4069176677 S Co:1:041:0 s 21 09 0300 0000 0008 8 = 9afcd495 ffa49970
ffff880402c54540 4069176931 C Co:1:041:0 0 8 >
ffff880403191600 4069193632 S Co:1:041:0 s 21 09 0300 0000 0008 8 = 7c133d39 9db1b5f9
ffff880403191600 4069193797 C Co:1:041:0 0 8 >
ffff880403191600 4069208671 S Co:1:041:0 s 21 09 0300 0000 0008 8 = d7136c46 2f938e06
ffff880403191600 4069208932 C Co:1:041:0 0 8 >
ffff8804031910c0 4069223563 S Co:1:041:0 s 21 09 0300 0000 0008 8 = 29309468 f3a70c1f
ffff8804031910c0 4069223688 C Co:1:041:0 0 8 >
ffff8804031910c0 4069240621 S Co:1:041:0 s 21 09 0300 0000 0008 8 = d2d3abe1 ce429520
ffff8804031910c0 4069240806 C Co:1:041:0 0 8 >
ffff880402c54540 4069255624 S Co:1:041:0 s 21 09 0300 0000 0008 8 = 9a19eb08 c62a96b9
ffff880402c54540 4069255804 C Co:1:041:0 0 8 >
ffff8804031910c0 4069270536 S Co:1:041:0 s 21 09 0300 0000 0008 8 = 275352c6 871affee
ffff8804031910c0 4069270684 C Co:1:041:0 0 8 >
ffff8804031910c0 4069287609 S Co:1:041:0 s 21 09 0300 0000 0008 8 = 8a862419 e040c596
ffff8804031910c0 4069287831 C Co:1:041:0 0 8 >
ffff8803e300a300 4069302659 S Co:1:041:0 s 21 09 0300 0000 0008 8 = b1eb6794 45c060de
ffff8803e300a300 4069302809 C Co:1:041:0 0 8 >
ffff8803ed3a9840 4069319569 S Co:1:041:0 s 21 09 0300 0000 0008 8 = f36e64db 4d314dc6
ffff8803ed3a9840 4069319682 C Co:1:041:0 0 8 >
ffff8803e300a300 4069334566 S Co:1:041:0 s 21 09 0300 0000 0008 8 = 8a312b29 341d8ca0
ffff8803e300a300 4069334660 C Co:1:041:0 0 8 >
ffff8803ed3a9840 4069349651 S Co:1:041:0 s 21 09 0300 0000 0008 8 = 12080dcc 58832196
ffff8803ed3a9840 4069349788 C Co:1:041:0 0 8 >
ffff880402c54540 4069364678 S Co:1:041:0 s 21 09 0300 0000 0008 8 = 0efc21a6 be579522
ffff880402c54540 4069364950 C Co:1:041:0 0 8 >
ffff880402c54540 4069381584 S Co:1:041:0 s 21 09 0300 0000 0008 8 = 61cbc1ab 8cfe7396
ffff880402c54540 4069381788 C Co:1:041:0 0 8 >
ffff880402c54540 4069396575 S Co:1:041:0 s 21 09 0300 0000 0008 8 = d7640c67 8ed5cd94
ffff880402c54540 4069396661 C Co:1:041:0 0 8 >
ffff8804031910c0 4069411682 S Co:1:041:0 s 21 09 0300 0000 0008 8 = 9b6d6478 b3a9b795
ffff8804031910c0 4069411935 C Co:1:041:0 0 8 >
ffff8804031910c0 4069428559 S Co:1:041:0 s 21 09 0300 0000 0008 8 = c0bff00e 8f3ec964
ffff8804031910c0 4069428689 C Co:1:041:0 0 8 >
ffff8804031910c0 4069443606 S Co:1:041:0 s 21 09 0300 0000 0008 8 = bbe61a70 dacaa0a2
ffff8804031910c0 4069443811 C Co:1:041:0 0 8 >
ffff8804031910c0 4069458663 S Co:1:041:0 s 21 09 0300 0000 0008 8 = e6a40f78 ed795b42
ffff8804031910c0 4069458812 C Co:1:041:0 0 8 >
ffff8804031910c0 4069475640 S Co:1:041:0 s 21 09 0300 0000 0008 8 = fc6d4414 4ae9200c
ffff8804031910c0 4069475795 C Co:1:041:0 0 8 >
ffff8803ed3a9240 4069490598 S Co:1:041:0 s 21 09 0300 0000 0008 8 = a1ebedc5 12ad971c
ffff8803ed3a9240 4069490797 C Co:1:041:0 0 8 >
ffff8803ed3a9240 4069505643 S Co:1:041:0 s 21 09 0300 0000 0008 8 = d9798622 8ecc6b61
ffff8803ed3a9240 4069505792 C Co:1:041:0 0 8 >
ffff8803ed3a96c0 4069521695 S Co:1:041:0 s 21 09 0300 0000 0008 8 = 8eaa4c54 a941ce21
ffff8803ed3a96c0 4069521915 C Co:1:041:0 0 8 >
ffff8803ed3a96c0 4069536533 S Co:1:041:0 s 21 09 0300 0000 0008 8 = 0ec1c399 737bf472
ffff8803ed3a96c0 4069536661 C Co:1:041:0 0 8 >
ffff8803e300a300 4069553645 S Co:1:041:0 s 21 09 0300 0000 0008 8 = 883830c3 9edc95c1
ffff8803e300a300 4069553803 C Co:1:041:0 0 8 >
ffff8803e300a300 4069567636 S Co:1:041:0 s 21 09 0300 0000 0008 8 = 943c1db9 023c6d4d
ffff8803e300a300 4069567809 C Co:1:041:0 0 8 >
ffff8803e300a300 4069583579 S Co:1:041:0 s 21 09 0300 0000 0008 8 = a92ddaf3 1b65bdaa
ffff8803e300a300 4069583689 C Co:1:041:0 0 8 >
ffff8803e300a300 4069599620 S Co:1:041:0 s 21 09 0300 0000 0008 8 = a720f9ff 8797ca41
ffff8803e300a300 4069599862 C Co:1:041:0 0 8 >
ffff8803e300a300 4069614649 S Co:1:041:0 s 21 09 0300 0000 0008 8 = 4d5fd000 8b045bcc
ffff8803e300a300 4069614788 C Co:1:041:0 0 8 >
ffff8803ed3a9600 4069630654 S Co:1:041:0 s 21 09 0300 0000 0008 8 = c2e5f92c 8d533ddc
ffff8803ed3a9600 4069630913 C Co:1:041:0 0 8 >
ffff8803a0055900 4069645608 S Co:1:041:0 s 21 09 0300 0000 0008 8 = 0ee5d24c 991ec156
ffff8803a0055900 4069645789 C Co:1:041:0 0 8 >
ffff8803ed3a9900 4069661662 S Co:1:041:0 s 21 09 0300 0000 0008 8 = a043ff3e df763bef
ffff8803ed3a9900 4069661788 C Co:1:041:0 0 8 >
ffff8803ed3a9900 4069677695 S Co:1:041:0 s 21 09 0300 0000 0008 8 = c817e574 315c82b5
ffff8803ed3a9900 4069677913 C Co:1:041:0 0 8 >
ffff8803ed3a9900 4069692589 S Co:1:041:0 s 21 09 0300 0000 0008 8 = 3c2e2f74 87477488
ffff8803ed3a9900 4069692811 C Co:1:041:0 0 8 >
ffff8803ed3a9900 4069710658 S Co:1:041:0 s 21 09 0300 0000 0008 8 = 958b4c58 7da3719a
ffff8803ed3a9900 4069710812 C Co:1:041:0 0 8 >
ffff8803ed3a9900 4069723675 S Co:1:041:0 s 21 09 0300 0000 0008 8 = d1e0ed4e d14fdef5
ffff8803ed3a9900 4069723946 C Co:1:041:0 0 8 >
ffff8803ed3a9900 4069740561 S Co:1:041:0 s 21 09 0300 0000 0008 8 = d1188917 e81ca2f4
ffff8803ed3a9900 4069740673 C Co:1:041:0 0 8 >
ffff8804031910c0 4069757590 S Co:1:041:0 s 21 09 0300 0000 0008 8 = dacfda89 4853aac7
ffff8804031910c0 4069757803 C Co:1:041:0 0 8 >
ffff8803ed3a9900 4069770677 S Co:1:041:0 s 21 09 0300 0000 0008 8 = 16d65f0f 1d2d66f1
ffff8803ed3a9900 4069770917 C Co:1:041:0 0 8 >
ffff8804031910c0 4069787587 S Co:1:041:0 s 21 09 0300 0000 0008 8 = 13b1da26 b75a4ccb
ffff8804031910c0 4069787811 C Co:1:041:0 0 8 >
ffff8804031910c0 4069802552 S Co:1:041:0 s 21 09 0300 0000 0008 8 = 401ad1e0 087d5201
ffff8804031910c0 4069802690 C Co:1:041:0 0 8 >
ffff8803e300a840 4069817655 S Co:1:041:0 s 21 09 0300 0000 0008 8 = 757e1063 28ac7612
ffff8803e300a840 4069817787 C Co:1:041:0 0 8 >
ffff8803ed3a9f00 4069833693 S Co:1:041:0 s 21 09 0300 0000 0008 8 = 6a7e2369 d3f338d2
ffff8803ed3a9f00 4069833941 C Co:1:041:0 0 8 >
ffff880403191600 4069848592 S Co:1:041:0 s 21 09 0300 0000 0008 8 = 3c6ddfbf e7d01ce9
ffff880403191600 4069848815 C Co:1:041:0 0 8 >
ffff8803e300a840 4069864627 S Co:1:041:0 s 21 09 0300 0000 0008 8 = edd6d8c8 e9b62b53
ffff8803e300a840 4069864807 C Co:1:041:0 0 8 >
ffff8803e300a240 4069880678 S Co:1:041:0 s 21 09 0300 0000 0008 8 = e3f5e9fa 7f8c71e0
ffff8803e300a240 4069880938 C Co:1:041:0 0 8 >
ffff8803e300a240 4069895519 S Co:1:041:0 s 21 09 0300 0000 0008 8 = 673bb25d f62d7eb4
ffff8803e300a240 4069895687 C Co:1:041:0 0 8 >
ffff8803e300a240 4069911618 S Co:1:041:0 s 21 09 0300 0000 0008 8 = 25cd1311 bbe8e7c7
ffff8803e300a240 4069911812 C Co:1:041:0 0 8 >
ffff880402c54900 4069929664 S Co:1:041:0 s 21 09 0300 0000 0008 8 = b103b4c7 e3ffc463
ffff880402c54900 4069929790 C Co:1:041:0 0 8 >
ffff8803ed3a9f00 4069942585 S Co:1:041:0 s 21 09 0300 0000 0008 8 = feec7e45 a62a32ab
ffff8803ed3a9f00 4069942687 C Co:1:041:0 0 8 >
ffff8803e300a240 4069959629 S Co:1:041:0 s 21 09 0300 0000 0008 8 = e6c621e5 dd13d010
ffff8803e300a240 4069959806 C Co:1:041:0 0 8 >
ffff8803e300a240 4069974672 S Co:1:041:0 s 21 09 0300 0000 0008 8 = a7888f14 8ada44dc
ffff8803e300a240 4069974937 C Co:1:041:0 0 8 >
ffff8803e300a9c0 4069990454 S Co:1:041:0 s 21 09 0300 0000 0008 8 = 625a7dd5 4e91b6aa
ffff8803e300a9c0 4069990563 C Co:1:041:0 0 8 >
ffff8803e300a9c0 4070005342 S Co:1:041:0 s 21 09 0300 0000 0008 8 = 9c19e73d f3be51e9
ffff8803e300a9c0 4070005564 C Co:1:041:0 0 8 >
ffff880403191600 4070022388 S Co:1:041:0 s 21 09 0300 0000 0008 8 = bfd68af7 e2dec75e
ffff880403191600 4070022545 C Co:1:041:0 0 8 >
ffff880402c54780 4070052317 S Co:1:041:0 s 21 09 0300 0000 0008 8 = 5503d517 3eb53702
ffff880402c54780 4070052418 C Co:1:041:0 0 8 >
ffff880403191300 4070084352 S Ci:1:041:0 s a1 01 0300 0000 0008 8 <
ffff880403191300 4070084559 C Ci:1:041:0 0 8 = aa040000 00000000
ffff880402e73480 4085286953 S Co:1:041:0 s 21 09 0300 0000 0008 8 = 55050000 00000000
ffff880402e73480 4085287086 C Co:1:041:0 0 8 >
ffff880402e73480 4085317874 S Ci:1:041:0 s a1 01 0300 0000 0008 8 <
ffff880402e73480 4085318087 C Ci:1:041:0 0 8 = 0b010101 0000000e
ffff880402e73480 4085334958 S Ci:1:041:0 s a1 01 0300 0000 0008 8 <
ffff880402e73480 4085335053 C Ci:1:041:0 0 8 = 0487302f 0f000781
ffff880402e73480 4085350003 S Ci:1:041:0 s a1 01 0300 0000 0008 8 <
ffff880402e73480 4085350185 C Ci:1:041:0 0 8 = 6e650480 90000021
ffff880402e73480 4085364989 S Ci:1:041:0 s a1 01 0300 0000 0008 8 <
ffff880402e73480 4085365215 C Ci:1:041:0 0 8 = 01900121 80009001
ffff880402e73480 4085381927 S Ci:1:041:0 s a1 01 0300 0000 0008 8 <
ffff880402e73480 4085382113 C Ci:1:041:0 0 8 = 237f9002 2300fb7f
ffff880402e73480 4085396960 S Ci:1:041:0 s a1 01 0300 0000 0008 8 <
ffff880402e73480 4085397134 C Ci:1:041:0 0 8 = fb4ffb1f fb000ffb
ffff8803e6d7a840 4085411849 S Ci:1:041:0 s a1 01 0300 0000 0008 8 <
ffff8803e6d7a840 4085412073 C Ci:1:041:0 0 8 = bffbdffb 4f00fb6f
ffff8803e6d7a840 4085427158 S Ci:1:041:0 s a1 01 0300 0000 0008 8 <
ffff8803e6d7a840 4085427324 C Ci:1:041:0 0 8 = fbaffb6f fb008ffb
ffff8803e6d7a840 4085443904 S Ci:1:041:0 s a1 01 0300 0000 0008 8 <
ffff8803e6d7a840 4085444069 C Ci:1:041:0 0 8 = effbaffb cf00fbff
ffff8803ebbf4300 4085458842 S Ci:1:041:0 s a1 01 0300 0000 0008 8 <
ffff8803ebbf4300 4085459073 C Ci:1:041:0 0 8 = fb1ffb6f fb005ffb
ffff8803ebbf4300 4085473873 S Ci:1:041:0 s a1 01 0300 0000 0008 8 <
ffff8803ebbf4300 4085474077 C Ci:1:041:0 0 8 = 3ffb4ffb ef00fb1f
ffff8803ebbf4300 4085488858 S Ci:1:041:0 s a1 01 0300 0000 0008 8 <
ffff8803ebbf4300 4085489077 C Ci:1:041:0 0 8 = fb6ffbcf fb001ffb
ffff8803ebbf4300 4085506005 S Ci:1:041:0 s a1 01 0300 0000 0008 8 <
ffff8803ebbf4300 4085506185 C Ci:1:041:0 0 8 = affb2ffb 8f00fb4f
ffff8803ebbf4300 4085520868 S Ci:1:041:0 s a1 01 0300 0000 0008 8 <
ffff8803ebbf4300 4085521053 C Ci:1:041:0 0 8 = fb7ffbbf fb002ffb
ffff8803ebbf4300 4085535912 S Ci:1:041:0 s a1 01 0300 0000 0008 8 <
ffff8803ebbf4300 4085536059 C Ci:1:041:0 0 8 = fffb5ffb 8f00fb0f
ffff8803a00d8300 4085552984 S Ci:1:041:0 s a1 01 0300 0000 0008 8 <
ffff8803a00d8300 4085553184 C Ci:1:041:0 0 8 = fb1ffb6f fb00effb
ffff8803a00d8300 4085567813 S Ci:1:041:0 s a1 01 0300 0000 0008 8 <
ffff8803a00d8300 4085567924 C Ci:1:041:0 0 8 = cffb5ffb ff00fbff
ffff8803e300ad80 4085583036 S Ci:1:041:0 s a1 01 0300 0000 0008 8 <
ffff8803e300ad80 4085583178 C Ci:1:041:0 0 8 = fbeffbaf fb000ffb
ffff8803e6d7acc0 4085598671 S Ci:1:041:0 s a1 01 0300 0000 0008 8 <
ffff8803e6d7acc0 4085598825 C Ci:1:041:0 0 8 = 3ffbaffb 3f00fb7f
ffff8803e6d7acc0 4085615523 S Ci:1:041:0 s a1 01 0300 0000 0008 8 <
ffff8803e6d7acc0 4085615673 C Ci:1:041:0 0 8 = fb5ffb5f fb009ffb
ffff8803e300a3c0 4085630614 S Ci:1:041:0 s a1 01 0300 0000 0008 8 <
ffff8803e300a3c0 4085630826 C Ci:1:041:0 0 8 = 6ffbcffb 9f00fbef
ffff8803e300a3c0 4085645595 S Ci:1:041:0 s a1 01 0300 0000 0008 8 <
ffff8803e300a3c0 4085645812 C Ci:1:041:0 0 8 = fb9ffbef fb003ffb
ffff8803e300a3c0 4085660693 S Ci:1:041:0 s a1 01 0300 0000 0008 8 <
ffff8803e300a3c0 4085660799 C Ci:1:041:0 0 8 = 9ffb2ffb 0f00fbef
ffff8803e300a3c0 4085677546 S Ci:1:041:0 s a1 01 0300 0000 0008 8 <
ffff8803e300a3c0 4085677689 C Ci:1:041:0 0 8 = fb5ffb2f fb002ffb
ffff8803e300a3c0 4085692632 S Ci:1:041:0 s a1 01 0300 0000 0008 8 <
ffff8803e300a3c0 4085692842 C Ci:1:041:0 0 8 = 8ffbdffb 0f00fb4f
ffff8803e6d7ab40 4085707702 S Ci:1:041:0 s a1 01 0300 0000 0008 8 <
ffff8803e6d7ab40 4085707801 C Ci:1:041:0 0 8 = fb9ffbaf fb00fffb
ffff8803e6d7ab40 4085725588 S Ci:1:041:0 s a1 01 0300 0000 0008 8 <
ffff8803e6d7ab40 4085725802 C Ci:1:041:0 0 8 = 0ffbeffb 6f00fb1f
ffff8803a009e540 4085740590 S Ci:1:041:0 s a1 01 0300 0000 0008 8 <
ffff8803a009e540 4085740818 C Ci:1:041:0 0 8 = fb2ffb4f fb00cffb
ffff8803a009e480 4085755682 S Ci:1:041:0 s a1 01 0300 0000 0008 8 <
ffff8803a009e480 4085755852 C Ci:1:041:0 0 8 = fffbaffb 1f00fbbf
ffff8803e300a3c0 4085770548 S Ci:1:041:0 s a1 01 0300 0000 0008 8 <
ffff8803e300a3c0 4085770677 C Ci:1:041:0 0 8 = fb8ffb0f fb005ffb
ffff8803e6d7a840 4085786615 S Ci:1:041:0 s a1 01 0300 0000 0008 8 <
ffff8803e6d7a840 4085786805 C Ci:1:041:0 0 8 = bffbfffb bf00fb8f
ffff8803e6d7a840 4085801722 S Ci:1:041:0 s a1 01 0300 0000 0008 8 <
ffff8803e6d7a840 4085801829 C Ci:1:041:0 0 8 = fb5ffb0f fb00bffb
ffff8803e6d7ab40 4085817675 S Ci:1:041:0 s a1 01 0300 0000 0008 8 <
ffff8803e6d7ab40 4085817815 C Ci:1:041:0 0 8 = 9ffb4ffb df00fbef
ffff8803e6d7ab40 4085833617 S Ci:1:041:0 s a1 01 0300 0000 0008 8 <
ffff8803e6d7ab40 4085833804 C Ci:1:041:0 0 8 = fbdffb3f fb005ffb
ffff8803e6d7ab40 4085848699 S Ci:1:041:0 s a1 01 0300 0000 0008 8 <
ffff8803e6d7ab40 4085848817 C Ci:1:041:0 0 8 = dffbaffb 6f00fb7f
ffff8803e6d7ab40 4085865638 S Ci:1:041:0 s a1 01 0300 0000 0008 8 <
ffff8803e6d7ab40 4085865801 C Ci:1:041:0 0 8 = fb9ffb2f fb002ffb
ffff8803ebbf4c00 4085880536 S Ci:1:041:0 s a1 01 0300 0000 0008 8 <
ffff8803ebbf4c00 4085880677 C Ci:1:041:0 0 8 = 9ffb3ffb bf00fbcf
ffff8803ebbf4600 4085895578 S Ci:1:041:0 s a1 01 0300 0000 0008 8 <
ffff8803ebbf4600 4085895677 C Ci:1:041:0 0 8 = fbeffb1f fb00cffb
ffff8803a00d8900 4085910670 S Ci:1:041:0 s a1 01 0300 0000 0008 8 <
ffff8803a00d8900 4085910824 C Ci:1:041:0 0 8 = 8ffb2ffb bf00fbbf
ffff8803a00d8a80 4085926569 S Ci:1:041:0 s a1 01 0300 0000 0008 8 <
ffff8803a00d8a80 4085926680 C Ci:1:041:0 0 8 = fb4ffbef fb008ffb
ffff8803a00d8900 4085942621 S Ci:1:041:0 s a1 01 0300 0000 0008 8 <
ffff8803a00d8900 4085942827 C Ci:1:041:0 0 8 = dffbbffb af00fb5f
ffff8803e300a3c0 4085957696 S Ci:1:041:0 s a1 01 0300 0000 0008 8 <
ffff8803e300a3c0 4085957833 C Ci:1:041:0 0 8 = fb0f0071 ff0087ff
ffff8803e300a3c0 4085973636 S Ci:1:041:0 s a1 01 0300 0000 0008 8 <
ffff8803e300a3c0 4085973821 C Ci:1:041:0 0 8 = c7ff47ff 5700ffe7
ffff8803e300a3c0 4085989544 S Ci:1:041:0 s a1 01 0300 0000 0008 8 <
ffff8803e300a3c0 4085989695 C Ci:1:041:0 0 8 = ff07ffe7 ff0037ff
ffff8803e6d7a840 4086004640 S Ci:1:041:0 s a1 01 0300 0000 0008 8 <
ffff8803e6d7a840 4086004806 C Ci:1:041:0 0 8 = 97ff97ff 0700ff27
ffff8803e6d7a840 4086022692 S Ci:1:041:0 s a1 01 0300 0000 0008 8 <
ffff8803e6d7a840 4086022828 C Ci:1:041:0 0 8 = ff27ff07 ff00e7ff
ffff8803e6d7a840 4086037549 S Ci:1:041:0 s a1 01 0300 0000 0008 8 <
ffff8803e6d7a840 4086037677 C Ci:1:041:0 0 8 = e7ff57ff a700ffd7
ffff8803e6d7a840 4086051630 S Ci:1:041:0 s a1 01 0300 0000 0008 8 <
ffff8803e6d7a840 4086051837 C Ci:1:041:0 0 8 = ff47ffc7 ff0057ff
ffff8803e6d7a840 4086067679 S Ci:1:041:0 s a1 01 0300 0000 0008 8 <
ffff8803e6d7a840 4086067828 C Ci:1:041:0 0 8 = b7ff47ff 7700ff47
ffff8803e6d7a840 4086085604 S Ci:1:041:0 s a1 01 0300 0000 0008 8 <
ffff8803e6d7a840 4086085805 C Ci:1:041:0 0 8 = ff67ffe7 ff0097ff
ffff8803e6d7a840 4086098618 S Ci:1:041:0 s a1 01 0300 0000 0008 8 <
ffff8803e6d7a840 4086098840 C Ci:1:041:0 0 8 = 57ff27ff b700ff37
ffff8803ebbf4300 4086115670 S Ci:1:041:0 s a1 01 0300 0000 0008 8 <
ffff8803ebbf4300 4086115806 C Ci:1:041:0 0 8 = ffc7ff47 ff0077ff
ffff8803e300a780 4086130571 S Ci:1:041:0 s a1 01 0300 0000 0008 8 <
ffff8803e300a780 4086130705 C Ci:1:041:0 0 8 = 47ff67ff 0700ffd7
ffff8803e6d7acc0 4086145597 S Ci:1:041:0 s a1 01 0300 0000 0008 8 <
ffff8803e6d7acc0 4086145718 C Ci:1:041:0 0 8 = ff77ff27 ff00e7ff
ffff8803ed3a9900 4086161653 S Ci:1:041:0 s a1 01 0300 0000 0008 8 <
ffff8803ed3a9900 4086161827 C Ci:1:041:0 0 8 = 87ff57ff e700ffa7
ffff8803ed3a9900 4086176626 S Ci:1:041:0 s a1 01 0300 0000 0008 8 <
ffff8803ed3a9900 4086176822 C Ci:1:041:0 0 8 = ffe7ff57 ff0057ff
ffff8803ed3a9900 4086193609 S Ci:1:041:0 s a1 01 0300 0000 0008 8 <
ffff8803ed3a9900 4086193827 C Ci:1:041:0 0 8 = 97ff27ff 1700ff47
ffff8803ebbf4840 4086208630 S Ci:1:041:0 s a1 01 0300 0000 0008 8 <
ffff8803ebbf4840 4086208823 C Ci:1:041:0 0 8 = ff07ff77 ff00d7ff
ffff8803a00d8900 4086223658 S Ci:1:041:0 s a1 01 0300 0000 0008 8 <
ffff8803a00d8900 4086223815 C Ci:1:041:0 0 8 = 07ff97ff 1700ff67
ffff8803e6d7a6c0 4086240595 S Ci:1:041:0 s a1 01 0300 0000 0008 8 <
ffff8803e6d7a6c0 4086240712 C Ci:1:041:0 0 8 = ff37ffa7 ff00b7ff
ffff8803ebbf4840 4086255621 S Ci:1:041:0 s a1 01 0300 0000 0008 8 <
ffff8803ebbf4840 4086255835 C Ci:1:041:0 0 8 = 17ffd7ff 2700ffd7
ffff8803ebbf4840 4086270652 S Ci:1:041:0 s a1 01 0300 0000 0008 8 <
ffff8803ebbf4840 4086270826 C Ci:1:041:0 0 8 = ff27ff47 ff0007ff
ffff8803ebbf4840 4086287588 S Ci:1:041:0 s a1 01 0300 0000 0008 8 <
ffff8803ebbf4840 4086287776 C Ci:1:041:0 0 8 = 07ff17ff 1700ff07
ffff8803a00d8c00 4086302555 S Ci:1:041:0 s a1 01 0300 0000 0008 8 <
ffff8803a00d8c00 4086302679 C Ci:1:041:0 0 8 = ffa7ffc7 ff0057ff
ffff8803a00d8c00 4086317701 S Ci:1:041:0 s a1 01 0300 0000 0008 8 <
ffff8803a00d8c00 4086317829 C Ci:1:041:0 0 8 = b7ff87ff 1700ff07
ffff8803ebbf4840 4086334635 S Ci:1:041:0 s a1 01 0300 0000 0008 8 <
ffff8803ebbf4840 4086334824 C Ci:1:041:0 0 8 = ff67ff57 ff00a7ff
ffff8803a00d8c00 4086349619 S Ci:1:041:0 s a1 01 0300 0000 0008 8 <
ffff8803a00d8c00 4086349865 C Ci:1:041:0 0 8 = 07ff97ff 9700ff07
ffff8803a00d8c00 4086364638 S Ci:1:041:0 s a1 01 0300 0000 0008 8 <
ffff8803a00d8c00 4086364833 C Ci:1:041:0 0 8 = ffa7ffd7 ff0097ff
ffff8803e300a780 4086381688 S Ci:1:041:0 s a1 01 0300 0000 0008 8 <
ffff8803e300a780 4086381834 C Ci:1:041:0 0 8 = c7ff67ff 8700ff27
ffff8803e300a780 4086396529 S Ci:1:041:0 s a1 01 0300 0000 0008 8 <
ffff8803e300a780 4086396699 C Ci:1:041:0 0 8 = ff37fff7 ff0027ff
ffff8803ebbf4840 4086411624 S Ci:1:041:0 s a1 01 0300 0000 0008 8 <
ffff8803ebbf4840 4086411809 C Ci:1:041:0 0 8 = a7ff17ff 4700ff97
ffff8803ebbf4840 4086427086 S Ci:1:041:0 s a1 01 0300 0000 0008 8 <
ffff8803ebbf4840 4086427184 C Ci:1:041:0 0 8 = ff77ffa7 ff0067ff
ffff8803e300a780 4086443523 S Ci:1:041:0 s a1 01 0300 0000 0008 8 <
ffff8803e300a780 4086443700 C Ci:1:041:0 0 8 = e7ff97ff 0700ffd7
ffff8803e300a780 4086458611 S Ci:1:041:0 s a1 01 0300 0000 0008 8 <
ffff8803e300a780 4086458816 C Ci:1:041:0 0 8 = ff17ff77 ff0097ff
ffff8803e300a780 4086473781 S Ci:1:041:0 s a1 01 0300 0000 0008 8 <
ffff8803e300a780 4086473990 C Ci:1:041:0 0 8 = c7ff87ff 0700ff17
ffff8803e300a780 4086490707 S Ci:1:041:0 s a1 01 0300 0000 0008 8 <
ffff8803e300a780 4086490850 C Ci:1:041:0 0 8 = ff17ff37 ff0047ff
ffff880406dc6900 4086505607 S Ci:1:041:0 s a1 01 0300 0000 0008 8 <
ffff880406dc6900 4086505697 C Ci:1:041:0 0 8 = 27ff37ff 6700ff87
ffff880406dc6900 4086520612 S Ci:1:041:0 s a1 01 0300 0000 0008 8 <
ffff880406dc6900 4086520826 C Ci:1:041:0 0 8 = ff47ff67 ff0097ff
ffff8803e300a780 4086537720 S Ci:1:041:0 s a1 01 0300 0000 0008 8 <
ffff8803e300a780 4086537810 C Ci:1:041:0 0 8 = b7ffa7ff 0f00ffc7
ffff8803e300a780 4086552570 S Ci:1:041:0 s a1 01 0300 0000 0008 8 <
ffff8803e300a780 4086552695 C Ci:1:041:0 0 8 = ff1fff97 ff00dfff
ffff880406dc6900 4086567707 S Ci:1:041:0 s a1 01 0300 0000 0008 8 <
ffff880406dc6900 4086567818 C Ci:1:041:0 0 8 = b7ffdfff 2700ff2f
ffff8803a00d8300 4086584192 S Ci:1:041:0 s a1 01 0300 0000 0008 8 <
ffff8803a00d8300 4086584307 C Ci:1:041:0 0 8 = ffb7ffaf ff00a7ff
ffff8803a00d8300 4086599108 S Ci:1:041:0 s a1 01 0300 0000 0008 8 <
ffff8803a00d8300 4086599310 C Ci:1:041:0 0 8 = efff87ff 6f00ff07
ffff8803a00d8300 4086615192 S Ci:1:041:0 s a1 01 0300 0000 0008 8 <
ffff8803a00d8300 4086615338 C Ci:1:041:0 0 8 = ff7fff67 ff009fff
ffff880406dc6900 4086630189 S Ci:1:041:0 s a1 01 0300 0000 0008 8 <
ffff880406dc6900 4086630330 C Ci:1:041:0 0 8 = e7ffffff b700ff4f
ffff880406dc6900 4086646129 S Ci:1:041:0 s a1 01 0300 0000 0008 8 <
ffff880406dc6900 4086646315 C Ci:1:041:0 0 8 = ff57ff9f ff0097ff
ffff8803a00d8300 4086664160 S Ci:1:041:0 s a1 01 0300 0000 0008 8 <
ffff8803a00d8300 4086664337 C Ci:1:041:0 0 8 = 3fff77ff 9f00ff97
ffff8803a00d8b40 4086677206 S Ci:1:041:0 s a1 01 0300 0000 0008 8 <
ffff8803a00d8b40 4086677309 C Ci:1:041:0 0 8 = ff3fff97 ff001fff
ffff8803e300af00 4086693257 S Ci:1:041:0 s a1 01 0300 0000 0008 8 <
ffff8803e300af00 4086693433 C Ci:1:041:0 0 8 = 37ff7fff 6700ff5f
ffff8803e300af00 4086710156 S Ci:1:041:0 s a1 01 0300 0000 0008 8 <
ffff8803e300af00 4086710312 C Ci:1:041:0 0 8 = ff27ffff ff00c7ff
ffff8803e300af00 4086725155 S Ci:1:041:0 s a1 01 0300 0000 0008 8 <
ffff8803e300af00 4086725308 C Ci:1:041:0 0 8 = 3fffe7ff 0f00ff47
ffff8803ebbf4840 4086740206 S Ci:1:041:0 s a1 01 0300 0000 0008 8 <
ffff8803ebbf4840 4086740326 C Ci:1:041:0 0 8 = ffefffd7 ff001fff
ffff8803ebbf4840 4086755110 S Ci:1:041:0 s a1 01 0300 0000 0008 8 <
ffff8803ebbf4840 4086755315 C Ci:1:041:0 0 8 = 67ff2fff 5700ff1f
ffff8803ebbf4840 4086770170 S Ci:1:041:0 s a1 01 0300 0000 0008 8 <
ffff8803ebbf4840 4086770313 C Ci:1:041:0 0 8 = ffc7ff0f ff0007ff
ffff8803ebbf4840 4086786224 S Ci:1:041:0 s a1 01 0300 0000 0008 8 <
ffff8803ebbf4840 4086786335 C Ci:1:041:0 0 8 = 6fffb7ff cf00ffd7
ffff8803ebbf4600 4086802257 S Ci:1:041:0 s a1 01 0300 0000 0008 8 <
ffff8803ebbf4600 4086802433 C Ci:1:041:0 0 8 = ffdffff7 ff008fff
ffff8803ebbf4600 4086817106 S Ci:1:041:0 s a1 01 0300 0000 0008 8 <
ffff8803ebbf4600 4086817328 C Ci:1:041:0 0 8 = 77ff4fff 0700ff1f
ffff8803ebbf4600 4086833202 S Ci:1:041:0 s a1 01 0300 0000 0008 8 <
ffff8803ebbf4600 4086833328 C Ci:1:041:0 0 8 = fff7ffef ff00f7ff
ffff8803ebbf4600 4086848229 S Ci:1:041:0 s a1 01 0300 0000 0008 8 <
ffff8803ebbf4600 4086848343 C Ci:1:041:0 0 8 = 5fffc7ff 7f00ff97
ffff8803ebbf4600 4086865104 S Ci:1:041:0 s a1 01 0300 0000 0008 8 <
ffff8803ebbf4600 4086865308 C Ci:1:041:0 0 8 = ff8fffc7 ff00efff
ffff8803ebbf4600 4086880160 S Ci:1:041:0 s a1 01 0300 0000 0008 8 <
ffff8803ebbf4600 4086880309 C Ci:1:041:0 0 8 = 87ff6fff f700ff4f
ffff8803ebbf4600 4086895225 S Ci:1:041:0 s a1 01 0300 0000 0008 8 <
ffff8803ebbf4600 4086895324 C Ci:1:041:0 0 8 = ffe7ffbf ff00a7ff
ffff8803ebbf4840 4086911135 S Ci:1:041:0 s a1 01 0300 0000 0008 8 <
ffff8803ebbf4840 4086911335 C Ci:1:041:0 0 8 = cfff37ff cf00fff7
ffff8803a00d8b40 4086928201 S Ci:1:041:0 s a1 01 0300 0000 0008 8 <
ffff8803a00d8b40 4086928337 C Ci:1:041:0 0 8 = ff4fff37 ff00dfff
ffff880406dc6d80 4086943233 S Ci:1:041:0 s a1 01 0300 0000 0008 8 <
ffff880406dc6d80 4086943466 C Ci:1:041:0 0 8 = 67ff9fff 5700ffbf
ffff8803a00d8900 4086958215 S Ci:1:041:0 s a1 01 0300 0000 0008 8 <
ffff8803a00d8900 4086958310 C Ci:1:041:0 0 8 = ff07ffbf ff0007ff
ffff8803ebbf4300 4086973242 S Ci:1:041:0 s a1 01 0300 0000 0008 8 <
ffff8803ebbf4300 4086973438 C Ci:1:041:0 0 8 = 0fff37ff bf00fff7
ffff8803ebbf4300 4086989226 S Ci:1:041:0 s a1 01 0300 0000 0008 8 <
ffff8803ebbf4300 4086989335 C Ci:1:041:0 0 8 = ff3fff67 ff001fff
ffff8803ebbf4300 4087005249 S Ci:1:041:0 s a1 01 0300 0000 0008 8 <
ffff8803ebbf4300 4087005438 C Ci:1:041:0 0 8 = a7ff3fff b700ff8f
ffff8803ebbf4300 4087020149 S Ci:1:041:0 s a1 01 0300 0000 0008 8 <
ffff8803ebbf4300 4087020312 C Ci:1:041:0 0 8 = ffe7ffdf ff00a7ff
ffff8803e300ad80 4087038190 S Ci:1:041:0 s a1 01 0300 0000 0008 8 <
ffff8803e300ad80 4087038356 C Ci:1:041:0 0 8 = 9fff87ff 3f00ffb7
ffff8803e300ad80 4087051312 S Ci:1:041:0 s a1 01 0300 0000 0008 8 <
ffff8803e300ad80 4087051455 C Ci:1:041:0 0 8 = ffffffe7 ff00bfff
ffff8803e300ad80 4087068144 S Ci:1:041:0 s a1 01 0300 0000 0008 8 <
ffff8803e300ad80 4087068313 C Ci:1:041:0 0 8 = 47ff9fff 1700ff9f
ffff8803e300a240 4087083185 S Ci:1:041:0 s a1 01 0300 0000 0008 8 <
ffff8803e300a240 4087083313 C Ci:1:041:0 0 8 = ffb7ffaf ff0027ff
ffff8803ebbf4f00 4087098159 S Ci:1:041:0 s a1 01 0300 0000 0008 8 <
ffff8803ebbf4f00 4087098314 C Ci:1:041:0 0 8 = 8fff272a d100d36b
ffff8803ebbf4f00 4087114142 S Ci:1:041:0 s a1 01 0300 0000 0008 8 <
ffff8803ebbf4f00 4087114314 C Ci:1:041:0 0 8 = 06fe94ee 97001316
ffff8803e300a240 4087130202 S Ci:1:041:0 s a1 01 0300 0000 0008 8 <
ffff8803e300a240 4087130392 C Ci:1:041:0 0 8 = fe2822a9 db00db78
ffff8803e300a240 4087145208 S Ci:1:041:0 s a1 01 0300 0000 0008 8 <
ffff8803e300a240 4087145386 C Ci:1:041:0 0 8 = 93e0bd68 5200ef28
ffff880406dc6d80 4087162290 S Ci:1:041:0 s a1 01 0300 0000 0008 8 <
ffff880406dc6d80 4087162441 C Ci:1:041:0 0 8 = 5d151b5e 1f007598
ffff880406dc6d80 4087177163 S Ci:1:041:0 s a1 01 0300 0000 0008 8 <
ffff880406dc6d80 4087177315 C Ci:1:041:0 0 8 = 636578e0 1b009cc8
ffff8803ebbf4f00 4087192181 S Ci:1:041:0 s a1 01 0300 0000 0008 8 <
ffff8803ebbf4f00 4087192316 C Ci:1:041:0 0 8 = 27a4f730 0200f6b7
ffff8803a00d8a80 4087209261 S Ci:1:041:0 s a1 01 0300 0000 0008 8 <
ffff8803a00d8a80 4087209442 C Ci:1:041:0 0 8 = 5853babd c1007867
ffff8803e300a240 4087224157 S Ci:1:041:0 s a1 01 0300 0000 0008 8 <
ffff8803e300a240 4087224346 C Ci:1:041:0 0 8 = 4d04b4a3 240047dd
ffff8803ebbf4f00 4087239136 S Ci:1:041:0 s a1 01 0300 0000 0008 8 <
ffff8803ebbf4f00 4087239314 C Ci:1:041:0 0 8 = d9be0047 1600e1ee
ffff8803e300a240 4087256303 S Ci:1:041:0 s a1 01 0300 0000 0008 8 <
ffff8803e300a240 4087256443 C Ci:1:041:0 0 8 = f12a6e54 ee00fc68
ffff880406dc6d80 4087271134 S Ci:1:041:0 s a1 01 0300 0000 0008 8 <
ffff880406dc6d80 4087271337 C Ci:1:041:0 0 8 = 78172d45 5c00eff0
ffff880406dc6d80 4087286173 S Ci:1:041:0 s a1 01 0300 0000 0008 8 <
ffff880406dc6d80 4087286316 C Ci:1:041:0 0 8 = 75bcd729 31004973
ffff880406dc6d80 4087303232 S Ci:1:041:0 s a1 01 0300 0000 0008 8 <
ffff880406dc6d80 4087303344 C Ci:1:041:0 0 8 = c485245b 5800a19d
ffff880406dc6d80 4087318128 S Ci:1:041:0 s a1 01 0300 0000 0008 8 <
ffff880406dc6d80 4087318337 C Ci:1:041:0 0 8 = 06fd5c2c f4006b09
ffff8803ebbf4f00 4087333167 S Ci:1:041:0 s a1 01 0300 0000 0008 8 <
ffff8803ebbf4f00 4087333343 C Ci:1:041:0 0 8 = b01b547f e8009503
ffff8803a00d8a80 4087350209 S Ci:1:041:0 s a1 01 0300 0000 0008 8 <
ffff8803a00d8a80 4087350376 C Ci:1:041:0 0 8 = 632f8736 b9007c55
ffff8803e300a240 4087365259 S Ci:1:041:0 s a1 01 0300 0000 0008 8 <
ffff8803e300a240 4087365443 C Ci:1:041:0 0 8 = 38ab9904 420098a3
ffff8803a00d8a80 4087380158 S Ci:1:041:0 s a1 01 0300 0000 0008 8 <
ffff8803a00d8a80 4087380338 C Ci:1:041:0 0 8 = ef1460c3 ae00d0ef
ffff8803a00d8a80 4087395177 S Ci:1:041:0 s a1 01 0300 0000 0008 8 <
ffff8803a00d8a80 4087395339 C Ci:1:041:0 0 8 = 2b431708 54008766
ffff8803a00d8a80 4087412236 S Ci:1:041:0 s a1 01 0300 0000 0008 8 <
ffff8803a00d8a80 4087412338 C Ci:1:041:0 0 8 = 5376d4b2 aa0048f4
ffff8803a00d8a80 4087427079 S Ci:1:041:0 s a1 01 0300 0000 0008 8 <
ffff8803a00d8a80 4087427189 C Ci:1:041:0 0 8 = 43a0f94a ce00536e
ffff8803a00d8a80 4087442704 S Ci:1:041:0 s a1 01 0300 0000 0008 8 <
ffff8803a00d8a80 4087442818 C Ci:1:041:0 0 8 = 3fd674be ef004494
ffff8803a00d8a80 4087459240 S Ci:1:041:0 s a1 01 0300 0000 0008 8 <
ffff8803a00d8a80 4087459320 C Ci:1:041:0 0 8 = eb1545b1 e3003465
ffff8803a00d8a80 4087474266 S Ci:1:041:0 s a1 01 0300 0000 0008 8 <
ffff8803a00d8a80 4087474444 C Ci:1:041:0 0 8 = 01b708e9 fd001b2c
ffff8803a00d8a80 4087489249 S Ci:1:041:0 s a1 01 0300 0000 0008 8 <
ffff8803a00d8a80 4087489445 C Ci:1:041:0 0 8 = 71b11e0c cf00432a
ffff8803a00d8a80 4087506226 S Ci:1:041:0 s a1 01 0300 0000 0008 8 <
ffff8803a00d8a80 4087506348 C Ci:1:041:0 0 8 = 0e22c33f fc003732
ffff8803a00d8a80 4087521247 S Ci:1:041:0 s a1 01 0300 0000 0008 8 <
ffff8803a00d8a80 4087521445 C Ci:1:041:0 0 8 = 6bb521d5 8e001516
ffff8803e300a480 4087536151 S Ci:1:041:0 s a1 01 0300 0000 0008 8 <
ffff8803e300a480 4087536321 C Ci:1:041:0 0 8 = bb4c218d 8c005377
ffff8803ebbf4b40 4087553213 S Ci:1:041:0 s a1 01 0300 0000 0008 8 <
ffff8803ebbf4b40 4087553411 C Ci:1:041:0 0 8 = 9695cff5 7900112a
ffff8803e300a6c0 4087567214 S Ci:1:041:0 s a1 01 0300 0000 0008 8 <
ffff8803e300a6c0 4087567332 C Ci:1:041:0 0 8 = a992ba08 f9006c90
ffff880406dc6900 4087584094 S Ci:1:041:0 s a1 01 0300 0000 0008 8 <
ffff880406dc6900 4087584315 C Ci:1:041:0 0 8 = 83141de9 a40098e1
ffff8803ebbf4b40 4087599181 S Ci:1:041:0 s a1 01 0300 0000 0008 8 <
ffff8803ebbf4b40 4087599343 C Ci:1:041:0 0 8 = ba2284fa 24005e61
ffff8803ebbf4b40 4087615222 S Ci:1:041:0 s a1 01 0300 0000 0008 8 <
ffff8803ebbf4b40 4087615341 C Ci:1:041:0 0 8 = c7429ead 23003289
ffff8803a0055240 4087630200 S Ci:1:041:0 s a1 01 0300 0000 0008 8 <
ffff8803a0055240 4087630347 C Ci:1:041:0 0 8 = 880162e4 a200451c
ffff8803a0055840 4087647187 S Ci:1:041:0 s a1 01 0300 0000 0008 8 <
ffff8803a0055840 4087647324 C Ci:1:041:0 0 8 = 8b64e555 b3005d40
ffff8803a0055840 4087662233 S Ci:1:041:0 s a1 01 0300 0000 0008 8 <
ffff8803a0055840 4087662319 C Ci:1:041:0 0 8 = b25ff0bf dc001f3c
ffff8803a0055840 4087677256 S Ci:1:041:0 s a1 01 0300 0000 0008 8 <
ffff8803a0055840 4087677449 C Ci:1:041:0 0 8 = aa05104c 4c00bb11
ffff880406dc69c0 4087692142 S Ci:1:041:0 s a1 01 0300 0000 0008 8 <
ffff880406dc69c0 4087692389 C Ci:1:041:0 0 8 = 804bec43 3b00413b
ffff8803e300ad80 4087708206 S Ci:1:041:0 s a1 01 0300 0000 0008 8 <
ffff8803e300ad80 4087708340 C Ci:1:041:0 0 8 = c4ce9f82 ab00a5c4
ffff880406dc69c0 4087723176 S Ci:1:041:0 s a1 01 0300 0000 0008 8 <
ffff880406dc69c0 4087723345 C Ci:1:041:0 0 8 = a747b059 a4009415
ffff8803a00d8a80 4087740118 S Ci:1:041:0 s a1 01 0300 0000 0008 8 <
ffff8803a00d8a80 4087740199 C Ci:1:041:0 0 8 = f0d2ff14 dd00765c
ffff8803a00d8a80 4087755180 S Ci:1:041:0 s a1 01 0300 0000 0008 8 <
ffff8803a00d8a80 4087755349 C Ci:1:041:0 0 8 = 3a538e24 c900c3dd
ffff8803e300a780 4087770227 S Ci:1:041:0 s a1 01 0300 0000 0008 8 <
ffff8803e300a780 4087770369 C Ci:1:041:0 0 8 = f3687234 41000759
ffff880406dc69c0 4087786274 S Ci:1:041:0 s a1 01 0300 0000 0008 8 <
ffff880406dc69c0 4087786475 C Ci:1:041:0 0 8 = 03601541 2100b7e6
ffff880406dc69c0 4087802172 S Ci:1:041:0 s a1 01 0300 0000 0008 8 <
ffff880406dc69c0 4087802320 C Ci:1:041:0 0 8 = 1fd83d5f ae003538
ffff880406dc69c0 4087817182 S Ci:1:041:0 s a1 01 0300 0000 0008 8 <
ffff880406dc69c0 4087817322 C Ci:1:041:0 0 8 = e44b8e38 83001554
ffff880406dc69c0 4087834214 S Ci:1:041:0 s a1 01 0300 0000 0008 8 <
ffff880406dc69c0 4087834318 C Ci:1:041:0 0 8 = 4e61451a 920065ca
ffff880406dc69c0 4087849158 S Ci:1:041:0 s a1 01 0300 0000 0008 8 <
ffff880406dc69c0 4087849336 C Ci:1:041:0 0 8 = e6d4242a b800a20d
ffff8803ebbf40c0 4087864165 S Ci:1:041:0 s a1 01 0300 0000 0008 8 <
ffff8803ebbf40c0 4087864319 C Ci:1:041:0 0 8 = 95597ad6 4b006650
ffff8803e300af00 4087880186 S Ci:1:041:0 s a1 01 0300 0000 0008 8 <
ffff8803e300af00 4087880317 C Ci:1:041:0 0 8 = 26309c44 8300ac65
ffff8803e300a780 4087895141 S Ci:1:041:0 s a1 01 0300 0000 0008 8 <
ffff8803e300a780 4087895323 C Ci:1:041:0 0 8 = 9d7fc9a4 09001f88
ffff8803ebbf4180 4087911129 S Ci:1:041:0 s a1 01 0300 0000 0008 8 <
ffff8803ebbf4180 4087911332 C Ci:1:041:0 0 8 = be188c84 e900f6fd
ffff8803ebbf4180 4087928191 S Ci:1:041:0 s a1 01 0300 0000 0008 8 <
ffff8803ebbf4180 4087928319 C Ci:1:041:0 0 8 = cab968e4 f700e80a
ffff8803ebbf4180 4087943098 S Ci:1:041:0 s a1 01 0300 0000 0008 8 <
ffff8803ebbf4180 4087943196 C Ci:1:041:0 0 8 = 579365c7 c200aea0
ffff880406dc6900 4087958182 S Ci:1:041:0 s a1 01 0300 0000 0008 8 <
ffff880406dc6900 4087958324 C Ci:1:041:0 0 8 = 99cbb915 820086a7
ffff8803ebbf4780 4087975223 S Ci:1:041:0 s a1 01 0300 0000 0008 8 <
ffff8803ebbf4780 4087975322 C Ci:1:041:0 0 8 = 17cbda44 de007c33
ffff8803ebbf4780 4087990202 S Ci:1:041:0 s a1 01 0300 0000 0008 8 <
ffff8803ebbf4780 4087990318 C Ci:1:041:0 0 8 = d5d41c6a f1001dab
ffff8803ebbf4780 4088005157 S Ci:1:041:0 s a1 01 0300 0000 0008 8 <
ffff8803ebbf4780 4088005344 C Ci:1:041:0 0 8 = f19f65dd 4300b1ed
ffff8803ebbf4780 4088021811 S Ci:1:041:0 s a1 01 0300 0000 0008 8 <
ffff8803ebbf4780 4088021950 C Ci:1:041:0 0 8 = 988b60d9 b0009329
ffff8803a00d8300 4088036917 S Ci:1:041:0 s a1 01 0300 0000 0008 8 <
ffff8803a00d8300 4088037075 C Ci:1:041:0 0 8 = b3e1f0e7 44000d6c
ffff8803a00d8300 4088052059 S Ci:1:041:0 s a1 01 0300 0000 0008 8 <
ffff8803a00d8300 4088052242 C Ci:1:041:0 0 8 = 3295b8b4 f70040c1
ffff8803e300a000 4088067837 S Ci:1:041:0 s a1 01 0300 0000 0008 8 <
ffff8803e300a000 4088068094 C Ci:1:041:0 0 8 = 4358fc63 8e00c668
ffff8803a00d8c00 4088083897 S Ci:1:041:0 s a1 01 0300 0000 0008 8 <
ffff8803a00d8c00 4088084094 C Ci:1:041:0 0 8 = 6c715d18 bc00d97f
ffff8803a00d8c00 4088099808 S Ci:1:041:0 s a1 01 0300 0000 0008 8 <
ffff8803a00d8c00 4088099993 C Ci:1:041:0 0 8 = de00b3b5 5a00b015
ffff8803a00d8c00 4088113976 S Ci:1:041:0 s a1 01 0300 0000 0008 8 <
ffff8803a00d8c00 4088114073 C Ci:1:041:0 0 8 = c2c447ac 0900f9c2
ffff8803a00d8300 4088132946 S Ci:1:041:0 s a1 01 0300 0000 0008 8 <
ffff8803a00d8300 4088133074 C Ci:1:041:0 0 8 = 6621c45c 6000b66f
ffff8803a00d8c00 4088147659 S Ci:1:041:0 s a1 01 0300 0000 0008 8 <
ffff8803a00d8c00 4088147822 C Ci:1:041:0 0 8 = 8812a38b 2e00b94d
ffff8803a00d8c00 4088160760 S Ci:1:041:0 s a1 01 0300 0000 0008 8 <
ffff8803a00d8c00 4088160947 C Ci:1:041:0 0 8 = fb2a0443 47000303
ffff8803a00d8c00 4088177761 S Ci:1:041:0 s a1 01 0300 0000 0008 8 <
ffff8803a00d8c00 4088177970 C Ci:1:041:0 0 8 = 1320e84e 6f002ff1
ffff8803a00d8300 4088192796 S Ci:1:041:0 s a1 01 0300 0000 0008 8 <
ffff8803a00d8300 4088192972 C Ci:1:041:0 0 8 = 72812293 a1008bf9
ffff8803a00d8300 4088207671 S Ci:1:041:0 s a1 01 0300 0000 0008 8 <
ffff8803a00d8300 4088207842 C Ci:1:041:0 0 8 = 6499c38e 1100d46e
ffff8803e300a9c0 4088223730 S Ci:1:041:0 s a1 01 0300 0000 0008 8 <
ffff8803e300a9c0 4088223846 C Ci:1:041:0 0 8 = 639df23b b100dc65
ffff8803a00d8b40 4088241814 S Ci:1:041:0 s a1 01 0300 0000 0008 8 <
ffff8803a00d8b40 4088241949 C Ci:1:041:0 0 8 = e2ad2f5c fd001d81
ffff8803a00d8b40 4088254672 S Ci:1:041:0 s a1 01 0300 0000 0008 8 <
ffff8803a00d8b40 4088254845 C Ci:1:041:0 0 8 = f1271c82 9600532a
ffff8803a00d8b40 4088271728 S Ci:1:041:0 s a1 01 0300 0000 0008 8 <
ffff8803a00d8b40 4088271844 C Ci:1:041:0 0 8 = 23bc6e77 5200c638
ffff8803e300a300 4088286769 S Ci:1:041:0 s a1 01 0300 0000 0008 8 <
ffff8803e300a300 4088286971 C Ci:1:041:0 0 8 = 70f82e60 8b002ff6
ffff8803e300a9c0 4088302065 S Ci:1:041:0 s a1 01 0300 0000 0008 8 <
ffff8803e300a9c0 4088302208 C Ci:1:041:0 0 8 = de50c852 9600a8fd
ffff8803e300a300 4088318735 S Ci:1:041:0 s a1 01 0300 0000 0008 8 <
ffff8803e300a300 4088318852 C Ci:1:041:0 0 8 = 942b6a73 57002023
ffff8803e300a300 4088333758 S Ci:1:041:0 s a1 01 0300 0000 0008 8 <
ffff8803e300a300 4088333954 C Ci:1:041:0 0 8 = 74f03626 6a001101
ffff8803e300a300 4088348799 S Ci:1:041:0 s a1 01 0300 0000 0008 8 <
ffff8803e300a300 4088348948 C Ci:1:041:0 0 8 = d59ebfcc 2e003377
ffff8803e300a300 4088365672 S Ci:1:041:0 s a1 01 0300 0000 0008 8 <
ffff8803e300a300 4088365822 C Ci:1:041:0 0 8 = af995e9c ef00f0e7
ffff8804031910c0 4088380744 S Ci:1:041:0 s a1 01 0300 0000 0008 8 <
ffff8804031910c0 4088380961 C Ci:1:041:0 0 8 = 2596d0e5 8400531f
ffff8803ebbf4180 4088395783 S Ci:1:041:0 s a1 01 0300 0000 0008 8 <
ffff8803ebbf4180 4088395972 C Ci:1:041:0 0 8 = b6d994de 3d0058e2
ffff8803ebbf4780 4088412699 S Ci:1:041:0 s a1 01 0300 0000 0008 8 <
ffff8803ebbf4780 4088412851 C Ci:1:041:0 0 8 = 305ff77c ab00c05d
ffff8803a00d8b40 4088427737 S Ci:1:041:0 s a1 01 0300 0000 0008 8 <
ffff8803a00d8b40 4088427831 C Ci:1:041:0 0 8 = 37dfbb07 960025a0
ffff8803a00d8b40 4088442773 S Ci:1:041:0 s a1 01 0300 0000 0008 8 <
ffff8803a00d8b40 4088442975 C Ci:1:041:0 0 8 = bd25aa31 34001bbb
ffff8803e300a300 4088459815 S Ci:1:041:0 s a1 01 0300 0000 0008 8 <
ffff8803e300a300 4088459966 C Ci:1:041:0 0 8 = 5f042f53 4100cdbb
ffff8803e300a300 4088474727 S Ci:1:041:0 s a1 01 0300 0000 0008 8 <
ffff8803e300a300 4088474826 C Ci:1:041:0 0 8 = e256a60f 6000fcc6
ffff8803e300a300 4088489770 S Ci:1:041:0 s a1 01 0300 0000 0008 8 <
ffff8803e300a300 4088489952 C Ci:1:041:0 0 8 = 18933076 32009c88
ffff8803ebbf4780 4088504876 S Ci:1:041:0 s a1 01 0300 0000 0008 8 <
ffff8803ebbf4780 4088505078 C Ci:1:041:0 0 8 = 364ac86e 2f003896
ffff8803ebbf4780 4088521713 S Ci:1:041:0 s a1 01 0300 0000 0008 8 <
ffff8803ebbf4780 4088521886 C Ci:1:041:0 0 8 = 9ed95b04 e200ed77
ffff880403191780 4088536696 S Ci:1:041:0 s a1 01 0300 0000 0008 8 <
ffff880403191780 4088536827 C Ci:1:041:0 0 8 = 1f0d8dcb ca0036b2
ffff880403191780 4088551790 S Ci:1:041:0 s a1 01 0300 0000 0008 8 <
ffff880403191780 4088551963 C Ci:1:041:0 0 8 = 76ce37d7 0c002265
ffff8803ebbf4780 4088568696 S Ci:1:041:0 s a1 01 0300 0000 0008 8 <
ffff8803ebbf4780 4088568827 C Ci:1:041:0 0 8 = e4747d91 5d00051a
ffff8803ebbf4780 4088583741 S Ci:1:041:0 s a1 01 0300 0000 0008 8 <
ffff8803ebbf4780 4088583850 C Ci:1:041:0 0 8 = 3fcbe1cb 26006a91
ffff8803ebbf4780 4088598774 S Ci:1:041:0 s a1 01 0300 0000 0008 8 <
ffff8803ebbf4780 4088598955 C Ci:1:041:0 0 8 = 41e815e1 9a001270
ffff8803ebbf4780 4088615690 S Ci:1:041:0 s a1 01 0300 0000 0008 8 <
ffff8803ebbf4780 4088615834 C Ci:1:041:0 0 8 = fe2c5754 ce009009
ffff8803ebbf4780 4088630726 S Ci:1:041:0 s a1 01 0300 0000 0008 8 <
ffff8803ebbf4780 4088630829 C Ci:1:041:0 0 8 = 8090f3d9 7d00b599
ffff8803e300a300 4088645776 S Ci:1:041:0 s a1 01 0300 0000 0008 8 <
ffff8803e300a300 4088645989 C Ci:1:041:0 0 8 = d0d2feb2 8d0069d6
ffff880403191780 4088662747 S Ci:1:041:0 s a1 01 0300 0000 0008 8 <
ffff880403191780 4088662952 C Ci:1:041:0 0 8 = 62c041f2 0b00e756
ffff8803ebbf4780 4088677707 S Ci:1:041:0 s a1 01 0300 0000 0008 8 <
ffff8803ebbf4780 4088677849 C Ci:1:041:0 0 8 = 27dd48cd 8b00a02f
ffff8803a00d8300 4088692747 S Ci:1:041:0 s a1 01 0300 0000 0008 8 <
ffff8803a00d8300 4088692849 C Ci:1:041:0 0 8 = 65d0c16a 1a00dd9c
ffff8803e300a300 4088707748 S Ci:1:041:0 s a1 01 0300 0000 0008 8 <
ffff8803e300a300 4088707854 C Ci:1:041:0 0 8 = 021bae09 3b00ee6d
ffff8804031910c0 4088724692 S Ci:1:041:0 s a1 01 0300 0000 0008 8 <
ffff8804031910c0 4088724866 C Ci:1:041:0 0 8 = 29cee2d2 720065b5
ffff8803ebbf4780 4088739738 S Ci:1:041:0 s a1 01 0300 0000 0008 8 <
ffff8803ebbf4780 4088739857 C Ci:1:041:0 0 8 = b8f95886 0000ffa7
ffff8803ebbf4780 4088755046 S Ci:1:041:0 s a1 01 0300 0000 0008 8 <
ffff8803ebbf4780 4088755233 C Ci:1:041:0 0 8 = feabbf38 bb003377
ffff8803e300a600 4088770675 S Ci:1:041:0 s a1 01 0300 0000 0008 8 <
ffff8803e300a600 4088770831 C Ci:1:041:0 0 8 = 51fd2ab5 59009416
ffff8803ebbf4780 4088787682 S Ci:1:041:0 s a1 01 0300 0000 0008 8 <
ffff8803ebbf4780 4088787850 C Ci:1:041:0 0 8 = e4cb098b 16007b0c
ffff8803ebbf4780 4088802761 S Ci:1:041:0 s a1 01 0300 0000 0008 8 <
ffff8803ebbf4780 4088802976 C Ci:1:041:0 0 8 = 8a140d1e 1a00a3b3
ffff8803e300a600 4088817805 S Ci:1:041:0 s a1 01 0300 0000 0008 8 <
ffff8803e300a600 4088817976 C Ci:1:041:0 0 8 = 7f251926 5a009521
ffff8804031910c0 4088834722 S Ci:1:041:0 s a1 01 0300 0000 0008 8 <
ffff8804031910c0 4088834830 C Ci:1:041:0 0 8 = e82fafcb b80082af
ffff8803a00d8300 4088849727 S Ci:1:041:0 s a1 01 0300 0000 0008 8 <
ffff8803a00d8300 4088849851 C Ci:1:041:0 0 8 = d755c2a5 4200787c
ffff8803e300a600 4088864840 S Ci:1:041:0 s a1 01 0300 0000 0008 8 <
ffff8803e300a600 4088864991 C Ci:1:041:0 0 8 = 8f120cc0 b8005fb0
ffff8803ebbf4180 4088881768 S Ci:1:041:0 s a1 01 0300 0000 0008 8 <
ffff8803ebbf4180 4088881964 C Ci:1:041:0 0 8 = d450a36f 18004d43
ffff8803ebbf4180 4088896767 S Ci:1:041:0 s a1 01 0300 0000 0008 8 <
ffff8803ebbf4180 4088896958 C Ci:1:041:0 0 8 = be39815d b7009afc
ffff8803ebbf4180 4088911793 S Ci:1:041:0 s a1 01 0300 0000 0008 8 <
ffff8803ebbf4180 4088911957 C Ci:1:041:0 0 8 = d495ffa4 9900707c
ffff8803ebbf4180 4088928729 S Ci:1:041:0 s a1 01 0300 0000 0008 8 <
ffff8803ebbf4180 4088928832 C Ci:1:041:0 0 8 = 133d399d b100b5f9
ffff8803ebbf4180 4088943741 S Ci:1:041:0 s a1 01 0300 0000 0008 8 <
ffff8803ebbf4180 4088943853 C Ci:1:041:0 0 8 = d7136c46 2f00938e
ffff8803e300a0c0 4088958736 S Ci:1:041:0 s a1 01 0300 0000 0008 8 <
ffff8803e300a0c0 4088958844 C Ci:1:041:0 0 8 = 06293094 6800f3a7
ffff8803e300a0c0 4088973912 S Ci:1:041:0 s a1 01 0300 0000 0008 8 <
ffff8803e300a0c0 4088974104 C Ci:1:041:0 0 8 = 0c1fd2d3 ab00e1ce
ffff8803e300a0c0 4088990688 S Ci:1:041:0 s a1 01 0300 0000 0008 8 <
ffff8803e300a0c0 4088990828 C Ci:1:041:0 0 8 = 4295209a 1900eb08
ffff8803e300a300 4089006756 S Ci:1:041:0 s a1 01 0300 0000 0008 8 <
ffff8803e300a300 4089006967 C Ci:1:041:0 0 8 = c62a96b9 27005352
ffff8803e300a300 4089021809 S Ci:1:041:0 s a1 01 0300 0000 0008 8 <
ffff8803e300a300 4089021977 C Ci:1:041:0 0 8 = c6871aff ee008a86
ffff8803e300a300 4089036648 S Ci:1:041:0 s a1 01 0300 0000 0008 8 <
ffff8803e300a300 4089036848 C Ci:1:041:0 0 8 = 2419e040 c50096b1
ffff8803e300a300 4089052015 S Ci:1:041:0 s a1 01 0300 0000 0008 8 <
ffff8803e300a300 4089052228 C Ci:1:041:0 0 8 = eb679445 c00060de
ffff8803e300a300 4089068787 S Ci:1:041:0 s a1 01 0300 0000 0008 8 <
ffff8803e300a300 4089068958 C Ci:1:041:0 0 8 = f36e64db 4d00314d
ffff8803e300a300 4089083634 S Ci:1:041:0 s a1 01 0300 0000 0008 8 <
ffff8803e300a300 4089083848 C Ci:1:041:0 0 8 = c68a312b 2900341d
ffff8804031910c0 4089098904 S Ci:1:041:0 s a1 01 0300 0000 0008 8 <
ffff8804031910c0 4089099097 C Ci:1:041:0 0 8 = 8ca01208 0d00cc58
ffff880403191840 4089116023 S Ci:1:041:0 s a1 01 0300 0000 0008 8 <
ffff880403191840 4089116206 C Ci:1:041:0 0 8 = 8321960e fc0021a6
ffff8803ebbf4cc0 4089130913 S Ci:1:041:0 s a1 01 0300 0000 0008 8 <
ffff8803ebbf4cc0 4089131103 C Ci:1:041:0 0 8 = be579522 6100cbc1
ffff8803ebbf4cc0 4089145940 S Ci:1:041:0 s a1 01 0300 0000 0008 8 <
ffff8803ebbf4cc0 4089146081 C Ci:1:041:0 0 8 = ab8cfe73 9600d764
ffff8803ebbf4cc0 4089162004 S Ci:1:041:0 s a1 01 0300 0000 0008 8 <
ffff8803ebbf4cc0 4089162232 C Ci:1:041:0 0 8 = 0c678ed5 cd00949b
ffff8803ebbf4cc0 4089177066 S Ci:1:041:0 s a1 01 0300 0000 0008 8 <
ffff8803ebbf4cc0 4089177226 C Ci:1:041:0 0 8 = 6d6478b3 a900b795
ffff8803ebbf4cc0 4089194960 S Ci:1:041:0 s a1 01 0300 0000 0008 8 <
ffff8803ebbf4cc0 4089195103 C Ci:1:041:0 0 8 = c0bff00e 8f003ec9
ffff8803e300a900 4089208921 S Ci:1:041:0 s a1 01 0300 0000 0008 8 <
ffff8803e300a900 4089209096 C Ci:1:041:0 0 8 = 64bbe61a 7000daca
ffff880403191840 4089225035 S Ci:1:041:0 s a1 01 0300 0000 0008 8 <
ffff880403191840 4089225208 C Ci:1:041:0 0 8 = a0a2e6a4 0f0078ed
ffff8803a00d8c00 4089239918 S Ci:1:041:0 s a1 01 0300 0000 0008 8 <
ffff8803a00d8c00 4089240104 C Ci:1:041:0 0 8 = 795b42fc 6d004414
ffff880403191300 4089255013 S Ci:1:041:0 s a1 01 0300 0000 0008 8 <
ffff880403191300 4089255229 C Ci:1:041:0 0 8 = 4ae9200c a100ebed
ffff8804031919c0 4089271957 S Ci:1:041:0 s a1 01 0300 0000 0008 8 <
ffff8804031919c0 4089272101 C Ci:1:041:0 0 8 = c512ad97 1c00d979
ffff8804031919c0 4089286920 S Ci:1:041:0 s a1 01 0300 0000 0008 8 <
ffff8804031919c0 4089287104 C Ci:1:041:0 0 8 = 86228ecc 6b00618e
ffff8804031919c0 4089303972 S Ci:1:041:0 s a1 01 0300 0000 0008 8 <
ffff8804031919c0 4089304110 C Ci:1:041:0 0 8 = aa4c54a9 4100ce21
ffff8803ebbf4cc0 4089319022 S Ci:1:041:0 s a1 01 0300 0000 0008 8 <
ffff8803ebbf4cc0 4089319232 C Ci:1:041:0 0 8 = 0ec1c399 73007bf4
ffff8803a0055e40 4089334059 S Ci:1:041:0 s a1 01 0300 0000 0008 8 <
ffff8803a0055e40 4089334226 C Ci:1:041:0 0 8 = 72883830 c3009edc
ffff8803a0055e40 4089348935 S Ci:1:041:0 s a1 01 0300 0000 0008 8 <
ffff8803a0055e40 4089349105 C Ci:1:041:0 0 8 = 95c1943c 1d00b902
ffff8804031919c0 4089366011 S Ci:1:041:0 s a1 01 0300 0000 0008 8 <
ffff8804031919c0 4089366232 C Ci:1:041:0 0 8 = 3c6d4da9 2d00daf3
ffff8804031919c0 4089381026 S Ci:1:041:0 s a1 01 0300 0000 0008 8 <
ffff8804031919c0 4089381210 C Ci:1:041:0 0 8 = 1b65bdaa a70020f9
ffff8803ebbf4cc0 4089395915 S Ci:1:041:0 s a1 01 0300 0000 0008 8 <
ffff8803ebbf4cc0 4089396105 C Ci:1:041:0 0 8 = ff8797ca 41004d5f
ffff8803ebbf4cc0 4089410898 S Ci:1:041:0 s a1 01 0300 0000 0008 8 <
ffff8803ebbf4cc0 4089411102 C Ci:1:041:0 0 8 = d0008b04 5b00ccc2
ffff8803ebbf4cc0 4089427974 S Ci:1:041:0 s a1 01 0300 0000 0008 8 <
ffff8803ebbf4cc0 4089428085 C Ci:1:041:0 0 8 = e5f92c8d 53003ddc
ffff8803ebbf4cc0 4089442905 S Ci:1:041:0 s a1 01 0300 0000 0008 8 <
ffff8803ebbf4cc0 4089443106 C Ci:1:041:0 0 8 = 0ee5d24c 99001ec1
ffff8803ebbf4cc0 4089457941 S Ci:1:041:0 s a1 01 0300 0000 0008 8 <
ffff8803ebbf4cc0 4089458092 C Ci:1:041:0 0 8 = 56a043ff 3e00df76
ffff8803ebbf4cc0 4089475001 S Ci:1:041:0 s a1 01 0300 0000 0008 8 <
ffff8803ebbf4cc0 4089475114 C Ci:1:041:0 0 8 = 3befc817 e5007431
ffff8803a00d8c00 4089490027 S Ci:1:041:0 s a1 01 0300 0000 0008 8 <
ffff8803a00d8c00 4089490232 C Ci:1:041:0 0 8 = 5c82b53c 2e002f74
ffff8803a00d8c00 4089504888 S Ci:1:041:0 s a1 01 0300 0000 0008 8 <
ffff8803a00d8c00 4089505102 C Ci:1:041:0 0 8 = 87477488 95008b4c
ffff8803a00d8c00 4089520286 S Ci:1:041:0 s a1 01 0300 0000 0008 8 <
ffff8803a00d8c00 4089520459 C Ci:1:041:0 0 8 = 587da371 9a00d1e0
ffff8803e300a180 4089537016 S Ci:1:041:0 s a1 01 0300 0000 0008 8 <
ffff8803e300a180 4089537233 C Ci:1:041:0 0 8 = ed4ed14f de00f5d1
ffff8803ebbf4cc0 4089551862 S Ci:1:041:0 s a1 01 0300 0000 0008 8 <
ffff8803ebbf4cc0 4089552107 C Ci:1:041:0 0 8 = 188917e8 1c00a2f4
ffff8804031913c0 4089566953 S Ci:1:041:0 s a1 01 0300 0000 0008 8 <
ffff8804031913c0 4089567102 C Ci:1:041:0 0 8 = dacfda89 480053aa
ffff880403191300 4089584027 S Ci:1:041:0 s a1 01 0300 0000 0008 8 <
ffff880403191300 4089584232 C Ci:1:041:0 0 8 = c716d65f 0f001d2d
ffff880403191300 4089598918 S Ci:1:041:0 s a1 01 0300 0000 0008 8 <
ffff880403191300 4089599108 C Ci:1:041:0 0 8 = 66f113b1 da0026b7
ffff880403191300 4089615964 S Ci:1:041:0 s a1 01 0300 0000 0008 8 <
ffff880403191300 4089616108 C Ci:1:041:0 0 8 = 5a4ccb40 1a00d1e0
ffff8803ed3a9f00 4089631021 S Ci:1:041:0 s a1 01 0300 0000 0008 8 <
ffff8803ed3a9f00 4089631219 C Ci:1:041:0 0 8 = 087d5201 75007e10
ffff8803c7fc36c0 4089646060 S Ci:1:041:0 s a1 01 0300 0000 0008 8 <
ffff8803c7fc36c0 4089646210 C Ci:1:041:0 0 8 = 6328ac76 12006a7e
ffff8803c7fc36c0 4089660973 S Ci:1:041:0 s a1 01 0300 0000 0008 8 <
ffff8803c7fc36c0 4089661109 C Ci:1:041:0 0 8 = 2369d3f3 3800d23c
ffff8803c7fc36c0 4089677992 S Ci:1:041:0 s a1 01 0300 0000 0008 8 <
ffff8803c7fc36c0 4089678113 C Ci:1:041:0 0 8 = 6ddfbfe7 d0001ce9
ffff8803c7fc36c0 4089694060 S Ci:1:041:0 s a1 01 0300 0000 0008 8 <
ffff8803c7fc36c0 4089694208 C Ci:1:041:0 0 8 = edd6d8c8 e900b62b
ffff8804031913c0 4089708885 S Ci:1:041:0 s a1 01 0300 0000 0008 8 <
ffff8804031913c0 4089709085 C Ci:1:041:0 0 8 = 53e3f5e9 fa007f8c
ffff880403191600 4089723974 S Ci:1:041:0 s a1 01 0300 0000 0008 8 <
ffff880403191600 4089724110 C Ci:1:041:0 0 8 = 71e0673b b2005df6
ffff8803e300a900 4089739493 S Ci:1:041:0 s a1 01 0300 0000 0008 8 <
ffff8803e300a900 4089739604 C Ci:1:041:0 0 8 = 2d7eb425 cd001311
ffff880403191600 4089755920 S Ci:1:041:0 s a1 01 0300 0000 0008 8 <
ffff880403191600 4089756091 C Ci:1:041:0 0 8 = bbe8e7c7 b10003b4
ffff8803ebbf40c0 4089770949 S Ci:1:041:0 s a1 01 0300 0000 0008 8 <
ffff8803ebbf40c0 4089771089 C Ci:1:041:0 0 8 = c7e3ffc4 6300feec
ffff8803ebbf40c0 4089786000 S Ci:1:041:0 s a1 01 0300 0000 0008 8 <
ffff8803ebbf40c0 4089786088 C Ci:1:041:0 0 8 = 7e45a62a 3200abe6
ffff8803ebbf40c0 4089802984 S Ci:1:041:0 s a1 01 0300 0000 0008 8 <
ffff8803ebbf40c0 4089803085 C Ci:1:041:0 0 8 = c621e5dd 1300d010
ffff8803ebbf40c0 4089817886 S Ci:1:041:0 s a1 01 0300 0000 0008 8 <
ffff8803ebbf40c0 4089818106 C Ci:1:041:0 0 8 = a7888f14 8a00da44
ffff880403191600 4089832981 S Ci:1:041:0 s a1 01 0300 0000 0008 8 <
ffff880403191600 4089833110 C Ci:1:041:0 0 8 = dc625a7d d5004e91
ffff8804031913c0 4089850007 S Ci:1:041:0 s a1 01 0300 0000 0008 8 <
ffff8804031913c0 4089850235 C Ci:1:041:0 0 8 = b6aa9c19 e7003df3
ffff8803a00d8c00 4089864913 S Ci:1:041:0 s a1 01 0300 0000 0008 8 <
ffff8803a00d8c00 4089865092 C Ci:1:041:0 0 8 = be51e9bf d6008af7
ffff8803a00d8c00 4089879974 S Ci:1:041:0 s a1 01 0300 0000 0008 8 <
ffff8803a00d8c00 4089880111 C Ci:1:041:0 0 8 = e2dec75e aa00aaaa
ffff8803e300a900 4089897030 S Ci:1:041:0 s a1 01 0300 0000 0008 8 <
ffff8803e300a900 4089897212 C Ci:1:041:0 0 8 = aa07e013 dbf0b600
ffff8803c7d1a0c0 5933422 C Ii:1:041:1 -108:8 0
