ffff880406dc6900 548488317 S Ci:1:042:0 s 80 06 0100 0000 0012 18 <
ffff880406dc6900 548488589 C Ci:1:042:0 0 18 = 12011001 00000008 571d01ac 00010102 0001
ffff880406dc6900 548488623 S Ci:1:042:0 s 80 06 0200 0000 0009 9 <
ffff880406dc6900 548488838 C Ci:1:042:0 0 9 = 09022200 010100a0 32
ffff880406dc6900 548488862 S Ci:1:042:0 s 80 06 0200 0000 0022 34 <
ffff880406dc6900 548489088 C Ci:1:042:0 0 34 = 09022200 010100a0 32090400 00010301 02000921 10010001 22410007 05810308
ffff8803e332c240 548489126 C Ii:1:042:1 -108:8 0
ffff8803d5611f00 548706088 S Ci:1:042:0 s 80 06 0100 0000 0040 64 <
ffff8803d5611f00 548706245 C Ci:1:042:0 0 18 = 12011001 00000008 571d01ac 00010102 0001
ffff8803d5611f00 548770934 S Ci:1:042:0 s 80 06 0100 0000 0012 18 <
ffff8803d5611f00 548771093 C Ci:1:042:0 0 18 = 12011001 00000008 571d01ac 00010102 0001
ffff8803d5611f00 548772956 S Ci:1:042:0 s 80 06 0200 0000 00ff 255 <
ffff8803d5611f00 548773217 C Ci:1:042:0 0 34 = 09022200 010100a0 32090400 00010301 02000921 10010001 22410007 05810308
ffff8803d5611f00 548774972 S Ci:1:042:0 s 80 06 0300 0000 00ff 255 <
ffff8803d5611f00 548775122 C Ci:1:042:0 0 4 = 04030904
ffff8803d5611f00 548777055 S Ci:1:042:0 s 80 06 0302 0409 00ff 255 <
ffff8803d5611f00 548777353 C Ci:1:042:0 0 40 = 28034800 49004400 2d006300 6f006d00 70006c00 69006100 6e007400 20004d00
ffff8803d5611f00 548782006 S Ci:1:042:0 s 80 06 0100 0000 0012 18 <
ffff8803d5611f00 548782234 C Ci:1:042:0 0 18 = 12011001 00000008 571d01ac 00010102 0001
ffff8803d5611f00 548785998 S Ci:1:042:0 s 80 06 0200 0000 0009 9 <
ffff8803d5611f00 548786242 C Ci:1:042:0 0 9 = 09022200 010100a0 32
ffff8803d5611f00 548787764 S Ci:1:042:0 s 80 06 0200 0000 0022 34 <
ffff8803d5611f00 548788103 C Ci:1:042:0 0 34 = 09022200 010100a0 32090400 00010301 02000921 10010001 22410007 05810308
ffff8803d5611f00 548795073 S Co:1:042:0 s 21 0a 0000 0000 0000 0
ffff8803d5611f00 548795214 C Co:1:042:0 0 0
ffff8803d5611f00 548796185 S Ci:1:042:0 s 81 06 2200 0000 0081 129 <
ffff8803d5611f00 548796604 C Ci:1:042:0 0 65 = 05010902 a1010901 a1000509 19012905 15002501 95057501 81029501 75038103
ffff8803d5611f00 548810017 S Ii:1:042:1 -115:8 4 <
ffff880406940000 553521507 S Co:1:042:0 s 21 09 0300 0000 0008 8 = 55010100 00ff075d
ffff880406940000 553521631 C Co:1:042:0 0 8 >
ffff880406940000 553552640 S Ci:1:042:0 s a1 01 0300 0000 0008 8 <
ffff880406940000 553552806 C Ci:1:042:0 0 8 = aa020000 00000000
ffff8802486c6f00 553583580 S Co:1:042:0 s 21 09 0300 0000 0008 8 = 0b010101 00000e04
ffff8802486c6f00 553583780 C Co:1:042:0 0 8 >
ffff8802486c6f00 553599197 S Co:1:042:0 s 21 09 0300 0000 0008 8 = c7853527 b3f312e8
ffff8802486c6f00 553599410 C Co:1:042:0 0 8 >
ffff880406987cc0 553615579 S Co:1:042:0 s 21 09 0300 0000 0008 8 = 01809000 15ff97ff
ffff880406987cc0 553615762 C Co:1:042:0 0 8 >
ffff880406987cc0 553630533 S Co:1:042:0 s 21 09 0300 0000 0008 8 = 77ff37ff d7ff77ff
ffff880406987cc0 553630631 C Co:1:042:0 0 8 >
ffff8803e6ff2d80 553645691 S Co:1:042:0 s 21 09 0300 0000 0008 8 = c7ff57ff a7ff07ff
ffff8803e6ff2d80 553645886 C Co:1:042:0 0 8 >
ffff8803e6ff26c0 553662703 S Co:1:042:0 s 21 09 0300 0000 0008 8 = 27ff77ff 57ff67ff
ffff8803e6ff26c0 553662885 C Co:1:042:0 0 8 >
ffff8803e6ff2d80 553677515 S Co:1:042:0 s 21 09 0300 0000 0008 8 = a7ffc7ff 67fff7ff
ffff8803e6ff2d80 553677640 C Co:1:042:0 0 8 >
ffff880406940000 553693013 S Co:1:042:0 s 21 09 0300 0000 0008 8 = 77ff77ff 67ffc7ff
ffff880406940000 553693158 C Co:1:042:0 0 8 >
ffff8802486c6f00 553709593 S Co:1:042:0 s 21 09 0300 0000 0008 8 = 77ff47ff 97ffa7ff
ffff8802486c6f00 553709758 C Co:1:042:0 0 8 >
ffff8802486c6f00 553724564 S Co:1:042:0 s 21 09 0300 0000 0008 8 = 07ffe7ff e7ff37ff
ffff8802486c6f00 553724784 C Co:1:042:0 0 8 >
ffff8802486c6f00 553739639 S Co:1:042:0 s 21 09 0300 0000 0008 8 = 67ffd7ff 47ff57ff
ffff8802486c6f00 553739887 C Co:1:042:0 0 8 >
ffff8802486c6f00 553756654 S Co:1:042:0 s 21 09 0300 0000 0008 8 = a7ff47ff 37ffe7ff
ffff8802486c6f00 553756889 C Co:1:042:0 0 8 >
ffff880406987cc0 553771483 S Co:1:042:0 s 21 09 0300 0000 0008 8 = b7ffc7ff 27ff87ff
ffff880406987cc0 553771652 C Co:1:042:0 0 8 >
ffff8802486c6f00 553786573 S Co:1:042:0 s 21 09 0300 0000 0008 8 = e7ff67ff d7ff07ff
ffff8802486c6f00 553786784 C Co:1:042:0 0 8 >
ffff880406940000 553801571 S Co:1:042:0 s 21 09 0300 0000 0008 8 = 27ffb7ff 67ffa7ff
ffff880406940000 553801759 C Co:1:042:0 0 8 >
ffff8802486c6300 553818596 S Co:1:042:0 s 21 09 0300 0000 0008 8 = 67ffc7ff d7ffb7ff
ffff8802486c6300 553818788 C Co:1:042:0 0 8 >
ffff880406987cc0 553833506 S Co:1:042:0 s 21 09 0300 0000 0008 8 = 37ff77ff c7ff87ff
ffff880406987cc0 553833649 C Co:1:042:0 0 8 >
ffff880406940000 553848587 S Co:1:042:0 s 21 09 0300 0000 0008 8 = a7ff27ff 67ffe7ff
ffff880406940000 553848764 C Co:1:042:0 0 8 >
ffff880406940000 553865641 S Co:1:042:0 s 21 09 0300 0000 0008 8 = 27ff27ff c7fff7ff
ffff880406940000 553865898 C Co:1:042:0 0 8 >
ffff880406940000 553880558 S Co:1:042:0 s 21 09 0300 0000 0008 8 = 37ff17ff 37ff67ff
ffff880406940000 553880768 C Co:1:042:0 0 8 >
ffff880406940000 553895881 S Co:1:042:0 s 21 09 0300 0000 0008 8 = e7ff27ff 27fff7ff
ffff880406940000 553896024 C Co:1:042:0 0 8 >
ffff880406940000 553912639 S Co:1:042:0 s 21 09 0300 0000 0008 8 = 87ff77ff 17ff07ff
ffff880406940000 553912888 C Co:1:042:0 0 8 >
ffff8802486c6300 553927540 S Co:1:042:0 s 21 09 0300 0000 0008 8 = f7ff07ff a7ff97ff
ffff8802486c6300 553927656 C Co:1:042:0 0 8 >
ffff8802486c6300 553942566 S Co:1:042:0 s 21 09 0300 0000 0008 8 = 07ffd7ff 67ff57ff
ffff8802486c6300 553942764 C Co:1:042:0 0 8 >
ffff880406940000 553959611 S Co:1:042:0 s 21 09 0300 0000 0008 8 = d7ffd7ff 47ff47ff
ffff880406940000 553959762 C Co:1:042:0 0 8 >
ffff880406940000 553974645 S Co:1:042:0 s 21 09 0300 0000 0008 8 = 07ff07ff a7ff07ff
ffff880406940000 553974940 C Co:1:042:0 0 8 >
ffff880406987cc0 553989547 S Co:1:042:0 s 21 09 0300 0000 0008 8 = 67ffa7ff b7ff37ff
ffff880406987cc0 553989640 C Co:1:042:0 0 8 >
ffff880406987cc0 554004538 S Co:1:042:0 s 21 09 0300 0000 0008 8 = e7ffb7ff d7ff47ff
ffff880406987cc0 554004636 C Co:1:042:0 0 8 >
ffff880406987d80 554021651 S Co:1:042:0 s 21 09 0300 0000 0008 8 = 87fff7ff 37ff27ff
ffff880406987d80 554021899 C Co:1:042:0 0 8 >
ffff880406987d80 554036509 S Co:1:042:0 s 21 09 0300 0000 0008 8 = c7ffb7ff 17ffa7ff
ffff880406987d80 554036637 C Co:1:042:0 0 8 >
ffff880406987600 554051701 S Co:1:042:0 s 21 09 0300 0000 0008 8 = 77ff67ff b7ffa7ff
ffff880406987600 554051884 C Co:1:042:0 0 8 >
ffff880406940480 554067726 S Co:1:042:0 s 21 09 0300 0000 0008 8 = 27ffb7ff 17ff17ff
ffff880406940480 554067904 C Co:1:042:0 0 8 >
ffff880406940000 554085658 S Co:1:042:0 s 21 09 0300 0000 0008 8 = 97ff07ff 77ffa7ff
ffff880406940000 554085884 C Co:1:042:0 0 8 >
ffff880406940000 554098680 S Co:1:042:0 s 21 09 0300 0000 0008 8 = e7ffa7ff 97fff7ff
ffff880406940000 554098885 C Co:1:042:0 0 8 >
ffff880406987600 554115775 S Co:1:042:0 s 21 09 0300 0000 0008 8 = 77fff7ff a7035628
ffff880406987600 554115912 C Co:1:042:0 0 8 >
ffff880406987600 554130821 S Co:1:042:0 s 21 09 0300 0000 0008 8 = 02fbd9d1 baf67238
ffff880406987600 554131036 C Co:1:042:0 0 8 >
ffff880406987600 554145714 S Co:1:042:0 s 21 09 0300 0000 0008 8 = bb39d946 f0a35e88
ffff880406987600 554145910 C Co:1:042:0 0 8 >
ffff880406940000 554161770 S Co:1:042:0 s 21 09 0300 0000 0008 8 = c6508a7a e78ff814
ffff880406940000 554161887 C Co:1:042:0 0 8 >
ffff8804069873c0 554176918 S Co:1:042:0 s 21 09 0300 0000 0008 8 = 38067298 11244f9a
ffff8804069873c0 554177038 C Co:1:042:0 0 8 >
ffff880406940000 554193722 S Co:1:042:0 s 21 09 0300 0000 0008 8 = bcc80b50 302f291b
ffff880406940000 554193890 C Co:1:042:0 0 8 >
ffff880406940000 554208746 S Co:1:042:0 s 21 09 0300 0000 0008 8 = 0f234656 dd627e5f
ffff880406940000 554208898 C Co:1:042:0 0 8 >
ffff88020f0f1480 554223755 S Co:1:042:0 s 21 09 0300 0000 0008 8 = 824c04e4 03d2fc70
ffff88020f0f1480 554223890 C Co:1:042:0 0 8 >
ffff8802486c6300 554240647 S Co:1:042:0 s 21 09 0300 0000 0008 8 = 7d9b9c36 6377841d
ffff8802486c6300 554240887 C Co:1:042:0 0 8 >
ffff880406940000 554255680 S Co:1:042:0 s 21 09 0300 0000 0008 8 = f90a5a0b 10b1aa76
ffff880406940000 554255889 C Co:1:042:0 0 8 >
ffff880406940000 554270852 S Co:1:042:0 s 21 09 0300 0000 0008 8 = 03b8fd29 f2bf3754
ffff880406940000 554271012 C Co:1:042:0 0 8 >
ffff880406940000 554287655 S Co:1:042:0 s 21 09 0300 0000 0008 8 = 3e6a36d7 4548a9d0
ffff880406940000 554287887 C Co:1:042:0 0 8 >
ffff88020f0f1480 554302669 S Co:1:042:0 s 21 09 0300 0000 0008 8 = 5f062d63 19d5afc9
ffff88020f0f1480 554302886 C Co:1:042:0 0 8 >
ffff880406940000 554317722 S Co:1:042:0 s 21 09 0300 0000 0008 8 = b118fe9c d253af61
ffff880406940000 554317888 C Co:1:042:0 0 8 >
ffff88020f0f1480 554334626 S Co:1:042:0 s 21 09 0300 0000 0008 8 = 90503656 a793427e
ffff88020f0f1480 554334764 C Co:1:042:0 0 8 >
ffff88020f0f1480 554349669 S Co:1:042:0 s 21 09 0300 0000 0008 8 = f00059eb 25cbb44b
ffff88020f0f1480 554349889 C Co:1:042:0 0 8 >
ffff88020f0f1cc0 554364693 S Co:1:042:0 s 21 09 0300 0000 0008 8 = d6a15db6 ab1487b7
ffff88020f0f1cc0 554364891 C Co:1:042:0 0 8 >
ffff880406940000 554379731 S Co:1:042:0 s 21 09 0300 0000 0008 8 = db4c2d98 edeceff3
ffff880406940000 554379890 C Co:1:042:0 0 8 >
ffff8802486c6300 554396649 S Co:1:042:0 s 21 09 0300 0000 0008 8 = ae432976 73b555f6
ffff8802486c6300 554396889 C Co:1:042:0 0 8 >
ffff8802486c6300 554411681 S Co:1:042:0 s 21 09 0300 0000 0008 8 = 9168a3b7 1a32d7fa
ffff8802486c6300 554411889 C Co:1:042:0 0 8 >
ffff8802486c6300 554426717 S Co:1:042:0 s 21 09 0300 0000 0008 8 = d9c262c8 900ec4fe
ffff8802486c6300 554426888 C Co:1:042:0 0 8 >
ffff8802486c6300 554443640 S Co:1:042:0 s 21 09 0300 0000 0008 8 = 71fd219a da562345
ffff8802486c6300 554443764 C Co:1:042:0 0 8 >
ffff8803ebbedd80 554458669 S Co:1:042:0 s 21 09 0300 0000 0008 8 = 55e90f20 d0fc2ad3
ffff8803ebbedd80 554458889 C Co:1:042:0 0 8 >
ffff8803ebbedd80 554473714 S Co:1:042:0 s 21 09 0300 0000 0008 8 = 19f84fd4 9d55c9f5
ffff8803ebbedd80 554473891 C Co:1:042:0 0 8 >
ffff8803ebbedd80 554490749 S Co:1:042:0 s 21 09 0300 0000 0008 8 = 62c37631 429a1fb7
ffff8803ebbedd80 554490890 C Co:1:042:0 0 8 >
ffff8803ebbedd80 554505682 S Co:1:042:0 s 21 09 0300 0000 0008 8 = 69841238 1168016e
ffff8803ebbedd80 554505889 C Co:1:042:0 0 8 >
ffff8803ebbedd80 554520686 S Co:1:042:0 s 21 09 0300 0000 0008 8 = 7d9a1fed 3442792e
ffff8803ebbedd80 554520889 C Co:1:042:0 0 8 >
ffff8803ebbedd80 554535734 S Co:1:042:0 s 21 09 0300 0000 0008 8 = 800a92d9 260c4253
ffff8803ebbedd80 554535889 C Co:1:042:0 0 8 >
ffff8803ebbedd80 554552646 S Co:1:042:0 s 21 09 0300 0000 0008 8 = 67fad188 378f4ffa
ffff8803ebbedd80 554552889 C Co:1:042:0 0 8 >
ffff880402c82b40 554567685 S Co:1:042:0 s 21 09 0300 0000 0008 8 = bc37360a 0afa4387
ffff880402c82b40 554567892 C Co:1:042:0 0 8 >
ffff880402c82b40 554582882 S Co:1:042:0 s 21 09 0300 0000 0008 8 = 1eae9275 185ef81e
ffff880402c82b40 554583017 C Co:1:042:0 0 8 >
ffff8802486c6540 554599637 S Co:1:042:0 s 21 09 0300 0000 0008 8 = bdf5a65f 2d2ffb2c
ffff8802486c6540 554599766 C Co:1:042:0 0 8 >
ffff880406940300 554614669 S Co:1:042:0 s 21 09 0300 0000 0008 8 = e1c1a966 e8c70cde
ffff880406940300 554614890 C Co:1:042:0 0 8 >
ffff88020f0f1cc0 554629755 S Co:1:042:0 s 21 09 0300 0000 0008 8 = 626fc7a9 3de4a1a7
ffff88020f0f1cc0 554629893 C Co:1:042:0 0 8 >
ffff88020f0f1cc0 554646645 S Co:1:042:0 s 21 09 0300 0000 0008 8 = 2f7e9e4e f42761bc
ffff88020f0f1cc0 554646915 C Co:1:042:0 0 8 >
ffff8802486c6540 554661652 S Co:1:042:0 s 21 09 0300 0000 0008 8 = c910c2fd 2996ab99
ffff8802486c6540 554661889 C Co:1:042:0 0 8 >
ffff880406940300 554676751 S Co:1:042:0 s 21 09 0300 0000 0008 8 = c76f3862 cc190f7c
ffff880406940300 554676917 C Co:1:042:0 0 8 >
ffff88020f0f1cc0 554693807 S Co:1:042:0 s 21 09 0300 0000 0008 8 = 5384fdad 21fed1e7
ffff88020f0f1cc0 554693898 C Co:1:042:0 0 8 >
ffff88020f0f1cc0 554708735 S Co:1:042:0 s 21 09 0300 0000 0008 8 = a9607e13 40776c20
ffff88020f0f1cc0 554708897 C Co:1:042:0 0 8 >
ffff88020f0f1cc0 554723740 S Co:1:042:0 s 21 09 0300 0000 0008 8 = 9db51e4c 94190bb2
ffff88020f0f1cc0 554723893 C Co:1:042:0 0 8 >
ffff8802486c6540 554740796 S Co:1:042:0 s 21 09 0300 0000 0008 8 = 135cb515 5d5d0feb
ffff8802486c6540 554740894 C Co:1:042:0 0 8 >
ffff88020f0f1cc0 554755663 S Co:1:042:0 s 21 09 0300 0000 0008 8 = 86cf0ead 30218d5e
ffff88020f0f1cc0 554755913 C Co:1:042:0 0 8 >
ffff8804069873c0 554770666 S Co:1:042:0 s 21 09 0300 0000 0008 8 = 84ad675a 7325cf61
ffff8804069873c0 554770910 C Co:1:042:0 0 8 >
ffff88020f0f1cc0 554787773 S Co:1:042:0 s 21 09 0300 0000 0008 8 = 2e3bf3e4 e490d18e
ffff88020f0f1cc0 554787924 C Co:1:042:0 0 8 >
ffff88020f0f1cc0 554802676 S Co:1:042:0 s 21 09 0300 0000 0008 8 = bbe05916 116bc444
ffff88020f0f1cc0 554802800 C Co:1:042:0 0 8 >
ffff8804069873c0 554817718 S Co:1:042:0 s 21 09 0300 0000 0008 8 = f4a63442 e0238d25
ffff8804069873c0 554817931 C Co:1:042:0 0 8 >
ffff8804069873c0 554834781 S Co:1:042:0 s 21 09 0300 0000 0008 8 = b8be93bc 07094498
ffff8804069873c0 554834913 C Co:1:042:0 0 8 >
ffff880406940300 554849807 S Co:1:042:0 s 21 09 0300 0000 0008 8 = 77fa785c 92d3b746
ffff880406940300 554849917 C Co:1:042:0 0 8 >
ffff880406940300 554864644 S Co:1:042:0 s 21 09 0300 0000 0008 8 = b9535bfe 621be79f
ffff880406940300 554864908 C Co:1:042:0 0 8 >
ffff880406940300 554881776 S Co:1:042:0 s 21 09 0300 0000 0008 8 = 9662a603 aadd8754
ffff880406940300 554881894 C Co:1:042:0 0 8 >
ffff880406940300 554896798 S Co:1:042:0 s 21 09 0300 0000 0008 8 = 3ce939d0 72fb82dc
ffff880406940300 554896897 C Co:1:042:0 0 8 >
ffff8803ed17fd80 554911630 S Co:1:042:0 s 21 09 0300 0000 0008 8 = 6f4ae54c 16bb75f2
ffff8803ed17fd80 554911768 C Co:1:042:0 0 8 >
ffff8803ed17fd80 554928748 S Co:1:042:0 s 21 09 0300 0000 0008 8 = 030df365 c6452f13
ffff8803ed17fd80 554928925 C Co:1:042:0 0 8 >
ffff8803ed17fd80 554943775 S Co:1:042:0 s 21 09 0300 0000 0008 8 = 625c9d89 05273502
ffff8803ed17fd80 554943919 C Co:1:042:0 0 8 >
ffff8803ed17fd80 554958693 S Co:1:042:0 s 21 09 0300 0000 0008 8 = 0a88912f 2dd34246
ffff8803ed17fd80 554958902 C Co:1:042:0 0 8 >
ffff8803ed17fd80 554975677 S Co:1:042:0 s 21 09 0300 0000 0008 8 = 0d83734d e71ec1a8
ffff8803ed17fd80 554975893 C Co:1:042:0 0 8 >
ffff8802486c6540 554990812 S Co:1:042:0 s 21 09 0300 0000 0008 8 = 916659e2 b6c154b8
ffff8802486c6540 554990913 C Co:1:042:0 0 8 >
ffff880406940300 555005819 S Co:1:042:0 s 21 09 0300 0000 0008 8 = 50eb4f6c 6bda4f48
ffff880406940300 555006022 C Co:1:042:0 0 8 >
ffff880406940300 555022688 S Co:1:042:0 s 21 09 0300 0000 0008 8 = 18f1d470 af6a3bed
ffff880406940300 555022925 C Co:1:042:0 0 8 >
ffff880406987a80 555038916 S Co:1:042:0 s 21 09 0300 0000 0008 8 = 4afd59f7 7fd65583
ffff880406987a80 555039094 C Co:1:042:0 0 8 >
ffff880406987a80 555051973 S Co:1:042:0 s 21 09 0300 0000 0008 8 = 5db6c60d a9670ea7
ffff880406987a80 555052146 C Co:1:042:0 0 8 >
ffff8804069406c0 555068870 S Co:1:042:0 s 21 09 0300 0000 0008 8 = 5a66f643 52cc8b3d
ffff8804069406c0 555069022 C Co:1:042:0 0 8 >
ffff88020f0f1300 555083879 S Co:1:042:0 s 21 09 0300 0000 0008 8 = 5f7e382c 729625ea
ffff88020f0f1300 555084023 C Co:1:042:0 0 8 >
ffff88020f0f1300 555098922 S Co:1:042:0 s 21 09 0300 0000 0008 8 = 1e10cfe2 54b9e899
ffff88020f0f1300 555099044 C Co:1:042:0 0 8 >
ffff88020f0f1300 555114819 S Co:1:042:0 s 21 09 0300 0000 0008 8 = 5d55717f 191016f8
ffff88020f0f1300 555115023 C Co:1:042:0 0 8 >
ffff880406987a80 555129865 S Co:1:042:0 s 21 09 0300 0000 0008 8 = 7627caa6 33d7a3fa
ffff880406987a80 555130023 C Co:1:042:0 0 8 >
ffff880406987a80 555145871 S Co:1:042:0 s 21 09 0300 0000 0008 8 = d786f8fb ec30b855
ffff880406987a80 555146019 C Co:1:042:0 0 8 >
ffff880406940cc0 555160953 S Co:1:042:0 s 21 09 0300 0000 0008 8 = 81150ea4 dfa13303
ffff880406940cc0 555161149 C Co:1:042:0 0 8 >
ffff880406940cc0 555177866 S Co:1:042:0 s 21 09 0300 0000 0008 8 = 8b9b93d0 7c9223c2
ffff880406940cc0 555178023 C Co:1:042:0 0 8 >
ffff8802486c6900 555192911 S Co:1:042:0 s 21 09 0300 0000 0008 8 = 9e85022f 86d14e96
ffff8802486c6900 555193022 C Co:1:042:0 0 8 >
ffff8803ebbedd80 555207976 S Co:1:042:0 s 21 09 0300 0000 0008 8 = 78614974 9710ad45
ffff8803ebbedd80 555208199 C Co:1:042:0 0 8 >
ffff8803ebbedd80 555224858 S Co:1:042:0 s 21 09 0300 0000 0008 8 = 6b624dd8 9864edd8
ffff8803ebbedd80 555225025 C Co:1:042:0 0 8 >
ffff8803ebbedd80 555239896 S Co:1:042:0 s 21 09 0300 0000 0008 8 = dde16298 4bc6ee1e
ffff8803ebbedd80 555240097 C Co:1:042:0 0 8 >
ffff8803ebbedd80 555254946 S Co:1:042:0 s 21 09 0300 0000 0008 8 = c8d8d673 c394452a
ffff8803ebbedd80 555255192 C Co:1:042:0 0 8 >
ffff8803ebbedd80 555271850 S Co:1:042:0 s 21 09 0300 0000 0008 8 = 3966652f e90fbbd2
ffff8803ebbedd80 555272025 C Co:1:042:0 0 8 >
ffff8803ebbedd80 555287426 S Co:1:042:0 s 21 09 0300 0000 0008 8 = d350c414 f7dcce31
ffff8803ebbedd80 555287551 C Co:1:042:0 0 8 >
ffff8803ebbedd80 555301926 S Co:1:042:0 s 21 09 0300 0000 0008 8 = 4c7d186d fe852d24
ffff8803ebbedd80 555302020 C Co:1:042:0 0 8 >
ffff88020f0f1300 555318975 S Co:1:042:0 s 21 09 0300 0000 0008 8 = ec777e0c 62f73fce
ffff88020f0f1300 555319170 C Co:1:042:0 0 8 >
ffff880406987a80 555333813 S Co:1:042:0 s 21 09 0300 0000 0008 8 = 13ef83c5 5a039b15
ffff880406987a80 555333895 C Co:1:042:0 0 8 >
ffff880406987a80 555348868 S Co:1:042:0 s 21 09 0300 0000 0008 8 = b238abf0 73e08e25
ffff880406987a80 555349032 C Co:1:042:0 0 8 >
ffff880406987a80 555363949 S Co:1:042:0 s 21 09 0300 0000 0008 8 = cfc8edea 0da59aeb
ffff880406987a80 555364160 C Co:1:042:0 0 8 >
ffff880406987a80 555380859 S Co:1:042:0 s 21 09 0300 0000 0008 8 = 04bc3392 dad2f499
ffff880406987a80 555381026 C Co:1:042:0 0 8 >
ffff880406987a80 555395901 S Co:1:042:0 s 21 09 0300 0000 0008 8 = fe53dcce 64c60426
ffff880406987a80 555396036 C Co:1:042:0 0 8 >
ffff88020f0f1300 555410965 S Co:1:042:0 s 21 09 0300 0000 0008 8 = 00703b05 8648e6cd
ffff88020f0f1300 555411152 C Co:1:042:0 0 8 >
ffff88020f0f1300 555427787 S Co:1:042:0 s 21 09 0300 0000 0008 8 = 601b17a5 ef00ed8b
ffff88020f0f1300 555427920 C Co:1:042:0 0 8 >
ffff880406987a80 555442897 S Co:1:042:0 s 21 09 0300 0000 0008 8 = 06fe2c9d a5fc1ca4
ffff880406987a80 555443054 C Co:1:042:0 0 8 >
ffff8802486c6900 555459940 S Co:1:042:0 s 21 09 0300 0000 0008 8 = f2eaa7e1 7d2fae1c
ffff8802486c6900 555460029 C Co:1:042:0 0 8 >
ffff8802486c6900 555474774 S Co:1:042:0 s 21 09 0300 0000 0008 8 = b552abeb a6eb8d40
ffff8802486c6900 555474944 C Co:1:042:0 0 8 >
ffff8802486c6900 555489867 S Co:1:042:0 s 21 09 0300 0000 0008 8 = f5cdd036 1e6ddd1d
ffff8802486c6900 555490022 C Co:1:042:0 0 8 >
ffff8802486c6900 555504983 S Co:1:042:0 s 21 09 0300 0000 0008 8 = ec96a1c4 394f7006
ffff8802486c6900 555505167 C Co:1:042:0 0 8 >
ffff8802486c6900 555522011 S Co:1:042:0 s 21 09 0300 0000 0008 8 = e70c1c97 1f155110
ffff8802486c6900 555522179 C Co:1:042:0 0 8 >
ffff880406940cc0 555536843 S Co:1:042:0 s 21 09 0300 0000 0008 8 = c9353439 4ca33c97
ffff880406940cc0 555537053 C Co:1:042:0 0 8 >
ffff8802486c6900 555551895 S Co:1:042:0 s 21 09 0300 0000 0008 8 = 87355037 10c322b9
ffff8802486c6900 555552025 C Co:1:042:0 0 8 >
ffff8802486c6900 555568953 S Co:1:042:0 s 21 09 0300 0000 0008 8 = acdacb9f 0ea2a7d8
ffff8802486c6900 555569177 C Co:1:042:0 0 8 >
ffff880406940cc0 555583840 S Co:1:042:0 s 21 09 0300 0000 0008 8 = d5127388 c052a61a
ffff880406940cc0 555584027 C Co:1:042:0 0 8 >
ffff880406940cc0 555598893 S Co:1:042:0 s 21 09 0300 0000 0008 8 = 33700d88 f047aaea
ffff880406940cc0 555599046 C Co:1:042:0 0 8 >
ffff880406940cc0 555615918 S Co:1:042:0 s 21 09 0300 0000 0008 8 = 0eadcd3d 3edc7476
ffff880406940cc0 555616025 C Co:1:042:0 0 8 >
ffff88020f0f1300 555630837 S Co:1:042:0 s 21 09 0300 0000 0008 8 = 3f23e1c7 9ecd7a31
ffff88020f0f1300 555631051 C Co:1:042:0 0 8 >
ffff880406940cc0 555645881 S Co:1:042:0 s 21 09 0300 0000 0008 8 = b352e54b d9bd6451
ffff880406940cc0 555646056 C Co:1:042:0 0 8 >
ffff880406940cc0 555662930 S Co:1:042:0 s 21 09 0300 0000 0008 8 = ed5d6e70 09af8f50
ffff880406940cc0 555663102 C Co:1:042:0 0 8 >
ffff880406940cc0 555678014 S Co:1:042:0 s 21 09 0300 0000 0008 8 = 828c81e3 208f8c6d
ffff880406940cc0 555678178 C Co:1:042:0 0 8 >
ffff880406940cc0 555692872 S Co:1:042:0 s 21 09 0300 0000 0008 8 = 9cc91bd4 60a99f2a
ffff880406940cc0 555693030 C Co:1:042:0 0 8 >
ffff88020f0f1300 555709912 S Co:1:042:0 s 21 09 0300 0000 0008 8 = 7a25a978 e12e43cd
ffff88020f0f1300 555710028 C Co:1:042:0 0 8 >
ffff880406987a80 555724947 S Co:1:042:0 s 21 09 0300 0000 0008 8 = ed538f87 11b4a3e2
ffff880406987a80 555725051 C Co:1:042:0 0 8 >
ffff880406940cc0 555739843 S Co:1:042:0 s 21 09 0300 0000 0008 8 = da29a3be 2db420b5
ffff880406940cc0 555740057 C Co:1:042:0 0 8 >
ffff8802486c6900 555754824 S Co:1:042:0 s 21 09 0300 0000 0008 8 = bd25b15d cb0cd0da
ffff8802486c6900 555755024 C Co:1:042:0 0 8 >
ffff88020f0f1300 555771935 S Co:1:042:0 s 21 09 0300 0000 0008 8 = 22e4f7a8 527dfba7
ffff88020f0f1300 555772028 C Co:1:042:0 0 8 >
ffff880406987a80 555786838 S Co:1:042:0 s 21 09 0300 0000 0008 8 = 2caaa968 7e2c9fb7
ffff880406987a80 555787060 C Co:1:042:0 0 8 >
ffff880406940cc0 555801867 S Co:1:042:0 s 21 09 0300 0000 0008 8 = 10de6c69 df23eb67
ffff880406940cc0 555802031 C Co:1:042:0 0 8 >
ffff880406940cc0 555817008 S Co:1:042:0 s 21 09 0300 0000 0008 8 = 988ddcfb 58cfc55a
ffff880406940cc0 555817154 C Co:1:042:0 0 8 >
ffff880406940cc0 555833903 S Co:1:042:0 s 21 09 0300 0000 0008 8 = a3e50873 a28245f7
ffff880406940cc0 555834032 C Co:1:042:0 0 8 >
ffff880406940cc0 555848799 S Co:1:042:0 s 21 09 0300 0000 0008 8 = a1baf3a9 c9f03ae8
ffff880406940cc0 555848900 C Co:1:042:0 0 8 >
ffff880406940cc0 555863896 S Co:1:042:0 s 21 09 0300 0000 0008 8 = 1a02137a acb4a29a
ffff880406940cc0 555864027 C Co:1:042:0 0 8 >
ffff880406987a80 555880951 S Co:1:042:0 s 21 09 0300 0000 0008 8 = 265ad345 7fca34c2
ffff880406987a80 555881050 C Co:1:042:0 0 8 >
ffff880406987a80 555895787 S Co:1:042:0 s 21 09 0300 0000 0008 8 = f4811370 4a15d9d4
ffff880406987a80 555895908 C Co:1:042:0 0 8 >
ffff880406987a80 555911137 S Co:1:042:0 s 21 09 0300 0000 0008 8 = 46dba5e3 6ad82c8c
ffff880406987a80 555911301 C Co:1:042:0 0 8 >
ffff880406987a80 555927879 S Co:1:042:0 s 21 09 0300 0000 0008 8 = f1edd089 0d3fff67
ffff880406987a80 555928044 C Co:1:042:0 0 8 >
ffff880406987a80 555942878 S Co:1:042:0 s 21 09 0300 0000 0008 8 = 5fe5cfd4 b8d6d729
ffff880406987a80 555943029 C Co:1:042:0 0 8 >
ffff880406987a80 555959887 S Co:1:042:0 s 21 09 0300 0000 0008 8 = 0f115038 c20e6d57
ffff880406987a80 555960029 C Co:1:042:0 0 8 >
ffff880406940cc0 555973952 S Co:1:042:0 s 21 09 0300 0000 0008 8 = 1165f8ad d8bd2ebc
ffff880406940cc0 555974166 C Co:1:042:0 0 8 >
ffff88020f0f1300 555990013 S Co:1:042:0 s 21 09 0300 0000 0008 8 = 8df7db2f 7a9cb9e6
ffff88020f0f1300 555990151 C Co:1:042:0 0 8 >
ffff88020f0f1300 556005236 S Co:1:042:0 s 21 09 0300 0000 0008 8 = 3b850740 7ac966a8
ffff88020f0f1300 556005409 C Co:1:042:0 0 8 >
ffff88020f0f1e40 556020681 S Co:1:042:0 s 21 09 0300 0000 0008 8 = eaecf862 8245bb97
ffff88020f0f1e40 556020935 C Co:1:042:0 0 8 >
ffff880406940cc0 556038445 S Co:1:042:0 s 21 09 0300 0000 0008 8 = fbb023a0 8d75f68f
ffff880406940cc0 556038651 C Co:1:042:0 0 8 >
ffff88020f0f1e40 556053476 S Co:1:042:0 s 21 09 0300 0000 0008 8 = e5796d04 6aa3892e
ffff88020f0f1e40 556053670 C Co:1:042:0 0 8 >
ffff880406987180 556068542 S Co:1:042:0 s 21 09 0300 0000 0008 8 = b291b320 3f7c9756
ffff880406987180 556068676 C Co:1:042:0 0 8 >
ffff8802486c6900 556083608 S Co:1:042:0 s 21 09 0300 0000 0008 8 = 7e694287 02927aad
ffff8802486c6900 556083803 C Co:1:042:0 0 8 >
ffff8802486c6900 556099521 S Co:1:042:0 s 21 09 0300 0000 0008 8 = fc145e53 ffda3f1e
ffff8802486c6900 556099677 C Co:1:042:0 0 8 >
ffff8802486c6900 556114547 S Co:1:042:0 s 21 09 0300 0000 0008 8 = f3c9bd9f 572d2658
ffff8802486c6900 556114676 C Co:1:042:0 0 8 >
ffff8802486c6e40 556130600 S Co:1:042:0 s 21 09 0300 0000 0008 8 = bb630b0c 7dc8244c
ffff8802486c6e40 556130803 C Co:1:042:0 0 8 >
ffff880406940b40 556145674 S Co:1:042:0 s 21 09 0300 0000 0008 8 = c3e2663f b9cd63b1
ffff880406940b40 556145902 C Co:1:042:0 0 8 >
ffff880406940b40 556162544 S Co:1:042:0 s 21 09 0300 0000 0008 8 = 0ce9e15f a7c2be81
ffff880406940b40 556162677 C Co:1:042:0 0 8 >
ffff88020f0f1240 556177575 S Co:1:042:0 s 21 09 0300 0000 0008 8 = ad400499 b710487b
ffff88020f0f1240 556177803 C Co:1:042:0 0 8 >
ffff88020f0f1240 556192553 S Co:1:042:0 s 21 09 0300 0000 0008 8 = 4f52489d ad84c4a1
ffff88020f0f1240 556192673 C Co:1:042:0 0 8 >
ffff88020f0f1240 556209533 S Co:1:042:0 s 21 09 0300 0000 0008 8 = b0ae9d21 20cf2cba
ffff88020f0f1240 556209657 C Co:1:042:0 0 8 >
ffff88020f0f1240 556224562 S Co:1:042:0 s 21 09 0300 0000 0008 8 = 2388e55b fd072dcf
ffff88020f0f1240 556224687 C Co:1:042:0 0 8 >
ffff88020f0f1240 556239596 S Co:1:042:0 s 21 09 0300 0000 0008 8 = 0c367889 0325a7b0
ffff88020f0f1240 556239805 C Co:1:042:0 0 8 >
ffff880406987240 556256461 S Co:1:042:0 s 21 09 0300 0000 0008 8 = 66b6a16b 4787306e
ffff880406987240 556256672 C Co:1:042:0 0 8 >
ffff880406987240 556271562 S Co:1:042:0 s 21 09 0300 0000 0008 8 = 3f251ec5 af6e90e0
ffff880406987240 556271677 C Co:1:042:0 0 8 >
ffff88020f0f1240 556286592 S Co:1:042:0 s 21 09 0300 0000 0008 8 = 3847a2e0 79804321
ffff88020f0f1240 556286783 C Co:1:042:0 0 8 >
ffff88020f0f1240 556301752 S Co:1:042:0 s 21 09 0300 0000 0008 8 = 08045308 b345fc0e
ffff88020f0f1240 556301907 C Co:1:042:0 0 8 >
ffff880406940b40 556318496 S Co:1:042:0 s 21 09 0300 0000 0008 8 = f8e64e0d c2ab1fcb
ffff880406940b40 556318654 C Co:1:042:0 0 8 >
ffff880406940b40 556333589 S Co:1:042:0 s 21 09 0300 0000 0008 8 = 669f21c4 de84443d
ffff880406940b40 556333797 C Co:1:042:0 0 8 >
ffff8803e6ff2e40 556348636 S Co:1:042:0 s 21 09 0300 0000 0008 8 = 447f4e86 9204b98e
ffff8803e6ff2e40 556348805 C Co:1:042:0 0 8 >
ffff8803e6ff2780 556365531 S Co:1:042:0 s 21 09 0300 0000 0008 8 = 9900cdad 3f46feae
ffff8803e6ff2780 556365681 C Co:1:042:0 0 8 >
ffff8803e6ff2780 556380575 S Co:1:042:0 s 21 09 0300 0000 0008 8 = fd3c881c 98c749cf
ffff8803e6ff2780 556380680 C Co:1:042:0 0 8 >
ffff8803e6ff2780 556395731 S Co:1:042:0 s 21 09 0300 0000 0008 8 = 1e74deb6 25e702e6
ffff8803e6ff2780 556395928 C Co:1:042:0 0 8 >
ffff8803e6ff2780 556412520 S Co:1:042:0 s 21 09 0300 0000 0008 8 = 408923e4 c26d462f
ffff8803e6ff2780 556412675 C Co:1:042:0 0 8 >
ffff8803e6ff2780 556427496 S Co:1:042:0 s 21 09 0300 0000 0008 8 = b6841c11 1e0265a8
ffff8803e6ff2780 556427676 C Co:1:042:0 0 8 >
ffff8803e6ff2780 556442770 S Co:1:042:0 s 21 09 0300 0000 0008 8 = 6c0f8630 3fb36692
ffff8803e6ff2780 556442922 C Co:1:042:0 0 8 >
ffff8803e6ff2780 556459585 S Co:1:042:0 s 21 09 0300 0000 0008 8 = 5ffc8e32 fb7181f6
ffff8803e6ff2780 556459702 C Co:1:042:0 0 8 >
ffff8803e6ff2780 556474506 S Co:1:042:0 s 21 09 0300 0000 0008 8 = 21bb5892 7f92a21c
ffff8803e6ff2780 556474664 C Co:1:042:0 0 8 >
ffff8803e6ff2780 556489580 S Co:1:042:0 s 21 09 0300 0000 0008 8 = 58e67acc ca50ea13
ffff8803e6ff2780 556489796 C Co:1:042:0 0 8 >
ffff8803e6ff2780 556506497 S Co:1:042:0 s 21 09 0300 0000 0008 8 = 3eb880e0 30472f2e
ffff8803e6ff2780 556506677 C Co:1:042:0 0 8 >
ffff8803e6ff2780 556521531 S Co:1:042:0 s 21 09 0300 0000 0008 8 = 218f68d1 d9f97982
ffff8803e6ff2780 556521672 C Co:1:042:0 0 8 >
ffff8803e6ff2780 556536565 S Co:1:042:0 s 21 09 0300 0000 0008 8 = e26f252a 424b856c
ffff8803e6ff2780 556536682 C Co:1:042:0 0 8 >
ffff8803e6ff2780 556553584 S Co:1:042:0 s 21 09 0300 0000 0008 8 = 78801f75 b9074407
ffff8803e6ff2780 556553803 C Co:1:042:0 0 8 >
ffff8803e6ff2780 556568554 S Co:1:042:0 s 21 09 0300 0000 0008 8 = 6b8dafc4 e35b5bb8
ffff8803e6ff2780 556568667 C Co:1:042:0 0 8 >
ffff8803e6ff2780 556583554 S Co:1:042:0 s 21 09 0300 0000 0008 8 = 5b85a52b 3756a3a5
ffff8803e6ff2780 556583660 C Co:1:042:0 0 8 >
ffff8803e6ff2780 556598604 S Co:1:042:0 s 21 09 0300 0000 0008 8 = 7afcc342 8270a837
ffff8803e6ff2780 556598786 C Co:1:042:0 0 8 >
ffff8803e6ff2780 556615453 S Co:1:042:0 s 21 09 0300 0000 0008 8 = 0ca941a5 64012c9e
ffff8803e6ff2780 556615676 C Co:1:042:0 0 8 >
ffff8803e6ff2780 556630503 S Co:1:042:0 s 21 09 0300 0000 0008 8 = ebe74a75 cfc7a24b
ffff8803e6ff2780 556630670 C Co:1:042:0 0 8 >
ffff8803e6ff2780 556645572 S Co:1:042:0 s 21 09 0300 0000 0008 8 = 07367bd7 8d62b675
ffff8803e6ff2780 556645657 C Co:1:042:0 0 8 >
ffff8803e6ff2780 556662494 S Co:1:042:0 s 21 09 0300 0000 0008 8 = e0b96972 b9d9c296
ffff8803e6ff2780 556662665 C Co:1:042:0 0 8 >
ffff8803e6ff2780 556677505 S Co:1:042:0 s 21 09 0300 0000 0008 8 = 0cb81af3 431558ed
ffff8803e6ff2780 556677672 C Co:1:042:0 0 8 >
ffff8803e6ff2780 556692567 S Co:1:042:0 s 21 09 0300 0000 0008 8 = b61e898b 6e63bdfd
ffff8803e6ff2780 556692753 C Co:1:042:0 0 8 >
ffff8803e6ff2780 556709657 S Co:1:042:0 s 21 09 0300 0000 0008 8 = 1bfa256d 53f46a0a
ffff8803e6ff2780 556709786 C Co:1:042:0 0 8 >
ffff8803e6ff2780 556724560 S Co:1:042:0 s 21 09 0300 0000 0008 8 = 0d005053 5d5e8ba1
ffff8803e6ff2780 556724661 C Co:1:042:0 0 8 >
ffff8803e6ff2780 556739508 S Co:1:042:0 s 21 09 0300 0000 0008 8 = 7207e1f8 cd1b820f
ffff8803e6ff2780 556739669 C Co:1:042:0 0 8 >
ffff8803e6ff2780 556756616 S Co:1:042:0 s 21 09 0300 0000 0008 8 = c48ba59d 360763e6
ffff8803e6ff2780 556756794 C Co:1:042:0 0 8 >
ffff8803e6ff2780 556771553 S Co:1:042:0 s 21 09 0300 0000 0008 8 = 902ad886 00e4787e
ffff8803e6ff2780 556771670 C Co:1:042:0 0 8 >
ffff8802486c6180 556786546 S Co:1:042:0 s 21 09 0300 0000 0008 8 = f928ae7c e8d7bc6f
ffff8802486c6180 556786691 C Co:1:042:0 0 8 >
ffff8802486c6180 556803606 S Co:1:042:0 s 21 09 0300 0000 0008 8 = 34edcf4b 7ceb611a
ffff8802486c6180 556803838 C Co:1:042:0 0 8 >
ffff8802486c6180 556818634 S Co:1:042:0 s 21 09 0300 0000 0008 8 = 0c84d444 a08b4d1f
ffff8802486c6180 556818874 C Co:1:042:0 0 8 >
ffff8802486c6180 556833487 S Co:1:042:0 s 21 09 0300 0000 0008 8 = 5e1cceba 0e0a96e6
ffff8802486c6180 556833677 C Co:1:042:0 0 8 >
ffff8804039dee40 556848560 S Co:1:042:0 s 21 09 0300 0000 0008 8 = 9c89bd86 d01d0c19
ffff8804039dee40 556848684 C Co:1:042:0 0 8 >
ffff8804039dee40 556865605 S Co:1:042:0 s 21 09 0300 0000 0008 8 = 4bc21b85 c65dae26
ffff8804039dee40 556865788 C Co:1:042:0 0 8 >
ffff88020f0f13c0 556880522 S Co:1:042:0 s 21 09 0300 0000 0008 8 = 87625117 24c731c0
ffff88020f0f13c0 556880688 C Co:1:042:0 0 8 >
ffff88020f0f13c0 556895497 S Co:1:042:0 s 21 09 0300 0000 0008 8 = 7c2a3ea0 f33e7f5c
ffff88020f0f13c0 556895660 C Co:1:042:0 0 8 >
ffff88020f0f13c0 556912609 S Co:1:042:0 s 21 09 0300 0000 0008 8 = ed7bb509 8d0633b6
ffff88020f0f13c0 556912808 C Co:1:042:0 0 8 >
ffff8804039de600 556927502 S Co:1:042:0 s 21 09 0300 0000 0008 8 = afdefd3e 2449204c
ffff8804039de600 556927665 C Co:1:042:0 0 8 >
ffff8804039de600 556942544 S Co:1:042:0 s 21 09 0300 0000 0008 8 = 2d7e51af 3a94c9e0
ffff8804039de600 556942685 C Co:1:042:0 0 8 >
ffff8804039de600 556959604 S Co:1:042:0 s 21 09 0300 0000 0008 8 = e4aa60d1 2858e8f8
ffff8804039de600 556959810 C Co:1:042:0 0 8 >
ffff8804039de600 556974439 S Co:1:042:0 s 21 09 0300 0000 0008 8 = e556cc9c 996bea5f
ffff8804039de600 556974660 C Co:1:042:0 0 8 >
ffff8804039de600 556989535 S Co:1:042:0 s 21 09 0300 0000 0008 8 = 5899ad0d 0e876fa4
ffff8804039de600 556989662 C Co:1:042:0 0 8 >
ffff8804039de6c0 557004539 S Co:1:042:0 s 21 09 0300 0000 0008 8 = f62f0ea3 5ac8cc98
ffff8804039de6c0 557004680 C Co:1:042:0 0 8 >
ffff880406987a80 557021638 S Co:1:042:0 s 21 09 0300 0000 0008 8 = 8cf66de4 25308bd2
ffff880406987a80 557021788 C Co:1:042:0 0 8 >
ffff8803ed17fd80 557036490 S Co:1:042:0 s 21 09 0300 0000 0008 8 = 7d723cd8 6b25e82c
ffff8803ed17fd80 557036679 C Co:1:042:0 0 8 >
ffff8803ed17f0c0 557051562 S Co:1:042:0 s 21 09 0300 0000 0008 8 = 3e4b648a fbef5445
ffff8803ed17f0c0 557051691 C Co:1:042:0 0 8 >
ffff8803ed17f0c0 557067603 S Co:1:042:0 s 21 09 0300 0000 0008 8 = d9ccbf8c fb3df3ff
ffff8803ed17f0c0 557067790 C Co:1:042:0 0 8 >
ffff8803ed17f0c0 557083514 S Co:1:042:0 s 21 09 0300 0000 0008 8 = 6d659b72 619f1f01
ffff8803ed17f0c0 557083665 C Co:1:042:0 0 8 >
ffff8803ed17f0c0 557098549 S Co:1:042:0 s 21 09 0300 0000 0008 8 = ab273d54 7a0ae534
ffff8803ed17f0c0 557098686 C Co:1:042:0 0 8 >
ffff8803ed17fd80 557117706 S Co:1:042:0 s 21 09 0300 0000 0008 8 = 584d594f 65598548
ffff8803ed17fd80 557117915 C Co:1:042:0 0 8 >
ffff8803ed17f0c0 557131241 S Co:1:042:0 s 21 09 0300 0000 0008 8 = d0af9c02 96c9f52e
ffff8803ed17f0c0 557131411 C Co:1:042:0 0 8 >
ffff8803ed17fd80 557146218 S Co:1:042:0 s 21 09 0300 0000 0008 8 = 7f4e2513 557b5d9d
ffff8803ed17fd80 557146433 C Co:1:042:0 0 8 >
ffff8803ed17fd80 557161183 S Co:1:042:0 s 21 09 0300 0000 0008 8 = 67ce05a9 3ff49a90
ffff8803ed17fd80 557161286 C Co:1:042:0 0 8 >
ffff8803ed17fd80 557177292 S Co:1:042:0 s 21 09 0300 0000 0008 8 = 9ff5c5f1 c29ebcc4
ffff8803ed17fd80 557177443 C Co:1:042:0 0 8 >
ffff8803ed17fd80 557195216 S Co:1:042:0 s 21 09 0300 0000 0008 8 = d12fde9c a3468a3c
ffff8803ed17fd80 557195436 C Co:1:042:0 0 8 >
ffff8803ed17fd80 557208223 S Co:1:042:0 s 21 09 0300 0000 0008 8 = b90b405e 7a9dfcbf
ffff8803ed17fd80 557208432 C Co:1:042:0 0 8 >
ffff8803ed17fd80 557225300 S Co:1:042:0 s 21 09 0300 0000 0008 8 = abbdce6e 32babd57
ffff8803ed17fd80 557225442 C Co:1:042:0 0 8 >
ffff8803ed17f0c0 557240217 S Co:1:042:0 s 21 09 0300 0000 0008 8 = 0c9cde0b 8b94b1d2
ffff8803ed17f0c0 557240438 C Co:1:042:0 0 8 >
ffff8803ed17fc00 557255160 S Co:1:042:0 s 21 09 0300 0000 0008 8 = d5a4bcf3 9a8a6b42
ffff8803ed17fc00 557255286 C Co:1:042:0 0 8 >
ffff8803ed17fb40 557272268 S Co:1:042:0 s 21 09 0300 0000 0008 8 = 15f326eb 46deb47f
ffff8803ed17fb40 557272442 C Co:1:042:0 0 8 >
ffff8803ed17fb40 557287170 S Co:1:042:0 s 21 09 0300 0000 0008 8 = 6d4dcf3c ca3309a1
ffff8803ed17fb40 557287314 C Co:1:042:0 0 8 >
ffff8803ed17fb40 557302236 S Co:1:042:0 s 21 09 0300 0000 0008 8 = 949bde33 38151b89
ffff8803ed17fb40 557302437 C Co:1:042:0 0 8 >
ffff8803ed17fb40 557317497 S Co:1:042:0 s 21 09 0300 0000 0008 8 = d4666f9e f36f4e58
ffff8803ed17fb40 557317698 C Co:1:042:0 0 8 >
ffff8803ed17fb40 557334241 S Co:1:042:0 s 21 09 0300 0000 0008 8 = 895e0e54 32143df4
ffff8803ed17fb40 557334434 C Co:1:042:0 0 8 >
ffff8803ed17fb40 557349195 S Co:1:042:0 s 21 09 0300 0000 0008 8 = a7d741ab 81393388
ffff8803ed17fb40 557349313 C Co:1:042:0 0 8 >
ffff8803ed17fb40 557364226 S Co:1:042:0 s 21 09 0300 0000 0008 8 = 3248fd01 41f7b202
ffff8803ed17fb40 557364437 C Co:1:042:0 0 8 >
ffff8803ed17fb40 557381278 S Co:1:042:0 s 21 09 0300 0000 0008 8 = c5cc2d36 25ccee95
ffff8803ed17fb40 557381425 C Co:1:042:0 0 8 >
ffff8803ed17fb40 557396118 S Co:1:042:0 s 21 09 0300 0000 0008 8 = 0ea4312e b5195037
ffff8803ed17fb40 557396307 C Co:1:042:0 0 8 >
ffff8803ed17fb40 557411213 S Co:1:042:0 s 21 09 0300 0000 0008 8 = 4fb15b52 cda3f522
ffff8803ed17fb40 557411291 C Co:1:042:0 0 8 >
ffff8803ed17fb40 557428213 S Co:1:042:0 s 21 09 0300 0000 0008 8 = ddfc710e 1d142e54
ffff8803ed17fb40 557428301 C Co:1:042:0 0 8 >
ffff8803ed17fb40 557443111 S Co:1:042:0 s 21 09 0300 0000 0008 8 = a2313052 a9790011
ffff8803ed17fb40 557443290 C Co:1:042:0 0 8 >
ffff8803ed17fb40 557458203 S Co:1:042:0 s 21 09 0300 0000 0008 8 = 9c1dc614 49c3a45f
ffff8803ed17fb40 557458294 C Co:1:042:0 0 8 >
ffff8803ed17fb40 557475279 S Co:1:042:0 s 21 09 0300 0000 0008 8 = 5e3555ca 27490687
ffff8803ed17fb40 557475419 C Co:1:042:0 0 8 >
ffff8803ed17fb40 557490296 S Co:1:042:0 s 21 09 0300 0000 0008 8 = 8c1074f2 46424899
ffff8803ed17fb40 557490438 C Co:1:042:0 0 8 >
ffff8803ed17fb40 557505193 S Co:1:042:0 s 21 09 0300 0000 0008 8 = 61eaaf8b f74e3ee6
ffff8803ed17fb40 557505367 C Co:1:042:0 0 8 >
ffff8803ed17fb40 557521264 S Co:1:042:0 s 21 09 0300 0000 0008 8 = 2b21059b 64ecf185
ffff8803ed17fb40 557521420 C Co:1:042:0 0 8 >
ffff8803ed17fb40 557536282 S Co:1:042:0 s 21 09 0300 0000 0008 8 = cbba67aa 07031fd0
ffff8803ed17fb40 557536421 C Co:1:042:0 0 8 >
ffff8803ed17fe40 557553177 S Co:1:042:0 s 21 09 0300 0000 0008 8 = 38db3e44 325bb7e6
ffff8803ed17fe40 557553299 C Co:1:042:0 0 8 >
ffff8803ed17fb40 557570258 S Co:1:042:0 s 21 09 0300 0000 0008 8 = fb50e379 87235f29
ffff8803ed17fb40 557570419 C Co:1:042:0 0 8 >
ffff8803ed17fb40 557599207 S Co:1:042:0 s 21 09 0300 0000 0008 8 = 55038142 872ed001
ffff8803ed17fb40 557599312 C Co:1:042:0 0 8 >
ffff8803ed17fb40 557631263 S Ci:1:042:0 s a1 01 0300 0000 0008 8 <
ffff8803ed17fb40 557631419 C Ci:1:042:0 0 8 = aa040000 00000000
ffff88020f0f1000 574239776 S Co:1:042:0 s 21 09 0300 0000 0008 8 = 55010100 00ff075d
ffff88020f0f1000 574239956 C Co:1:042:0 0 8 >
ffff88025ad1fd80 574270714 S Ci:1:042:0 s a1 01 0300 0000 0008 8 <
ffff88025ad1fd80 574270842 C Ci:1:042:0 0 8 = aa020000 00000000
ffff880406987c00 574301840 S Co:1:042:0 s 21 09 0300 0000 0008 8 = 0b010101 00000e04
ffff880406987c00 574301961 C Co:1:042:0 0 8 >
ffff880406940c00 574318698 S Co:1:042:0 s 21 09 0300 0000 0008 8 = 753b6678 f227a248
ffff880406940c00 574318828 C Co:1:042:0 0 8 >
ffff880406940c00 574333738 S Co:1:042:0 s 21 09 0300 0000 0008 8 = 01809100 15ff97ff
ffff880406940c00 574333937 C Co:1:042:0 0 8 >
ffff88025ad1fd80 574348778 S Co:1:042:0 s 21 09 0300 0000 0008 8 = d7ffa7ff 87ff37ff
ffff88025ad1fd80 574348938 C Co:1:042:0 0 8 >
ffff88025ad1fd80 574365687 S Co:1:042:0 s 21 09 0300 0000 0008 8 = d7ffe7ff 37ff37ff
ffff88025ad1fd80 574365891 C Co:1:042:0 0 8 >
ffff88025ad1fd80 574380681 S Co:1:042:0 s 21 09 0300 0000 0008 8 = 77ff07ff e7ffe7ff
ffff88025ad1fd80 574380829 C Co:1:042:0 0 8 >
ffff8804069873c0 574395774 S Co:1:042:0 s 21 09 0300 0000 0008 8 = a7ff37ff 07fff7ff
ffff8804069873c0 574395940 C Co:1:042:0 0 8 >
ffff880406987b40 574412695 S Co:1:042:0 s 21 09 0300 0000 0008 8 = d7ff27ff 97ff77ff
ffff880406987b40 574412814 C Co:1:042:0 0 8 >
ffff88025ad1fd80 574427720 S Co:1:042:0 s 21 09 0300 0000 0008 8 = 67ffa7ff 07ff97ff
ffff88025ad1fd80 574427814 C Co:1:042:0 0 8 >
ffff88025ad1fd80 574442763 S Co:1:042:0 s 21 09 0300 0000 0008 8 = c7ffe7ff 27ff57ff
ffff88025ad1fd80 574442996 C Co:1:042:0 0 8 >
ffff88025ad1fd80 574459674 S Co:1:042:0 s 21 09 0300 0000 0008 8 = b7ff27ff b7ffb7ff
ffff88025ad1fd80 574459814 C Co:1:042:0 0 8 >
ffff8804033a5cc0 574474722 S Co:1:042:0 s 21 09 0300 0000 0008 8 = b7ffe7ff f7ffa7ff
ffff8804033a5cc0 574474838 C Co:1:042:0 0 8 >
ffff88025ad1fd80 574489692 S Co:1:042:0 s 21 09 0300 0000 0008 8 = a7ff37ff 67ff27ff
ffff88025ad1fd80 574489811 C Co:1:042:0 0 8 >
ffff88025ad1f300 574504986 S Co:1:042:0 s 21 09 0300 0000 0008 8 = 07ffb7ff f7ff77ff
ffff88025ad1f300 574505263 C Co:1:042:0 0 8 >
ffff88025ad1f300 574521649 S Co:1:042:0 s 21 09 0300 0000 0008 8 = f7ff07ff 77ff97ff
ffff88025ad1f300 574521810 C Co:1:042:0 0 8 >
ffff8803e6ff2d80 574537749 S Co:1:042:0 s 21 09 0300 0000 0008 8 = c7ff97ff 07ff47ff
ffff8803e6ff2d80 574537977 C Co:1:042:0 0 8 >
ffff8804033a5cc0 574551778 S Co:1:042:0 s 21 09 0300 0000 0008 8 = c7ff67ff 17ffd7ff
ffff8804033a5cc0 574551938 C Co:1:042:0 0 8 >
ffff88025ad1f300 574567678 S Co:1:042:0 s 21 09 0300 0000 0008 8 = 17ff17ff 77ffb7ff
ffff88025ad1f300 574567845 C Co:1:042:0 0 8 >
ffff8804069400c0 574584738 S Co:1:042:0 s 21 09 0300 0000 0008 8 = 17ffc7ff a7ffa7ff
ffff8804069400c0 574584938 C Co:1:042:0 0 8 >
ffff8804033a5240 574598767 S Co:1:042:0 s 21 09 0300 0000 0008 8 = a7ff37ff 77ffe7ff
ffff8804033a5240 574598959 C Co:1:042:0 0 8 >
ffff8804033a5240 574616638 S Co:1:042:0 s 21 09 0300 0000 0008 8 = 27ff27ff 17ffd7ff
ffff8804033a5240 574616831 C Co:1:042:0 0 8 >
ffff880406987d80 574630728 S Co:1:042:0 s 21 09 0300 0000 0008 8 = 47ff37ff d7ffd7ff
ffff880406987d80 574630959 C Co:1:042:0 0 8 >
ffff880406940cc0 574645761 S Co:1:042:0 s 21 09 0300 0000 0008 8 = 37ff67ff b7ff17ff
ffff880406940cc0 574645939 C Co:1:042:0 0 8 >
ffff88020f0f19c0 574661775 S Co:1:042:0 s 21 09 0300 0000 0008 8 = 47ffd7ff 27ff37ff
ffff88020f0f19c0 574661955 C Co:1:042:0 0 8 >
ffff880406940000 574676636 S Co:1:042:0 s 21 09 0300 0000 0008 8 = 97ffb7ff 87ff77ff
ffff880406940000 574676811 C Co:1:042:0 0 8 >
ffff8804033a5b40 574692734 S Co:1:042:0 s 21 09 0300 0000 0008 8 = 17ff47ff a7ffb7ff
ffff8804033a5b40 574692971 C Co:1:042:0 0 8 >
ffff8804033a5b40 574708790 S Co:1:042:0 s 21 09 0300 0000 0008 8 = a7ff47ff a7ff87ff
ffff8804033a5b40 574708962 C Co:1:042:0 0 8 >
ffff8804033a5b40 574724271 S Co:1:042:0 s 21 09 0300 0000 0008 8 = b7fff7ff 47ff67ff
ffff8804033a5b40 574724460 C Co:1:042:0 0 8 >
ffff88025ad1ff00 574739248 S Co:1:042:0 s 21 09 0300 0000 0008 8 = e7ff97ff f7ff57ff
ffff88025ad1ff00 574739437 C Co:1:042:0 0 8 >
ffff8804033a5b40 574756303 S Co:1:042:0 s 21 09 0300 0000 0008 8 = 37ffd7ff a7ff87ff
ffff8804033a5b40 574756436 C Co:1:042:0 0 8 >
ffff8804033a5d80 574772267 S Co:1:042:0 s 21 09 0300 0000 0008 8 = e7ff17ff 87ffa7ff
ffff8804033a5d80 574772440 C Co:1:042:0 0 8 >
ffff88025ad1f9c0 574786288 S Co:1:042:0 s 21 09 0300 0000 0008 8 = 47ff37ff 27ffc7ff
ffff88025ad1f9c0 574786441 C Co:1:042:0 0 8 >
ffff88025ad1f000 574802274 S Co:1:042:0 s 21 09 0300 0000 0008 8 = 57ff87ff 17ff67ff
ffff88025ad1f000 574802457 C Co:1:042:0 0 8 >
ffff88020f0f19c0 574818328 S Co:1:042:0 s 21 09 0300 0000 0008 8 = b7ffb7ff d7ffd7ff
ffff88020f0f19c0 574818461 C Co:1:042:0 0 8 >
ffff88020f0f19c0 574834095 S Co:1:042:0 s 21 09 0300 0000 0008 8 = d7ff97ff 976ebc88
ffff88020f0f19c0 574834218 C Co:1:042:0 0 8 >
ffff88020f0f1d80 574848274 S Co:1:042:0 s 21 09 0300 0000 0008 8 = 8fe5576f d1c3cbfa
ffff88020f0f1d80 574848463 C Co:1:042:0 0 8 >
ffff88020f0f1d80 574864275 S Co:1:042:0 s 21 09 0300 0000 0008 8 = 9b3a8bf9 8d33db0d
ffff88020f0f1d80 574864443 C Co:1:042:0 0 8 >
ffff88020f0f1d80 574880173 S Co:1:042:0 s 21 09 0300 0000 0008 8 = 4d948c96 67d1f9df
ffff88020f0f1d80 574880317 C Co:1:042:0 0 8 >
ffff88020f0f1d80 574895147 S Co:1:042:0 s 21 09 0300 0000 0008 8 = 64b54289 2872c835
ffff88020f0f1d80 574895332 C Co:1:042:0 0 8 >
ffff88020f0f1d80 574911193 S Co:1:042:0 s 21 09 0300 0000 0008 8 = 91e8e976 4d32fdf6
ffff88020f0f1d80 574911331 C Co:1:042:0 0 8 >
ffff88020f0f1d80 574927159 S Co:1:042:0 s 21 09 0300 0000 0008 8 = fc7791e6 88efe3ac
ffff88020f0f1d80 574927316 C Co:1:042:0 0 8 >
ffff88020f0f1d80 574942199 S Co:1:042:0 s 21 09 0300 0000 0008 8 = c1349dc8 3ccbd607
ffff88020f0f1d80 574942347 C Co:1:042:0 0 8 >
ffff88020f0f1d80 574959254 S Co:1:042:0 s 21 09 0300 0000 0008 8 = 6df347ec 03adca5c
ffff88020f0f1d80 574959468 C Co:1:042:0 0 8 >
ffff88025ad1ff00 574976328 S Co:1:042:0 s 21 09 0300 0000 0008 8 = 830b1888 29bec420
ffff88025ad1ff00 574976468 C Co:1:042:0 0 8 >
ffff880406940300 574989200 S Co:1:042:0 s 21 09 0300 0000 0008 8 = fcdb73b6 30ed5d70
ffff880406940300 574989343 C Co:1:042:0 0 8 >
ffff8804033a5b40 575005244 S Co:1:042:0 s 21 09 0300 0000 0008 8 = c04109f2 4c6d448a
ffff8804033a5b40 575005462 C Co:1:042:0 0 8 >
ffff88025ad1f840 575020494 S Co:1:042:0 s 21 09 0300 0000 0008 8 = 3022639e e634bb53
ffff88025ad1f840 575020694 C Co:1:042:0 0 8 >
ffff88025ad1f840 575036121 S Co:1:042:0 s 21 09 0300 0000 0008 8 = 9ee75e7f 1c7d17d2
ffff88025ad1f840 575036317 C Co:1:042:0 0 8 >
ffff8804033a5b40 575054215 S Co:1:042:0 s 21 09 0300 0000 0008 8 = d1fda83f 3d4543b1
ffff8804033a5b40 575054315 C Co:1:042:0 0 8 >
ffff8804033a5d80 575067339 S Co:1:042:0 s 21 09 0300 0000 0008 8 = 845246ec 4fcf3bc0
ffff8804033a5d80 575067441 C Co:1:042:0 0 8 >
ffff8804033a5d80 575083152 S Co:1:042:0 s 21 09 0300 0000 0008 8 = e6dd1076 8b229374
ffff8804033a5d80 575083319 C Co:1:042:0 0 8 >
ffff880406987180 575100228 S Co:1:042:0 s 21 09 0300 0000 0008 8 = 19143132 de87ef62
ffff880406987180 575100443 C Co:1:042:0 0 8 >
ffff8804033a5240 575114244 S Co:1:042:0 s 21 09 0300 0000 0008 8 = b575a95b 680e8bc7
ffff8804033a5240 575114455 C Co:1:042:0 0 8 >
ffff880406987180 575130230 S Co:1:042:0 s 21 09 0300 0000 0008 8 = 4500cd8e fe08b302
ffff880406987180 575130334 C Co:1:042:0 0 8 >
ffff880406940c00 575146191 S Co:1:042:0 s 21 09 0300 0000 0008 8 = c6b9c44b aa8c4a15
ffff880406940c00 575146332 C Co:1:042:0 0 8 >
ffff8804033a5cc0 575161242 S Co:1:042:0 s 21 09 0300 0000 0008 8 = 2d290a79 27f5452a
ffff8804033a5cc0 575161465 C Co:1:042:0 0 8 >
ffff8804033a5a80 575177274 S Co:1:042:0 s 21 09 0300 0000 0008 8 = e0dcefe1 68602e0a
ffff8804033a5a80 575177444 C Co:1:042:0 0 8 >
ffff88025ad1f000 575192309 S Co:1:042:0 s 21 09 0300 0000 0008 8 = 39e316b0 1031a3a6
ffff88025ad1f000 575192464 C Co:1:042:0 0 8 >
ffff88025ad1f000 575208220 S Co:1:042:0 s 21 09 0300 0000 0008 8 = 0951f8f7 f98dd790
ffff88025ad1f000 575208331 C Co:1:042:0 0 8 >
ffff88025ad1f000 575224201 S Co:1:042:0 s 21 09 0300 0000 0008 8 = 11bf612c b0df0f80
ffff88025ad1f000 575224315 C Co:1:042:0 0 8 >
ffff880406940c00 575239162 S Co:1:042:0 s 21 09 0300 0000 0008 8 = 88caf0a9 f55524d2
ffff880406940c00 575239342 C Co:1:042:0 0 8 >
ffff880406940c00 575255172 S Co:1:042:0 s 21 09 0300 0000 0008 8 = 9a92992a 3e610505
ffff880406940c00 575255340 C Co:1:042:0 0 8 >
ffff880406940c00 575271247 S Co:1:042:0 s 21 09 0300 0000 0008 8 = e53b2451 323b333c
ffff880406940c00 575271473 C Co:1:042:0 0 8 >
ffff880406940c00 575289640 S Co:1:042:0 s 21 09 0300 0000 0008 8 = fd6ead23 305c45be
ffff880406940c00 575289819 C Co:1:042:0 0 8 >
ffff880406940c00 575302240 S Co:1:042:0 s 21 09 0300 0000 0008 8 = e7d6248a c8026578
ffff880406940c00 575302320 C Co:1:042:0 0 8 >
ffff880406940c00 575317302 S Co:1:042:0 s 21 09 0300 0000 0008 8 = 9fa5cdd4 3eb1cf77
ffff880406940c00 575317440 C Co:1:042:0 0 8 >
ffff880406940c00 575333309 S Co:1:042:0 s 21 09 0300 0000 0008 8 = 940fc031 0dae5671
ffff880406940c00 575333445 C Co:1:042:0 0 8 >
ffff8804033a5a80 575349160 S Co:1:042:0 s 21 09 0300 0000 0008 8 = 29cd6836 5f84e13b
ffff8804033a5a80 575349317 C Co:1:042:0 0 8 >
ffff88025ad1f000 575364240 S Co:1:042:0 s 21 09 0300 0000 0008 8 = 3499055e 9882e852
ffff88025ad1f000 575364463 C Co:1:042:0 0 8 >
ffff8804033a5a80 575381307 S Co:1:042:0 s 21 09 0300 0000 0008 8 = 81b62c86 ca39fa55
ffff8804033a5a80 575381468 C Co:1:042:0 0 8 >
ffff880406940c00 575396215 S Co:1:042:0 s 21 09 0300 0000 0008 8 = 4e67436f 40ff3886
ffff880406940c00 575396342 C Co:1:042:0 0 8 >
ffff880406940c00 575411240 S Co:1:042:0 s 21 09 0300 0000 0008 8 = ce74083e f671d94f
ffff880406940c00 575411343 C Co:1:042:0 0 8 >
ffff8804033a5cc0 575428298 S Co:1:042:0 s 21 09 0300 0000 0008 8 = a8ab09fc 1deba6b9
ffff8804033a5cc0 575428466 C Co:1:042:0 0 8 >
ffff88025ad1f000 575443153 S Co:1:042:0 s 21 09 0300 0000 0008 8 = 775a2c18 9a107ef5
ffff88025ad1f000 575443337 C Co:1:042:0 0 8 >
ffff88025ad1f000 575458252 S Co:1:042:0 s 21 09 0300 0000 0008 8 = 49d826e3 8546d1d5
ffff88025ad1f000 575458456 C Co:1:042:0 0 8 >
ffff880406940c00 575475262 S Co:1:042:0 s 21 09 0300 0000 0008 8 = 23fc0611 ac392652
ffff880406940c00 575475450 C Co:1:042:0 0 8 >
ffff88025ad1f600 575491205 S Co:1:042:0 s 21 09 0300 0000 0008 8 = 7aa2aa3c 10559806
ffff88025ad1f600 575491345 C Co:1:042:0 0 8 >
ffff88025ad1f600 575506235 S Co:1:042:0 s 21 09 0300 0000 0008 8 = b92c4662 644e52b1
ffff88025ad1f600 575506342 C Co:1:042:0 0 8 >
ffff88025ad1f600 575521266 S Co:1:042:0 s 21 09 0300 0000 0008 8 = bffce265 939a19b5
ffff88025ad1f600 575521475 C Co:1:042:0 0 8 >
ffff880406987d80 575537320 S Co:1:042:0 s 21 09 0300 0000 0008 8 = 60fdda88 39f4c09c
ffff880406987d80 575537467 C Co:1:042:0 0 8 >
ffff880406987d80 575552213 S Co:1:042:0 s 21 09 0300 0000 0008 8 = e2195ef6 27d9b38f
ffff880406987d80 575552349 C Co:1:042:0 0 8 >
ffff8804069400c0 575569249 S Co:1:042:0 s 21 09 0300 0000 0008 8 = 7fc2f13d e20c70df
ffff8804069400c0 575569465 C Co:1:042:0 0 8 >
ffff8804033a50c0 575583236 S Co:1:042:0 s 21 09 0300 0000 0008 8 = e86bedcd 2314077f
ffff8804033a50c0 575583462 C Co:1:042:0 0 8 >
ffff8804069873c0 575598890 S Co:1:042:0 s 21 09 0300 0000 0008 8 = be0efb7b 56bb9f85
ffff8804069873c0 575599068 C Co:1:042:0 0 8 >
ffff880406940480 575614971 S Co:1:042:0 s 21 09 0300 0000 0008 8 = 18a69d03 1d8ff2ae
ffff880406940480 575615091 C Co:1:042:0 0 8 >
ffff8804069873c0 575632033 S Co:1:042:0 s 21 09 0300 0000 0008 8 = 02b4a77f cc62ced9
ffff8804069873c0 575632220 C Co:1:042:0 0 8 >
ffff8803e6ff2e40 575646062 S Co:1:042:0 s 21 09 0300 0000 0008 8 = fabdbff3 eccc9489
ffff8803e6ff2e40 575646198 C Co:1:042:0 0 8 >
ffff8803e6ff2d80 575662917 S Co:1:042:0 s 21 09 0300 0000 0008 8 = 74c8e3c3 baa5bb65
ffff8803e6ff2d80 575663088 C Co:1:042:0 0 8 >
ffff8803e6ff2d80 575676995 S Co:1:042:0 s 21 09 0300 0000 0008 8 = 55e2e139 a78e4cba
ffff8803e6ff2d80 575677201 C Co:1:042:0 0 8 >
ffff8803e6ff2d80 575693046 S Co:1:042:0 s 21 09 0300 0000 0008 8 = 799bde02 d86765f5
ffff8803e6ff2d80 575693218 C Co:1:042:0 0 8 >
ffff8803e6ff2e40 575710069 S Co:1:042:0 s 21 09 0300 0000 0008 8 = 2f88d2af a6d8b82c
ffff8803e6ff2e40 575710199 C Co:1:042:0 0 8 >
ffff8803e6ff2d80 575723759 S Co:1:042:0 s 21 09 0300 0000 0008 8 = bac20836 1dcb0b94
ffff8803e6ff2d80 575724017 C Co:1:042:0 0 8 >
ffff8803e6ff2d80 575739750 S Co:1:042:0 s 21 09 0300 0000 0008 8 = d064a171 7fefb80a
ffff8803e6ff2d80 575739948 C Co:1:042:0 0 8 >
ffff880406940480 575755566 S Co:1:042:0 s 21 09 0300 0000 0008 8 = 1d0f0f9c c0342d8d
ffff880406940480 575755713 C Co:1:042:0 0 8 >
ffff8804033a50c0 575771686 S Co:1:042:0 s 21 09 0300 0000 0008 8 = bf679cd9 09536bc0
ffff8804033a50c0 575771825 C Co:1:042:0 0 8 >
ffff880406987000 575788707 S Co:1:042:0 s 21 09 0300 0000 0008 8 = c995e3ae 3845896b
ffff880406987000 575788845 C Co:1:042:0 0 8 >
ffff880406987000 575803728 S Co:1:042:0 s 21 09 0300 0000 0008 8 = c2c55483 5cc92ff8
ffff880406987000 575803838 C Co:1:042:0 0 8 >
ffff880406987000 575818650 S Co:1:042:0 s 21 09 0300 0000 0008 8 = 25a7b227 3be11df8
ffff880406987000 575818851 C Co:1:042:0 0 8 >
ffff8804069406c0 575835740 S Co:1:042:0 s 21 09 0300 0000 0008 8 = e0f0964a ce53a59d
ffff8804069406c0 575835824 C Co:1:042:0 0 8 >
ffff880406940240 575849758 S Co:1:042:0 s 21 09 0300 0000 0008 8 = d7d8ec02 c22a2b40
ffff880406940240 575849948 C Co:1:042:0 0 8 >
ffff88025ad1f600 575864640 S Co:1:042:0 s 21 09 0300 0000 0008 8 = 619c7348 f735a9db
ffff88025ad1f600 575864845 C Co:1:042:0 0 8 >
ffff88025ad1f3c0 575880696 S Co:1:042:0 s 21 09 0300 0000 0008 8 = c9fc3f7a 02852f8e
ffff88025ad1f3c0 575880847 C Co:1:042:0 0 8 >
ffff8804033a5000 575896727 S Co:1:042:0 s 21 09 0300 0000 0008 8 = ccbc38d8 acf15d1c
ffff8804033a5000 575896849 C Co:1:042:0 0 8 >
ffff880406940240 575913646 S Co:1:042:0 s 21 09 0300 0000 0008 8 = 1f249b09 7393e96c
ffff880406940240 575913837 C Co:1:042:0 0 8 >
ffff880406987000 575926670 S Co:1:042:0 s 21 09 0300 0000 0008 8 = e7827696 064a1e0b
ffff880406987000 575926824 C Co:1:042:0 0 8 >
ffff880406987f00 575942668 S Co:1:042:0 s 21 09 0300 0000 0008 8 = 41a52e6c cc3859a7
ffff880406987f00 575942841 C Co:1:042:0 0 8 >
ffff8804033a5000 575959711 S Co:1:042:0 s 21 09 0300 0000 0008 8 = ba62fa5d 5c448c93
ffff8804033a5000 575959822 C Co:1:042:0 0 8 >
ffff8804033a5900 575974664 S Co:1:042:0 s 21 09 0300 0000 0008 8 = d611679d 0397bd48
ffff8804033a5900 575974826 C Co:1:042:0 0 8 >
ffff88025ad1f3c0 575989713 S Co:1:042:0 s 21 09 0300 0000 0008 8 = 8c0ed547 432186e0
ffff88025ad1f3c0 575989832 C Co:1:042:0 0 8 >
ffff88025ad1f3c0 576004691 S Co:1:042:0 s 21 09 0300 0000 0008 8 = c63bf6d7 5113949b
ffff88025ad1f3c0 576004827 C Co:1:042:0 0 8 >
ffff880406987f00 576020656 S Co:1:042:0 s 21 09 0300 0000 0008 8 = e37a54af 94642a5c
ffff880406987f00 576020826 C Co:1:042:0 0 8 >
ffff880406940b40 576035621 S Co:1:042:0 s 21 09 0300 0000 0008 8 = 3636ca95 2b4f9e2a
ffff880406940b40 576035822 C Co:1:042:0 0 8 >
ffff8804033a5300 576051658 S Co:1:042:0 s 21 09 0300 0000 0008 8 = 86d90731 66d1d8b2
ffff8804033a5300 576051842 C Co:1:042:0 0 8 >
ffff88025ad1f000 576067617 S Co:1:042:0 s 21 09 0300 0000 0008 8 = 8f551092 492ed8c2
ffff88025ad1f000 576067722 C Co:1:042:0 0 8 >
ffff880406940b40 576082603 S Co:1:042:0 s 21 09 0300 0000 0008 8 = 7e9ebda8 0e6b2fcd
ffff880406940b40 576082706 C Co:1:042:0 0 8 >
ffff880406940600 576099679 S Co:1:042:0 s 21 09 0300 0000 0008 8 = 762c3ac9 a2d3836c
ffff880406940600 576099843 C Co:1:042:0 0 8 >
ffff880406987240 576114758 S Co:1:042:0 s 21 09 0300 0000 0008 8 = 0f7b852e 25740ed9
ffff880406987240 576115006 C Co:1:042:0 0 8 >
ffff8804069870c0 576129590 S Co:1:042:0 s 21 09 0300 0000 0008 8 = d48cf475 6da01d74
ffff8804069870c0 576129698 C Co:1:042:0 0 8 >
ffff8804069870c0 576145640 S Co:1:042:0 s 21 09 0300 0000 0008 8 = c364af1f 826f9340
ffff8804069870c0 576145843 C Co:1:042:0 0 8 >
ffff880406987240 576161747 S Co:1:042:0 s 21 09 0300 0000 0008 8 = cf8a3011 213a6565
ffff880406987240 576161958 C Co:1:042:0 0 8 >
ffff880406940600 576176642 S Co:1:042:0 s 21 09 0300 0000 0008 8 = 5f8bc815 3a1f1ead
ffff880406940600 576176827 C Co:1:042:0 0 8 >
ffff880406940600 576193705 S Co:1:042:0 s 21 09 0300 0000 0008 8 = cd781a58 74825a09
ffff880406940600 576193827 C Co:1:042:0 0 8 >
ffff8804033a5780 576208723 S Co:1:042:0 s 21 09 0300 0000 0008 8 = ea64a0eb a6884d0c
ffff8804033a5780 576208828 C Co:1:042:0 0 8 >
ffff880406987240 576223624 S Co:1:042:0 s 21 09 0300 0000 0008 8 = 77e92345 5e9c3c6c
ffff880406987240 576223719 C Co:1:042:0 0 8 >
ffff88025ad1f000 576240668 S Co:1:042:0 s 21 09 0300 0000 0008 8 = aca246bd 5dec0186
ffff88025ad1f000 576240832 C Co:1:042:0 0 8 >
ffff88025ad1f000 576255709 S Co:1:042:0 s 21 09 0300 0000 0008 8 = b3b0fa13 17eb89d9
ffff88025ad1f000 576255831 C Co:1:042:0 0 8 >
ffff88025ad1f000 576270644 S Co:1:042:0 s 21 09 0300 0000 0008 8 = 2c3709e6 34cf5788
ffff88025ad1f000 576270858 C Co:1:042:0 0 8 >
ffff880406987240 576286660 S Co:1:042:0 s 21 09 0300 0000 0008 8 = a8e08d3d 131200db
ffff880406987240 576286829 C Co:1:042:0 0 8 >
ffff880406940840 576301854 S Co:1:042:0 s 21 09 0300 0000 0008 8 = 30577700 44f3aebd
ffff880406940840 576302078 C Co:1:042:0 0 8 >
ffff880406987240 576318733 S Co:1:042:0 s 21 09 0300 0000 0008 8 = becc0c7e 0cf4a03d
ffff880406987240 576318851 C Co:1:042:0 0 8 >
ffff880406940240 576333657 S Co:1:042:0 s 21 09 0300 0000 0008 8 = c07461e7 e45ca70e
ffff880406940240 576333829 C Co:1:042:0 0 8 >
ffff880406987240 576350714 S Co:1:042:0 s 21 09 0300 0000 0008 8 = 9a08e4d1 f8b4a809
ffff880406987240 576350845 C Co:1:042:0 0 8 >
ffff88025ad1f000 576365737 S Co:1:042:0 s 21 09 0300 0000 0008 8 = 2243d5b5 a94b1fa8
ffff88025ad1f000 576365847 C Co:1:042:0 0 8 >
ffff88025ad1f000 576380630 S Co:1:042:0 s 21 09 0300 0000 0008 8 = 2466c771 0db5988b
ffff88025ad1f000 576380848 C Co:1:042:0 0 8 >
ffff88025ad1f000 576395800 S Co:1:042:0 s 21 09 0300 0000 0008 8 = deb522c6 6c4636f5
ffff88025ad1f000 576395956 C Co:1:042:0 0 8 >
ffff880406987240 576412731 S Co:1:042:0 s 21 09 0300 0000 0008 8 = 84f8a2d9 c3992e4e
ffff880406987240 576412848 C Co:1:042:0 0 8 >
ffff880406940240 576427633 S Co:1:042:0 s 21 09 0300 0000 0008 8 = bbfdd6b4 440d4aa0
ffff880406940240 576427831 C Co:1:042:0 0 8 >
ffff880406940240 576442697 S Co:1:042:0 s 21 09 0300 0000 0008 8 = 1f13a4c4 d245691c
ffff880406940240 576442871 C Co:1:042:0 0 8 >
ffff880406940240 576459717 S Co:1:042:0 s 21 09 0300 0000 0008 8 = bf8fc25b 86a5fb95
ffff880406940240 576459848 C Co:1:042:0 0 8 >
ffff8804033a5780 576474703 S Co:1:042:0 s 21 09 0300 0000 0008 8 = 9e493d2d 2eda8802
ffff8804033a5780 576474833 C Co:1:042:0 0 8 >
ffff880406940240 576489650 S Co:1:042:0 s 21 09 0300 0000 0008 8 = 321ef4d5 cb5128fe
ffff880406940240 576489830 C Co:1:042:0 0 8 >
ffff880406940240 576506651 S Co:1:042:0 s 21 09 0300 0000 0008 8 = e66e1b50 11bc0a49
ffff880406940240 576506826 C Co:1:042:0 0 8 >
ffff8804033a5600 576521719 S Co:1:042:0 s 21 09 0300 0000 0008 8 = 9a9cba7e e993f046
ffff8804033a5600 576521901 C Co:1:042:0 0 8 >
ffff8804033a5600 576536578 S Co:1:042:0 s 21 09 0300 0000 0008 8 = 20932da6 f18eaf7d
ffff8804033a5600 576536702 C Co:1:042:0 0 8 >
ffff88025ad1f000 576551800 S Co:1:042:0 s 21 09 0300 0000 0008 8 = bf3ea5f0 f82eb118
ffff88025ad1f000 576551978 C Co:1:042:0 0 8 >
ffff880406987240 576568744 S Co:1:042:0 s 21 09 0300 0000 0008 8 = b20da4eb 84337568
ffff880406987240 576568955 C Co:1:042:0 0 8 >
ffff88025ad1f000 576583418 S Co:1:042:0 s 21 09 0300 0000 0008 8 = a7748207 4e250b60
ffff88025ad1f000 576583602 C Co:1:042:0 0 8 >
ffff88025ad1f840 576600267 S Co:1:042:0 s 21 09 0300 0000 0008 8 = 436dec1a c2ce9b17
ffff88025ad1f840 576600470 C Co:1:042:0 0 8 >
ffff88025ad1f000 576615329 S Co:1:042:0 s 21 09 0300 0000 0008 8 = 9af462dd 82bcdd48
ffff88025ad1f000 576615455 C Co:1:042:0 0 8 >
ffff8804033a5780 576630171 S Co:1:042:0 s 21 09 0300 0000 0008 8 = b988b66e e2c2a0d3
ffff8804033a5780 576630327 C Co:1:042:0 0 8 >
ffff88025ad1f000 576646270 S Co:1:042:0 s 21 09 0300 0000 0008 8 = 1faf92ce 6c76453b
ffff88025ad1f000 576646509 C Co:1:042:0 0 8 >
ffff880406987cc0 576663283 S Co:1:042:0 s 21 09 0300 0000 0008 8 = 3d70f163 5bb24328
ffff880406987cc0 576663474 C Co:1:042:0 0 8 >
ffff8804033a5300 576678344 S Co:1:042:0 s 21 09 0300 0000 0008 8 = fcd8a275 2215a3e5
ffff8804033a5300 576678477 C Co:1:042:0 0 8 >
ffff8804033a5300 576693295 S Co:1:042:0 s 21 09 0300 0000 0008 8 = 3678cab2 e48084e1
ffff8804033a5300 576693477 C Co:1:042:0 0 8 >
ffff8804033a5300 576708356 S Co:1:042:0 s 21 09 0300 0000 0008 8 = 39e461ac fb9c962f
ffff8804033a5300 576708477 C Co:1:042:0 0 8 >
ffff880406940240 576726240 S Co:1:042:0 s 21 09 0300 0000 0008 8 = 4933b357 7451a108
ffff880406940240 576726331 C Co:1:042:0 0 8 >
ffff88025ad1f480 576741207 S Co:1:042:0 s 21 09 0300 0000 0008 8 = 1c83df8e 8f4efd46
ffff88025ad1f480 576741329 C Co:1:042:0 0 8 >
ffff8804033a5300 576756241 S Co:1:042:0 s 21 09 0300 0000 0008 8 = 5e75598d 418619e9
ffff8804033a5300 576756337 C Co:1:042:0 0 8 >
ffff8804033a5300 576771312 S Co:1:042:0 s 21 09 0300 0000 0008 8 = 2dab6977 b3aff695
ffff8804033a5300 576771466 C Co:1:042:0 0 8 >
ffff8804033a5300 576787233 S Co:1:042:0 s 21 09 0300 0000 0008 8 = 9c4fabd0 c3c3ab0f
ffff8804033a5300 576787348 C Co:1:042:0 0 8 >
ffff8804033a59c0 576802277 S Co:1:042:0 s 21 09 0300 0000 0008 8 = 338d8f01 8181e1c5
ffff8804033a59c0 576802458 C Co:1:042:0 0 8 >
ffff8804033a5300 576818451 S Co:1:042:0 s 21 09 0300 0000 0008 8 = 6b16d9d9 b1ec5645
ffff8804033a5300 576818582 C Co:1:042:0 0 8 >
ffff8804033a59c0 576833410 S Co:1:042:0 s 21 09 0300 0000 0008 8 = 349d2008 4dc85dc3
ffff8804033a59c0 576833598 C Co:1:042:0 0 8 >
ffff8804033a59c0 576848378 S Co:1:042:0 s 21 09 0300 0000 0008 8 = 705c51a4 02225a96
ffff8804033a59c0 576848585 C Co:1:042:0 0 8 >
ffff880406987a80 576864429 S Co:1:042:0 s 21 09 0300 0000 0008 8 = 778e2ba7 b0c648b9
ffff880406987a80 576864584 C Co:1:042:0 0 8 >
ffff8804033a59c0 576882493 S Co:1:042:0 s 21 09 0300 0000 0008 8 = 94f3c26d edc9354c
ffff8804033a59c0 576882584 C Co:1:042:0 0 8 >
ffff8804033a5900 576895374 S Co:1:042:0 s 21 09 0300 0000 0008 8 = 8552ff38 80ffc212
ffff8804033a5900 576895457 C Co:1:042:0 0 8 >
ffff88025ad1f9c0 576912420 S Co:1:042:0 s 21 09 0300 0000 0008 8 = fcf01dad e883a6f3
ffff88025ad1f9c0 576912604 C Co:1:042:0 0 8 >
ffff880406987cc0 576929250 S Co:1:042:0 s 21 09 0300 0000 0008 8 = 221c2b56 d5352a7a
ffff880406987cc0 576929482 C Co:1:042:0 0 8 >
ffff88025ad1fb40 576942231 S Co:1:042:0 s 21 09 0300 0000 0008 8 = 11a68e20 ac35ac56
ffff88025ad1fb40 576942333 C Co:1:042:0 0 8 >
ffff880406987cc0 576958174 S Co:1:042:0 s 21 09 0300 0000 0008 8 = 58617edd 056b1edb
ffff880406987cc0 576958354 C Co:1:042:0 0 8 >
ffff880406987cc0 576974217 S Co:1:042:0 s 21 09 0300 0000 0008 8 = 79a686c2 2e018780
ffff880406987cc0 576974347 C Co:1:042:0 0 8 >
ffff880406987cc0 576989237 S Co:1:042:0 s 21 09 0300 0000 0008 8 = 6cd207e8 a7e57f60
ffff880406987cc0 576989362 C Co:1:042:0 0 8 >
ffff8804033a50c0 577005190 S Co:1:042:0 s 21 09 0300 0000 0008 8 = 1bc5b3cc a649b4bb
ffff8804033a50c0 577005412 C Co:1:042:0 0 8 >
ffff8804033a50c0 577020499 S Co:1:042:0 s 21 09 0300 0000 0008 8 = e56314d1 93256974
ffff8804033a50c0 577020606 C Co:1:042:0 0 8 >
ffff8804033a5000 577036599 S Co:1:042:0 s 21 09 0300 0000 0008 8 = 1e1405bb 8ab2f493
ffff8804033a5000 577036711 C Co:1:042:0 0 8 >
ffff8804033a5000 577052170 S Co:1:042:0 s 21 09 0300 0000 0008 8 = 8b463633 deee3ec3
ffff8804033a5000 577052384 C Co:1:042:0 0 8 >
ffff880406940480 577067193 S Co:1:042:0 s 21 09 0300 0000 0008 8 = e9e8ab48 931d45d3
ffff880406940480 577067386 C Co:1:042:0 0 8 >
ffff880406940480 577083225 S Co:1:042:0 s 21 09 0300 0000 0008 8 = 65ef3bea e2449b37
ffff880406940480 577083364 C Co:1:042:0 0 8 >
ffff8804033a5000 577099121 S Co:1:042:0 s 21 09 0300 0000 0008 8 = 23d3136f b7aee686
ffff8804033a5000 577099380 C Co:1:042:0 0 8 >
ffff8804033a5000 577114156 S Co:1:042:0 s 21 09 0300 0000 0008 8 = b9103211 336960fb
ffff8804033a5000 577114356 C Co:1:042:0 0 8 >
ffff8804033a5000 577131207 S Co:1:042:0 s 21 09 0300 0000 0008 8 = b3a8ec6c 2cc857f6
ffff8804033a5000 577131355 C Co:1:042:0 0 8 >
ffff8804033a5d80 577146207 S Co:1:042:0 s 21 09 0300 0000 0008 8 = 0f9e6902 aae1ac7a
ffff8804033a5d80 577146335 C Co:1:042:0 0 8 >
ffff880406987f00 577160919 S Co:1:042:0 s 21 09 0300 0000 0008 8 = c07a25b8 6a0e55af
ffff880406987f00 577161083 C Co:1:042:0 0 8 >
ffff8804069406c0 577177028 S Co:1:042:0 s 21 09 0300 0000 0008 8 = 2eca7159 5d6edd60
ffff8804069406c0 577177231 C Co:1:042:0 0 8 >
ffff88020f0f1480 577193073 S Co:1:042:0 s 21 09 0300 0000 0008 8 = b29cef10 2863e17c
ffff88020f0f1480 577193211 C Co:1:042:0 0 8 >
ffff88020f0f1480 577207910 S Co:1:042:0 s 21 09 0300 0000 0008 8 = 1c0717f0 a4139397
ffff88020f0f1480 577208102 C Co:1:042:0 0 8 >
ffff88020f0f1480 577225021 S Co:1:042:0 s 21 09 0300 0000 0008 8 = 2ea2b66d 5dea3968
ffff88020f0f1480 577225295 C Co:1:042:0 0 8 >
ffff88020f0f1480 577240070 S Co:1:042:0 s 21 09 0300 0000 0008 8 = 20096ce2 1414ad4a
ffff88020f0f1480 577240213 C Co:1:042:0 0 8 >
ffff88020f0f1480 577254958 S Co:1:042:0 s 21 09 0300 0000 0008 8 = 1d5d2b0c 3f05ddbe
ffff88020f0f1480 577255098 C Co:1:042:0 0 8 >
ffff88025ad1f300 577271036 S Co:1:042:0 s 21 09 0300 0000 0008 8 = c2c3bd8c 87f34ae5
ffff88025ad1f300 577271212 C Co:1:042:0 0 8 >
ffff880406987000 577288001 S Co:1:042:0 s 21 09 0300 0000 0008 8 = a4e23d66 47598a08
ffff880406987000 577288083 C Co:1:042:0 0 8 >
ffff880406987000 577303025 S Co:1:042:0 s 21 09 0300 0000 0008 8 = c9679a86 1174c812
ffff880406987000 577303225 C Co:1:042:0 0 8 >
ffff880406940cc0 577317998 S Co:1:042:0 s 21 09 0300 0000 0008 8 = 2c831a38 2ac74112
ffff880406940cc0 577318110 C Co:1:042:0 0 8 >
ffff88025ad1f300 577333597 S Co:1:042:0 s 21 09 0300 0000 0008 8 = 3b6ad3ad 0b99c7bc
ffff88025ad1f300 577333717 C Co:1:042:0 0 8 >
ffff880406940cc0 577350070 S Co:1:042:0 s 21 09 0300 0000 0008 8 = 5bd3317c e07340e7
ffff880406940cc0 577350210 C Co:1:042:0 0 8 >
ffff880406987000 577365008 S Co:1:042:0 s 21 09 0300 0000 0008 8 = 607c751c 0ba5250e
ffff880406987000 577365211 C Co:1:042:0 0 8 >
ffff880406940cc0 577382037 S Co:1:042:0 s 21 09 0300 0000 0008 8 = 17a5326c a0c106d1
ffff880406940cc0 577382275 C Co:1:042:0 0 8 >
ffff880406940cc0 577397079 S Co:1:042:0 s 21 09 0300 0000 0008 8 = bf93d02d e81c0374
ffff880406940cc0 577397212 C Co:1:042:0 0 8 >
ffff880406987000 577411974 S Co:1:042:0 s 21 09 0300 0000 0008 8 = 890d0b85 e152525c
ffff880406987000 577412107 C Co:1:042:0 0 8 >
ffff880406940cc0 577427019 S Co:1:042:0 s 21 09 0300 0000 0008 8 = 1ee0737c bac0be97
ffff880406940cc0 577427212 C Co:1:042:0 0 8 >
ffff880406987000 577443134 S Co:1:042:0 s 21 09 0300 0000 0008 8 = 175cec80 590a2454
ffff880406987000 577443342 C Co:1:042:0 0 8 >
ffff8804033a50c0 577459950 S Co:1:042:0 s 21 09 0300 0000 0008 8 = 84d62ee3 d795f564
ffff8804033a50c0 577460092 C Co:1:042:0 0 8 >
ffff88025ad1f180 577474007 S Co:1:042:0 s 21 09 0300 0000 0008 8 = 6827435a 010bb9c1
ffff88025ad1f180 577474246 C Co:1:042:0 0 8 >
ffff8804033a50c0 577490047 S Co:1:042:0 s 21 09 0300 0000 0008 8 = 3a2a0e7e d7dc8906
ffff8804033a50c0 577490213 C Co:1:042:0 0 8 >
ffff88025ad1f180 577506970 S Co:1:042:0 s 21 09 0300 0000 0008 8 = 633fc04d 0eba92f1
ffff88025ad1f180 577507090 C Co:1:042:0 0 8 >
ffff88025ad1f180 577520977 S Co:1:042:0 s 21 09 0300 0000 0008 8 = c4cd63a7 901b97e6
ffff88025ad1f180 577521110 C Co:1:042:0 0 8 >
ffff880406987000 577538046 S Co:1:042:0 s 21 09 0300 0000 0008 8 = 30b951d3 f8b96d6d
ffff880406987000 577538212 C Co:1:042:0 0 8 >
ffff880406987000 577553066 S Co:1:042:0 s 21 09 0300 0000 0008 8 = ecf2bcfa 19137fb1
ffff880406987000 577553222 C Co:1:042:0 0 8 >
ffff8804033a5000 577567963 S Co:1:042:0 s 21 09 0300 0000 0008 8 = 34e726a9 76ea4a02
ffff8804033a5000 577568100 C Co:1:042:0 0 8 >
ffff880406987240 577584020 S Co:1:042:0 s 21 09 0300 0000 0008 8 = b70de852 c9c7df52
ffff880406987240 577584222 C Co:1:042:0 0 8 >
ffff880406987240 577599047 S Co:1:042:0 s 21 09 0300 0000 0008 8 = 175dadc9 7f7266b9
ffff880406987240 577599216 C Co:1:042:0 0 8 >
ffff8803e6ff2d80 577614107 S Co:1:042:0 s 21 09 0300 0000 0008 8 = 6cd1f6c8 387a98f2
ffff8803e6ff2d80 577614227 C Co:1:042:0 0 8 >
ffff8803d5424300 577629998 S Co:1:042:0 s 21 09 0300 0000 0008 8 = c1ec956e 49b242dd
ffff8803d5424300 577630091 C Co:1:042:0 0 8 >
ffff8803d5424300 577645320 S Co:1:042:0 s 21 09 0300 0000 0008 8 = 933134ba 3cb0c7fe
ffff8803d5424300 577645463 C Co:1:042:0 0 8 >
ffff8803d5424300 577662090 S Co:1:042:0 s 21 09 0300 0000 0008 8 = 57a8ce12 4d4e9cfb
ffff8803d5424300 577662218 C Co:1:042:0 0 8 >
ffff8803d5424300 577676980 S Co:1:042:0 s 21 09 0300 0000 0008 8 = f35f33c1 ec2bcb20
ffff8803d5424300 577677113 C Co:1:042:0 0 8 >
ffff8803d5424300 577692008 S Co:1:042:0 s 21 09 0300 0000 0008 8 = 42e58772 402973dc
ffff8803d5424300 577692112 C Co:1:042:0 0 8 >
ffff880406987240 577709069 S Co:1:042:0 s 21 09 0300 0000 0008 8 = 92cfc1b8 a0ef4443
ffff880406987240 577709216 C Co:1:042:0 0 8 >
ffff8804033a5a80 577723960 S Co:1:042:0 s 21 09 0300 0000 0008 8 = 28352e88 1a66068c
ffff8804033a5a80 577724100 C Co:1:042:0 0 8 >
ffff880406987240 577738944 S Co:1:042:0 s 21 09 0300 0000 0008 8 = b833edbb ee3e1292
ffff880406987240 577739108 C Co:1:042:0 0 8 >
ffff8804033a5a80 577754989 S Co:1:042:0 s 21 09 0300 0000 0008 8 = ef6a728f 1268d556
ffff8804033a5a80 577755088 C Co:1:042:0 0 8 >
ffff880406987d80 577771908 S Co:1:042:0 s 21 09 0300 0000 0008 8 = ec7f0524 ae9b5179
ffff880406987d80 577772102 C Co:1:042:0 0 8 >
ffff880406940000 577787000 S Co:1:042:0 s 21 09 0300 0000 0008 8 = c0994301 9ed29dc4
ffff880406940000 577787101 C Co:1:042:0 0 8 >
ffff8804033a5a80 577802047 S Co:1:042:0 s 21 09 0300 0000 0008 8 = f4e69a8f f5ca63a2
ffff8804033a5a80 577802218 C Co:1:042:0 0 8 >
ffff8804033a5a80 577817070 S Co:1:042:0 s 21 09 0300 0000 0008 8 = 0115cf9b 77875fa2
ffff8804033a5a80 577817217 C Co:1:042:0 0 8 >
ffff88025ad1f300 577834003 S Co:1:042:0 s 21 09 0300 0000 0008 8 = d7da7ad7 1ccde5f8
ffff88025ad1f300 577834116 C Co:1:042:0 0 8 >
ffff880406987d80 577849035 S Co:1:042:0 s 21 09 0300 0000 0008 8 = 596f8657 92a959fb
ffff880406987d80 577849218 C Co:1:042:0 0 8 >
ffff880406987d80 577864098 S Co:1:042:0 s 21 09 0300 0000 0008 8 = dd0fb316 bae8b7a7
ffff880406987d80 577864217 C Co:1:042:0 0 8 >
ffff8804069406c0 577880981 S Co:1:042:0 s 21 09 0300 0000 0008 8 = af7b1670 289d0b1a
ffff8804069406c0 577881099 C Co:1:042:0 0 8 >
ffff88025ad1f300 577896008 S Co:1:042:0 s 21 09 0300 0000 0008 8 = 8d7896a7 a49df719
ffff88025ad1f300 577896099 C Co:1:042:0 0 8 >
ffff88025ad1f300 577911048 S Co:1:042:0 s 21 09 0300 0000 0008 8 = 2a4d6e61 ae04328a
ffff88025ad1f300 577911237 C Co:1:042:0 0 8 >
ffff88025ad1f300 577927905 S Co:1:042:0 s 21 09 0300 0000 0008 8 = ad47b026 f4af06f9
ffff88025ad1f300 577928108 C Co:1:042:0 0 8 >
ffff880406987240 577942943 S Co:1:042:0 s 21 09 0300 0000 0008 8 = 3137bee5 dbc2cf15
ffff880406987240 577943089 C Co:1:042:0 0 8 >
ffff880406987240 577957998 S Co:1:042:0 s 21 09 0300 0000 0008 8 = 45f0d16e fe228132
ffff880406987240 577958234 C Co:1:042:0 0 8 >
ffff8804033a5b40 577975107 S Co:1:042:0 s 21 09 0300 0000 0008 8 = 6ccb75f6 a8fa20c7
ffff8804033a5b40 577975248 C Co:1:042:0 0 8 >
ffff8804033a5b40 577990013 S Co:1:042:0 s 21 09 0300 0000 0008 8 = 9c250999 5b3847f0
ffff8804033a5b40 577990225 C Co:1:042:0 0 8 >
ffff88025ad1fd80 578005298 S Co:1:042:0 s 21 09 0300 0000 0008 8 = c0de41d1 4b0fa4eb
ffff88025ad1fd80 578005528 C Co:1:042:0 0 8 >
ffff8804069870c0 578020322 S Co:1:042:0 s 21 09 0300 0000 0008 8 = 38dba502 e175799d
ffff8804069870c0 578020469 C Co:1:042:0 0 8 >
ffff8804069870c0 578038193 S Co:1:042:0 s 21 09 0300 0000 0008 8 = 568211f0 3aa41a0c
ffff8804069870c0 578038358 C Co:1:042:0 0 8 >
ffff8804033a5b40 578053250 S Co:1:042:0 s 21 09 0300 0000 0008 8 = e0423545 a79b74e4
ffff8804033a5b40 578053359 C Co:1:042:0 0 8 >
ffff8804033a50c0 578068314 S Co:1:042:0 s 21 09 0300 0000 0008 8 = 930b150e 2d9c82f4
ffff8804033a50c0 578068490 C Co:1:042:0 0 8 >
ffff8804033a5b40 578083162 S Co:1:042:0 s 21 09 0300 0000 0008 8 = 9dd0883d 05add7b0
ffff8804033a5b40 578083340 C Co:1:042:0 0 8 >
ffff8804033a5b40 578099197 S Co:1:042:0 s 21 09 0300 0000 0008 8 = 200abb26 1b191aaf
ffff8804033a5b40 578099359 C Co:1:042:0 0 8 >
ffff8804033a50c0 578114296 S Co:1:042:0 s 21 09 0300 0000 0008 8 = b336ae04 91ef832d
ffff8804033a50c0 578114490 C Co:1:042:0 0 8 >
ffff88025ad1f180 578131292 S Co:1:042:0 s 21 09 0300 0000 0008 8 = e254b373 3b806188
ffff88025ad1f180 578131465 C Co:1:042:0 0 8 >
ffff88025ad1f180 578146248 S Co:1:042:0 s 21 09 0300 0000 0008 8 = ac68f4f5 22e395c5
ffff88025ad1f180 578146354 C Co:1:042:0 0 8 >
ffff88025ad1f180 578161295 S Co:1:042:0 s 21 09 0300 0000 0008 8 = 02faeb70 0372160a
ffff88025ad1f180 578161469 C Co:1:042:0 0 8 >
ffff880406940cc0 578178337 S Co:1:042:0 s 21 09 0300 0000 0008 8 = 4d98eaad d04d6d23
ffff880406940cc0 578178492 C Co:1:042:0 0 8 >
ffff880406940cc0 578193239 S Co:1:042:0 s 21 09 0300 0000 0008 8 = e65193d8 2cd43800
ffff880406940cc0 578193345 C Co:1:042:0 0 8 >
ffff880406940c00 578208325 S Co:1:042:0 s 21 09 0300 0000 0008 8 = 9d3a5f04 f12eaa33
ffff880406940c00 578208473 C Co:1:042:0 0 8 >
ffff880406940000 578225273 S Co:1:042:0 s 21 09 0300 0000 0008 8 = 35eb19a6 abc70774
ffff880406940000 578225478 C Co:1:042:0 0 8 >
ffff88020f0f1480 578240164 S Co:1:042:0 s 21 09 0300 0000 0008 8 = e4016217 1ccc2a1e
ffff88020f0f1480 578240361 C Co:1:042:0 0 8 >
ffff88020f0f1480 578255203 S Co:1:042:0 s 21 09 0300 0000 0008 8 = d69b2d15 b8af01b2
ffff88020f0f1480 578255342 C Co:1:042:0 0 8 >
ffff88020f0f1480 578272318 S Co:1:042:0 s 21 09 0300 0000 0008 8 = a9df4241 29a70d51
ffff88020f0f1480 578272471 C Co:1:042:0 0 8 >
ffff88020f0f1480 578287232 S Co:1:042:0 s 21 09 0300 0000 0008 8 = f075bda0 ca2fe545
ffff88020f0f1480 578287370 C Co:1:042:0 0 8 >
ffff88020f0f1480 578318318 S Co:1:042:0 s 21 09 0300 0000 0008 8 = 55036f82 4f38d001
ffff88020f0f1480 578318478 C Co:1:042:0 0 8 >
ffff88020f0f1480 578349244 S Ci:1:042:0 s a1 01 0300 0000 0008 8 <
ffff88020f0f1480 578349349 C Ci:1:042:0 0 8 = aa040000 00000000
ffff880403862b40 588631874 S Co:1:042:0 s 21 09 0300 0000 0008 8 = 55010100 00ff075d
ffff880403862b40 588632061 C Co:1:042:0 0 8 >
ffff880406987c00 588661767 S Ci:1:042:0 s a1 01 0300 0000 0008 8 <
ffff880406987c00 588661931 C Ci:1:042:0 0 8 = aa020000 00000000
ffff880406940cc0 588692701 S Co:1:042:0 s 21 09 0300 0000 0008 8 = 0b010101 00000e04
ffff880406940cc0 588692818 C Co:1:042:0 0 8 >
ffff8803e300a600 588709743 S Co:1:042:0 s 21 09 0300 0000 0008 8 = 2797d290 0fc5cfce
ffff8803e300a600 588709930 C Co:1:042:0 0 8 >
ffff8803e300acc0 588723780 S Co:1:042:0 s 21 09 0300 0000 0008 8 = 01809200 15ff47ff
ffff8803e300acc0 588723956 C Co:1:042:0 0 8 >
ffff880406940cc0 588739642 S Co:1:042:0 s 21 09 0300 0000 0008 8 = c7ff37ff 87ff87ff
ffff880406940cc0 588739806 C Co:1:042:0 0 8 >
ffff880406940b40 588754839 S Co:1:042:0 s 21 09 0300 0000 0008 8 = 37ff87ff d7ffa7ff
ffff880406940b40 588754954 C Co:1:042:0 0 8 >
ffff8803e300acc0 588772793 S Co:1:042:0 s 21 09 0300 0000 0008 8 = 87ffd7ff 97ff17ff
ffff8803e300acc0 588772957 C Co:1:042:0 0 8 >
ffff880406987240 588787637 S Co:1:042:0 s 21 09 0300 0000 0008 8 = 37ff57ff b7ffd7ff
ffff880406987240 588787826 C Co:1:042:0 0 8 >
ffff880406987240 588802669 S Co:1:042:0 s 21 09 0300 0000 0008 8 = 97ff57ff 07ff77ff
ffff880406987240 588802825 C Co:1:042:0 0 8 >
ffff880406987180 588817765 S Co:1:042:0 s 21 09 0300 0000 0008 8 = 37ff87ff d7ff97ff
ffff880406987180 588817934 C Co:1:042:0 0 8 >
ffff8803e300acc0 588833303 S Co:1:042:0 s 21 09 0300 0000 0008 8 = 77ffa7ff b7ff47ff
ffff8803e300acc0 588833450 C Co:1:042:0 0 8 >
ffff8803e300a3c0 588849664 S Co:1:042:0 s 21 09 0300 0000 0008 8 = 37ffd7ff 27ff47ff
ffff8803e300a3c0 588849826 C Co:1:042:0 0 8 >
ffff8803e300acc0 588864697 S Co:1:042:0 s 21 09 0300 0000 0008 8 = e7fff7ff d7ffa7ff
ffff8803e300acc0 588864830 C Co:1:042:0 0 8 >
ffff8803d5424e40 588880135 S Co:1:042:0 s 21 09 0300 0000 0008 8 = 27ffa7ff 47ff87ff
ffff8803d5424e40 588880332 C Co:1:042:0 0 8 >
ffff880406987180 588895732 S Co:1:042:0 s 21 09 0300 0000 0008 8 = 97fff7ff 17ff87ff
ffff880406987180 588895947 C Co:1:042:0 0 8 >
ffff880406940b40 588913762 S Co:1:042:0 s 21 09 0300 0000 0008 8 = 87ffe7ff 57ffa7ff
ffff880406940b40 588913935 C Co:1:042:0 0 8 >
ffff88025ad1fe40 588926794 S Co:1:042:0 s 21 09 0300 0000 0008 8 = 47ff87ff 57ff77ff
ffff88025ad1fe40 588926935 C Co:1:042:0 0 8 >
ffff88025ad1f540 588943645 S Co:1:042:0 s 21 09 0300 0000 0008 8 = e7ff37ff 67ff37ff
ffff88025ad1f540 588943840 C Co:1:042:0 0 8 >
ffff880406987180 588960754 S Co:1:042:0 s 21 09 0300 0000 0008 8 = 87ff07ff 27ffe7ff
ffff880406987180 588960960 C Co:1:042:0 0 8 >
ffff88025ad1f540 588973782 S Co:1:042:0 s 21 09 0300 0000 0008 8 = 57ff97ff c7ff87ff
ffff88025ad1f540 588973935 C Co:1:042:0 0 8 >
ffff88025ad1f180 588990822 S Co:1:042:0 s 21 09 0300 0000 0008 8 = 37ffe7ff 17ffb7ff
ffff88025ad1f180 588990936 C Co:1:042:0 0 8 >
ffff88025ad1f540 589005721 S Co:1:042:0 s 21 09 0300 0000 0008 8 = c7ffc7ff d7ffe7ff
ffff88025ad1f540 589005840 C Co:1:042:0 0 8 >
ffff88025ad1f540 589020870 S Co:1:042:0 s 21 09 0300 0000 0008 8 = f7ff37ff 87ffd7ff
ffff88025ad1f540 589021063 C Co:1:042:0 0 8 >
ffff88025ad1f540 589036803 S Co:1:042:0 s 21 09 0300 0000 0008 8 = d7ff07ff 37ff97ff
ffff88025ad1f540 589036937 C Co:1:042:0 0 8 >
ffff880403862480 589054698 S Co:1:042:0 s 21 09 0300 0000 0008 8 = a7ff07ff d7ff87ff
ffff880403862480 589054868 C Co:1:042:0 0 8 >
ffff880403862480 589067798 S Co:1:042:0 s 21 09 0300 0000 0008 8 = 17ff27ff 77ffd7ff
ffff880403862480 589067938 C Co:1:042:0 0 8 >
ffff880403862e40 589083760 S Co:1:042:0 s 21 09 0300 0000 0008 8 = f7ff17ff 27ff07ff
ffff880403862e40 589083938 C Co:1:042:0 0 8 >
ffff880406987a80 589099655 S Co:1:042:0 s 21 09 0300 0000 0008 8 = a7ff97ff 97ffc7ff
ffff880406987a80 589099814 C Co:1:042:0 0 8 >
ffff880406987b40 589114641 S Co:1:042:0 s 21 09 0300 0000 0008 8 = c7ff17ff a7ff17ff
ffff880406987b40 589114828 C Co:1:042:0 0 8 >
ffff880406987b40 589131744 S Co:1:042:0 s 21 09 0300 0000 0008 8 = a7ff67ff 67ffa7ff
ffff880406987b40 589131939 C Co:1:042:0 0 8 >
ffff880406987b40 589146582 S Co:1:042:0 s 21 09 0300 0000 0008 8 = b7ff87ff 37ff57ff
ffff880406987b40 589146684 C Co:1:042:0 0 8 >
ffff88025ad1f000 589161634 S Co:1:042:0 s 21 09 0300 0000 0008 8 = a7ff17ff 37ff57ff
ffff88025ad1f000 589161829 C Co:1:042:0 0 8 >
ffff88025ad1f480 589176657 S Co:1:042:0 s 21 09 0300 0000 0008 8 = d7ffa7ff c7fff7ff
ffff88025ad1f480 589176829 C Co:1:042:0 0 8 >
ffff8804069406c0 589192691 S Co:1:042:0 s 21 09 0300 0000 0008 8 = 57ffd7ff 07ff17ff
ffff8804069406c0 589192810 C Co:1:042:0 0 8 >
ffff88025ad1f480 589207606 S Co:1:042:0 s 21 09 0300 0000 0008 8 = c7ffa7ff 17fff7ff
ffff88025ad1f480 589207685 C Co:1:042:0 0 8 >
ffff88025ad1f480 589224684 S Co:1:042:0 s 21 09 0300 0000 0008 8 = d7ff57ff 77c3997a
ffff88025ad1f480 589224811 C Co:1:042:0 0 8 >
ffff88025ad1f480 589239745 S Co:1:042:0 s 21 09 0300 0000 0008 8 = dde96501 e25ff5d9
ffff88025ad1f480 589239938 C Co:1:042:0 0 8 >
ffff88025ad1f480 589254897 S Co:1:042:0 s 21 09 0300 0000 0008 8 = 82449f98 1db7e57f
ffff88025ad1f480 589255072 C Co:1:042:0 0 8 >
ffff88025ad1f480 589271701 S Co:1:042:0 s 21 09 0300 0000 0008 8 = 9af740b4 d8c12fbe
ffff88025ad1f480 589271836 C Co:1:042:0 0 8 >
ffff880406987d80 589286930 S Co:1:042:0 s 21 09 0300 0000 0008 8 = 58e78041 282ddefc
ffff880406987d80 589287188 C Co:1:042:0 0 8 >
ffff8803e300a840 589301766 S Co:1:042:0 s 21 09 0300 0000 0008 8 = 12699c00 06dac133
ffff8803e300a840 589301939 C Co:1:042:0 0 8 >
ffff880406940600 589318691 S Co:1:042:0 s 21 09 0300 0000 0008 8 = c5c85404 d05de970
ffff880406940600 589318824 C Co:1:042:0 0 8 >
ffff8804069406c0 589333696 S Co:1:042:0 s 21 09 0300 0000 0008 8 = 90c36c36 c6802d56
ffff8804069406c0 589333812 C Co:1:042:0 0 8 >
ffff88025ad1f480 589348696 S Co:1:042:0 s 21 09 0300 0000 0008 8 = 360e2cd0 90bea79b
ffff88025ad1f480 589348812 C Co:1:042:0 0 8 >
ffff88025ad1f480 589365676 S Co:1:042:0 s 21 09 0300 0000 0008 8 = 9fcfe2e3 b4ca3687
ffff88025ad1f480 589365849 C Co:1:042:0 0 8 >
ffff880406987d80 589380715 S Co:1:042:0 s 21 09 0300 0000 0008 8 = 55205dd3 2207fc7a
ffff880406987d80 589380862 C Co:1:042:0 0 8 >
ffff880406987d80 589395741 S Co:1:042:0 s 21 09 0300 0000 0008 8 = 099172d8 ab0fe065
ffff880406987d80 589395973 C Co:1:042:0 0 8 >
ffff880406940600 589412647 S Co:1:042:0 s 21 09 0300 0000 0008 8 = 0da5797d 832f0b4e
ffff880406940600 589412837 C Co:1:042:0 0 8 >
ffff88025ad1f0c0 589427721 S Co:1:042:0 s 21 09 0300 0000 0008 8 = da53cf22 c5e76dcf
ffff88025ad1f0c0 589427817 C Co:1:042:0 0 8 >
ffff88025ad1f0c0 589442678 S Co:1:042:0 s 21 09 0300 0000 0008 8 = 8a85537b ed6c3796
ffff88025ad1f0c0 589442813 C Co:1:042:0 0 8 >
ffff880406987d80 589459641 S Co:1:042:0 s 21 09 0300 0000 0008 8 = 5d9aeb11 5e2861e3
ffff880406987d80 589459836 C Co:1:042:0 0 8 >
ffff880406940600 589474692 S Co:1:042:0 s 21 09 0300 0000 0008 8 = 36e5febf db36230f
ffff880406940600 589474820 C Co:1:042:0 0 8 >
ffff8803e300a240 589489278 S Co:1:042:0 s 21 09 0300 0000 0008 8 = 1d2efa34 10e97e02
ffff8803e300a240 589489439 C Co:1:042:0 0 8 >
ffff880406987d80 589506289 S Co:1:042:0 s 21 09 0300 0000 0008 8 = bc2ecd76 0844b2b9
ffff880406987d80 589506463 C Co:1:042:0 0 8 >
ffff880406987d80 589521302 S Co:1:042:0 s 21 09 0300 0000 0008 8 = e4156e5b b682c7c8
ffff880406987d80 589521463 C Co:1:042:0 0 8 >
ffff880406987d80 589536311 S Co:1:042:0 s 21 09 0300 0000 0008 8 = 0805540f 6f8d07d4
ffff880406987d80 589536439 C Co:1:042:0 0 8 >
ffff880406940240 589552359 S Co:1:042:0 s 21 09 0300 0000 0008 8 = be97fb93 6c898017
ffff880406940240 589552443 C Co:1:042:0 0 8 >
ffff880406940000 589567250 S Co:1:042:0 s 21 09 0300 0000 0008 8 = 4353643a 4b4884de
ffff880406940000 589567438 C Co:1:042:0 0 8 >
ffff880406940000 589585329 S Co:1:042:0 s 21 09 0300 0000 0008 8 = f63a942c 8dd52b0c
ffff880406940000 589585454 C Co:1:042:0 0 8 >
ffff8803e300a240 589598364 S Co:1:042:0 s 21 09 0300 0000 0008 8 = da3e12e5 17ecce96
ffff8803e300a240 589598566 C Co:1:042:0 0 8 >
ffff88025ad1fd80 589614196 S Co:1:042:0 s 21 09 0300 0000 0008 8 = 17c66bb5 b37e8b07
ffff88025ad1fd80 589614314 C Co:1:042:0 0 8 >
ffff880406987d80 589630242 S Co:1:042:0 s 21 09 0300 0000 0008 8 = 772db040 8e2fc6fc
ffff880406987d80 589630447 C Co:1:042:0 0 8 >
ffff8804069873c0 589645282 S Co:1:042:0 s 21 09 0300 0000 0008 8 = eb41f4fd badaa4a6
ffff8804069873c0 589645458 C Co:1:042:0 0 8 >
ffff8803e300a9c0 589663401 S Co:1:042:0 s 21 09 0300 0000 0008 8 = 06c7d1b9 ab0a904d
ffff8803e300a9c0 589663569 C Co:1:042:0 0 8 >
ffff8803e300af00 589678302 S Co:1:042:0 s 21 09 0300 0000 0008 8 = 7ef3e213 bc80b9ca
ffff8803e300af00 589678443 C Co:1:042:0 0 8 >
ffff8803e300af00 589693338 S Co:1:042:0 s 21 09 0300 0000 0008 8 = b1f348ff a9b28f0a
ffff8803e300af00 589693441 C Co:1:042:0 0 8 >
ffff8803e300a9c0 589708392 S Co:1:042:0 s 21 09 0300 0000 0008 8 = 1b632746 14484b90
ffff8803e300a9c0 589708576 C Co:1:042:0 0 8 >
ffff8803e300af00 589723362 S Co:1:042:0 s 21 09 0300 0000 0008 8 = e3d82802 039f66f1
ffff8803e300af00 589723569 C Co:1:042:0 0 8 >
ffff8803a01729c0 589740300 S Co:1:042:0 s 21 09 0300 0000 0008 8 = 4d57f725 5f481f57
ffff8803a01729c0 589740456 C Co:1:042:0 0 8 >
ffff8803a01729c0 589755298 S Co:1:042:0 s 21 09 0300 0000 0008 8 = 47ddc5f1 7487f801
ffff8803a01729c0 589755453 C Co:1:042:0 0 8 >
ffff8803a01729c0 589770349 S Co:1:042:0 s 21 09 0300 0000 0008 8 = dfd7c57e 75d738c0
ffff8803a01729c0 589770455 C Co:1:042:0 0 8 >
ffff8803a01729c0 589787289 S Co:1:042:0 s 21 09 0300 0000 0008 8 = c8a9b03a f763687a
ffff8803a01729c0 589787454 C Co:1:042:0 0 8 >
ffff8803a01729c0 589802344 S Co:1:042:0 s 21 09 0300 0000 0008 8 = db2a4362 738dd8a8
ffff8803a01729c0 589802454 C Co:1:042:0 0 8 >
ffff8803a01729c0 589817383 S Co:1:042:0 s 21 09 0300 0000 0008 8 = 9223be8c c76819d9
ffff8803a01729c0 589817617 C Co:1:042:0 0 8 >
ffff8803a01729c0 589834254 S Co:1:042:0 s 21 09 0300 0000 0008 8 = 8dd6651f b440822f
ffff8803a01729c0 589834441 C Co:1:042:0 0 8 >
ffff8803a01729c0 589849299 S Co:1:042:0 s 21 09 0300 0000 0008 8 = 0f7301d7 5f0faddf
ffff8803a01729c0 589849459 C Co:1:042:0 0 8 >
ffff8803a01729c0 589864381 S Co:1:042:0 s 21 09 0300 0000 0008 8 = 80a25d44 d207fab3
ffff8803a01729c0 589864592 C Co:1:042:0 0 8 >
ffff8803a01729c0 589880320 S Co:1:042:0 s 21 09 0300 0000 0008 8 = ebfecc49 7b0d098a
ffff8803a01729c0 589880443 C Co:1:042:0 0 8 >
ffff8803a01729c0 589895429 S Co:1:042:0 s 21 09 0300 0000 0008 8 = 7f96a09f a93942d5
ffff8803a01729c0 589895565 C Co:1:042:0 0 8 >
ffff8803a01729c0 589911314 S Co:1:042:0 s 21 09 0300 0000 0008 8 = 0f6db252 145a4e19
ffff8803a01729c0 589911442 C Co:1:042:0 0 8 >
ffff8803a01729c0 589929290 S Co:1:042:0 s 21 09 0300 0000 0008 8 = 94f9de41 536e9d71
ffff8803a01729c0 589929454 C Co:1:042:0 0 8 >
ffff8803a01729c0 589942417 S Co:1:042:0 s 21 09 0300 0000 0008 8 = a8a586a0 662ce00b
ffff8803a01729c0 589942576 C Co:1:042:0 0 8 >
ffff8803a01729c0 589958353 S Co:1:042:0 s 21 09 0300 0000 0008 8 = 0b510d77 2c7d8fa9
ffff8803a01729c0 589958476 C Co:1:042:0 0 8 >
ffff8803a01729c0 589974406 S Co:1:042:0 s 21 09 0300 0000 0008 8 = 20cf5b23 ecfc6320
ffff8803a01729c0 589974590 C Co:1:042:0 0 8 >
ffff8803a01729c0 589989230 S Co:1:042:0 s 21 09 0300 0000 0008 8 = 6f665ed2 cf7bdada
ffff8803a01729c0 589989343 C Co:1:042:0 0 8 >
ffff8803a01729c0 590007363 S Co:1:042:0 s 21 09 0300 0000 0008 8 = 23518509 617fb856
ffff8803a01729c0 590007502 C Co:1:042:0 0 8 >
ffff8803a01729c0 590022340 S Co:1:042:0 s 21 09 0300 0000 0008 8 = 8b3f451f 15c182a4
ffff8803a01729c0 590022442 C Co:1:042:0 0 8 >
ffff88025ad1fd80 590037324 S Co:1:042:0 s 21 09 0300 0000 0008 8 = 9ad295c1 c0ae03ec
ffff88025ad1fd80 590037474 C Co:1:042:0 0 8 >
ffff88025ad1fd80 590052319 S Co:1:042:0 s 21 09 0300 0000 0008 8 = 6922746f 1ce6c9e6
ffff88025ad1fd80 590052477 C Co:1:042:0 0 8 >
ffff88025ad1f540 590067634 S Co:1:042:0 s 21 09 0300 0000 0008 8 = b23960fb 45bea661
ffff88025ad1f540 590067821 C Co:1:042:0 0 8 >
ffff8804069406c0 590083271 S Co:1:042:0 s 21 09 0300 0000 0008 8 = 5596df0f 3dbf32bf
ffff8804069406c0 590083446 C Co:1:042:0 0 8 >
ffff8803e300af00 590099328 S Co:1:042:0 s 21 09 0300 0000 0008 8 = d5adf8a6 69274675
ffff8803e300af00 590099467 C Co:1:042:0 0 8 >
ffff88025ad1f540 590114357 S Co:1:042:0 s 21 09 0300 0000 0008 8 = da63b88f 1365818d
ffff88025ad1f540 590114469 C Co:1:042:0 0 8 >
ffff880406987000 590130195 S Co:1:042:0 s 21 09 0300 0000 0008 8 = af95b0f0 e89fc525
ffff880406987000 590130317 C Co:1:042:0 0 8 >
ffff8803e300af00 590147294 S Co:1:042:0 s 21 09 0300 0000 0008 8 = c39074bf 7a2eb8f0
ffff8803e300af00 590147445 C Co:1:042:0 0 8 >
ffff880406940000 590161285 S Co:1:042:0 s 21 09 0300 0000 0008 8 = 2a981b48 bd1f45b2
ffff880406940000 590161444 C Co:1:042:0 0 8 >
ffff8803e300a240 590177346 S Co:1:042:0 s 21 09 0300 0000 0008 8 = 1a63c4ac 8cb21ac6
ffff8803e300a240 590177463 C Co:1:042:0 0 8 >
ffff880406987a80 590194284 S Co:1:042:0 s 21 09 0300 0000 0008 8 = 719d0d5e 24dc2a9a
ffff880406987a80 590194447 C Co:1:042:0 0 8 >
ffff8803e300a240 590209324 S Co:1:042:0 s 21 09 0300 0000 0008 8 = 2c649ba6 a5c72b2f
ffff8803e300a240 590209468 C Co:1:042:0 0 8 >
ffff88025ad1f0c0 590224392 S Co:1:042:0 s 21 09 0300 0000 0008 8 = efcc9720 964e189c
ffff88025ad1f0c0 590224593 C Co:1:042:0 0 8 >
ffff880406987a80 590240297 S Co:1:042:0 s 21 09 0300 0000 0008 8 = 825a2d3c 6084ae8a
ffff880406987a80 590240465 C Co:1:042:0 0 8 >
ffff88025ad1f0c0 590255256 S Co:1:042:0 s 21 09 0300 0000 0008 8 = 4f8a0ebe cf2cf0b8
ffff88025ad1f0c0 590255475 C Co:1:042:0 0 8 >
ffff880406940000 590271290 S Co:1:042:0 s 21 09 0300 0000 0008 8 = e74bed3d 9641a476
ffff880406940000 590271462 C Co:1:042:0 0 8 >
ffff8803a01729c0 590289295 S Co:1:042:0 s 21 09 0300 0000 0008 8 = 7d7f04a6 cb6dd62b
ffff8803a01729c0 590289448 C Co:1:042:0 0 8 >
ffff8803a01729c0 590301229 S Co:1:042:0 s 21 09 0300 0000 0008 8 = 687f8eb8 659353d1
ffff8803a01729c0 590301336 C Co:1:042:0 0 8 >
ffff8803a01729c0 590317366 S Co:1:042:0 s 21 09 0300 0000 0008 8 = a3934c88 c3482d76
ffff8803a01729c0 590317449 C Co:1:042:0 0 8 >
ffff8803a01729c0 590333391 S Co:1:042:0 s 21 09 0300 0000 0008 8 = 4e7c02fc 26543bbb
ffff8803a01729c0 590333595 C Co:1:042:0 0 8 >
ffff8803a01729c0 590350729 S Co:1:042:0 s 21 09 0300 0000 0008 8 = 2decf952 33339857
ffff8803a01729c0 590350843 C Co:1:042:0 0 8 >
ffff880406940000 590365238 S Co:1:042:0 s 21 09 0300 0000 0008 8 = 250a7d98 74982193
ffff880406940000 590365461 C Co:1:042:0 0 8 >
ffff880406987b40 590379875 S Co:1:042:0 s 21 09 0300 0000 0008 8 = c4f05e33 d7e7f9cd
ffff880406987b40 590380089 C Co:1:042:0 0 8 >
ffff880406987b40 590395781 S Co:1:042:0 s 21 09 0300 0000 0008 8 = b82f715b 2bb807f8
ffff880406987b40 590395949 C Co:1:042:0 0 8 >
ffff88025ad1f0c0 590410874 S Co:1:042:0 s 21 09 0300 0000 0008 8 = 55480e9b a8597518
ffff88025ad1f0c0 590410950 C Co:1:042:0 0 8 >
ffff88025ad1f0c0 590429017 S Co:1:042:0 s 21 09 0300 0000 0008 8 = 12339254 664a31c8
ffff88025ad1f0c0 590429199 C Co:1:042:0 0 8 >
ffff880406987b40 590442822 S Co:1:042:0 s 21 09 0300 0000 0008 8 = 0adadd39 e2c16db5
ffff880406987b40 590442971 C Co:1:042:0 0 8 >
ffff880406987b40 590458081 S Co:1:042:0 s 21 09 0300 0000 0008 8 = 7d9cd3d2 7f262123
ffff880406987b40 590458197 C Co:1:042:0 0 8 >
ffff880406987b40 590473917 S Co:1:042:0 s 21 09 0300 0000 0008 8 = 4ecddcfb 01968665
ffff880406987b40 590474099 C Co:1:042:0 0 8 >
ffff880406940b40 590490945 S Co:1:042:0 s 21 09 0300 0000 0008 8 = 85336663 11629a67
ffff880406940b40 590491074 C Co:1:042:0 0 8 >
ffff8803e300a240 590504850 S Co:1:042:0 s 21 09 0300 0000 0008 8 = cd886010 be8ea126
ffff8803e300a240 590504973 C Co:1:042:0 0 8 >
ffff8803e300a240 590521902 S Co:1:042:0 s 21 09 0300 0000 0008 8 = f5fcbfd8 f955a035
ffff8803e300a240 590522077 C Co:1:042:0 0 8 >
ffff880406940b40 590535957 S Co:1:042:0 s 21 09 0300 0000 0008 8 = 71b2fbe8 16a2e238
ffff880406940b40 590536202 C Co:1:042:0 0 8 >
ffff880406987b40 590551823 S Co:1:042:0 s 21 09 0300 0000 0008 8 = d841913f 4f967569
ffff880406987b40 590551950 C Co:1:042:0 0 8 >
ffff880406987b40 590568896 S Co:1:042:0 s 21 09 0300 0000 0008 8 = 65328031 4207ac18
ffff880406987b40 590569085 C Co:1:042:0 0 8 >
ffff880406940b40 590583670 S Co:1:042:0 s 21 09 0300 0000 0008 8 = 7886cee6 70fd9d25
ffff880406940b40 590583823 C Co:1:042:0 0 8 >
ffff8804069406c0 590599637 S Co:1:042:0 s 21 09 0300 0000 0008 8 = 153002db bf35a287
ffff8804069406c0 590599852 C Co:1:042:0 0 8 >
ffff8803e300a240 590614660 S Co:1:042:0 s 21 09 0300 0000 0008 8 = 6295aa5e f7a0dac7
ffff8803e300a240 590614827 C Co:1:042:0 0 8 >
ffff88025ad1ff00 590630703 S Co:1:042:0 s 21 09 0300 0000 0008 8 = 2a11d514 46e3a783
ffff88025ad1ff00 590630826 C Co:1:042:0 0 8 >
ffff88025ad1ff00 590645744 S Co:1:042:0 s 21 09 0300 0000 0008 8 = 5f739774 bed730ed
ffff88025ad1ff00 590645850 C Co:1:042:0 0 8 >
ffff880406987240 590661648 S Co:1:042:0 s 21 09 0300 0000 0008 8 = 917d8a4c d408de4b
ffff880406987240 590661837 C Co:1:042:0 0 8 >
ffff880406940cc0 590677706 S Co:1:042:0 s 21 09 0300 0000 0008 8 = 7a674939 e138e076
ffff880406940cc0 590677822 C Co:1:042:0 0 8 >
ffff8803e300a540 590692364 S Co:1:042:0 s 21 09 0300 0000 0008 8 = 755cf631 a2dba95e
ffff8803e300a540 590692576 C Co:1:042:0 0 8 >
ffff8803e300a540 590708233 S Co:1:042:0 s 21 09 0300 0000 0008 8 = 00fab3fa ba9a7083
ffff8803e300a540 590708326 C Co:1:042:0 0 8 >
ffff88025ad1f9c0 590724218 S Co:1:042:0 s 21 09 0300 0000 0008 8 = 3fd32ab2 2dd2ad7b
ffff88025ad1f9c0 590724322 C Co:1:042:0 0 8 >
ffff8803d5424300 590739251 S Co:1:042:0 s 21 09 0300 0000 0008 8 = 7af00848 e414a071
ffff8803d5424300 590739449 C Co:1:042:0 0 8 >
ffff8803d54249c0 590756244 S Co:1:042:0 s 21 09 0300 0000 0008 8 = 9c4b7bff 2ea5cba2
ffff8803d54249c0 590756349 C Co:1:042:0 0 8 >
ffff8803d5424300 590770409 S Co:1:042:0 s 21 09 0300 0000 0008 8 = b453baf0 3cfe75e0
ffff8803d5424300 590770586 C Co:1:042:0 0 8 >
ffff8803d5424300 590786304 S Co:1:042:0 s 21 09 0300 0000 0008 8 = 766a7b86 a24b2811
ffff8803d5424300 590786454 C Co:1:042:0 0 8 >
ffff88025ad1f9c0 590803589 S Co:1:042:0 s 21 09 0300 0000 0008 8 = b9687d02 daee31af
ffff88025ad1f9c0 590803724 C Co:1:042:0 0 8 >
ffff88025ad1f9c0 590819217 S Co:1:042:0 s 21 09 0300 0000 0008 8 = f817fef7 c2fb2547
ffff88025ad1f9c0 590819349 C Co:1:042:0 0 8 >
ffff8804069870c0 590833369 S Co:1:042:0 s 21 09 0300 0000 0008 8 = d3b643ce 1cbc58fc
ffff8804069870c0 590833593 C Co:1:042:0 0 8 >
ffff88025ad1f6c0 590849293 S Co:1:042:0 s 21 09 0300 0000 0008 8 = 8e791541 0b2c6603
ffff88025ad1f6c0 590849454 C Co:1:042:0 0 8 >
ffff88025ad1f6c0 590865131 S Co:1:042:0 s 21 09 0300 0000 0008 8 = 8f0540e1 9a7dac27
ffff88025ad1f6c0 590865343 C Co:1:042:0 0 8 >
ffff88025ad1f6c0 590880229 S Co:1:042:0 s 21 09 0300 0000 0008 8 = e2f71491 3795ce45
ffff88025ad1f6c0 590880328 C Co:1:042:0 0 8 >
ffff8803e300a900 590898296 S Co:1:042:0 s 21 09 0300 0000 0008 8 = b65ce70b 328b31cf
ffff8803e300a900 590898474 C Co:1:042:0 0 8 >
ffff88025ad1f600 590911175 S Co:1:042:0 s 21 09 0300 0000 0008 8 = df388f59 402c804b
ffff88025ad1f600 590911329 C Co:1:042:0 0 8 >
ffff88025ad1f600 590927738 S Co:1:042:0 s 21 09 0300 0000 0008 8 = 5401ea5b fc7a29d2
ffff88025ad1f600 590927829 C Co:1:042:0 0 8 >
ffff880406940cc0 590942783 S Co:1:042:0 s 21 09 0300 0000 0008 8 = b0235845 6329de93
ffff880406940cc0 590942975 C Co:1:042:0 0 8 >
ffff880406940cc0 590958625 S Co:1:042:0 s 21 09 0300 0000 0008 8 = b37c3d20 56231750
ffff880406940cc0 590958824 C Co:1:042:0 0 8 >
ffff880406940240 590974732 S Co:1:042:0 s 21 09 0300 0000 0008 8 = c1df8247 1a038ddf
ffff880406940240 590974827 C Co:1:042:0 0 8 >
ffff880406987c00 590989733 S Co:1:042:0 s 21 09 0300 0000 0008 8 = 609312e9 d89cbfa8
ffff880406987c00 590989831 C Co:1:042:0 0 8 >
ffff8804069406c0 591005813 S Co:1:042:0 s 21 09 0300 0000 0008 8 = bcd3608b 1f716f2b
ffff8804069406c0 591005953 C Co:1:042:0 0 8 >
ffff880406987c00 591020682 S Co:1:042:0 s 21 09 0300 0000 0008 8 = 244ede85 603c2379
ffff880406987c00 591020830 C Co:1:042:0 0 8 >
ffff880406987c00 591037781 S Co:1:042:0 s 21 09 0300 0000 0008 8 = 8ca78582 6f6aa6b7
ffff880406987c00 591037952 C Co:1:042:0 0 8 >
ffff8803e300a300 591051377 S Co:1:042:0 s 21 09 0300 0000 0008 8 = 0bf45103 079b86a1
ffff8803e300a300 591051591 C Co:1:042:0 0 8 >
ffff88025ad1f840 591068310 S Co:1:042:0 s 21 09 0300 0000 0008 8 = 5c40c4db 44259603
ffff88025ad1f840 591068455 C Co:1:042:0 0 8 >
ffff88025ad1f840 591083338 S Co:1:042:0 s 21 09 0300 0000 0008 8 = 5f0b61b2 288f6c40
ffff88025ad1f840 591083455 C Co:1:042:0 0 8 >
ffff88025ad1f840 591100422 S Co:1:042:0 s 21 09 0300 0000 0008 8 = 98c63084 1818e2cd
ffff88025ad1f840 591100579 C Co:1:042:0 0 8 >
ffff880403862e40 591114282 S Co:1:042:0 s 21 09 0300 0000 0008 8 = ad5a3f20 5f3097b4
ffff880403862e40 591114454 C Co:1:042:0 0 8 >
ffff8804069406c0 591130334 S Co:1:042:0 s 21 09 0300 0000 0008 8 = eaa11dac a8fb6e14
ffff8804069406c0 591130455 C Co:1:042:0 0 8 >
ffff88025ad1f840 591145349 S Co:1:042:0 s 21 09 0300 0000 0008 8 = beea5f1e 86d30b9e
ffff88025ad1f840 591145451 C Co:1:042:0 0 8 >
ffff88025ad1f6c0 591162369 S Co:1:042:0 s 21 09 0300 0000 0008 8 = 3d771dc3 eec55b17
ffff88025ad1f6c0 591162453 C Co:1:042:0 0 8 >
ffff88025ad1f840 591177320 S Co:1:042:0 s 21 09 0300 0000 0008 8 = 9eff73ba b9110adb
ffff88025ad1f840 591177478 C Co:1:042:0 0 8 >
ffff88025ad1f840 591192312 S Co:1:042:0 s 21 09 0300 0000 0008 8 = bd2f0377 25ad0c56
ffff88025ad1f840 591192453 C Co:1:042:0 0 8 >
ffff88025ad1f840 591209413 S Co:1:042:0 s 21 09 0300 0000 0008 8 = 98236f43 52c1188b
ffff88025ad1f840 591209601 C Co:1:042:0 0 8 >
ffff88025ad1f840 591224314 S Co:1:042:0 s 21 09 0300 0000 0008 8 = d3efe2b8 c82a268f
ffff88025ad1f840 591224481 C Co:1:042:0 0 8 >
ffff88025ad1f840 591239296 S Co:1:042:0 s 21 09 0300 0000 0008 8 = 361b8647 edf9f60c
ffff88025ad1f840 591239473 C Co:1:042:0 0 8 >
ffff88025ad1f840 591256390 S Co:1:042:0 s 21 09 0300 0000 0008 8 = 2c200db4 91f28bc1
ffff88025ad1f840 591256601 C Co:1:042:0 0 8 >
ffff88025ad1f6c0 591271325 S Co:1:042:0 s 21 09 0300 0000 0008 8 = 45ee2a97 6510aafe
ffff88025ad1f6c0 591271457 C Co:1:042:0 0 8 >
ffff8803e300a900 591287609 S Co:1:042:0 s 21 09 0300 0000 0008 8 = b36817db 7dfe5d2b
ffff8803e300a900 591287706 C Co:1:042:0 0 8 >
ffff8803e300a900 591302368 S Co:1:042:0 s 21 09 0300 0000 0008 8 = cee50f40 d49d7440
ffff8803e300a900 591302479 C Co:1:042:0 0 8 >
ffff8803e300a900 591317509 S Co:1:042:0 s 21 09 0300 0000 0008 8 = 91aed4db c683014c
ffff8803e300a900 591317708 C Co:1:042:0 0 8 >
ffff880406987600 591333298 S Co:1:042:0 s 21 09 0300 0000 0008 8 = 1d842893 9578d9f1
ffff880406987600 591333471 C Co:1:042:0 0 8 >
ffff88025ad1f6c0 591349356 S Co:1:042:0 s 21 09 0300 0000 0008 8 = 331955a4 e7f918e4
ffff88025ad1f6c0 591349480 C Co:1:042:0 0 8 >
ffff88025ad1f6c0 591364397 S Co:1:042:0 s 21 09 0300 0000 0008 8 = bc95a71d 44b79c6f
ffff88025ad1f6c0 591364584 C Co:1:042:0 0 8 >
ffff88025ad1f6c0 591381270 S Co:1:042:0 s 21 09 0300 0000 0008 8 = 4311ef64 9b1786f0
ffff88025ad1f6c0 591381473 C Co:1:042:0 0 8 >
ffff88025ad1f6c0 591396345 S Co:1:042:0 s 21 09 0300 0000 0008 8 = 771c00af bcb1be5a
ffff88025ad1f6c0 591396457 C Co:1:042:0 0 8 >
ffff88025ad1f6c0 591411427 S Co:1:042:0 s 21 09 0300 0000 0008 8 = ac3b348a ddd36eb1
ffff88025ad1f6c0 591411606 C Co:1:042:0 0 8 >
ffff880406940600 591428246 S Co:1:042:0 s 21 09 0300 0000 0008 8 = 5a63e656 17fe8590
ffff880406940600 591428329 C Co:1:042:0 0 8 >
ffff88025ad1f6c0 591443282 S Co:1:042:0 s 21 09 0300 0000 0008 8 = 9a7ff7c6 e86633a5
ffff88025ad1f6c0 591443476 C Co:1:042:0 0 8 >
ffff88025ad1f6c0 591458389 S Co:1:042:0 s 21 09 0300 0000 0008 8 = adef4b62 b0747132
ffff88025ad1f6c0 591458645 C Co:1:042:0 0 8 >
ffff880406987600 591473408 S Co:1:042:0 s 21 09 0300 0000 0008 8 = 77054b06 3645788c
ffff880406987600 591473584 C Co:1:042:0 0 8 >
ffff880406987600 591490322 S Co:1:042:0 s 21 09 0300 0000 0008 8 = fe886363 232a479d
ffff880406987600 591490457 C Co:1:042:0 0 8 >
ffff880406940600 591505368 S Co:1:042:0 s 21 09 0300 0000 0008 8 = ee32837a 84282063
ffff880406940600 591505485 C Co:1:042:0 0 8 >
ffff8803e300a900 591520404 S Co:1:042:0 s 21 09 0300 0000 0008 8 = 1734a026 4b780971
ffff8803e300a900 591520585 C Co:1:042:0 0 8 >
ffff880406940600 591536308 S Co:1:042:0 s 21 09 0300 0000 0008 8 = ebaf3291 cc064e6b
ffff880406940600 591536458 C Co:1:042:0 0 8 >
ffff880402c82540 591552315 S Co:1:042:0 s 21 09 0300 0000 0008 8 = 023bb6bb 42f4fb8c
ffff880402c82540 591552464 C Co:1:042:0 0 8 >
ffff880402c823c0 591568150 S Co:1:042:0 s 21 09 0300 0000 0008 8 = 97622cf8 49166422
ffff880402c823c0 591568338 C Co:1:042:0 0 8 >
ffff880402c823c0 591583048 S Co:1:042:0 s 21 09 0300 0000 0008 8 = 0b239871 64759f0e
ffff880402c823c0 591583208 C Co:1:042:0 0 8 >
ffff880406940600 591599090 S Co:1:042:0 s 21 09 0300 0000 0008 8 = 5f7183a1 76cf0747
ffff880406940600 591599208 C Co:1:042:0 0 8 >
ffff880406940600 591614145 S Co:1:042:0 s 21 09 0300 0000 0008 8 = bcb478d7 4b13b956
ffff880406940600 591614339 C Co:1:042:0 0 8 >
ffff880406940600 591630160 S Co:1:042:0 s 21 09 0300 0000 0008 8 = ed4589b8 0ee718da
ffff880406940600 591630334 C Co:1:042:0 0 8 >
ffff8803e300a900 591648101 S Co:1:042:0 s 21 09 0300 0000 0008 8 = e2f4cabc d2244b03
ffff8803e300a900 591648230 C Co:1:042:0 0 8 >
ffff880406987f00 591661100 S Co:1:042:0 s 21 09 0300 0000 0008 8 = 2d84d3ae 0c56bb18
ffff880406987f00 591661217 C Co:1:042:0 0 8 >
ffff880406940600 591677168 S Co:1:042:0 s 21 09 0300 0000 0008 8 = 862b412f 163f98f3
ffff880406940600 591677355 C Co:1:042:0 0 8 >
ffff880402c82e40 591693103 S Co:1:042:0 s 21 09 0300 0000 0008 8 = 49153432 ab535382
ffff880402c82e40 591693226 C Co:1:042:0 0 8 >
ffff880402c82e40 591708097 S Co:1:042:0 s 21 09 0300 0000 0008 8 = f4e0cf7f 6f3c2446
ffff880402c82e40 591708231 C Co:1:042:0 0 8 >
ffff880402c82e40 591724078 S Co:1:042:0 s 21 09 0300 0000 0008 8 = ac1fbd32 665583d6
ffff880402c82e40 591724214 C Co:1:042:0 0 8 >
ffff880402c823c0 591739410 S Co:1:042:0 s 21 09 0300 0000 0008 8 = b7d9a83b 7a31b15b
ffff880402c823c0 591739592 C Co:1:042:0 0 8 >
ffff880402c823c0 591755086 S Co:1:042:0 s 21 09 0300 0000 0008 8 = 0109c2dd f8132e13
ffff880402c823c0 591755237 C Co:1:042:0 0 8 >
ffff880402c823c0 591771065 S Co:1:042:0 s 21 09 0300 0000 0008 8 = 991e3f32 127542d0
ffff880402c823c0 591771207 C Co:1:042:0 0 8 >
ffff880402c82e40 591788110 S Co:1:042:0 s 21 09 0300 0000 0008 8 = 337bd7a3 5d847778
ffff880402c82e40 591788212 C Co:1:042:0 0 8 >
ffff880402c823c0 591801653 S Co:1:042:0 s 21 09 0300 0000 0008 8 = a7f64672 51a01b85
ffff880402c823c0 591801832 C Co:1:042:0 0 8 >
ffff880402c823c0 591817779 S Co:1:042:0 s 21 09 0300 0000 0008 8 = 6e5acd33 cedec185
ffff880402c823c0 591817961 C Co:1:042:0 0 8 >
ffff880402c823c0 591833828 S Co:1:042:0 s 21 09 0300 0000 0008 8 = 2ae7b14c 9388be99
ffff880402c823c0 591833965 C Co:1:042:0 0 8 >
ffff880402c823c0 591848648 S Co:1:042:0 s 21 09 0300 0000 0008 8 = 1cceb97a c799aef8
ffff880402c823c0 591848851 C Co:1:042:0 0 8 >
ffff880402c823c0 591865724 S Co:1:042:0 s 21 09 0300 0000 0008 8 = aeb8b34e 7244ef6b
ffff880402c823c0 591865833 C Co:1:042:0 0 8 >
ffff8803e300a900 591880786 S Co:1:042:0 s 21 09 0300 0000 0008 8 = e93fedaa 036d23d0
ffff8803e300a900 591880963 C Co:1:042:0 0 8 >
ffff8803e300a540 591895628 S Co:1:042:0 s 21 09 0300 0000 0008 8 = fd71be46 ca2cb099
ffff8803e300a540 591895847 C Co:1:042:0 0 8 >
ffff8803e300a540 591912755 S Co:1:042:0 s 21 09 0300 0000 0008 8 = be52fc30 7d4e414c
ffff8803e300a540 591912965 C Co:1:042:0 0 8 >
ffff880406987c00 591926808 S Co:1:042:0 s 21 09 0300 0000 0008 8 = 23598545 b5d64403
ffff880406987c00 591926963 C Co:1:042:0 0 8 >
ffff88025ad1f600 591943636 S Co:1:042:0 s 21 09 0300 0000 0008 8 = c8f0babb 70766ceb
ffff88025ad1f600 591943834 C Co:1:042:0 0 8 >
ffff880403862900 591958722 S Co:1:042:0 s 21 09 0300 0000 0008 8 = 6cf6fd99 8f192fc7
ffff880403862900 591958878 C Co:1:042:0 0 8 >
ffff880406987c00 591973749 S Co:1:042:0 s 21 09 0300 0000 0008 8 = 713f383a 575b486d
ffff880406987c00 591973866 C Co:1:042:0 0 8 >
ffff88025ad1f600 591990617 S Co:1:042:0 s 21 09 0300 0000 0008 8 = 601057d0 f20d3346
ffff88025ad1f600 591990853 C Co:1:042:0 0 8 >
ffff880406940b40 592004647 S Co:1:042:0 s 21 09 0300 0000 0008 8 = 65a5cadd edb3b6d0
ffff880406940b40 592004837 C Co:1:042:0 0 8 >
ffff8803e300a240 592022774 S Co:1:042:0 s 21 09 0300 0000 0008 8 = cdae07ba ba07541d
ffff8803e300a240 592022963 C Co:1:042:0 0 8 >
ffff8803e300a240 592036796 S Co:1:042:0 s 21 09 0300 0000 0008 8 = 8dcb0413 2e76d953
ffff8803e300a240 592036962 C Co:1:042:0 0 8 >
ffff8803e300a240 592052697 S Co:1:042:0 s 21 09 0300 0000 0008 8 = bd16bf67 01a1d42c
ffff8803e300a240 592052838 C Co:1:042:0 0 8 >
ffff8803e300a540 592067740 S Co:1:042:0 s 21 09 0300 0000 0008 8 = 1697b88a 53db1675
ffff8803e300a540 592067859 C Co:1:042:0 0 8 >
ffff88025ad1f9c0 592083793 S Co:1:042:0 s 21 09 0300 0000 0008 8 = 7acf7324 23af3691
ffff88025ad1f9c0 592083965 C Co:1:042:0 0 8 >
ffff88025ad1f9c0 592099697 S Co:1:042:0 s 21 09 0300 0000 0008 8 = 6a30f931 d8590ff5
ffff88025ad1f9c0 592099839 C Co:1:042:0 0 8 >
ffff88025ad1f9c0 592114719 S Co:1:042:0 s 21 09 0300 0000 0008 8 = 90a15682 bb4a3eac
ffff88025ad1f9c0 592114859 C Co:1:042:0 0 8 >
ffff88025ad1f840 592134085 S Co:1:042:0 s 21 09 0300 0000 0008 8 = 35fd1a38 78a7a7d3
ffff88025ad1f840 592134228 C Co:1:042:0 0 8 >
ffff8804069870c0 592148607 S Co:1:042:0 s 21 09 0300 0000 0008 8 = c993da4e a3c8ee1c
ffff8804069870c0 592148713 C Co:1:042:0 0 8 >
ffff880406940b40 592163498 S Co:1:042:0 s 21 09 0300 0000 0008 8 = 61a5ae0e 2fbc004d
ffff880406940b40 592163586 C Co:1:042:0 0 8 >
ffff8803e300a540 592176514 S Co:1:042:0 s 21 09 0300 0000 0008 8 = 32ebb398 f6c18abf
ffff8803e300a540 592176715 C Co:1:042:0 0 8 >
ffff88025ad1f9c0 592193663 S Co:1:042:0 s 21 09 0300 0000 0008 8 = 19108861 36ce7ee2
ffff88025ad1f9c0 592193838 C Co:1:042:0 0 8 >
ffff88025ad1f9c0 592208490 S Co:1:042:0 s 21 09 0300 0000 0008 8 = 1431d3af 100b94b6
ffff88025ad1f9c0 592208610 C Co:1:042:0 0 8 >
ffff880406940240 592223512 S Co:1:042:0 s 21 09 0300 0000 0008 8 = c863bc20 0955c551
ffff880406940240 592223713 C Co:1:042:0 0 8 >
ffff880402c82900 592239506 S Co:1:042:0 s 21 09 0300 0000 0008 8 = fb2c6f22 8bbdcf5e
ffff880402c82900 592239710 C Co:1:042:0 0 8 >
ffff880402c823c0 592255406 S Co:1:042:0 s 21 09 0300 0000 0008 8 = 19069c7b 6408b699
ffff880402c823c0 592255585 C Co:1:042:0 0 8 >
ffff880402c823c0 592270588 S Co:1:042:0 s 21 09 0300 0000 0008 8 = b2e2f7c0 432f3f56
ffff880402c823c0 592270725 C Co:1:042:0 0 8 >
ffff880402c823c0 592287510 S Co:1:042:0 s 21 09 0300 0000 0008 8 = f8a1bae0 40de75fa
ffff880402c823c0 592287587 C Co:1:042:0 0 8 >
ffff880402c823c0 592302538 S Co:1:042:0 s 21 09 0300 0000 0008 8 = 449b2198 53f7267f
ffff880402c823c0 592302729 C Co:1:042:0 0 8 >
ffff880402c823c0 592317432 S Co:1:042:0 s 21 09 0300 0000 0008 8 = 8f1aebfe d90e65f2
ffff880402c823c0 592317590 C Co:1:042:0 0 8 >
ffff880402c823c0 592334574 S Co:1:042:0 s 21 09 0300 0000 0008 8 = fbdddef9 15ec07f6
ffff880402c823c0 592334739 C Co:1:042:0 0 8 >
ffff880402c823c0 592349551 S Co:1:042:0 s 21 09 0300 0000 0008 8 = 4a9741c5 ab0e2940
ffff880402c823c0 592349736 C Co:1:042:0 0 8 >
ffff880402c823c0 592364487 S Co:1:042:0 s 21 09 0300 0000 0008 8 = 63706272 2425a61b
ffff880402c823c0 592364615 C Co:1:042:0 0 8 >
ffff880402c823c0 592379530 S Co:1:042:0 s 21 09 0300 0000 0008 8 = d2811064 6f96a3e3
ffff880402c823c0 592379731 C Co:1:042:0 0 8 >
ffff880402c823c0 592396510 S Co:1:042:0 s 21 09 0300 0000 0008 8 = 475a1fd2 5cfa068c
ffff880402c823c0 592396588 C Co:1:042:0 0 8 >
ffff880402c823c0 592411424 S Co:1:042:0 s 21 09 0300 0000 0008 8 = 147ee949 219ef81b
ffff880402c823c0 592411605 C Co:1:042:0 0 8 >
ffff880402c823c0 592426688 S Co:1:042:0 s 21 09 0300 0000 0008 8 = b1e3c928 d8016829
ffff880402c823c0 592426860 C Co:1:042:0 0 8 >
ffff880402c823c0 592443500 S Co:1:042:0 s 21 09 0300 0000 0008 8 = 3a75a023 fd5b8965
ffff880402c823c0 592443600 C Co:1:042:0 0 8 >
ffff880402c823c0 592458600 S Co:1:042:0 s 21 09 0300 0000 0008 8 = ee9153c3 f2125111
ffff880402c823c0 592458768 C Co:1:042:0 0 8 >
ffff880402c823c0 592473489 S Co:1:042:0 s 21 09 0300 0000 0008 8 = b08d49e2 7c44fb82
ffff880402c823c0 592473651 C Co:1:042:0 0 8 >
ffff880402c823c0 592490545 S Co:1:042:0 s 21 09 0300 0000 0008 8 = 872def32 454384a3
ffff880402c823c0 592490788 C Co:1:042:0 0 8 >
ffff880402c823c0 592505584 S Co:1:042:0 s 21 09 0300 0000 0008 8 = 1f2d36b5 5b122f70
ffff880402c823c0 592505717 C Co:1:042:0 0 8 >
ffff880402c823c0 592520417 S Co:1:042:0 s 21 09 0300 0000 0008 8 = 48bb1143 adeb037d
ffff880402c823c0 592520607 C Co:1:042:0 0 8 >
ffff880402c823c0 592537505 S Co:1:042:0 s 21 09 0300 0000 0008 8 = 74fcfa09 93bb496e
ffff880402c823c0 592537592 C Co:1:042:0 0 8 >
ffff880402c823c0 592552542 S Co:1:042:0 s 21 09 0300 0000 0008 8 = 3b856c07 45a2117f
ffff880402c823c0 592552741 C Co:1:042:0 0 8 >
ffff880402c823c0 592567428 S Co:1:042:0 s 21 09 0300 0000 0008 8 = d9e16890 6075acfc
ffff880402c823c0 592567590 C Co:1:042:0 0 8 >
ffff880402c823c0 592584518 S Co:1:042:0 s 21 09 0300 0000 0008 8 = ad0ff2cc 673d32c8
ffff880402c823c0 592584719 C Co:1:042:0 0 8 >
ffff880402c823c0 592599591 S Co:1:042:0 s 21 09 0300 0000 0008 8 = ba039336 3eb8fbd8
ffff880402c823c0 592599733 C Co:1:042:0 0 8 >
ffff880402c823c0 592614452 S Co:1:042:0 s 21 09 0300 0000 0008 8 = 2723d720 afd628b6
ffff880402c823c0 592614607 C Co:1:042:0 0 8 >
ffff880402c823c0 592631528 S Co:1:042:0 s 21 09 0300 0000 0008 8 = c0c9ce2d e63b1900
ffff880402c823c0 592631733 C Co:1:042:0 0 8 >
ffff880402c823c0 592646556 S Co:1:042:0 s 21 09 0300 0000 0008 8 = 75c68dd4 f7c1f6e9
ffff880402c823c0 592646727 C Co:1:042:0 0 8 >
ffff880402c823c0 592661589 S Co:1:042:0 s 21 09 0300 0000 0008 8 = d8dbade1 55f529b6
ffff880402c823c0 592661719 C Co:1:042:0 0 8 >
ffff88025ad1ff00 592676469 S Co:1:042:0 s 21 09 0300 0000 0008 8 = a23fc9f5 5a97e040
ffff88025ad1ff00 592676604 C Co:1:042:0 0 8 >
ffff880406987cc0 592721548 S Co:1:042:0 s 21 09 0300 0000 0008 8 = 55035647 c52fe901
ffff880406987cc0 592721732 C Co:1:042:0 0 8 >
ffff880406940240 592740506 S Ci:1:042:0 s a1 01 0300 0000 0008 8 <
ffff880406940240 592740597 C Ci:1:042:0 0 8 = aa040000 00000000
ffff880406987b40 601490342 S Co:1:042:0 s 21 09 0300 0000 0008 8 = 55010100 00ff075d
ffff880406987b40 601490428 C Co:1:042:0 0 8 >
ffff880406987a80 601522283 S Ci:1:042:0 s a1 01 0300 0000 0008 8 <
ffff880406987a80 601522441 C Ci:1:042:0 0 8 = aa020000 00000000
ffff880406987a80 601551714 S Co:1:042:0 s 21 09 0300 0000 0008 8 = 0b010101 00000e04
ffff880406987a80 601551821 C Co:1:042:0 0 8 >
ffff880405365240 601568220 S Co:1:042:0 s 21 09 0300 0000 0008 8 = 6f453ae9 8b7baa28
ffff880405365240 601568436 C Co:1:042:0 0 8 >
ffff880406987a80 601583239 S Co:1:042:0 s 21 09 0300 0000 0008 8 = 01809300 15ff57ff
ffff880406987a80 601583435 C Co:1:042:0 0 8 >
ffff880405365240 601598665 S Co:1:042:0 s 21 09 0300 0000 0008 8 = d7ffd7ff 67ff47ff
ffff880405365240 601598808 C Co:1:042:0 0 8 >
ffff8804069406c0 601615250 S Co:1:042:0 s 21 09 0300 0000 0008 8 = 47ffe7ff 57ffb7ff
ffff8804069406c0 601615425 C Co:1:042:0 0 8 >
ffff8803d56ac180 601630230 S Co:1:042:0 s 21 09 0300 0000 0008 8 = 57ff77ff c7fff7ff
ffff8803d56ac180 601630418 C Co:1:042:0 0 8 >
ffff8804069406c0 601645265 S Co:1:042:0 s 21 09 0300 0000 0008 8 = 07ffb7ff 07fff7ff
ffff8804069406c0 601645435 C Co:1:042:0 0 8 >
ffff8804069406c0 601662410 S Co:1:042:0 s 21 09 0300 0000 0008 8 = 77ff77ff 37ffa7ff
ffff8804069406c0 601662558 C Co:1:042:0 0 8 >
ffff8804069406c0 601677233 S Co:1:042:0 s 21 09 0300 0000 0008 8 = 57ff27ff f7fff7ff
ffff8804069406c0 601677435 C Co:1:042:0 0 8 >
ffff8804069406c0 601692265 S Co:1:042:0 s 21 09 0300 0000 0008 8 = a7ffb7ff b7ff57ff
ffff8804069406c0 601692436 C Co:1:042:0 0 8 >
ffff8804069406c0 601709331 S Co:1:042:0 s 21 09 0300 0000 0008 8 = 37ff37ff 97ff77ff
ffff8804069406c0 601709420 C Co:1:042:0 0 8 >
ffff88025ad1fd80 601724222 S Co:1:042:0 s 21 09 0300 0000 0008 8 = 97ffd7ff 17ffc7ff
ffff88025ad1fd80 601724423 C Co:1:042:0 0 8 >
ffff8803d54249c0 601739254 S Co:1:042:0 s 21 09 0300 0000 0008 8 = d7ff57ff b7ff97ff
ffff8803d54249c0 601739442 C Co:1:042:0 0 8 >
ffff8803d54249c0 601756311 S Co:1:042:0 s 21 09 0300 0000 0008 8 = 87ff87ff 17ffd7ff
ffff8803d54249c0 601756419 C Co:1:042:0 0 8 >
ffff8803d54249c0 601771242 S Co:1:042:0 s 21 09 0300 0000 0008 8 = a7ff07ff 07ff37ff
ffff8803d54249c0 601771422 C Co:1:042:0 0 8 >
ffff8803d54249c0 601786265 S Co:1:042:0 s 21 09 0300 0000 0008 8 = 07ff67ff 27ff07ff
ffff8803d54249c0 601786490 C Co:1:042:0 0 8 >
ffff8803d54249c0 601803328 S Co:1:042:0 s 21 09 0300 0000 0008 8 = 17ff67ff 87ffe7ff
ffff8803d54249c0 601803447 C Co:1:042:0 0 8 >
ffff8803d54249c0 601818358 S Co:1:042:0 s 21 09 0300 0000 0008 8 = 57ff67ff b7ff07ff
ffff8803d54249c0 601818568 C Co:1:042:0 0 8 >
ffff8803d54249c0 601833223 S Co:1:042:0 s 21 09 0300 0000 0008 8 = 07ff67ff 07ffc7ff
ffff8803d54249c0 601833422 C Co:1:042:0 0 8 >
ffff880405365240 601848352 S Co:1:042:0 s 21 09 0300 0000 0008 8 = e7ff07ff d7ff27ff
ffff880405365240 601848564 C Co:1:042:0 0 8 >
ffff88025ad1fd80 601865311 S Co:1:042:0 s 21 09 0300 0000 0008 8 = 57ffb7ff 97ffa7ff
ffff88025ad1fd80 601865419 C Co:1:042:0 0 8 >
ffff88025ad1fd80 601880263 S Co:1:042:0 s 21 09 0300 0000 0008 8 = e7ff47ff 97ffc7ff
ffff88025ad1fd80 601880424 C Co:1:042:0 0 8 >
ffff88025ad1fd80 601895378 S Co:1:042:0 s 21 09 0300 0000 0008 8 = 67ffd7ff 47ff17ff
ffff88025ad1fd80 601895561 C Co:1:042:0 0 8 >
ffff880405365240 601912314 S Co:1:042:0 s 21 09 0300 0000 0008 8 = 97ffb7ff b7ff07ff
ffff880405365240 601912420 C Co:1:042:0 0 8 >
ffff88025ad1fd80 601927253 S Co:1:042:0 s 21 09 0300 0000 0008 8 = 67ffd7ff 57fff7ff
ffff88025ad1fd80 601927429 C Co:1:042:0 0 8 >
ffff88025ad1fd80 601942426 S Co:1:042:0 s 21 09 0300 0000 0008 8 = 07ff47ff f7ff17ff
ffff88025ad1fd80 601942546 C Co:1:042:0 0 8 >
ffff88025ad1fd80 601959341 S Co:1:042:0 s 21 09 0300 0000 0008 8 = 07ffe7ff e7ff27ff
ffff88025ad1fd80 601959442 C Co:1:042:0 0 8 >
ffff88025ad1fd80 601974383 S Co:1:042:0 s 21 09 0300 0000 0008 8 = 97ffa7ff b7ffd7ff
ffff88025ad1fd80 601974568 C Co:1:042:0 0 8 >
ffff880405365240 601989220 S Co:1:042:0 s 21 09 0300 0000 0008 8 = 07ffa7ff 77ffe7ff
ffff880405365240 601989314 C Co:1:042:0 0 8 >
ffff88025ad1fd80 602006343 S Co:1:042:0 s 21 09 0300 0000 0008 8 = 17ffc7ff 57ff37ff
ffff88025ad1fd80 602006568 C Co:1:042:0 0 8 >
ffff8804069406c0 602021374 S Co:1:042:0 s 21 09 0300 0000 0008 8 = 87ffa7ff 47ff57ff
ffff8804069406c0 602021565 C Co:1:042:0 0 8 >
ffff8804053656c0 602036218 S Co:1:042:0 s 21 09 0300 0000 0008 8 = c7ff67ff d7fff7ff
ffff8804053656c0 602036419 C Co:1:042:0 0 8 >
ffff880406940cc0 602053328 S Co:1:042:0 s 21 09 0300 0000 0008 8 = 77ff27ff e7ff07ff
ffff880406940cc0 602053431 C Co:1:042:0 0 8 >
ffff8804033a5c00 602067622 S Co:1:042:0 s 21 09 0300 0000 0008 8 = 77ff77ff 67ffc7ff
ffff8804033a5c00 602067817 C Co:1:042:0 0 8 >
ffff8804033a59c0 602084512 S Co:1:042:0 s 21 09 0300 0000 0008 8 = 87ff47ff c7523abe
ffff8804033a59c0 602084694 C Co:1:042:0 0 8 >
ffff8804033a59c0 602099554 S Co:1:042:0 s 21 09 0300 0000 0008 8 = 931e20b7 c80cdd35
ffff8804033a59c0 602099700 C Co:1:042:0 0 8 >
ffff88025ad1fd80 602114600 S Co:1:042:0 s 21 09 0300 0000 0008 8 = 2c852f2f 67e652a6
ffff88025ad1fd80 602114820 C Co:1:042:0 0 8 >
ffff8804053656c0 602130467 S Co:1:042:0 s 21 09 0300 0000 0008 8 = 7f3199e7 98f5491c
ffff8804053656c0 602130690 C Co:1:042:0 0 8 >
ffff880405365180 602145573 S Co:1:042:0 s 21 09 0300 0000 0008 8 = f07bb619 1a32a165
ffff880405365180 602145688 C Co:1:042:0 0 8 >
ffff880405365180 602161580 S Co:1:042:0 s 21 09 0300 0000 0008 8 = 795dd088 01fbef95
ffff880405365180 602161709 C Co:1:042:0 0 8 >
ffff88025ad1f480 602178015 S Co:1:042:0 s 21 09 0300 0000 0008 8 = 2af6a7f7 3590fd7f
ffff88025ad1f480 602178185 C Co:1:042:0 0 8 >
ffff88025ad1f000 602192542 S Co:1:042:0 s 21 09 0300 0000 0008 8 = a30becaf f2994641
ffff88025ad1f000 602192673 C Co:1:042:0 0 8 >
ffff8804053656c0 602207711 S Co:1:042:0 s 21 09 0300 0000 0008 8 = 9a83c8fb 489c7db7
ffff8804053656c0 602207821 C Co:1:042:0 0 8 >
ffff880406940480 602223616 S Co:1:042:0 s 21 09 0300 0000 0008 8 = 5ae955ad 9b890504
ffff880406940480 602223821 C Co:1:042:0 0 8 >
ffff8804033a5a80 602239457 S Co:1:042:0 s 21 09 0300 0000 0008 8 = 40eb2199 2331780f
ffff8804033a5a80 602239690 C Co:1:042:0 0 8 >
ffff880406940480 602254559 S Co:1:042:0 s 21 09 0300 0000 0008 8 = 3edfb017 6bc82301
ffff880406940480 602254676 C Co:1:042:0 0 8 >
ffff88025ad1ff00 602272608 S Co:1:042:0 s 21 09 0300 0000 0008 8 = 5a3af884 d36986ca
ffff88025ad1ff00 602272813 C Co:1:042:0 0 8 >
ffff8804053656c0 602287516 S Co:1:042:0 s 21 09 0300 0000 0008 8 = 2e19e5bf 1090d69b
ffff8804053656c0 602287677 C Co:1:042:0 0 8 >
ffff88025ad1fe40 602302544 S Co:1:042:0 s 21 09 0300 0000 0008 8 = 67bbd6ae a89f7d6b
ffff88025ad1fe40 602302676 C Co:1:042:0 0 8 >
ffff880406940480 602317524 S Co:1:042:0 s 21 09 0300 0000 0008 8 = 48031cb8 795c9675
ffff880406940480 602317672 C Co:1:042:0 0 8 >
ffff880248699f00 602332663 S Co:1:042:0 s 21 09 0300 0000 0008 8 = 27f97f4b 326f74b6
ffff880248699f00 602332799 C Co:1:042:0 0 8 >
ffff880403760cc0 602349544 S Co:1:042:0 s 21 09 0300 0000 0008 8 = ec48ba56 d6e71b72
ffff880403760cc0 602349703 C Co:1:042:0 0 8 >
ffff880403760cc0 602364582 S Co:1:042:0 s 21 09 0300 0000 0008 8 = 97befccd 3eb4c3ae
ffff880403760cc0 602364702 C Co:1:042:0 0 8 >
ffff880403760cc0 602379839 S Co:1:042:0 s 21 09 0300 0000 0008 8 = b9d1682a 952c59b4
ffff880403760cc0 602379952 C Co:1:042:0 0 8 >
ffff880248699f00 602396531 S Co:1:042:0 s 21 09 0300 0000 0008 8 = f81794e8 dc880094
ffff880248699f00 602396680 C Co:1:042:0 0 8 >
ffff880248699f00 602411500 S Co:1:042:0 s 21 09 0300 0000 0008 8 = 8ecb0c08 66668aa0
ffff880248699f00 602411673 C Co:1:042:0 0 8 >
ffff88025ad1fe40 602426598 S Co:1:042:0 s 21 09 0300 0000 0008 8 = c84ccd8f 5b4702ee
ffff88025ad1fe40 602426678 C Co:1:042:0 0 8 >
ffff880403760cc0 602443531 S Co:1:042:0 s 21 09 0300 0000 0008 8 = 89a0cc04 371024d7
ffff880403760cc0 602443698 C Co:1:042:0 0 8 >
ffff880403760cc0 602458487 S Co:1:042:0 s 21 09 0300 0000 0008 8 = c6eb6ff4 4a8be17c
ffff880403760cc0 602458693 C Co:1:042:0 0 8 >
ffff880403760cc0 602473579 S Co:1:042:0 s 21 09 0300 0000 0008 8 = 0afb1170 38e5dd3e
ffff880403760cc0 602473747 C Co:1:042:0 0 8 >
ffff880403760cc0 602490622 S Co:1:042:0 s 21 09 0300 0000 0008 8 = f1be818b 782ff343
ffff880403760cc0 602490828 C Co:1:042:0 0 8 >
ffff8804069400c0 602504700 S Co:1:042:0 s 21 09 0300 0000 0008 8 = afc781df d7e0aef6
ffff8804069400c0 602504827 C Co:1:042:0 0 8 >
ffff8804069400c0 602520581 S Co:1:042:0 s 21 09 0300 0000 0008 8 = 89cf4907 f450cf85
ffff8804069400c0 602520698 C Co:1:042:0 0 8 >
ffff8804069400c0 602536617 S Co:1:042:0 s 21 09 0300 0000 0008 8 = 59300324 c43ccc63
ffff8804069400c0 602536803 C Co:1:042:0 0 8 >
ffff880248699000 602551461 S Co:1:042:0 s 21 09 0300 0000 0008 8 = 0c6a4f5a 0d464dc6
ffff880248699000 602551559 C Co:1:042:0 0 8 >
ffff880248699000 602567484 S Co:1:042:0 s 21 09 0300 0000 0008 8 = 25a0be52 ed74af28
ffff880248699000 602567674 C Co:1:042:0 0 8 >
ffff880248699000 602585570 S Co:1:042:0 s 21 09 0300 0000 0008 8 = 391a59b8 52ae83c8
ffff880248699000 602585674 C Co:1:042:0 0 8 >
ffff880403760cc0 602598448 S Co:1:042:0 s 21 09 0300 0000 0008 8 = 72c219bd 81430d28
ffff880403760cc0 602598576 C Co:1:042:0 0 8 >
ffff8804069400c0 602614554 S Co:1:042:0 s 21 09 0300 0000 0008 8 = 0fa96f94 9263c88e
ffff8804069400c0 602614679 C Co:1:042:0 0 8 >
ffff88025ad1ff00 602631599 S Co:1:042:0 s 21 09 0300 0000 0008 8 = e182bcf6 f0a4df86
ffff88025ad1ff00 602631826 C Co:1:042:0 0 8 >
ffff880403760cc0 602646513 S Co:1:042:0 s 21 09 0300 0000 0008 8 = cd23d7a0 dc7fb45c
ffff880403760cc0 602646696 C Co:1:042:0 0 8 >
ffff880403760cc0 602661554 S Co:1:042:0 s 21 09 0300 0000 0008 8 = 4f0a8cd2 e8d25ba4
ffff880403760cc0 602661687 C Co:1:042:0 0 8 >
ffff880406940300 602677595 S Co:1:042:0 s 21 09 0300 0000 0008 8 = f3d419d0 7e5e1db5
ffff880406940300 602677702 C Co:1:042:0 0 8 >
ffff880406940300 602692623 S Co:1:042:0 s 21 09 0300 0000 0008 8 = dcc5b163 5948f727
ffff880406940300 602692804 C Co:1:042:0 0 8 >
ffff880248699240 602708529 S Co:1:042:0 s 21 09 0300 0000 0008 8 = 3f44fc57 099a1a5a
ffff880248699240 602708677 C Co:1:042:0 0 8 >
ffff880248699240 602724839 S Co:1:042:0 s 21 09 0300 0000 0008 8 = e65e93fc 71c16bf1
ffff880248699240 602724935 C Co:1:042:0 0 8 >
ffff880248699240 602740625 S Co:1:042:0 s 21 09 0300 0000 0008 8 = b04186a7 4b0f0350
ffff880248699240 602740830 C Co:1:042:0 0 8 >
ffff88025ad1fa80 602754449 S Co:1:042:0 s 21 09 0300 0000 0008 8 = 0dc1d730 a039ae24
ffff88025ad1fa80 602754551 C Co:1:042:0 0 8 >
ffff88025ad1fa80 602770550 S Co:1:042:0 s 21 09 0300 0000 0008 8 = 85d4fe73 52d76dda
ffff88025ad1fa80 602770698 C Co:1:042:0 0 8 >
ffff88025ad1fa80 602786596 S Co:1:042:0 s 21 09 0300 0000 0008 8 = 301766d2 94e9f624
ffff88025ad1fa80 602786757 C Co:1:042:0 0 8 >
ffff88025ad1fa80 602801668 S Co:1:042:0 s 21 09 0300 0000 0008 8 = 3d49edb0 6f4e327a
ffff88025ad1fa80 602801806 C Co:1:042:0 0 8 >
ffff880403760cc0 602819596 S Co:1:042:0 s 21 09 0300 0000 0008 8 = 6ece66f5 3d4dbc94
ffff880403760cc0 602819805 C Co:1:042:0 0 8 >
ffff880403760cc0 602834633 S Co:1:042:0 s 21 09 0300 0000 0008 8 = 982b188f 2f0e66f3
ffff880403760cc0 602834801 C Co:1:042:0 0 8 >
ffff8803fab63540 602848612 S Co:1:042:0 s 21 09 0300 0000 0008 8 = 258e3ded c920b557
ffff8803fab63540 602848807 C Co:1:042:0 0 8 >
ffff88025ad1f480 602865532 S Co:1:042:0 s 21 09 0300 0000 0008 8 = 94458684 63f36248
ffff88025ad1f480 602865680 C Co:1:042:0 0 8 >
ffff88025ad1f480 602880513 S Co:1:042:0 s 21 09 0300 0000 0008 8 = f544944c a85dda90
ffff88025ad1f480 602880676 C Co:1:042:0 0 8 >
ffff88025ad1f000 602895612 S Co:1:042:0 s 21 09 0300 0000 0008 8 = 70a17f41 1818bdbd
ffff88025ad1f000 602895815 C Co:1:042:0 0 8 >
ffff88025ad1f000 602911513 S Co:1:042:0 s 21 09 0300 0000 0008 8 = bd1a51e4 884060a2
ffff88025ad1f000 602911733 C Co:1:042:0 0 8 >
ffff88025ad1fd80 602926659 S Co:1:042:0 s 21 09 0300 0000 0008 8 = ab8c8aba 9ed64cd5
ffff88025ad1fd80 602926831 C Co:1:042:0 0 8 >
ffff880406940cc0 602942600 S Co:1:042:0 s 21 09 0300 0000 0008 8 = 9b7b9bca 5842bf30
ffff880406940cc0 602942703 C Co:1:042:0 0 8 >
ffff880248699d80 602958503 S Co:1:042:0 s 21 09 0300 0000 0008 8 = 048f6d22 85cb2851
ffff880248699d80 602958681 C Co:1:042:0 0 8 >
ffff880248699d80 602973516 S Co:1:042:0 s 21 09 0300 0000 0008 8 = f012d950 481fad1c
ffff880248699d80 602973697 C Co:1:042:0 0 8 >
ffff880403760f00 602989586 S Co:1:042:0 s 21 09 0300 0000 0008 8 = 7b7530eb 9ad0a737
ffff880403760f00 602989712 C Co:1:042:0 0 8 >
ffff880406940300 603005641 S Co:1:042:0 s 21 09 0300 0000 0008 8 = 58cbb30a c6d2238b
ffff880406940300 603005805 C Co:1:042:0 0 8 >
ffff880248699540 603020544 S Co:1:042:0 s 21 09 0300 0000 0008 8 = 4e4b19c9 ed0061c7
ffff880248699540 603020681 C Co:1:042:0 0 8 >
ffff880406940480 603038585 S Co:1:042:0 s 21 09 0300 0000 0008 8 = b5d00ec9 829756de
ffff880406940480 603038828 C Co:1:042:0 0 8 >
ffff8802486c6480 603051752 S Co:1:042:0 s 21 09 0300 0000 0008 8 = fc5ab0ae cdb72c86
ffff8802486c6480 603051943 C Co:1:042:0 0 8 >
ffff88025ad1fd80 603068484 S Co:1:042:0 s 21 09 0300 0000 0008 8 = 248c12a1 6ae7beb9
ffff88025ad1fd80 603068693 C Co:1:042:0 0 8 >
ffff88025ad1f600 603084582 S Co:1:042:0 s 21 09 0300 0000 0008 8 = 442ebbcf c98f1f36
ffff88025ad1f600 603084684 C Co:1:042:0 0 8 >
ffff880403760f00 603098715 S Co:1:042:0 s 21 09 0300 0000 0008 8 = 05ab27e6 ae7e1200
ffff880403760f00 603098861 C Co:1:042:0 0 8 >
ffff88025ad1f600 603115456 S Co:1:042:0 s 21 09 0300 0000 0008 8 = 2592429c b16492db
ffff88025ad1f600 603115555 C Co:1:042:0 0 8 >
ffff880403760cc0 603130548 S Co:1:042:0 s 21 09 0300 0000 0008 8 = f717f22a bc5749d4
ffff880403760cc0 603130723 C Co:1:042:0 0 8 >
ffff8802486c6c00 603146537 S Co:1:042:0 s 21 09 0300 0000 0008 8 = df908ccb 92511ab7
ffff8802486c6c00 603146679 C Co:1:042:0 0 8 >
ffff880248699300 603161644 S Co:1:042:0 s 21 09 0300 0000 0008 8 = d8fb5c40 44ae9a98
ffff880248699300 603161834 C Co:1:042:0 0 8 >
ffff880248699300 603176481 S Co:1:042:0 s 21 09 0300 0000 0008 8 = f0751f4d bcb0914e
ffff880248699300 603176679 C Co:1:042:0 0 8 >
ffff880248699300 603192573 S Co:1:042:0 s 21 09 0300 0000 0008 8 = c8c28a3b 34fc7bf1
ffff880248699300 603192703 C Co:1:042:0 0 8 >
ffff880248699300 603207695 S Co:1:042:0 s 21 09 0300 0000 0008 8 = 17cac356 bd1c0b62
ffff880248699300 603207807 C Co:1:042:0 0 8 >
ffff880248699300 603224525 S Co:1:042:0 s 21 09 0300 0000 0008 8 = 2618e56e bcfea5c1
ffff880248699300 603224704 C Co:1:042:0 0 8 >
ffff8803d56ac180 603239557 S Co:1:042:0 s 21 09 0300 0000 0008 8 = 535b7f58 6671e1f6
ffff8803d56ac180 603239706 C Co:1:042:0 0 8 >
ffff8803d56ac180 603254855 S Co:1:042:0 s 21 09 0300 0000 0008 8 = 90e6136c 4aad0d2b
ffff8803d56ac180 603255085 C Co:1:042:0 0 8 >
ffff8803d56ac180 603271534 S Co:1:042:0 s 21 09 0300 0000 0008 8 = e4329807 c5caa94e
ffff8803d56ac180 603271686 C Co:1:042:0 0 8 >
ffff8803d56ac180 603286577 S Co:1:042:0 s 21 09 0300 0000 0008 8 = e759fb09 8d45eb91
ffff8803d56ac180 603286684 C Co:1:042:0 0 8 >
ffff8803d56ac180 603301607 S Co:1:042:0 s 21 09 0300 0000 0008 8 = 479c9856 29813bec
ffff8803d56ac180 603301730 C Co:1:042:0 0 8 >
ffff8803d56ac180 603318643 S Co:1:042:0 s 21 09 0300 0000 0008 8 = 47dcc457 7542b697
ffff8803d56ac180 603318850 C Co:1:042:0 0 8 >
ffff8803d56ac180 603333572 S Co:1:042:0 s 21 09 0300 0000 0008 8 = 3d224477 2131ad93
ffff8803d56ac180 603333711 C Co:1:042:0 0 8 >
ffff8803d56ac180 603348578 S Co:1:042:0 s 21 09 0300 0000 0008 8 = 1219d5a8 305d2421
ffff8803d56ac180 603348706 C Co:1:042:0 0 8 >
ffff8803d56ac180 603365623 S Co:1:042:0 s 21 09 0300 0000 0008 8 = c490a4de 7bb65647
ffff8803d56ac180 603365827 C Co:1:042:0 0 8 >
ffff8803d56ac180 603380529 S Co:1:042:0 s 21 09 0300 0000 0008 8 = e5fad591 2e932e50
ffff8803d56ac180 603380686 C Co:1:042:0 0 8 >
ffff8803d56ac180 603395514 S Co:1:042:0 s 21 09 0300 0000 0008 8 = 1bf0fe3e 482bcd4a
ffff8803d56ac180 603395682 C Co:1:042:0 0 8 >
ffff8803d56ac180 603412648 S Co:1:042:0 s 21 09 0300 0000 0008 8 = a0adabe4 1d1d0988
ffff8803d56ac180 603412812 C Co:1:042:0 0 8 >
ffff8803d56ac180 603427468 S Co:1:042:0 s 21 09 0300 0000 0008 8 = c28fda89 d6eaea20
ffff8803d56ac180 603427565 C Co:1:042:0 0 8 >
ffff88025ad1f840 603442545 S Co:1:042:0 s 21 09 0300 0000 0008 8 = 629a7eb4 ed782d6c
ffff88025ad1f840 603442725 C Co:1:042:0 0 8 >
ffff880403760cc0 603459583 S Co:1:042:0 s 21 09 0300 0000 0008 8 = 76f6fef3 b38fc38b
ffff880403760cc0 603459704 C Co:1:042:0 0 8 >
ffff880403760cc0 603474630 S Co:1:042:0 s 21 09 0300 0000 0008 8 = 896eb555 cc5d51df
ffff880403760cc0 603474836 C Co:1:042:0 0 8 >
ffff8802486c6cc0 603490557 S Co:1:042:0 s 21 09 0300 0000 0008 8 = 38f172ee b0f4b08e
ffff8802486c6cc0 603490699 C Co:1:042:0 0 8 >
ffff8802486996c0 603505594 S Co:1:042:0 s 21 09 0300 0000 0008 8 = b513f858 2ac96c03
ffff8802486996c0 603505709 C Co:1:042:0 0 8 >
ffff880248699300 603520630 S Co:1:042:0 s 21 09 0300 0000 0008 8 = 468b7d2f da35476d
ffff880248699300 603520812 C Co:1:042:0 0 8 >
ffff8804039dec00 603536470 S Co:1:042:0 s 21 09 0300 0000 0008 8 = c5b42c92 b5f5b53d
ffff8804039dec00 603536566 C Co:1:042:0 0 8 >
ffff8804039dec00 603551564 S Co:1:042:0 s 21 09 0300 0000 0008 8 = 200ea5a6 82ac5faa
ffff8804039dec00 603551724 C Co:1:042:0 0 8 >
ffff8804039dec00 603568617 S Co:1:042:0 s 21 09 0300 0000 0008 8 = d8bd7a15 5c5ea22f
ffff8804039dec00 603568808 C Co:1:042:0 0 8 >
ffff8804039dec00 603583458 S Co:1:042:0 s 21 09 0300 0000 0008 8 = 8306b289 35f40f09
ffff8804039dec00 603583558 C Co:1:042:0 0 8 >
ffff8804039dec00 603598511 S Co:1:042:0 s 21 09 0300 0000 0008 8 = 4cd74834 4fbdebbb
ffff8804039dec00 603598703 C Co:1:042:0 0 8 >
ffff880403760cc0 603614592 S Co:1:042:0 s 21 09 0300 0000 0008 8 = 703eaa49 c3eaaf8c
ffff880403760cc0 603614688 C Co:1:042:0 0 8 >
ffff8802486c6cc0 603629577 S Co:1:042:0 s 21 09 0300 0000 0008 8 = c1ef3c82 fd0f8705
ffff8802486c6cc0 603629688 C Co:1:042:0 0 8 >
ffff8802486c60c0 603647565 S Co:1:042:0 s 21 09 0300 0000 0008 8 = 25c1d59a 3ca6d576
ffff8802486c60c0 603647683 C Co:1:042:0 0 8 >
ffff88025ad1f840 603662596 S Co:1:042:0 s 21 09 0300 0000 0008 8 = 15303fd2 148dad70
ffff88025ad1f840 603662707 C Co:1:042:0 0 8 >
ffff88025ad1f9c0 603677634 S Co:1:042:0 s 21 09 0300 0000 0008 8 = 21daba6e ed85594b
ffff88025ad1f9c0 603677813 C Co:1:042:0 0 8 >
ffff88025ad1f840 603692539 S Co:1:042:0 s 21 09 0300 0000 0008 8 = 69037737 83b4d4a0
ffff88025ad1f840 603692688 C Co:1:042:0 0 8 >
ffff88025ad1f9c0 603708542 S Co:1:042:0 s 21 09 0300 0000 0008 8 = 23131ff9 662251cd
ffff88025ad1f9c0 603708693 C Co:1:042:0 0 8 >
ffff88025ad1f840 603724604 S Co:1:042:0 s 21 09 0300 0000 0008 8 = 1a154b05 7a3eb375
ffff88025ad1f840 603724708 C Co:1:042:0 0 8 >
ffff88025ad1f300 603739524 S Co:1:042:0 s 21 09 0300 0000 0008 8 = 2b380bae 765714ff
ffff88025ad1f300 603739687 C Co:1:042:0 0 8 >
ffff8802486c66c0 603755558 S Co:1:042:0 s 21 09 0300 0000 0008 8 = c75062cd 67254015
ffff8802486c66c0 603755689 C Co:1:042:0 0 8 >
ffff88025ad1f3c0 603770598 S Co:1:042:0 s 21 09 0300 0000 0008 8 = 7654c63f 2c403925
ffff88025ad1f3c0 603770687 C Co:1:042:0 0 8 >
ffff88025ad1f3c0 603787518 S Co:1:042:0 s 21 09 0300 0000 0008 8 = 51e0a364 faa6b3e2
ffff88025ad1f3c0 603787709 C Co:1:042:0 0 8 >
ffff8802486c66c0 603802579 S Co:1:042:0 s 21 09 0300 0000 0008 8 = 85b2d7a0 d73898c2
ffff8802486c66c0 603802689 C Co:1:042:0 0 8 >
ffff8802486c6000 603817626 S Co:1:042:0 s 21 09 0300 0000 0008 8 = d52e35dc 213b837f
ffff8802486c6000 603817833 C Co:1:042:0 0 8 >
ffff880403760f00 603833650 S Co:1:042:0 s 21 09 0300 0000 0008 8 = 16dc0504 06d84797
ffff880403760f00 603833816 C Co:1:042:0 0 8 >
ffff880403760cc0 603848537 S Co:1:042:0 s 21 09 0300 0000 0008 8 = b3e78088 0b9e67ce
ffff880403760cc0 603848693 C Co:1:042:0 0 8 >
ffff880248699840 603865575 S Co:1:042:0 s 21 09 0300 0000 0008 8 = 299e56dd 88fe9daa
ffff880248699840 603865735 C Co:1:042:0 0 8 >
ffff880248699840 603880614 S Co:1:042:0 s 21 09 0300 0000 0008 8 = 89f529fb 28cc56f4
ffff880248699840 603880834 C Co:1:042:0 0 8 >
ffff880248699840 603895515 S Co:1:042:0 s 21 09 0300 0000 0008 8 = fb0311df 6cc2323b
ffff880248699840 603895710 C Co:1:042:0 0 8 >
ffff8802486c6180 603912600 S Co:1:042:0 s 21 09 0300 0000 0008 8 = 38841908 27ff8752
ffff8802486c6180 603912689 C Co:1:042:0 0 8 >
ffff8802486c6f00 603927613 S Co:1:042:0 s 21 09 0300 0000 0008 8 = 0d56befc 0182dccf
ffff8802486c6f00 603927815 C Co:1:042:0 0 8 >
ffff880248699840 603942302 S Co:1:042:0 s 21 09 0300 0000 0008 8 = ddfd75c3 f6b1708c
ffff880248699840 603942443 C Co:1:042:0 0 8 >
ffff880248699cc0 603958288 S Co:1:042:0 s 21 09 0300 0000 0008 8 = 1d212468 d6d7b328
ffff880248699cc0 603958457 C Co:1:042:0 0 8 >
ffff880248699cc0 603976242 S Co:1:042:0 s 21 09 0300 0000 0008 8 = d70da67d c49fc985
ffff880248699cc0 603976455 C Co:1:042:0 0 8 >
ffff880248699cc0 603989400 S Co:1:042:0 s 21 09 0300 0000 0008 8 = 2a314996 ba9c0c4a
ffff880248699cc0 603989565 C Co:1:042:0 0 8 >
ffff880403760cc0 604006157 S Co:1:042:0 s 21 09 0300 0000 0008 8 = c79f51cb 01c38960
ffff880403760cc0 604006325 C Co:1:042:0 0 8 >
ffff880403760cc0 604021250 S Co:1:042:0 s 21 09 0300 0000 0008 8 = 738f7538 bbed8077
ffff880403760cc0 604021463 C Co:1:042:0 0 8 >
ffff8802486c6540 604036298 S Co:1:042:0 s 21 09 0300 0000 0008 8 = 8adc5f7f 5c58e780
ffff8802486c6540 604036456 C Co:1:042:0 0 8 >
ffff880248699b40 604053452 S Co:1:042:0 s 21 09 0300 0000 0008 8 = 78862e42 2a24e632
ffff880248699b40 604053566 C Co:1:042:0 0 8 >
ffff88025ad1f6c0 604067496 S Co:1:042:0 s 21 09 0300 0000 0008 8 = 3f31f6ac c2d85a88
ffff88025ad1f6c0 604067692 C Co:1:042:0 0 8 >
ffff880403760f00 604083542 S Co:1:042:0 s 21 09 0300 0000 0008 8 = f6a33ce7 95dd543f
ffff880403760f00 604083692 C Co:1:042:0 0 8 >
ffff88025ad1f3c0 604098434 S Co:1:042:0 s 21 09 0300 0000 0008 8 = 47487da5 6400985a
ffff88025ad1f3c0 604098577 C Co:1:042:0 0 8 >
ffff88025ad1f3c0 604114415 S Co:1:042:0 s 21 09 0300 0000 0008 8 = eeafa69a caf321a0
ffff88025ad1f3c0 604114581 C Co:1:042:0 0 8 >
ffff8802486c6300 604129607 S Co:1:042:0 s 21 09 0300 0000 0008 8 = 3f0c9bfd b1ca9a1b
ffff8802486c6300 604129715 C Co:1:042:0 0 8 >
ffff880248699180 604146386 S Co:1:042:0 s 21 09 0300 0000 0008 8 = 9eb6b20d da80e499
ffff880248699180 604146564 C Co:1:042:0 0 8 >
ffff880248699180 604162454 S Co:1:042:0 s 21 09 0300 0000 0008 8 = 07a93788 5771952c
ffff880248699180 604162564 C Co:1:042:0 0 8 >
ffff88025ad1f840 604177497 S Co:1:042:0 s 21 09 0300 0000 0008 8 = 8603e833 12df75ac
ffff88025ad1f840 604177703 C Co:1:042:0 0 8 >
ffff88025ad1f840 604192557 S Co:1:042:0 s 21 09 0300 0000 0008 8 = bd887857 46700132
ffff88025ad1f840 604192716 C Co:1:042:0 0 8 >
ffff88025ad1f840 604209458 S Co:1:042:0 s 21 09 0300 0000 0008 8 = 63210e40 03acea9c
ffff88025ad1f840 604209588 C Co:1:042:0 0 8 >
ffff88025ad1f840 604224491 S Co:1:042:0 s 21 09 0300 0000 0008 8 = c257c5bf ac82950e
ffff88025ad1f840 604224714 C Co:1:042:0 0 8 >
ffff88025ad1f9c0 604239603 S Co:1:042:0 s 21 09 0300 0000 0008 8 = 36da2ca7 7ac29a6d
ffff88025ad1f9c0 604239809 C Co:1:042:0 0 8 >
ffff880403760cc0 604256442 S Co:1:042:0 s 21 09 0300 0000 0008 8 = b3fec552 f8a247e4
ffff880403760cc0 604256594 C Co:1:042:0 0 8 >
ffff880248699a80 604271486 S Co:1:042:0 s 21 09 0300 0000 0008 8 = 3d3a881b 873b1d61
ffff880248699a80 604271593 C Co:1:042:0 0 8 >
ffff880403760cc0 604286548 S Co:1:042:0 s 21 09 0300 0000 0008 8 = 6faa60e3 da0a5017
ffff880403760cc0 604286694 C Co:1:042:0 0 8 >
ffff880403760cc0 604301540 S Co:1:042:0 s 21 09 0300 0000 0008 8 = f78caa8e 7a7249fc
ffff880403760cc0 604301706 C Co:1:042:0 0 8 >
ffff88025ad1f9c0 604318474 S Co:1:042:0 s 21 09 0300 0000 0008 8 = 17c4bb85 4137254a
ffff88025ad1f9c0 604318603 C Co:1:042:0 0 8 >
ffff88025ad1f9c0 604333521 S Co:1:042:0 s 21 09 0300 0000 0008 8 = 235b5934 e0033500
ffff88025ad1f9c0 604333693 C Co:1:042:0 0 8 >
ffff880248699c00 604348937 S Co:1:042:0 s 21 09 0300 0000 0008 8 = 08fa3f8b 5be37e60
ffff880248699c00 604349094 C Co:1:042:0 0 8 >
ffff88025ad1f9c0 604365462 S Co:1:042:0 s 21 09 0300 0000 0008 8 = c1719b7f 89c93970
ffff88025ad1f9c0 604365571 C Co:1:042:0 0 8 >
ffff880403760cc0 604380492 S Co:1:042:0 s 21 09 0300 0000 0008 8 = e1349189 9709527b
ffff880403760cc0 604380713 C Co:1:042:0 0 8 >
ffff880403760cc0 604395576 S Co:1:042:0 s 21 09 0300 0000 0008 8 = 0fdab823 84deeb90
ffff880403760cc0 604395697 C Co:1:042:0 0 8 >
ffff8804053656c0 604412447 S Co:1:042:0 s 21 09 0300 0000 0008 8 = 839f9a50 a5e4d800
ffff8804053656c0 604412569 C Co:1:042:0 0 8 >
ffff880403760cc0 604427469 S Co:1:042:0 s 21 09 0300 0000 0008 8 = 8ce13613 209e22e2
ffff880403760cc0 604427568 C Co:1:042:0 0 8 >
ffff880248699cc0 604442536 S Co:1:042:0 s 21 09 0300 0000 0008 8 = 0ba580f5 73ef8790
ffff880248699cc0 604442702 C Co:1:042:0 0 8 >
ffff880248699cc0 604459433 S Co:1:042:0 s 21 09 0300 0000 0008 8 = f711dd82 eca3f629
ffff880248699cc0 604459577 C Co:1:042:0 0 8 >
ffff880248699cc0 604474465 S Co:1:042:0 s 21 09 0300 0000 0008 8 = d9f1aaca 30e51510
ffff880248699cc0 604474591 C Co:1:042:0 0 8 >
ffff880248699cc0 604489504 S Co:1:042:0 s 21 09 0300 0000 0008 8 = 4f34b4e2 b7c8bd69
ffff880248699cc0 604489696 C Co:1:042:0 0 8 >
ffff880248699cc0 604506423 S Co:1:042:0 s 21 09 0300 0000 0008 8 = 8c6ebf62 4dc17aa1
ffff880248699cc0 604506571 C Co:1:042:0 0 8 >
ffff880403760f00 604521416 S Co:1:042:0 s 21 09 0300 0000 0008 8 = d45601e6 90290ee5
ffff880403760f00 604521570 C Co:1:042:0 0 8 >
ffff8802486c6300 604536493 S Co:1:042:0 s 21 09 0300 0000 0008 8 = 0248a690 76beeea7
ffff8802486c6300 604536717 C Co:1:042:0 0 8 >
ffff8802486990c0 604551580 S Co:1:042:0 s 21 09 0300 0000 0008 8 = 04c24c83 c621c11e
ffff8802486990c0 604551715 C Co:1:042:0 0 8 >
ffff88025ad1f9c0 604568392 S Co:1:042:0 s 21 09 0300 0000 0008 8 = 5be98667 9c57e5c5
ffff88025ad1f9c0 604568585 C Co:1:042:0 0 8 >
ffff88025ad1f540 604584496 S Co:1:042:0 s 21 09 0300 0000 0008 8 = 9e035be9 e84aecd9
ffff88025ad1f540 604584696 C Co:1:042:0 0 8 >
ffff880403760cc0 604599539 S Co:1:042:0 s 21 09 0300 0000 0008 8 = f6fcc63a ee4719de
ffff880403760cc0 604599696 C Co:1:042:0 0 8 >
ffff880403760f00 604614431 S Co:1:042:0 s 21 09 0300 0000 0008 8 = a1e4368e c580e619
ffff880403760f00 604614623 C Co:1:042:0 0 8 >
ffff8802486c6f00 604630457 S Co:1:042:0 s 21 09 0300 0000 0008 8 = 716d0d9d da898015
ffff8802486c6f00 604630601 C Co:1:042:0 0 8 >
ffff8802486c6f00 604645478 S Co:1:042:0 s 21 09 0300 0000 0008 8 = 4c6f2323 6cdd4720
ffff8802486c6f00 604645567 C Co:1:042:0 0 8 >
ffff880248699180 604662563 S Co:1:042:0 s 21 09 0300 0000 0008 8 = ac664262 0f5950cc
ffff880248699180 604662693 C Co:1:042:0 0 8 >
ffff8802486c69c0 604677466 S Co:1:042:0 s 21 09 0300 0000 0008 8 = 1ff0aa9c 2bbde571
ffff8802486c69c0 604677570 C Co:1:042:0 0 8 >
ffff880248699e40 604692505 S Co:1:042:0 s 21 09 0300 0000 0008 8 = c6528d9b 7d3002a8
ffff880248699e40 604692717 C Co:1:042:0 0 8 >
ffff88025ad1f180 604709572 S Co:1:042:0 s 21 09 0300 0000 0008 8 = d8f2922c 93bad7d0
ffff88025ad1f180 604709733 C Co:1:042:0 0 8 >
ffff8802486c6840 604724447 S Co:1:042:0 s 21 09 0300 0000 0008 8 = 1ddc539d 52ca4b8a
ffff8802486c6840 604724571 C Co:1:042:0 0 8 >
ffff88025ad1f3c0 604739439 S Co:1:042:0 s 21 09 0300 0000 0008 8 = 7640e145 72b0753f
ffff88025ad1f3c0 604739569 C Co:1:042:0 0 8 >
ffff88025ad1f3c0 604755504 S Co:1:042:0 s 21 09 0300 0000 0008 8 = 52f03dfa fe222297
ffff88025ad1f3c0 604755718 C Co:1:042:0 0 8 >
ffff8804053656c0 604770525 S Co:1:042:0 s 21 09 0300 0000 0008 8 = 38e4de9b d6b95501
ffff8804053656c0 604770717 C Co:1:042:0 0 8 >
ffff8802486c6840 604786508 S Co:1:042:0 s 21 09 0300 0000 0008 8 = 42b83086 2f73c030
ffff8802486c6840 604786717 C Co:1:042:0 0 8 >
ffff8802486c6840 604801495 S Co:1:042:0 s 21 09 0300 0000 0008 8 = 9d2a1220 10314e9a
ffff8802486c6840 604801695 C Co:1:042:0 0 8 >
ffff8802486c6a80 604817563 S Co:1:042:0 s 21 09 0300 0000 0008 8 = 0c9f5552 d5389bf9
ffff8802486c6a80 604817696 C Co:1:042:0 0 8 >
ffff88025ad1ff00 604833403 S Co:1:042:0 s 21 09 0300 0000 0008 8 = 659d4208 adb278cc
ffff88025ad1ff00 604833569 C Co:1:042:0 0 8 >
ffff880248699c00 604848462 S Co:1:042:0 s 21 09 0300 0000 0008 8 = 115012b3 1e2c69d5
ffff880248699c00 604848600 C Co:1:042:0 0 8 >
ffff88025ad1ff00 604865558 S Co:1:042:0 s 21 09 0300 0000 0008 8 = 8e0875c6 7e18299b
ffff88025ad1ff00 604865697 C Co:1:042:0 0 8 >
ffff8802486c6900 604880461 S Co:1:042:0 s 21 09 0300 0000 0008 8 = eeb70e3a 794b22e7
ffff8802486c6900 604880594 C Co:1:042:0 0 8 >
ffff8802486c6900 604895696 S Co:1:042:0 s 21 09 0300 0000 0008 8 = 5775f30c 907df849
ffff8802486c6900 604895844 C Co:1:042:0 0 8 >
ffff8802486c6a80 604911530 S Co:1:042:0 s 21 09 0300 0000 0008 8 = 82fe30bc 96cefd92
ffff8802486c6a80 604911719 C Co:1:042:0 0 8 >
ffff8802486c6900 604928454 S Co:1:042:0 s 21 09 0300 0000 0008 8 = 3f3043ce 343dbc59
ffff8802486c6900 604928574 C Co:1:042:0 0 8 >
ffff8802486c6900 604943499 S Co:1:042:0 s 21 09 0300 0000 0008 8 = ee909f4b 64317179
ffff8802486c6900 604943698 C Co:1:042:0 0 8 >
ffff8802486c6a80 604958462 S Co:1:042:0 s 21 09 0300 0000 0008 8 = 05c42b3f f7f38d8f
ffff8802486c6a80 604958570 C Co:1:042:0 0 8 >
ffff8802486c6a80 604974573 S Co:1:042:0 s 21 09 0300 0000 0008 8 = 8f18c23a 112f357e
ffff8802486c6a80 604974724 C Co:1:042:0 0 8 >
ffff88025ad1fe40 604989404 S Co:1:042:0 s 21 09 0300 0000 0008 8 = a9fcb3d1 a978c2ed
ffff88025ad1fe40 604989570 C Co:1:042:0 0 8 >
ffff88025ad1fd80 605006516 S Co:1:042:0 s 21 09 0300 0000 0008 8 = 0582401c 0cc440c6
ffff88025ad1fd80 605006720 C Co:1:042:0 0 8 >
ffff88025ad1fd80 605021552 S Co:1:042:0 s 21 09 0300 0000 0008 8 = 69e22138 59eaf0b7
ffff88025ad1fd80 605021698 C Co:1:042:0 0 8 >
ffff8802486c6240 605036395 S Co:1:042:0 s 21 09 0300 0000 0008 8 = 2ef800c5 0529c8b2
ffff8802486c6240 605036570 C Co:1:042:0 0 8 >
ffff880403760f00 605053490 S Co:1:042:0 s 21 09 0300 0000 0008 8 = c4c3fd67 56a2f06e
ffff880403760f00 605053607 C Co:1:042:0 0 8 >
ffff880403760cc0 605068529 S Co:1:042:0 s 21 09 0300 0000 0008 8 = 2ae52a46 eada45e6
ffff880403760cc0 605068718 C Co:1:042:0 0 8 >
ffff880403760cc0 605083436 S Co:1:042:0 s 21 09 0300 0000 0008 8 = 79280d90 303bd8d8
ffff880403760cc0 605083595 C Co:1:042:0 0 8 >
ffff880403760f00 605098454 S Co:1:042:0 s 21 09 0300 0000 0008 8 = 58f523f4 eb926e45
ffff880403760f00 605098595 C Co:1:042:0 0 8 >
ffff880403760f00 605114463 S Co:1:042:0 s 21 09 0300 0000 0008 8 = 87dc5927 b49100f6
ffff880403760f00 605114596 C Co:1:042:0 0 8 >
ffff8804053656c0 605130506 S Co:1:042:0 s 21 09 0300 0000 0008 8 = 57129361 764d3af2
ffff8804053656c0 605130715 C Co:1:042:0 0 8 >
ffff880248699cc0 605145401 S Co:1:042:0 s 21 09 0300 0000 0008 8 = 2eec28de f2bffe0b
ffff880248699cc0 605145589 C Co:1:042:0 0 8 >
ffff8802486c6d80 605162524 S Co:1:042:0 s 21 09 0300 0000 0008 8 = 05676260 3b44e050
ffff8802486c6d80 605162721 C Co:1:042:0 0 8 >
ffff8802486c6d80 605177560 S Co:1:042:0 s 21 09 0300 0000 0008 8 = eca100a9 391fa99a
ffff8802486c6d80 605177720 C Co:1:042:0 0 8 >
ffff8802486c6d80 605192454 S Co:1:042:0 s 21 09 0300 0000 0008 8 = 835fb604 28f3d602
ffff8802486c6d80 605192596 C Co:1:042:0 0 8 >
ffff8802486c6d80 605209496 S Co:1:042:0 s 21 09 0300 0000 0008 8 = 8087a9bb 184c1867
ffff8802486c6d80 605209601 C Co:1:042:0 0 8 >
ffff8802486990c0 605224547 S Co:1:042:0 s 21 09 0300 0000 0008 8 = 2da6f5a0 6c16d5eb
ffff8802486990c0 605224728 C Co:1:042:0 0 8 >
ffff8803e6d16180 605239439 S Co:1:042:0 s 21 09 0300 0000 0008 8 = e9692986 5d22a374
ffff8803e6d16180 605239579 C Co:1:042:0 0 8 >
ffff8803e6d169c0 605256492 S Co:1:042:0 s 21 09 0300 0000 0008 8 = a525c8c7 77a6d22e
ffff8803e6d169c0 605256585 C Co:1:042:0 0 8 >
ffff8803d54249c0 605271567 S Co:1:042:0 s 21 09 0300 0000 0008 8 = 6652c8be 19bce105
ffff8803d54249c0 605271708 C Co:1:042:0 0 8 >
ffff8803d54249c0 605289727 S Co:1:042:0 s 21 09 0300 0000 0008 8 = c80a154d f8e0052d
ffff8803d54249c0 605289848 C Co:1:042:0 0 8 >
ffff8802486c6900 605302410 S Co:1:042:0 s 21 09 0300 0000 0008 8 = 778c0d56 9a74a79c
ffff8802486c6900 605302572 C Co:1:042:0 0 8 >
ffff8802486c6900 605317509 S Co:1:042:0 s 21 09 0300 0000 0008 8 = b6bd0343 dd3de48c
ffff8802486c6900 605317722 C Co:1:042:0 0 8 >
ffff88025ad1f000 605334492 S Co:1:042:0 s 21 09 0300 0000 0008 8 = daa3be80 6fe50efc
ffff88025ad1f000 605334720 C Co:1:042:0 0 8 >
ffff8802486c6900 605349478 S Co:1:042:0 s 21 09 0300 0000 0008 8 = cdebf9fe 5579282f
ffff8802486c6900 605349578 C Co:1:042:0 0 8 >
ffff8803e6d16a80 605364489 S Co:1:042:0 s 21 09 0300 0000 0008 8 = 8e62e3b0 67eb6c29
ffff8803e6d16a80 605364603 C Co:1:042:0 0 8 >
ffff880405365240 605381586 S Co:1:042:0 s 21 09 0300 0000 0008 8 = ae7d9e10 d090c737
ffff880405365240 605381701 C Co:1:042:0 0 8 >
ffff8802486c6240 605396495 S Co:1:042:0 s 21 09 0300 0000 0008 8 = d2d4c299 90a15966
ffff8802486c6240 605396576 C Co:1:042:0 0 8 >
ffff8803e300a9c0 605411486 S Co:1:042:0 s 21 09 0300 0000 0008 8 = 36a1d94c fcbbf708
ffff8803e300a9c0 605411576 C Co:1:042:0 0 8 >
ffff8803e300a540 605428534 S Co:1:042:0 s 21 09 0300 0000 0008 8 = 2643e32d 3b61aa34
ffff8803e300a540 605428725 C Co:1:042:0 0 8 >
ffff88025ad1ff00 605443407 S Co:1:042:0 s 21 09 0300 0000 0008 8 = 84bfd2c5 c9773045
ffff88025ad1ff00 605443598 C Co:1:042:0 0 8 >
ffff880403990780 605458471 S Co:1:042:0 s 21 09 0300 0000 0008 8 = 473c0ca0 f5c77958
ffff880403990780 605458603 C Co:1:042:0 0 8 >
ffff8802486c6240 605475525 S Co:1:042:0 s 21 09 0300 0000 0008 8 = f984eece 657d29d1
ffff8802486c6240 605475703 C Co:1:042:0 0 8 >
ffff8802486990c0 605490582 S Co:1:042:0 s 21 09 0300 0000 0008 8 = 36874565 8fad1ad5
ffff8802486990c0 605490726 C Co:1:042:0 0 8 >
ffff8802486990c0 605505463 S Co:1:042:0 s 21 09 0300 0000 0008 8 = 32dad5fb 3fcad9ce
ffff8802486990c0 605505579 C Co:1:042:0 0 8 >
ffff880403990780 605520575 S Co:1:042:0 s 21 09 0300 0000 0008 8 = 3132d52e 162e26ec
ffff880403990780 605520705 C Co:1:042:0 0 8 >
ffff88025ad1f480 605537558 S Co:1:042:0 s 21 09 0300 0000 0008 8 = 0fec6f1e 079776a1
ffff88025ad1f480 605537704 C Co:1:042:0 0 8 >
ffff880403862480 605568435 S Co:1:042:0 s 21 09 0300 0000 0008 8 = 55037d63 383cac01
ffff880403862480 605568574 C Co:1:042:0 0 8 >
ffff880248699000 605599392 S Ci:1:042:0 s a1 01 0300 0000 0008 8 <
ffff880248699000 605599596 C Ci:1:042:0 0 8 = aa040000 00000000
ffff880365a3e9c0 632364663 S Co:1:042:0 s 21 09 0300 0000 0008 8 = 55010100 00ff075d
ffff880365a3e9c0 632364804 C Co:1:042:0 0 8 >
ffff8802486993c0 632395583 S Ci:1:042:0 s a1 01 0300 0000 0008 8 <
ffff8802486993c0 632395679 C Ci:1:042:0 0 8 = aa020000 00000000
ffff880403990600 632427252 S Co:1:042:0 s 21 09 0300 0000 0008 8 = 0b010101 00000e04
ffff880403990600 632427436 C Co:1:042:0 0 8 >
ffff880403990600 632443584 S Co:1:042:0 s 21 09 0300 0000 0008 8 = a1873acf 810ae8d2
ffff880403990600 632443680 C Co:1:042:0 0 8 >
ffff8803ed17f9c0 632458622 S Co:1:042:0 s 21 09 0300 0000 0008 8 = 01809400 15ffb7ff
ffff8803ed17f9c0 632458825 C Co:1:042:0 0 8 >
ffff880248699b40 632473835 S Co:1:042:0 s 21 09 0300 0000 0008 8 = d7ff67ff b7ffe7ff
ffff880248699b40 632473932 C Co:1:042:0 0 8 >
ffff880365a3e9c0 632490711 S Co:1:042:0 s 21 09 0300 0000 0008 8 = d7ff27ff a7ffb7ff
ffff880365a3e9c0 632490810 C Co:1:042:0 0 8 >
ffff880365a3e9c0 632505662 S Co:1:042:0 s 21 09 0300 0000 0008 8 = f7ffe7ff f7ffb7ff
ffff880365a3e9c0 632505840 C Co:1:042:0 0 8 >
ffff880365a3e9c0 632520733 S Co:1:042:0 s 21 09 0300 0000 0008 8 = 57ff57ff e7ff17ff
ffff880365a3e9c0 632520935 C Co:1:042:0 0 8 >
ffff880365a3e9c0 632537779 S Co:1:042:0 s 21 09 0300 0000 0008 8 = 07ffb7ff 37ff27ff
ffff880365a3e9c0 632537933 C Co:1:042:0 0 8 >
ffff880365a3e9c0 632552596 S Co:1:042:0 s 21 09 0300 0000 0008 8 = b7ffa7ff 57ffc7ff
ffff880365a3e9c0 632552681 C Co:1:042:0 0 8 >
ffff880365a3e9c0 632568234 S Co:1:042:0 s 21 09 0300 0000 0008 8 = 87ff07ff 97fff7ff
ffff880365a3e9c0 632568441 C Co:1:042:0 0 8 >
ffff8803ed17f9c0 632584457 S Co:1:042:0 s 21 09 0300 0000 0008 8 = 87ffe7ff e7ffe7ff
ffff8803ed17f9c0 632584581 C Co:1:042:0 0 8 >
ffff8803e6ff2300 632599281 S Co:1:042:0 s 21 09 0300 0000 0008 8 = 57ff67ff 57ff77ff
ffff8803e6ff2300 632599450 C Co:1:042:0 0 8 >
ffff880365a3e6c0 632615377 S Co:1:042:0 s 21 09 0300 0000 0008 8 = 37ff27ff 57ff27ff
ffff880365a3e6c0 632615581 C Co:1:042:0 0 8 >
ffff880365a3e6c0 632630422 S Co:1:042:0 s 21 09 0300 0000 0008 8 = d7ff27ff 17ff67ff
ffff880365a3e6c0 632630581 C Co:1:042:0 0 8 >
ffff880365a3e6c0 632645399 S Co:1:042:0 s 21 09 0300 0000 0008 8 = 67ff37ff b7ff37ff
ffff880365a3e6c0 632645576 C Co:1:042:0 0 8 >
ffff880365a3e6c0 632662376 S Co:1:042:0 s 21 09 0300 0000 0008 8 = 97ff67ff 87ff77ff
ffff880365a3e6c0 632662580 C Co:1:042:0 0 8 >
ffff880365a3e6c0 632677412 S Co:1:042:0 s 21 09 0300 0000 0008 8 = f7ff17ff b7ff77ff
ffff880365a3e6c0 632677560 C Co:1:042:0 0 8 >
ffff880365a3e6c0 632692453 S Co:1:042:0 s 21 09 0300 0000 0008 8 = d7ffe7ff e7ff97ff
ffff880365a3e6c0 632692581 C Co:1:042:0 0 8 >
ffff880365a3e6c0 632709371 S Co:1:042:0 s 21 09 0300 0000 0008 8 = f7ff57ff 67ff47ff
ffff880365a3e6c0 632709585 C Co:1:042:0 0 8 >
ffff880365a3e9c0 632724406 S Co:1:042:0 s 21 09 0300 0000 0008 8 = d7ff07ff 67ff67ff
ffff880365a3e9c0 632724580 C Co:1:042:0 0 8 >
ffff880403990600 632739437 S Co:1:042:0 s 21 09 0300 0000 0008 8 = 47ffe7ff a7ff97ff
ffff880403990600 632739561 C Co:1:042:0 0 8 >
ffff880403990000 632755334 S Co:1:042:0 s 21 09 0300 0000 0008 8 = a7ff17ff e7ff07ff
ffff880403990000 632755598 C Co:1:042:0 0 8 >
ffff880403990000 632770475 S Co:1:042:0 s 21 09 0300 0000 0008 8 = 57ff67ff 77ff87ff
ffff880403990000 632770586 C Co:1:042:0 0 8 >
ffff880403990000 632786411 S Co:1:042:0 s 21 09 0300 0000 0008 8 = 67ffd7ff 07ff77ff
ffff880403990000 632786562 C Co:1:042:0 0 8 >
ffff880403990600 632802658 S Co:1:042:0 s 21 09 0300 0000 0008 8 = 57ff97ff b7ffa7ff
ffff880403990600 632802877 C Co:1:042:0 0 8 >
ffff880403990000 632817409 S Co:1:042:0 s 21 09 0300 0000 0008 8 = c7fff7ff 27ffd7ff
ffff880403990000 632817625 C Co:1:042:0 0 8 >
ffff880403990000 632833438 S Co:1:042:0 s 21 09 0300 0000 0008 8 = 07fff7ff 77ffb7ff
ffff880403990000 632833605 C Co:1:042:0 0 8 >
ffff880403990000 632848460 S Co:1:042:0 s 21 09 0300 0000 0008 8 = b7ff97ff 97ff37ff
ffff880403990000 632848561 C Co:1:042:0 0 8 >
ffff880365a3eb40 632865359 S Co:1:042:0 s 21 09 0300 0000 0008 8 = d7ff27ff 97ff07ff
ffff880365a3eb40 632865563 C Co:1:042:0 0 8 >
ffff8803ed17fb40 632880342 S Co:1:042:0 s 21 09 0300 0000 0008 8 = c7ffd7ff 07ff17ff
ffff8803ed17fb40 632880559 C Co:1:042:0 0 8 >
ffff880365a3e000 632895371 S Co:1:042:0 s 21 09 0300 0000 0008 8 = d7ff97ff 47ffe7ff
ffff880365a3e000 632895558 C Co:1:042:0 0 8 >
ffff8803ed17f240 632911350 S Co:1:042:0 s 21 09 0300 0000 0008 8 = a7ff47ff 67ff87ff
ffff8803ed17f240 632911583 C Co:1:042:0 0 8 >
ffff8803e6ff2780 632926932 S Co:1:042:0 s 21 09 0300 0000 0008 8 = a7ffe7ff 67ff47ff
ffff8803e6ff2780 632927082 C Co:1:042:0 0 8 >
ffff8803e6ff2780 632943984 S Co:1:042:0 s 21 09 0300 0000 0008 8 = a7ff67ff 17ff37ff
ffff8803e6ff2780 632944208 C Co:1:042:0 0 8 >
ffff8803e6ff2b40 632958876 S Co:1:042:0 s 21 09 0300 0000 0008 8 = a7ff67ff 17433f3e
ffff8803e6ff2b40 632959087 C Co:1:042:0 0 8 >
ffff8803e6ff2b40 632973908 S Co:1:042:0 s 21 09 0300 0000 0008 8 = 5a73dd88 4f618aa1
ffff8803e6ff2b40 632974061 C Co:1:042:0 0 8 >
ffff8803e6ff2b40 632989995 S Co:1:042:0 s 21 09 0300 0000 0008 8 = 1ef2c987 4155c8f8
ffff8803e6ff2b40 632990269 C Co:1:042:0 0 8 >
ffff8803e6ff2b40 633004991 S Co:1:042:0 s 21 09 0300 0000 0008 8 = 463ecdcc e161dd94
ffff8803e6ff2b40 633005209 C Co:1:042:0 0 8 >
ffff880365a3e780 633022921 S Co:1:042:0 s 21 09 0300 0000 0008 8 = 3931ae74 6cdacf3e
ffff880365a3e780 633023063 C Co:1:042:0 0 8 >
ffff8803ed17fb40 633036888 S Co:1:042:0 s 21 09 0300 0000 0008 8 = 637c16d0 ddaa4ab0
ffff8803ed17fb40 633037060 C Co:1:042:0 0 8 >
ffff8803e6d16180 633051917 S Co:1:042:0 s 21 09 0300 0000 0008 8 = b72312e5 79cf1e18
ffff8803e6d16180 633052060 C Co:1:042:0 0 8 >
ffff8803ed17f300 633068895 S Co:1:042:0 s 21 09 0300 0000 0008 8 = 27fd93ec 46dcbd9b
ffff8803ed17f300 633069085 C Co:1:042:0 0 8 >
ffff8803ed17f300 633083943 S Co:1:042:0 s 21 09 0300 0000 0008 8 = 2c37f0d1 8d75bfcd
ffff8803ed17f300 633084084 C Co:1:042:0 0 8 >
ffff8801eff40180 633098980 S Co:1:042:0 s 21 09 0300 0000 0008 8 = 43d061b6 5dd55f3b
ffff8801eff40180 633099086 C Co:1:042:0 0 8 >
ffff8801eff40180 633114870 S Co:1:042:0 s 21 09 0300 0000 0008 8 = 6c1d836f 0a4afee4
ffff8801eff40180 633115065 C Co:1:042:0 0 8 >
ffff880248699c00 633129852 S Co:1:042:0 s 21 09 0300 0000 0008 8 = ab44d805 a8b59db9
ffff880248699c00 633129936 C Co:1:042:0 0 8 >
ffff8801eff40180 633145951 S Co:1:042:0 s 21 09 0300 0000 0008 8 = 88c34636 920d6522
ffff8801eff40180 633146073 C Co:1:042:0 0 8 >
ffff8803e6ff23c0 633161133 S Co:1:042:0 s 21 09 0300 0000 0008 8 = 91e895f1 e7db217b
ffff8803e6ff23c0 633161336 C Co:1:042:0 0 8 >
ffff8803e6d16180 633177850 S Co:1:042:0 s 21 09 0300 0000 0008 8 = d559f4dc 09bdc191
ffff8803e6d16180 633178078 C Co:1:042:0 0 8 >
ffff8803e6d16180 633192984 S Co:1:042:0 s 21 09 0300 0000 0008 8 = 698b73d0 1fe6d728
ffff8803e6d16180 633193065 C Co:1:042:0 0 8 >
ffff8803e6d16180 633208027 S Co:1:042:0 s 21 09 0300 0000 0008 8 = e54d885a 939a1b76
ffff8803e6d16180 633208209 C Co:1:042:0 0 8 >
ffff8803ed17f300 633224900 S Co:1:042:0 s 21 09 0300 0000 0008 8 = e63c8c39 92b4e9a7
ffff8803ed17f300 633225072 C Co:1:042:0 0 8 >
ffff8803e6ff2c00 633239939 S Co:1:042:0 s 21 09 0300 0000 0008 8 = 8b4e3de5 9122bf59
ffff8803e6ff2c00 633240068 C Co:1:042:0 0 8 >
ffff8802486999c0 633254963 S Co:1:042:0 s 21 09 0300 0000 0008 8 = fa4a3c04 c465c21f
ffff8802486999c0 633255078 C Co:1:042:0 0 8 >
ffff8803ed17f300 633271841 S Co:1:042:0 s 21 09 0300 0000 0008 8 = db4c8ef5 a7143800
ffff8803ed17f300 633271946 C Co:1:042:0 0 8 >
ffff8803ed17f300 633286918 S Co:1:042:0 s 21 09 0300 0000 0008 8 = d9441d47 77580df7
ffff8803ed17f300 633287066 C Co:1:042:0 0 8 >
ffff8803ed17f300 633301953 S Co:1:042:0 s 21 09 0300 0000 0008 8 = 26763640 b86f5073
ffff8803ed17f300 633302066 C Co:1:042:0 0 8 >
ffff8803ed17f300 633318995 S Co:1:042:0 s 21 09 0300 0000 0008 8 = f6f90b59 af2bb5d6
ffff8803ed17f300 633319191 C Co:1:042:0 0 8 >
ffff8803ed17f300 633333849 S Co:1:042:0 s 21 09 0300 0000 0008 8 = 013a30bf e67214f8
ffff8803ed17f300 633333947 C Co:1:042:0 0 8 >
ffff8801eff40f00 633348938 S Co:1:042:0 s 21 09 0300 0000 0008 8 = 037820d2 adbee6a4
ffff8801eff40f00 633349068 C Co:1:042:0 0 8 >
ffff8802486999c0 633363992 S Co:1:042:0 s 21 09 0300 0000 0008 8 = 3d47b7a7 969dcd17
ffff8802486999c0 633364105 C Co:1:042:0 0 8 >
ffff8802486999c0 633380898 S Co:1:042:0 s 21 09 0300 0000 0008 8 = f40fb888 f7300a86
ffff8802486999c0 633381066 C Co:1:042:0 0 8 >
ffff8802486999c0 633395943 S Co:1:042:0 s 21 09 0300 0000 0008 8 = ef8d4671 6aae0797
ffff8802486999c0 633396067 C Co:1:042:0 0 8 >
ffff8803e6ff2780 633410964 S Co:1:042:0 s 21 09 0300 0000 0008 8 = fb4f6d92 4de0cde4
ffff8803e6ff2780 633411087 C Co:1:042:0 0 8 >
ffff8801eff40540 633427878 S Co:1:042:0 s 21 09 0300 0000 0008 8 = 693a98d2 44a48c7e
ffff8801eff40540 633428067 C Co:1:042:0 0 8 >
ffff8803ed17f300 633442919 S Co:1:042:0 s 21 09 0300 0000 0008 8 = 8c061b48 b46c1866
ffff8803ed17f300 633443078 C Co:1:042:0 0 8 >
ffff8803e6ff2780 633457914 S Co:1:042:0 s 21 09 0300 0000 0008 8 = 3ebea9c2 48be6914
ffff8803e6ff2780 633458084 C Co:1:042:0 0 8 >
ffff8802486999c0 633474973 S Co:1:042:0 s 21 09 0300 0000 0008 8 = 5a42dc40 6fb418f2
ffff8802486999c0 633475085 C Co:1:042:0 0 8 >
ffff8802486999c0 633489902 S Co:1:042:0 s 21 09 0300 0000 0008 8 = 41c7b277 da7be7df
ffff8802486999c0 633490090 C Co:1:042:0 0 8 >
ffff8802486999c0 633504943 S Co:1:042:0 s 21 09 0300 0000 0008 8 = 58540c51 00d637ae
ffff8802486999c0 633505077 C Co:1:042:0 0 8 >
ffff8802486999c0 633522042 S Co:1:042:0 s 21 09 0300 0000 0008 8 = 86452f6a 9b9b92a7
ffff8802486999c0 633522216 C Co:1:042:0 0 8 >
ffff8802486999c0 633536838 S Co:1:042:0 s 21 09 0300 0000 0008 8 = b8c94593 2a332103
ffff8802486999c0 633536939 C Co:1:042:0 0 8 >
ffff8802486999c0 633551938 S Co:1:042:0 s 21 09 0300 0000 0008 8 = 5e66db50 6f1c3472
ffff8802486999c0 633552074 C Co:1:042:0 0 8 >
ffff880248699540 633568999 S Co:1:042:0 s 21 09 0300 0000 0008 8 = ed72635c f068bf97
ffff880248699540 633569193 C Co:1:042:0 0 8 >
ffff880248699540 633583888 S Co:1:042:0 s 21 09 0300 0000 0008 8 = 5e99b122 793dda88
ffff880248699540 633584084 C Co:1:042:0 0 8 >
ffff880248699c00 633598856 S Co:1:042:0 s 21 09 0300 0000 0008 8 = ac5c8043 96543e51
ffff880248699c00 633599082 C Co:1:042:0 0 8 >
ffff8803ed17f600 633614020 S Co:1:042:0 s 21 09 0300 0000 0008 8 = 588eec15 1c7dcd70
ffff8803ed17f600 633614248 C Co:1:042:0 0 8 >
ffff8803e6ff2e40 633629950 S Co:1:042:0 s 21 09 0300 0000 0008 8 = e6d8f81f 9f180858
ffff8803e6ff2e40 633630090 C Co:1:042:0 0 8 >
ffff8803e6ff2e40 633647935 S Co:1:042:0 s 21 09 0300 0000 0008 8 = 5f3408a0 fa9b99f0
ffff8803e6ff2e40 633648073 C Co:1:042:0 0 8 >
ffff8803ed17f300 633660942 S Co:1:042:0 s 21 09 0300 0000 0008 8 = ce736508 cc11c913
ffff8803ed17f300 633661080 C Co:1:042:0 0 8 >
ffff8803ed17f300 633676594 S Co:1:042:0 s 21 09 0300 0000 0008 8 = c6b9be7c f8970810
ffff8803ed17f300 633676714 C Co:1:042:0 0 8 >
ffff8801eff406c0 633692431 S Co:1:042:0 s 21 09 0300 0000 0008 8 = d9fda355 23df6b29
ffff8801eff406c0 633692565 C Co:1:042:0 0 8 >
ffff8801eff406c0 633710561 S Co:1:042:0 s 21 09 0300 0000 0008 8 = 208c0a9f 37af2716
ffff8801eff406c0 633710704 C Co:1:042:0 0 8 >
ffff8803e6ff2b40 633723576 S Co:1:042:0 s 21 09 0300 0000 0008 8 = b885cd9b e4601981
ffff8803e6ff2b40 633723728 C Co:1:042:0 0 8 >
ffff8802486993c0 633740441 S Co:1:042:0 s 21 09 0300 0000 0008 8 = 405d273f 1c623f8a
ffff8802486993c0 633740574 C Co:1:042:0 0 8 >
ffff880248699b40 633755570 S Co:1:042:0 s 21 09 0300 0000 0008 8 = 5e5b3cb3 94b53e43
ffff880248699b40 633755703 C Co:1:042:0 0 8 >
ffff8803ed17fb40 633770558 S Co:1:042:0 s 21 09 0300 0000 0008 8 = 3a1a91d4 486fdc32
ffff8803ed17fb40 633770693 C Co:1:042:0 0 8 >
ffff8803ed17f300 633787653 S Co:1:042:0 s 21 09 0300 0000 0008 8 = ff0c8eb3 f53b85d4
ffff8803ed17f300 633787819 C Co:1:042:0 0 8 >
ffff8803e6ff2b40 633801274 S Co:1:042:0 s 21 09 0300 0000 0008 8 = 5ff30115 9fd5c917
ffff8803e6ff2b40 633801459 C Co:1:042:0 0 8 >
ffff8803e6ff2b40 633817298 S Co:1:042:0 s 21 09 0300 0000 0008 8 = 0e689cf3 0b91dadd
ffff8803e6ff2b40 633817447 C Co:1:042:0 0 8 >
ffff8803e6ff2d80 633833344 S Co:1:042:0 s 21 09 0300 0000 0008 8 = 445673f9 44d4117d
ffff8803e6ff2d80 633833567 C Co:1:042:0 0 8 >
ffff8803e6ff2d80 633848296 S Co:1:042:0 s 21 09 0300 0000 0008 8 = 3e7e8109 18986743
ffff8803e6ff2d80 633848447 C Co:1:042:0 0 8 >
ffff8803ed17fc00 633866298 S Co:1:042:0 s 21 09 0300 0000 0008 8 = bbf323b7 9aeafeed
ffff8803ed17fc00 633866447 C Co:1:042:0 0 8 >
ffff8803ed17fe40 633881284 S Co:1:042:0 s 21 09 0300 0000 0008 8 = 819d99cc a06d982f
ffff8803ed17fe40 633881464 C Co:1:042:0 0 8 >
ffff8803ed17fe40 633896194 S Co:1:042:0 s 21 09 0300 0000 0008 8 = d7b88ac5 44d61c2e
ffff8803ed17fe40 633896318 C Co:1:042:0 0 8 >
ffff8803ed17fe40 633912291 S Co:1:042:0 s 21 09 0300 0000 0008 8 = 0b547f54 656f1607
ffff8803ed17fe40 633912458 C Co:1:042:0 0 8 >
ffff8803e6ff20c0 633928362 S Co:1:042:0 s 21 09 0300 0000 0008 8 = ebd464dc 25973647
ffff8803e6ff20c0 633928575 C Co:1:042:0 0 8 >
ffff8803e6ff2d80 633943243 S Co:1:042:0 s 21 09 0300 0000 0008 8 = 4e720df6 6a3fce71
ffff8803e6ff2d80 633943455 C Co:1:042:0 0 8 >
ffff8803e6ff2d80 633958279 S Co:1:042:0 s 21 09 0300 0000 0008 8 = 8bb7adf1 5f6d567e
ffff8803e6ff2d80 633958453 C Co:1:042:0 0 8 >
ffff8803e6ff2d80 633973341 S Co:1:042:0 s 21 09 0300 0000 0008 8 = fe055e4c f3baea56
ffff8803e6ff2d80 633973591 C Co:1:042:0 0 8 >
ffff8803e6ff2d80 633990299 S Co:1:042:0 s 21 09 0300 0000 0008 8 = 88109e3c 57d5c95a
ffff8803e6ff2d80 633990462 C Co:1:042:0 0 8 >
ffff8803ed17fe40 634005250 S Co:1:042:0 s 21 09 0300 0000 0008 8 = 0e5ece2a 8200d6dc
ffff8803ed17fe40 634005458 C Co:1:042:0 0 8 >
ffff8803e6ff2480 634020232 S Co:1:042:0 s 21 09 0300 0000 0008 8 = f7cdb434 ae9018a3
ffff8803e6ff2480 634020458 C Co:1:042:0 0 8 >
ffff8801eff40f00 634037356 S Co:1:042:0 s 21 09 0300 0000 0008 8 = b00bf8a9 da6f3b6a
ffff8801eff40f00 634037582 C Co:1:042:0 0 8 >
ffff8803ed17fcc0 634052250 S Co:1:042:0 s 21 09 0300 0000 0008 8 = 2a1da88f 489c0f60
ffff8803ed17fcc0 634052458 C Co:1:042:0 0 8 >
ffff8803ed17f480 634067275 S Co:1:042:0 s 21 09 0300 0000 0008 8 = 58dbb61f ffa806a7
ffff8803ed17f480 634067448 C Co:1:042:0 0 8 >
ffff8803ed17f480 634083326 S Co:1:042:0 s 21 09 0300 0000 0008 8 = b4707746 4838b8d7
ffff8803ed17f480 634083592 C Co:1:042:0 0 8 >
ffff8803e6ff2d80 634099241 S Co:1:042:0 s 21 09 0300 0000 0008 8 = b9dc2324 3388617a
ffff8803e6ff2d80 634099458 C Co:1:042:0 0 8 >
ffff8803ed17f480 634114206 S Co:1:042:0 s 21 09 0300 0000 0008 8 = 68745a8e 12e46090
ffff8803ed17f480 634114319 C Co:1:042:0 0 8 >
ffff880248699b40 634130332 S Co:1:042:0 s 21 09 0300 0000 0008 8 = c55f9c8e fa2eb80b
ffff880248699b40 634130573 C Co:1:042:0 0 8 >
ffff8803ed17f480 634145669 S Co:1:042:0 s 21 09 0300 0000 0008 8 = 5919cddf 465d9051
ffff8803ed17f480 634145844 C Co:1:042:0 0 8 >
ffff8803ed17f480 634162278 S Co:1:042:0 s 21 09 0300 0000 0008 8 = b0f1b974 16fbb4bf
ffff8803ed17f480 634162484 C Co:1:042:0 0 8 >
ffff8801eff40b40 634177310 S Co:1:042:0 s 21 09 0300 0000 0008 8 = da8d8cf0 caa41422
ffff8801eff40b40 634177467 C Co:1:042:0 0 8 >
ffff880248699cc0 634192391 S Co:1:042:0 s 21 09 0300 0000 0008 8 = ec63572d 8a8c423f
ffff880248699cc0 634192594 C Co:1:042:0 0 8 >
ffff880248699cc0 634209271 S Co:1:042:0 s 21 09 0300 0000 0008 8 = 7f4091b8 c0f7f74a
ffff880248699cc0 634209474 C Co:1:042:0 0 8 >
ffff880248699cc0 634224295 S Co:1:042:0 s 21 09 0300 0000 0008 8 = 2dc29151 9ac18d70
ffff880248699cc0 634224472 C Co:1:042:0 0 8 >
ffff8803ed17f480 634239338 S Co:1:042:0 s 21 09 0300 0000 0008 8 = 19e0166e 8bd6834f
ffff8803ed17f480 634239595 C Co:1:042:0 0 8 >
ffff8803ed17f480 634256195 S Co:1:042:0 s 21 09 0300 0000 0008 8 = 665fc1b6 c8b8fe7b
ffff8803ed17f480 634256321 C Co:1:042:0 0 8 >
ffff8801eff40180 634271276 S Co:1:042:0 s 21 09 0300 0000 0008 8 = bd5c9888 cdfe45f9
ffff8801eff40180 634271449 C Co:1:042:0 0 8 >
ffff8803ed17f480 634288328 S Co:1:042:0 s 21 09 0300 0000 0008 8 = cac78374 d8d142c5
ffff8803ed17f480 634288603 C Co:1:042:0 0 8 >
ffff8803ed17f480 634303291 S Co:1:042:0 s 21 09 0300 0000 0008 8 = bde4d0be 6b70064e
ffff8803ed17f480 634303445 C Co:1:042:0 0 8 >
ffff8803ed17f480 634318267 S Co:1:042:0 s 21 09 0300 0000 0008 8 = cbcbb1e0 ccab43f7
ffff8803ed17f480 634318475 C Co:1:042:0 0 8 >
ffff8803e6ff2d80 634333281 S Co:1:042:0 s 21 09 0300 0000 0008 8 = ace7bb07 866ad196
ffff8803e6ff2d80 634333467 C Co:1:042:0 0 8 >
ffff8803e6ff2d80 634350330 S Co:1:042:0 s 21 09 0300 0000 0008 8 = 1d786794 e7252cf7
ffff8803e6ff2d80 634350573 C Co:1:042:0 0 8 >
ffff8801eff40180 634365255 S Co:1:042:0 s 21 09 0300 0000 0008 8 = 5d12929a 826bf358
ffff8801eff40180 634365447 C Co:1:042:0 0 8 >
ffff8801eff40180 634380297 S Co:1:042:0 s 21 09 0300 0000 0008 8 = b21eff64 ad5d69ec
ffff8801eff40180 634380451 C Co:1:042:0 0 8 >
ffff8801eff40180 634395581 S Co:1:042:0 s 21 09 0300 0000 0008 8 = e357d2ee 0232f55a
ffff8801eff40180 634395722 C Co:1:042:0 0 8 >
ffff880248699cc0 634412244 S Co:1:042:0 s 21 09 0300 0000 0008 8 = be4c1569 e0b3a43d
ffff880248699cc0 634412326 C Co:1:042:0 0 8 >
ffff8803e6ff2600 634427280 S Co:1:042:0 s 21 09 0300 0000 0008 8 = 92e235ba e9bfa3a3
ffff8803e6ff2600 634427458 C Co:1:042:0 0 8 >
ffff8801eff40180 634442314 S Co:1:042:0 s 21 09 0300 0000 0008 8 = b4d183f9 84c6c891
ffff8801eff40180 634442460 C Co:1:042:0 0 8 >
ffff880248699cc0 634459370 S Co:1:042:0 s 21 09 0300 0000 0008 8 = fb25b5f4 5a4f087c
ffff880248699cc0 634459602 C Co:1:042:0 0 8 >
ffff8803ed17fe40 634474229 S Co:1:042:0 s 21 09 0300 0000 0008 8 = 46bc65ab da7400cf
ffff8803ed17fe40 634474337 C Co:1:042:0 0 8 >
ffff8803ed17fe40 634489296 S Co:1:042:0 s 21 09 0300 0000 0008 8 = f3cc8fd4 b8636f69
ffff8803ed17fe40 634489453 C Co:1:042:0 0 8 >
ffff8803ed17fe40 634506295 S Co:1:042:0 s 21 09 0300 0000 0008 8 = 685c1557 68deb81e
ffff8803ed17fe40 634506452 C Co:1:042:0 0 8 >
ffff8803ed17fe40 634521250 S Co:1:042:0 s 21 09 0300 0000 0008 8 = 8cc93cd1 a5b96234
ffff8803ed17fe40 634521354 C Co:1:042:0 0 8 >
ffff8801eff40cc0 634536308 S Co:1:042:0 s 21 09 0300 0000 0008 8 = 4c402f13 ee609ae5
ffff8801eff40cc0 634536468 C Co:1:042:0 0 8 >
ffff8801eff406c0 634551724 S Co:1:042:0 s 21 09 0300 0000 0008 8 = 194879a2 0651ade2
ffff8801eff406c0 634551826 C Co:1:042:0 0 8 >
ffff8803e6ff2cc0 634568694 S Co:1:042:0 s 21 09 0300 0000 0008 8 = 67378d37 729c91cc
ffff8803e6ff2cc0 634568829 C Co:1:042:0 0 8 >
ffff8803e6ff2cc0 634583632 S Co:1:042:0 s 21 09 0300 0000 0008 8 = 2dba403e fc685bba
ffff8803e6ff2cc0 634583842 C Co:1:042:0 0 8 >
ffff8801eff40b40 634598732 S Co:1:042:0 s 21 09 0300 0000 0008 8 = 69504b59 346fc8b8
ffff8801eff40b40 634598826 C Co:1:042:0 0 8 >
ffff880248699cc0 634614637 S Co:1:042:0 s 21 09 0300 0000 0008 8 = 9cceccdb eb7fb744
ffff880248699cc0 634614839 C Co:1:042:0 0 8 >
ffff880248699cc0 634632749 S Co:1:042:0 s 21 09 0300 0000 0008 8 = 48dac350 b9f9abd2
ffff880248699cc0 634632827 C Co:1:042:0 0 8 >
ffff8802486990c0 634645715 S Co:1:042:0 s 21 09 0300 0000 0008 8 = 777297f2 77544c47
ffff8802486990c0 634645877 C Co:1:042:0 0 8 >
ffff8803e6ff2480 634661819 S Co:1:042:0 s 21 09 0300 0000 0008 8 = 35649133 c399e47f
ffff8803e6ff2480 634661949 C Co:1:042:0 0 8 >
ffff8803ed17fc00 634677612 S Co:1:042:0 s 21 09 0300 0000 0008 8 = 13d55e38 81e6e4c9
ffff8803ed17fc00 634677712 C Co:1:042:0 0 8 >
ffff8801eff40b40 634692702 S Co:1:042:0 s 21 09 0300 0000 0008 8 = a4bd905a 56ed5e68
ffff8801eff40b40 634692829 C Co:1:042:0 0 8 >
ffff8802486990c0 634709784 S Co:1:042:0 s 21 09 0300 0000 0008 8 = 01671ba5 2d748b12
ffff8802486990c0 634709953 C Co:1:042:0 0 8 >
ffff8802486990c0 634724597 S Co:1:042:0 s 21 09 0300 0000 0008 8 = 47f3d95b b4d54573
ffff8802486990c0 634724699 C Co:1:042:0 0 8 >
ffff8802486990c0 634739631 S Co:1:042:0 s 21 09 0300 0000 0008 8 = 16d60970 de7e8ba8
ffff8802486990c0 634739824 C Co:1:042:0 0 8 >
ffff8803ed17fe40 634755736 S Co:1:042:0 s 21 09 0300 0000 0008 8 = 1257ca0d 607002c6
ffff8803ed17fe40 634755848 C Co:1:042:0 0 8 >
ffff8803ed17fc00 634772221 S Co:1:042:0 s 21 09 0300 0000 0008 8 = 6412a210 36c17153
ffff8803ed17fc00 634772350 C Co:1:042:0 0 8 >
ffff8803e6ff2f00 634787688 S Co:1:042:0 s 21 09 0300 0000 0008 8 = 3877fc88 1e1c42ca
ffff8803e6ff2f00 634787850 C Co:1:042:0 0 8 >
ffff8801eff40480 634802726 S Co:1:042:0 s 21 09 0300 0000 0008 8 = 3e49a33b 1a3e061a
ffff8801eff40480 634802845 C Co:1:042:0 0 8 >
ffff8801eff40480 634817768 S Co:1:042:0 s 21 09 0300 0000 0008 8 = 2b214a22 f079f025
ffff8801eff40480 634817954 C Co:1:042:0 0 8 >
ffff8801eff40480 634834624 S Co:1:042:0 s 21 09 0300 0000 0008 8 = 38eb06ea ac335643
ffff8801eff40480 634834718 C Co:1:042:0 0 8 >
ffff880248699b40 634849711 S Co:1:042:0 s 21 09 0300 0000 0008 8 = 9f66d072 1a6635be
ffff880248699b40 634849825 C Co:1:042:0 0 8 >
ffff8803ed17fb40 634864761 S Co:1:042:0 s 21 09 0300 0000 0008 8 = 23a60652 4e20ac56
ffff8803ed17fb40 634864973 C Co:1:042:0 0 8 >
ffff8803e6ff2600 634879656 S Co:1:042:0 s 21 09 0300 0000 0008 8 = 8793e950 1e027ebd
ffff8803e6ff2600 634879830 C Co:1:042:0 0 8 >
ffff8801eff40000 634895479 S Co:1:042:0 s 21 09 0300 0000 0008 8 = 146a1eeb a4c29319
ffff8801eff40000 634895600 C Co:1:042:0 0 8 >
ffff8801eff40000 634912293 S Co:1:042:0 s 21 09 0300 0000 0008 8 = 15392fd2 bfab7587
ffff8801eff40000 634912477 C Co:1:042:0 0 8 >
ffff8802486993c0 634927195 S Co:1:042:0 s 21 09 0300 0000 0008 8 = 5c65096c 921ad594
ffff8802486993c0 634927351 C Co:1:042:0 0 8 >
ffff8803ed17fd80 634943269 S Co:1:042:0 s 21 09 0300 0000 0008 8 = bd257d50 010106c4
ffff8803ed17fd80 634943517 C Co:1:042:0 0 8 >
ffff8803ed17fd80 634958222 S Co:1:042:0 s 21 09 0300 0000 0008 8 = 9006c1cb 39667e0e
ffff8803ed17fd80 634958355 C Co:1:042:0 0 8 >
ffff8803ed17fd80 634975245 S Co:1:042:0 s 21 09 0300 0000 0008 8 = 3267ef5f 26e35a5b
ffff8803ed17fd80 634975451 C Co:1:042:0 0 8 >
ffff8803ed17fd80 634990170 S Co:1:042:0 s 21 09 0300 0000 0008 8 = 82fd8341 fd25d90d
ffff8803ed17fd80 634990327 C Co:1:042:0 0 8 >
ffff8803ed17fd80 635005209 S Co:1:042:0 s 21 09 0300 0000 0008 8 = 664fe0d8 b26fde74
ffff8803ed17fd80 635005328 C Co:1:042:0 0 8 >
ffff8803ed17fd80 635023301 S Co:1:042:0 s 21 09 0300 0000 0008 8 = 4538c943 80167158
ffff8803ed17fd80 635023476 C Co:1:042:0 0 8 >
ffff8801eff40840 635038220 S Co:1:042:0 s 21 09 0300 0000 0008 8 = 8d6aead2 67053c74
ffff8801eff40840 635038330 C Co:1:042:0 0 8 >
ffff8801eff40780 635053259 S Co:1:042:0 s 21 09 0300 0000 0008 8 = 2ce74e89 a73910f7
ffff8801eff40780 635053476 C Co:1:042:0 0 8 >
ffff880248699e40 635068301 S Co:1:042:0 s 21 09 0300 0000 0008 8 = 1988e8a2 48446004
ffff880248699e40 635068478 C Co:1:042:0 0 8 >
ffff880248699e40 635083342 S Co:1:042:0 s 21 09 0300 0000 0008 8 = cb790d0a 94ccc231
ffff880248699e40 635083602 C Co:1:042:0 0 8 >
ffff8803e6ff2f00 635099173 S Co:1:042:0 s 21 09 0300 0000 0008 8 = beb8f6e1 990a730a
ffff8803e6ff2f00 635099346 C Co:1:042:0 0 8 >
ffff8803ed17fd80 635115342 S Co:1:042:0 s 21 09 0300 0000 0008 8 = f39b41fd a94ed28d
ffff8803ed17fd80 635115602 C Co:1:042:0 0 8 >
ffff8803e6ff2300 635130112 S Co:1:042:0 s 21 09 0300 0000 0008 8 = 6f496f66 dc78e2ac
ffff8803e6ff2300 635130210 C Co:1:042:0 0 8 >
ffff880248699180 635147169 S Co:1:042:0 s 21 09 0300 0000 0008 8 = b93f65d9 8b7ecbd0
ffff880248699180 635147355 C Co:1:042:0 0 8 >
ffff8803e6ff2480 635162260 S Co:1:042:0 s 21 09 0300 0000 0008 8 = 5ecbed46 d5eb5753
ffff8803e6ff2480 635162460 C Co:1:042:0 0 8 >
ffff8803ed17f0c0 635177282 S Co:1:042:0 s 21 09 0300 0000 0008 8 = 6f913454 1b5b7704
ffff8803ed17f0c0 635177458 C Co:1:042:0 0 8 >
ffff8803ed17f0c0 635194191 S Co:1:042:0 s 21 09 0300 0000 0008 8 = ff0b4cda 8502bea5
ffff8803ed17f0c0 635194339 C Co:1:042:0 0 8 >
ffff8803e6ff2480 635209270 S Co:1:042:0 s 21 09 0300 0000 0008 8 = a802a966 7d25e36e
ffff8803e6ff2480 635209458 C Co:1:042:0 0 8 >
ffff8803e6ff2480 635224293 S Co:1:042:0 s 21 09 0300 0000 0008 8 = 0518a6b9 329d4189
ffff8803e6ff2480 635224459 C Co:1:042:0 0 8 >
ffff8803e6d16180 635241191 S Co:1:042:0 s 21 09 0300 0000 0008 8 = 3741ff46 155a5896
ffff8803e6d16180 635241332 C Co:1:042:0 0 8 >
ffff8803e6d16180 635256191 S Co:1:042:0 s 21 09 0300 0000 0008 8 = 624357b8 5cdb4b26
ffff8803e6d16180 635256334 C Co:1:042:0 0 8 >
ffff8803e6d16180 635271539 S Co:1:042:0 s 21 09 0300 0000 0008 8 = 2f3cb16b 84b96142
ffff8803e6d16180 635271708 C Co:1:042:0 0 8 >
ffff8803e6d16180 635290346 S Co:1:042:0 s 21 09 0300 0000 0008 8 = 4a1af9f0 c81b87e3
ffff8803e6d16180 635290584 C Co:1:042:0 0 8 >
ffff8803e6d16180 635301721 S Co:1:042:0 s 21 09 0300 0000 0008 8 = e4227a8c ad41cb7a
ffff8803e6d16180 635301845 C Co:1:042:0 0 8 >
ffff8803e6d16180 635318265 S Co:1:042:0 s 21 09 0300 0000 0008 8 = 306c67b8 79fbe168
ffff8803e6d16180 635318481 C Co:1:042:0 0 8 >
ffff8803e6d16180 635333302 S Co:1:042:0 s 21 09 0300 0000 0008 8 = e76355a0 b5319f84
ffff8803e6d16180 635333459 C Co:1:042:0 0 8 >
ffff8803e6d16180 635348195 S Co:1:042:0 s 21 09 0300 0000 0008 8 = c648bea5 b15c829a
ffff8803e6d16180 635348335 C Co:1:042:0 0 8 >
ffff8803e6d16180 635365272 S Co:1:042:0 s 21 09 0300 0000 0008 8 = 0dae7ddd fe0929e8
ffff8803e6d16180 635365460 C Co:1:042:0 0 8 >
ffff8803e6d16180 635380295 S Co:1:042:0 s 21 09 0300 0000 0008 8 = 00fd5690 f35ad7a1
ffff8803e6d16180 635380460 C Co:1:042:0 0 8 >
ffff8803e6d16180 635395356 S Co:1:042:0 s 21 09 0300 0000 0008 8 = 68f16ebb 2b87f46d
ffff8803e6d16180 635395605 C Co:1:042:0 0 8 >
ffff8803e6d16180 635412198 S Co:1:042:0 s 21 09 0300 0000 0008 8 = 1019cd8f 03578be5
ffff8803e6d16180 635412351 C Co:1:042:0 0 8 >
ffff8803e6d16180 635427292 S Co:1:042:0 s 21 09 0300 0000 0008 8 = 4b5be1f1 1eaacb19
ffff8803e6d16180 635427476 C Co:1:042:0 0 8 >
ffff8803e6d16180 635442263 S Co:1:042:0 s 21 09 0300 0000 0008 8 = 6b6dfbfa e3f0870b
ffff8803e6d16180 635442461 C Co:1:042:0 0 8 >
ffff8803e6d16180 635459223 S Co:1:042:0 s 21 09 0300 0000 0008 8 = 495cd276 fbb1b834
ffff8803e6d16180 635459360 C Co:1:042:0 0 8 >
ffff8803e6d16180 635474272 S Co:1:042:0 s 21 09 0300 0000 0008 8 = c107fe67 d605f8fc
ffff8803e6d16180 635474481 C Co:1:042:0 0 8 >
ffff8803e6d16180 635489299 S Co:1:042:0 s 21 09 0300 0000 0008 8 = 35a27c81 261b0744
ffff8803e6d16180 635489482 C Co:1:042:0 0 8 >
ffff8803e6d16180 635506168 S Co:1:042:0 s 21 09 0300 0000 0008 8 = 08352ead 60b548de
ffff8803e6d16180 635506350 C Co:1:042:0 0 8 >
ffff8803e6d16180 635521267 S Co:1:042:0 s 21 09 0300 0000 0008 8 = 221c5a89 40a84311
ffff8803e6d16180 635521471 C Co:1:042:0 0 8 >
ffff8803e6d160c0 635537348 S Co:1:042:0 s 21 09 0300 0000 0008 8 = 718829e4 435e2318
ffff8803e6d160c0 635537601 C Co:1:042:0 0 8 >
ffff880387677d80 635552135 S Co:1:042:0 s 21 09 0300 0000 0008 8 = 64fa2744 2d5637a1
ffff880387677d80 635552351 C Co:1:042:0 0 8 >
ffff880387677d80 635567369 S Co:1:042:0 s 21 09 0300 0000 0008 8 = 70cdc762 83a07250
ffff880387677d80 635567587 C Co:1:042:0 0 8 >
ffff880387677d80 635583278 S Co:1:042:0 s 21 09 0300 0000 0008 8 = 8dabdfaa 1064ed3c
ffff880387677d80 635583480 C Co:1:042:0 0 8 >
ffff880387677d80 635599183 S Co:1:042:0 s 21 09 0300 0000 0008 8 = b71426be 625a626f
ffff880387677d80 635599336 C Co:1:042:0 0 8 >
ffff880387677d80 635614273 S Co:1:042:0 s 21 09 0300 0000 0008 8 = 6fddbbf2 4b51b169
ffff880387677d80 635614461 C Co:1:042:0 0 8 >
ffff880387677d80 635631263 S Co:1:042:0 s 21 09 0300 0000 0008 8 = 3aad9fd0 63aa5e9b
ffff880387677d80 635631461 C Co:1:042:0 0 8 >
ffff880387677d80 635646231 S Co:1:042:0 s 21 09 0300 0000 0008 8 = 1f7f3793 83dc0eee
ffff880387677d80 635646355 C Co:1:042:0 0 8 >
ffff880387677d80 635661218 S Co:1:042:0 s 21 09 0300 0000 0008 8 = 2c25cdae 4af00f3b
ffff880387677d80 635661407 C Co:1:042:0 0 8 >
ffff8803ed17f0c0 635678252 S Co:1:042:0 s 21 09 0300 0000 0008 8 = efc10e44 9a05cfd3
ffff8803ed17f0c0 635678481 C Co:1:042:0 0 8 >
ffff8803ed17f900 635693244 S Co:1:042:0 s 21 09 0300 0000 0008 8 = ff4c8caf 19cb62f7
ffff8803ed17f900 635693332 C Co:1:042:0 0 8 >
ffff8803e6ff2b40 635708194 S Co:1:042:0 s 21 09 0300 0000 0008 8 = 73123bfb b20afe5e
ffff8803e6ff2b40 635708364 C Co:1:042:0 0 8 >
ffff8801eff400c0 635724234 S Co:1:042:0 s 21 09 0300 0000 0008 8 = 6732f66a 141a81b4
ffff8801eff400c0 635724393 C Co:1:042:0 0 8 >
ffff8803e6ff26c0 635739478 S Co:1:042:0 s 21 09 0300 0000 0008 8 = 7c20faf1 306ae817
ffff8803e6ff26c0 635739627 C Co:1:042:0 0 8 >
ffff8803e6ff20c0 635756386 S Co:1:042:0 s 21 09 0300 0000 0008 8 = 562467b7 bdfbd79a
ffff8803e6ff20c0 635756588 C Co:1:042:0 0 8 >
ffff8801eff400c0 635770210 S Co:1:042:0 s 21 09 0300 0000 0008 8 = 1edac49b b5e416c4
ffff8801eff400c0 635770358 C Co:1:042:0 0 8 >
ffff8801eff40000 635786053 S Co:1:042:0 s 21 09 0300 0000 0008 8 = 01b27aad d7ce0f11
ffff8801eff40000 635786212 C Co:1:042:0 0 8 >
ffff880248699180 635802074 S Co:1:042:0 s 21 09 0300 0000 0008 8 = ad7055b1 2577546e
ffff880248699180 635802208 C Co:1:042:0 0 8 >
ffff8803ed17f180 635816974 S Co:1:042:0 s 21 09 0300 0000 0008 8 = d8ab09a1 663215be
ffff8803ed17f180 635817115 C Co:1:042:0 0 8 >
ffff880248699600 635834037 S Co:1:042:0 s 21 09 0300 0000 0008 8 = bb50a92a a363ac59
ffff880248699600 635834211 C Co:1:042:0 0 8 >
ffff8803ed17f3c0 635849083 S Co:1:042:0 s 21 09 0300 0000 0008 8 = 911e2f2c ac05138a
ffff8803ed17f3c0 635849254 C Co:1:042:0 0 8 >
ffff8801eff40000 635863947 S Co:1:042:0 s 21 09 0300 0000 0008 8 = 1b29f93d 92266a0e
ffff8801eff40000 635864128 C Co:1:042:0 0 8 >
ffff8801eff40d80 635881028 S Co:1:042:0 s 21 09 0300 0000 0008 8 = 1d5a4824 2c67759a
ffff8801eff40d80 635881242 C Co:1:042:0 0 8 >
ffff8801eff40d80 635896063 S Co:1:042:0 s 21 09 0300 0000 0008 8 = e0ebc160 957f1954
ffff8801eff40d80 635896213 C Co:1:042:0 0 8 >
ffff8801eff40d80 635910961 S Co:1:042:0 s 21 09 0300 0000 0008 8 = b0eeefa1 aab7e457
ffff8801eff40d80 635911088 C Co:1:042:0 0 8 >
ffff8801eff40d80 635926998 S Co:1:042:0 s 21 09 0300 0000 0008 8 = 5dc5bd4b 8e6d8432
ffff8801eff40d80 635927088 C Co:1:042:0 0 8 >
ffff880248699e40 635942988 S Co:1:042:0 s 21 09 0300 0000 0008 8 = bca9fef9 28934d67
ffff880248699e40 635943085 C Co:1:042:0 0 8 >
ffff8803ed17f240 635958087 S Co:1:042:0 s 21 09 0300 0000 0008 8 = 2525e6f6 a22fb6ee
ffff8803ed17f240 635958236 C Co:1:042:0 0 8 >
ffff8803e6ff2300 635974943 S Co:1:042:0 s 21 09 0300 0000 0008 8 = f59a90c3 eadbdab1
ffff8803e6ff2300 635975104 C Co:1:042:0 0 8 >
ffff8803e6ff2480 635989577 S Co:1:042:0 s 21 09 0300 0000 0008 8 = 0cba7996 3345f90f
ffff8803e6ff2480 635989727 C Co:1:042:0 0 8 >
ffff8803e6ff2480 636004727 S Co:1:042:0 s 21 09 0300 0000 0008 8 = 4e0f01d6 72aef75c
ffff8803e6ff2480 636004860 C Co:1:042:0 0 8 >
ffff8803e6ff2480 636021594 S Co:1:042:0 s 21 09 0300 0000 0008 8 = 2474efa2 e36dd95d
ffff8803e6ff2480 636021727 C Co:1:042:0 0 8 >
ffff8803e6ff2480 636036565 S Co:1:042:0 s 21 09 0300 0000 0008 8 = f999ec4a 846b4dcf
ffff8803e6ff2480 636036728 C Co:1:042:0 0 8 >
ffff8803e6ff2480 636051660 S Co:1:042:0 s 21 09 0300 0000 0008 8 = bf8204d3 96a621df
ffff8803e6ff2480 636051892 C Co:1:042:0 0 8 >
ffff8801eff40000 636067503 S Co:1:042:0 s 21 09 0300 0000 0008 8 = 6a062b75 21b0c9b1
ffff8801eff40000 636067585 C Co:1:042:0 0 8 >
ffff8803e6ff26c0 636083620 S Co:1:042:0 s 21 09 0300 0000 0008 8 = 7251b41e 6f2fdcdb
ffff8803e6ff26c0 636083733 C Co:1:042:0 0 8 >
ffff8801eff40000 636098661 S Co:1:042:0 s 21 09 0300 0000 0008 8 = 5464d9ef 8f5d95e9
ffff8801eff40000 636098838 C Co:1:042:0 0 8 >
ffff8801eff40000 636115503 S Co:1:042:0 s 21 09 0300 0000 0008 8 = 0f9338bc d18854d9
ffff8801eff40000 636115730 C Co:1:042:0 0 8 >
ffff880248699180 636130584 S Co:1:042:0 s 21 09 0300 0000 0008 8 = a904528e 4e911d9e
ffff880248699180 636130733 C Co:1:042:0 0 8 >
ffff8801eff40000 636145626 S Co:1:042:0 s 21 09 0300 0000 0008 8 = a9340d22 5f6e169f
ffff8801eff40000 636145730 C Co:1:042:0 0 8 >
ffff8801eff40000 636162548 S Co:1:042:0 s 21 09 0300 0000 0008 8 = 9d743169 23aa0a38
ffff8801eff40000 636162736 C Co:1:042:0 0 8 >
ffff8801eff40000 636177587 S Co:1:042:0 s 21 09 0300 0000 0008 8 = 9466ec08 fce2eb35
ffff8801eff40000 636177766 C Co:1:042:0 0 8 >
ffff8801eff40000 636192612 S Co:1:042:0 s 21 09 0300 0000 0008 8 = a28250d7 1148495c
ffff8801eff40000 636192719 C Co:1:042:0 0 8 >
ffff8801eff40000 636209669 S Co:1:042:0 s 21 09 0300 0000 0008 8 = 6195d265 cb22dee2
ffff8801eff40000 636209867 C Co:1:042:0 0 8 >
ffff880248699180 636224575 S Co:1:042:0 s 21 09 0300 0000 0008 8 = 6d3fcb70 594a05f3
ffff880248699180 636224737 C Co:1:042:0 0 8 >
ffff8803ed17f240 636239548 S Co:1:042:0 s 21 09 0300 0000 0008 8 = e572f86f 2fae3c2c
ffff8803ed17f240 636239713 C Co:1:042:0 0 8 >
ffff8803e6ff26c0 636254595 S Co:1:042:0 s 21 09 0300 0000 0008 8 = eef8fc0a 81cfa722
ffff8803e6ff26c0 636254727 C Co:1:042:0 0 8 >
ffff8803e6ff26c0 636271570 S Co:1:042:0 s 21 09 0300 0000 0008 8 = 32ecdb9f ca438edb
ffff8803e6ff26c0 636271739 C Co:1:042:0 0 8 >
ffff8801eff40000 636286878 S Co:1:042:0 s 21 09 0300 0000 0008 8 = 5b3d7fbd 4935dc52
ffff8801eff40000 636286973 C Co:1:042:0 0 8 >
ffff8801eff40000 636301754 S Co:1:042:0 s 21 09 0300 0000 0008 8 = 9b3134aa 80e2a0f5
ffff8801eff40000 636301864 C Co:1:042:0 0 8 >
ffff8801eff40000 636318550 S Co:1:042:0 s 21 09 0300 0000 0008 8 = 25de2edf b61c8e28
ffff8801eff40000 636318737 C Co:1:042:0 0 8 >
ffff880248699180 636333585 S Co:1:042:0 s 21 09 0300 0000 0008 8 = b3b00088 75c97dc2
ffff880248699180 636333737 C Co:1:042:0 0 8 >
ffff880248699180 636348623 S Co:1:042:0 s 21 09 0300 0000 0008 8 = 00e82407 0b62e88d
ffff880248699180 636348717 C Co:1:042:0 0 8 >
ffff8803ed17f240 636365662 S Co:1:042:0 s 21 09 0300 0000 0008 8 = 4d197970 0a7770c9
ffff8803ed17f240 636365843 C Co:1:042:0 0 8 >
ffff8803ed17f240 636380579 S Co:1:042:0 s 21 09 0300 0000 0008 8 = deabbe0c c92856a7
ffff8803ed17f240 636380768 C Co:1:042:0 0 8 >
ffff8801eff40000 636395606 S Co:1:042:0 s 21 09 0300 0000 0008 8 = 7c5a19d9 e3ab03d0
ffff8801eff40000 636395722 C Co:1:042:0 0 8 >
ffff8801eff40c00 636412649 S Co:1:042:0 s 21 09 0300 0000 0008 8 = f3b69406 b5cb82dd
ffff8801eff40c00 636412873 C Co:1:042:0 0 8 >
ffff8803e6ff26c0 636443608 S Co:1:042:0 s 21 09 0300 0000 0008 8 = 55034887 7538d401
ffff8803e6ff26c0 636443741 C Co:1:042:0 0 8 >
ffff8803e6ff26c0 636474545 S Ci:1:042:0 s a1 01 0300 0000 0008 8 <
ffff8803e6ff26c0 636474738 C Ci:1:042:0 0 8 = aa040000 00000000
ffff880403990780 653021794 S Co:1:042:0 s 21 09 0300 0000 0008 8 = 55010100 00ff075d
ffff880403990780 653022012 C Co:1:042:0 0 8 >
ffff880403990b40 653052009 S Ci:1:042:0 s a1 01 0300 0000 0008 8 <
ffff880403990b40 653052133 C Ci:1:042:0 0 8 = aa020000 00000000
ffff880403990b40 653082966 S Co:1:042:0 s 21 09 0300 0000 0008 8 = 0b010101 00000e04
ffff880403990b40 653083129 C Co:1:042:0 0 8 >
ffff880403990b40 653098968 S Co:1:042:0 s 21 09 0300 0000 0008 8 = 104bd895 5d7d6b59
ffff880403990b40 653099126 C Co:1:042:0 0 8 >
ffff880403990b40 653115029 S Co:1:042:0 s 21 09 0300 0000 0008 8 = 01809500 15ff57ff
ffff880403990b40 653115154 C Co:1:042:0 0 8 >
ffff880403990b40 653130949 S Co:1:042:0 s 21 09 0300 0000 0008 8 = 27ffd7ff b7ff37ff
ffff880403990b40 653131131 C Co:1:042:0 0 8 >
ffff880403990d80 653146009 S Co:1:042:0 s 21 09 0300 0000 0008 8 = 37ff17ff 27ff17ff
ffff880403990d80 653146106 C Co:1:042:0 0 8 >
ffff8801eff40c00 653161372 S Co:1:042:0 s 21 09 0300 0000 0008 8 = 57ff27ff 27ff97ff
ffff8801eff40c00 653161487 C Co:1:042:0 0 8 >
ffff8801eff40780 653178099 S Co:1:042:0 s 21 09 0300 0000 0008 8 = f7ffc7ff b7ffd7ff
ffff8801eff40780 653178240 C Co:1:042:0 0 8 >
ffff8802486c6000 653192966 S Co:1:042:0 s 21 09 0300 0000 0008 8 = 77ffe7ff 37ffe7ff
ffff8802486c6000 653193132 C Co:1:042:0 0 8 >
ffff8801eff40780 653208253 S Co:1:042:0 s 21 09 0300 0000 0008 8 = 77ffb7ff 57ffd7ff
ffff8801eff40780 653208362 C Co:1:042:0 0 8 >
ffff8802486993c0 653225065 S Co:1:042:0 s 21 09 0300 0000 0008 8 = c7ff57ff 97ffd7ff
ffff8802486993c0 653225237 C Co:1:042:0 0 8 >
ffff8802486993c0 653239957 S Co:1:042:0 s 21 09 0300 0000 0008 8 = e7ffe7ff a7ff27ff
ffff8802486993c0 653240140 C Co:1:042:0 0 8 >
ffff8802486993c0 653255103 S Co:1:042:0 s 21 09 0300 0000 0008 8 = a7ff27ff 27ff17ff
ffff8802486993c0 653255261 C Co:1:042:0 0 8 >
ffff8802486993c0 653272049 S Co:1:042:0 s 21 09 0300 0000 0008 8 = 37ff87ff f7ffb7ff
ffff8802486993c0 653272256 C Co:1:042:0 0 8 >
ffff8802486993c0 653286941 S Co:1:042:0 s 21 09 0300 0000 0008 8 = 27fff7ff 37ff77ff
ffff8802486993c0 653287132 C Co:1:042:0 0 8 >
ffff8802486993c0 653301996 S Co:1:042:0 s 21 09 0300 0000 0008 8 = e7ff77ff f7ff37ff
ffff8802486993c0 653302139 C Co:1:042:0 0 8 >
ffff8802486993c0 653319029 S Co:1:042:0 s 21 09 0300 0000 0008 8 = 77ffc7ff 07ffa7ff
ffff8802486993c0 653319132 C Co:1:042:0 0 8 >
ffff8803ed17fcc0 653334071 S Co:1:042:0 s 21 09 0300 0000 0008 8 = 57ffd7ff 07ff47ff
ffff8803ed17fcc0 653334253 C Co:1:042:0 0 8 >
ffff8802486993c0 653348961 S Co:1:042:0 s 21 09 0300 0000 0008 8 = 77ff97ff 87ffb7ff
ffff8802486993c0 653349138 C Co:1:042:0 0 8 >
ffff8802486993c0 653364067 S Co:1:042:0 s 21 09 0300 0000 0008 8 = 17ff77ff c7ff57ff
ffff8802486993c0 653364261 C Co:1:042:0 0 8 >
ffff8801eff40780 653381067 S Co:1:042:0 s 21 09 0300 0000 0008 8 = 07ffe7ff 87ff97ff
ffff8801eff40780 653381258 C Co:1:042:0 0 8 >
ffff8802486993c0 653395950 S Co:1:042:0 s 21 09 0300 0000 0008 8 = d7ff57ff c7ff87ff
ffff8802486993c0 653396134 C Co:1:042:0 0 8 >
ffff8802486c6000 653410989 S Co:1:042:0 s 21 09 0300 0000 0008 8 = d7ff17ff 67ff67ff
ffff8802486c6000 653411133 C Co:1:042:0 0 8 >
ffff8802486c6000 653428043 S Co:1:042:0 s 21 09 0300 0000 0008 8 = 97ff27ff 97fff7ff
ffff8802486c6000 653428248 C Co:1:042:0 0 8 >
ffff8802486993c0 653442937 S Co:1:042:0 s 21 09 0300 0000 0008 8 = 97ff17ff 87ff37ff
ffff8802486993c0 653443134 C Co:1:042:0 0 8 >
ffff8802486993c0 653459994 S Co:1:042:0 s 21 09 0300 0000 0008 8 = 37ffc7ff b7ff77ff
ffff8802486993c0 653460121 C Co:1:042:0 0 8 >
ffff8802486993c0 653475038 S Co:1:042:0 s 21 09 0300 0000 0008 8 = b7ffa7ff e7ff67ff
ffff8802486993c0 653475241 C Co:1:042:0 0 8 >
ffff8802486993c0 653490089 S Co:1:042:0 s 21 09 0300 0000 0008 8 = e7ffe7ff e7ffd7ff
ffff8802486993c0 653490239 C Co:1:042:0 0 8 >
ffff8802486993c0 653505035 S Co:1:042:0 s 21 09 0300 0000 0008 8 = a7ff27ff 57ff27ff
ffff8802486993c0 653505139 C Co:1:042:0 0 8 >
ffff8801eff40780 653522033 S Co:1:042:0 s 21 09 0300 0000 0008 8 = f7ff47ff a7ff77ff
ffff8801eff40780 653522245 C Co:1:042:0 0 8 >
ffff8801eff40780 653537063 S Co:1:042:0 s 21 09 0300 0000 0008 8 = b7ffb7ff 57fff7ff
ffff8801eff40780 653537239 C Co:1:042:0 0 8 >
ffff8802486c6000 653551929 S Co:1:042:0 s 21 09 0300 0000 0008 8 = d7ff77ff b7fff7ff
ffff8802486c6000 653552135 C Co:1:042:0 0 8 >
ffff8802486c6000 653569013 S Co:1:042:0 s 21 09 0300 0000 0008 8 = 27ff17ff 57ff27ff
ffff8802486c6000 653569143 C Co:1:042:0 0 8 >
ffff8802486c6000 653584045 S Co:1:042:0 s 21 09 0300 0000 0008 8 = f7ff37ff 97ff47ff
ffff8802486c6000 653584239 C Co:1:042:0 0 8 >
ffff8801eff40780 653598966 S Co:1:042:0 s 21 09 0300 0000 0008 8 = d7ffe7ff 57ff77ff
ffff8801eff40780 653599135 C Co:1:042:0 0 8 >
ffff8802486c6000 653613918 S Co:1:042:0 s 21 09 0300 0000 0008 8 = 47ffe7ff 0790f740
ffff8802486c6000 653614135 C Co:1:042:0 0 8 >
ffff8802486c6000 653631035 S Co:1:042:0 s 21 09 0300 0000 0008 8 = 464b6120 bb9b3821
ffff8802486c6000 653631177 C Co:1:042:0 0 8 >
ffff880387677b40 653646092 S Co:1:042:0 s 21 09 0300 0000 0008 8 = ac8c7547 662f7b12
ffff880387677b40 653646239 C Co:1:042:0 0 8 >
ffff880387677b40 653660967 S Co:1:042:0 s 21 09 0300 0000 0008 8 = 0ddd81df a8ad4383
ffff880387677b40 653661116 C Co:1:042:0 0 8 >
ffff880387677b40 653678041 S Co:1:042:0 s 21 09 0300 0000 0008 8 = 7038e925 5a8c375c
ffff880387677b40 653678246 C Co:1:042:0 0 8 >
ffff880387677b40 653693057 S Co:1:042:0 s 21 09 0300 0000 0008 8 = e26ef78a 1ad5a479
ffff880387677b40 653693244 C Co:1:042:0 0 8 >
ffff880387677b40 653707895 S Co:1:042:0 s 21 09 0300 0000 0008 8 = f3a35833 cca6f827
ffff880387677b40 653708129 C Co:1:042:0 0 8 >
ffff880387677b40 653724969 S Co:1:042:0 s 21 09 0300 0000 0008 8 = 39cf9d79 15b146a9
ffff880387677b40 653725112 C Co:1:042:0 0 8 >
ffff8801eff409c0 653740044 S Co:1:042:0 s 21 09 0300 0000 0008 8 = ca3dbd68 e0bdc7b7
ffff8801eff409c0 653740242 C Co:1:042:0 0 8 >
ffff880248699000 653754945 S Co:1:042:0 s 21 09 0300 0000 0008 8 = c40e8f42 db2155fc
ffff880248699000 653755117 C Co:1:042:0 0 8 >
ffff880248699000 653771992 S Co:1:042:0 s 21 09 0300 0000 0008 8 = c7b552fb f84eef96
ffff880248699000 653772131 C Co:1:042:0 0 8 >
ffff880248699000 653787070 S Co:1:042:0 s 21 09 0300 0000 0008 8 = 777a28bd ef443a98
ffff880248699000 653787250 C Co:1:042:0 0 8 >
ffff880248699000 653802071 S Co:1:042:0 s 21 09 0300 0000 0008 8 = fdf89463 b91afd89
ffff880248699000 653802258 C Co:1:042:0 0 8 >
ffff8803ed17fcc0 653818983 S Co:1:042:0 s 21 09 0300 0000 0008 8 = 85a102ff 1579a2e4
ffff8803ed17fcc0 653819127 C Co:1:042:0 0 8 >
ffff8802486993c0 653834027 S Co:1:042:0 s 21 09 0300 0000 0008 8 = bf383d57 051fba97
ffff8802486993c0 653834115 C Co:1:042:0 0 8 >
ffff8802486993c0 653849053 S Co:1:042:0 s 21 09 0300 0000 0008 8 = 6054f861 4f5e7887
ffff8802486993c0 653849240 C Co:1:042:0 0 8 >
ffff8803ed17f3c0 653863968 S Co:1:042:0 s 21 09 0300 0000 0008 8 = a0e148cd fe9c3209
ffff8803ed17f3c0 653864117 C Co:1:042:0 0 8 >
ffff8802486c6cc0 653881022 S Co:1:042:0 s 21 09 0300 0000 0008 8 = bca0267a e1d3e568
ffff8802486c6cc0 653881137 C Co:1:042:0 0 8 >
ffff8803ed17f3c0 653896052 S Co:1:042:0 s 21 09 0300 0000 0008 8 = 74a4f0fd 0910b063
ffff8803ed17f3c0 653896251 C Co:1:042:0 0 8 >
ffff8802486c6000 653911003 S Co:1:042:0 s 21 09 0300 0000 0008 8 = 8cd6e620 4df656ae
ffff8802486c6000 653911138 C Co:1:042:0 0 8 >
ffff880403990d80 653928028 S Co:1:042:0 s 21 09 0300 0000 0008 8 = 4c70b05e c73bbf6f
ffff880403990d80 653928116 C Co:1:042:0 0 8 >
ffff880403990d80 653943061 S Co:1:042:0 s 21 09 0300 0000 0008 8 = 0283d46a 562775c0
ffff880403990d80 653943243 C Co:1:042:0 0 8 >
ffff8803ed17f3c0 653958011 S Co:1:042:0 s 21 09 0300 0000 0008 8 = 7d7342a7 1c1a2931
ffff8803ed17f3c0 653958114 C Co:1:042:0 0 8 >
ffff8802486993c0 653974982 S Co:1:042:0 s 21 09 0300 0000 0008 8 = 9278cbaf 00052d45
ffff8802486993c0 653975118 C Co:1:042:0 0 8 >
ffff8802486c6000 653990048 S Co:1:042:0 s 21 09 0300 0000 0008 8 = 991da3cf 2beefaf3
ffff8802486c6000 653990242 C Co:1:042:0 0 8 >
ffff8803ed17f3c0 654005379 S Co:1:042:0 s 21 09 0300 0000 0008 8 = efc2e587 8d6faa25
ffff8803ed17f3c0 654005499 C Co:1:042:0 0 8 >
ffff8803ed17f180 654022692 S Co:1:042:0 s 21 09 0300 0000 0008 8 = 731b0d0c 57367d3a
ffff8803ed17f180 654022868 C Co:1:042:0 0 8 >
ffff8804039de6c0 654037673 S Co:1:042:0 s 21 09 0300 0000 0008 8 = 0bb17ec8 81835685
ffff8804039de6c0 654037869 C Co:1:042:0 0 8 >
ffff8802486c6480 654052788 S Co:1:042:0 s 21 09 0300 0000 0008 8 = 1e5ffbd6 43af3dce
ffff8802486c6480 654053015 C Co:1:042:0 0 8 >
ffff8802486c6480 654067581 S Co:1:042:0 s 21 09 0300 0000 0008 8 = 1ad43089 9ea2dcce
ffff8802486c6480 654067763 C Co:1:042:0 0 8 >
ffff8801eff40c00 654083683 S Co:1:042:0 s 21 09 0300 0000 0008 8 = ed1628e4 d25904b5
ffff8801eff40c00 654083870 C Co:1:042:0 0 8 >
ffff8801eff40c00 654098714 S Co:1:042:0 s 21 09 0300 0000 0008 8 = 8efbd622 e76828a5
ffff8801eff40c00 654098869 C Co:1:042:0 0 8 >
ffff8801eff40c00 654116638 S Co:1:042:0 s 21 09 0300 0000 0008 8 = 74af8f2d 2774de37
ffff8801eff40c00 654116763 C Co:1:042:0 0 8 >
ffff8804039de6c0 654129605 S Co:1:042:0 s 21 09 0300 0000 0008 8 = 1b338c29 a0b763f3
ffff8804039de6c0 654129741 C Co:1:042:0 0 8 >
ffff8804039de6c0 654146704 S Co:1:042:0 s 21 09 0300 0000 0008 8 = 84da6be8 a47e16da
ffff8804039de6c0 654146880 C Co:1:042:0 0 8 >
ffff8804039de6c0 654161752 S Co:1:042:0 s 21 09 0300 0000 0008 8 = b4ccad75 4bacfade
ffff8804039de6c0 654161868 C Co:1:042:0 0 8 >
ffff8804039de600 654176651 S Co:1:042:0 s 21 09 0300 0000 0008 8 = 3285378c ee363766
ffff8804039de600 654176765 C Co:1:042:0 0 8 >
ffff8801eff40780 654193731 S Co:1:042:0 s 21 09 0300 0000 0008 8 = 8b55d31e aba797cd
ffff8801eff40780 654193868 C Co:1:042:0 0 8 >
ffff8804039de600 654208776 S Co:1:042:0 s 21 09 0300 0000 0008 8 = d0e0aecf e69c0be1
ffff8804039de600 654208892 C Co:1:042:0 0 8 >
ffff8804039de600 654223744 S Co:1:042:0 s 21 09 0300 0000 0008 8 = 149dda7a c4462667
ffff8804039de600 654223867 C Co:1:042:0 0 8 >
ffff8802486c6480 654240652 S Co:1:042:0 s 21 09 0300 0000 0008 8 = f159cbaa b0ed9e93
ffff8802486c6480 654240744 C Co:1:042:0 0 8 >
ffff8801eff40780 654255724 S Co:1:042:0 s 21 09 0300 0000 0008 8 = 02b3dc20 d96ad193
ffff8801eff40780 654255870 C Co:1:042:0 0 8 >
ffff8802486993c0 654270814 S Co:1:042:0 s 21 09 0300 0000 0008 8 = 689fc952 afaa3b03
ffff8802486993c0 654270991 C Co:1:042:0 0 8 >
ffff8804039de600 654287640 S Co:1:042:0 s 21 09 0300 0000 0008 8 = 47e634e8 6b300378
ffff8804039de600 654287741 C Co:1:042:0 0 8 >
ffff8801eff40780 654302731 S Co:1:042:0 s 21 09 0300 0000 0008 8 = 48a2233f 86916df7
ffff8801eff40780 654302874 C Co:1:042:0 0 8 >
ffff8802486993c0 654317756 S Co:1:042:0 s 21 09 0300 0000 0008 8 = 17c57fe8 3ff7677d
ffff8802486993c0 654317892 C Co:1:042:0 0 8 >
ffff8802486c6480 654334618 S Co:1:042:0 s 21 09 0300 0000 0008 8 = e5919427 18a1ff77
ffff8802486c6480 654334747 C Co:1:042:0 0 8 >
ffff8802486c6480 654349653 S Co:1:042:0 s 21 09 0300 0000 0008 8 = e51e9577 5860e849
ffff8802486c6480 654349747 C Co:1:042:0 0 8 >
ffff8802486c6480 654364743 S Co:1:042:0 s 21 09 0300 0000 0008 8 = d0da1703 881afbca
ffff8802486c6480 654364887 C Co:1:042:0 0 8 >
ffff8801eff40780 654381659 S Co:1:042:0 s 21 09 0300 0000 0008 8 = 6302932d f848b2c3
ffff8801eff40780 654381747 C Co:1:042:0 0 8 >
ffff8801eff40780 654396703 S Co:1:042:0 s 21 09 0300 0000 0008 8 = de2ce708 3979ad76
ffff8801eff40780 654396882 C Co:1:042:0 0 8 >
ffff8804039def00 654411736 S Co:1:042:0 s 21 09 0300 0000 0008 8 = 85bfd4e0 a2cf2f13
ffff8804039def00 654411872 C Co:1:042:0 0 8 >
ffff8802486993c0 654428634 S Co:1:042:0 s 21 09 0300 0000 0008 8 = 21777faf cd7fa042
ffff8802486993c0 654428748 C Co:1:042:0 0 8 >
ffff8804039de0c0 654443705 S Co:1:042:0 s 21 09 0300 0000 0008 8 = 7de4f2a7 1a530b9e
ffff8804039de0c0 654443913 C Co:1:042:0 0 8 >
ffff880248699000 654458723 S Co:1:042:0 s 21 09 0300 0000 0008 8 = ece99bad 292a9f36
ffff880248699000 654458900 C Co:1:042:0 0 8 >
ffff880248699000 654475641 S Co:1:042:0 s 21 09 0300 0000 0008 8 = c03fc9d9 62752f0d
ffff880248699000 654475768 C Co:1:042:0 0 8 >
ffff880248699000 654490676 S Co:1:042:0 s 21 09 0300 0000 0008 8 = d2f234fa 6eb9b499
ffff880248699000 654490874 C Co:1:042:0 0 8 >
ffff8802486c6480 654505714 S Co:1:042:0 s 21 09 0300 0000 0008 8 = fee1730e bd11c845
ffff8802486c6480 654505873 C Co:1:042:0 0 8 >
ffff8801eff40780 654520915 S Co:1:042:0 s 21 09 0300 0000 0008 8 = a64086cc 00ab2bf1
ffff8801eff40780 654521023 C Co:1:042:0 0 8 >
ffff8804039ded80 654537641 S Co:1:042:0 s 21 09 0300 0000 0008 8 = 2d174c1d af49406f
ffff8804039ded80 654537749 C Co:1:042:0 0 8 >
ffff8804039deb40 654552700 S Co:1:042:0 s 21 09 0300 0000 0008 8 = 7bc30c9c 83c08f06
ffff8804039deb40 654552937 C Co:1:042:0 0 8 >
ffff880248699000 654567669 S Co:1:042:0 s 21 09 0300 0000 0008 8 = 7e72ef1b fa7a43f1
ffff880248699000 654567889 C Co:1:042:0 0 8 >
ffff8804039deb40 654584641 S Co:1:042:0 s 21 09 0300 0000 0008 8 = a5a9811f d8f6abdf
ffff8804039deb40 654584805 C Co:1:042:0 0 8 >
ffff8802486c6cc0 654599690 S Co:1:042:0 s 21 09 0300 0000 0008 8 = 65bf3561 a244ba72
ffff8802486c6cc0 654599893 C Co:1:042:0 0 8 >
ffff8801eff40000 654614721 S Co:1:042:0 s 21 09 0300 0000 0008 8 = b561e04e 238c89c2
ffff8801eff40000 654614894 C Co:1:042:0 0 8 >
ffff8802486c6cc0 654631640 S Co:1:042:0 s 21 09 0300 0000 0008 8 = 940f3c86 e986d2d9
ffff8802486c6cc0 654631759 C Co:1:042:0 0 8 >
ffff8802486993c0 654646722 S Co:1:042:0 s 21 09 0300 0000 0008 8 = 809b655e c6017536
ffff8802486993c0 654646871 C Co:1:042:0 0 8 >
ffff8801eff40000 654661710 S Co:1:042:0 s 21 09 0300 0000 0008 8 = ffaf5d5f 525ff54d
ffff8801eff40000 654661882 C Co:1:042:0 0 8 >
ffff8801eff40000 654676751 S Co:1:042:0 s 21 09 0300 0000 0008 8 = 184689c7 6615fa03
ffff8801eff40000 654676875 C Co:1:042:0 0 8 >
ffff8804039dea80 654693661 S Co:1:042:0 s 21 09 0300 0000 0008 8 = d82f3305 a12dcf35
ffff8804039dea80 654693770 C Co:1:042:0 0 8 >
ffff8802486c6cc0 654708693 S Co:1:042:0 s 21 09 0300 0000 0008 8 = d090083f e5c5e330
ffff8802486c6cc0 654708879 C Co:1:042:0 0 8 >
ffff8802486993c0 654723714 S Co:1:042:0 s 21 09 0300 0000 0008 8 = 945f9ace d8904a38
ffff8802486993c0 654723874 C Co:1:042:0 0 8 >
ffff8802486993c0 654740608 S Co:1:042:0 s 21 09 0300 0000 0008 8 = 3be8ddbf 65523a03
ffff8802486993c0 654740800 C Co:1:042:0 0 8 >
ffff8804039deb40 654755680 S Co:1:042:0 s 21 09 0300 0000 0008 8 = e44cac52 3a66913d
ffff8804039deb40 654755891 C Co:1:042:0 0 8 >
ffff8804039deb40 654770717 S Co:1:042:0 s 21 09 0300 0000 0008 8 = 2dfe447c 4a3a4c04
ffff8804039deb40 654770909 C Co:1:042:0 0 8 >
ffff8802486c6cc0 654787670 S Co:1:042:0 s 21 09 0300 0000 0008 8 = bb46c567 4bcf0f6c
ffff8802486c6cc0 654787875 C Co:1:042:0 0 8 >
ffff8802486c6cc0 654802628 S Co:1:042:0 s 21 09 0300 0000 0008 8 = b7c0b6ee 383ca2fa
ffff8802486c6cc0 654802746 C Co:1:042:0 0 8 >
ffff880403990840 654817651 S Co:1:042:0 s 21 09 0300 0000 0008 8 = 4ddc8024 ce2a6f2a
ffff880403990840 654817772 C Co:1:042:0 0 8 >
ffff880403990840 654832992 S Co:1:042:0 s 21 09 0300 0000 0008 8 = 2e5eefcc 105807eb
ffff880403990840 654833132 C Co:1:042:0 0 8 >
ffff880403990840 654849607 S Co:1:042:0 s 21 09 0300 0000 0008 8 = 0dddb6e1 c4169d1f
ffff880403990840 654849765 C Co:1:042:0 0 8 >
ffff880403990840 654864700 S Co:1:042:0 s 21 09 0300 0000 0008 8 = 2446eb0d f6cb881f
ffff880403990840 654864943 C Co:1:042:0 0 8 >
ffff880403990840 654879867 S Co:1:042:0 s 21 09 0300 0000 0008 8 = ae588533 7371c333
ffff880403990840 654880028 C Co:1:042:0 0 8 >
ffff880403990840 654896648 S Co:1:042:0 s 21 09 0300 0000 0008 8 = 6c28e3e8 4d166e1c
ffff880403990840 654896752 C Co:1:042:0 0 8 >
ffff880403990840 654911694 S Co:1:042:0 s 21 09 0300 0000 0008 8 = 229c46f4 5b5b4d8c
ffff880403990840 654911896 C Co:1:042:0 0 8 >
ffff880403990840 654926752 S Co:1:042:0 s 21 09 0300 0000 0008 8 = 19f253d3 b8f745aa
ffff880403990840 654926876 C Co:1:042:0 0 8 >
ffff880403990840 654943596 S Co:1:042:0 s 21 09 0300 0000 0008 8 = 9d389438 4133e490
ffff880403990840 654943748 C Co:1:042:0 0 8 >
ffff880403990840 654958672 S Co:1:042:0 s 21 09 0300 0000 0008 8 = 7ed3f787 196dd8cf
ffff880403990840 654958885 C Co:1:042:0 0 8 >
ffff880403990840 654973659 S Co:1:042:0 s 21 09 0300 0000 0008 8 = 91fb4b58 279875e8
ffff880403990840 654973766 C Co:1:042:0 0 8 >
ffff880403990840 654990729 S Co:1:042:0 s 21 09 0300 0000 0008 8 = 2e3bc8f9 95b832d3
ffff880403990840 654990876 C Co:1:042:0 0 8 >
ffff880403990000 655004726 S Co:1:042:0 s 21 09 0300 0000 0008 8 = b2f486ea 51682a7a
ffff880403990000 655004900 C Co:1:042:0 0 8 >
ffff880403990000 655021659 S Co:1:042:0 s 21 09 0300 0000 0008 8 = fdd90261 8d559d3c
ffff880403990000 655021766 C Co:1:042:0 0 8 >
ffff880403990000 655036696 S Co:1:042:0 s 21 09 0300 0000 0008 8 = f3729fc6 41c36e6d
ffff880403990000 655036898 C Co:1:042:0 0 8 >
ffff880403990000 655051542 S Co:1:042:0 s 21 09 0300 0000 0008 8 = fc9b2136 a605a5d3
ffff880403990000 655051765 C Co:1:042:0 0 8 >
ffff880403990000 655067629 S Co:1:042:0 s 21 09 0300 0000 0008 8 = 86033102 ba07ed28
ffff880403990000 655067796 C Co:1:042:0 0 8 >
ffff880403990000 655083714 S Co:1:042:0 s 21 09 0300 0000 0008 8 = 80b0de2e c1c6159c
ffff880403990000 655083876 C Co:1:042:0 0 8 >
ffff880403990000 655098574 S Co:1:042:0 s 21 09 0300 0000 0008 8 = df7819f5 c0d59152
ffff880403990000 655098776 C Co:1:042:0 0 8 >
ffff880403990840 655114609 S Co:1:042:0 s 21 09 0300 0000 0008 8 = 1b883642 02d8f8e1
ffff880403990840 655114754 C Co:1:042:0 0 8 >
ffff880403990840 655131670 S Co:1:042:0 s 21 09 0300 0000 0008 8 = b1df6f36 950985d2
ffff880403990840 655131902 C Co:1:042:0 0 8 >
ffff880403990840 655146513 S Co:1:042:0 s 21 09 0300 0000 0008 8 = a0d162a7 ccb89826
ffff880403990840 655146750 C Co:1:042:0 0 8 >
ffff880403990840 655161609 S Co:1:042:0 s 21 09 0300 0000 0008 8 = ee86909d bdc535d0
ffff880403990840 655161774 C Co:1:042:0 0 8 >
ffff880403990840 655176636 S Co:1:042:0 s 21 09 0300 0000 0008 8 = 227bdfd5 c2278235
ffff880403990840 655176778 C Co:1:042:0 0 8 >
ffff880403990840 655193696 S Co:1:042:0 s 21 09 0300 0000 0008 8 = cafe1740 fa674ab1
ffff880403990840 655193900 C Co:1:042:0 0 8 >
ffff880403990840 655208536 S Co:1:042:0 s 21 09 0300 0000 0008 8 = f5b46683 c7237f13
ffff880403990840 655208770 C Co:1:042:0 0 8 >
ffff880403990840 655223631 S Co:1:042:0 s 21 09 0300 0000 0008 8 = b714de77 508db11d
ffff880403990840 655223755 C Co:1:042:0 0 8 >
ffff8802486c6cc0 655240631 S Co:1:042:0 s 21 09 0300 0000 0008 8 = aaecf4a8 feeb9a07
ffff8802486c6cc0 655240767 C Co:1:042:0 0 8 >
ffff8802486996c0 655255524 S Co:1:042:0 s 21 09 0300 0000 0008 8 = 69d901d8 001695fc
ffff8802486996c0 655255782 C Co:1:042:0 0 8 >
ffff8802486c6cc0 655272633 S Co:1:042:0 s 21 09 0300 0000 0008 8 = 16d1c27b c9fe209a
ffff8802486c6cc0 655272780 C Co:1:042:0 0 8 >
ffff8802486996c0 655289640 S Co:1:042:0 s 21 09 0300 0000 0008 8 = d39ada3a 90235f73
ffff8802486996c0 655289769 C Co:1:042:0 0 8 >
ffff880403862900 655302704 S Co:1:042:0 s 21 09 0300 0000 0008 8 = 4a524d72 cd1b9a90
ffff880403862900 655302899 C Co:1:042:0 0 8 >
ffff880403862900 655317607 S Co:1:042:0 s 21 09 0300 0000 0008 8 = 28e804b4 c011bceb
ffff880403862900 655317780 C Co:1:042:0 0 8 >
ffff8801eff409c0 655332782 S Co:1:042:0 s 21 09 0300 0000 0008 8 = 9b9f4e45 eb42d4f3
ffff8801eff409c0 655332881 C Co:1:042:0 0 8 >
ffff8801eff409c0 655349639 S Co:1:042:0 s 21 09 0300 0000 0008 8 = da905c9e 9580960a
ffff8801eff409c0 655349753 C Co:1:042:0 0 8 >
ffff8802486996c0 655364564 S Co:1:042:0 s 21 09 0300 0000 0008 8 = 9b26c2eb 48b1d908
ffff8802486996c0 655364773 C Co:1:042:0 0 8 >
ffff8802486c6cc0 655379609 S Co:1:042:0 s 21 09 0300 0000 0008 8 = 9da2fa8e 514f18b7
ffff8802486c6cc0 655379774 C Co:1:042:0 0 8 >
ffff8801eff409c0 655396686 S Co:1:042:0 s 21 09 0300 0000 0008 8 = 1e97e29b 45e7f356
ffff8801eff409c0 655396901 C Co:1:042:0 0 8 >
ffff8801eff409c0 655411583 S Co:1:042:0 s 21 09 0300 0000 0008 8 = 636e3c5c 789cae19
ffff8801eff409c0 655411776 C Co:1:042:0 0 8 >
ffff8801eff409c0 655426875 S Co:1:042:0 s 21 09 0300 0000 0008 8 = 35e12bcc 86a3afa5
ffff8801eff409c0 655427035 C Co:1:042:0 0 8 >
ffff8801eff409c0 655443619 S Co:1:042:0 s 21 09 0300 0000 0008 8 = 6081ba1d ccc70297
ffff8801eff409c0 655443774 C Co:1:042:0 0 8 >
ffff8801eff409c0 655458702 S Co:1:042:0 s 21 09 0300 0000 0008 8 = 34315735 eee5d6fc
ffff8801eff409c0 655458944 C Co:1:042:0 0 8 >
ffff8801eff409c0 655473601 S Co:1:042:0 s 21 09 0300 0000 0008 8 = 07ab522b 516fffd8
ffff8801eff409c0 655473752 C Co:1:042:0 0 8 >
ffff8801eff409c0 655490662 S Co:1:042:0 s 21 09 0300 0000 0008 8 = aff960cc a0eb74a1
ffff8801eff409c0 655490767 C Co:1:042:0 0 8 >
ffff8801eff409c0 655505687 S Co:1:042:0 s 21 09 0300 0000 0008 8 = 0afb1c1a 4972d0c3
ffff8801eff409c0 655505901 C Co:1:042:0 0 8 >
ffff880403862900 655520593 S Co:1:042:0 s 21 09 0300 0000 0008 8 = 78e583c9 fe33d31c
ffff880403862900 655520755 C Co:1:042:0 0 8 >
ffff8802486996c0 655537595 S Co:1:042:0 s 21 09 0300 0000 0008 8 = 5dc076c3 37f0e17f
ffff8802486996c0 655537755 C Co:1:042:0 0 8 >
ffff880406d57cc0 655552714 S Co:1:042:0 s 21 09 0300 0000 0008 8 = a2e73aa3 ad7f8033
ffff880406d57cc0 655552934 C Co:1:042:0 0 8 >
ffff880406d57cc0 655567579 S Co:1:042:0 s 21 09 0300 0000 0008 8 = 3289f83c df48dc73
ffff880406d57cc0 655567817 C Co:1:042:0 0 8 >
ffff8802486c6cc0 655582662 S Co:1:042:0 s 21 09 0300 0000 0008 8 = 802b3f11 8fcb44ee
ffff8802486c6cc0 655582783 C Co:1:042:0 0 8 >
ffff8801eff409c0 655599659 S Co:1:042:0 s 21 09 0300 0000 0008 8 = fe2580dc 4319ac47
ffff8801eff409c0 655599777 C Co:1:042:0 0 8 >
ffff880403862900 655614708 S Co:1:042:0 s 21 09 0300 0000 0008 8 = a5228f0a c6572b94
ffff880403862900 655614882 C Co:1:042:0 0 8 >
ffff880403862900 655629544 S Co:1:042:0 s 21 09 0300 0000 0008 8 = 71a3273b a6417ce0
ffff880403862900 655629753 C Co:1:042:0 0 8 >
ffff880403862900 655646646 S Co:1:042:0 s 21 09 0300 0000 0008 8 = e47b64c5 b6a37fab
ffff880403862900 655646763 C Co:1:042:0 0 8 >
ffff880403862900 655661690 S Co:1:042:0 s 21 09 0300 0000 0008 8 = 8152482f 8ce0b866
ffff880403862900 655661882 C Co:1:042:0 0 8 >
ffff8802486c6cc0 655676539 S Co:1:042:0 s 21 09 0300 0000 0008 8 = 502438b8 026dcdfa
ffff8802486c6cc0 655676771 C Co:1:042:0 0 8 >
ffff8802486c6cc0 655693637 S Co:1:042:0 s 21 09 0300 0000 0008 8 = 5fc07fd0 b7540a41
ffff8802486c6cc0 655693796 C Co:1:042:0 0 8 >
ffff8802486c6cc0 655708684 S Co:1:042:0 s 21 09 0300 0000 0008 8 = 3d4cc89b 8eb4de8a
ffff8802486c6cc0 655708912 C Co:1:042:0 0 8 >
ffff8802486c6cc0 655723586 S Co:1:042:0 s 21 09 0300 0000 0008 8 = 7fbea673 2b3e5d17
ffff8802486c6cc0 655723778 C Co:1:042:0 0 8 >
ffff8801eff409c0 655740633 S Co:1:042:0 s 21 09 0300 0000 0008 8 = 3d630e65 7bb7be9f
ffff8801eff409c0 655740758 C Co:1:042:0 0 8 >
ffff8802486c6cc0 655755626 S Co:1:042:0 s 21 09 0300 0000 0008 8 = 935ad9b1 2a7bddcf
ffff8802486c6cc0 655755760 C Co:1:042:0 0 8 >
ffff8802486c6cc0 655770565 S Co:1:042:0 s 21 09 0300 0000 0008 8 = 2317454d 2cf6b8c3
ffff8802486c6cc0 655770797 C Co:1:042:0 0 8 >
ffff8801eff409c0 655787630 S Co:1:042:0 s 21 09 0300 0000 0008 8 = 8fe37261 382bf38f
ffff8801eff409c0 655787779 C Co:1:042:0 0 8 >
ffff8801eff409c0 655802671 S Co:1:042:0 s 21 09 0300 0000 0008 8 = 0258e8ca 462f56bb
ffff8801eff409c0 655802760 C Co:1:042:0 0 8 >
ffff8802486996c0 655817663 S Co:1:042:0 s 21 09 0300 0000 0008 8 = a6e70d99 16ac4cc0
ffff8802486996c0 655817754 C Co:1:042:0 0 8 >
ffff8802486c6cc0 655834602 S Co:1:042:0 s 21 09 0300 0000 0008 8 = 2d54b192 ab61658e
ffff8802486c6cc0 655834783 C Co:1:042:0 0 8 >
ffff8801eff409c0 655849594 S Co:1:042:0 s 21 09 0300 0000 0008 8 = 4a3785b0 ca9ed308
ffff8801eff409c0 655849756 C Co:1:042:0 0 8 >
ffff8802486c6cc0 655864807 S Co:1:042:0 s 21 09 0300 0000 0008 8 = 377b9d9e 7dcbee85
ffff8802486c6cc0 655865016 C Co:1:042:0 0 8 >
ffff8802486996c0 655881601 S Co:1:042:0 s 21 09 0300 0000 0008 8 = 2fe0f43d 94e0b14e
ffff8802486996c0 655881763 C Co:1:042:0 0 8 >
ffff8802486996c0 655896647 S Co:1:042:0 s 21 09 0300 0000 0008 8 = f47be623 21ec3d24
ffff8802486996c0 655896760 C Co:1:042:0 0 8 >
ffff8802486996c0 655911608 S Co:1:042:0 s 21 09 0300 0000 0008 8 = 4833b518 f99153b9
ffff8802486996c0 655911756 C Co:1:042:0 0 8 >
ffff880406d57cc0 655928596 S Co:1:042:0 s 21 09 0300 0000 0008 8 = 75440799 3884dc35
ffff880406d57cc0 655928780 C Co:1:042:0 0 8 >
ffff880406d57cc0 655943655 S Co:1:042:0 s 21 09 0300 0000 0008 8 = c7bd6457 bc0f63b1
ffff880406d57cc0 655943758 C Co:1:042:0 0 8 >
ffff880406d57cc0 655958657 S Co:1:042:0 s 21 09 0300 0000 0008 8 = 0f04bbb7 a69097bc
ffff880406d57cc0 655958838 C Co:1:042:0 0 8 >
ffff880406d57cc0 655973893 S Co:1:042:0 s 21 09 0300 0000 0008 8 = 204fdc51 defaccdb
ffff880406d57cc0 655974008 C Co:1:042:0 0 8 >
ffff880406d57240 655991241 S Co:1:042:0 s 21 09 0300 0000 0008 8 = 542afd73 8e517a03
ffff880406d57240 655991407 C Co:1:042:0 0 8 >
ffff880406d57240 656005268 S Co:1:042:0 s 21 09 0300 0000 0008 8 = 06f6379e a530ba1f
ffff880406d57240 656005415 C Co:1:042:0 0 8 >
ffff880406d57cc0 656022358 S Co:1:042:0 s 21 09 0300 0000 0008 8 = 17660806 5345cd8f
ffff880406d57cc0 656022533 C Co:1:042:0 0 8 >
ffff880406d57cc0 656036177 S Co:1:042:0 s 21 09 0300 0000 0008 8 = 6b02d014 91d297a5
ffff880406d57cc0 656036256 C Co:1:042:0 0 8 >
ffff880406d57cc0 656052243 S Co:1:042:0 s 21 09 0300 0000 0008 8 = 6ba656e5 982c1e28
ffff880406d57cc0 656052409 C Co:1:042:0 0 8 >
ffff880406d57cc0 656068256 S Co:1:042:0 s 21 09 0300 0000 0008 8 = 830343ca 673d0ed2
ffff880406d57cc0 656068383 C Co:1:042:0 0 8 >
ffff880406d57cc0 656083161 S Co:1:042:0 s 21 09 0300 0000 0008 8 = a31aa4c8 400337d4
ffff880406d57cc0 656083258 C Co:1:042:0 0 8 >
ffff880406d57240 656099172 S Co:1:042:0 s 21 09 0300 0000 0008 8 = c0c66b18 29110b4f
ffff880406d57240 656099276 C Co:1:042:0 0 8 >
ffff880406d57240 656114347 S Co:1:042:0 s 21 09 0300 0000 0008 8 = 5231eca6 6e0b22db
ffff880406d57240 656114545 C Co:1:042:0 0 8 >
ffff880406d57240 656131199 S Co:1:042:0 s 21 09 0300 0000 0008 8 = d65b6294 1b2cb702
ffff880406d57240 656131416 C Co:1:042:0 0 8 >
ffff8802486c6cc0 656146165 S Co:1:042:0 s 21 09 0300 0000 0008 8 = 4c9869b6 84c22bc3
ffff8802486c6cc0 656146279 C Co:1:042:0 0 8 >
ffff8802486c6cc0 656161251 S Co:1:042:0 s 21 09 0300 0000 0008 8 = b8118415 bfae7f11
ffff8802486c6cc0 656161393 C Co:1:042:0 0 8 >
ffff8801eff40780 656178316 S Co:1:042:0 s 21 09 0300 0000 0008 8 = a341966f 27e7dc54
ffff8801eff40780 656178512 C Co:1:042:0 0 8 >
ffff8801eff40780 656193152 S Co:1:042:0 s 21 09 0300 0000 0008 8 = 98776bb3 d9f60de5
ffff8801eff40780 656193259 C Co:1:042:0 0 8 >
ffff8801eff40780 656208185 S Co:1:042:0 s 21 09 0300 0000 0008 8 = a9582e87 387a0294
ffff8801eff40780 656208404 C Co:1:042:0 0 8 >
ffff8802486996c0 656225289 S Co:1:042:0 s 21 09 0300 0000 0008 8 = ea5cf2c4 6ba34d24
ffff8802486996c0 656225383 C Co:1:042:0 0 8 >
ffff8802486c6cc0 656240142 S Co:1:042:0 s 21 09 0300 0000 0008 8 = f34e2cf6 dbb8a6cb
ffff8802486c6cc0 656240271 C Co:1:042:0 0 8 >
ffff880248699000 656255231 S Co:1:042:0 s 21 09 0300 0000 0008 8 = 61cf36df b89369b5
ffff880248699000 656255430 C Co:1:042:0 0 8 >
ffff880248699000 656272306 S Co:1:042:0 s 21 09 0300 0000 0008 8 = 54d2cbf3 73221480
ffff880248699000 656272409 C Co:1:042:0 0 8 >
ffff880248699000 656287207 S Co:1:042:0 s 21 09 0300 0000 0008 8 = ef1f8fdc 44e6ccbf
ffff880248699000 656287408 C Co:1:042:0 0 8 >
ffff880403862900 656302254 S Co:1:042:0 s 21 09 0300 0000 0008 8 = ddd286f5 a376d779
ffff880403862900 656302405 C Co:1:042:0 0 8 >
ffff880403862900 656319276 S Co:1:042:0 s 21 09 0300 0000 0008 8 = c8db9ad1 d1fb21a9
ffff880403862900 656319390 C Co:1:042:0 0 8 >
ffff8802486c6cc0 656334251 S Co:1:042:0 s 21 09 0300 0000 0008 8 = e27d18b3 4eb3b9be
ffff8802486c6cc0 656334383 C Co:1:042:0 0 8 >
ffff8802486c6cc0 656349150 S Co:1:042:0 s 21 09 0300 0000 0008 8 = 5fd23215 6270531b
ffff8802486c6cc0 656349259 C Co:1:042:0 0 8 >
ffff8802486c6cc0 656366216 S Co:1:042:0 s 21 09 0300 0000 0008 8 = f7437d24 9718c796
ffff8802486c6cc0 656366402 C Co:1:042:0 0 8 >
ffff8802486c6cc0 656381245 S Co:1:042:0 s 21 09 0300 0000 0008 8 = 66127140 3b258efa
ffff8802486c6cc0 656381406 C Co:1:042:0 0 8 >
ffff8802486c6cc0 656396163 S Co:1:042:0 s 21 09 0300 0000 0008 8 = edd3ee7e e1254a87
ffff8802486c6cc0 656396259 C Co:1:042:0 0 8 >
ffff8802486c6cc0 656411471 S Co:1:042:0 s 21 09 0300 0000 0008 8 = d1ecb328 de393c6e
ffff8802486c6cc0 656411657 C Co:1:042:0 0 8 >
ffff8802486c6cc0 656428237 S Co:1:042:0 s 21 09 0300 0000 0008 8 = d91ae739 ce98ce58
ffff8802486c6cc0 656428403 C Co:1:042:0 0 8 >
ffff8801eff40780 656443142 S Co:1:042:0 s 21 09 0300 0000 0008 8 = d3ee92e4 0f0b09df
ffff8801eff40780 656443260 C Co:1:042:0 0 8 >
ffff880248699000 656458173 S Co:1:042:0 s 21 09 0300 0000 0008 8 = 0d4a230d 43701d11
ffff880248699000 656458283 C Co:1:042:0 0 8 >
ffff8802486c6cc0 656473198 S Co:1:042:0 s 21 09 0300 0000 0008 8 = dee6eacc d039def2
ffff8802486c6cc0 656473402 C Co:1:042:0 0 8 >
ffff8802486c6840 656490256 S Co:1:042:0 s 21 09 0300 0000 0008 8 = 1cd09dee 61ec43f9
ffff8802486c6840 656490403 C Co:1:042:0 0 8 >
ffff880248699300 656505153 S Co:1:042:0 s 21 09 0300 0000 0008 8 = a5e5d576 64a3e890
ffff880248699300 656505261 C Co:1:042:0 0 8 >
ffff8802486c6e40 656520302 S Co:1:042:0 s 21 09 0300 0000 0008 8 = da5b9016 8c8b8c96
ffff8802486c6e40 656520531 C Co:1:042:0 0 8 >
ffff8802486c6e40 656537252 S Co:1:042:0 s 21 09 0300 0000 0008 8 = 1d39afb9 4f6791df
ffff8802486c6e40 656537389 C Co:1:042:0 0 8 >
ffff8801eff403c0 656552145 S Co:1:042:0 s 21 09 0300 0000 0008 8 = 58da77fb 680d80b0
ffff8801eff403c0 656552264 C Co:1:042:0 0 8 >
ffff8801eff403c0 656567210 S Co:1:042:0 s 21 09 0300 0000 0008 8 = 777012ad 53e68545
ffff8801eff403c0 656567408 C Co:1:042:0 0 8 >
ffff8803e300a780 656584255 S Co:1:042:0 s 21 09 0300 0000 0008 8 = ea7d0d53 d670ed4e
ffff8803e300a780 656584388 C Co:1:042:0 0 8 >
ffff8803e300a780 656599195 S Co:1:042:0 s 21 09 0300 0000 0008 8 = 275adaa7 74bdad6b
ffff8803e300a780 656599392 C Co:1:042:0 0 8 >
ffff880403862cc0 656614224 S Co:1:042:0 s 21 09 0300 0000 0008 8 = 24b34e16 f9f3ddb6
ffff880403862cc0 656614413 C Co:1:042:0 0 8 >
ffff8801eff40780 656631286 S Co:1:042:0 s 21 09 0300 0000 0008 8 = df072141 f4cc3637
ffff8801eff40780 656631394 C Co:1:042:0 0 8 >
ffff880403990c00 656646236 S Co:1:042:0 s 21 09 0300 0000 0008 8 = d82a737b 36159a6f
ffff880403990c00 656646388 C Co:1:042:0 0 8 >
ffff880403990c00 656661216 S Co:1:042:0 s 21 09 0300 0000 0008 8 = 93c4434f 56318ad0
ffff880403990c00 656661445 C Co:1:042:0 0 8 >
ffff8802486c6e40 656678211 S Co:1:042:0 s 21 09 0300 0000 0008 8 = 19d1f8f9 2f95b041
ffff8802486c6e40 656678406 C Co:1:042:0 0 8 >
ffff8801eff40780 656693306 S Co:1:042:0 s 21 09 0300 0000 0008 8 = 7622dbea 5e4c559d
ffff8801eff40780 656693414 C Co:1:042:0 0 8 >
ffff8801eff40780 656708201 S Co:1:042:0 s 21 09 0300 0000 0008 8 = 3ad89847 c773e933
ffff8801eff40780 656708391 C Co:1:042:0 0 8 >
ffff8801eff40780 656723255 S Co:1:042:0 s 21 09 0300 0000 0008 8 = faeec368 0ebc8145
ffff8801eff40780 656723388 C Co:1:042:0 0 8 >
ffff880403990b40 656740253 S Co:1:042:0 s 21 09 0300 0000 0008 8 = ceae4f5c 20ed528b
ffff880403990b40 656740390 C Co:1:042:0 0 8 >
ffff880403990b40 656755196 S Co:1:042:0 s 21 09 0300 0000 0008 8 = d3381661 aa5f39b0
ffff880403990b40 656755437 C Co:1:042:0 0 8 >
ffff880403990b40 656772278 S Co:1:042:0 s 21 09 0300 0000 0008 8 = a801566e 9e8234d1
ffff880403990b40 656772390 C Co:1:042:0 0 8 >
ffff880403990b40 656787284 S Co:1:042:0 s 21 09 0300 0000 0008 8 = f34f30ab b456e803
ffff880403990b40 656787404 C Co:1:042:0 0 8 >
ffff880403990b40 656802254 S Co:1:042:0 s 21 09 0300 0000 0008 8 = dcc029f5 e5f11bcc
ffff880403990b40 656802410 C Co:1:042:0 0 8 >
ffff880403990b40 656817211 S Co:1:042:0 s 21 09 0300 0000 0008 8 = 8fc2ab5d effe39a6
ffff880403990b40 656817413 C Co:1:042:0 0 8 >
ffff8801eff40780 656834269 S Co:1:042:0 s 21 09 0300 0000 0008 8 = bc1b84a8 d639d282
ffff8801eff40780 656834393 C Co:1:042:0 0 8 >
ffff880248699300 656849247 S Co:1:042:0 s 21 09 0300 0000 0008 8 = 176063cf 5ff61841
ffff880248699300 656849391 C Co:1:042:0 0 8 >
ffff8801eff40780 656864140 S Co:1:042:0 s 21 09 0300 0000 0008 8 = da80607e 959a643b
ffff8801eff40780 656864266 C Co:1:042:0 0 8 >
ffff8801eff40780 656881211 S Co:1:042:0 s 21 09 0300 0000 0008 8 = 41387397 461fafba
ffff8801eff40780 656881408 C Co:1:042:0 0 8 >
ffff8802486c6300 656896233 S Co:1:042:0 s 21 09 0300 0000 0008 8 = 0b9ef9ae 85921b7d
ffff8802486c6300 656896408 C Co:1:042:0 0 8 >
ffff8802486c6300 656911181 S Co:1:042:0 s 21 09 0300 0000 0008 8 = fe99358c 27966a37
ffff8802486c6300 656911320 C Co:1:042:0 0 8 >
ffff880248699300 656928186 S Co:1:042:0 s 21 09 0300 0000 0008 8 = 6165cbae 49e08310
ffff880248699300 656928279 C Co:1:042:0 0 8 >
ffff880248699300 656943238 S Co:1:042:0 s 21 09 0300 0000 0008 8 = 821244c5 c6bbf221
ffff880248699300 656943400 C Co:1:042:0 0 8 >
ffff8802486c6300 656958214 S Co:1:042:0 s 21 09 0300 0000 0008 8 = 30048f36 c38367fa
ffff8802486c6300 656958396 C Co:1:042:0 0 8 >
ffff8802486c6300 656975231 S Co:1:042:0 s 21 09 0300 0000 0008 8 = 3f727c9a 262c341e
ffff8802486c6300 656975397 C Co:1:042:0 0 8 >
ffff880248699300 656990266 S Co:1:042:0 s 21 09 0300 0000 0008 8 = 09e9413e 18bbd183
ffff880248699300 656990408 C Co:1:042:0 0 8 >
ffff8802486c6300 657005348 S Co:1:042:0 s 21 09 0300 0000 0008 8 = e9c8f8a1 88c95a15
ffff8802486c6300 657005517 C Co:1:042:0 0 8 >
ffff880403862cc0 657020215 S Co:1:042:0 s 21 09 0300 0000 0008 8 = c0c31dfb a9050e31
ffff880403862cc0 657020389 C Co:1:042:0 0 8 >
ffff8801eff40780 657037211 S Co:1:042:0 s 21 09 0300 0000 0008 8 = 736312b2 71b1d02d
ffff8801eff40780 657037391 C Co:1:042:0 0 8 >
ffff8801eff40c00 657052296 S Co:1:042:0 s 21 09 0300 0000 0008 8 = 69829ce4 1b22a7cd
ffff8801eff40c00 657052394 C Co:1:042:0 0 8 >
ffff8801eff40c00 657067781 S Co:1:042:0 s 21 09 0300 0000 0008 8 = 0fd265e3 a4433fcd
ffff8801eff40c00 657067915 C Co:1:042:0 0 8 >
ffff880403862cc0 657098776 S Co:1:042:0 s 21 09 0300 0000 0008 8 = 550387b4 834d6302
ffff880403862cc0 657098917 C Co:1:042:0 0 8 >
ffff8802486c6c00 657130704 S Ci:1:042:0 s a1 01 0300 0000 0008 8 <
ffff8802486c6c00 657130916 C Ci:1:042:0 0 8 = aa040000 00000000
ffff8803d54a6e40 667926684 S Co:1:042:0 s 21 09 0300 0000 0008 8 = 55010100 00ff075d
ffff8803d54a6e40 667926858 C Co:1:042:0 0 8 >
ffff8803d54a6e40 667971613 S Ci:1:042:0 s a1 01 0300 0000 0008 8 <
ffff8803d54a6e40 667971752 C Ci:1:042:0 0 8 = aa020000 00000000
ffff8803d54a6e40 667990603 S Co:1:042:0 s 21 09 0300 0000 0008 8 = 0b010101 00000e04
ffff8803d54a6e40 667990734 C Co:1:042:0 0 8 >
ffff8803d54a6e40 668005691 S Co:1:042:0 s 21 09 0300 0000 0008 8 = 8bb76e03 26d335b4
ffff8803d54a6e40 668005924 C Co:1:042:0 0 8 >
ffff8803d54a6900 668020954 S Co:1:042:0 s 21 09 0300 0000 0008 8 = 01809600 15ffd7ff
ffff8803d54a6900 668021115 C Co:1:042:0 0 8 >
ffff8803d54a6900 668038813 S Co:1:042:0 s 21 09 0300 0000 0008 8 = 87ff97ff f7ff27ff
ffff8803d54a6900 668039003 C Co:1:042:0 0 8 >
ffff8803d54a6900 668051865 S Co:1:042:0 s 21 09 0300 0000 0008 8 = 87ffa7ff 57ffc7ff
ffff8803d54a6900 668051985 C Co:1:042:0 0 8 >
ffff8803d54a6900 668068876 S Co:1:042:0 s 21 09 0300 0000 0008 8 = 47ffb7ff 57ffc7ff
ffff8803d54a6900 668068985 C Co:1:042:0 0 8 >
ffff8803d54a6e40 668083826 S Co:1:042:0 s 21 09 0300 0000 0008 8 = 97ff57ff 57ff17ff
ffff8803d54a6e40 668083989 C Co:1:042:0 0 8 >
ffff8803d54a6e40 668099085 S Co:1:042:0 s 21 09 0300 0000 0008 8 = d7ff27ff 57ff67ff
ffff8803d54a6e40 668099260 C Co:1:042:0 0 8 >
ffff8803d54a6e40 668114933 S Co:1:042:0 s 21 09 0300 0000 0008 8 = d7ff97ff c7ff27ff
ffff8803d54a6e40 668115114 C Co:1:042:0 0 8 >
ffff8803d54a6900 668130743 S Co:1:042:0 s 21 09 0300 0000 0008 8 = a7ff97ff d7ffc7ff
ffff8803d54a6900 668130860 C Co:1:042:0 0 8 >
ffff8803d54a6900 668145806 S Co:1:042:0 s 21 09 0300 0000 0008 8 = 37ff27ff 77ff87ff
ffff8803d54a6900 668145988 C Co:1:042:0 0 8 >
ffff8803d54a6900 668162903 S Co:1:042:0 s 21 09 0300 0000 0008 8 = 47ff07ff 67ffd7ff
ffff8803d54a6900 668163012 C Co:1:042:0 0 8 >
ffff8803d54a6900 668177895 S Co:1:042:0 s 21 09 0300 0000 0008 8 = a7ffa7ff 77ffc7ff
ffff8803d54a6900 668177991 C Co:1:042:0 0 8 >
ffff8803d54a6900 668192826 S Co:1:042:0 s 21 09 0300 0000 0008 8 = c7ff27ff 67fff7ff
ffff8803d54a6900 668193022 C Co:1:042:0 0 8 >
ffff8804039de240 668209880 S Co:1:042:0 s 21 09 0300 0000 0008 8 = 67ff07ff 67ff87ff
ffff8804039de240 668209995 C Co:1:042:0 0 8 >
ffff8802486c6480 668224920 S Co:1:042:0 s 21 09 0300 0000 0008 8 = 67ff97ff a7ff87ff
ffff8802486c6480 668225153 C Co:1:042:0 0 8 >
ffff8803d54a6900 668239788 S Co:1:042:0 s 21 09 0300 0000 0008 8 = 57ff27ff 47ff47ff
ffff8803d54a6900 668240008 C Co:1:042:0 0 8 >
ffff8803d54a6900 668256814 S Co:1:042:0 s 21 09 0300 0000 0008 8 = c7ffc7ff 17ff67ff
ffff8803d54a6900 668257006 C Co:1:042:0 0 8 >
ffff8801eff40000 668271913 S Co:1:042:0 s 21 09 0300 0000 0008 8 = f7ff47ff 97ffb7ff
ffff8801eff40000 668272115 C Co:1:042:0 0 8 >
ffff8801eff40000 668287148 S Co:1:042:0 s 21 09 0300 0000 0008 8 = e7ff47ff f7ff97ff
ffff8801eff40000 668287267 C Co:1:042:0 0 8 >
ffff8801eff40000 668301848 S Co:1:042:0 s 21 09 0300 0000 0008 8 = 67ffa7ff 47ff57ff
ffff8801eff40000 668302012 C Co:1:042:0 0 8 >
ffff8801eff40000 668318893 S Co:1:042:0 s 21 09 0300 0000 0008 8 = 07ff47ff 67ff77ff
ffff8801eff40000 668319012 C Co:1:042:0 0 8 >
ffff8801eff40000 668333937 S Co:1:042:0 s 21 09 0300 0000 0008 8 = 37ffc7ff c7fff7ff
ffff8801eff40000 668334131 C Co:1:042:0 0 8 >
ffff8801eff40000 668348775 S Co:1:042:0 s 21 09 0300 0000 0008 8 = b7fff7ff 37ff77ff
ffff8801eff40000 668348991 C Co:1:042:0 0 8 >
ffff8802486c6480 668365823 S Co:1:042:0 s 21 09 0300 0000 0008 8 = b7ff17ff c7ff07ff
ffff8802486c6480 668366015 C Co:1:042:0 0 8 >
ffff8802486999c0 668380923 S Co:1:042:0 s 21 09 0300 0000 0008 8 = 17ff67ff f7ff97ff
ffff8802486999c0 668381116 C Co:1:042:0 0 8 >
ffff8802486999c0 668395809 S Co:1:042:0 s 21 09 0300 0000 0008 8 = 87ff67ff c7ff67ff
ffff8802486999c0 668396011 C Co:1:042:0 0 8 >
ffff8802486999c0 668412868 S Co:1:042:0 s 21 09 0300 0000 0008 8 = 37ffa7ff c7ffe7ff
ffff8802486999c0 668413018 C Co:1:042:0 0 8 >
ffff8804039de240 668427906 S Co:1:042:0 s 21 09 0300 0000 0008 8 = 37ff77ff 67ff97ff
ffff8804039de240 668428011 C Co:1:042:0 0 8 >
ffff8804039de240 668442746 S Co:1:042:0 s 21 09 0300 0000 0008 8 = e7ff77ff b7ffc7ff
ffff8804039de240 668442883 C Co:1:042:0 0 8 >
ffff8802486c6480 668459862 S Co:1:042:0 s 21 09 0300 0000 0008 8 = 97ff67ff f7ff77ff
ffff8802486c6480 668460008 C Co:1:042:0 0 8 >
ffff8801eff40000 668474884 S Co:1:042:0 s 21 09 0300 0000 0008 8 = d7ffa7ff 27ffc7ff
ffff8801eff40000 668474992 C Co:1:042:0 0 8 >
ffff8801eff40000 668489927 S Co:1:042:0 s 21 09 0300 0000 0008 8 = 57ff47ff 07ff97ff
ffff8801eff40000 668490113 C Co:1:042:0 0 8 >
ffff8801eff40000 668504818 S Co:1:042:0 s 21 09 0300 0000 0008 8 = 77ffc7ff b7fff7ff
ffff8801eff40000 668505014 C Co:1:042:0 0 8 >
ffff8802486c6480 668521873 S Co:1:042:0 s 21 09 0300 0000 0008 8 = 57ff57ff c7c45182
ffff8802486c6480 668522011 C Co:1:042:0 0 8 >
ffff8801eff40000 668536954 S Co:1:042:0 s 21 09 0300 0000 0008 8 = 2b5c87fa aaad5419
ffff8801eff40000 668537118 C Co:1:042:0 0 8 >
ffff8801eff40000 668552023 S Co:1:042:0 s 21 09 0300 0000 0008 8 = 6c89fbd8 dc2ea8fe
ffff8801eff40000 668552116 C Co:1:042:0 0 8 >
ffff8801eff40000 668568819 S Co:1:042:0 s 21 09 0300 0000 0008 8 = c712ae84 b2effe46
ffff8801eff40000 668568999 C Co:1:042:0 0 8 >
ffff8801eff40000 668583916 S Co:1:042:0 s 21 09 0300 0000 0008 8 = 7e0feaf1 3bd91c29
ffff8801eff40000 668584139 C Co:1:042:0 0 8 >
ffff8801eff40000 668598868 S Co:1:042:0 s 21 09 0300 0000 0008 8 = 499dd2f9 b59c5c80
ffff8801eff40000 668599017 C Co:1:042:0 0 8 >
ffff8804039dec00 668615810 S Co:1:042:0 s 21 09 0300 0000 0008 8 = d25bd7da 172a2b4d
ffff8804039dec00 668616034 C Co:1:042:0 0 8 >
ffff8804039dec00 668630836 S Co:1:042:0 s 21 09 0300 0000 0008 8 = 39ef43b5 89388c31
ffff8804039dec00 668630990 C Co:1:042:0 0 8 >
ffff8802486c6480 668645882 S Co:1:042:0 s 21 09 0300 0000 0008 8 = 9081b10f e8c294f6
ffff8802486c6480 668645990 C Co:1:042:0 0 8 >
ffff8801eff40000 668660799 S Co:1:042:0 s 21 09 0300 0000 0008 8 = 5d3c9052 4585ee05
ffff8801eff40000 668660993 C Co:1:042:0 0 8 >
ffff8803e300af00 668677828 S Co:1:042:0 s 21 09 0300 0000 0008 8 = 1dd2a54c 658557ef
ffff8803e300af00 668678014 C Co:1:042:0 0 8 >
ffff8803e300af00 668692860 S Co:1:042:0 s 21 09 0300 0000 0008 8 = bdf788ac 418721e6
ffff8803e300af00 668693049 C Co:1:042:0 0 8 >
ffff8803e300af00 668707816 S Co:1:042:0 s 21 09 0300 0000 0008 8 = 21e3248a 8596b142
ffff8803e300af00 668708017 C Co:1:042:0 0 8 >
ffff8803e300af00 668724840 S Co:1:042:0 s 21 09 0300 0000 0008 8 = a0d33ade 138003ff
ffff8803e300af00 668724991 C Co:1:042:0 0 8 >
ffff8803e300af00 668739914 S Co:1:042:0 s 21 09 0300 0000 0008 8 = 8486dd05 7f58233b
ffff8803e300af00 668740193 C Co:1:042:0 0 8 >
ffff8803e300af00 668754777 S Co:1:042:0 s 21 09 0300 0000 0008 8 = 8cc2f542 92f4b4bb
ffff8803e300af00 668754887 C Co:1:042:0 0 8 >
ffff8802486999c0 668771803 S Co:1:042:0 s 21 09 0300 0000 0008 8 = 6ccebe39 c96e6b65
ffff8802486999c0 668772012 C Co:1:042:0 0 8 >
ffff8802486999c0 668786879 S Co:1:042:0 s 21 09 0300 0000 0008 8 = 49f84873 d5a593c6
ffff8802486999c0 668786996 C Co:1:042:0 0 8 >
ffff8804039dec00 668801930 S Co:1:042:0 s 21 09 0300 0000 0008 8 = 3f0ef7df 1bbb888b
ffff8804039dec00 668802133 C Co:1:042:0 0 8 >
ffff8804039dec00 668818844 S Co:1:042:0 s 21 09 0300 0000 0008 8 = dde7024d 34963e0a
ffff8804039dec00 668819016 C Co:1:042:0 0 8 >
ffff8804039dec00 668833890 S Co:1:042:0 s 21 09 0300 0000 0008 8 = a6daf6f3 6d61bab8
ffff8804039dec00 668833995 C Co:1:042:0 0 8 >
ffff8804039dec00 668848919 S Co:1:042:0 s 21 09 0300 0000 0008 8 = 904332eb 450b95b2
ffff8804039dec00 668849022 C Co:1:042:0 0 8 >
ffff8802486c6d80 668865818 S Co:1:042:0 s 21 09 0300 0000 0008 8 = 87036ab1 f4c57f36
ffff8802486c6d80 668866007 C Co:1:042:0 0 8 >
ffff8801eff40cc0 668880880 S Co:1:042:0 s 21 09 0300 0000 0008 8 = e9ff27a7 e086b729
ffff8801eff40cc0 668881024 C Co:1:042:0 0 8 >
ffff8801eff40cc0 668895940 S Co:1:042:0 s 21 09 0300 0000 0008 8 = 099e4392 27889591
ffff8801eff40cc0 668896122 C Co:1:042:0 0 8 >
ffff8801eff40cc0 668912780 S Co:1:042:0 s 21 09 0300 0000 0008 8 = ae4d6f1c 1bca031b
ffff8801eff40cc0 668912908 C Co:1:042:0 0 8 >
ffff8802486999c0 668927856 S Co:1:042:0 s 21 09 0300 0000 0008 8 = 93fdaf53 bf8efd94
ffff8802486999c0 668928016 C Co:1:042:0 0 8 >
ffff8804031c4000 668942892 S Co:1:042:0 s 21 09 0300 0000 0008 8 = e7a1db26 4ddb1772
ffff8804031c4000 668943061 C Co:1:042:0 0 8 >
ffff8804031c4000 668959807 S Co:1:042:0 s 21 09 0300 0000 0008 8 = ccb31eed b2fbf64a
ffff8804031c4000 668959995 C Co:1:042:0 0 8 >
ffff8804039dec00 668974854 S Co:1:042:0 s 21 09 0300 0000 0008 8 = daae79e0 0efbd359
ffff8804039dec00 668974996 C Co:1:042:0 0 8 >
ffff8804039dec00 668989884 S Co:1:042:0 s 21 09 0300 0000 0008 8 = 9b933e9d 3630fdfd
ffff8804039dec00 668990022 C Co:1:042:0 0 8 >
ffff8804039de300 669007318 S Co:1:042:0 s 21 09 0300 0000 0008 8 = 0f6697a4 33ae563b
ffff8804039de300 669007518 C Co:1:042:0 0 8 >
ffff8801eff40cc0 669022344 S Co:1:042:0 s 21 09 0300 0000 0008 8 = 28b0ffdc c3d1d33a
ffff8801eff40cc0 669022521 C Co:1:042:0 0 8 >
ffff8802486999c0 669037315 S Co:1:042:0 s 21 09 0300 0000 0008 8 = 4cfdc60e d6b6fec4
ffff8802486999c0 669037513 C Co:1:042:0 0 8 >
ffff8802486999c0 669052397 S Co:1:042:0 s 21 09 0300 0000 0008 8 = d85d8f67 10c076ca
ffff8802486999c0 669052520 C Co:1:042:0 0 8 >
ffff8801eff40480 669067673 S Co:1:042:0 s 21 09 0300 0000 0008 8 = 99e5d3f8 4b166bde
ffff8801eff40480 669067899 C Co:1:042:0 0 8 >
ffff8801eff40480 669083288 S Co:1:042:0 s 21 09 0300 0000 0008 8 = 532e5e37 142225b8
ffff8801eff40480 669083493 C Co:1:042:0 0 8 >
ffff8801eff40a80 669101360 S Co:1:042:0 s 21 09 0300 0000 0008 8 = 3dd2cf7e 2b127cb4
ffff8801eff40a80 669101519 C Co:1:042:0 0 8 >
ffff8801eff40a80 669115319 S Co:1:042:0 s 21 09 0300 0000 0008 8 = 81f41a89 05595f51
ffff8801eff40a80 669115518 C Co:1:042:0 0 8 >
ffff8801eff40a80 669131341 S Co:1:042:0 s 21 09 0300 0000 0008 8 = beb707fa 4c2c50b2
ffff8801eff40a80 669131497 C Co:1:042:0 0 8 >
ffff8801eff40a80 669146399 S Co:1:042:0 s 21 09 0300 0000 0008 8 = 87c4b2d6 5c07e31e
ffff8801eff40a80 669146517 C Co:1:042:0 0 8 >
ffff8801eff40a80 669161496 S Co:1:042:0 s 21 09 0300 0000 0008 8 = e4c70c07 c5284582
ffff8801eff40a80 669161643 C Co:1:042:0 0 8 >
ffff8804039deb40 669178287 S Co:1:042:0 s 21 09 0300 0000 0008 8 = cef056db ce11b1eb
ffff8804039deb40 669178511 C Co:1:042:0 0 8 >
ffff8804039deb40 669193379 S Co:1:042:0 s 21 09 0300 0000 0008 8 = b574ab82 ee08fb0f
ffff8804039deb40 669193518 C Co:1:042:0 0 8 >
ffff8804039de300 669208723 S Co:1:042:0 s 21 09 0300 0000 0008 8 = fc0b7591 539807c3
ffff8804039de300 669208901 C Co:1:042:0 0 8 >
ffff8802486999c0 669225294 S Co:1:042:0 s 21 09 0300 0000 0008 8 = 7972f483 5d0f5084
ffff8802486999c0 669225495 C Co:1:042:0 0 8 >
ffff8804039dea80 669240349 S Co:1:042:0 s 21 09 0300 0000 0008 8 = f8e8bd35 220064f1
ffff8804039dea80 669240544 C Co:1:042:0 0 8 >
ffff8802486c6300 669255375 S Co:1:042:0 s 21 09 0300 0000 0008 8 = b6b33667 eac1654c
ffff8802486c6300 669255522 C Co:1:042:0 0 8 >
ffff8802486c6300 669272271 S Co:1:042:0 s 21 09 0300 0000 0008 8 = e99a1d40 b2ec87ff
ffff8802486c6300 669272395 C Co:1:042:0 0 8 >
ffff8802486c6300 669287331 S Co:1:042:0 s 21 09 0300 0000 0008 8 = 356b01c9 abe09713
ffff8802486c6300 669287535 C Co:1:042:0 0 8 >
ffff8802486c6300 669302365 S Co:1:042:0 s 21 09 0300 0000 0008 8 = 3575c56f b93f70b9
ffff8802486c6300 669302520 C Co:1:042:0 0 8 >
ffff8801eff40540 669319255 S Co:1:042:0 s 21 09 0300 0000 0008 8 = fa0d2283 f77085c3
ffff8801eff40540 669319400 C Co:1:042:0 0 8 >
ffff8801eff40540 669334289 S Co:1:042:0 s 21 09 0300 0000 0008 8 = 860a23bc 301c5d2a
ffff8801eff40540 669334391 C Co:1:042:0 0 8 >
ffff8802486999c0 669349364 S Co:1:042:0 s 21 09 0300 0000 0008 8 = 4e4ba9b1 65b31088
ffff8802486999c0 669349568 C Co:1:042:0 0 8 >
ffff8802486c6300 669366351 S Co:1:042:0 s 21 09 0300 0000 0008 8 = c02ee761 4ce6cc9c
ffff8802486c6300 669366513 C Co:1:042:0 0 8 >
ffff8802486c6300 669381312 S Co:1:042:0 s 21 09 0300 0000 0008 8 = b819e5ae cd2c55cb
ffff8802486c6300 669381519 C Co:1:042:0 0 8 >
ffff8802486999c0 669396377 S Co:1:042:0 s 21 09 0300 0000 0008 8 = 0bf3ffdb 853f7f9c
ffff8802486999c0 669396523 C Co:1:042:0 0 8 >
ffff8802486999c0 669411395 S Co:1:042:0 s 21 09 0300 0000 0008 8 = ffa96513 459fb439
ffff8802486999c0 669411521 C Co:1:042:0 0 8 >
ffff8802486999c0 669428315 S Co:1:042:0 s 21 09 0300 0000 0008 8 = ceac9ae4 920c72f3
ffff8802486999c0 669428526 C Co:1:042:0 0 8 >
ffff8802486999c0 669443304 S Co:1:042:0 s 21 09 0300 0000 0008 8 = 2870f8be 250ecbbc
ffff8802486999c0 669443517 C Co:1:042:0 0 8 >
ffff8801eff40840 669458453 S Co:1:042:0 s 21 09 0300 0000 0008 8 = b0ec2976 6a6ee5ad
ffff8801eff40840 669458647 C Co:1:042:0 0 8 >
ffff8801eff40840 669475301 S Co:1:042:0 s 21 09 0300 0000 0008 8 = 7d1eadc7 02bc7a80
ffff8801eff40840 669475518 C Co:1:042:0 0 8 >
ffff8803d54a63c0 669490340 S Co:1:042:0 s 21 09 0300 0000 0008 8 = 998758ce 43ca5815
ffff8803d54a63c0 669490521 C Co:1:042:0 0 8 >
ffff8803d54a63c0 669505364 S Co:1:042:0 s 21 09 0300 0000 0008 8 = 83a9d38c b52de0ef
ffff8803d54a63c0 669505522 C Co:1:042:0 0 8 >
ffff8803d54a63c0 669522419 S Co:1:042:0 s 21 09 0300 0000 0008 8 = ae8e1866 96c189b5
ffff8803d54a63c0 669522523 C Co:1:042:0 0 8 >
ffff8803d54a63c0 669537281 S Co:1:042:0 s 21 09 0300 0000 0008 8 = 0242f8a6 55235cb4
ffff8803d54a63c0 669537394 C Co:1:042:0 0 8 >
ffff8803d54a63c0 669552359 S Co:1:042:0 s 21 09 0300 0000 0008 8 = 585697f9 18377759
ffff8803d54a63c0 669552498 C Co:1:042:0 0 8 >
ffff8803d54a63c0 669569407 S Co:1:042:0 s 21 09 0300 0000 0008 8 = 005dedf0 38a28cba
ffff8803d54a63c0 669569576 C Co:1:042:0 0 8 >
ffff8803d54a63c0 669584306 S Co:1:042:0 s 21 09 0300 0000 0008 8 = 3d704581 c14f610c
ffff8803d54a63c0 669584518 C Co:1:042:0 0 8 >
ffff8803d54a63c0 669599289 S Co:1:042:0 s 21 09 0300 0000 0008 8 = c5acc086 f5ec502c
ffff8803d54a63c0 669599389 C Co:1:042:0 0 8 >
ffff8803d54a63c0 669616398 S Co:1:042:0 s 21 09 0300 0000 0008 8 = 43b1d13b c86cc719
ffff8803d54a63c0 669616523 C Co:1:042:0 0 8 >
ffff8803d54a63c0 669631335 S Co:1:042:0 s 21 09 0300 0000 0008 8 = d723bfc2 6384c776
ffff8803d54a63c0 669631502 C Co:1:042:0 0 8 >
ffff8803d54a63c0 669646293 S Co:1:042:0 s 21 09 0300 0000 0008 8 = 932b28a1 a330670b
ffff8803d54a63c0 669646402 C Co:1:042:0 0 8 >
ffff8803d54a63c0 669661365 S Co:1:042:0 s 21 09 0300 0000 0008 8 = fef57b40 9a2e5042
ffff8803d54a63c0 669661540 C Co:1:042:0 0 8 >
ffff8803d54a63c0 669676415 S Co:1:042:0 s 21 09 0300 0000 0008 8 = 93317c6e 0b8040ac
ffff8803d54a63c0 669676523 C Co:1:042:0 0 8 >
ffff8803d54a63c0 669693322 S Co:1:042:0 s 21 09 0300 0000 0008 8 = 4194c2db f0ec897b
ffff8803d54a63c0 669693523 C Co:1:042:0 0 8 >
ffff8803d54a63c0 669708364 S Co:1:042:0 s 21 09 0300 0000 0008 8 = ea57399d f57e9108
ffff8803d54a63c0 669708524 C Co:1:042:0 0 8 >
ffff8803d54a63c0 669723430 S Co:1:042:0 s 21 09 0300 0000 0008 8 = e6b4a2ad fc02524d
ffff8803d54a63c0 669723639 C Co:1:042:0 0 8 >
ffff8803d54a63c0 669740262 S Co:1:042:0 s 21 09 0300 0000 0008 8 = 7f6e1068 998cd96a
ffff8803d54a63c0 669740374 C Co:1:042:0 0 8 >
ffff8803d54a63c0 669755355 S Co:1:042:0 s 21 09 0300 0000 0008 8 = 75486c11 96f2c922
ffff8803d54a63c0 669755510 C Co:1:042:0 0 8 >
ffff8803d54a63c0 669770345 S Co:1:042:0 s 21 09 0300 0000 0008 8 = 798bf04c 6e4ed85c
ffff8803d54a63c0 669770506 C Co:1:042:0 0 8 >
ffff8803d54a63c0 669787237 S Co:1:042:0 s 21 09 0300 0000 0008 8 = b482ada3 d47f4ea5
ffff8803d54a63c0 669787374 C Co:1:042:0 0 8 >
ffff8803d54a63c0 669802286 S Co:1:042:0 s 21 09 0300 0000 0008 8 = 40ff0703 2ba88bab
ffff8803d54a63c0 669802375 C Co:1:042:0 0 8 >
ffff8803d54a63c0 669817365 S Co:1:042:0 s 21 09 0300 0000 0008 8 = abd6353e 0dad80c1
ffff8803d54a63c0 669817579 C Co:1:042:0 0 8 >
ffff8803d54a63c0 669834363 S Co:1:042:0 s 21 09 0300 0000 0008 8 = 795fc488 c7bb3360
ffff8803d54a63c0 669834517 C Co:1:042:0 0 8 >
ffff8803d54a63c0 669849336 S Co:1:042:0 s 21 09 0300 0000 0008 8 = a0f714fc d9be3ea2
ffff8803d54a63c0 669849523 C Co:1:042:0 0 8 >
ffff8803d54a63c0 669864379 S Co:1:042:0 s 21 09 0300 0000 0008 8 = 0c7dd716 78eb4ec7
ffff8803d54a63c0 669864569 C Co:1:042:0 0 8 >
ffff8803d54a63c0 669881410 S Co:1:042:0 s 21 09 0300 0000 0008 8 = 1bd79738 0e36a6b2
ffff8803d54a63c0 669881529 C Co:1:042:0 0 8 >
ffff8803d54a63c0 669896354 S Co:1:042:0 s 21 09 0300 0000 0008 8 = 216c2f28 b7db9c6a
ffff8803d54a63c0 669896505 C Co:1:042:0 0 8 >
ffff8803d54a63c0 669911341 S Co:1:042:0 s 21 09 0300 0000 0008 8 = e3aa4e8e c3d7189c
ffff8803d54a63c0 669911505 C Co:1:042:0 0 8 >
ffff8803d54a63c0 669926359 S Co:1:042:0 s 21 09 0300 0000 0008 8 = 1d80fa79 396d1a16
ffff8803d54a63c0 669926500 C Co:1:042:0 0 8 >
ffff8803d54a63c0 669943309 S Co:1:042:0 s 21 09 0300 0000 0008 8 = fee209d9 50a4334b
ffff8803d54a63c0 669943558 C Co:1:042:0 0 8 >
ffff8803d54a63c0 669958335 S Co:1:042:0 s 21 09 0300 0000 0008 8 = a94aa704 f6c609d4
ffff8803d54a63c0 669958525 C Co:1:042:0 0 8 >
ffff8803d54a63c0 669973676 S Co:1:042:0 s 21 09 0300 0000 0008 8 = b433d533 4be1d6eb
ffff8803d54a63c0 669973905 C Co:1:042:0 0 8 >
ffff8803d54a6d80 669990956 S Co:1:042:0 s 21 09 0300 0000 0008 8 = ab9ee604 2548e7f0
ffff8803d54a6d80 669991130 C Co:1:042:0 0 8 >
ffff8803d54a6d80 670005854 S Co:1:042:0 s 21 09 0300 0000 0008 8 = 8b9002f8 8b101fe6
ffff8803d54a6d80 670005967 C Co:1:042:0 0 8 >
ffff8802486c6300 670020894 S Co:1:042:0 s 21 09 0300 0000 0008 8 = 4990a5f4 3c9573f4
ffff8802486c6300 670021023 C Co:1:042:0 0 8 >
ffff8803a00d6e40 670036003 S Co:1:042:0 s 21 09 0300 0000 0008 8 = 4b2b1fc2 28f56ee7
ffff8803a00d6e40 670036143 C Co:1:042:0 0 8 >
ffff8803a00d6e40 670051826 S Co:1:042:0 s 21 09 0300 0000 0008 8 = ec72148f f491adad
ffff8803a00d6e40 670052006 C Co:1:042:0 0 8 >
ffff8803a00d6e40 670067867 S Co:1:042:0 s 21 09 0300 0000 0008 8 = fb78fb6c 789261da
ffff8803a00d6e40 670068081 C Co:1:042:0 0 8 >
ffff8803a00d6e40 670083090 S Co:1:042:0 s 21 09 0300 0000 0008 8 = 3ad7a1d0 4260d224
ffff8803a00d6e40 670083263 C Co:1:042:0 0 8 >
ffff8803a00d63c0 670098820 S Co:1:042:0 s 21 09 0300 0000 0008 8 = e12aa512 122ad9e8
ffff8803a00d63c0 670099004 C Co:1:042:0 0 8 >
ffff8803a00d63c0 670115866 S Co:1:042:0 s 21 09 0300 0000 0008 8 = 1a92fbf2 5e6363a5
ffff8803a00d63c0 670116017 C Co:1:042:0 0 8 >
ffff8803a00d63c0 670130905 S Co:1:042:0 s 21 09 0300 0000 0008 8 = 85336c0f ce40f37e
ffff8803a00d63c0 670131007 C Co:1:042:0 0 8 >
ffff8803a00d63c0 670145938 S Co:1:042:0 s 21 09 0300 0000 0008 8 = b3b61270 bf3e1ebb
ffff8803a00d63c0 670146152 C Co:1:042:0 0 8 >
ffff8802486999c0 670162839 S Co:1:042:0 s 21 09 0300 0000 0008 8 = adc7dffd c2990e47
ffff8802486999c0 670163005 C Co:1:042:0 0 8 >
ffff8802486999c0 670177877 S Co:1:042:0 s 21 09 0300 0000 0008 8 = 6c971505 1cd40230
ffff8802486999c0 670178081 C Co:1:042:0 0 8 >
ffff8802486999c0 670192922 S Co:1:042:0 s 21 09 0300 0000 0008 8 = 6159ccb8 4535cb2c
ffff8802486999c0 670193010 C Co:1:042:0 0 8 >
ffff8802486999c0 670209785 S Co:1:042:0 s 21 09 0300 0000 0008 8 = edc672ac 6b474e11
ffff8802486999c0 670209903 C Co:1:042:0 0 8 >
ffff8802486999c0 670224835 S Co:1:042:0 s 21 09 0300 0000 0008 8 = e79b445a ef59075a
ffff8802486999c0 670225027 C Co:1:042:0 0 8 >
ffff8802486999c0 670239906 S Co:1:042:0 s 21 09 0300 0000 0008 8 = 1b18d8a0 e5fc82a7
ffff8802486999c0 670240028 C Co:1:042:0 0 8 >
ffff8802486999c0 670256829 S Co:1:042:0 s 21 09 0300 0000 0008 8 = c781953f 9687e23b
ffff8802486999c0 670257034 C Co:1:042:0 0 8 >
ffff8802486999c0 670271874 S Co:1:042:0 s 21 09 0300 0000 0008 8 = 1e9f375c ff955c7e
ffff8802486999c0 670272027 C Co:1:042:0 0 8 >
ffff8802486999c0 670286872 S Co:1:042:0 s 21 09 0300 0000 0008 8 = c83e4e01 5183ba7a
ffff8802486999c0 670287025 C Co:1:042:0 0 8 >
ffff8802486c6a80 670302286 S Co:1:042:0 s 21 09 0300 0000 0008 8 = 5eaebd9b 71f4db60
ffff8802486c6a80 670302380 C Co:1:042:0 0 8 >
ffff8802486999c0 670318801 S Co:1:042:0 s 21 09 0300 0000 0008 8 = f0443d7c 784f2f03
ffff8802486999c0 670319031 C Co:1:042:0 0 8 >
ffff8802486c6a80 670333835 S Co:1:042:0 s 21 09 0300 0000 0008 8 = 80d8da58 323d3e5a
ffff8802486c6a80 670334022 C Co:1:042:0 0 8 >
ffff8802486999c0 670348872 S Co:1:042:0 s 21 09 0300 0000 0008 8 = 864673ca a12e2000
ffff8802486999c0 670349024 C Co:1:042:0 0 8 >
ffff8801eff40480 670365792 S Co:1:042:0 s 21 09 0300 0000 0008 8 = 6df03ccf 79d404b5
ffff8801eff40480 670365898 C Co:1:042:0 0 8 >
ffff8801eff40480 670380826 S Co:1:042:0 s 21 09 0300 0000 0008 8 = 13393d47 a3a4acdc
ffff8801eff40480 670381026 C Co:1:042:0 0 8 >
ffff8801eff40480 670395986 S Co:1:042:0 s 21 09 0300 0000 0008 8 = 4b09d379 bc5aedfd
ffff8801eff40480 670396160 C Co:1:042:0 0 8 >
ffff8801eff40480 670412782 S Co:1:042:0 s 21 09 0300 0000 0008 8 = 5c4e2c8d 96733142
ffff8801eff40480 670412901 C Co:1:042:0 0 8 >
ffff8804039de3c0 670427825 S Co:1:042:0 s 21 09 0300 0000 0008 8 = 8077cd12 b4b3f7fc
ffff8804039de3c0 670428027 C Co:1:042:0 0 8 >
ffff8804039de3c0 670442849 S Co:1:042:0 s 21 09 0300 0000 0008 8 = 68f90d78 d09f4f1e
ffff8804039de3c0 670443006 C Co:1:042:0 0 8 >
ffff8804039de3c0 670457887 S Co:1:042:0 s 21 09 0300 0000 0008 8 = b5cc9995 560261bf
ffff8804039de3c0 670458035 C Co:1:042:0 0 8 >
ffff8804039de3c0 670474802 S Co:1:042:0 s 21 09 0300 0000 0008 8 = 7fecf122 e86ae59a
ffff8804039de3c0 670474900 C Co:1:042:0 0 8 >
ffff8802486c6a80 670489836 S Co:1:042:0 s 21 09 0300 0000 0008 8 = d0dae73d daaaaa8f
ffff8802486c6a80 670490025 C Co:1:042:0 0 8 >
ffff8801eff40480 670504871 S Co:1:042:0 s 21 09 0300 0000 0008 8 = 281b25e7 b6571221
ffff8801eff40480 670505025 C Co:1:042:0 0 8 >
ffff8801eff40480 670521787 S Co:1:042:0 s 21 09 0300 0000 0008 8 = f8b6a686 b74d91f8
ffff8801eff40480 670521901 C Co:1:042:0 0 8 >
ffff8801eff40480 670536821 S Co:1:042:0 s 21 09 0300 0000 0008 8 = 29b93962 4f2a345f
ffff8801eff40480 670537026 C Co:1:042:0 0 8 >
ffff8801eff40480 670551856 S Co:1:042:0 s 21 09 0300 0000 0008 8 = 94b20429 a4d016c5
ffff8801eff40480 670552022 C Co:1:042:0 0 8 >
ffff8801eff40480 670568779 S Co:1:042:0 s 21 09 0300 0000 0008 8 = 8a38fd6c 0de5ea3d
ffff8801eff40480 670568902 C Co:1:042:0 0 8 >
ffff8801eff40480 670583833 S Co:1:042:0 s 21 09 0300 0000 0008 8 = 4b627022 97547700
ffff8801eff40480 670584025 C Co:1:042:0 0 8 >
ffff8801eff40480 670598845 S Co:1:042:0 s 21 09 0300 0000 0008 8 = 914c7e23 84cc15e8
ffff8801eff40480 670599006 C Co:1:042:0 0 8 >
ffff8801eff40480 670613979 S Co:1:042:0 s 21 09 0300 0000 0008 8 = 05979aac c93e33f5
ffff8801eff40480 670614150 C Co:1:042:0 0 8 >
ffff8804039de3c0 670630801 S Co:1:042:0 s 21 09 0300 0000 0008 8 = c6e70ce0 8d61d2cb
ffff8804039de3c0 670631028 C Co:1:042:0 0 8 >
ffff8802486c6a80 670645852 S Co:1:042:0 s 21 09 0300 0000 0008 8 = e7667043 af2f092f
ffff8802486c6a80 670646025 C Co:1:042:0 0 8 >
ffff8802486c6a80 670660868 S Co:1:042:0 s 21 09 0300 0000 0008 8 = ef3e363e 3e67818f
ffff8802486c6a80 670661006 C Co:1:042:0 0 8 >
ffff8802486c6a80 670677814 S Co:1:042:0 s 21 09 0300 0000 0008 8 = 592022a0 010bf979
ffff8802486c6a80 670678034 C Co:1:042:0 0 8 >
ffff8802486c6a80 670692836 S Co:1:042:0 s 21 09 0300 0000 0008 8 = 14c1cb19 efe2c121
ffff8802486c6a80 670693007 C Co:1:042:0 0 8 >
ffff8802486c6a80 670707959 S Co:1:042:0 s 21 09 0300 0000 0008 8 = 035a1ebf b6f540de
ffff8802486c6a80 670708215 C Co:1:042:0 0 8 >
ffff8802486c6a80 670724830 S Co:1:042:0 s 21 09 0300 0000 0008 8 = 7c26da8c 361470ab
ffff8802486c6a80 670725031 C Co:1:042:0 0 8 >
ffff8802486c6a80 670739813 S Co:1:042:0 s 21 09 0300 0000 0008 8 = cae614dc 04505fa8
ffff8802486c6a80 670740029 C Co:1:042:0 0 8 >
ffff8801eff40480 670754907 S Co:1:042:0 s 21 09 0300 0000 0008 8 = ad5eb2f1 ea80ae98
ffff8801eff40480 670755066 C Co:1:042:0 0 8 >
ffff8801eff40480 670771810 S Co:1:042:0 s 21 09 0300 0000 0008 8 = d7d7f270 64bf1463
ffff8801eff40480 670772034 C Co:1:042:0 0 8 >
ffff8804039de3c0 670786854 S Co:1:042:0 s 21 09 0300 0000 0008 8 = 6f9de2e3 23eada94
ffff8804039de3c0 670787012 C Co:1:042:0 0 8 >
ffff8804039de3c0 670801884 S Co:1:042:0 s 21 09 0300 0000 0008 8 = 9080e737 8b255eda
ffff8804039de3c0 670802030 C Co:1:042:0 0 8 >
ffff8804039de3c0 670818929 S Co:1:042:0 s 21 09 0300 0000 0008 8 = c855393e 36549389
ffff8804039de3c0 670819034 C Co:1:042:0 0 8 >
ffff8804039de3c0 670833784 S Co:1:042:0 s 21 09 0300 0000 0008 8 = 9c74632d 71a47d17
ffff8804039de3c0 670833884 C Co:1:042:0 0 8 >
ffff8802486c6a80 670848878 S Co:1:042:0 s 21 09 0300 0000 0008 8 = 003ac61d bd02b7a2
ffff8802486c6a80 670849039 C Co:1:042:0 0 8 >
ffff8802486c6a80 670865933 S Co:1:042:0 s 21 09 0300 0000 0008 8 = e287158b 4da1ee67
ffff8802486c6a80 670866040 C Co:1:042:0 0 8 >
ffff8802486999c0 670880772 S Co:1:042:0 s 21 09 0300 0000 0008 8 = 9e3fd8da 8c76664a
ffff8802486999c0 670880901 C Co:1:042:0 0 8 >
ffff8804039de3c0 670895868 S Co:1:042:0 s 21 09 0300 0000 0008 8 = 88cbebce 96bd7253
ffff8804039de3c0 670896051 C Co:1:042:0 0 8 >
ffff8801eff40480 670912917 S Co:1:042:0 s 21 09 0300 0000 0008 8 = 6896fd10 bc74fe2d
ffff8801eff40480 670913032 C Co:1:042:0 0 8 >
ffff8801eff40480 670927821 S Co:1:042:0 s 21 09 0300 0000 0008 8 = f79214af 03dc07a7
ffff8801eff40480 670928013 C Co:1:042:0 0 8 >
ffff8802486999c0 670942855 S Co:1:042:0 s 21 09 0300 0000 0008 8 = 66b3069b a3fd1f35
ffff8802486999c0 670943036 C Co:1:042:0 0 8 >
ffff8802486999c0 670959920 S Co:1:042:0 s 21 09 0300 0000 0008 8 = d671002a 8a21ed6e
ffff8802486999c0 670960045 C Co:1:042:0 0 8 >
ffff8802486999c0 670974968 S Co:1:042:0 s 21 09 0300 0000 0008 8 = de490196 d957a88d
ffff8802486999c0 670975161 C Co:1:042:0 0 8 >
ffff8802486999c0 670989793 S Co:1:042:0 s 21 09 0300 0000 0008 8 = 0a3a5d7b 64efa1f2
ffff8802486999c0 670989896 C Co:1:042:0 0 8 >
ffff8804039deb40 671006901 S Co:1:042:0 s 21 09 0300 0000 0008 8 = 584a3c5b 3402b8a0
ffff8804039deb40 671007078 C Co:1:042:0 0 8 >
ffff8804039deb40 671021875 S Co:1:042:0 s 21 09 0300 0000 0008 8 = bb011b1b 06e9e4bf
ffff8804039deb40 671022009 C Co:1:042:0 0 8 >
ffff8804039deb40 671036837 S Co:1:042:0 s 21 09 0300 0000 0008 8 = 9aea4886 cbc3ad1a
ffff8804039deb40 671037024 C Co:1:042:0 0 8 >
ffff8803a00d63c0 671051936 S Co:1:042:0 s 21 09 0300 0000 0008 8 = 501768c7 28f2b4a0
ffff8803a00d63c0 671052139 C Co:1:042:0 0 8 >
ffff8801eff40840 671068927 S Co:1:042:0 s 21 09 0300 0000 0008 8 = ac9cf2f1 f59d28e5
ffff8801eff40840 671069045 C Co:1:042:0 0 8 >
ffff8801eff40d80 671083364 S Co:1:042:0 s 21 09 0300 0000 0008 8 = 7110b378 c02d50a0
ffff8801eff40d80 671083538 C Co:1:042:0 0 8 >
ffff8801eff40d80 671100208 S Co:1:042:0 s 21 09 0300 0000 0008 8 = d5124bb7 4ad2052c
ffff8801eff40d80 671100409 C Co:1:042:0 0 8 >
ffff8801eff40d80 671115243 S Co:1:042:0 s 21 09 0300 0000 0008 8 = 03c0ad6b 07fd3709
ffff8801eff40d80 671115388 C Co:1:042:0 0 8 >
ffff8801eff40d80 671130146 S Co:1:042:0 s 21 09 0300 0000 0008 8 = 9b3fa034 a0e5665b
ffff8801eff40d80 671130260 C Co:1:042:0 0 8 >
ffff8802486996c0 671146167 S Co:1:042:0 s 21 09 0300 0000 0008 8 = 2f394219 72042868
ffff8802486996c0 671146273 C Co:1:042:0 0 8 >
ffff8802486996c0 671162156 S Co:1:042:0 s 21 09 0300 0000 0008 8 = c6588203 0f99a81c
ffff8802486996c0 671162260 C Co:1:042:0 0 8 >
ffff8804039de240 671177247 S Co:1:042:0 s 21 09 0300 0000 0008 8 = 5bcea33f ba272386
ffff8804039de240 671177457 C Co:1:042:0 0 8 >
ffff8804039deb40 671193153 S Co:1:042:0 s 21 09 0300 0000 0008 8 = 5ccebefe edf26b5a
ffff8804039deb40 671193291 C Co:1:042:0 0 8 >
ffff8802486c60c0 671208180 S Co:1:042:0 s 21 09 0300 0000 0008 8 = 2d123ed7 d487666f
ffff8802486c60c0 671208416 C Co:1:042:0 0 8 >
ffff8802486996c0 671225303 S Co:1:042:0 s 21 09 0300 0000 0008 8 = a5556441 d1338e40
ffff8802486996c0 671225395 C Co:1:042:0 0 8 >
ffff8803d54a6d80 671240091 S Co:1:042:0 s 21 09 0300 0000 0008 8 = 8ed8c31b f888706d
ffff8803d54a6d80 671240263 C Co:1:042:0 0 8 >
ffff8803d54a6d80 671255121 S Co:1:042:0 s 21 09 0300 0000 0008 8 = 27dfc326 92dd2f39
ffff8803d54a6d80 671255262 C Co:1:042:0 0 8 >
ffff8803d54a6d80 671272233 S Co:1:042:0 s 21 09 0300 0000 0008 8 = a4332188 9dcd000c
ffff8803d54a6d80 671272396 C Co:1:042:0 0 8 >
ffff8803d54a6d80 671287137 S Co:1:042:0 s 21 09 0300 0000 0008 8 = aba06b49 48b5aef1
ffff8803d54a6d80 671287270 C Co:1:042:0 0 8 >
ffff8803d54a6d80 671302112 S Co:1:042:0 s 21 09 0300 0000 0008 8 = d67785d7 79391618
ffff8803d54a6d80 671302263 C Co:1:042:0 0 8 >
ffff8803d54a6d80 671319222 S Co:1:042:0 s 21 09 0300 0000 0008 8 = 350b2984 49beaa52
ffff8803d54a6d80 671319412 C Co:1:042:0 0 8 >
ffff8803d54a6d80 671334257 S Co:1:042:0 s 21 09 0300 0000 0008 8 = cb356105 85efef99
ffff8803d54a6d80 671334390 C Co:1:042:0 0 8 >
ffff8803d54a6d80 671349161 S Co:1:042:0 s 21 09 0300 0000 0008 8 = 0ed20df3 2c3a0188
ffff8803d54a6d80 671349288 C Co:1:042:0 0 8 >
ffff8803d54a6d80 671366220 S Co:1:042:0 s 21 09 0300 0000 0008 8 = 6a42614c f6520cdd
ffff8803d54a6d80 671366397 C Co:1:042:0 0 8 >
ffff8803d54a6d80 671381216 S Co:1:042:0 s 21 09 0300 0000 0008 8 = bde966f0 c9acd3fc
ffff8803d54a6d80 671381391 C Co:1:042:0 0 8 >
ffff8803d54a6d80 671396122 S Co:1:042:0 s 21 09 0300 0000 0008 8 = dab07626 44042b6d
ffff8803d54a6d80 671396283 C Co:1:042:0 0 8 >
ffff8803d54a6d80 671411186 S Co:1:042:0 s 21 09 0300 0000 0008 8 = 0983c317 36d87f5b
ffff8803d54a6d80 671411291 C Co:1:042:0 0 8 >
ffff8803d54a6d80 671428236 S Co:1:042:0 s 21 09 0300 0000 0008 8 = 83d2cf50 26ea4c16
ffff8803d54a6d80 671428392 C Co:1:042:0 0 8 >
ffff8804039deb40 671443081 S Co:1:042:0 s 21 09 0300 0000 0008 8 = f712f342 cbc0a48f
ffff8804039deb40 671443283 C Co:1:042:0 0 8 >
ffff8802486c60c0 671458162 S Co:1:042:0 s 21 09 0300 0000 0008 8 = 0a3bdac4 9225ace0
ffff8802486c60c0 671458264 C Co:1:042:0 0 8 >
ffff8802486c60c0 671475207 S Co:1:042:0 s 21 09 0300 0000 0008 8 = d14a058d 1ea820c4
ffff8802486c60c0 671475400 C Co:1:042:0 0 8 >
ffff8802486996c0 671490188 S Co:1:042:0 s 21 09 0300 0000 0008 8 = 57be47bc c119cc19
ffff8802486996c0 671490297 C Co:1:042:0 0 8 >
ffff8802486996c0 671505468 S Co:1:042:0 s 21 09 0300 0000 0008 8 = 1c1d4853 06111364
ffff8802486996c0 671505675 C Co:1:042:0 0 8 >
ffff8802486996c0 671522213 S Co:1:042:0 s 21 09 0300 0000 0008 8 = 926f04b5 286a6a4b
ffff8802486996c0 671522398 C Co:1:042:0 0 8 >
ffff8802486c60c0 671537259 S Co:1:042:0 s 21 09 0300 0000 0008 8 = a0bf4a2d 9ac1db1a
ffff8802486c60c0 671537394 C Co:1:042:0 0 8 >
ffff8802486c60c0 671552150 S Co:1:042:0 s 21 09 0300 0000 0008 8 = 219f4069 80f98540
ffff8802486c60c0 671552304 C Co:1:042:0 0 8 >
ffff8802486c60c0 671569182 S Co:1:042:0 s 21 09 0300 0000 0008 8 = 63a3dcf9 32b819d1
ffff8802486c60c0 671569309 C Co:1:042:0 0 8 >
ffff8802486c6a80 671584246 S Co:1:042:0 s 21 09 0300 0000 0008 8 = aae36bd3 beea5c04
ffff8802486c6a80 671584389 C Co:1:042:0 0 8 >
ffff8802486c6a80 671599137 S Co:1:042:0 s 21 09 0300 0000 0008 8 = ad7b0cd0 643baab4
ffff8802486c6a80 671599266 C Co:1:042:0 0 8 >
ffff8801eff40d80 671614154 S Co:1:042:0 s 21 09 0300 0000 0008 8 = 160d332d 19a06fe2
ffff8801eff40d80 671614283 C Co:1:042:0 0 8 >
ffff8802486996c0 671631198 S Co:1:042:0 s 21 09 0300 0000 0008 8 = 043c290d 07cdad2f
ffff8802486996c0 671631405 C Co:1:042:0 0 8 >
ffff8802486c6300 671646267 S Co:1:042:0 s 21 09 0300 0000 0008 8 = 8b3088f4 0abd7c64
ffff8802486c6300 671646421 C Co:1:042:0 0 8 >
ffff8804039deb40 671661157 S Co:1:042:0 s 21 09 0300 0000 0008 8 = 3016c14c 333083ec
ffff8804039deb40 671661269 C Co:1:042:0 0 8 >
ffff8802486c6300 671678158 S Co:1:042:0 s 21 09 0300 0000 0008 8 = 709f98e2 47268156
ffff8802486c6300 671678273 C Co:1:042:0 0 8 >
ffff880248699cc0 671693267 S Co:1:042:0 s 21 09 0300 0000 0008 8 = 387fa568 3e67c9d6
ffff880248699cc0 671693399 C Co:1:042:0 0 8 >
ffff8801eff40d80 671708153 S Co:1:042:0 s 21 09 0300 0000 0008 8 = 6cedd3f2 c6fdc0c3
ffff8801eff40d80 671708267 C Co:1:042:0 0 8 >
ffff8802486993c0 671725150 S Co:1:042:0 s 21 09 0300 0000 0008 8 = 6228e27b bfb55f19
ffff8802486993c0 671725269 C Co:1:042:0 0 8 >
ffff8802486993c0 671740188 S Co:1:042:0 s 21 09 0300 0000 0008 8 = 66eee75f bfa4b5f6
ffff8802486993c0 671740267 C Co:1:042:0 0 8 >
ffff8804039deb40 671755181 S Co:1:042:0 s 21 09 0300 0000 0008 8 = 3604c9e0 8e9e631f
ffff8804039deb40 671755291 C Co:1:042:0 0 8 >
ffff8802486c6300 671772192 S Co:1:042:0 s 21 09 0300 0000 0008 8 = 85b3c4a4 a9bf207a
ffff8802486c6300 671772339 C Co:1:042:0 0 8 >
ffff8801eff40d80 671787213 S Co:1:042:0 s 21 09 0300 0000 0008 8 = 7a47e733 c1e53693
ffff8801eff40d80 671787393 C Co:1:042:0 0 8 >
ffff8802486993c0 671802260 S Co:1:042:0 s 21 09 0300 0000 0008 8 = 3091987b 3b310119
ffff8802486993c0 671802424 C Co:1:042:0 0 8 >
ffff8802486993c0 671819128 S Co:1:042:0 s 21 09 0300 0000 0008 8 = 36640d4e b08c7560
ffff8802486993c0 671819266 C Co:1:042:0 0 8 >
ffff8801eff40d80 671834235 S Co:1:042:0 s 21 09 0300 0000 0008 8 = 0e1ad2e1 6c1e96df
ffff8801eff40d80 671834404 C Co:1:042:0 0 8 >
ffff8804039deb40 671849197 S Co:1:042:0 s 21 09 0300 0000 0008 8 = b00e484d f0d6ffb2
ffff8804039deb40 671849394 C Co:1:042:0 0 8 >
ffff8801eff40d80 671864137 S Co:1:042:0 s 21 09 0300 0000 0008 8 = 07212210 72e75e17
ffff8801eff40d80 671864266 C Co:1:042:0 0 8 >
ffff8802486993c0 671881147 S Co:1:042:0 s 21 09 0300 0000 0008 8 = 7037e88b 5a46f5f3
ffff8802486993c0 671881267 C Co:1:042:0 0 8 >
ffff8804039deb40 671896252 S Co:1:042:0 s 21 09 0300 0000 0008 8 = 40b97683 c62f194c
ffff8804039deb40 671896397 C Co:1:042:0 0 8 >
ffff8804039deb40 671913150 S Co:1:042:0 s 21 09 0300 0000 0008 8 = 3d137ca2 05a0b4ce
ffff8804039deb40 671913319 C Co:1:042:0 0 8 >
ffff8804039deb40 671926272 S Co:1:042:0 s 21 09 0300 0000 0008 8 = 2235fef5 1ddbc448
ffff8804039deb40 671926439 C Co:1:042:0 0 8 >
ffff8802486c6300 671943268 S Co:1:042:0 s 21 09 0300 0000 0008 8 = 1d14d46e 46e7dc2e
ffff8802486c6300 671943401 C Co:1:042:0 0 8 >
ffff8802486c6300 671958219 S Co:1:042:0 s 21 09 0300 0000 0008 8 = 52292961 6f0da017
ffff8802486c6300 671958413 C Co:1:042:0 0 8 >
ffff880248699840 671973123 S Co:1:042:0 s 21 09 0300 0000 0008 8 = 58eefd09 b65c4b3f
ffff880248699840 671973273 C Co:1:042:0 0 8 >
ffff8804039deb40 672018263 S Co:1:042:0 s 21 09 0300 0000 0008 8 = 5503706d 153c8601
ffff8804039deb40 672018419 C Co:1:042:0 0 8 >
ffff8804039deb40 672037196 S Ci:1:042:0 s a1 01 0300 0000 0008 8 <
ffff8804039deb40 672037409 C Ci:1:042:0 0 8 = aa040000 00000000
ffff8803ed332000 686599632 S Co:1:042:0 s 21 09 0300 0000 0008 8 = 55010100 00ff075d
ffff8803ed332000 686599803 C Co:1:042:0 0 8 >
ffff8803ed332000 686630672 S Ci:1:042:0 s a1 01 0300 0000 0008 8 <
ffff8803ed332000 686630772 C Ci:1:042:0 0 8 = aa020000 00000000
ffff8803ed332000 686661589 S Co:1:042:0 s 21 09 0300 0000 0008 8 = 0b010101 00000e04
ffff8803ed332000 686661773 C Co:1:042:0 0 8 >
ffff8803ed332000 686676618 S Co:1:042:0 s 21 09 0300 0000 0008 8 = d239666e 526341e7
ffff8803ed332000 686676771 C Co:1:042:0 0 8 >
ffff8803ed332000 686693738 S Co:1:042:0 s 21 09 0300 0000 0008 8 = 01809700 15ff27ff
ffff8803ed332000 686693919 C Co:1:042:0 0 8 >
ffff8803ed332000 686708615 S Co:1:042:0 s 21 09 0300 0000 0008 8 = 57ff47ff 27ffc7ff
ffff8803ed332000 686708799 C Co:1:042:0 0 8 >
ffff8803ed332000 686723637 S Co:1:042:0 s 21 09 0300 0000 0008 8 = 57ffe7ff b7ff07ff
ffff8803ed332000 686723796 C Co:1:042:0 0 8 >
ffff8803ed332000 686740711 S Co:1:042:0 s 21 09 0300 0000 0008 8 = 47fff7ff a7ff97ff
ffff8803ed332000 686740926 C Co:1:042:0 0 8 >
ffff8803ed332000 686755539 S Co:1:042:0 s 21 09 0300 0000 0008 8 = 07ff07ff 87ff97ff
ffff8803ed332000 686755676 C Co:1:042:0 0 8 >
ffff8803ed332000 686770574 S Co:1:042:0 s 21 09 0300 0000 0008 8 = b7ff07ff 77ff37ff
ffff8803ed332000 686770790 C Co:1:042:0 0 8 >
ffff8803ed332000 686787684 S Co:1:042:0 s 21 09 0300 0000 0008 8 = 77ffa7ff 77fff7ff
ffff8803ed332000 686787799 C Co:1:042:0 0 8 >
ffff8803ed332000 686802650 S Co:1:042:0 s 21 09 0300 0000 0008 8 = c7ffc7ff 27ffc7ff
ffff8803ed332000 686802770 C Co:1:042:0 0 8 >
ffff8803ed332000 686817553 S Co:1:042:0 s 21 09 0300 0000 0008 8 = 17ff97ff 77ff87ff
ffff8803ed332000 686817647 C Co:1:042:0 0 8 >
ffff8803ed332000 686834669 S Co:1:042:0 s 21 09 0300 0000 0008 8 = d7ff97ff c7ff27ff
ffff8803ed332000 686834797 C Co:1:042:0 0 8 >
ffff8803ed332000 686849708 S Co:1:042:0 s 21 09 0300 0000 0008 8 = e7ff37ff 67ff47ff
ffff8803ed332000 686849923 C Co:1:042:0 0 8 >
ffff8803ed332000 686864600 S Co:1:042:0 s 21 09 0300 0000 0008 8 = c7ff67ff 27ffe7ff
ffff8803ed332000 686864795 C Co:1:042:0 0 8 >
ffff8803ed332000 686879673 S Co:1:042:0 s 21 09 0300 0000 0008 8 = 87ff77ff 27ffa7ff
ffff8803ed332000 686879794 C Co:1:042:0 0 8 >
ffff8803ed332000 686896695 S Co:1:042:0 s 21 09 0300 0000 0008 8 = 97ff67ff d7ffa7ff
ffff8803ed332000 686896900 C Co:1:042:0 0 8 >
ffff8803ed332000 686911597 S Co:1:042:0 s 21 09 0300 0000 0008 8 = 27ff27ff 97ffb7ff
ffff8803ed332000 686911794 C Co:1:042:0 0 8 >
ffff8803ed332000 686926968 S Co:1:042:0 s 21 09 0300 0000 0008 8 = b7ff67ff 17ff67ff
ffff8803ed332000 686927155 C Co:1:042:0 0 8 >
ffff8803ed332000 686943636 S Co:1:042:0 s 21 09 0300 0000 0008 8 = 87ff67ff 57ffd7ff
ffff8803ed332000 686943794 C Co:1:042:0 0 8 >
ffff8802486c6600 686958581 S Co:1:042:0 s 21 09 0300 0000 0008 8 = d7ff47ff b7ff37ff
ffff8802486c6600 686958813 C Co:1:042:0 0 8 >
ffff8802486c6600 686973614 S Co:1:042:0 s 21 09 0300 0000 0008 8 = 07ff57ff 57ff27ff
ffff8802486c6600 686973805 C Co:1:042:0 0 8 >
ffff88028014f180 686990606 S Co:1:042:0 s 21 09 0300 0000 0008 8 = 27ffb7ff 87ffc7ff
ffff88028014f180 686990790 C Co:1:042:0 0 8 >
ffff8804039de0c0 687005701 S Co:1:042:0 s 21 09 0300 0000 0008 8 = 87ff57ff 07ff37ff
ffff8804039de0c0 687005901 C Co:1:042:0 0 8 >
ffff8804039de0c0 687020601 S Co:1:042:0 s 21 09 0300 0000 0008 8 = e7ff47ff b7ff97ff
ffff8804039de0c0 687020778 C Co:1:042:0 0 8 >
ffff8804039de0c0 687037713 S Co:1:042:0 s 21 09 0300 0000 0008 8 = 97ffe7ff 37ff07ff
ffff8804039de0c0 687037911 C Co:1:042:0 0 8 >
ffff8804039de240 687054538 S Co:1:042:0 s 21 09 0300 0000 0008 8 = f7ff77ff 77ffd7ff
ffff8804039de240 687054647 C Co:1:042:0 0 8 >
ffff8804039de240 687067626 S Co:1:042:0 s 21 09 0300 0000 0008 8 = 37ff97ff 67ff27ff
ffff8804039de240 687067772 C Co:1:042:0 0 8 >
ffff8802486c6600 687084488 S Co:1:042:0 s 21 09 0300 0000 0008 8 = 47ffb7ff 57ffa7ff
ffff8802486c6600 687084666 C Co:1:042:0 0 8 >
ffff8802486c6600 687099515 S Co:1:042:0 s 21 09 0300 0000 0008 8 = 27ff27ff 27ffb7ff
ffff8802486c6600 687099666 C Co:1:042:0 0 8 >
ffff880403840d80 687114473 S Co:1:042:0 s 21 09 0300 0000 0008 8 = 47ff37ff f7ffb7ff
ffff880403840d80 687114671 C Co:1:042:0 0 8 >
ffff8804039de6c0 687130519 S Co:1:042:0 s 21 09 0300 0000 0008 8 = 77ff87ff e7ff57ff
ffff8804039de6c0 687130661 C Co:1:042:0 0 8 >
ffff8802486c66c0 687148534 S Co:1:042:0 s 21 09 0300 0000 0008 8 = a7ff17ff 57ffa7ff
ffff8802486c66c0 687148665 C Co:1:042:0 0 8 >
ffff8802486c66c0 687163782 S Co:1:042:0 s 21 09 0300 0000 0008 8 = 37ffb7ff 27ff17ff
ffff8802486c66c0 687164024 C Co:1:042:0 0 8 >
ffff8802486c6c00 687177669 S Co:1:042:0 s 21 09 0300 0000 0008 8 = 87ff77ff 77ffa7ff
ffff8802486c6c00 687177773 C Co:1:042:0 0 8 >
ffff880403840d80 687192704 S Co:1:042:0 s 21 09 0300 0000 0008 8 = 97fff7ff 37971741
ffff880403840d80 687192909 C Co:1:042:0 0 8 >
ffff88028014fa80 687207785 S Co:1:042:0 s 21 09 0300 0000 0008 8 = bd00a773 9a153937
ffff88028014fa80 687208026 C Co:1:042:0 0 8 >
ffff88028014f300 687223692 S Co:1:042:0 s 21 09 0300 0000 0008 8 = 9855e2cd 6c1bce2e
ffff88028014f300 687223907 C Co:1:042:0 0 8 >
ffff8802486c6c00 687239683 S Co:1:042:0 s 21 09 0300 0000 0008 8 = da6a8279 13f950a1
ffff8802486c6c00 687239784 C Co:1:042:0 0 8 >
ffff8802486c6900 687254720 S Co:1:042:0 s 21 09 0300 0000 0008 8 = 4d7f1b55 a4414c30
ffff8802486c6900 687254921 C Co:1:042:0 0 8 >
ffff8802486c6900 687271645 S Co:1:042:0 s 21 09 0300 0000 0008 8 = 30d91522 6848e51f
ffff8802486c6900 687271794 C Co:1:042:0 0 8 >
ffff8802486c6c00 687288696 S Co:1:042:0 s 21 09 0300 0000 0008 8 = b73f2c06 5caa51d4
ffff8802486c6c00 687288915 C Co:1:042:0 0 8 >
ffff880403840180 687301709 S Co:1:042:0 s 21 09 0300 0000 0008 8 = 877ef009 b2c4585b
ffff880403840180 687301918 C Co:1:042:0 0 8 >
ffff880403840180 687318756 S Co:1:042:0 s 21 09 0300 0000 0008 8 = 3de6459a 4d3adae3
ffff880403840180 687318918 C Co:1:042:0 0 8 >
ffff88028014f300 687333668 S Co:1:042:0 s 21 09 0300 0000 0008 8 = e6cce208 47714840
ffff88028014f300 687333793 C Co:1:042:0 0 8 >
ffff88028014f300 687348724 S Co:1:042:0 s 21 09 0300 0000 0008 8 = 8609d40b 6c142869
ffff88028014f300 687348922 C Co:1:042:0 0 8 >
ffff88028014f300 687365790 S Co:1:042:0 s 21 09 0300 0000 0008 8 = 9378fa3b be9193f9
ffff88028014f300 687365925 C Co:1:042:0 0 8 >
ffff88028014f300 687380670 S Co:1:042:0 s 21 09 0300 0000 0008 8 = 797a8996 f29ab9b0
ffff88028014f300 687380796 C Co:1:042:0 0 8 >
ffff880403840180 687395744 S Co:1:042:0 s 21 09 0300 0000 0008 8 = 167387fd efa75af2
ffff880403840180 687395925 C Co:1:042:0 0 8 >
ffff880403840180 687410850 S Co:1:042:0 s 21 09 0300 0000 0008 8 = 3d4b52b5 54714c45
ffff880403840180 687411049 C Co:1:042:0 0 8 >
ffff88028014f300 687427690 S Co:1:042:0 s 21 09 0300 0000 0008 8 = 35f018e7 f077f9d5
ffff88028014f300 687427802 C Co:1:042:0 0 8 >
ffff88028014f300 687442772 S Co:1:042:0 s 21 09 0300 0000 0008 8 = 3ad15f22 4a7ae0f1
ffff88028014f300 687442944 C Co:1:042:0 0 8 >
ffff88028014f300 687458022 S Co:1:042:0 s 21 09 0300 0000 0008 8 = f8637cd7 1903128d
ffff88028014f300 687458190 C Co:1:042:0 0 8 >
ffff8802486c6c00 687474770 S Co:1:042:0 s 21 09 0300 0000 0008 8 = 159f1eda cadab5c0
ffff8802486c6c00 687474922 C Co:1:042:0 0 8 >
ffff8802486c6c00 687489728 S Co:1:042:0 s 21 09 0300 0000 0008 8 = a67fc2e5 008e8245
ffff8802486c6c00 687489929 C Co:1:042:0 0 8 >
ffff8802486c6c00 687504695 S Co:1:042:0 s 21 09 0300 0000 0008 8 = b6863e17 0df248fc
ffff8802486c6c00 687504799 C Co:1:042:0 0 8 >
ffff8802486c6c00 687521814 S Co:1:042:0 s 21 09 0300 0000 0008 8 = c537396f 7c9c6969
ffff8802486c6c00 687522068 C Co:1:042:0 0 8 >
ffff8802486c6c00 687536648 S Co:1:042:0 s 21 09 0300 0000 0008 8 = 459aaf53 88665a32
ffff8802486c6c00 687536805 C Co:1:042:0 0 8 >
ffff8802486c6c00 687551740 S Co:1:042:0 s 21 09 0300 0000 0008 8 = 1dbd700e a4ef26a3
ffff8802486c6c00 687551925 C Co:1:042:0 0 8 >
ffff880403840180 687568801 S Co:1:042:0 s 21 09 0300 0000 0008 8 = 272f9f4b f419e92b
ffff880403840180 687569067 C Co:1:042:0 0 8 >
ffff88028014f300 687583699 S Co:1:042:0 s 21 09 0300 0000 0008 8 = b485369d d08b57de
ffff88028014f300 687583786 C Co:1:042:0 0 8 >
ffff88028014f300 687598671 S Co:1:042:0 s 21 09 0300 0000 0008 8 = 05d77ef9 462e35f3
ffff88028014f300 687598921 C Co:1:042:0 0 8 >
ffff8803ed332000 687615787 S Co:1:042:0 s 21 09 0300 0000 0008 8 = d2419938 96b2dc45
ffff8803ed332000 687616051 C Co:1:042:0 0 8 >
ffff8803ed332000 687630625 S Co:1:042:0 s 21 09 0300 0000 0008 8 = c565fb98 b508bbd5
ffff8803ed332000 687630777 C Co:1:042:0 0 8 >
ffff8803ed332000 687645718 S Co:1:042:0 s 21 09 0300 0000 0008 8 = fde5ea39 cde7d444
ffff8803ed332000 687645919 C Co:1:042:0 0 8 >
ffff8804039de000 687662775 S Co:1:042:0 s 21 09 0300 0000 0008 8 = 8eec03a2 ba4a3c5b
ffff8804039de000 687662966 C Co:1:042:0 0 8 >
ffff8804039de000 687677807 S Co:1:042:0 s 21 09 0300 0000 0008 8 = fda4b73c 8dee9d85
ffff8804039de000 687678080 C Co:1:042:0 0 8 >
ffff8802486c6c00 687692856 S Co:1:042:0 s 21 09 0300 0000 0008 8 = c7bfc8d4 0bd7b652
ffff8802486c6c00 687693117 C Co:1:042:0 0 8 >
ffff880403840180 687709748 S Co:1:042:0 s 21 09 0300 0000 0008 8 = d9f0ce1c 2ccad8f4
ffff880403840180 687709928 C Co:1:042:0 0 8 >
ffff8802486c6c00 687724806 S Co:1:042:0 s 21 09 0300 0000 0008 8 = 1771b628 9ed168c3
ffff8802486c6c00 687725052 C Co:1:042:0 0 8 >
ffff8802486c6c00 687739639 S Co:1:042:0 s 21 09 0300 0000 0008 8 = d77d40f3 41bc61ba
ffff8802486c6c00 687739778 C Co:1:042:0 0 8 >
ffff88028014f300 687756745 S Co:1:042:0 s 21 09 0300 0000 0008 8 = 65d57ed9 ab9dd1f9
ffff88028014f300 687756908 C Co:1:042:0 0 8 >
ffff88028014f300 687771782 S Co:1:042:0 s 21 09 0300 0000 0008 8 = 7f3e5a1c a4495a44
ffff88028014f300 687771915 C Co:1:042:0 0 8 >
ffff8802486c6c00 687786682 S Co:1:042:0 s 21 09 0300 0000 0008 8 = d8ff0f62 a9dcb181
ffff8802486c6c00 687786796 C Co:1:042:0 0 8 >
ffff8802486c6c00 687801715 S Co:1:042:0 s 21 09 0300 0000 0008 8 = 9765ad33 6b34203c
ffff8802486c6c00 687801957 C Co:1:042:0 0 8 >
ffff8804039de000 687818782 S Co:1:042:0 s 21 09 0300 0000 0008 8 = d741977e 4f720624
ffff8804039de000 687819084 C Co:1:042:0 0 8 >
ffff8804039de000 687833818 S Co:1:042:0 s 21 09 0300 0000 0008 8 = 27660613 ee7e538d
ffff8804039de000 687834034 C Co:1:042:0 0 8 >
ffff8804039de000 687848649 S Co:1:042:0 s 21 09 0300 0000 0008 8 = 092e8528 94820fee
ffff8804039de000 687848780 C Co:1:042:0 0 8 >
ffff8802486c6c00 687863736 S Co:1:042:0 s 21 09 0300 0000 0008 8 = 75f475d6 c26cd263
ffff8802486c6c00 687863903 C Co:1:042:0 0 8 >
ffff88028014f300 687880795 S Co:1:042:0 s 21 09 0300 0000 0008 8 = 5698899a ae6f4b2a
ffff88028014f300 687881064 C Co:1:042:0 0 8 >
ffff88028014f840 687895694 S Co:1:042:0 s 21 09 0300 0000 0008 8 = 09014ad7 c081bb28
ffff88028014f840 687895783 C Co:1:042:0 0 8 >
ffff880403840300 687911193 S Co:1:042:0 s 21 09 0300 0000 0008 8 = e3959251 15dc7963
ffff880403840300 687911286 C Co:1:042:0 0 8 >
ffff88028014f540 687927784 S Co:1:042:0 s 21 09 0300 0000 0008 8 = aac112b2 ff7f6e87
ffff88028014f540 687928035 C Co:1:042:0 0 8 >
ffff8804039de0c0 687942682 S Co:1:042:0 s 21 09 0300 0000 0008 8 = 1975ce07 81ac9963
ffff8804039de0c0 687942782 C Co:1:042:0 0 8 >
ffff8804039de0c0 687957884 S Co:1:042:0 s 21 09 0300 0000 0008 8 = 5ea69d42 d4698a6b
ffff8804039de0c0 687958053 C Co:1:042:0 0 8 >
ffff8802486c6e40 687974786 S Co:1:042:0 s 21 09 0300 0000 0008 8 = 9dccacb7 e702e837
ffff8802486c6e40 687975054 C Co:1:042:0 0 8 >
ffff8802486c6e40 687989815 S Co:1:042:0 s 21 09 0300 0000 0008 8 = 6d64faa1 d883ee00
ffff8802486c6e40 687990054 C Co:1:042:0 0 8 >
ffff8802486c6e40 688004664 S Co:1:042:0 s 21 09 0300 0000 0008 8 = 586edc9c 7e40e727
ffff8802486c6e40 688004781 C Co:1:042:0 0 8 >
ffff880403840300 688021770 S Co:1:042:0 s 21 09 0300 0000 0008 8 = 5dee782b e24fb8b0
ffff880403840300 688021915 C Co:1:042:0 0 8 >
ffff8804039de0c0 688035752 S Co:1:042:0 s 21 09 0300 0000 0008 8 = 706d4c31 bf0b55c1
ffff8804039de0c0 688035907 C Co:1:042:0 0 8 >
ffff8804039de240 688053748 S Co:1:042:0 s 21 09 0300 0000 0008 8 = f676a67a 07914826
ffff8804039de240 688053917 C Co:1:042:0 0 8 >
ffff8804065d8d80 688068761 S Co:1:042:0 s 21 09 0300 0000 0008 8 = 4c1b2c31 5f442fcf
ffff8804065d8d80 688068910 C Co:1:042:0 0 8 >
ffff8802486c6e40 688083771 S Co:1:042:0 s 21 09 0300 0000 0008 8 = 3f705369 a04b3c4e
ffff8802486c6e40 688083910 C Co:1:042:0 0 8 >
ffff88028014f0c0 688098689 S Co:1:042:0 s 21 09 0300 0000 0008 8 = 920dea97 570fb55b
ffff88028014f0c0 688098807 C Co:1:042:0 0 8 >
ffff88028014f0c0 688114725 S Co:1:042:0 s 21 09 0300 0000 0008 8 = 7e8f8e14 44c07551
ffff88028014f0c0 688114911 C Co:1:042:0 0 8 >
ffff8802486c63c0 688129756 S Co:1:042:0 s 21 09 0300 0000 0008 8 = 2b15359e dccf67b1
ffff8802486c63c0 688129911 C Co:1:042:0 0 8 >
ffff8802486c63c0 688145839 S Co:1:042:0 s 21 09 0300 0000 0008 8 = 3ac5a6d6 c8740f9d
ffff8802486c63c0 688146031 C Co:1:042:0 0 8 >
ffff8801eff40480 688162721 S Co:1:042:0 s 21 09 0300 0000 0008 8 = 3e47fdc1 6627035c
ffff8801eff40480 688162907 C Co:1:042:0 0 8 >
ffff88028014f0c0 688177762 S Co:1:042:0 s 21 09 0300 0000 0008 8 = 3c462a49 45296cda
ffff88028014f0c0 688177910 C Co:1:042:0 0 8 >
ffff8804039de240 688192804 S Co:1:042:0 s 21 09 0300 0000 0008 8 = 30f471bb acfa8826
ffff8804039de240 688193035 C Co:1:042:0 0 8 >
ffff8804039de240 688209711 S Co:1:042:0 s 21 09 0300 0000 0008 8 = 8985e949 12e22af4
ffff8804039de240 688209934 C Co:1:042:0 0 8 >
ffff8804039de240 688224745 S Co:1:042:0 s 21 09 0300 0000 0008 8 = a9b1ff87 a46b361b
ffff8804039de240 688224907 C Co:1:042:0 0 8 >
ffff8804039de240 688239795 S Co:1:042:0 s 21 09 0300 0000 0008 8 = 6834f2f0 c4e32717
ffff8804039de240 688240068 C Co:1:042:0 0 8 >
ffff8804039de240 688256720 S Co:1:042:0 s 21 09 0300 0000 0008 8 = 904f5660 87dd8a87
ffff8804039de240 688256975 C Co:1:042:0 0 8 >
ffff8802486c6900 688271742 S Co:1:042:0 s 21 09 0300 0000 0008 8 = 6147939a 34ae83ad
ffff8802486c6900 688271932 C Co:1:042:0 0 8 >
ffff8802486c6900 688286777 S Co:1:042:0 s 21 09 0300 0000 0008 8 = 0de366c2 caf245f2
ffff8802486c6900 688286909 C Co:1:042:0 0 8 >
ffff8802486c6900 688301919 S Co:1:042:0 s 21 09 0300 0000 0008 8 = 3af05de1 78079c62
ffff8802486c6900 688302073 C Co:1:042:0 0 8 >
ffff8804039de240 688318714 S Co:1:042:0 s 21 09 0300 0000 0008 8 = 85bf5d66 258f652a
ffff8804039de240 688318911 C Co:1:042:0 0 8 >
ffff8804039de240 688333706 S Co:1:042:0 s 21 09 0300 0000 0008 8 = fca41ea1 e8f0121f
ffff8804039de240 688333908 C Co:1:042:0 0 8 >
ffff8804065d8d80 688348881 S Co:1:042:0 s 21 09 0300 0000 0008 8 = a176ab48 8fd52938
ffff8804065d8d80 688349055 C Co:1:042:0 0 8 >
ffff8802486c63c0 688365730 S Co:1:042:0 s 21 09 0300 0000 0008 8 = eb13e4f4 1aacc411
ffff8802486c63c0 688365934 C Co:1:042:0 0 8 >
ffff8801eff40480 688380759 S Co:1:042:0 s 21 09 0300 0000 0008 8 = 46dbfea3 3f281168
ffff8801eff40480 688380936 C Co:1:042:0 0 8 >
ffff8801eff40480 688395853 S Co:1:042:0 s 21 09 0300 0000 0008 8 = 91330036 e5bfd1a2
ffff8801eff40480 688396058 C Co:1:042:0 0 8 >
ffff88028014f0c0 688412691 S Co:1:042:0 s 21 09 0300 0000 0008 8 = 9d0246f2 ab2bda45
ffff88028014f0c0 688412809 C Co:1:042:0 0 8 >
ffff8801eff40480 688427686 S Co:1:042:0 s 21 09 0300 0000 0008 8 = b235ff01 61eb977e
ffff8801eff40480 688427785 C Co:1:042:0 0 8 >
ffff88028014f0c0 688442757 S Co:1:042:0 s 21 09 0300 0000 0008 8 = 0c3cb1f0 8cc1859a
ffff88028014f0c0 688442915 C Co:1:042:0 0 8 >
ffff8802486c63c0 688459706 S Co:1:042:0 s 21 09 0300 0000 0008 8 = 588db231 e434b68e
ffff8802486c63c0 688459939 C Co:1:042:0 0 8 >
ffff8802486c63c0 688474701 S Co:1:042:0 s 21 09 0300 0000 0008 8 = 3a1eae99 d70d5071
ffff8802486c63c0 688474859 C Co:1:042:0 0 8 >
ffff8801eff40b40 688489751 S Co:1:042:0 s 21 09 0300 0000 0008 8 = c8ed26e0 05dc0dff
ffff8801eff40b40 688489913 C Co:1:042:0 0 8 >
ffff8801eff403c0 688504798 S Co:1:042:0 s 21 09 0300 0000 0008 8 = 0e7aed26 c472ba17
ffff8801eff403c0 688505064 C Co:1:042:0 0 8 >
ffff8804039dee40 688521741 S Co:1:042:0 s 21 09 0300 0000 0008 8 = 8a49ac6a 9c66ba3b
ffff8804039dee40 688521912 C Co:1:042:0 0 8 >
ffff880403840d80 688536795 S Co:1:042:0 s 21 09 0300 0000 0008 8 = af635d13 ca938315
ffff880403840d80 688537041 C Co:1:042:0 0 8 >
ffff8803e3016c00 688551807 S Co:1:042:0 s 21 09 0300 0000 0008 8 = 64d4d16a bf961dee
ffff8803e3016c00 688552038 C Co:1:042:0 0 8 >
ffff8803e3016780 688568742 S Co:1:042:0 s 21 09 0300 0000 0008 8 = 842c2c1b 9f52a836
ffff8803e3016780 688568918 C Co:1:042:0 0 8 >
ffff8803e30163c0 688583787 S Co:1:042:0 s 21 09 0300 0000 0008 8 = 5d0065b9 c56ed502
ffff8803e30163c0 688583915 C Co:1:042:0 0 8 >
ffff8803e30163c0 688598774 S Co:1:042:0 s 21 09 0300 0000 0008 8 = 3468c93a 3cd46a87
ffff8803e30163c0 688598933 C Co:1:042:0 0 8 >
ffff8803e30163c0 688615831 S Co:1:042:0 s 21 09 0300 0000 0008 8 = be817775 4532c1a2
ffff8803e30163c0 688616037 C Co:1:042:0 0 8 >
ffff8803e30163c0 688630725 S Co:1:042:0 s 21 09 0300 0000 0008 8 = a6eae4a9 d67a4751
ffff8803e30163c0 688630937 C Co:1:042:0 0 8 >
ffff880403862a80 688645755 S Co:1:042:0 s 21 09 0300 0000 0008 8 = 0c4957f7 1764ff39
ffff880403862a80 688645926 C Co:1:042:0 0 8 >
ffff88028014f180 688662819 S Co:1:042:0 s 21 09 0300 0000 0008 8 = 01c66be4 e5e9fe20
ffff88028014f180 688663060 C Co:1:042:0 0 8 >
ffff88028014f180 688677719 S Co:1:042:0 s 21 09 0300 0000 0008 8 = 0e8c92da 52c7ef72
ffff88028014f180 688677917 C Co:1:042:0 0 8 >
ffff88040333b0c0 688692707 S Co:1:042:0 s 21 09 0300 0000 0008 8 = ad4e8ea6 21028fbf
ffff88040333b0c0 688692932 C Co:1:042:0 0 8 >
ffff88040333b0c0 688707802 S Co:1:042:0 s 21 09 0300 0000 0008 8 = ccbdf8fa 4b5f3039
ffff88040333b0c0 688708039 C Co:1:042:0 0 8 >
ffff88040333b0c0 688724649 S Co:1:042:0 s 21 09 0300 0000 0008 8 = 4f14bbeb 7ee93738
ffff88040333b0c0 688724800 C Co:1:042:0 0 8 >
ffff8802486c63c0 688739682 S Co:1:042:0 s 21 09 0300 0000 0008 8 = 8d8f9872 9b6ea0b8
ffff8802486c63c0 688739805 C Co:1:042:0 0 8 >
ffff8802486c66c0 688754731 S Co:1:042:0 s 21 09 0300 0000 0008 8 = d0eda2ec 360177d8
ffff8802486c66c0 688754932 C Co:1:042:0 0 8 >
ffff88028014f180 688771680 S Co:1:042:0 s 21 09 0300 0000 0008 8 = d7f4c19c 18775f5a
ffff88028014f180 688771790 C Co:1:042:0 0 8 >
ffff88040333b480 688786731 S Co:1:042:0 s 21 09 0300 0000 0008 8 = 56eb3125 bfec0d28
ffff88040333b480 688786932 C Co:1:042:0 0 8 >
ffff88028014f180 688801766 S Co:1:042:0 s 21 09 0300 0000 0008 8 = 72200213 da3ecccb
ffff88028014f180 688801915 C Co:1:042:0 0 8 >
ffff88028014f180 688818828 S Co:1:042:0 s 21 09 0300 0000 0008 8 = 47619752 cf8ff9f4
ffff88028014f180 688819061 C Co:1:042:0 0 8 >
ffff8803ed332900 688833663 S Co:1:042:0 s 21 09 0300 0000 0008 8 = 64852ab3 37c685f5
ffff8803ed332900 688833788 C Co:1:042:0 0 8 >
ffff8803ed332900 688848776 S Co:1:042:0 s 21 09 0300 0000 0008 8 = 4ce3446c 5e0c7846
ffff8803ed332900 688848925 C Co:1:042:0 0 8 >
ffff8803ed332900 688865757 S Co:1:042:0 s 21 09 0300 0000 0008 8 = f5d74797 c6506b03
ffff8803ed332900 688865915 C Co:1:042:0 0 8 >
ffff8803ed332900 688880648 S Co:1:042:0 s 21 09 0300 0000 0008 8 = 4b42e7b0 a3c50b6b
ffff8803ed332900 688880788 C Co:1:042:0 0 8 >
ffff8803ed332900 688896238 S Co:1:042:0 s 21 09 0300 0000 0008 8 = ac09aa19 5e619a60
ffff8803ed332900 688896430 C Co:1:042:0 0 8 >
ffff8803ed332900 688912804 S Co:1:042:0 s 21 09 0300 0000 0008 8 = 6b936e97 155f70ec
ffff8803ed332900 688913064 C Co:1:042:0 0 8 >
ffff8803ed332900 688927704 S Co:1:042:0 s 21 09 0300 0000 0008 8 = 4f4de1d4 17bc74b8
ffff8803ed332900 688927812 C Co:1:042:0 0 8 >
ffff8803ed332900 688942739 S Co:1:042:0 s 21 09 0300 0000 0008 8 = 132808dd 6abba695
ffff8803ed332900 688942918 C Co:1:042:0 0 8 >
ffff8803ed332900 688959783 S Co:1:042:0 s 21 09 0300 0000 0008 8 = e617bba4 476396f5
ffff8803ed332900 688959925 C Co:1:042:0 0 8 >
ffff8803ed332900 688974646 S Co:1:042:0 s 21 09 0300 0000 0008 8 = ea94257e 9bfdec70
ffff8803ed332900 688974789 C Co:1:042:0 0 8 >
ffff8803ed332900 688989722 S Co:1:042:0 s 21 09 0300 0000 0008 8 = b71a46a4 8699e042
ffff8803ed332900 688989917 C Co:1:042:0 0 8 >
ffff8803ed332900 689006781 S Co:1:042:0 s 21 09 0300 0000 0008 8 = d7aa73b3 dd88c1ca
ffff8803ed332900 689006944 C Co:1:042:0 0 8 >
ffff8802486c6240 689021282 S Co:1:042:0 s 21 09 0300 0000 0008 8 = 4a48d32e aae1710b
ffff8802486c6240 689021421 C Co:1:042:0 0 8 >
ffff8802486c6840 689038196 S Co:1:042:0 s 21 09 0300 0000 0008 8 = 017de2f9 a8ffe52c
ffff8802486c6840 689038328 C Co:1:042:0 0 8 >
ffff88040333b900 689053209 S Co:1:042:0 s 21 09 0300 0000 0008 8 = 65d5efde caffa7f9
ffff88040333b900 689053314 C Co:1:042:0 0 8 >
ffff88040333b900 689068256 S Co:1:042:0 s 21 09 0300 0000 0008 8 = d060a009 b3455662
ffff88040333b900 689068491 C Co:1:042:0 0 8 >
ffff880403862180 689084182 S Co:1:042:0 s 21 09 0300 0000 0008 8 = 10336b8e 3df622f9
ffff880403862180 689084313 C Co:1:042:0 0 8 >
ffff88028014f540 689098196 S Co:1:042:0 s 21 09 0300 0000 0008 8 = e9e71ce0 f57d5377
ffff88028014f540 689098313 C Co:1:042:0 0 8 >
ffff88028014f540 689114239 S Co:1:042:0 s 21 09 0300 0000 0008 8 = 92175459 9b08c136
ffff88028014f540 689114417 C Co:1:042:0 0 8 >
ffff88040333b3c0 689130225 S Co:1:042:0 s 21 09 0300 0000 0008 8 = 35e307b7 a5095bb5
ffff88040333b3c0 689130414 C Co:1:042:0 0 8 >
ffff88040333b3c0 689145234 S Co:1:042:0 s 21 09 0300 0000 0008 8 = 7171fb9b bab8a319
ffff88040333b3c0 689145452 C Co:1:042:0 0 8 >
ffff88040333b3c0 689162234 S Co:1:042:0 s 21 09 0300 0000 0008 8 = d9694d0b 398e2ea8
ffff88040333b3c0 689162414 C Co:1:042:0 0 8 >
ffff88028014f780 689177250 S Co:1:042:0 s 21 09 0300 0000 0008 8 = 7577edef b2c9264f
ffff88028014f780 689177444 C Co:1:042:0 0 8 >
ffff88028014f780 689192159 S Co:1:042:0 s 21 09 0300 0000 0008 8 = 3ecb1f95 69edc91b
ffff88028014f780 689192314 C Co:1:042:0 0 8 >
ffff88028014f780 689209206 S Co:1:042:0 s 21 09 0300 0000 0008 8 = a49afb2f d93feac2
ffff88028014f780 689209316 C Co:1:042:0 0 8 >
ffff88040333b3c0 689224273 S Co:1:042:0 s 21 09 0300 0000 0008 8 = 0a9ceb52 2d4a6d19
ffff88040333b3c0 689224445 C Co:1:042:0 0 8 >
ffff8802486c6300 689239157 S Co:1:042:0 s 21 09 0300 0000 0008 8 = 468e3277 c65dcd9d
ffff8802486c6300 689239297 C Co:1:042:0 0 8 >
ffff8803e3016000 689256158 S Co:1:042:0 s 21 09 0300 0000 0008 8 = 24af617c b90998ed
ffff8803e3016000 689256291 C Co:1:042:0 0 8 >
ffff8803e3016d80 689271188 S Co:1:042:0 s 21 09 0300 0000 0008 8 = e145e221 50a4f04c
ffff8803e3016d80 689271310 C Co:1:042:0 0 8 >
ffff8804038620c0 689286088 S Co:1:042:0 s 21 09 0300 0000 0008 8 = b217708d 87cb0a21
ffff8804038620c0 689286166 C Co:1:042:0 0 8 >
ffff88040333bd80 689303147 S Co:1:042:0 s 21 09 0300 0000 0008 8 = 3df39ac9 8fdab079
ffff88040333bd80 689303309 C Co:1:042:0 0 8 >
ffff880403862cc0 689318193 S Co:1:042:0 s 21 09 0300 0000 0008 8 = 1d284542 4d74c081
ffff880403862cc0 689318297 C Co:1:042:0 0 8 >
ffff880403862cc0 689333218 S Co:1:042:0 s 21 09 0300 0000 0008 8 = 610b2949 d9ffac0f
ffff880403862cc0 689333437 C Co:1:042:0 0 8 >
ffff880403862cc0 689348185 S Co:1:042:0 s 21 09 0300 0000 0008 8 = 0b745295 0126fb18
ffff880403862cc0 689348303 C Co:1:042:0 0 8 >
ffff88040333bd80 689365240 S Co:1:042:0 s 21 09 0300 0000 0008 8 = 933f9ebd c658c539
ffff88040333bd80 689365478 C Co:1:042:0 0 8 >
ffff880403862900 689380201 S Co:1:042:0 s 21 09 0300 0000 0008 8 = 64cd43c0 db463931
ffff880403862900 689380291 C Co:1:042:0 0 8 >
ffff880403862900 689397183 S Co:1:042:0 s 21 09 0300 0000 0008 8 = 5b83487f 2b671863
ffff880403862900 689397297 C Co:1:042:0 0 8 >
ffff88028014f780 689412208 S Co:1:042:0 s 21 09 0300 0000 0008 8 = 4d480a40 53763956
ffff88028014f780 689412295 C Co:1:042:0 0 8 >
ffff88040333bd80 689427250 S Co:1:042:0 s 21 09 0300 0000 0008 8 = 7f09b62b 22f00537
ffff88040333bd80 689427441 C Co:1:042:0 0 8 >
ffff88040333bd80 689444170 S Co:1:042:0 s 21 09 0300 0000 0008 8 = 2e37d3cf 1d98fa53
ffff88040333bd80 689444294 C Co:1:042:0 0 8 >
ffff880403862900 689459201 S Co:1:042:0 s 21 09 0300 0000 0008 8 = 0746b79b fff52aa0
ffff880403862900 689459318 C Co:1:042:0 0 8 >
ffff880403862900 689474253 S Co:1:042:0 s 21 09 0300 0000 0008 8 = ae2d0f67 33d1bc33
ffff880403862900 689474421 C Co:1:042:0 0 8 >
ffff88028014f780 689491288 S Co:1:042:0 s 21 09 0300 0000 0008 8 = 3aeb5aeb 5bba68c9
ffff88028014f780 689491443 C Co:1:042:0 0 8 >
ffff88028014f780 689506200 S Co:1:042:0 s 21 09 0300 0000 0008 8 = b5fe6d45 cb82fc41
ffff88028014f780 689506296 C Co:1:042:0 0 8 >
ffff88028014f780 689521236 S Co:1:042:0 s 21 09 0300 0000 0008 8 = 9eebee76 0cc1db1e
ffff88028014f780 689521421 C Co:1:042:0 0 8 >
ffff8804038620c0 689538149 S Co:1:042:0 s 21 09 0300 0000 0008 8 = 68bbdbe3 5b4f7b07
ffff8804038620c0 689538298 C Co:1:042:0 0 8 >
ffff880403862900 689553183 S Co:1:042:0 s 21 09 0300 0000 0008 8 = fb7a02d5 29cde549
ffff880403862900 689553323 C Co:1:042:0 0 8 >
ffff88028014f780 689568213 S Co:1:042:0 s 21 09 0300 0000 0008 8 = 30b988fb 9b1b3752
ffff88028014f780 689568297 C Co:1:042:0 0 8 >
ffff88028014f780 689583205 S Co:1:042:0 s 21 09 0300 0000 0008 8 = 570b65e6 0ae12335
ffff88028014f780 689583293 C Co:1:042:0 0 8 >
ffff88028014f780 689600163 S Co:1:042:0 s 21 09 0300 0000 0008 8 = b389e48a 8209702b
ffff88028014f780 689600321 C Co:1:042:0 0 8 >
ffff88040333b3c0 689615209 S Co:1:042:0 s 21 09 0300 0000 0008 8 = fa5025c2 4541760e
ffff88040333b3c0 689615324 C Co:1:042:0 0 8 >
ffff8802486c6300 689630222 S Co:1:042:0 s 21 09 0300 0000 0008 8 = d7009dca 477ca3dd
ffff8802486c6300 689630341 C Co:1:042:0 0 8 >
ffff880403862c00 689647281 S Co:1:042:0 s 21 09 0300 0000 0008 8 = 6a3d93c4 b170fa3d
ffff880403862c00 689647480 C Co:1:042:0 0 8 >
ffff880403862c00 689662215 S Co:1:042:0 s 21 09 0300 0000 0008 8 = c530a336 611791f5
ffff880403862c00 689662449 C Co:1:042:0 0 8 >
ffff88028014f540 689677170 S Co:1:042:0 s 21 09 0300 0000 0008 8 = 6f053d88 6630116f
ffff88028014f540 689677313 C Co:1:042:0 0 8 >
ffff88028014f3c0 689694275 S Co:1:042:0 s 21 09 0300 0000 0008 8 = e36c2489 86bd383c
ffff88028014f3c0 689694459 C Co:1:042:0 0 8 >
ffff88028014f3c0 689709118 S Co:1:042:0 s 21 09 0300 0000 0008 8 = 101af1e9 ba84588f
ffff88028014f3c0 689709294 C Co:1:042:0 0 8 >
ffff88040333b3c0 689724219 S Co:1:042:0 s 21 09 0300 0000 0008 8 = d84890bd af90d7be
ffff88040333b3c0 689724324 C Co:1:042:0 0 8 >
ffff880403862c00 689739257 S Co:1:042:0 s 21 09 0300 0000 0008 8 = 9330c000 45b0afc6
ffff880403862c00 689739444 C Co:1:042:0 0 8 >
ffff88040333b3c0 689756166 S Co:1:042:0 s 21 09 0300 0000 0008 8 = 8b95950f 11f5edc6
ffff88040333b3c0 689756307 C Co:1:042:0 0 8 >
ffff88040333b3c0 689771205 S Co:1:042:0 s 21 09 0300 0000 0008 8 = 803af72b dc363481
ffff88040333b3c0 689771328 C Co:1:042:0 0 8 >
ffff8802486c6600 689786248 S Co:1:042:0 s 21 09 0300 0000 0008 8 = 236823f9 248d3adf
ffff8802486c6600 689786427 C Co:1:042:0 0 8 >
ffff88028014f3c0 689803321 S Co:1:042:0 s 21 09 0300 0000 0008 8 = 9d6a2703 98d9486a
ffff88028014f3c0 689803447 C Co:1:042:0 0 8 >
ffff88040333b3c0 689818188 S Co:1:042:0 s 21 09 0300 0000 0008 8 = 07126836 9f3cbcd3
ffff88040333b3c0 689818320 C Co:1:042:0 0 8 >
ffff8804065d8d80 689833236 S Co:1:042:0 s 21 09 0300 0000 0008 8 = f2341d63 d09d886c
ffff8804065d8d80 689833421 C Co:1:042:0 0 8 >
ffff88040333b3c0 689848196 S Co:1:042:0 s 21 09 0300 0000 0008 8 = df28d3c1 7825b1ae
ffff88040333b3c0 689848301 C Co:1:042:0 0 8 >
ffff88040333b3c0 689865174 S Co:1:042:0 s 21 09 0300 0000 0008 8 = c54be967 19c4d3b3
ffff88040333b3c0 689865360 C Co:1:042:0 0 8 >
ffff88040333b3c0 689880234 S Co:1:042:0 s 21 09 0300 0000 0008 8 = 907c14d5 e8ab9bbb
ffff88040333b3c0 689880432 C Co:1:042:0 0 8 >
ffff88040333b3c0 689895253 S Co:1:042:0 s 21 09 0300 0000 0008 8 = 9ea1db6a 4cd14aa9
ffff88040333b3c0 689895431 C Co:1:042:0 0 8 >
ffff88040333b3c0 689912160 S Co:1:042:0 s 21 09 0300 0000 0008 8 = 432119ed 64713685
ffff88040333b3c0 689912301 C Co:1:042:0 0 8 >
ffff88040333b3c0 689927209 S Co:1:042:0 s 21 09 0300 0000 0008 8 = 446a8006 80884af9
ffff88040333b3c0 689927300 C Co:1:042:0 0 8 >
ffff88040333b3c0 689942282 S Co:1:042:0 s 21 09 0300 0000 0008 8 = 5d6b12c4 a45a83d6
ffff88040333b3c0 689942439 C Co:1:042:0 0 8 >
ffff88040333b3c0 689959294 S Co:1:042:0 s 21 09 0300 0000 0008 8 = bd18a817 0bec728e
ffff88040333b3c0 689959427 C Co:1:042:0 0 8 >
ffff88028014f3c0 689974188 S Co:1:042:0 s 21 09 0300 0000 0008 8 = 87eb6e55 9f89bfba
ffff88028014f3c0 689974322 C Co:1:042:0 0 8 >
ffff88028014f0c0 689989326 S Co:1:042:0 s 21 09 0300 0000 0008 8 = 515f62b7 843ea394
ffff88028014f0c0 689989458 C Co:1:042:0 0 8 >
ffff88040333bb40 690005408 S Co:1:042:0 s 21 09 0300 0000 0008 8 = a676dadb 8c606b7c
ffff88040333bb40 690005569 C Co:1:042:0 0 8 >
ffff8802486c63c0 690020373 S Co:1:042:0 s 21 09 0300 0000 0008 8 = 8632fd41 c204fa75
ffff8802486c63c0 690020551 C Co:1:042:0 0 8 >
ffff88040333bb40 690037424 S Co:1:042:0 s 21 09 0300 0000 0008 8 = e31d48d0 e28445a7
ffff88040333bb40 690037566 C Co:1:042:0 0 8 >
ffff88040333bb40 690051445 S Co:1:042:0 s 21 09 0300 0000 0008 8 = 24c30851 ddfed7dc
ffff88040333bb40 690051571 C Co:1:042:0 0 8 >
ffff8802486c6840 690067352 S Co:1:042:0 s 21 09 0300 0000 0008 8 = a435e4f1 57d64d05
ffff8802486c6840 690067571 C Co:1:042:0 0 8 >
ffff8802486c6840 690083410 S Co:1:042:0 s 21 09 0300 0000 0008 8 = 328653c2 2b31d9b5
ffff8802486c6840 690083552 C Co:1:042:0 0 8 >
ffff880403862f00 690098460 S Co:1:042:0 s 21 09 0300 0000 0008 8 = 90501f38 e37ac0a2
ffff880403862f00 690098572 C Co:1:042:0 0 8 >
ffff8804038620c0 690114277 S Co:1:042:0 s 21 09 0300 0000 0008 8 = f62eeaae 43dfde2a
ffff8804038620c0 690114448 C Co:1:042:0 0 8 >
ffff88040333bb40 690129368 S Co:1:042:0 s 21 09 0300 0000 0008 8 = 8e41a8e1 bed31fc9
ffff88040333bb40 690129548 C Co:1:042:0 0 8 >
ffff8802486c6900 690146399 S Co:1:042:0 s 21 09 0300 0000 0008 8 = f7ad1f71 fd8c06a6
ffff8802486c6900 690146565 C Co:1:042:0 0 8 >
ffff8802486c6900 690161472 S Co:1:042:0 s 21 09 0300 0000 0008 8 = c51b6d65 5d842805
ffff8802486c6900 690161550 C Co:1:042:0 0 8 >
ffff8804038620c0 690176413 S Co:1:042:0 s 21 09 0300 0000 0008 8 = fe3780a5 6ffab0d4
ffff8804038620c0 690176593 C Co:1:042:0 0 8 >
ffff8804038620c0 690193424 S Co:1:042:0 s 21 09 0300 0000 0008 8 = 9c329d80 7770da21
ffff8804038620c0 690193579 C Co:1:042:0 0 8 >
ffff880403840840 690208477 S Co:1:042:0 s 21 09 0300 0000 0008 8 = 103fdc26 f02d7a9f
ffff880403840840 690208705 C Co:1:042:0 0 8 >
ffff88040333bb40 690223354 S Co:1:042:0 s 21 09 0300 0000 0008 8 = ba17a82d 05ba7527
ffff88040333bb40 690223581 C Co:1:042:0 0 8 >
ffff8802486c6480 690240357 S Co:1:042:0 s 21 09 0300 0000 0008 8 = 7477420e 17664433
ffff8802486c6480 690240566 C Co:1:042:0 0 8 >
ffff88028014f540 690255430 S Co:1:042:0 s 21 09 0300 0000 0008 8 = 079f3da7 3cc57663
ffff88028014f540 690255573 C Co:1:042:0 0 8 >
ffff8803ed332d80 690270657 S Co:1:042:0 s 21 09 0300 0000 0008 8 = b2d301b9 bc2b2dfa
ffff8803ed332d80 690270808 C Co:1:042:0 0 8 >
ffff8803ed332d80 690287335 S Co:1:042:0 s 21 09 0300 0000 0008 8 = a8dc4969 95339e60
ffff8803ed332d80 690287426 C Co:1:042:0 0 8 >
ffff8803ed332d80 690302379 S Co:1:042:0 s 21 09 0300 0000 0008 8 = 9086a7c1 f63c93a0
ffff8803ed332d80 690302568 C Co:1:042:0 0 8 >
ffff8803ed332d80 690317593 S Co:1:042:0 s 21 09 0300 0000 0008 8 = 0621fe2e c5e9ebe9
ffff8803ed332d80 690317707 C Co:1:042:0 0 8 >
ffff8803ed332d80 690334330 S Co:1:042:0 s 21 09 0300 0000 0008 8 = 17020502 1a9e170e
ffff8803ed332d80 690334426 C Co:1:042:0 0 8 >
ffff88040333b0c0 690349427 S Co:1:042:0 s 21 09 0300 0000 0008 8 = c601c9f1 c4089c08
ffff88040333b0c0 690349598 C Co:1:042:0 0 8 >
ffff880403862c00 690364456 S Co:1:042:0 s 21 09 0300 0000 0008 8 = 8bfb2896 c1949671
ffff880403862c00 690364554 C Co:1:042:0 0 8 >
ffff88028014fa80 690381316 S Co:1:042:0 s 21 09 0300 0000 0008 8 = d14f59ed c8f43109
ffff88028014fa80 690381431 C Co:1:042:0 0 8 >
ffff88028014fa80 690396449 S Co:1:042:0 s 21 09 0300 0000 0008 8 = 766361d9 c2a02f33
ffff88028014fa80 690396554 C Co:1:042:0 0 8 >
ffff88028014fa80 690411454 S Co:1:042:0 s 21 09 0300 0000 0008 8 = 4c1e9d9d 4a506777
ffff88028014fa80 690411574 C Co:1:042:0 0 8 >
ffff88040333b0c0 690428304 S Co:1:042:0 s 21 09 0300 0000 0008 8 = 9c6e3e65 32854200
ffff88040333b0c0 690428427 C Co:1:042:0 0 8 >
ffff8804038626c0 690443338 S Co:1:042:0 s 21 09 0300 0000 0008 8 = a0c2c5bd ffff3f1d
ffff8804038626c0 690443427 C Co:1:042:0 0 8 >
ffff880403862c00 690458373 S Co:1:042:0 s 21 09 0300 0000 0008 8 = 078f8d16 6a466fc1
ffff880403862c00 690458550 C Co:1:042:0 0 8 >
ffff880403862c00 690475505 S Co:1:042:0 s 21 09 0300 0000 0008 8 = 73cd4046 df24f705
ffff880403862c00 690475678 C Co:1:042:0 0 8 >
ffff880403862c00 690490392 S Co:1:042:0 s 21 09 0300 0000 0008 8 = fc785e06 002792a3
ffff880403862c00 690490575 C Co:1:042:0 0 8 >
ffff880403862c00 690505433 S Co:1:042:0 s 21 09 0300 0000 0008 8 = ac11bc74 22220e7b
ffff880403862c00 690505576 C Co:1:042:0 0 8 >
ffff88028014fa80 690522403 S Co:1:042:0 s 21 09 0300 0000 0008 8 = 031d0191 ccabcd10
ffff88028014fa80 690522552 C Co:1:042:0 0 8 >
ffff88040333b0c0 690537360 S Co:1:042:0 s 21 09 0300 0000 0008 8 = 72a328c2 3c9c440a
ffff88040333b0c0 690537583 C Co:1:042:0 0 8 >
ffff8802486c6480 690552415 S Co:1:042:0 s 21 09 0300 0000 0008 8 = e2b10351 e4937db4
ffff8802486c6480 690552594 C Co:1:042:0 0 8 >
ffff8802486c6480 690567443 S Co:1:042:0 s 21 09 0300 0000 0008 8 = 2cd5b4ec e774967d
ffff8802486c6480 690567552 C Co:1:042:0 0 8 >
ffff88040333b0c0 690584348 S Co:1:042:0 s 21 09 0300 0000 0008 8 = a0a63422 9fe54279
ffff88040333b0c0 690584436 C Co:1:042:0 0 8 >
ffff88040333b0c0 690599389 S Co:1:042:0 s 21 09 0300 0000 0008 8 = 813bcfeb 19cf45de
ffff88040333b0c0 690599564 C Co:1:042:0 0 8 >
ffff88040333b0c0 690614426 S Co:1:042:0 s 21 09 0300 0000 0008 8 = 86b0a31f 95e1fa8a
ffff88040333b0c0 690614578 C Co:1:042:0 0 8 >
ffff88040333b0c0 690631422 S Co:1:042:0 s 21 09 0300 0000 0008 8 = 59a627fb 080ecf7a
ffff88040333b0c0 690631552 C Co:1:042:0 0 8 >
ffff8802486c6480 690646414 S Co:1:042:0 s 21 09 0300 0000 0008 8 = 19c1a0a2 9c0cc552
ffff8802486c6480 690646572 C Co:1:042:0 0 8 >
ffff8804038620c0 690677468 S Co:1:042:0 s 21 09 0300 0000 0008 8 = 55035f84 4b2fb501
ffff8804038620c0 690677582 C Co:1:042:0 0 8 >
ffff88028014fa80 690708405 S Ci:1:042:0 s a1 01 0300 0000 0008 8 <
ffff88028014fa80 690708558 C Ci:1:042:0 0 8 = aa040000 00000000
ffff8803d5780480 707694313 S Co:1:042:0 s 21 09 0300 0000 0008 8 = 55010100 00ff075d
ffff8803d5780480 707694465 C Co:1:042:0 0 8 >
ffff8803d5780cc0 707724304 S Ci:1:042:0 s a1 01 0300 0000 0008 8 <
ffff8803d5780cc0 707724453 C Ci:1:042:0 0 8 = aa020000 00000000
ffff8802486c6a80 707756282 S Co:1:042:0 s 21 09 0300 0000 0008 8 = 0b010101 00000e04
ffff8802486c6a80 707756523 C Co:1:042:0 0 8 >
ffff8803d5780a80 707771312 S Co:1:042:0 s 21 09 0300 0000 0008 8 = c19f1246 d710dbbc
ffff8803d5780a80 707771476 C Co:1:042:0 0 8 >
ffff880403862b40 707786822 S Co:1:042:0 s 21 09 0300 0000 0008 8 = 01809800 15fff7ff
ffff880403862b40 707786975 C Co:1:042:0 0 8 >
ffff88025ad1f600 707802498 S Co:1:042:0 s 21 09 0300 0000 0008 8 = 57ff97ff 17ffb7ff
ffff88025ad1f600 707802723 C Co:1:042:0 0 8 >
ffff8803d5780a80 707820354 S Co:1:042:0 s 21 09 0300 0000 0008 8 = 67ff87ff 47ff27ff
ffff8803d5780a80 707820452 C Co:1:042:0 0 8 >
ffff8803d57809c0 707833373 S Co:1:042:0 s 21 09 0300 0000 0008 8 = d7ffa7ff e7ff87ff
ffff8803d57809c0 707833575 C Co:1:042:0 0 8 >
ffff8802486c6e40 707850382 S Co:1:042:0 s 21 09 0300 0000 0008 8 = c7ff57ff d7ff97ff
ffff8802486c6e40 707850451 C Co:1:042:0 0 8 >
ffff8802486c60c0 707867252 S Co:1:042:0 s 21 09 0300 0000 0008 8 = 07ffe7ff e7ffe7ff
ffff8802486c60c0 707867466 C Co:1:042:0 0 8 >
ffff8802486c60c0 707880480 S Co:1:042:0 s 21 09 0300 0000 0008 8 = 57ff17ff a7ffb7ff
ffff8802486c60c0 707880623 C Co:1:042:0 0 8 >
ffff88025ad1f180 707897377 S Co:1:042:0 s 21 09 0300 0000 0008 8 = 27ffe7ff f7ff77ff
ffff88025ad1f180 707897605 C Co:1:042:0 0 8 >
ffff88025ad1f180 707912283 S Co:1:042:0 s 21 09 0300 0000 0008 8 = 77ff77ff 47ff97ff
ffff88025ad1f180 707912478 C Co:1:042:0 0 8 >
ffff88025ad1f180 707927346 S Co:1:042:0 s 21 09 0300 0000 0008 8 = 87ffb7ff 77ff37ff
ffff88025ad1f180 707927454 C Co:1:042:0 0 8 >
ffff88025ad1f180 707943356 S Co:1:042:0 s 21 09 0300 0000 0008 8 = 17ff67ff a7ff77ff
ffff88025ad1f180 707943475 C Co:1:042:0 0 8 >
ffff8803ed332b40 707958308 S Co:1:042:0 s 21 09 0300 0000 0008 8 = e7ff67ff 87ffe7ff
ffff8803ed332b40 707958470 C Co:1:042:0 0 8 >
ffff8802486c6300 707973307 S Co:1:042:0 s 21 09 0300 0000 0008 8 = 87ff87ff f7ff27ff
ffff8802486c6300 707973470 C Co:1:042:0 0 8 >
ffff880403862900 707989336 S Co:1:042:0 s 21 09 0300 0000 0008 8 = d7ffb7ff 97ffd7ff
ffff880403862900 707989453 C Co:1:042:0 0 8 >
ffff88025ad1f180 708005372 S Co:1:042:0 s 21 09 0300 0000 0008 8 = c7ffd7ff b7ffa7ff
ffff88025ad1f180 708005453 C Co:1:042:0 0 8 >
ffff88025ad1fa80 708020282 S Co:1:042:0 s 21 09 0300 0000 0008 8 = 97ff47ff e7ff17ff
ffff88025ad1fa80 708020498 C Co:1:042:0 0 8 >
ffff8803d5780b40 708037325 S Co:1:042:0 s 21 09 0300 0000 0008 8 = f7ff07ff f7ffa7ff
ffff8803d5780b40 708037463 C Co:1:042:0 0 8 >
ffff8803d5780cc0 708052372 S Co:1:042:0 s 21 09 0300 0000 0008 8 = 17ff27ff 17ff37ff
ffff8803d5780cc0 708052476 C Co:1:042:0 0 8 >
ffff8803d5780cc0 708067198 S Co:1:042:0 s 21 09 0300 0000 0008 8 = f7ff17ff a7ffe7ff
ffff8803d5780cc0 708067326 C Co:1:042:0 0 8 >
ffff8802486c6e40 708083342 S Co:1:042:0 s 21 09 0300 0000 0008 8 = f7ff97ff 97ffa7ff
ffff8802486c6e40 708083475 C Co:1:042:0 0 8 >
ffff8803d5780cc0 708099985 S Co:1:042:0 s 21 09 0300 0000 0008 8 = d7ffb7ff 97ffc7ff
ffff8803d5780cc0 708100205 C Co:1:042:0 0 8 >
ffff8804038620c0 708115830 S Co:1:042:0 s 21 09 0300 0000 0008 8 = 97ff37ff 37ff27ff
ffff8804038620c0 708115952 C Co:1:042:0 0 8 >
ffff88025ad1fb40 708130926 S Co:1:042:0 s 21 09 0300 0000 0008 8 = 47fff7ff 77fff7ff
ffff88025ad1fb40 708131081 C Co:1:042:0 0 8 >
ffff8803d57809c0 708145899 S Co:1:042:0 s 21 09 0300 0000 0008 8 = 07ffc7ff 77ff67ff
ffff8803d57809c0 708146076 C Co:1:042:0 0 8 >
ffff8803d5780a80 708160945 S Co:1:042:0 s 21 09 0300 0000 0008 8 = 67ff97ff 97ff87ff
ffff8803d5780a80 708161203 C Co:1:042:0 0 8 >
ffff8802486c60c0 708177888 S Co:1:042:0 s 21 09 0300 0000 0008 8 = 17ff87ff 57ff97ff
ffff8802486c60c0 708178110 C Co:1:042:0 0 8 >
ffff8802486c6c00 708192953 S Co:1:042:0 s 21 09 0300 0000 0008 8 = c7ffa7ff 57ffd7ff
ffff8802486c6c00 708193104 C Co:1:042:0 0 8 >
ffff8802486c60c0 708207988 S Co:1:042:0 s 21 09 0300 0000 0008 8 = 27ffa7ff 97ff97ff
ffff8802486c60c0 708208228 C Co:1:042:0 0 8 >
ffff8803d57809c0 708224896 S Co:1:042:0 s 21 09 0300 0000 0008 8 = 57fff7ff c7ffe7ff
ffff8803d57809c0 708225103 C Co:1:042:0 0 8 >
ffff88025ad1f600 708239969 S Co:1:042:0 s 21 09 0300 0000 0008 8 = 77fff7ff 37ffc7ff
ffff88025ad1f600 708240207 C Co:1:042:0 0 8 >
ffff88025ad1f600 708254927 S Co:1:042:0 s 21 09 0300 0000 0008 8 = 97ff87ff d7ffe7ff
ffff88025ad1f600 708255100 C Co:1:042:0 0 8 >
ffff88025ad1f600 708270874 S Co:1:042:0 s 21 09 0300 0000 0008 8 = c7ff17ff 37ff67ff
ffff88025ad1f600 708271102 C Co:1:042:0 0 8 >
ffff88025ad1fa80 708286916 S Co:1:042:0 s 21 09 0300 0000 0008 8 = 67ff47ff 477bd97b
ffff88025ad1fa80 708287082 C Co:1:042:0 0 8 >
ffff88025ad1fa80 708301895 S Co:1:042:0 s 21 09 0300 0000 0008 8 = ca284147 ad9ec355
ffff88025ad1fa80 708302079 C Co:1:042:0 0 8 >
ffff8802486c60c0 708319989 S Co:1:042:0 s 21 09 0300 0000 0008 8 = f88cca5f 6ad7a77d
ffff8802486c60c0 708320205 C Co:1:042:0 0 8 >
ffff8803d5780f00 708332841 S Co:1:042:0 s 21 09 0300 0000 0008 8 = 2c816db6 d4d612c7
ffff8803d5780f00 708332954 C Co:1:042:0 0 8 >
ffff880403862b40 708348943 S Co:1:042:0 s 21 09 0300 0000 0008 8 = 9cd8c332 dfed878a
ffff880403862b40 708349109 C Co:1:042:0 0 8 >
ffff8802486c66c0 708364986 S Co:1:042:0 s 21 09 0300 0000 0008 8 = d5c718fe 9094ff25
ffff8802486c66c0 708365204 C Co:1:042:0 0 8 >
ffff880403862b40 708379843 S Co:1:042:0 s 21 09 0300 0000 0008 8 = 3668ee09 80e76276
ffff880403862b40 708379975 C Co:1:042:0 0 8 >
ffff88025ad1fa80 708395932 S Co:1:042:0 s 21 09 0300 0000 0008 8 = 74377984 5e251162
ffff88025ad1fa80 708396104 C Co:1:042:0 0 8 >
ffff88025ad1f180 708411063 S Co:1:042:0 s 21 09 0300 0000 0008 8 = 15962366 6c305e53
ffff88025ad1f180 708411231 C Co:1:042:0 0 8 >
ffff8803d5780f00 708427848 S Co:1:042:0 s 21 09 0300 0000 0008 8 = f64a07e9 ff1210b3
ffff8803d5780f00 708427971 C Co:1:042:0 0 8 >
ffff8802486c6600 708442921 S Co:1:042:0 s 21 09 0300 0000 0008 8 = c8fd780c 0274e273
ffff8802486c6600 708443085 C Co:1:042:0 0 8 >
ffff8802486c6600 708459924 S Co:1:042:0 s 21 09 0300 0000 0008 8 = 8dbd7911 71270389
ffff8802486c6600 708460100 C Co:1:042:0 0 8 >
ffff8802486c6600 708475006 S Co:1:042:0 s 21 09 0300 0000 0008 8 = 1d7944ff e09d956b
ffff8802486c6600 708475217 C Co:1:042:0 0 8 >
ffff880403862900 708491567 S Co:1:042:0 s 21 09 0300 0000 0008 8 = a689c520 f46e3097
ffff880403862900 708491711 C Co:1:042:0 0 8 >
ffff88025ad1f180 708505566 S Co:1:042:0 s 21 09 0300 0000 0008 8 = 25251e81 e6d65f0d
ffff88025ad1f180 708505716 C Co:1:042:0 0 8 >
ffff8802486c6600 708520672 S Co:1:042:0 s 21 09 0300 0000 0008 8 = f0ea2477 05341fd2
ffff8802486c6600 708520835 C Co:1:042:0 0 8 >
ffff88025ad1f600 708536476 S Co:1:042:0 s 21 09 0300 0000 0008 8 = 2e5bde16 338b656c
ffff88025ad1f600 708536580 C Co:1:042:0 0 8 >
ffff8802486c6840 708552559 S Co:1:042:0 s 21 09 0300 0000 0008 8 = 5b5c0bba 6502976a
ffff8802486c6840 708552709 C Co:1:042:0 0 8 >
ffff8803d5780a80 708567600 S Co:1:042:0 s 21 09 0300 0000 0008 8 = c6b79a80 25650fdc
ffff8803d5780a80 708567715 C Co:1:042:0 0 8 >
ffff8803d5780b40 708583468 S Co:1:042:0 s 21 09 0300 0000 0008 8 = 159832cb 12a49ed5
ffff8803d5780b40 708583582 C Co:1:042:0 0 8 >
ffff8804038629c0 708599572 S Co:1:042:0 s 21 09 0300 0000 0008 8 = be13aac2 5c5105ee
ffff8804038629c0 708599709 C Co:1:042:0 0 8 >
ffff88025ad1f600 708614595 S Co:1:042:0 s 21 09 0300 0000 0008 8 = 8d9b8fcf 4b257bc4
ffff88025ad1f600 708614710 C Co:1:042:0 0 8 >
ffff88025ad1fb40 708630641 S Co:1:042:0 s 21 09 0300 0000 0008 8 = 238aa420 b77a2c77
ffff88025ad1fb40 708630848 C Co:1:042:0 0 8 >
ffff8804038620c0 708645737 S Co:1:042:0 s 21 09 0300 0000 0008 8 = 739e5b28 8fcfb62b
ffff8804038620c0 708645831 C Co:1:042:0 0 8 >
ffff88025ad1ff00 708661584 S Co:1:042:0 s 21 09 0300 0000 0008 8 = 46795f1c 5449ad89
ffff88025ad1ff00 708661725 C Co:1:042:0 0 8 >
ffff8803d5780b40 708677614 S Co:1:042:0 s 21 09 0300 0000 0008 8 = b61e0b78 9d2f163c
ffff8803d5780b40 708677733 C Co:1:042:0 0 8 >
ffff8803d5780cc0 708692515 S Co:1:042:0 s 21 09 0300 0000 0008 8 = b478f27a 946bed77
ffff8803d5780cc0 708692734 C Co:1:042:0 0 8 >
ffff8803ed332b40 708708969 S Co:1:042:0 s 21 09 0300 0000 0008 8 = 84d558a4 750ea16b
ffff8803ed332b40 708709207 C Co:1:042:0 0 8 >
ffff8803ed332b40 708723627 S Co:1:042:0 s 21 09 0300 0000 0008 8 = 3d64b53c 14ca95d4
ffff8803ed332b40 708723832 C Co:1:042:0 0 8 >
ffff8803ed332b40 708739556 S Co:1:042:0 s 21 09 0300 0000 0008 8 = 4cbd37cd 55779f6b
ffff8803ed332b40 708739716 C Co:1:042:0 0 8 >
ffff8803ed332b40 708755556 S Co:1:042:0 s 21 09 0300 0000 0008 8 = f1583ea5 b3918b73
ffff8803ed332b40 708755726 C Co:1:042:0 0 8 >
ffff8803ed332b40 708770763 S Co:1:042:0 s 21 09 0300 0000 0008 8 = be13e057 bcb7972f
ffff8803ed332b40 708770965 C Co:1:042:0 0 8 >
ffff8803ed332b40 708788523 S Co:1:042:0 s 21 09 0300 0000 0008 8 = 1dae6539 922cf667
ffff8803ed332b40 708788711 C Co:1:042:0 0 8 >
ffff8803d57800c0 708803541 S Co:1:042:0 s 21 09 0300 0000 0008 8 = c850cae5 69574fe9
ffff8803d57800c0 708803712 C Co:1:042:0 0 8 >
ffff8802486c6600 708818597 S Co:1:042:0 s 21 09 0300 0000 0008 8 = 51023fba 0e453d03
ffff8802486c6600 708818710 C Co:1:042:0 0 8 >
ffff8804039906c0 708835428 S Co:1:042:0 s 21 09 0300 0000 0008 8 = 9a31ab5a 5c23ce0c
ffff8804039906c0 708835584 C Co:1:042:0 0 8 >
ffff88040541c540 708849315 S Co:1:042:0 s 21 09 0300 0000 0008 8 = 5c2e262c c6c707db
ffff88040541c540 708849477 C Co:1:042:0 0 8 >
ffff88040541c540 708865462 S Co:1:042:0 s 21 09 0300 0000 0008 8 = a3b07cd9 d3265d4c
ffff88040541c540 708865617 C Co:1:042:0 0 8 >
ffff88040541c240 708880459 S Co:1:042:0 s 21 09 0300 0000 0008 8 = 4d4eaed1 9bdd3bc1
ffff88040541c240 708880589 C Co:1:042:0 0 8 >
ffff88040541c240 708895351 S Co:1:042:0 s 21 09 0300 0000 0008 8 = 900772c5 4cab809c
ffff88040541c240 708895476 C Co:1:042:0 0 8 >
ffff88040541c240 708911397 S Co:1:042:0 s 21 09 0300 0000 0008 8 = 73bcb02c aaf300c8
ffff88040541c240 708911587 C Co:1:042:0 0 8 >
ffff88040541c240 708928451 S Co:1:042:0 s 21 09 0300 0000 0008 8 = 52b305c0 893c012f
ffff88040541c240 708928590 C Co:1:042:0 0 8 >
ffff88040541c240 708942208 S Co:1:042:0 s 21 09 0300 0000 0008 8 = 5d144201 53b3bd43
ffff88040541c240 708942333 C Co:1:042:0 0 8 >
ffff88040541c240 708958173 S Co:1:042:0 s 21 09 0300 0000 0008 8 = 186eecaf 86a5e577
ffff88040541c240 708958338 C Co:1:042:0 0 8 >
ffff88040541c240 708973146 S Co:1:042:0 s 21 09 0300 0000 0008 8 = da30bb52 34081ac5
ffff88040541c240 708973334 C Co:1:042:0 0 8 >
ffff88040541c240 708989248 S Co:1:042:0 s 21 09 0300 0000 0008 8 = 50321db3 83f17328
ffff88040541c240 708989337 C Co:1:042:0 0 8 >
ffff88040541c240 709005096 S Co:1:042:0 s 21 09 0300 0000 0008 8 = f92cb362 2d1dfc21
ffff88040541c240 709005209 C Co:1:042:0 0 8 >
ffff88040541c240 709020235 S Co:1:042:0 s 21 09 0300 0000 0008 8 = a93cd131 006b3335
ffff88040541c240 709020349 C Co:1:042:0 0 8 >
ffff88040541c240 709036249 S Co:1:042:0 s 21 09 0300 0000 0008 8 = 096300b5 5d5e8c6b
ffff88040541c240 709036336 C Co:1:042:0 0 8 >
ffff88040541c540 709052146 S Co:1:042:0 s 21 09 0300 0000 0008 8 = 13067dca bb9decd0
ffff88040541c540 709052367 C Co:1:042:0 0 8 >
ffff88040541c240 709067227 S Co:1:042:0 s 21 09 0300 0000 0008 8 = 996fba0d 23752ff4
ffff88040541c240 709067359 C Co:1:042:0 0 8 >
ffff88040541c540 709084090 S Co:1:042:0 s 21 09 0300 0000 0008 8 = bd4ada62 b354a46c
ffff88040541c540 709084217 C Co:1:042:0 0 8 >
ffff88040541c540 709098904 S Co:1:042:0 s 21 09 0300 0000 0008 8 = 782b366e 1d4d8e51
ffff88040541c540 709099085 C Co:1:042:0 0 8 >
ffff88040541c540 709114007 S Co:1:042:0 s 21 09 0300 0000 0008 8 = 1505dd1c 2799a3be
ffff88040541c540 709114214 C Co:1:042:0 0 8 >
ffff8802486c6c00 709130025 S Co:1:042:0 s 21 09 0300 0000 0008 8 = b4b30d1a 2b128f54
ffff8802486c6c00 709130216 C Co:1:042:0 0 8 >
ffff8803ed3329c0 709147024 S Co:1:042:0 s 21 09 0300 0000 0008 8 = ca71bd5b 97b770b7
ffff8803ed3329c0 709147230 C Co:1:042:0 0 8 >
ffff8803ed3329c0 709160943 S Co:1:042:0 s 21 09 0300 0000 0008 8 = 9e611694 6c2d5910
ffff8803ed3329c0 709161108 C Co:1:042:0 0 8 >
ffff8803ed332b40 709177016 S Co:1:042:0 s 21 09 0300 0000 0008 8 = cc09f3c2 c13bd18b
ffff8803ed332b40 709177216 C Co:1:042:0 0 8 >
ffff8803ed332b40 709193024 S Co:1:042:0 s 21 09 0300 0000 0008 8 = c4d167a0 3f4b52d8
ffff8803ed332b40 709193230 C Co:1:042:0 0 8 >
ffff8803ed332b40 709210002 S Co:1:042:0 s 21 09 0300 0000 0008 8 = 49883533 a4eecdac
ffff8803ed332b40 709210216 C Co:1:042:0 0 8 >
ffff8803ed332b40 709225024 S Co:1:042:0 s 21 09 0300 0000 0008 8 = f4de5741 4257233f
ffff8803ed332b40 709225217 C Co:1:042:0 0 8 >
ffff8803ed332b40 709241085 S Co:1:042:0 s 21 09 0300 0000 0008 8 = b1e879d3 7fdcacce
ffff8803ed332b40 709241222 C Co:1:042:0 0 8 >
ffff8803ed332b40 709255920 S Co:1:042:0 s 21 09 0300 0000 0008 8 = 3fa27db8 557ab219
ffff8803ed332b40 709256087 C Co:1:042:0 0 8 >
ffff880403862600 709271029 S Co:1:042:0 s 21 09 0300 0000 0008 8 = b266f703 d150f5e4
ffff880403862600 709271216 C Co:1:042:0 0 8 >
ffff88025ad1f000 709288059 S Co:1:042:0 s 21 09 0300 0000 0008 8 = f278b18a 96212777
ffff88025ad1f000 709288216 C Co:1:042:0 0 8 >
ffff88025ad1f000 709303084 S Co:1:042:0 s 21 09 0300 0000 0008 8 = 3b7c2667 5ad56e20
ffff88025ad1f000 709303240 C Co:1:042:0 0 8 >
ffff88025ad1f000 709317970 S Co:1:042:0 s 21 09 0300 0000 0008 8 = 9efc097a 65f6e7ae
ffff88025ad1f000 709318216 C Co:1:042:0 0 8 >
ffff8802486c6480 709333028 S Co:1:042:0 s 21 09 0300 0000 0008 8 = 7ce5bde3 17351ff6
ffff8802486c6480 709333218 C Co:1:042:0 0 8 >
ffff880403862600 709350079 S Co:1:042:0 s 21 09 0300 0000 0008 8 = 1009dc89 61e49a50
ffff880403862600 709350212 C Co:1:042:0 0 8 >
ffff880403862600 709364921 S Co:1:042:0 s 21 09 0300 0000 0008 8 = e49cb398 497c4f18
ffff880403862600 709365090 C Co:1:042:0 0 8 >
ffff880403862600 709379952 S Co:1:042:0 s 21 09 0300 0000 0008 8 = 58b9c2fc 69172730
ffff880403862600 709380213 C Co:1:042:0 0 8 >
ffff88025ad1f000 709397088 S Co:1:042:0 s 21 09 0300 0000 0008 8 = 21dc3eea 6ef5847a
ffff88025ad1f000 709397231 C Co:1:042:0 0 8 >
ffff88025ad1f000 709411008 S Co:1:042:0 s 21 09 0300 0000 0008 8 = c6679156 9bf9b661
ffff88025ad1f000 709411219 C Co:1:042:0 0 8 >
ffff880403862600 709427952 S Co:1:042:0 s 21 09 0300 0000 0008 8 = 2220d77c 462b854f
ffff880403862600 709428089 C Co:1:042:0 0 8 >
ffff8804038620c0 709442990 S Co:1:042:0 s 21 09 0300 0000 0008 8 = e7af6059 5735ac36
ffff8804038620c0 709443214 C Co:1:042:0 0 8 >
ffff8803d5780240 709458502 S Co:1:042:0 s 21 09 0300 0000 0008 8 = 17233330 cee85a0a
ffff8803d5780240 709458619 C Co:1:042:0 0 8 >
ffff880403862600 709475004 S Co:1:042:0 s 21 09 0300 0000 0008 8 = 8b6c8708 3cb7b243
ffff880403862600 709475246 C Co:1:042:0 0 8 >
ffff880403862600 709490049 S Co:1:042:0 s 21 09 0300 0000 0008 8 = 6ee04a2b 47384a5d
ffff880403862600 709490239 C Co:1:042:0 0 8 >
ffff880403862600 709505069 S Co:1:042:0 s 21 09 0300 0000 0008 8 = c1b89ca7 29a8ae59
ffff880403862600 709505220 C Co:1:042:0 0 8 >
ffff880403862600 709521943 S Co:1:042:0 s 21 09 0300 0000 0008 8 = d79252cf 2f66dc3c
ffff880403862600 709522108 C Co:1:042:0 0 8 >
ffff8802486c6480 709536970 S Co:1:042:0 s 21 09 0300 0000 0008 8 = d8ee76b8 3c75c78d
ffff8802486c6480 709537215 C Co:1:042:0 0 8 >
ffff88025ad1f000 709553012 S Co:1:042:0 s 21 09 0300 0000 0008 8 = 40b4c4be 45fdd6d9
ffff88025ad1f000 709553231 C Co:1:042:0 0 8 >
ffff88025ad1f000 709567960 S Co:1:042:0 s 21 09 0300 0000 0008 8 = 5faa2dff d5c86331
ffff88025ad1f000 709568110 C Co:1:042:0 0 8 >
ffff88025ad1f840 709584014 S Co:1:042:0 s 21 09 0300 0000 0008 8 = d90156dc 89c73fa8
ffff88025ad1f840 709584218 C Co:1:042:0 0 8 >
ffff88025ad1f840 709599049 S Co:1:042:0 s 21 09 0300 0000 0008 8 = 25c7177e 928d2bd8
ffff88025ad1f840 709599238 C Co:1:042:0 0 8 >
ffff88025ad1f840 709614959 S Co:1:042:0 s 21 09 0300 0000 0008 8 = 1074fe4d 38d15f5c
ffff88025ad1f840 709615114 C Co:1:042:0 0 8 >
ffff8803d5780900 709630010 S Co:1:042:0 s 21 09 0300 0000 0008 8 = 395fcb78 54ee0555
ffff8803d5780900 709630238 C Co:1:042:0 0 8 >
ffff8802486c6840 709646045 S Co:1:042:0 s 21 09 0300 0000 0008 8 = 9548f472 d364bde7
ffff8802486c6840 709646239 C Co:1:042:0 0 8 >
ffff8803d5780cc0 709663094 S Co:1:042:0 s 21 09 0300 0000 0008 8 = eace2171 385618bb
ffff8803d5780cc0 709663218 C Co:1:042:0 0 8 >
ffff8803a0172780 709677996 S Co:1:042:0 s 21 09 0300 0000 0008 8 = 56f8afef 180b1f7d
ffff8803a0172780 709678218 C Co:1:042:0 0 8 >
ffff8802486c6840 709693032 S Co:1:042:0 s 21 09 0300 0000 0008 8 = c7ae2f2b 9d70cc5d
ffff8802486c6840 709693240 C Co:1:042:0 0 8 >
ffff8802486c6e40 709708371 S Co:1:042:0 s 21 09 0300 0000 0008 8 = 823fe6a7 06938d91
ffff8802486c6e40 709708479 C Co:1:042:0 0 8 >
ffff880403862540 709724994 S Co:1:042:0 s 21 09 0300 0000 0008 8 = 9fdb4ca9 2427c6cf
ffff880403862540 709725217 C Co:1:042:0 0 8 >
ffff880403862180 709740016 S Co:1:042:0 s 21 09 0300 0000 0008 8 = 89188fbc dc054dd5
ffff880403862180 709740219 C Co:1:042:0 0 8 >
ffff880403862b40 709755145 S Co:1:042:0 s 21 09 0300 0000 0008 8 = 816f102f aaa7eee3
ffff880403862b40 709755350 C Co:1:042:0 0 8 >
ffff880403862900 709770956 S Co:1:042:0 s 21 09 0300 0000 0008 8 = 19bee393 1aade73d
ffff880403862900 709771120 C Co:1:042:0 0 8 >
ffff8803d5780f00 709787009 S Co:1:042:0 s 21 09 0300 0000 0008 8 = bbc6513f 4f5a6bab
ffff8803d5780f00 709787240 C Co:1:042:0 0 8 >
ffff8803d5780cc0 709802041 S Co:1:042:0 s 21 09 0300 0000 0008 8 = 22ac57ce 7e1622fb
ffff8803d5780cc0 709802241 C Co:1:042:0 0 8 >
ffff880403862900 709817681 S Co:1:042:0 s 21 09 0300 0000 0008 8 = de7a269d 71eca57c
ffff880403862900 709817867 C Co:1:042:0 0 8 >
ffff8802486c6300 709833517 S Co:1:042:0 s 21 09 0300 0000 0008 8 = d39da34f 070b0483
ffff8802486c6300 709833591 C Co:1:042:0 0 8 >
ffff880403990780 709849563 S Co:1:042:0 s 21 09 0300 0000 0008 8 = b867e74b b04641e8
ffff880403990780 709849735 C Co:1:042:0 0 8 >
ffff880403990780 709864612 S Co:1:042:0 s 21 09 0300 0000 0008 8 = 998cbe3a f496d588
ffff880403990780 709864725 C Co:1:042:0 0 8 >
ffff880403990780 709881572 S Co:1:042:0 s 21 09 0300 0000 0008 8 = 57a72a8c eb9528c3
ffff880403990780 709881719 C Co:1:042:0 0 8 >
ffff880403990780 709896611 S Co:1:042:0 s 21 09 0300 0000 0008 8 = 26b4dff3 c4031bfd
ffff880403990780 709896732 C Co:1:042:0 0 8 >
ffff880403862480 709911647 S Co:1:042:0 s 21 09 0300 0000 0008 8 = 0c96c6e4 4143801e
ffff880403862480 709911847 C Co:1:042:0 0 8 >
ffff88025ad1f480 709928568 S Co:1:042:0 s 21 09 0300 0000 0008 8 = 66917c1b 37dd9e14
ffff88025ad1f480 709928723 C Co:1:042:0 0 8 >
ffff8803d5780d80 709943560 S Co:1:042:0 s 21 09 0300 0000 0008 8 = 64ced215 10fcb04e
ffff8803d5780d80 709943717 C Co:1:042:0 0 8 >
ffff8803d5780d80 709958587 S Co:1:042:0 s 21 09 0300 0000 0008 8 = 8adc4e96 4bef6440
ffff8803d5780d80 709958718 C Co:1:042:0 0 8 >
ffff880403862480 709973675 S Co:1:042:0 s 21 09 0300 0000 0008 8 = 302ba623 f8a95ee4
ffff880403862480 709973846 C Co:1:042:0 0 8 >
ffff88025ad1f6c0 709989514 S Co:1:042:0 s 21 09 0300 0000 0008 8 = 01914a87 3f43b536
ffff88025ad1f6c0 709989717 C Co:1:042:0 0 8 >
ffff8802486c69c0 710004597 S Co:1:042:0 s 21 09 0300 0000 0008 8 = 7dc7d950 d87773b5
ffff8802486c69c0 710004743 C Co:1:042:0 0 8 >
ffff880403862480 710021656 S Co:1:042:0 s 21 09 0300 0000 0008 8 = 79eba851 922518e7
ffff880403862480 710021857 C Co:1:042:0 0 8 >
ffff880403862cc0 710035620 S Co:1:042:0 s 21 09 0300 0000 0008 8 = 9cfe401f ced015d3
ffff880403862cc0 710035737 C Co:1:042:0 0 8 >
ffff880403862cc0 710051557 S Co:1:042:0 s 21 09 0300 0000 0008 8 = e165df96 03205386
ffff880403862cc0 710051738 C Co:1:042:0 0 8 >
ffff8802486c6a80 710068653 S Co:1:042:0 s 21 09 0300 0000 0008 8 = 1a6af454 3b60ab91
ffff8802486c6a80 710068866 C Co:1:042:0 0 8 >
ffff880403990780 710084505 S Co:1:042:0 s 21 09 0300 0000 0008 8 = 69bba53b 92ff6e88
ffff880403990780 710084737 C Co:1:042:0 0 8 >
ffff880403990840 710098594 S Co:1:042:0 s 21 09 0300 0000 0008 8 = c7e74bf1 bb11dd82
ffff880403990840 710098737 C Co:1:042:0 0 8 >
ffff8803a0172600 710114618 S Co:1:042:0 s 21 09 0300 0000 0008 8 = 80e6f361 7dccaf9d
ffff8803a0172600 710114749 C Co:1:042:0 0 8 >
ffff8803a0172600 710129607 S Co:1:042:0 s 21 09 0300 0000 0008 8 = b290dd3a 300e907a
ffff8803a0172600 710129738 C Co:1:042:0 0 8 >
ffff8802486c6a80 710145565 S Co:1:042:0 s 21 09 0300 0000 0008 8 = d322fe6d 43d49ebb
ffff8802486c6a80 710145743 C Co:1:042:0 0 8 >
ffff880403990840 710161628 S Co:1:042:0 s 21 09 0300 0000 0008 8 = 2abf80b1 b7c2ec8a
ffff880403990840 710161744 C Co:1:042:0 0 8 >
ffff880403990840 710176654 S Co:1:042:0 s 21 09 0300 0000 0008 8 = 54ea3f00 a3a00113
ffff880403990840 710176849 C Co:1:042:0 0 8 >
ffff880403990840 710192571 S Co:1:042:0 s 21 09 0300 0000 0008 8 = bf0f4b19 b0d85907
ffff880403990840 710192743 C Co:1:042:0 0 8 >
ffff880403990840 710207633 S Co:1:042:0 s 21 09 0300 0000 0008 8 = 2ffa6bfe 9dfbe119
ffff880403990840 710207720 C Co:1:042:0 0 8 >
ffff88025ad1f3c0 710224658 S Co:1:042:0 s 21 09 0300 0000 0008 8 = 3e5c9676 ba3c7c83
ffff88025ad1f3c0 710224853 C Co:1:042:0 0 8 >
ffff88025ad1f9c0 710239494 S Co:1:042:0 s 21 09 0300 0000 0008 8 = d54b798a 6ef28280
ffff88025ad1f9c0 710239597 C Co:1:042:0 0 8 >
ffff8802486c6cc0 710254582 S Co:1:042:0 s 21 09 0300 0000 0008 8 = b7c0f70a b3183ed0
ffff8802486c6cc0 710254743 C Co:1:042:0 0 8 >
ffff8802486c6cc0 710271583 S Co:1:042:0 s 21 09 0300 0000 0008 8 = f519a207 97ce6d3a
ffff8802486c6cc0 710271739 C Co:1:042:0 0 8 >
ffff880403862cc0 710286680 S Co:1:042:0 s 21 09 0300 0000 0008 8 = 79974558 bbd8c404
ffff880403862cc0 710286870 C Co:1:042:0 0 8 >
ffff88025ad1f540 710301568 S Co:1:042:0 s 21 09 0300 0000 0008 8 = 7de05c18 d61b697a
ffff88025ad1f540 710301744 C Co:1:042:0 0 8 >
ffff88025ad1f540 710318622 S Co:1:042:0 s 21 09 0300 0000 0008 8 = 137c9724 3125776f
ffff88025ad1f540 710318791 C Co:1:042:0 0 8 >
ffff88025ad1f540 710333682 S Co:1:042:0 s 21 09 0300 0000 0008 8 = 9d595da0 2aa47db5
ffff88025ad1f540 710333876 C Co:1:042:0 0 8 >
ffff88025ad1f540 710348567 S Co:1:042:0 s 21 09 0300 0000 0008 8 = 53494571 b4ecfda5
ffff88025ad1f540 710348761 C Co:1:042:0 0 8 >
ffff880403862cc0 710365622 S Co:1:042:0 s 21 09 0300 0000 0008 8 = c3819dc1 d374ef9c
ffff880403862cc0 710365725 C Co:1:042:0 0 8 >
ffff880403862cc0 710380597 S Co:1:042:0 s 21 09 0300 0000 0008 8 = 4a19e580 22573d7a
ffff880403862cc0 710380720 C Co:1:042:0 0 8 >
ffff880403862300 710395552 S Co:1:042:0 s 21 09 0300 0000 0008 8 = 9e9153e0 4ed54623
ffff880403862300 710395746 C Co:1:042:0 0 8 >
ffff88025ad1f540 710412550 S Co:1:042:0 s 21 09 0300 0000 0008 8 = 46484fd6 9bd25eff
ffff88025ad1f540 710412721 C Co:1:042:0 0 8 >
ffff8804038626c0 710427583 S Co:1:042:0 s 21 09 0300 0000 0008 8 = 1e05f69e 5c534a7c
ffff8804038626c0 710427722 C Co:1:042:0 0 8 >
ffff88025ad1f540 710444591 S Co:1:042:0 s 21 09 0300 0000 0008 8 = d6719936 7d06c789
ffff88025ad1f540 710444753 C Co:1:042:0 0 8 >
ffff8803d5780900 710457768 S Co:1:042:0 s 21 09 0300 0000 0008 8 = 71993ddf fbb9021b
ffff8803d5780900 710457968 C Co:1:042:0 0 8 >
ffff8803d5780900 710474625 S Co:1:042:0 s 21 09 0300 0000 0008 8 = c96e1aa2 68e01faa
ffff8803d5780900 710474747 C Co:1:042:0 0 8 >
ffff8802486c6cc0 710489668 S Co:1:042:0 s 21 09 0300 0000 0008 8 = 07461ec7 6b12b4b2
ffff8802486c6cc0 710489849 C Co:1:042:0 0 8 >
ffff8802486c6cc0 710504564 S Co:1:042:0 s 21 09 0300 0000 0008 8 = 2d5b695d 3b8a4d35
ffff8802486c6cc0 710504727 C Co:1:042:0 0 8 >
ffff8802486c6180 710521619 S Co:1:042:0 s 21 09 0300 0000 0008 8 = 8e49d1b7 29a8e836
ffff8802486c6180 710521737 C Co:1:042:0 0 8 >
ffff88025ad1f540 710536659 S Co:1:042:0 s 21 09 0300 0000 0008 8 = 53925eea 1570783d
ffff88025ad1f540 710536881 C Co:1:042:0 0 8 >
ffff8803ed332b40 710551745 S Co:1:042:0 s 21 09 0300 0000 0008 8 = f61bcd53 f60864d8
ffff8803ed332b40 710551856 C Co:1:042:0 0 8 >
ffff8803ed3329c0 710568563 S Co:1:042:0 s 21 09 0300 0000 0008 8 = c8ae0f0d 543b0815
ffff8803ed3329c0 710568723 C Co:1:042:0 0 8 >
ffff8803d5780240 710583605 S Co:1:042:0 s 21 09 0300 0000 0008 8 = 6d79c97d cffb310b
ffff8803d5780240 710583724 C Co:1:042:0 0 8 >
ffff8803d5780d80 710598540 S Co:1:042:0 s 21 09 0300 0000 0008 8 = 5d8cd4c9 99d8a251
ffff8803d5780d80 710598729 C Co:1:042:0 0 8 >
ffff8803d5780d80 710614583 S Co:1:042:0 s 21 09 0300 0000 0008 8 = 635cbc5a f68c9383
ffff8803d5780d80 710614727 C Co:1:042:0 0 8 >
ffff8803d5780d80 710630641 S Co:1:042:0 s 21 09 0300 0000 0008 8 = 1f444360 c0722fc3
ffff8803d5780d80 710630752 C Co:1:042:0 0 8 >
ffff88025ad1f3c0 710645668 S Co:1:042:0 s 21 09 0300 0000 0008 8 = 8601dd4c e7081333
ffff88025ad1f3c0 710645849 C Co:1:042:0 0 8 >
ffff88025ad1f3c0 710663589 S Co:1:042:0 s 21 09 0300 0000 0008 8 = 5f333355 eb72d47d
ffff88025ad1f3c0 710663728 C Co:1:042:0 0 8 >
ffff88025ad1f540 710676764 S Co:1:042:0 s 21 09 0300 0000 0008 8 = c5e1a2f5 62f8784e
ffff88025ad1f540 710676997 C Co:1:042:0 0 8 >
ffff8803ed332a80 710692597 S Co:1:042:0 s 21 09 0300 0000 0008 8 = aaf4bb6b 7785fad4
ffff8803ed332a80 710692723 C Co:1:042:0 0 8 >
ffff8803ed332a80 710708578 S Co:1:042:0 s 21 09 0300 0000 0008 8 = 50b9c33a 6728c846
ffff8803ed332a80 710708759 C Co:1:042:0 0 8 >
ffff8803ed332a80 710724611 S Co:1:042:0 s 21 09 0300 0000 0008 8 = d06133a6 0495475a
ffff8803ed332a80 710724751 C Co:1:042:0 0 8 >
ffff8803ed332a80 710739651 S Co:1:042:0 s 21 09 0300 0000 0008 8 = 9682383c 34a34bce
ffff8803ed332a80 710739874 C Co:1:042:0 0 8 >
ffff8803ed3329c0 710756589 S Co:1:042:0 s 21 09 0300 0000 0008 8 = e1963149 71cda1e2
ffff8803ed3329c0 710756757 C Co:1:042:0 0 8 >
ffff8803ed3329c0 710770571 S Co:1:042:0 s 21 09 0300 0000 0008 8 = 4579365f 48b388db
ffff8803ed3329c0 710770747 C Co:1:042:0 0 8 >
ffff8803ed332a80 710786627 S Co:1:042:0 s 21 09 0300 0000 0008 8 = 2aed8dd5 dc993180
ffff8803ed332a80 710786731 C Co:1:042:0 0 8 >
ffff8803ed3329c0 710803294 S Co:1:042:0 s 21 09 0300 0000 0008 8 = 4c183446 62e5459e
ffff8803ed3329c0 710803496 C Co:1:042:0 0 8 >
ffff8803ed332a80 710818366 S Co:1:042:0 s 21 09 0300 0000 0008 8 = 3b025d10 a5a35d85
ffff8803ed332a80 710818493 C Co:1:042:0 0 8 >
ffff8803ed332a80 710833363 S Co:1:042:0 s 21 09 0300 0000 0008 8 = db19ebd4 8202898a
ffff8803ed332a80 710833475 C Co:1:042:0 0 8 >
ffff8803ed332a80 710849464 S Co:1:042:0 s 21 09 0300 0000 0008 8 = e3aff8fa 6bd6cc86
ffff8803ed332a80 710849604 C Co:1:042:0 0 8 >
ffff8803ed332a80 710864364 S Co:1:042:0 s 21 09 0300 0000 0008 8 = 6079502c e5169d54
ffff8803ed332a80 710864502 C Co:1:042:0 0 8 >
ffff8803ed332a80 710882440 S Co:1:042:0 s 21 09 0300 0000 0008 8 = 3110f5d8 0c5d6554
ffff8803ed332a80 710882662 C Co:1:042:0 0 8 >
ffff8803ed332a80 710895574 S Co:1:042:0 s 21 09 0300 0000 0008 8 = 8b729bb1 0c6b05ed
ffff8803ed332a80 710895819 C Co:1:042:0 0 8 >
ffff8803ed332a80 710911411 S Co:1:042:0 s 21 09 0300 0000 0008 8 = 747f2c2c a8a45004
ffff8803ed332a80 710911648 C Co:1:042:0 0 8 >
ffff8803ed332a80 710927343 S Co:1:042:0 s 21 09 0300 0000 0008 8 = 4a7e4405 b58e8b88
ffff8803ed332a80 710927476 C Co:1:042:0 0 8 >
ffff8803ed332a80 710942464 S Co:1:042:0 s 21 09 0300 0000 0008 8 = 3b98b3ba 9e55f2e8
ffff8803ed332a80 710942682 C Co:1:042:0 0 8 >
ffff8803ed332a80 710960366 S Co:1:042:0 s 21 09 0300 0000 0008 8 = cd5aff0d e0483499
ffff8803ed332a80 710960479 C Co:1:042:0 0 8 >
ffff8803ed332a80 710975338 S Co:1:042:0 s 21 09 0300 0000 0008 8 = 5535e284 8d5bf394
ffff8803ed332a80 710975498 C Co:1:042:0 0 8 >
ffff8803ed332a80 710990428 S Co:1:042:0 s 21 09 0300 0000 0008 8 = 8200c6ea caa547d3
ffff8803ed332a80 710990670 C Co:1:042:0 0 8 >
ffff8803ed3329c0 711005458 S Co:1:042:0 s 21 09 0300 0000 0008 8 = d1724ece 53e13bd9
ffff8803ed3329c0 711005630 C Co:1:042:0 0 8 >
ffff8803ed332a80 711020550 S Co:1:042:0 s 21 09 0300 0000 0008 8 = 18aacf01 f4f04c29
ffff8803ed332a80 711020752 C Co:1:042:0 0 8 >
ffff8803ed3329c0 711035951 S Co:1:042:0 s 21 09 0300 0000 0008 8 = fea9d019 1053efcb
ffff8803ed3329c0 711036119 C Co:1:042:0 0 8 >
ffff8803ed332a80 711053053 S Co:1:042:0 s 21 09 0300 0000 0008 8 = 7fd590f3 1cb30acd
ffff8803ed332a80 711053231 C Co:1:042:0 0 8 >
ffff8803ed332a80 711067947 S Co:1:042:0 s 21 09 0300 0000 0008 8 = 6b767f2b 225b78be
ffff8803ed332a80 711068105 C Co:1:042:0 0 8 >
ffff8803ed332a80 711083148 S Co:1:042:0 s 21 09 0300 0000 0008 8 = e53bc1a4 41ba8733
ffff8803ed332a80 711083356 C Co:1:042:0 0 8 >
ffff8803d5780f00 711100035 S Co:1:042:0 s 21 09 0300 0000 0008 8 = e7b4b104 2ae47b44
ffff8803d5780f00 711100231 C Co:1:042:0 0 8 >
ffff8803d5780f00 711114868 S Co:1:042:0 s 21 09 0300 0000 0008 8 = bad75937 a2100b0d
ffff8803d5780f00 711114977 C Co:1:042:0 0 8 >
ffff88025ad1f6c0 711130065 S Co:1:042:0 s 21 09 0300 0000 0008 8 = 807dfde9 051ae12f
ffff88025ad1f6c0 711130269 C Co:1:042:0 0 8 >
ffff8804038626c0 711147020 S Co:1:042:0 s 21 09 0300 0000 0008 8 = ade38f0f bf001c4f
ffff8804038626c0 711147253 C Co:1:042:0 0 8 >
ffff8804038626c0 711162080 S Co:1:042:0 s 21 09 0300 0000 0008 8 = 872c3a5d d266d094
ffff8804038626c0 711162256 C Co:1:042:0 0 8 >
ffff8804038626c0 711176981 S Co:1:042:0 s 21 09 0300 0000 0008 8 = abdcdace 5614822c
ffff8804038626c0 711177129 C Co:1:042:0 0 8 >
ffff8804038626c0 711194048 S Co:1:042:0 s 21 09 0300 0000 0008 8 = 8a5d8022 f275afc6
ffff8804038626c0 711194253 C Co:1:042:0 0 8 >
ffff8804038626c0 711209053 S Co:1:042:0 s 21 09 0300 0000 0008 8 = e67cf059 65194416
ffff8804038626c0 711209238 C Co:1:042:0 0 8 >
ffff880403862540 711223940 S Co:1:042:0 s 21 09 0300 0000 0008 8 = 57ea253b 02322556
ffff880403862540 711224120 C Co:1:042:0 0 8 >
ffff8802486c6540 711241005 S Co:1:042:0 s 21 09 0300 0000 0008 8 = cabecad2 2e18a8c1
ffff8802486c6540 711241254 C Co:1:042:0 0 8 >
ffff8802486c6540 711256029 S Co:1:042:0 s 21 09 0300 0000 0008 8 = ffefc0ec e2c61918
ffff8802486c6540 711256249 C Co:1:042:0 0 8 >
ffff8802486c63c0 711271117 S Co:1:042:0 s 21 09 0300 0000 0008 8 = 08dd9d9b 2d5d3620
ffff8802486c63c0 711271254 C Co:1:042:0 0 8 >
ffff880403862f00 711288001 S Co:1:042:0 s 21 09 0300 0000 0008 8 = cfc729b7 b09eb220
ffff880403862f00 711288260 C Co:1:042:0 0 8 >
ffff880403862f00 711303027 S Co:1:042:0 s 21 09 0300 0000 0008 8 = 8f53e158 2272b465
ffff880403862f00 711303253 C Co:1:042:0 0 8 >
ffff88025ad1f6c0 711318066 S Co:1:042:0 s 21 09 0300 0000 0008 8 = 580c765f cd6457c0
ffff88025ad1f6c0 711318258 C Co:1:042:0 0 8 >
ffff88025ad1f6c0 711334974 S Co:1:042:0 s 21 09 0300 0000 0008 8 = 8ddd4ded 0d242a04
ffff88025ad1f6c0 711335181 C Co:1:042:0 0 8 >
ffff88025ad1f6c0 711349982 S Co:1:042:0 s 21 09 0300 0000 0008 8 = 6799fee8 d604b08a
ffff88025ad1f6c0 711350122 C Co:1:042:0 0 8 >
ffff88025ad1fd80 711364986 S Co:1:042:0 s 21 09 0300 0000 0008 8 = 7275d77b 2c7cdfaf
ffff88025ad1fd80 711365231 C Co:1:042:0 0 8 >
ffff88025ad1f000 711379883 S Co:1:042:0 s 21 09 0300 0000 0008 8 = 0c8a5994 aaa7a253
ffff88025ad1f000 711379998 C Co:1:042:0 0 8 >
ffff88025ad1f000 711395043 S Co:1:042:0 s 21 09 0300 0000 0008 8 = eb56b866 fec5595b
ffff88025ad1f000 711395250 C Co:1:042:0 0 8 >
ffff88025ad1f600 711412032 S Co:1:042:0 s 21 09 0300 0000 0008 8 = 973a5de6 6aba552e
ffff88025ad1f600 711412262 C Co:1:042:0 0 8 >
ffff88025ad1f600 711426933 S Co:1:042:0 s 21 09 0300 0000 0008 8 = eafb6551 438c5f38
ffff88025ad1f600 711427134 C Co:1:042:0 0 8 >
ffff880403990300 711443995 S Co:1:042:0 s 21 09 0300 0000 0008 8 = 954321a2 73e7316c
ffff880403990300 711444263 C Co:1:042:0 0 8 >
ffff880403862f00 711459007 S Co:1:042:0 s 21 09 0300 0000 0008 8 = 9c1f961e f89bf9bc
ffff880403862f00 711459236 C Co:1:042:0 0 8 >
ffff880403862f00 711474080 S Co:1:042:0 s 21 09 0300 0000 0008 8 = d680fdcb 651adca1
ffff880403862f00 711474248 C Co:1:042:0 0 8 >
ffff880403862f00 711488897 S Co:1:042:0 s 21 09 0300 0000 0008 8 = 70bd42f2 5efc6e98
ffff880403862f00 711488981 C Co:1:042:0 0 8 >
ffff880403862480 711505956 S Co:1:042:0 s 21 09 0300 0000 0008 8 = 690e87a2 1e7c3ca1
ffff880403862480 711506107 C Co:1:042:0 0 8 >
ffff88025ad1fb40 711521031 S Co:1:042:0 s 21 09 0300 0000 0008 8 = 1610a02f f3fb45c0
ffff88025ad1fb40 711521251 C Co:1:042:0 0 8 >
ffff8803a0172a80 711535975 S Co:1:042:0 s 21 09 0300 0000 0008 8 = 9d4596ad be7a7a7d
ffff8803a0172a80 711536246 C Co:1:042:0 0 8 >
ffff8803a0172600 711552785 S Co:1:042:0 s 21 09 0300 0000 0008 8 = 7c932777 76224366
ffff8803a0172600 711553006 C Co:1:042:0 0 8 >
ffff8803a0172a80 711568752 S Co:1:042:0 s 21 09 0300 0000 0008 8 = 01c242ac a4befc8a
ffff8803a0172a80 711568858 C Co:1:042:0 0 8 >
ffff8803a0172a80 711583688 S Co:1:042:0 s 21 09 0300 0000 0008 8 = d2018dae e63e72fe
ffff8803a0172a80 711583880 C Co:1:042:0 0 8 >
ffff8803a0172a80 711598748 S Co:1:042:0 s 21 09 0300 0000 0008 8 = 6460e1a4 6f34695a
ffff8803a0172a80 711598888 C Co:1:042:0 0 8 >
ffff8803a0172a80 711615717 S Co:1:042:0 s 21 09 0300 0000 0008 8 = 8655cbf8 8358173b
ffff8803a0172a80 711615885 C Co:1:042:0 0 8 >
ffff8802486c63c0 711630736 S Co:1:042:0 s 21 09 0300 0000 0008 8 = d5390ad7 fd06a8c0
ffff8802486c63c0 711630876 C Co:1:042:0 0 8 >
ffff8803d5780d80 711645642 S Co:1:042:0 s 21 09 0300 0000 0008 8 = 47ca16b6 cbbcba0f
ffff8803d5780d80 711645732 C Co:1:042:0 0 8 >
ffff880403862cc0 711661703 S Co:1:042:0 s 21 09 0300 0000 0008 8 = a3a995c9 6e9fe0d0
ffff880403862cc0 711661860 C Co:1:042:0 0 8 >
ffff88025ad1fb40 711676727 S Co:1:042:0 s 21 09 0300 0000 0008 8 = 05dbe68c 7df521ae
ffff88025ad1fb40 711676882 C Co:1:042:0 0 8 >
ffff88025ad1fb40 711693705 S Co:1:042:0 s 21 09 0300 0000 0008 8 = 5d4a983c 21aa78db
ffff88025ad1fb40 711693882 C Co:1:042:0 0 8 >
ffff88025ad1fb40 711708744 S Co:1:042:0 s 21 09 0300 0000 0008 8 = ef43f15d 98cd548b
ffff88025ad1fb40 711708885 C Co:1:042:0 0 8 >
ffff88025ad1fb40 711723778 S Co:1:042:0 s 21 09 0300 0000 0008 8 = d2f86a34 b4121776
ffff88025ad1fb40 711723884 C Co:1:042:0 0 8 >
ffff8803d5780d80 711740649 S Co:1:042:0 s 21 09 0300 0000 0008 8 = 73fd304b 5b519958
ffff8803d5780d80 711740742 C Co:1:042:0 0 8 >
ffff880403862e40 711770770 S Co:1:042:0 s 21 09 0300 0000 0008 8 = 550397b8 95357102
ffff880403862e40 711770884 C Co:1:042:0 0 8 >
ffff880403862a80 711803724 S Ci:1:042:0 s a1 01 0300 0000 0008 8 <
ffff880403862a80 711803862 C Ci:1:042:0 0 8 = aa040000 00000000
ffff8803d5611f00 729114533 C Ii:1:042:1 -71:8 0
