ffff8803fdf61a80 1427430234 C Ii:1:005:1 0:8 8 = 00000000 00000000
ffff8803fdf61a80 1427430286 S Ii:1:005:1 -115:8 8 <
ffff8803fe0e8f00 1427799233 C Ii:1:005:2 0:8 4 = 0100ff00
ffff8803fe0e8f00 1427799258 S Ii:1:005:2 -115:8 4 <
ffff8803fe0e8f00 1427815230 C Ii:1:005:2 0:8 4 = 01000100
ffff8803fe0e8f00 1427815249 S Ii:1:005:2 -115:8 4 <
ffff8803fe0e8f00 1427927233 C Ii:1:005:2 0:8 4 = 010001fe
ffff8803fe0e8f00 1427927257 S Ii:1:005:2 -115:8 4 <
ffff8803fe0e8f00 1427951215 C Ii:1:005:2 0:8 4 = 010002fc
ffff8803fe0e8f00 1427951246 S Ii:1:005:2 -115:8 4 <
ffff8803fe0e8f00 1427959216 C Ii:1:005:2 0:8 4 = 010005fe
ffff8803fe0e8f00 1427959243 S Ii:1:005:2 -115:8 4 <
ffff8803fe0e8f00 1427975212 C Ii:1:005:2 0:8 4 = 01000d01
ffff8803fe0e8f00 1427975226 S Ii:1:005:2 -115:8 4 <
ffff8803fe0e8f00 1427999226 C Ii:1:005:2 0:8 4 = 01001907
ffff8803fe0e8f00 1427999258 S Ii:1:005:2 -115:8 4 <
ffff8803fe0e8f00 1428015228 C Ii:1:005:2 0:8 4 = 01001608
ffff8803fe0e8f00 1428015252 S Ii:1:005:2 -115:8 4 <
ffff8803fe0e8f00 1428023232 C Ii:1:005:2 0:8 4 = 01001409
ffff8803fe0e8f00 1428023246 S Ii:1:005:2 -115:8 4 <
ffff8803fe0e8f00 1428039232 C Ii:1:005:2 0:8 4 = 01000d07
ffff8803fe0e8f00 1428039250 S Ii:1:005:2 -115:8 4 <
ffff8803fe0e8f00 1428055238 C Ii:1:005:2 0:8 4 = 01001e10
ffff8803fe0e8f00 1428055273 S Ii:1:005:2 -115:8 4 <
ffff8803fe0e8f00 1428071217 C Ii:1:005:2 0:8 4 = 01001108
ffff8803fe0e8f00 1428071249 S Ii:1:005:2 -115:8 4 <
ffff8803fe0e8f00 1428079233 C Ii:1:005:2 0:8 4 = 01001209
ffff8803fe0e8f00 1428079248 S Ii:1:005:2 -115:8 4 <
ffff8803fe0e8f00 1428103266 C Ii:1:005:2 0:8 4 = 01002711
ffff8803fe0e8f00 1428103301 S Ii:1:005:2 -115:8 4 <
ffff8803fe0e8f00 1428111234 C Ii:1:005:2 0:8 4 = 01001509
ffff8803fe0e8f00 1428111258 S Ii:1:005:2 -115:8 4 <
ffff8803fe0e8f00 1428135235 C Ii:1:005:2 0:8 4 = 01002c10
ffff8803fe0e8f00 1428135261 S Ii:1:005:2 -115:8 4 <
ffff8803fe0e8f00 1428143233 C Ii:1:005:2 0:8 4 = 01001207
ffff8803fe0e8f00 1428143248 S Ii:1:005:2 -115:8 4 <
ffff8803fe0e8f00 1428167236 C Ii:1:005:2 0:8 4 = 01001809
ffff8803fe0e8f00 1428167261 S Ii:1:005:2 -115:8 4 <
ffff8803fe0e8f00 1428183234 C Ii:1:005:2 0:8 4 = 01000402
ffff8803fe0e8f00 1428183252 S Ii:1:005:2 -115:8 4 <
ffff8803fe0e8f00 1428199255 C Ii:1:005:2 0:8 4 = 01000703
ffff8803fe0e8f00 1428199290 S Ii:1:005:2 -115:8 4 <
ffff8803fe0e8f00 1428215232 C Ii:1:005:2 0:8 4 = 01000001
ffff8803fe0e8f00 1428215248 S Ii:1:005:2 -115:8 4 <
ffff8803fe0e8f00 1428239234 C Ii:1:005:2 0:8 4 = 010007ff
ffff8803fe0e8f00 1428239253 S Ii:1:005:2 -115:8 4 <
ffff8803fe0e8f00 1428263234 C Ii:1:005:2 0:8 4 = 01000cfe
ffff8803fe0e8f00 1428263253 S Ii:1:005:2 -115:8 4 <
ffff8803fe0e8f00 1428271232 C Ii:1:005:2 0:8 4 = 010007ff
ffff8803fe0e8f00 1428271248 S Ii:1:005:2 -115:8 4 <
ffff8803fe0e8f00 1428295235 C Ii:1:005:2 0:8 4 = 010013ff
ffff8803fe0e8f00 1428295253 S Ii:1:005:2 -115:8 4 <
ffff8803fe0e8f00 1428303235 C Ii:1:005:2 0:8 4 = 01000c00
ffff8803fe0e8f00 1428303258 S Ii:1:005:2 -115:8 4 <
ffff8803fe0e8f00 1428327237 C Ii:1:005:2 0:8 4 = 01001d01
ffff8803fe0e8f00 1428327260 S Ii:1:005:2 -115:8 4 <
ffff8803fe0e8f00 1428335235 C Ii:1:005:2 0:8 4 = 01001302
ffff8803fe0e8f00 1428335251 S Ii:1:005:2 -115:8 4 <
ffff8803fe0e8f00 1428351235 C Ii:1:005:2 0:8 4 = 01001504
ffff8803fe0e8f00 1428351255 S Ii:1:005:2 -115:8 4 <
ffff8803fe0e8f00 1428367217 C Ii:1:005:2 0:8 4 = 01002907
ffff8803fe0e8f00 1428367241 S Ii:1:005:2 -115:8 4 <
ffff8803fe0e8f00 1428383217 C Ii:1:005:2 0:8 4 = 01001004
ffff8803fe0e8f00 1428383237 S Ii:1:005:2 -115:8 4 <
ffff8803fe0e8f00 1428399233 C Ii:1:005:2 0:8 4 = 01001504
ffff8803fe0e8f00 1428399259 S Ii:1:005:2 -115:8 4 <
ffff8803fe0e8f00 1428415233 C Ii:1:005:2 0:8 4 = 01000401
ffff8803fe0e8f00 1428415254 S Ii:1:005:2 -115:8 4 <
ffff8803fe0e8f00 1428439237 C Ii:1:005:2 0:8 4 = 01000901
ffff8803fe0e8f00 1428439265 S Ii:1:005:2 -115:8 4 <
ffff8803fe0e8f00 1428447236 C Ii:1:005:2 0:8 4 = 01000300
ffff8803fe0e8f00 1428447259 S Ii:1:005:2 -115:8 4 <
ffff8803fe0e8f00 1428463236 C Ii:1:005:2 0:8 4 = 01000300
ffff8803fe0e8f00 1428463253 S Ii:1:005:2 -115:8 4 <
ffff8803fe0e8f00 1428479236 C Ii:1:005:2 0:8 4 = 01000800
ffff8803fe0e8f00 1428479259 S Ii:1:005:2 -115:8 4 <
ffff8803fe0e8f00 1428495239 C Ii:1:005:2 0:8 4 = 01000100
ffff8803fe0e8f00 1428495270 S Ii:1:005:2 -115:8 4 <
ffff8803fe0e8f00 1428527218 C Ii:1:005:2 0:8 4 = 01000001
ffff8803fe0e8f00 1428527241 S Ii:1:005:2 -115:8 4 <
ffff8803fe0e8f00 1428543237 C Ii:1:005:2 0:8 4 = 0100ffff
ffff8803fe0e8f00 1428543254 S Ii:1:005:2 -115:8 4 <
ffff8803fe0e8f00 1428559219 C Ii:1:005:2 0:8 4 = 0100ff00
ffff8803fe0e8f00 1428559241 S Ii:1:005:2 -115:8 4 <
ffff8803fe0e8f00 1428575237 C Ii:1:005:2 0:8 4 = 010000ff
ffff8803fe0e8f00 1428575256 S Ii:1:005:2 -115:8 4 <
ffff8803fe0e8f00 1428583236 C Ii:1:005:2 0:8 4 = 0100ffff
ffff8803fe0e8f00 1428583252 S Ii:1:005:2 -115:8 4 <
ffff8803fe0e8f00 1428607238 C Ii:1:005:2 0:8 4 = 0100fefa
ffff8803fe0e8f00 1428607259 S Ii:1:005:2 -115:8 4 <
ffff8803fe0e8f00 1428615220 C Ii:1:005:2 0:8 4 = 010000fd
ffff8803fe0e8f00 1428615241 S Ii:1:005:2 -115:8 4 <
ffff8803fdc4a780 1428628194 C Ii:3:003:1 0:8 6 = 08781c11 2c01
ffff8803fdc4a780 1428628225 S Ii:3:003:1 -115:8 6 <
ffff8803fe0e8f00 1428639244 C Ii:1:005:2 0:8 4 = 010100ff
ffff8803fe0e8f00 1428639284 S Ii:1:005:2 -115:8 4 <
ffff8803fdc4a6c0 1428647736 S Ci:3:003:0 s a1 01 030a 0000 0002 64 <
ffff8803fdc4a6c0 1428647819 C Ci:3:003:0 0 2 = 0af0
ffff8803fdc4a6c0 1428647834 S Ci:3:003:0 s a1 01 030f 0000 0002 64 <
ffff8803fdc4a6c0 1428647908 C Ci:3:003:0 0 2 = 0f77
ffff8803fdc4a6c0 1428647919 S Ci:3:003:0 s a1 01 0312 0000 0002 64 <
ffff8803fdc4a6c0 1428647990 C Ci:3:003:0 0 2 = 1277
ffff8803fdc4a6c0 1428648021 S Ci:3:003:0 s a1 01 0313 0000 0002 64 <
ffff8803fdc4a6c0 1428648168 C Ci:3:003:0 0 2 = 130b
ffff8803fdc4a6c0 1428648198 S Ci:3:003:0 s a1 01 0317 0000 0002 64 <
ffff8803fdc4a6c0 1428648270 C Ci:3:003:0 0 2 = 1700
ffff8803fdc4a6c0 1428648297 S Ci:3:003:0 s a1 01 030b 0000 0002 64 <
ffff8803fdc4a6c0 1428648391 C Ci:3:003:0 0 2 = 0b11
ffff8803fe0e8f00 1428663234 C Ii:1:005:2 0:8 4 = 01010001
ffff8803fe0e8f00 1428663253 S Ii:1:005:2 -115:8 4 <
ffff8803fe0e8f00 1428687271 C Ii:1:005:2 0:8 4 = 0101ff00
ffff8803fe0e8f00 1428687307 S Ii:1:005:2 -115:8 4 <
ffff8803fdc4a780 1428692181 C Ii:3:003:1 0:8 2 = 0b11
ffff8803fdc4a780 1428692210 S Ii:3:003:1 -115:8 6 <
ffff8803fe0e8f00 1428735223 C Ii:1:005:2 0:8 4 = 01010100
ffff8803fe0e8f00 1428735260 S Ii:1:005:2 -115:8 4 <
ffff8803fe0e8f00 1428767239 C Ii:1:005:2 0:8 4 = 01000000
ffff8803fe0e8f00 1428767258 S Ii:1:005:2 -115:8 4 <
ffff8803fdf61a80 1429174256 C Ii:1:005:1 0:8 8 = 02000000 00000000
ffff8803fdf61a80 1429174286 S Ii:1:005:1 -115:8 8 <
ffff8803fdf61a80 1429230274 C Ii:1:005:1 0:8 8 = 02001200 00000000
ffff8803fdf61a80 1429230321 S Ii:1:005:1 -115:8 8 <
ffff8803fdf61a80 1429358233 C Ii:1:005:1 0:8 8 = 0200120e 00000000
ffff8803fdf61a80 1429358293 S Ii:1:005:1 -115:8 8 <
ffff8803fdf61a80 1429414247 C Ii:1:005:1 0:8 8 = 02000e00 00000000
ffff8803fdf61a80 1429414273 S Ii:1:005:1 -115:8 8 <
ffff8803fdf61a80 1429430246 C Ii:1:005:1 0:8 8 = 00000e00 00000000
ffff8803fdf61a80 1429430267 S Ii:1:005:1 -115:8 8 <
ffff8803fdf61a80 1429486227 C Ii:1:005:1 0:8 8 = 00000000 00000000
ffff8803fdf61a80 1429486261 S Ii:1:005:1 -115:8 8 <
ffff8803fdf61a80 1429614248 C Ii:1:005:1 0:8 8 = 00002800 00000000
ffff8803fdf61a80 1429614275 S Ii:1:005:1 -115:8 8 <
ffff8803fdf61a80 1429686234 C Ii:1:005:1 0:8 8 = 00000000 00000000
ffff8803fdf61a80 1429686280 S Ii:1:005:1 -115:8 8 <
ffff8803fe0e8f00 1430007234 C Ii:1:005:2 0:8 4 = 0100fe01
ffff8803fe0e8f00 1430007259 S Ii:1:005:2 -115:8 4 <
ffff8803fe0e8f00 1430023248 C Ii:1:005:2 0:8 4 = 0100fe03
ffff8803fe0e8f00 1430023271 S Ii:1:005:2 -115:8 4 <
ffff8803fe0e8f00 1430039252 C Ii:1:005:2 0:8 4 = 0100fc03
ffff8803fe0e8f00 1430039269 S Ii:1:005:2 -115:8 4 <
ffff8803fe0e8f00 1430055252 C Ii:1:005:2 0:8 4 = 0100fe02
ffff8803fe0e8f00 1430055270 S Ii:1:005:2 -115:8 4 <
ffff8803fe0e8f00 1430071251 C Ii:1:005:2 0:8 4 = 0100f705
ffff8803fe0e8f00 1430071271 S Ii:1:005:2 -115:8 4 <
ffff8803fe0e8f00 1430087251 C Ii:1:005:2 0:8 4 = 0100fa03
ffff8803fe0e8f00 1430087268 S Ii:1:005:2 -115:8 4 <
ffff8803fe0e8f00 1430095251 C Ii:1:005:2 0:8 4 = 0100f902
ffff8803fe0e8f00 1430095268 S Ii:1:005:2 -115:8 4 <
ffff8803fe0e8f00 1430119252 C Ii:1:005:2 0:8 4 = 0100ee03
ffff8803fe0e8f00 1430119269 S Ii:1:005:2 -115:8 4 <
ffff8803fe0e8f00 1430127251 C Ii:1:005:2 0:8 4 = 0100f601
ffff8803fe0e8f00 1430127268 S Ii:1:005:2 -115:8 4 <
ffff8803fe0e8f00 1430151253 C Ii:1:005:2 0:8 4 = 0100ec02
ffff8803fe0e8f00 1430151272 S Ii:1:005:2 -115:8 4 <
ffff8803fe0e8f00 1430159250 C Ii:1:005:2 0:8 4 = 0100f301
ffff8803fe0e8f00 1430159267 S Ii:1:005:2 -115:8 4 <
ffff8803fe0e8f00 1430183254 C Ii:1:005:2 0:8 4 = 0100e602
ffff8803fe0e8f00 1430183278 S Ii:1:005:2 -115:8 4 <
ffff8803fe0e8f00 1430191252 C Ii:1:005:2 0:8 4 = 0100f202
ffff8803fe0e8f00 1430191268 S Ii:1:005:2 -115:8 4 <
ffff8803fe0e8f00 1430215253 C Ii:1:005:2 0:8 4 = 0100e603
ffff8803fe0e8f00 1430215272 S Ii:1:005:2 -115:8 4 <
ffff8803fe0e8f00 1430223253 C Ii:1:005:2 0:8 4 = 0100f301
ffff8803fe0e8f00 1430223270 S Ii:1:005:2 -115:8 4 <
ffff8803fe0e8f00 1430239233 C Ii:1:005:2 0:8 4 = 0100f202
ffff8803fe0e8f00 1430239250 S Ii:1:005:2 -115:8 4 <
ffff8803fe0e8f00 1430255255 C Ii:1:005:2 0:8 4 = 0100e502
ffff8803fe0e8f00 1430255279 S Ii:1:005:2 -115:8 4 <
ffff8803fe0e8f00 1430271234 C Ii:1:005:2 0:8 4 = 0100f202
ffff8803fe0e8f00 1430271251 S Ii:1:005:2 -115:8 4 <
ffff8803fe0e8f00 1430295250 C Ii:1:005:2 0:8 4 = 0100e303
ffff8803fe0e8f00 1430295273 S Ii:1:005:2 -115:8 4 <
ffff8803fe0e8f00 1430303253 C Ii:1:005:2 0:8 4 = 0100f002
ffff8803fe0e8f00 1430303270 S Ii:1:005:2 -115:8 4 <
ffff8803fe0e8f00 1430327254 C Ii:1:005:2 0:8 4 = 0100e102
ffff8803fe0e8f00 1430327274 S Ii:1:005:2 -115:8 4 <
ffff8803fe0e8f00 1430335238 C Ii:1:005:2 0:8 4 = 0100f201
ffff8803fe0e8f00 1430335269 S Ii:1:005:2 -115:8 4 <
ffff8803fe0e8f00 1430351259 C Ii:1:005:2 0:8 4 = 0100f1ff
ffff8803fe0e8f00 1430351293 S Ii:1:005:2 -115:8 4 <
ffff8803fe0e8f00 1430367237 C Ii:1:005:2 0:8 4 = 0100e1fd
ffff8803fe0e8f00 1430367276 S Ii:1:005:2 -115:8 4 <
ffff8803fe0e8f00 1430399254 C Ii:1:005:2 0:8 4 = 0100f2fd
ffff8803fe0e8f00 1430399273 S Ii:1:005:2 -115:8 4 <
ffff8803fe0e8f00 1430415255 C Ii:1:005:2 0:8 4 = 0100e3fa
ffff8803fe0e8f00 1430415273 S Ii:1:005:2 -115:8 4 <
ffff8803fe0e8f00 1430431255 C Ii:1:005:2 0:8 4 = 0100f6fe
ffff8803fe0e8f00 1430431273 S Ii:1:005:2 -115:8 4 <
ffff8803fe0e8f00 1430447255 C Ii:1:005:2 0:8 4 = 0100e6fd
ffff8803fe0e8f00 1430447278 S Ii:1:005:2 -115:8 4 <
ffff8803fe0e8f00 1430463256 C Ii:1:005:2 0:8 4 = 0100f6fe
ffff8803fe0e8f00 1430463280 S Ii:1:005:2 -115:8 4 <
ffff8803fe0e8f00 1430471255 C Ii:1:005:2 0:8 4 = 0100f8ff
ffff8803fe0e8f00 1430471268 S Ii:1:005:2 -115:8 4 <
ffff8803fe0e8f00 1430495255 C Ii:1:005:2 0:8 4 = 0100f8fe
ffff8803fe0e8f00 1430495273 S Ii:1:005:2 -115:8 4 <
ffff8803fe0e8f00 1430527255 C Ii:1:005:2 0:8 4 = 01000200
ffff8803fe0e8f00 1430527273 S Ii:1:005:2 -115:8 4 <
ffff8803fe0e8f00 1430543240 C Ii:1:005:2 0:8 4 = 010002ff
ffff8803fe0e8f00 1430543281 S Ii:1:005:2 -115:8 4 <
ffff8803fe0e8f00 1430559256 C Ii:1:005:2 0:8 4 = 01000100
ffff8803fe0e8f00 1430559273 S Ii:1:005:2 -115:8 4 <
ffff8803fe0e8f00 1430623263 C Ii:1:005:2 0:8 4 = 0100ff00
ffff8803fe0e8f00 1430623305 S Ii:1:005:2 -115:8 4 <
ffff8803fe0e8f00 1430631261 C Ii:1:005:2 0:8 4 = 0100ff00
ffff8803fe0e8f00 1430631291 S Ii:1:005:2 -115:8 4 <
ffff8803fe0e8f00 1430655258 C Ii:1:005:2 0:8 4 = 0100ff01
ffff8803fe0e8f00 1430655286 S Ii:1:005:2 -115:8 4 <
ffff8803fe0e8f00 1430679258 C Ii:1:005:2 0:8 4 = 0100ff00
ffff8803fe0e8f00 1430679284 S Ii:1:005:2 -115:8 4 <
ffff8803fe0e8f00 1430695257 C Ii:1:005:2 0:8 4 = 01000100
ffff8803fe0e8f00 1430695273 S Ii:1:005:2 -115:8 4 <
ffff8803fe0e8f00 1430839260 C Ii:1:005:2 0:8 4 = 0100ff00
ffff8803fe0e8f00 1430839283 S Ii:1:005:2 -115:8 4 <
ffff8803fe0e8f00 1430871260 C Ii:1:005:2 0:8 4 = 010000ff
ffff8803fe0e8f00 1430871279 S Ii:1:005:2 -115:8 4 <
ffff8803fe0e8f00 1430903245 C Ii:1:005:2 0:8 4 = 0100ff00
ffff8803fe0e8f00 1430903290 S Ii:1:005:2 -115:8 4 <
ffff8803fe0e8f00 1431079262 C Ii:1:005:2 0:8 4 = 01000001
ffff8803fe0e8f00 1431079288 S Ii:1:005:2 -115:8 4 <
ffff8803fe0e8f00 1431087260 C Ii:1:005:2 0:8 4 = 01000101
ffff8803fe0e8f00 1431087275 S Ii:1:005:2 -115:8 4 <
ffff8803fe0e8f00 1431135261 C Ii:1:005:2 0:8 4 = 01000001
ffff8803fe0e8f00 1431135281 S Ii:1:005:2 -115:8 4 <
ffff8803fe0e8f00 1431151242 C Ii:1:005:2 0:8 4 = 010000ff
ffff8803fe0e8f00 1431151264 S Ii:1:005:2 -115:8 4 <
ffff8803fe0e8f00 1431175258 C Ii:1:005:2 0:8 4 = 01000001
ffff8803fe0e8f00 1431175279 S Ii:1:005:2 -115:8 4 <
ffff8803fe0e8f00 1431199244 C Ii:1:005:2 0:8 4 = 01000100
ffff8803fe0e8f00 1431199276 S Ii:1:005:2 -115:8 4 <
ffff8803fe0e8f00 1431391265 C Ii:1:005:2 0:8 4 = 01000001
ffff8803fe0e8f00 1431391289 S Ii:1:005:2 -115:8 4 <
ffff8803fe0e8f00 1431575266 C Ii:1:005:2 0:8 4 = 0100ff00
ffff8803fe0e8f00 1431575289 S Ii:1:005:2 -115:8 4 <
ffff8803fdc4a780 1431628206 C Ii:3:003:1 0:8 6 = 0878e010 2c01
ffff8803fdc4a780 1431628241 S Ii:3:003:1 -115:8 6 <
ffff8803fdc4a6c0 1431648499 S Ci:3:003:0 s a1 01 030a 0000 0002 64 <
ffff8803fdc4a6c0 1431648603 C Ci:3:003:0 0 2 = 0af0
ffff8803fdc4a6c0 1431648658 S Ci:3:003:0 s a1 01 030f 0000 0002 64 <
ffff8803fdc4a6c0 1431648731 C Ci:3:003:0 0 2 = 0f77
ffff8803fdc4a6c0 1431648774 S Ci:3:003:0 s a1 01 0312 0000 0002 64 <
ffff8803fdc4a6c0 1431648874 C Ci:3:003:0 0 2 = 1277
ffff8803fdc4a6c0 1431648956 S Ci:3:003:0 s a1 01 0313 0000 0002 64 <
ffff8803fdc4a6c0 1431649062 C Ci:3:003:0 0 2 = 130b
ffff8803fdc4a6c0 1431649094 S Ci:3:003:0 s a1 01 0317 0000 0002 64 <
ffff8803fdc4a6c0 1431649199 C Ci:3:003:0 0 2 = 1700
ffff8803fdc4a6c0 1431649249 S Ci:3:003:0 s a1 01 030b 0000 0002 64 <
ffff8803fdc4a6c0 1431649372 C Ci:3:003:0 0 2 = 0b11
ffff8803fdc4a780 1431692203 C Ii:3:003:1 0:8 2 = 0b11
ffff8803fdc4a780 1431692237 S Ii:3:003:1 -115:8 6 <
ffff8803fe0e8f00 1431911270 C Ii:1:005:2 0:8 4 = 01000001
ffff8803fe0e8f00 1431911294 S Ii:1:005:2 -115:8 4 <
ffff8803fe0e8f00 1431935268 C Ii:1:005:2 0:8 4 = 0100ff00
ffff8803fe0e8f00 1431935287 S Ii:1:005:2 -115:8 4 <
ffff8803fe0e8f00 1431951268 C Ii:1:005:2 0:8 4 = 01000100
ffff8803fe0e8f00 1431951286 S Ii:1:005:2 -115:8 4 <
ffff8803fe0e8f00 1431991269 C Ii:1:005:2 0:8 4 = 010002ff
ffff8803fe0e8f00 1431991289 S Ii:1:005:2 -115:8 4 <
ffff8803fe0e8f00 1432007251 C Ii:1:005:2 0:8 4 = 01000300
ffff8803fe0e8f00 1432007275 S Ii:1:005:2 -115:8 4 <
ffff8803fe0e8f00 1432015271 C Ii:1:005:2 0:8 4 = 01000500
ffff8803fe0e8f00 1432015293 S Ii:1:005:2 -115:8 4 <
ffff8803fe0e8f00 1432039270 C Ii:1:005:2 0:8 4 = 01000b00
ffff8803fe0e8f00 1432039289 S Ii:1:005:2 -115:8 4 <
ffff8803fe0e8f00 1432047269 C Ii:1:005:2 0:8 4 = 01000600
ffff8803fe0e8f00 1432047283 S Ii:1:005:2 -115:8 4 <
ffff8803fe0e8f00 1432071300 C Ii:1:005:2 0:8 4 = 01000bff
ffff8803fe0e8f00 1432071336 S Ii:1:005:2 -115:8 4 <
ffff8803fe0e8f00 1432079252 C Ii:1:005:2 0:8 4 = 010008fe
ffff8803fe0e8f00 1432079277 S Ii:1:005:2 -115:8 4 <
ffff8803fe0e8f00 1432095263 C Ii:1:005:2 0:8 4 = 01000afd
ffff8803fe0e8f00 1432095295 S Ii:1:005:2 -115:8 4 <
ffff8803fe0e8f00 1432111267 C Ii:1:005:2 0:8 4 = 010019f8
ffff8803fe0e8f00 1432111304 S Ii:1:005:2 -115:8 4 <
ffff8803fe0e8f00 1432127302 C Ii:1:005:2 0:8 4 = 010011fb
ffff8803fe0e8f00 1432127335 S Ii:1:005:2 -115:8 4 <
ffff8803fe0e8f00 1432151271 C Ii:1:005:2 0:8 4 = 010025f6
ffff8803fe0e8f00 1432151289 S Ii:1:005:2 -115:8 4 <
ffff8803fe0e8f00 1432159270 C Ii:1:005:2 0:8 4 = 010014fb
ffff8803fe0e8f00 1432159286 S Ii:1:005:2 -115:8 4 <
ffff8803fe0e8f00 1432183272 C Ii:1:005:2 0:8 4 = 010027f7
ffff8803fe0e8f00 1432183298 S Ii:1:005:2 -115:8 4 <
ffff8803fe0e8f00 1432191270 C Ii:1:005:2 0:8 4 = 010014fc
ffff8803fe0e8f00 1432191284 S Ii:1:005:2 -115:8 4 <
ffff8803fe0e8f00 1432215271 C Ii:1:005:2 0:8 4 = 01002cf7
ffff8803fe0e8f00 1432215288 S Ii:1:005:2 -115:8 4 <
ffff8803fe0e8f00 1432223271 C Ii:1:005:2 0:8 4 = 010019fb
ffff8803fe0e8f00 1432223294 S Ii:1:005:2 -115:8 4 <
ffff8803fe0e8f00 1432239255 C Ii:1:005:2 0:8 4 = 01001afb
ffff8803fe0e8f00 1432239286 S Ii:1:005:2 -115:8 4 <
ffff8803fe0e8f00 1432255275 C Ii:1:005:2 0:8 4 = 010034f7
ffff8803fe0e8f00 1432255307 S Ii:1:005:2 -115:8 4 <
ffff8803fe0e8f00 1432271272 C Ii:1:005:2 0:8 4 = 01001afc
ffff8803fe0e8f00 1432271297 S Ii:1:005:2 -115:8 4 <
ffff8803fe0e8f00 1432287268 C Ii:1:005:2 0:8 4 = 010035f9
ffff8803fe0e8f00 1432287306 S Ii:1:005:2 -115:8 4 <
ffff8803fe0e8f00 1432303272 C Ii:1:005:2 0:8 4 = 010019fd
ffff8803fe0e8f00 1432303291 S Ii:1:005:2 -115:8 4 <
ffff8803fe0e8f00 1432319273 C Ii:1:005:2 0:8 4 = 010032fa
ffff8803fe0e8f00 1432319292 S Ii:1:005:2 -115:8 4 <
ffff8803fe0e8f00 1432335255 C Ii:1:005:2 0:8 4 = 010018fd
ffff8803fe0e8f00 1432335283 S Ii:1:005:2 -115:8 4 <
ffff8803fe0e8f00 1432343257 C Ii:1:005:2 0:8 4 = 010018fd
ffff8803fe0e8f00 1432343298 S Ii:1:005:2 -115:8 4 <
ffff8803fe0e8f00 1432367280 C Ii:1:005:2 0:8 4 = 010032fa
ffff8803fe0e8f00 1432367322 S Ii:1:005:2 -115:8 4 <
ffff8803fe0e8f00 1432375254 C Ii:1:005:2 0:8 4 = 010018fd
ffff8803fe0e8f00 1432375284 S Ii:1:005:2 -115:8 4 <
ffff8803fe0e8f00 1432399274 C Ii:1:005:2 0:8 4 = 010032fb
ffff8803fe0e8f00 1432399296 S Ii:1:005:2 -115:8 4 <
ffff8803fe0e8f00 1432415273 C Ii:1:005:2 0:8 4 = 010019fd
ffff8803fe0e8f00 1432415297 S Ii:1:005:2 -115:8 4 <
ffff8803fe0e8f00 1432431262 C Ii:1:005:2 0:8 4 = 01002bfc
ffff8803fe0e8f00 1432431298 S Ii:1:005:2 -115:8 4 <
ffff8803fe0e8f00 1432447269 C Ii:1:005:2 0:8 4 = 010011fe
ffff8803fe0e8f00 1432447293 S Ii:1:005:2 -115:8 4 <
ffff8803fe0e8f00 1432463278 C Ii:1:005:2 0:8 4 = 010022fc
ffff8803fe0e8f00 1432463314 S Ii:1:005:2 -115:8 4 <
ffff8803fe0e8f00 1432479276 C Ii:1:005:2 0:8 4 = 010008fe
ffff8803fe0e8f00 1432479304 S Ii:1:005:2 -115:8 4 <
ffff8803fe0e8f00 1432487275 C Ii:1:005:2 0:8 4 = 01000dfd
ffff8803fe0e8f00 1432487297 S Ii:1:005:2 -115:8 4 <
ffff8803fe0e8f00 1432511275 C Ii:1:005:2 0:8 4 = 010012fb
ffff8803fe0e8f00 1432511304 S Ii:1:005:2 -115:8 4 <
ffff8803fe0e8f00 1432519274 C Ii:1:005:2 0:8 4 = 010007fd
ffff8803fe0e8f00 1432519297 S Ii:1:005:2 -115:8 4 <
ffff8803fe0e8f00 1432543257 C Ii:1:005:2 0:8 4 = 01000ef9
ffff8803fe0e8f00 1432543282 S Ii:1:005:2 -115:8 4 <
ffff8803fe0e8f00 1432551274 C Ii:1:005:2 0:8 4 = 010005fd
ffff8803fe0e8f00 1432551290 S Ii:1:005:2 -115:8 4 <
ffff8803fe0e8f00 1432575273 C Ii:1:005:2 0:8 4 = 01000afa
ffff8803fe0e8f00 1432575295 S Ii:1:005:2 -115:8 4 <
ffff8803fe0e8f00 1432583258 C Ii:1:005:2 0:8 4 = 010000ff
ffff8803fe0e8f00 1432583293 S Ii:1:005:2 -115:8 4 <
ffff8803fe0e8f00 1432599274 C Ii:1:005:2 0:8 4 = 01000100
ffff8803fe0e8f00 1432599298 S Ii:1:005:2 -115:8 4 <
ffff8803fe0e8f00 1432615260 C Ii:1:005:2 0:8 4 = 010002fd
ffff8803fe0e8f00 1432615296 S Ii:1:005:2 -115:8 4 <
ffff8803fe0e8f00 1432631256 C Ii:1:005:2 0:8 4 = 010001fe
ffff8803fe0e8f00 1432631289 S Ii:1:005:2 -115:8 4 <
ffff8803fe0e8f00 1432647276 C Ii:1:005:2 0:8 4 = 010002fa
ffff8803fe0e8f00 1432647301 S Ii:1:005:2 -115:8 4 <
ffff8803fe0e8f00 1432663277 C Ii:1:005:2 0:8 4 = 010000fb
ffff8803fe0e8f00 1432663300 S Ii:1:005:2 -115:8 4 <
ffff8803fe0e8f00 1432687310 C Ii:1:005:2 0:8 4 = 0100fef7
ffff8803fe0e8f00 1432687350 S Ii:1:005:2 -115:8 4 <
ffff8803fe0e8f00 1432695279 C Ii:1:005:2 0:8 4 = 0100fffd
ffff8803fe0e8f00 1432695312 S Ii:1:005:2 -115:8 4 <
ffff8803fe0e8f00 1432719277 C Ii:1:005:2 0:8 4 = 0100ffff
ffff8803fe0e8f00 1432719301 S Ii:1:005:2 -115:8 4 <
ffff8803fe0e8f00 1432839284 C Ii:1:005:2 0:8 4 = 010000ff
ffff8803fe0e8f00 1432839326 S Ii:1:005:2 -115:8 4 <
ffff8803fe0e8f00 1432855281 C Ii:1:005:2 0:8 4 = 0100ffff
ffff8803fe0e8f00 1432855314 S Ii:1:005:2 -115:8 4 <
ffff8803fe0e8f00 1432863282 C Ii:1:005:2 0:8 4 = 0100fffe
ffff8803fe0e8f00 1432863313 S Ii:1:005:2 -115:8 4 <
ffff8803fe0e8f00 1432887279 C Ii:1:005:2 0:8 4 = 0100fefb
ffff8803fe0e8f00 1432887304 S Ii:1:005:2 -115:8 4 <
ffff8803fe0e8f00 1432895276 C Ii:1:005:2 0:8 4 = 0100fffd
ffff8803fe0e8f00 1432895293 S Ii:1:005:2 -115:8 4 <
ffff8803fe0e8f00 1432919278 C Ii:1:005:2 0:8 4 = 0100fef6
ffff8803fe0e8f00 1432919297 S Ii:1:005:2 -115:8 4 <
ffff8803fe0e8f00 1432935278 C Ii:1:005:2 0:8 4 = 0100fefa
ffff8803fe0e8f00 1432935295 S Ii:1:005:2 -115:8 4 <
ffff8803fe0e8f00 1432951278 C Ii:1:005:2 0:8 4 = 0100fdf4
ffff8803fe0e8f00 1432951302 S Ii:1:005:2 -115:8 4 <
ffff8803fe0e8f00 1432967278 C Ii:1:005:2 0:8 4 = 0100fefa
ffff8803fe0e8f00 1432967297 S Ii:1:005:2 -115:8 4 <
ffff8803fe0e8f00 1432975278 C Ii:1:005:2 0:8 4 = 0100fffc
ffff8803fe0e8f00 1432975295 S Ii:1:005:2 -115:8 4 <
ffff8803fe0e8f00 1432999277 C Ii:1:005:2 0:8 4 = 0100fdfa
ffff8803fe0e8f00 1432999298 S Ii:1:005:2 -115:8 4 <
ffff8803fe0e8f00 1433031305 C Ii:1:005:2 0:8 4 = 0100ffff
ffff8803fe0e8f00 1433031346 S Ii:1:005:2 -115:8 4 <
ffff8803fe0e8f00 1433039282 C Ii:1:005:2 0:8 4 = 010000ff
ffff8803fe0e8f00 1433039313 S Ii:1:005:2 -115:8 4 <
ffff8803fe0e8f00 1433063279 C Ii:1:005:2 0:8 4 = 0100ffff
ffff8803fe0e8f00 1433063297 S Ii:1:005:2 -115:8 4 <
ffff8803fe0e8f00 1433071276 C Ii:1:005:2 0:8 4 = 0100ff00
ffff8803fe0e8f00 1433071291 S Ii:1:005:2 -115:8 4 <
ffff8803fe0e8f00 1433095279 C Ii:1:005:2 0:8 4 = 0100fdfc
ffff8803fe0e8f00 1433095301 S Ii:1:005:2 -115:8 4 <
ffff8803fe0e8f00 1433119310 C Ii:1:005:2 0:8 4 = 0100fefd
ffff8803fe0e8f00 1433119345 S Ii:1:005:2 -115:8 4 <
ffff8803fe0e8f00 1433135284 C Ii:1:005:2 0:8 4 = 0100fefb
ffff8803fe0e8f00 1433135317 S Ii:1:005:2 -115:8 4 <
ffff8803fe0e8f00 1433151264 C Ii:1:005:2 0:8 4 = 0100fefc
ffff8803fe0e8f00 1433151308 S Ii:1:005:2 -115:8 4 <
ffff8803fe0e8f00 1433167280 C Ii:1:005:2 0:8 4 = 0100fcf9
ffff8803fe0e8f00 1433167302 S Ii:1:005:2 -115:8 4 <
ffff8803fe0e8f00 1433183281 C Ii:1:005:2 0:8 4 = 0100fefa
ffff8803fe0e8f00 1433183301 S Ii:1:005:2 -115:8 4 <
ffff8803fe0e8f00 1433207265 C Ii:1:005:2 0:8 4 = 0100fbf7
ffff8803fe0e8f00 1433207288 S Ii:1:005:2 -115:8 4 <
ffff8803fe0e8f00 1433215280 C Ii:1:005:2 0:8 4 = 0100fffc
ffff8803fe0e8f00 1433215296 S Ii:1:005:2 -115:8 4 <
ffff8803fe0e8f00 1433231281 C Ii:1:005:2 0:8 4 = 0100fefc
ffff8803fe0e8f00 1433231300 S Ii:1:005:2 -115:8 4 <
ffff8803fe0e8f00 1433247281 C Ii:1:005:2 0:8 4 = 0100fdfb
ffff8803fe0e8f00 1433247299 S Ii:1:005:2 -115:8 4 <
ffff8803fe0e8f00 1433263262 C Ii:1:005:2 0:8 4 = 0100fffc
ffff8803fe0e8f00 1433263281 S Ii:1:005:2 -115:8 4 <
ffff8803fe0e8f00 1433279281 C Ii:1:005:2 0:8 4 = 0100fdfa
ffff8803fe0e8f00 1433279299 S Ii:1:005:2 -115:8 4 <
ffff8803fe0e8f00 1433391283 C Ii:1:005:2 0:8 4 = 01000001
ffff8803fe0e8f00 1433391308 S Ii:1:005:2 -115:8 4 <
ffff8803fe0e8f00 1433503284 C Ii:1:005:2 0:8 4 = 0100ffff
ffff8803fe0e8f00 1433503306 S Ii:1:005:2 -115:8 4 <
ffff8803fe0e8f00 1433663287 C Ii:1:005:2 0:8 4 = 01000001
ffff8803fe0e8f00 1433663315 S Ii:1:005:2 -115:8 4 <
ffff8803fe0e8f00 1434127325 C Ii:1:005:2 0:8 4 = 01010000
ffff8803fe0e8f00 1434127369 S Ii:1:005:2 -115:8 4 <
ffff8803fe0e8f00 1434207327 C Ii:1:005:2 0:8 4 = 01000000
ffff8803fe0e8f00 1434207370 S Ii:1:005:2 -115:8 4 <
ffff8803fe0e8f00 1434271327 C Ii:1:005:2 0:8 4 = 01010000
ffff8803fe0e8f00 1434271366 S Ii:1:005:2 -115:8 4 <
ffff8803fe0e8f00 1434359294 C Ii:1:005:2 0:8 4 = 01000000
ffff8803fe0e8f00 1434359322 S Ii:1:005:2 -115:8 4 <
ffff8803fdc4a780 1434628249 C Ii:3:003:1 0:8 6 = 0878b211 2c01
ffff8803fdc4a780 1434628279 S Ii:3:003:1 -115:8 6 <
ffff8803fdc4a6c0 1434649528 S Ci:3:003:0 s a1 01 030a 0000 0002 64 <
ffff8803fdc4a6c0 1434649642 C Ci:3:003:0 0 2 = 0af0
ffff8803fdc4a6c0 1434649690 S Ci:3:003:0 s a1 01 030f 0000 0002 64 <
ffff8803fdc4a6c0 1434649780 C Ci:3:003:0 0 2 = 0f77
ffff8803fdc4a6c0 1434649804 S Ci:3:003:0 s a1 01 0312 0000 0002 64 <
ffff8803fdc4a6c0 1434649927 C Ci:3:003:0 0 2 = 1277
ffff8803fdc4a6c0 1434649982 S Ci:3:003:0 s a1 01 0313 0000 0002 64 <
ffff8803fdc4a6c0 1434650069 C Ci:3:003:0 0 2 = 130b
ffff8803fdc4a6c0 1434650124 S Ci:3:003:0 s a1 01 0317 0000 0002 64 <
ffff8803fdc4a6c0 1434650244 C Ci:3:003:0 0 2 = 1700
ffff8803fdc4a6c0 1434650311 S Ci:3:003:0 s a1 01 030b 0000 0002 64 <
ffff8803fdc4a6c0 1434650423 C Ci:3:003:0 0 2 = 0b11
ffff8803fdc4a780 1434692244 C Ii:3:003:1 0:8 2 = 0b11
ffff8803fdc4a780 1434692270 S Ii:3:003:1 -115:8 6 <
ffff8803fe0e8f00 1434895328 C Ii:1:005:2 0:8 4 = 01000100
ffff8803fe0e8f00 1434895369 S Ii:1:005:2 -115:8 4 <
ffff8803fe0e8f00 1434919313 C Ii:1:005:2 0:8 4 = 01000402
ffff8803fe0e8f00 1434919343 S Ii:1:005:2 -115:8 4 <
ffff8803fe0e8f00 1434927331 C Ii:1:005:2 0:8 4 = 01000302
ffff8803fe0e8f00 1434927362 S Ii:1:005:2 -115:8 4 <
ffff8803fe0e8f00 1434951328 C Ii:1:005:2 0:8 4 = 01000401
ffff8803fe0e8f00 1434951359 S Ii:1:005:2 -115:8 4 <
ffff8803fe0e8f00 1434959278 C Ii:1:005:2 0:8 4 = 01000001
ffff8803fe0e8f00 1434959306 S Ii:1:005:2 -115:8 4 <
ffff8803fe0e8f00 1434999280 C Ii:1:005:2 0:8 4 = 010005ff
ffff8803fe0e8f00 1434999307 S Ii:1:005:2 -115:8 4 <
ffff8803fe0e8f00 1435007280 C Ii:1:005:2 0:8 4 = 010006fe
ffff8803fe0e8f00 1435007308 S Ii:1:005:2 -115:8 4 <
ffff8803fe0e8f00 1435023283 C Ii:1:005:2 0:8 4 = 010007fe
ffff8803fe0e8f00 1435023323 S Ii:1:005:2 -115:8 4 <
ffff8803fe0e8f00 1435047332 C Ii:1:005:2 0:8 4 = 01000cfd
ffff8803fe0e8f00 1435047365 S Ii:1:005:2 -115:8 4 <
ffff8803fe0e8f00 1435055329 C Ii:1:005:2 0:8 4 = 010006fe
ffff8803fe0e8f00 1435055359 S Ii:1:005:2 -115:8 4 <
ffff8803fe0e8f00 1435079329 C Ii:1:005:2 0:8 4 = 010008fd
ffff8803fe0e8f00 1435079360 S Ii:1:005:2 -115:8 4 <
ffff8803fe0e8f00 1435087279 C Ii:1:005:2 0:8 4 = 010002ff
ffff8803fe0e8f00 1435087314 S Ii:1:005:2 -115:8 4 <
ffff8803fe0e8f00 1435111302 C Ii:1:005:2 0:8 4 = 010003fe
ffff8803fe0e8f00 1435111337 S Ii:1:005:2 -115:8 4 <
ffff8803fe0e8f00 1435151281 C Ii:1:005:2 0:8 4 = 010002fd
ffff8803fe0e8f00 1435151308 S Ii:1:005:2 -115:8 4 <
ffff8803fe0e8f00 1435167283 C Ii:1:005:2 0:8 4 = 010003fb
ffff8803fe0e8f00 1435167331 S Ii:1:005:2 -115:8 4 <
ffff8803fe0e8f00 1435183280 C Ii:1:005:2 0:8 4 = 010000fd
ffff8803fe0e8f00 1435183301 S Ii:1:005:2 -115:8 4 <
ffff8803fe0e8f00 1435199330 C Ii:1:005:2 0:8 4 = 010001f5
ffff8803fe0e8f00 1435199364 S Ii:1:005:2 -115:8 4 <
ffff8803fe0e8f00 1435215330 C Ii:1:005:2 0:8 4 = 010000fa
ffff8803fe0e8f00 1435215360 S Ii:1:005:2 -115:8 4 <
ffff8803fe0e8f00 1435231330 C Ii:1:005:2 0:8 4 = 010001f8
ffff8803fe0e8f00 1435231361 S Ii:1:005:2 -115:8 4 <
ffff8803fe0e8f00 1435247334 C Ii:1:005:2 0:8 4 = 010000fe
ffff8803fe0e8f00 1435247363 S Ii:1:005:2 -115:8 4 <
ffff8803fe0e8f00 1435255331 C Ii:1:005:2 0:8 4 = 010000ff
ffff8803fe0e8f00 1435255361 S Ii:1:005:2 -115:8 4 <
ffff8803fe0e8f00 1435279330 C Ii:1:005:2 0:8 4 = 010000fd
ffff8803fe0e8f00 1435279359 S Ii:1:005:2 -115:8 4 <
ffff8803fe0e8f00 1435287330 C Ii:1:005:2 0:8 4 = 010001fe
ffff8803fe0e8f00 1435287361 S Ii:1:005:2 -115:8 4 <
ffff8803fe0e8f00 1435311311 C Ii:1:005:2 0:8 4 = 0100fffd
ffff8803fe0e8f00 1435311342 S Ii:1:005:2 -115:8 4 <
ffff8803fe0e8f00 1435327330 C Ii:1:005:2 0:8 4 = 010000fe
ffff8803fe0e8f00 1435327361 S Ii:1:005:2 -115:8 4 <
ffff8803fe0e8f00 1435343282 C Ii:1:005:2 0:8 4 = 0100fefa
ffff8803fe0e8f00 1435343313 S Ii:1:005:2 -115:8 4 <
ffff8803fe0e8f00 1435359329 C Ii:1:005:2 0:8 4 = 0100fffd
ffff8803fe0e8f00 1435359360 S Ii:1:005:2 -115:8 4 <
ffff8803fe0e8f00 1435367294 C Ii:1:005:2 0:8 4 = 0100fefc
ffff8803fe0e8f00 1435367320 S Ii:1:005:2 -115:8 4 <
ffff8803fe0e8f00 1435391304 C Ii:1:005:2 0:8 4 = 0100fcfb
ffff8803fe0e8f00 1435391337 S Ii:1:005:2 -115:8 4 <
ffff8803fe0e8f00 1435399329 C Ii:1:005:2 0:8 4 = 010000ff
ffff8803fe0e8f00 1435399359 S Ii:1:005:2 -115:8 4 <
ffff8803fe0e8f00 1435423335 C Ii:1:005:2 0:8 4 = 0100fdfe
ffff8803fe0e8f00 1435423366 S Ii:1:005:2 -115:8 4 <
ffff8803fe0e8f00 1435431330 C Ii:1:005:2 0:8 4 = 0100feff
ffff8803fe0e8f00 1435431360 S Ii:1:005:2 -115:8 4 <
ffff8803fe0e8f00 1435455285 C Ii:1:005:2 0:8 4 = 0100fafd
ffff8803fe0e8f00 1435455323 S Ii:1:005:2 -115:8 4 <
ffff8803fe0e8f00 1435463313 C Ii:1:005:2 0:8 4 = 0100ffff
ffff8803fe0e8f00 1435463345 S Ii:1:005:2 -115:8 4 <
ffff8803fe0e8f00 1435487315 C Ii:1:005:2 0:8 4 = 0100fbfe
ffff8803fe0e8f00 1435487346 S Ii:1:005:2 -115:8 4 <
ffff8803fe0e8f00 1435495291 C Ii:1:005:2 0:8 4 = 0100fefe
ffff8803fe0e8f00 1435495321 S Ii:1:005:2 -115:8 4 <
ffff8803fe0e8f00 1435511334 C Ii:1:005:2 0:8 4 = 0100feff
ffff8803fe0e8f00 1435511365 S Ii:1:005:2 -115:8 4 <
ffff8803fe0e8f00 1435527338 C Ii:1:005:2 0:8 4 = 0100fdfc
ffff8803fe0e8f00 1435527369 S Ii:1:005:2 -115:8 4 <
ffff8803fe0e8f00 1435543305 C Ii:1:005:2 0:8 4 = 0100fefe
ffff8803fe0e8f00 1435543336 S Ii:1:005:2 -115:8 4 <
ffff8803fe0e8f00 1435567318 C Ii:1:005:2 0:8 4 = 0100fefc
ffff8803fe0e8f00 1435567349 S Ii:1:005:2 -115:8 4 <
ffff8803fe0e8f00 1435575283 C Ii:1:005:2 0:8 4 = 0100ffff
ffff8803fe0e8f00 1435575310 S Ii:1:005:2 -115:8 4 <
ffff8803fe0e8f00 1435607284 C Ii:1:005:2 0:8 4 = 0100ff00
ffff8803fe0e8f00 1435607312 S Ii:1:005:2 -115:8 4 <
ffff8803fe0e8f00 1435655332 C Ii:1:005:2 0:8 4 = 010000ff
ffff8803fe0e8f00 1435655363 S Ii:1:005:2 -115:8 4 <
ffff8803fe0e8f00 1435679314 C Ii:1:005:2 0:8 4 = 0100ff00
ffff8803fe0e8f00 1435679346 S Ii:1:005:2 -115:8 4 <
ffff8803fe0e8f00 1435807339 C Ii:1:005:2 0:8 4 = 01010000
ffff8803fe0e8f00 1435807372 S Ii:1:005:2 -115:8 4 <
ffff8803fe0e8f00 1435935312 C Ii:1:005:2 0:8 4 = 01000000
ffff8803fe0e8f00 1435935354 S Ii:1:005:2 -115:8 4 <
ffff8803fe0e8f00 1436127345 C Ii:1:005:2 0:8 4 = 0100ff00
ffff8803fe0e8f00 1436127386 S Ii:1:005:2 -115:8 4 <
ffff8803fe0e8f00 1436175349 C Ii:1:005:2 0:8 4 = 01000001
ffff8803fe0e8f00 1436175390 S Ii:1:005:2 -115:8 4 <
ffff8803fe0e8f00 1436191343 C Ii:1:005:2 0:8 4 = 01000100
ffff8803fe0e8f00 1436191373 S Ii:1:005:2 -115:8 4 <
ffff8803fe0e8f00 1436239342 C Ii:1:005:2 0:8 4 = 01000102
ffff8803fe0e8f00 1436239374 S Ii:1:005:2 -115:8 4 <
ffff8803fe0e8f00 1436247313 C Ii:1:005:2 0:8 4 = 01000100
ffff8803fe0e8f00 1436247343 S Ii:1:005:2 -115:8 4 <
ffff8803fe0e8f00 1436271313 C Ii:1:005:2 0:8 4 = 01000001
ffff8803fe0e8f00 1436271343 S Ii:1:005:2 -115:8 4 <
ffff8803fe0e8f00 1436279340 C Ii:1:005:2 0:8 4 = 01000101
ffff8803fe0e8f00 1436279370 S Ii:1:005:2 -115:8 4 <
ffff8803fe0e8f00 1436303339 C Ii:1:005:2 0:8 4 = 01000204
ffff8803fe0e8f00 1436303370 S Ii:1:005:2 -115:8 4 <
ffff8803fe0e8f00 1436311339 C Ii:1:005:2 0:8 4 = 01000102
ffff8803fe0e8f00 1436311369 S Ii:1:005:2 -115:8 4 <
ffff8803fe0e8f00 1436335338 C Ii:1:005:2 0:8 4 = 01000304
ffff8803fe0e8f00 1436335369 S Ii:1:005:2 -115:8 4 <
ffff8803fe0e8f00 1436343290 C Ii:1:005:2 0:8 4 = 01000103
ffff8803fe0e8f00 1436343320 S Ii:1:005:2 -115:8 4 <
ffff8803fe0e8f00 1436367345 C Ii:1:005:2 0:8 4 = 01000202
ffff8803fe0e8f00 1436367375 S Ii:1:005:2 -115:8 4 <
ffff8803fe0e8f00 1436383313 C Ii:1:005:2 0:8 4 = 01000102
ffff8803fe0e8f00 1436383344 S Ii:1:005:2 -115:8 4 <
ffff8803fe0e8f00 1436391342 C Ii:1:005:2 0:8 4 = 01000102
ffff8803fe0e8f00 1436391373 S Ii:1:005:2 -115:8 4 <
ffff8803fe0e8f00 1436415320 C Ii:1:005:2 0:8 4 = 01000204
ffff8803fe0e8f00 1436415350 S Ii:1:005:2 -115:8 4 <
ffff8803fe0e8f00 1436423296 C Ii:1:005:2 0:8 4 = 01000103
ffff8803fe0e8f00 1436423325 S Ii:1:005:2 -115:8 4 <
ffff8803fe0e8f00 1436447341 C Ii:1:005:2 0:8 4 = 01000306
ffff8803fe0e8f00 1436447371 S Ii:1:005:2 -115:8 4 <
ffff8803fe0e8f00 1436455345 C Ii:1:005:2 0:8 4 = 01000101
ffff8803fe0e8f00 1436455375 S Ii:1:005:2 -115:8 4 <
ffff8803fe0e8f00 1436479342 C Ii:1:005:2 0:8 4 = 01000101
ffff8803fe0e8f00 1436479372 S Ii:1:005:2 -115:8 4 <
ffff8803fe0e8f00 1436567341 C Ii:1:005:2 0:8 4 = 01000100
ffff8803fe0e8f00 1436567372 S Ii:1:005:2 -115:8 4 <
ffff8803fe0e8f00 1436591341 C Ii:1:005:2 0:8 4 = 01000100
ffff8803fe0e8f00 1436591371 S Ii:1:005:2 -115:8 4 <
ffff8803fe0e8f00 1436615341 C Ii:1:005:2 0:8 4 = 01000100
ffff8803fe0e8f00 1436615372 S Ii:1:005:2 -115:8 4 <
ffff8803fe0e8f00 1436631347 C Ii:1:005:2 0:8 4 = 01000100
ffff8803fe0e8f00 1436631377 S Ii:1:005:2 -115:8 4 <
ffff8803fe0e8f00 1436647327 C Ii:1:005:2 0:8 4 = 01000402
ffff8803fe0e8f00 1436647358 S Ii:1:005:2 -115:8 4 <
ffff8803fe0e8f00 1436663318 C Ii:1:005:2 0:8 4 = 01000201
ffff8803fe0e8f00 1436663348 S Ii:1:005:2 -115:8 4 <
ffff8803fe0e8f00 1436679294 C Ii:1:005:2 0:8 4 = 01000302
ffff8803fe0e8f00 1436679322 S Ii:1:005:2 -115:8 4 <
ffff8803fe0e8f00 1436719348 C Ii:1:005:2 0:8 4 = 01000100
ffff8803fe0e8f00 1436719378 S Ii:1:005:2 -115:8 4 <
ffff8803fe0e8f00 1436823329 C Ii:1:005:2 0:8 4 = 010000ff
ffff8803fe0e8f00 1436823370 S Ii:1:005:2 -115:8 4 <
ffff8803fe0e8f00 1436831345 C Ii:1:005:2 0:8 4 = 01000100
ffff8803fe0e8f00 1436831376 S Ii:1:005:2 -115:8 4 <
ffff8803fe0e8f00 1436871349 C Ii:1:005:2 0:8 4 = 010000ff
ffff8803fe0e8f00 1436871380 S Ii:1:005:2 -115:8 4 <
ffff8803fe0e8f00 1436927346 C Ii:1:005:2 0:8 4 = 01000200
ffff8803fe0e8f00 1436927380 S Ii:1:005:2 -115:8 4 <
ffff8803fe0e8f00 1436951319 C Ii:1:005:2 0:8 4 = 01000300
ffff8803fe0e8f00 1436951349 S Ii:1:005:2 -115:8 4 <
ffff8803fe0e8f00 1436959345 C Ii:1:005:2 0:8 4 = 01000500
ffff8803fe0e8f00 1436959375 S Ii:1:005:2 -115:8 4 <
ffff8803fe0e8f00 1436983346 C Ii:1:005:2 0:8 4 = 01001201
ffff8803fe0e8f00 1436983376 S Ii:1:005:2 -115:8 4 <
ffff8803fe0e8f00 1436991319 C Ii:1:005:2 0:8 4 = 01000c01
ffff8803fe0e8f00 1436991351 S Ii:1:005:2 -115:8 4 <
ffff8803fe0e8f00 1437007312 C Ii:1:005:2 0:8 4 = 01000900
ffff8803fe0e8f00 1437007346 S Ii:1:005:2 -115:8 4 <
ffff8803fe0e8f00 1437023312 C Ii:1:005:2 0:8 4 = 01000bff
ffff8803fe0e8f00 1437023352 S Ii:1:005:2 -115:8 4 <
ffff8803fe0e8f00 1437039350 C Ii:1:005:2 0:8 4 = 01000200
ffff8803fe0e8f00 1437039380 S Ii:1:005:2 -115:8 4 <
ffff8803fe0e8f00 1437055298 C Ii:1:005:2 0:8 4 = 010008fe
ffff8803fe0e8f00 1437055326 S Ii:1:005:2 -115:8 4 <
ffff8803fe0e8f00 1437071297 C Ii:1:005:2 0:8 4 = 010003ff
ffff8803fe0e8f00 1437071325 S Ii:1:005:2 -115:8 4 <
ffff8803fe0e8f00 1437087299 C Ii:1:005:2 0:8 4 = 010006fe
ffff8803fe0e8f00 1437087324 S Ii:1:005:2 -115:8 4 <
ffff8803fe0e8f00 1437103298 C Ii:1:005:2 0:8 4 = 01000400
ffff8803fe0e8f00 1437103323 S Ii:1:005:2 -115:8 4 <
ffff8803fe0e8f00 1437111296 C Ii:1:005:2 0:8 4 = 010004ff
ffff8803fe0e8f00 1437111311 S Ii:1:005:2 -115:8 4 <
ffff8803fe0e8f00 1437135297 C Ii:1:005:2 0:8 4 = 01000700
ffff8803fe0e8f00 1437135320 S Ii:1:005:2 -115:8 4 <
ffff8803fe0e8f00 1437143298 C Ii:1:005:2 0:8 4 = 01000400
ffff8803fe0e8f00 1437143319 S Ii:1:005:2 -115:8 4 <
ffff8803fe0e8f00 1437167312 C Ii:1:005:2 0:8 4 = 01000401
ffff8803fe0e8f00 1437167345 S Ii:1:005:2 -115:8 4 <
ffff8803fe0e8f00 1437183298 C Ii:1:005:2 0:8 4 = 01000201
ffff8803fe0e8f00 1437183323 S Ii:1:005:2 -115:8 4 <
ffff8803fe0e8f00 1437199313 C Ii:1:005:2 0:8 4 = 01000401
ffff8803fe0e8f00 1437199337 S Ii:1:005:2 -115:8 4 <
ffff8803fe0e8f00 1437231307 C Ii:1:005:2 0:8 4 = 01000101
ffff8803fe0e8f00 1437231336 S Ii:1:005:2 -115:8 4 <
ffff8803fe0e8f00 1437247321 C Ii:1:005:2 0:8 4 = 01000100
ffff8803fe0e8f00 1437247352 S Ii:1:005:2 -115:8 4 <
ffff8803fe0e8f00 1437263348 C Ii:1:005:2 0:8 4 = 01000102
ffff8803fe0e8f00 1437263378 S Ii:1:005:2 -115:8 4 <
ffff8803fe0e8f00 1437271349 C Ii:1:005:2 0:8 4 = 01000102
ffff8803fe0e8f00 1437271379 S Ii:1:005:2 -115:8 4 <
ffff8803fe0e8f00 1437295348 C Ii:1:005:2 0:8 4 = 01000002
ffff8803fe0e8f00 1437295377 S Ii:1:005:2 -115:8 4 <
ffff8803fe0e8f00 1437303327 C Ii:1:005:2 0:8 4 = 01000102
ffff8803fe0e8f00 1437303357 S Ii:1:005:2 -115:8 4 <
ffff8803fe0e8f00 1437327323 C Ii:1:005:2 0:8 4 = 01000004
ffff8803fe0e8f00 1437327352 S Ii:1:005:2 -115:8 4 <
ffff8803fe0e8f00 1437335300 C Ii:1:005:2 0:8 4 = 01000002
ffff8803fe0e8f00 1437335324 S Ii:1:005:2 -115:8 4 <
ffff8803fe0e8f00 1437359349 C Ii:1:005:2 0:8 4 = 01000006
ffff8803fe0e8f00 1437359378 S Ii:1:005:2 -115:8 4 <
ffff8803fe0e8f00 1437367300 C Ii:1:005:2 0:8 4 = 01000103
ffff8803fe0e8f00 1437367325 S Ii:1:005:2 -115:8 4 <
ffff8803fe0e8f00 1437383316 C Ii:1:005:2 0:8 4 = 01000004
ffff8803fe0e8f00 1437383347 S Ii:1:005:2 -115:8 4 <
ffff8803fe0e8f00 1437399360 C Ii:1:005:2 0:8 4 = 01000001
ffff8803fe0e8f00 1437399390 S Ii:1:005:2 -115:8 4 <
ffff8803fe0e8f00 1437463307 C Ii:1:005:2 0:8 4 = 01000001
ffff8803fe0e8f00 1437463336 S Ii:1:005:2 -115:8 4 <
ffff8803fe0e8f00 1437487350 C Ii:1:005:2 0:8 4 = 01000101
ffff8803fe0e8f00 1437487380 S Ii:1:005:2 -115:8 4 <
ffff8803fe0e8f00 1437511355 C Ii:1:005:2 0:8 4 = 01000001
ffff8803fe0e8f00 1437511385 S Ii:1:005:2 -115:8 4 <
ffff8803fdc4a780 1437628274 C Ii:3:003:1 0:8 6 = 0878d011 2c01
ffff8803fdc4a780 1437628300 S Ii:3:003:1 -115:8 6 <
ffff8803fdc4a6c0 1437650585 S Ci:3:003:0 s a1 01 030a 0000 0002 64 <
ffff8803fdc4a6c0 1437650711 C Ci:3:003:0 0 2 = 0af0
ffff8803fdc4a6c0 1437650763 S Ci:3:003:0 s a1 01 030f 0000 0002 64 <
ffff8803fdc4a6c0 1437650889 C Ci:3:003:0 0 2 = 0f77
ffff8803fdc4a6c0 1437650945 S Ci:3:003:0 s a1 01 0312 0000 0002 64 <
ffff8803fdc4a6c0 1437651030 C Ci:3:003:0 0 2 = 1277
ffff8803fdc4a6c0 1437651086 S Ci:3:003:0 s a1 01 0313 0000 0002 64 <
ffff8803fdc4a6c0 1437651173 C Ci:3:003:0 0 2 = 130a
ffff8803fdc4a6c0 1437651236 S Ci:3:003:0 s a1 01 0317 0000 0002 64 <
ffff8803fdc4a6c0 1437651379 C Ci:3:003:0 0 2 = 1700
ffff8803fdc4a6c0 1437651434 S Ci:3:003:0 s a1 01 030b 0000 0002 64 <
ffff8803fdc4a6c0 1437651534 C Ci:3:003:0 0 2 = 0b11
ffff8803fe0e8f00 1437663357 C Ii:1:005:2 0:8 4 = 01010000
ffff8803fe0e8f00 1437663390 S Ii:1:005:2 -115:8 4 <
ffff8803fdc4a780 1437692269 C Ii:3:003:1 0:8 2 = 0b11
ffff8803fdc4a780 1437692295 S Ii:3:003:1 -115:8 6 <
ffff8803fe0e8f00 1437783358 C Ii:1:005:2 0:8 4 = 01000000
ffff8803fe0e8f00 1437783390 S Ii:1:005:2 -115:8 4 <
ffff880377ac9a80 1437827765 S Co:1:036:0 s 21 09 0300 0000 0008 8 = 55050000 00000000
ffff880377ac9a80 1437827954 C Co:1:036:0 0 8 >
ffff8803750ee900 1437856760 S Ci:1:036:0 s a1 01 0300 0000 0008 8 <
ffff8803750ee900 1437856953 C Ci:1:036:0 0 8 = 0b010101 0000000e
ffff8803750ee900 1437873756 S Ci:1:036:0 s a1 01 0300 0000 0008 8 <
ffff8803750ee900 1437873952 C Ci:1:036:0 0 8 = 0496960c 85009ae2
ffff8803750ee900 1437888665 S Ci:1:036:0 s a1 01 0300 0000 0008 8 <
ffff8803750ee900 1437888826 C Ci:1:036:0 0 8 = 31ab027f b3000019
ffff8803750ee900 1437904012 S Ci:1:036:0 s a1 01 0300 0000 0008 8 <
ffff8803750ee900 1437904183 C Ci:1:036:0 0 8 = 2f910117 96002fec
ffff8803750ee900 1437920747 S Ci:1:036:0 s a1 01 0300 0000 0008 8 <
ffff8803750ee900 1437920949 C Ci:1:036:0 0 8 = fddfc3ec 3d00961f
ffff8803750ee900 1437935633 S Ci:1:036:0 s a1 01 0300 0000 0008 8 <
ffff8803750ee900 1437935843 C Ci:1:036:0 0 8 = 620f7e5f fe00bfff
ffff8803750ee900 1437950938 S Ci:1:036:0 s a1 01 0300 0000 0008 8 <
ffff8803750ee900 1437951078 C Ci:1:036:0 0 8 = 3fffdfff 0f00ff8f
ffff8803750ee900 1437967729 S Ci:1:036:0 s a1 01 0300 0000 0008 8 <
ffff8803750ee900 1437967956 C Ci:1:036:0 0 8 = ff8fffef ff00bfff
ffff8803750ee900 1437982761 S Ci:1:036:0 s a1 01 0300 0000 0008 8 <
ffff8803750ee900 1437982955 C Ci:1:036:0 0 8 = ffffdf1c dd00042d
ffff8803750ee900 1437997662 S Ci:1:036:0 s a1 01 0300 0000 0008 8 <
ffff8803750ee900 1437997829 C Ci:1:036:0 0 8 = e36feb2f 0c00dd1c
ffff8803750ee900 1438014720 S Ci:1:036:0 s a1 01 0300 0000 0008 8 <
ffff8803750ee900 1438014954 C Ci:1:036:0 0 8 = 4dffefff bf000c4f
ffff8803750ee900 1438029753 S Ci:1:036:0 s a1 01 0300 0000 0008 8 <
ffff8803750ee900 1438029970 C Ci:1:036:0 0 8 = 0c7d6f9d 6f002d0f
ffff8803750ee900 1438044712 S Ci:1:036:0 s a1 01 0300 0000 0008 8 <
ffff8803750ee900 1438044829 C Ci:1:036:0 0 8 = 6d9fafff ef00ff9f
ffff8803750ee900 1438061704 S Ci:1:036:0 s a1 01 0300 0000 0008 8 <
ffff8803750ee900 1438061828 C Ci:1:036:0 0 8 = 0c610cd1 ef006def
ffff8803750ee900 1438076748 S Ci:1:036:0 s a1 01 0300 0000 0008 8 <
ffff8803750ee900 1438076950 C Ci:1:036:0 0 8 = 9d0ccd1c cf00ffaf
ffff8803750ee900 1438091790 S Ci:1:036:0 s a1 01 0300 0000 0008 8 <
ffff8803750ee900 1438091954 C Ci:1:036:0 0 8 = ffdf0caf 0c002dff
ffff8803750ee900 1438106677 S Ci:1:036:0 s a1 01 0300 0000 0008 8 <
ffff8803750ee900 1438106828 C Ci:1:036:0 0 8 = 6dff3d0c 01000c71
ffff880377ac9a80 1438123726 S Ci:1:036:0 s a1 01 0300 0000 0008 8 <
ffff880377ac9a80 1438123830 C Ci:1:036:0 0 8 = ffefff2f ef004def
ffff8803663ce240 1438138771 S Ci:1:036:0 s a1 01 0300 0000 0008 8 <
ffff8803663ce240 1438138937 C Ci:1:036:0 0 8 = edefbd0c 71001cd1
ffff8803663ce240 1438153671 S Ci:1:036:0 s a1 01 0300 0000 0008 8 <
ffff8803663ce240 1438153831 C Ci:1:036:0 0 8 = ffcdff9f ff00fffd
ffff8803708f9000 1438168888 S Ci:1:036:0 s a1 01 0300 0000 0008 8 <
ffff8803708f9000 1438169061 C Ci:1:036:0 0 8 = adfdbdfd 9f00fe8f
ffff8803750ee900 1438185762 S Ci:1:036:0 s a1 01 0300 0000 0008 8 <
ffff8803750ee900 1438185932 C Ci:1:036:0 0 8 = 0ced0cad ff009fff
ffff8803663ce240 1438200651 S Ci:1:036:0 s a1 01 0300 0000 0008 8 <
ffff8803663ce240 1438200808 C Ci:1:036:0 0 8 = bfef1fef bf000cf5
ffff8803750ee900 1438218636 S Ci:1:036:0 s a1 01 0300 0000 0008 8 <
ffff8803750ee900 1438218830 C Ci:1:036:0 0 8 = 0c45ef6d ef006dff
ffff8803750ee900 1438232743 S Ci:1:036:0 s a1 01 0300 0000 0008 8 <
ffff8803750ee900 1438232963 C Ci:1:036:0 0 8 = 5fffcf1d 29000c21
ffff8803750ee900 1438247609 S Ci:1:036:0 s a1 01 0300 0000 0008 8 <
ffff8803750ee900 1438247689 C Ci:1:036:0 0 8 = eee7ee27 0c00810c
ffff8803663ce780 1438264667 S Ci:1:036:0 s a1 01 0300 0000 0008 8 <
ffff8803663ce780 1438264832 C Ci:1:036:0 0 8 = 21ffefff 9f00ffff
ffff8803663ce780 1438279706 S Ci:1:036:0 s a1 01 0300 0000 0008 8 <
ffff8803663ce780 1438279809 C Ci:1:036:0 0 8 = ffefff1f ff009fff
ffff8803663ce780 1438294742 S Ci:1:036:0 s a1 01 0300 0000 0008 8 <
ffff8803663ce780 1438294958 C Ci:1:036:0 0 8 = 0fff3fff ef00ff5f
ffff8803663ce780 1438309681 S Ci:1:036:0 s a1 01 0300 0000 0008 8 <
ffff8803663ce780 1438309810 C Ci:1:036:0 0 8 = 1c3d04cd e3006feb
ffff8803663ce780 1438326691 S Ci:1:036:0 s a1 01 0300 0000 0008 8 <
ffff8803663ce780 1438326810 C Ci:1:036:0 0 8 = 5f0cad1c dd00ffcf
ffff8803663ce780 1438341732 S Ci:1:036:0 s a1 01 0300 0000 0008 8 <
ffff8803663ce780 1438341814 C Ci:1:036:0 0 8 = ff6f1c2f 0c005def
ffff8803663ce780 1438356709 S Ci:1:036:0 s a1 01 0300 0000 0008 8 <
ffff8803663ce780 1438356837 C Ci:1:036:0 0 8 = 3def4d00 8d0000bd
ffff8803750ee900 1438373682 S Ci:1:036:0 s a1 01 0300 0000 0008 8 <
ffff8803750ee900 1438373831 C Ci:1:036:0 0 8 = ff8fffdf 1c004f0c
ffff8803750ee900 1438388736 S Ci:1:036:0 s a1 01 0300 0000 0008 8 <
ffff8803750ee900 1438388811 C Ci:1:036:0 0 8 = 1def5def ad00001d
ffff8803750ee900 1438405642 S Ci:1:036:0 s a1 01 0300 0000 0008 8 <
ffff8803750ee900 1438405823 C Ci:1:036:0 0 8 = 003dffbf ff00ef0c
ffff8803d9ba3600 1438420685 S Ci:1:036:0 s a1 01 0300 0000 0008 8 <
ffff8803d9ba3600 1438420811 C Ci:1:036:0 0 8 = 0f0c2d6f dd006f9d
ffff880377ac9a80 1438435702 S Ci:1:036:0 s a1 01 0300 0000 0008 8 <
ffff880377ac9a80 1438435823 C Ci:1:036:0 0 8 = 0f0d9fff ff00afff
ffff8803750ee900 1438450985 S Ci:1:036:0 s a1 01 0300 0000 0008 8 <
ffff8803750ee900 1438451208 C Ci:1:036:0 0 8 = af0c010c c100fe4f
ffff8803750ee900 1438467661 S Ci:1:036:0 s a1 01 0300 0000 0008 8 <
ffff8803750ee900 1438467832 C Ci:1:036:0 0 8 = fedf0c21 0c00b1f4
ffff8803750ee900 1438482699 S Ci:1:036:0 s a1 01 0300 0000 0008 8 <
ffff8803750ee900 1438482832 C Ci:1:036:0 0 8 = 4f774db7 8d00d7bd
ffff8803663ce780 1438497735 S Ci:1:036:0 s a1 01 0300 0000 0008 8 <
ffff8803663ce780 1438497949 C Ci:1:036:0 0 8 = e49fffef f400cf77
ffff8803663ce780 1438512730 S Ci:1:036:0 s a1 01 0300 0000 0008 8 <
ffff8803663ce780 1438512966 C Ci:1:036:0 0 8 = 2db70dd7 9d00e44f
ffff8803d9ba3600 1438529684 S Ci:1:036:0 s a1 01 0300 0000 0008 8 <
ffff8803d9ba3600 1438529835 C Ci:1:036:0 0 8 = ffdf8cff 7700ed77
ffff8803d9ba3600 1438544725 S Ci:1:036:0 s a1 01 0300 0000 0008 8 <
ffff8803d9ba3600 1438544842 C Ci:1:036:0 0 8 = 3df72ded 4f00ffcf
ffff8803d9ba3600 1438559616 S Ci:1:036:0 s a1 01 0300 0000 0008 8 <
ffff8803d9ba3600 1438559812 C Ci:1:036:0 0 8 = 8f9d779d 77005d77
ffff8803d9ba3600 1438576674 S Ci:1:036:0 s a1 01 0300 0000 0008 8 <
ffff8803d9ba3600 1438576825 C Ci:1:036:0 0 8 = dd6c6dff af008cbf
ffff8803d9ba3600 1438591712 S Ci:1:036:0 s a1 01 0300 0000 0008 8 <
ffff8803d9ba3600 1438591825 C Ci:1:036:0 0 8 = 779d773d 77009d8c
ffff8803d9ba3600 1438608621 S Ci:1:036:0 s a1 01 0300 0000 0008 8 <
ffff8803d9ba3600 1438608840 C Ci:1:036:0 0 8 = 8fff2f8f 0f0075ad
ffff8803d9ba3600 1438623658 S Ci:1:036:0 s a1 01 0300 0000 0008 8 <
ffff8803d9ba3600 1438623842 C Ci:1:036:0 0 8 = 77ed770d 0c007fff
ffff8803d9ba3600 1438638697 S Ci:1:036:0 s a1 01 0300 0000 0008 8 <
ffff8803d9ba3600 1438638824 C Ci:1:036:0 0 8 = cf8c4f77 5d0077ad
ffff8803d9ba3600 1438653735 S Ci:1:036:0 s a1 01 0300 0000 0008 8 <
ffff8803d9ba3600 1438653961 C Ci:1:036:0 0 8 = f73deddf ff00df8c
ffff8803d9ba3600 1438670646 S Ci:1:036:0 s a1 01 0300 0000 0008 8 <
ffff8803d9ba3600 1438670833 C Ci:1:036:0 0 8 = 2f776d77 4d00772d
ffff8803d9ba3600 1438685687 S Ci:1:036:0 s a1 01 0300 0000 0008 8 <
ffff8803d9ba3600 1438685836 C Ci:1:036:0 0 8 = 8c9f6f68 e900b045
ffff8803d9ba3600 1438700716 S Ci:1:036:0 s a1 01 0300 0000 0008 8 <
ffff8803d9ba3600 1438700835 C Ci:1:036:0 0 8 = dd7eb3af e600d9ce
ffff8803663ce780 1438717640 S Ci:1:036:0 s a1 01 0300 0000 0008 8 <
ffff8803663ce780 1438717836 C Ci:1:036:0 0 8 = 29a39df9 23007779
ffff8803663ce780 1438732667 S Ci:1:036:0 s a1 01 0300 0000 0008 8 <
ffff8803663ce780 1438732835 C Ci:1:036:0 0 8 = 0080bdc1 d2004ea9
ffff8803663ce780 1438747713 S Ci:1:036:0 s a1 01 0300 0000 0008 8 <
ffff8803663ce780 1438747819 C Ci:1:036:0 0 8 = 4d08c87b 9700b489
ffff8803663ce780 1438764623 S Ci:1:036:0 s a1 01 0300 0000 0008 8 <
ffff8803663ce780 1438764843 C Ci:1:036:0 0 8 = eb106d13 d100c398
ffff8803663ce780 1438779660 S Ci:1:036:0 s a1 01 0300 0000 0008 8 <
ffff8803663ce780 1438779826 C Ci:1:036:0 0 8 = 80152df8 8700d75b
ffff8803663ce780 1438794702 S Ci:1:036:0 s a1 01 0300 0000 0008 8 <
ffff8803663ce780 1438794827 C Ci:1:036:0 0 8 = 79b2df45 3900dd46
ffff8803663ce780 1438809785 S Ci:1:036:0 s a1 01 0300 0000 0008 8 <
ffff8803663ce780 1438809953 C Ci:1:036:0 0 8 = 6bd7f366 ae0001e5
ffff880377ac9a80 1438826682 S Ci:1:036:0 s a1 01 0300 0000 0008 8 <
ffff880377ac9a80 1438826814 C Ci:1:036:0 0 8 = 007039eb ac00f0e7
ffff8803750ee900 1438841692 S Ci:1:036:0 s a1 01 0300 0000 0008 8 <
ffff8803750ee900 1438841814 C Ci:1:036:0 0 8 = ff87e0a4 96001748
ffff8803750ee900 1438856732 S Ci:1:036:0 s a1 01 0300 0000 0008 8 <
ffff8803750ee900 1438856842 C Ci:1:036:0 0 8 = c6a1829f 2700c4f0
ffff8803750ee900 1438873640 S Ci:1:036:0 s a1 01 0300 0000 0008 8 <
ffff8803750ee900 1438873849 C Ci:1:036:0 0 8 = 273bd63d 89005199
ffff8803750ee900 1438888677 S Ci:1:036:0 s a1 01 0300 0000 0008 8 <
ffff8803750ee900 1438888837 C Ci:1:036:0 0 8 = e3b129bb 2700ecb8
ffff8803750ee900 1438903705 S Ci:1:036:0 s a1 01 0300 0000 0008 8 <
ffff8803750ee900 1438903836 C Ci:1:036:0 0 8 = 0d844137 0200550d
ffff8803663ce480 1438920621 S Ci:1:036:0 s a1 01 0300 0000 0008 8 <
ffff8803663ce480 1438920834 C Ci:1:036:0 0 8 = 726bc6e2 4f0071fc
ffff8803663ce480 1438935668 S Ci:1:036:0 s a1 01 0300 0000 0008 8 <
ffff8803663ce480 1438935837 C Ci:1:036:0 0 8 = a19cd383 d5001e61
ffff8803d9ba3600 1438950769 S Ci:1:036:0 s a1 01 0300 0000 0008 8 <
ffff8803d9ba3600 1438950967 C Ci:1:036:0 0 8 = f953d8b9 f9001099
ffff8803d9ba3600 1438967614 S Ci:1:036:0 s a1 01 0300 0000 0008 8 <
ffff8803d9ba3600 1438967692 C Ci:1:036:0 0 8 = 424a43c9 660049bb
ffff8803d9ba3600 1438982649 S Ci:1:036:0 s a1 01 0300 0000 0008 8 <
ffff8803d9ba3600 1438982829 C Ci:1:036:0 0 8 = 74149482 980075f8
ffff8803d9ba3600 1438997682 S Ci:1:036:0 s a1 01 0300 0000 0008 8 <
ffff8803d9ba3600 1438997839 C Ci:1:036:0 0 8 = b3abed9d 99007055
ffff880377ac90c0 1439014735 S Ci:1:036:0 s a1 01 0300 0000 0008 8 <
ffff880377ac90c0 1439014954 C Ci:1:036:0 0 8 = 700afc77 d1000203
ffff8803750ee900 1439029640 S Ci:1:036:0 s a1 01 0300 0000 0008 8 <
ffff8803750ee900 1439029815 C Ci:1:036:0 0 8 = cb7f8268 7100c0ab
ffff8803663ce480 1439044672 S Ci:1:036:0 s a1 01 0300 0000 0008 8 <
ffff8803663ce480 1439044839 C Ci:1:036:0 0 8 = 056fd417 b7002c9c
ffff8803d9ba3600 1439061715 S Ci:1:036:0 s a1 01 0300 0000 0008 8 <
ffff8803d9ba3600 1439061835 C Ci:1:036:0 0 8 = 78ae2d87 7400f30e
ffff8803d9ba3600 1439076628 S Ci:1:036:0 s a1 01 0300 0000 0008 8 <
ffff8803d9ba3600 1439076841 C Ci:1:036:0 0 8 = bec03ac3 90007beb
ffff880377ac90c0 1439091656 S Ci:1:036:0 s a1 01 0300 0000 0008 8 <
ffff880377ac90c0 1439091816 C Ci:1:036:0 0 8 = 101fcd6b 47004cc0
ffff880377ac90c0 1439106698 S Ci:1:036:0 s a1 01 0300 0000 0008 8 <
ffff880377ac90c0 1439106839 C Ci:1:036:0 0 8 = af42e15e 0400a0fe
ffff880377ac90c0 1439123741 S Ci:1:036:0 s a1 01 0300 0000 0008 8 <
ffff880377ac90c0 1439123972 C Ci:1:036:0 0 8 = 0c1844c6 26004d0a
ffff880377ac90c0 1439138660 S Ci:1:036:0 s a1 01 0300 0000 0008 8 <
ffff880377ac90c0 1439138817 C Ci:1:036:0 0 8 = 4adc3fcc b5004d93
ffff880377ac90c0 1439153686 S Ci:1:036:0 s a1 01 0300 0000 0008 8 <
ffff880377ac90c0 1439153817 C Ci:1:036:0 0 8 = 95b9e203 24003aec
ffff88040201fc00 1439170746 S Ci:1:036:0 s a1 01 0300 0000 0008 8 <
ffff88040201fc00 1439170945 C Ci:1:036:0 0 8 = a7a53a81 8600ab05
ffff88040201fc00 1439185630 S Ci:1:036:0 s a1 01 0300 0000 0008 8 <
ffff88040201fc00 1439185838 C Ci:1:036:0 0 8 = 935d719d 5300ae52
ffff88040201fc00 1439200671 S Ci:1:036:0 s a1 01 0300 0000 0008 8 <
ffff88040201fc00 1439200823 C Ci:1:036:0 0 8 = 68c50d86 1800a4a6
ffff88040201fc00 1439216489 S Ci:1:036:0 s a1 01 0300 0000 0008 8 <
ffff88040201fc00 1439216695 C Ci:1:036:0 0 8 = 1edb7813 4300c5f6
ffff88040201fc00 1439231613 S Ci:1:036:0 s a1 01 0300 0000 0008 8 <
ffff88040201fc00 1439231837 C Ci:1:036:0 0 8 = 5dab7a98 50005c20
ffff88040201fc00 1439248664 S Ci:1:036:0 s a1 01 0300 0000 0008 8 <
ffff88040201fc00 1439248842 C Ci:1:036:0 0 8 = 7d04a584 8300a95a
ffff88040201fc00 1439263700 S Ci:1:036:0 s a1 01 0300 0000 0008 8 <
ffff88040201fc00 1439263829 C Ci:1:036:0 0 8 = 8ba2924f dc008c85
ffff88040201fc00 1439278740 S Ci:1:036:0 s a1 01 0300 0000 0008 8 <
ffff88040201fc00 1439278830 C Ci:1:036:0 0 8 = 17cb8341 fe00897a
ffff88040201fc00 1439299029 S Ci:1:036:0 s a1 01 0300 0000 0008 8 <
ffff88040201fc00 1439299195 C Ci:1:036:0 0 8 = 51448a6f 10009c37
ffff88040201fc00 1439309550 S Ci:1:036:0 s a1 01 0300 0000 0008 8 <
ffff88040201fc00 1439309693 C Ci:1:036:0 0 8 = 08fde5d6 6c004228
ffff88040201fc00 1439325633 S Ci:1:036:0 s a1 01 0300 0000 0008 8 <
ffff88040201fc00 1439325848 C Ci:1:036:0 0 8 = b6657fd2 9e00b3db
ffff88040201fc00 1439342529 S Ci:1:036:0 s a1 01 0300 0000 0008 8 <
ffff88040201fc00 1439342723 C Ci:1:036:0 0 8 = 3378b34d 36003a31
ffff88040201fc00 1439357579 S Ci:1:036:0 s a1 01 0300 0000 0008 8 <
ffff88040201fc00 1439357709 C Ci:1:036:0 0 8 = 2862168a e50012e2
ffff88040201fc00 1439372622 S Ci:1:036:0 s a1 01 0300 0000 0008 8 <
ffff88040201fc00 1439372841 C Ci:1:036:0 0 8 = 0635f1c9 740047b8
ffff88040201fc00 1439389529 S Ci:1:036:0 s a1 01 0300 0000 0008 8 <
ffff88040201fc00 1439389694 C Ci:1:036:0 0 8 = 3407572c f3007178
ffff88040201fc00 1439404572 S Ci:1:036:0 s a1 01 0300 0000 0008 8 <
ffff88040201fc00 1439404716 C Ci:1:036:0 0 8 = 52b03ea2 f5009672
ffff88040201fc00 1439419605 S Ci:1:036:0 s a1 01 0300 0000 0008 8 <
ffff88040201fc00 1439419716 C Ci:1:036:0 0 8 = ff5b3d66 720043d9
ffff88040201fc00 1439436657 S Ci:1:036:0 s a1 01 0300 0000 0008 8 <
ffff88040201fc00 1439436849 C Ci:1:036:0 0 8 = e06923a4 7200e4a0
ffff88040201fc00 1439451570 S Ci:1:036:0 s a1 01 0300 0000 0008 8 <
ffff88040201fc00 1439451717 C Ci:1:036:0 0 8 = 8815c64d 1200055c
ffff88040201fc00 1439466603 S Ci:1:036:0 s a1 01 0300 0000 0008 8 <
ffff88040201fc00 1439466705 C Ci:1:036:0 0 8 = a893df2b 520098f9
ffff88040201fc00 1439481645 S Ci:1:036:0 s a1 01 0300 0000 0008 8 <
ffff88040201fc00 1439481849 C Ci:1:036:0 0 8 = ff8f8c02 3000feac
ffff88040201fc00 1439498551 S Ci:1:036:0 s a1 01 0300 0000 0008 8 <
ffff88040201fc00 1439498694 C Ci:1:036:0 0 8 = db37992c b50072f0
ffff88040201fc00 1439513596 S Ci:1:036:0 s a1 01 0300 0000 0008 8 <
ffff88040201fc00 1439513711 C Ci:1:036:0 0 8 = a76b34a2 cd002211
ffff88040201fc00 1439528673 S Ci:1:036:0 s a1 01 0300 0000 0008 8 <
ffff88040201fc00 1439528844 C Ci:1:036:0 0 8 = 1c481f68 9600eee8
ffff88040201fc00 1439545532 S Ci:1:036:0 s a1 01 0300 0000 0008 8 <
ffff88040201fc00 1439545713 C Ci:1:036:0 0 8 = 314a2e9e 0800f7b4
ffff88040201fc00 1439560568 S Ci:1:036:0 s a1 01 0300 0000 0008 8 <
ffff88040201fc00 1439560714 C Ci:1:036:0 0 8 = 9a7b975f 4700905c
ffff88040201fc00 1439575625 S Ci:1:036:0 s a1 01 0300 0000 0008 8 <
ffff88040201fc00 1439575859 C Ci:1:036:0 0 8 = 66409af1 c500aa3e
ffff88040201fc00 1439592520 S Ci:1:036:0 s a1 01 0300 0000 0008 8 <
ffff88040201fc00 1439592715 C Ci:1:036:0 0 8 = eeeed3c1 9c00ae0b
ffff88040201fc00 1439607634 S Ci:1:036:0 s a1 01 0300 0000 0008 8 <
ffff88040201fc00 1439607841 C Ci:1:036:0 0 8 = 94ec5dc3 2200b24a
ffff88040201fc00 1439622596 S Ci:1:036:0 s a1 01 0300 0000 0008 8 <
ffff88040201fc00 1439622709 C Ci:1:036:0 0 8 = e5d82665 7300769d
ffff88040201fc00 1439639648 S Ci:1:036:0 s a1 01 0300 0000 0008 8 <
ffff88040201fc00 1439639843 C Ci:1:036:0 0 8 = 2e629584 de00b979
ffff88040201fc00 1439654557 S Ci:1:036:0 s a1 01 0300 0000 0008 8 <
ffff88040201fc00 1439654698 C Ci:1:036:0 0 8 = 9dd5e619 7e004460
ffff8803750ee900 1439669586 S Ci:1:036:0 s a1 01 0300 0000 0008 8 <
ffff8803750ee900 1439669718 C Ci:1:036:0 0 8 = 6d471c83 f700a336
ffff8803d9ba3600 1439686638 S Ci:1:036:0 s a1 01 0300 0000 0008 8 <
ffff8803d9ba3600 1439686854 C Ci:1:036:0 0 8 = a89501c3 84008514
ffff880377ac9300 1439701534 S Ci:1:036:0 s a1 01 0300 0000 0008 8 <
ffff880377ac9300 1439701722 C Ci:1:036:0 0 8 = f7c3b989 f100e55d
ffff880377ac9300 1439716579 S Ci:1:036:0 s a1 01 0300 0000 0008 8 <
ffff880377ac9300 1439716719 C Ci:1:036:0 0 8 = 08ee58a7 6e00afd7
ffff880377ac9300 1439733622 S Ci:1:036:0 s a1 01 0300 0000 0008 8 <
ffff880377ac9300 1439733854 C Ci:1:036:0 0 8 = de482802 ae00936a
ffff8803663ce480 1439748559 S Ci:1:036:0 s a1 01 0300 0000 0008 8 <
ffff8803663ce480 1439748698 C Ci:1:036:0 0 8 = 3faab2d2 d00022b1
ffff8803663ce480 1439763567 S Ci:1:036:0 s a1 01 0300 0000 0008 8 <
ffff8803663ce480 1439763730 C Ci:1:036:0 0 8 = 733528b9 c200c4dd
ffff8803d9ba3600 1439778605 S Ci:1:036:0 s a1 01 0300 0000 0008 8 <
ffff8803d9ba3600 1439778720 C Ci:1:036:0 0 8 = d3818701 e100ed56
ffff8803d9ba3600 1439795513 S Ci:1:036:0 s a1 01 0300 0000 0008 8 <
ffff8803d9ba3600 1439795728 C Ci:1:036:0 0 8 = bbda2b36 a50045f0
ffff880377ac9300 1439810548 S Ci:1:036:0 s a1 01 0300 0000 0008 8 <
ffff880377ac9300 1439810730 C Ci:1:036:0 0 8 = f01bf970 f500c513
ffff880377ac9300 1439825581 S Ci:1:036:0 s a1 01 0300 0000 0008 8 <
ffff880377ac9300 1439825720 C Ci:1:036:0 0 8 = 8a726338 3100afd8
ffff880377ac9300 1439840722 S Ci:1:036:0 s a1 01 0300 0000 0008 8 <
ffff880377ac9300 1439840846 C Ci:1:036:0 0 8 = 0c1eae7a f300b400
ffff8803750ee900 1439857538 S Ci:1:036:0 s a1 01 0300 0000 0008 8 <
ffff8803750ee900 1439857725 C Ci:1:036:0 0 8 = 990733ea 4d005a21
ffff8803750ee900 1439872582 S Ci:1:036:0 s a1 01 0300 0000 0008 8 <
ffff8803750ee900 1439872698 C Ci:1:036:0 0 8 = b9856df6 63004df1
ffff8803750ee900 1439889624 S Ci:1:036:0 s a1 01 0300 0000 0008 8 <
ffff8803750ee900 1439889823 C Ci:1:036:0 0 8 = 075f5fbc b400c6ed
ffff8803750ee900 1439904527 S Ci:1:036:0 s a1 01 0300 0000 0008 8 <
ffff8803750ee900 1439904728 C Ci:1:036:0 0 8 = 0fd6abae 070063b7
ffff8803750ee900 1439919556 S Ci:1:036:0 s a1 01 0300 0000 0008 8 <
ffff8803750ee900 1439919698 C Ci:1:036:0 0 8 = 27616309 3b007218
ffff8803663ce480 1439936623 S Ci:1:036:0 s a1 01 0300 0000 0008 8 <
ffff8803663ce480 1439936724 C Ci:1:036:0 0 8 = 4df66669 1b0096b8
ffff8803663ce480 1439951515 S Ci:1:036:0 s a1 01 0300 0000 0008 8 <
ffff8803663ce480 1439951720 C Ci:1:036:0 0 8 = 9092dbf2 05003591
ffff8803663ce480 1439966549 S Ci:1:036:0 s a1 01 0300 0000 0008 8 <
ffff8803663ce480 1439966732 C Ci:1:036:0 0 8 = a7aa055b ae0038e0
ffff8803663ce480 1439981616 S Ci:1:036:0 s a1 01 0300 0000 0008 8 <
ffff8803663ce480 1439981724 C Ci:1:036:0 0 8 = c1a0e919 7d009467
ffff8803663ce480 1439998641 S Ci:1:036:0 s a1 01 0300 0000 0008 8 <
ffff8803663ce480 1439998847 C Ci:1:036:0 0 8 = 59021af5 b6004e75
ffff8803750ee900 1440013543 S Ci:1:036:0 s a1 01 0300 0000 0008 8 <
ffff8803750ee900 1440013706 C Ci:1:036:0 0 8 = dc11f11e 1800b55e
ffff880377ac9b40 1440028628 S Ci:1:036:0 s a1 01 0300 0000 0008 8 <
ffff880377ac9b40 1440028855 C Ci:1:036:0 0 8 = 75442d72 ca00c366
ffff8803663ce480 1440045632 S Ci:1:036:0 s a1 01 0300 0000 0008 8 <
ffff8803663ce480 1440045855 C Ci:1:036:0 0 8 = 438c3006 2a00d008
ffff8803663ce480 1440060534 S Ci:1:036:0 s a1 01 0300 0000 0008 8 <
ffff8803663ce480 1440060724 C Ci:1:036:0 0 8 = 0c130596 a80004f6
ffff8803d9ba3600 1440075679 S Ci:1:036:0 s a1 01 0300 0000 0008 8 <
ffff8803d9ba3600 1440075849 C Ci:1:036:0 0 8 = 205dec01 500055ae
ffff8803663ce480 1440092617 S Ci:1:036:0 s a1 01 0300 0000 0008 8 <
ffff8803663ce480 1440092731 C Ci:1:036:0 0 8 = 96e5046e f3009a01
ffff8803d9ba3600 1440107658 S Ci:1:036:0 s a1 01 0300 0000 0008 8 <
ffff8803d9ba3600 1440107865 C Ci:1:036:0 0 8 = 1b1e5621 3d002396
ffff8803d9ba3600 1440122549 S Ci:1:036:0 s a1 01 0300 0000 0008 8 <
ffff8803d9ba3600 1440122702 C Ci:1:036:0 0 8 = d5018f18 c600822c
ffff880377ac9b40 1440139609 S Ci:1:036:0 s a1 01 0300 0000 0008 8 <
ffff880377ac9b40 1440139725 C Ci:1:036:0 0 8 = caaf5aff f2007a69
ffff8803663ce480 1440154642 S Ci:1:036:0 s a1 01 0300 0000 0008 8 <
ffff8803663ce480 1440154851 C Ci:1:036:0 0 8 = 809e9ee4 19004eb8
ffff8803663ce480 1440169545 S Ci:1:036:0 s a1 01 0300 0000 0008 8 <
ffff8803663ce480 1440169723 C Ci:1:036:0 0 8 = a2e2e168 a3009abd
ffff8803663ce480 1440186593 S Ci:1:036:0 s a1 01 0300 0000 0008 8 <
ffff8803663ce480 1440186715 C Ci:1:036:0 0 8 = 6fe2e943 06005dd4
ffff8803663ce480 1440201638 S Ci:1:036:0 s a1 01 0300 0000 0008 8 <
ffff8803663ce480 1440201858 C Ci:1:036:0 0 8 = 72816181 da00251b
ffff8803663ce480 1440216928 S Ci:1:036:0 s a1 01 0300 0000 0008 8 <
ffff8803663ce480 1440217078 C Ci:1:036:0 0 8 = 2dc3465c 6b009fa5
ffff8803663ce480 1440233587 S Ci:1:036:0 s a1 01 0300 0000 0008 8 <
ffff8803663ce480 1440233725 C Ci:1:036:0 0 8 = ac9fad08 9300baef
ffff880377ac9d80 1440248621 S Ci:1:036:0 s a1 01 0300 0000 0008 8 <
ffff880377ac9d80 1440248724 C Ci:1:036:0 0 8 = 1b23384f 8700ca57
ffff8803750ee900 1440263516 S Ci:1:036:0 s a1 01 0300 0000 0008 8 <
ffff8803750ee900 1440263702 C Ci:1:036:0 0 8 = 0d505699 6c007449
ffff8803750ee900 1440278550 S Ci:1:036:0 s a1 01 0300 0000 0008 8 <
ffff8803750ee900 1440278724 C Ci:1:036:0 0 8 = 7c9dc260 7800ecf8
ffff8803663ce480 1440295604 S Ci:1:036:0 s a1 01 0300 0000 0008 8 <
ffff8803663ce480 1440295717 C Ci:1:036:0 0 8 = 5e3a2920 1e002059
ffff8803663ce480 1440310641 S Ci:1:036:0 s a1 01 0300 0000 0008 8 <
ffff8803663ce480 1440310846 C Ci:1:036:0 0 8 = 2cd8f59e d100b3ee
ffff8803663ce480 1440325540 S Ci:1:036:0 s a1 01 0300 0000 0008 8 <
ffff8803663ce480 1440325731 C Ci:1:036:0 0 8 = 64a18ce5 ce006c05
ffff8803663ce480 1440342592 S Ci:1:036:0 s a1 01 0300 0000 0008 8 <
ffff8803663ce480 1440342726 C Ci:1:036:0 0 8 = d460d8d2 9500ed3e
ffff8803663ce480 1440357628 S Ci:1:036:0 s a1 01 0300 0000 0008 8 <
ffff8803663ce480 1440357850 C Ci:1:036:0 0 8 = 40d8c3c8 06006516
ffff8803750ee900 1440372526 S Ci:1:036:0 s a1 01 0300 0000 0008 8 <
ffff8803750ee900 1440372703 C Ci:1:036:0 0 8 = c95194aa 5d000a09
ffff8803663ce480 1440387834 S Ci:1:036:0 s a1 01 0300 0000 0008 8 <
ffff8803663ce480 1440387976 C Ci:1:036:0 0 8 = c5426ab5 5400f5c1
ffff8803d9ba3600 1440404621 S Ci:1:036:0 s a1 01 0300 0000 0008 8 <
ffff8803d9ba3600 1440404708 C Ci:1:036:0 0 8 = 0a5c1082 7e00a4e4
ffff880377ac9d80 1440419513 S Ci:1:036:0 s a1 01 0300 0000 0008 8 <
ffff880377ac9d80 1440419722 C Ci:1:036:0 0 8 = 9343a152 d40044a2
ffff880377ac9d80 1440434543 S Ci:1:036:0 s a1 01 0300 0000 0008 8 <
ffff880377ac9d80 1440434730 C Ci:1:036:0 0 8 = efed633c 58005df2
ffff880377ac9d80 1440451618 S Ci:1:036:0 s a1 01 0300 0000 0008 8 <
ffff880377ac9d80 1440451726 C Ci:1:036:0 0 8 = f8d2c070 3c002661
ffff880377ac9d80 1440466650 S Ci:1:036:0 s a1 01 0300 0000 0008 8 <
ffff880377ac9d80 1440466862 C Ci:1:036:0 0 8 = 8577bc00 400091f6
ffff880377ac9d80 1440481538 S Ci:1:036:0 s a1 01 0300 0000 0008 8 <
ffff880377ac9d80 1440481742 C Ci:1:036:0 0 8 = e48f92d0 2500ff91
ffff880377ac9d80 1440498599 S Ci:1:036:0 s a1 01 0300 0000 0008 8 <
ffff880377ac9d80 1440498727 C Ci:1:036:0 0 8 = b533b6df a400abae
ffff8803663ce480 1440513644 S Ci:1:036:0 s a1 01 0300 0000 0008 8 <
ffff8803663ce480 1440513859 C Ci:1:036:0 0 8 = 75835b33 9b00c393
ffff8803663ce480 1440528527 S Ci:1:036:0 s a1 01 0300 0000 0008 8 <
ffff8803663ce480 1440528705 C Ci:1:036:0 0 8 = a0db36af 5600252d
ffff8803663ce480 1440545584 S Ci:1:036:0 s a1 01 0300 0000 0008 8 <
ffff8803663ce480 1440545706 C Ci:1:036:0 0 8 = e2fd43d6 4400ff80
ffff8803663ce480 1440560624 S Ci:1:036:0 s a1 01 0300 0000 0008 8 <
ffff8803663ce480 1440560709 C Ci:1:036:0 0 8 = d41f4195 20007624
ffff8803663ce480 1440575613 S Ci:1:036:0 s a1 01 0300 0000 0008 8 <
ffff8803663ce480 1440575729 C Ci:1:036:0 0 8 = d41fd7bc 98000463
ffff8803663ce480 1440592576 S Ci:1:036:0 s a1 01 0300 0000 0008 8 <
ffff8803663ce480 1440592729 C Ci:1:036:0 0 8 = 4fec691b 12007a29
ffff880377ac9d80 1440607660 S Ci:1:036:0 s a1 01 0300 0000 0008 8 <
ffff880377ac9d80 1440607864 C Ci:1:036:0 0 8 = 6d1fb681 fe00ba4c
ffff880377ac9d80 1440622646 S Ci:1:036:0 s a1 01 0300 0000 0008 8 <
ffff880377ac9d80 1440622853 C Ci:1:036:0 0 8 = 66bac5c8 29001a81
ffff8803fdc4a780 1440628303 C Ii:3:003:1 0:8 6 = 0878d011 2c01
ffff8803fdc4a780 1440628330 S Ii:3:003:1 -115:8 6 <
ffff8803663ce480 1440639562 S Ci:1:036:0 s a1 01 0300 0000 0008 8 <
ffff8803663ce480 1440639729 C Ci:1:036:0 0 8 = 8549b587 d800990a
ffff8803fdc4a6c0 1440651683 S Ci:3:003:0 s a1 01 030a 0000 0002 64 <
ffff8803fdc4a6c0 1440651810 C Ci:3:003:0 0 2 = 0af0
ffff8803fdc4a6c0 1440651867 S Ci:3:003:0 s a1 01 030f 0000 0002 64 <
ffff8803fdc4a6c0 1440651969 C Ci:3:003:0 0 2 = 0f77
ffff8803fdc4a6c0 1440652033 S Ci:3:003:0 s a1 01 0312 0000 0002 64 <
ffff8803fdc4a6c0 1440652160 C Ci:3:003:0 0 2 = 1277
ffff8803fdc4a6c0 1440652191 S Ci:3:003:0 s a1 01 0313 0000 0002 64 <
ffff8803fdc4a6c0 1440652309 C Ci:3:003:0 0 2 = 130a
ffff8803fdc4a6c0 1440652325 S Ci:3:003:0 s a1 01 0317 0000 0002 64 <
ffff8803fdc4a6c0 1440652420 C Ci:3:003:0 0 2 = 1700
ffff8803fdc4a6c0 1440652440 S Ci:3:003:0 s a1 01 030b 0000 0002 64 <
ffff8803fdc4a6c0 1440652561 C Ci:3:003:0 0 2 = 0b11
ffff8803750ee900 1440654595 S Ci:1:036:0 s a1 01 0300 0000 0008 8 <
ffff8803750ee900 1440654718 C Ci:1:036:0 0 8 = 067c938c 3e0041fb
ffff8803750ee900 1440669630 S Ci:1:036:0 s a1 01 0300 0000 0008 8 <
ffff8803750ee900 1440669706 C Ci:1:036:0 0 8 = ef3df1b8 b200da83
ffff8803750ee900 1440686559 S Ci:1:036:0 s a1 01 0300 0000 0008 8 <
ffff8803750ee900 1440686727 C Ci:1:036:0 0 8 = eeedef83 60005dda
ffff8803fdc4a780 1440692297 C Ii:3:003:1 0:8 2 = 0b11
ffff8803fdc4a780 1440692324 S Ii:3:003:1 -115:8 6 <
ffff8803663ce480 1440701596 S Ci:1:036:0 s a1 01 0300 0000 0008 8 <
ffff8803663ce480 1440701721 C Ci:1:036:0 0 8 = c106ad36 3900ea07
ffff8803663ce480 1440716615 S Ci:1:036:0 s a1 01 0300 0000 0008 8 <
ffff8803663ce480 1440716730 C Ci:1:036:0 0 8 = d64249db 0400fbe6
ffff8803d9ba3600 1440733537 S Ci:1:036:0 s a1 01 0300 0000 0008 8 <
ffff8803d9ba3600 1440733749 C Ci:1:036:0 0 8 = eff8f3b1 a7009b18
ffff8803d9ba3600 1440748581 S Ci:1:036:0 s a1 01 0300 0000 0008 8 <
ffff8803d9ba3600 1440748729 C Ci:1:036:0 0 8 = 99977de2 ae004714
ffff8803d9ba3600 1440763627 S Ci:1:036:0 s a1 01 0300 0000 0008 8 <
ffff8803d9ba3600 1440763710 C Ci:1:036:0 0 8 = c07c4536 c300a371
ffff8803d9ba3600 1440780662 S Ci:1:036:0 s a1 01 0300 0000 0008 8 <
ffff8803d9ba3600 1440780864 C Ci:1:036:0 0 8 = da89bb85 0b006c67
ffff8803d9ba3600 1440795562 S Ci:1:036:0 s a1 01 0300 0000 0008 8 <
ffff8803d9ba3600 1440795730 C Ci:1:036:0 0 8 = e32decb7 a300755a
ffff8803d9ba3600 1440810623 S Ci:1:036:0 s a1 01 0300 0000 0008 8 <
ffff8803d9ba3600 1440810712 C Ci:1:036:0 0 8 = c4dda2c7 86003301
ffff8803d9ba3600 1440825629 S Ci:1:036:0 s a1 01 0300 0000 0008 8 <
ffff8803d9ba3600 1440825712 C Ci:1:036:0 0 8 = 2cf9a3a0 db00708b
ffff8803d9ba3600 1440842560 S Ci:1:036:0 s a1 01 0300 0000 0008 8 <
ffff8803d9ba3600 1440842720 C Ci:1:036:0 0 8 = d12539fd e3004d73
ffff8803d9ba3600 1440857594 S Ci:1:036:0 s a1 01 0300 0000 0008 8 <
ffff8803d9ba3600 1440857731 C Ci:1:036:0 0 8 = 461cad2b b900fb27
ffff8803d9ba3600 1440872627 S Ci:1:036:0 s a1 01 0300 0000 0008 8 <
ffff8803d9ba3600 1440872713 C Ci:1:036:0 0 8 = bec1accf 6b0026cb
ffff8803d9ba3600 1440887540 S Ci:1:036:0 s a1 01 0300 0000 0008 8 <
ffff8803d9ba3600 1440887705 C Ci:1:036:0 0 8 = d6379f5d ba000699
ffff8803d9ba3600 1440904575 S Ci:1:036:0 s a1 01 0300 0000 0008 8 <
ffff8803d9ba3600 1440904730 C Ci:1:036:0 0 8 = 0cacf647 a30041ff
ffff8803d9ba3600 1440919617 S Ci:1:036:0 s a1 01 0300 0000 0008 8 <
ffff8803d9ba3600 1440919709 C Ci:1:036:0 0 8 = ebca5dca 6300035d
ffff8803d9ba3600 1440936663 S Ci:1:036:0 s a1 01 0300 0000 0008 8 <
ffff8803d9ba3600 1440936873 C Ci:1:036:0 0 8 = cef6e484 b1006096
ffff880377ac9d80 1440951566 S Ci:1:036:0 s a1 01 0300 0000 0008 8 <
ffff880377ac9d80 1440951732 C Ci:1:036:0 0 8 = a8de1d8e 1e0062f3
ffff880377ac9d80 1440966592 S Ci:1:036:0 s a1 01 0300 0000 0008 8 <
ffff880377ac9d80 1440966709 C Ci:1:036:0 0 8 = 8be20dc3 d0000bc5
ffff880377ac9d80 1440981708 S Ci:1:036:0 s a1 01 0300 0000 0008 8 <
ffff880377ac9d80 1440981857 C Ci:1:036:0 0 8 = 90a46e2d d0000792
ffff8803663ce480 1440998551 S Ci:1:036:0 s a1 01 0300 0000 0008 8 <
ffff8803663ce480 1440998727 C Ci:1:036:0 0 8 = 78f3b6d4 87003261
ffff8803663ce480 1441013583 S Ci:1:036:0 s a1 01 0300 0000 0008 8 <
ffff8803663ce480 1441013723 C Ci:1:036:0 0 8 = db4a992b 3f005558
ffff880377ac9d80 1441028618 S Ci:1:036:0 s a1 01 0300 0000 0008 8 <
ffff880377ac9d80 1441028732 C Ci:1:036:0 0 8 = 6375c146 8100fe46
ffff880377ac9d80 1441045538 S Ci:1:036:0 s a1 01 0300 0000 0008 8 <
ffff880377ac9d80 1441045732 C Ci:1:036:0 0 8 = b664d096 7f00cb04
ffff880377ac9d80 1441060584 S Ci:1:036:0 s a1 01 0300 0000 0008 8 <
ffff880377ac9d80 1441060733 C Ci:1:036:0 0 8 = fc4611c2 35000f2d
ffff880377ac9d80 1441075632 S Ci:1:036:0 s a1 01 0300 0000 0008 8 <
ffff880377ac9d80 1441075865 C Ci:1:036:0 0 8 = 6a8f04ea 04004084
ffff880377ac9d80 1441092585 S Ci:1:036:0 s a1 01 0300 0000 0008 8 <
ffff880377ac9d80 1441092723 C Ci:1:036:0 0 8 = 63ea096f c100b40b
ffff8803750ee900 1441107570 S Ci:1:036:0 s a1 01 0300 0000 0008 8 <
ffff8803750ee900 1441107732 C Ci:1:036:0 0 8 = b13964e9 0d0040d3
ffff8803750ee900 1441122599 S Ci:1:036:0 s a1 01 0300 0000 0008 8 <
ffff8803750ee900 1441122732 C Ci:1:036:0 0 8 = 202b115c a300e562
ffff8803663ce480 1441139515 S Ci:1:036:0 s a1 01 0300 0000 0008 8 <
ffff8803663ce480 1441139732 C Ci:1:036:0 0 8 = c6bace62 77001d04
ffff8803663ce480 1441154551 S Ci:1:036:0 s a1 01 0300 0000 0008 8 <
ffff8803663ce480 1441154736 C Ci:1:036:0 0 8 = f6d84c38 35000331
ffff8803663ce480 1441169589 S Ci:1:036:0 s a1 01 0300 0000 0008 8 <
ffff8803663ce480 1441169733 C Ci:1:036:0 0 8 = fb22b4f9 4b00a96e
ffff8803663ce480 1441186647 S Ci:1:036:0 s a1 01 0300 0000 0008 8 <
ffff8803663ce480 1441186856 C Ci:1:036:0 0 8 = 2f5edcec 1b00ad6e
ffff8803663ce480 1441201544 S Ci:1:036:0 s a1 01 0300 0000 0008 8 <
ffff8803663ce480 1441201736 C Ci:1:036:0 0 8 = cc5a4470 7700bf49
ffff8803663ce480 1441216872 S Ci:1:036:0 s a1 01 0300 0000 0008 8 <
ffff8803663ce480 1441216985 C Ci:1:036:0 0 8 = 4b5469cc ff002d25
ffff8803663ce480 1441232615 S Ci:1:036:0 s a1 01 0300 0000 0008 8 <
ffff8803663ce480 1441232712 C Ci:1:036:0 0 8 = ce9be106 9400fc4b
ffff8803663ce480 1441247514 S Ci:1:036:0 s a1 01 0300 0000 0008 8 <
ffff8803663ce480 1441247732 C Ci:1:036:0 0 8 = 422dc973 500041af
ffff8803663ce480 1441264575 S Ci:1:036:0 s a1 01 0300 0000 0008 8 <
ffff8803663ce480 1441264733 C Ci:1:036:0 0 8 = f4401dda ad005afc
ffff8803663ce480 1441279606 S Ci:1:036:0 s a1 01 0300 0000 0008 8 <
ffff8803663ce480 1441279740 C Ci:1:036:0 0 8 = b4acfa98 e20057ab
ffff880377ac9d80 1441294647 S Ci:1:036:0 s a1 01 0300 0000 0008 8 <
ffff880377ac9d80 1441294861 C Ci:1:036:0 0 8 = f17bdc83 5d008bdc
ffff880377ac9d80 1441311563 S Ci:1:036:0 s a1 01 0300 0000 0008 8 <
ffff880377ac9d80 1441311732 C Ci:1:036:0 0 8 = bed1c853 9e006e93
ffff8803750ee900 1441326602 S Ci:1:036:0 s a1 01 0300 0000 0008 8 <
ffff8803750ee900 1441326734 C Ci:1:036:0 0 8 = cb824f32 c1004592
ffff8803750ee900 1441341632 S Ci:1:036:0 s a1 01 0300 0000 0008 8 <
ffff8803750ee900 1441341856 C Ci:1:036:0 0 8 = 4c57daa5 a6003c25
ffff8803750ee900 1441356591 S Ci:1:036:0 s a1 01 0300 0000 0008 8 <
ffff8803750ee900 1441356725 C Ci:1:036:0 0 8 = d21dd91c 0e00e3be
ffff8803750ee900 1441373584 S Ci:1:036:0 s a1 01 0300 0000 0008 8 <
ffff8803750ee900 1441373734 C Ci:1:036:0 0 8 = 1efefe4b 93004bfe
ffff8803750ee900 1441388624 S Ci:1:036:0 s a1 01 0300 0000 0008 8 <
ffff8803750ee900 1441388737 C Ci:1:036:0 0 8 = a3c627fe cd00ff20
ffff8803750ee900 1441403518 S Ci:1:036:0 s a1 01 0300 0000 0008 8 <
ffff8803750ee900 1441403739 C Ci:1:036:0 0 8 = dd2de424 be002312
ffff8803d9ba3600 1441420570 S Ci:1:036:0 s a1 01 0300 0000 0008 8 <
ffff8803d9ba3600 1441420724 C Ci:1:036:0 0 8 = d6be01f7 1000f533
ffff8803663ce6c0 1441435615 S Ci:1:036:0 s a1 01 0300 0000 0008 8 <
ffff8803663ce6c0 1441435734 C Ci:1:036:0 0 8 = f3b9afa9 af00c8ec
ffff8803663ce6c0 1441450645 S Ci:1:036:0 s a1 01 0300 0000 0008 8 <
ffff8803663ce6c0 1441450870 C Ci:1:036:0 0 8 = 88bd9915 12007170
ffff8803663ce6c0 1441467561 S Ci:1:036:0 s a1 01 0300 0000 0008 8 <
ffff8803663ce6c0 1441467734 C Ci:1:036:0 0 8 = 01d3fe4b 28000ed5
ffff8803d9ba3600 1441482609 S Ci:1:036:0 s a1 01 0300 0000 0008 8 <
ffff8803d9ba3600 1441482737 C Ci:1:036:0 0 8 = ed26673a 270073d2
ffff8803d9ba3600 1441497636 S Ci:1:036:0 s a1 01 0300 0000 0008 8 <
ffff8803d9ba3600 1441497871 C Ci:1:036:0 0 8 = 296961bb 68008a57
ffff8803d9ba3600 1441514550 S Ci:1:036:0 s a1 01 0300 0000 0008 8 <
ffff8803d9ba3600 1441514737 C Ci:1:036:0 0 8 = 77edd44c ea007254
ffff8803d9ba3600 1441529588 S Ci:1:036:0 s a1 01 0300 0000 0008 8 <
ffff8803d9ba3600 1441529737 C Ci:1:036:0 0 8 = 877a5760 950034b8
ffff8803d9ba3600 1441544627 S Ci:1:036:0 s a1 01 0300 0000 0008 8 <
ffff8803d9ba3600 1441544740 C Ci:1:036:0 0 8 = 698b3ecf 02007d7d
ffff8803d9ba3600 1441561552 S Ci:1:036:0 s a1 01 0300 0000 0008 8 <
ffff8803d9ba3600 1441561714 C Ci:1:036:0 0 8 = 8b313f86 7100f65b
ffff8803750ee900 1441576585 S Ci:1:036:0 s a1 01 0300 0000 0008 8 <
ffff8803750ee900 1441576719 C Ci:1:036:0 0 8 = cab41a52 fe00903a
ffff8803750ee900 1441591609 S Ci:1:036:0 s a1 01 0300 0000 0008 8 <
ffff8803750ee900 1441591737 C Ci:1:036:0 0 8 = 18c9ec13 ca00b230
ffff8803663ce6c0 1441608529 S Ci:1:036:0 s a1 01 0300 0000 0008 8 <
ffff8803663ce6c0 1441608739 C Ci:1:036:0 0 8 = 0fb24864 11007d93
ffff8803663ce6c0 1441623560 S Ci:1:036:0 s a1 01 0300 0000 0008 8 <
ffff8803663ce6c0 1441623738 C Ci:1:036:0 0 8 = 8a7ebbbb 3c008c98
ffff8803663ce6c0 1441638606 S Ci:1:036:0 s a1 01 0300 0000 0008 8 <
ffff8803663ce6c0 1441638738 C Ci:1:036:0 0 8 = f78acfd9 b9000e01
ffff8803663ce6c0 1441653633 S Ci:1:036:0 s a1 01 0300 0000 0008 8 <
ffff8803663ce6c0 1441653718 C Ci:1:036:0 0 8 = 1a185111 46007d63
ffff8803d9ba3600 1441670553 S Ci:1:036:0 s a1 01 0300 0000 0008 8 <
ffff8803d9ba3600 1441670734 C Ci:1:036:0 0 8 = 6f5792b5 97005068
ffff8803750ee900 1441685592 S Ci:1:036:0 s a1 01 0300 0000 0008 8 <
ffff8803750ee900 1441685715 C Ci:1:036:0 0 8 = 3adc77e7 be0077d8
ffff8803663ce540 1441700641 S Ci:1:036:0 s a1 01 0300 0000 0008 8 <
ffff8803663ce540 1441700841 C Ci:1:036:0 0 8 = 7b86cff7 fc00290b
ffff8803663ce540 1441717538 S Ci:1:036:0 s a1 01 0300 0000 0008 8 <
ffff8803663ce540 1441717752 C Ci:1:036:0 0 8 = d4dfaed6 25009ce7
ffff8803663ce540 1441732574 S Ci:1:036:0 s a1 01 0300 0000 0008 8 <
ffff8803663ce540 1441732739 C Ci:1:036:0 0 8 = 72cf5f0d 0000a6f2
ffff8803663ce540 1441747622 S Ci:1:036:0 s a1 01 0300 0000 0008 8 <
ffff8803663ce540 1441747743 C Ci:1:036:0 0 8 = 9d0d66ea 720061f1
ffff8803d9ba39c0 1441764529 S Ci:1:036:0 s a1 01 0300 0000 0008 8 <
ffff8803d9ba39c0 1441764745 C Ci:1:036:0 0 8 = 112405cb 1400a093
ffff8803d9ba39c0 1441779569 S Ci:1:036:0 s a1 01 0300 0000 0008 8 <
ffff8803d9ba39c0 1441779717 C Ci:1:036:0 0 8 = d46d08c2 440093cd
ffff8803d9ba39c0 1441794602 S Ci:1:036:0 s a1 01 0300 0000 0008 8 <
ffff8803d9ba39c0 1441794729 C Ci:1:036:0 0 8 = 31ec610a 7400abc5
ffff8803d9ba39c0 1441811519 S Ci:1:036:0 s a1 01 0300 0000 0008 8 <
ffff8803d9ba39c0 1441811592 C Ci:1:036:0 0 8 = 245d2faa a0008ced
ffff8803d9ba39c0 1441826554 S Ci:1:036:0 s a1 01 0300 0000 0008 8 <
ffff8803d9ba39c0 1441826740 C Ci:1:036:0 0 8 = 27453963 e8007341
ffff8803d9ba39c0 1441841590 S Ci:1:036:0 s a1 01 0300 0000 0008 8 <
ffff8803d9ba39c0 1441841739 C Ci:1:036:0 0 8 = 8dddc26f a60022de
ffff8803d9ba39c0 1441858653 S Ci:1:036:0 s a1 01 0300 0000 0008 8 <
ffff8803d9ba39c0 1441858871 C Ci:1:036:0 0 8 = 0d212fa2 ac00e741
ffff8803d9ba39c0 1441873543 S Ci:1:036:0 s a1 01 0300 0000 0008 8 <
ffff8803d9ba39c0 1441873756 C Ci:1:036:0 0 8 = 732fd208 df001e69
ffff8803d9ba39c0 1441888586 S Ci:1:036:0 s a1 01 0300 0000 0008 8 <
ffff8803d9ba39c0 1441888717 C Ci:1:036:0 0 8 = 92772ade 7700eafc
ffff8803d9ba39c0 1441903654 S Ci:1:036:0 s a1 01 0300 0000 0008 8 <
ffff8803d9ba39c0 1441903846 C Ci:1:036:0 0 8 = 45466342 17003024
ffff8803d9ba39c0 1441920530 S Ci:1:036:0 s a1 01 0300 0000 0008 8 <
ffff8803d9ba39c0 1441920735 C Ci:1:036:0 0 8 = fce7f463 0400620a
ffff8803d9ba39c0 1441935558 S Ci:1:036:0 s a1 01 0300 0000 0008 8 <
ffff8803d9ba39c0 1441935742 C Ci:1:036:0 0 8 = 65dc8d13 d900bd3b
ffff8803d9ba39c0 1441950825 S Ci:1:036:0 s a1 01 0300 0000 0008 8 <
ffff8803d9ba39c0 1441950982 C Ci:1:036:0 0 8 = 8077ddcd 8200d9ff
ffff8803d9ba39c0 1441967518 S Ci:1:036:0 s a1 01 0300 0000 0008 8 <
ffff8803d9ba39c0 1441967599 C Ci:1:036:0 0 8 = 2f339941 0f0002ac
ffff8803ba3cd240 1441982553 S Ci:1:036:0 s a1 01 0300 0000 0008 8 <
ffff8803ba3cd240 1441982741 C Ci:1:036:0 0 8 = 225e64ff d2000db9
ffff8803ba3cd240 1441997595 S Ci:1:036:0 s a1 01 0300 0000 0008 8 <
ffff8803ba3cd240 1441997718 C Ci:1:036:0 0 8 = 50be017c 4e005c58
ffff8803ba3cd240 1442014641 S Ci:1:036:0 s a1 01 0300 0000 0008 8 <
ffff8803ba3cd240 1442014844 C Ci:1:036:0 0 8 = aff434e0 8600232f
ffff8803ba3cd240 1442029534 S Ci:1:036:0 s a1 01 0300 0000 0008 8 <
ffff8803ba3cd240 1442029742 C Ci:1:036:0 0 8 = d4527e24 d800b18b
ffff8803ba3cd240 1442044574 S Ci:1:036:0 s a1 01 0300 0000 0008 8 <
ffff8803ba3cd240 1442044732 C Ci:1:036:0 0 8 = a038f407 f6005dd1
ffff8803ba3cd240 1442061631 S Ci:1:036:0 s a1 01 0300 0000 0008 8 <
ffff8803ba3cd240 1442061736 C Ci:1:036:0 0 8 = 8a88914a 5c0054f4
ffff8803ba3cd240 1442076540 S Ci:1:036:0 s a1 01 0300 0000 0008 8 <
ffff8803ba3cd240 1442076749 C Ci:1:036:0 0 8 = dd96c2be ed007dac
ffff8803ba3cd240 1442091568 S Ci:1:036:0 s a1 01 0300 0000 0008 8 <
ffff8803ba3cd240 1442091723 C Ci:1:036:0 0 8 = b7701baf f300db1f
ffff8803ba3cd240 1442106604 S Ci:1:036:0 s a1 01 0300 0000 0008 8 <
ffff8803ba3cd240 1442106719 C Ci:1:036:0 0 8 = b1d34af7 b30039f4
ffff8803ba3cd240 1442123517 S Ci:1:036:0 s a1 01 0300 0000 0008 8 <
ffff8803ba3cd240 1442123749 C Ci:1:036:0 0 8 = 2cd80bcf fd00b6eb
ffff8803ba3cd240 1442138551 S Ci:1:036:0 s a1 01 0300 0000 0008 8 <
ffff8803ba3cd240 1442138749 C Ci:1:036:0 0 8 = 7f3fdd34 850074a6
ffff8803ba3cd240 1442153588 S Ci:1:036:0 s a1 01 0300 0000 0008 8 <
ffff8803ba3cd240 1442153743 C Ci:1:036:0 0 8 = 38a52b3e b9009897
ffff8803ba3cd240 1442170640 S Ci:1:036:0 s a1 01 0300 0000 0008 8 <
ffff8803ba3cd240 1442170726 C Ci:1:036:0 0 8 = f3a5f373 bd001657
ffff880377ac9600 1442185545 S Ci:1:036:0 s a1 01 0300 0000 0008 8 <
ffff880377ac9600 1442185759 C Ci:1:036:0 0 8 = 15108ada d100e05f
ffff8803663ce540 1442200581 S Ci:1:036:0 s a1 01 0300 0000 0008 8 <
ffff8803663ce540 1442200742 C Ci:1:036:0 0 8 = b691f692 3100b272
ffff8803663ce540 1442217630 S Ci:1:036:0 s a1 01 0300 0000 0008 8 <
ffff8803663ce540 1442217721 C Ci:1:036:0 0 8 = b9cc21a1 3e00afb6
ffff8803663ce540 1442232525 S Ci:1:036:0 s a1 01 0300 0000 0008 8 <
ffff8803663ce540 1442232752 C Ci:1:036:0 0 8 = 02dd54d0 93006173
ffff8803d9ba3cc0 1442247560 S Ci:1:036:0 s a1 01 0300 0000 0008 8 <
ffff8803d9ba3cc0 1442247744 C Ci:1:036:0 0 8 = 32619b2f 1e004fa3
ffff880377ac9600 1442264655 S Ci:1:036:0 s a1 01 0300 0000 0008 8 <
ffff880377ac9600 1442264874 C Ci:1:036:0 0 8 = 7fb02652 de007ddd
ffff880377ac9600 1442279516 S Ci:1:036:0 s a1 01 0300 0000 0008 8 <
ffff880377ac9600 1442279753 C Ci:1:036:0 0 8 = 00366c2b 7a000ad4
ffff880377ac9600 1442294552 S Ci:1:036:0 s a1 01 0300 0000 0008 8 <
ffff880377ac9600 1442294763 C Ci:1:036:0 0 8 = 4b48e3d6 0f001dfe
ffff880377ac9600 1442309584 S Ci:1:036:0 s a1 01 0300 0000 0008 8 <
ffff880377ac9600 1442309745 C Ci:1:036:0 0 8 = fd289e34 1500b458
ffff8803750ee3c0 1442326658 S Ci:1:036:0 s a1 01 0300 0000 0008 8 <
ffff8803750ee3c0 1442326877 C Ci:1:036:0 0 8 = 294909fb b90080c1
ffff8803d9ba3cc0 1442341547 S Ci:1:036:0 s a1 01 0300 0000 0008 8 <
ffff8803d9ba3cc0 1442341722 C Ci:1:036:0 0 8 = dc9ff906 ab006825
ffff8803d9ba3cc0 1442356636 S Ci:1:036:0 s a1 01 0300 0000 0008 8 <
ffff8803d9ba3cc0 1442356722 C Ci:1:036:0 0 8 = 1f7197c5 3b00cd1a
ffff8803d9ba3cc0 1442373635 S Ci:1:036:0 s a1 01 0300 0000 0008 8 <
ffff8803d9ba3cc0 1442373722 C Ci:1:036:0 0 8 = 447e6fed 57004ad5
ffff8803d9ba3cc0 1442388539 S Ci:1:036:0 s a1 01 0300 0000 0008 8 <
ffff8803d9ba3cc0 1442388753 C Ci:1:036:0 0 8 = 0cd3cf45 9f00ced5
ffff8803750ee3c0 1442403685 S Ci:1:036:0 s a1 01 0300 0000 0008 8 <
ffff8803750ee3c0 1442403870 C Ci:1:036:0 0 8 = 0c61fac9 f500523e
ffff8803750ee3c0 1442420622 S Ci:1:036:0 s a1 01 0300 0000 0008 8 <
ffff8803750ee3c0 1442420747 C Ci:1:036:0 0 8 = 070c9d96 aa00aaaa
ffff8803663ce540 1442435515 S Ci:1:036:0 s a1 01 0300 0000 0008 8 <
ffff8803663ce540 1442435610 C Ci:1:036:0 0 8 = aa077767 28f02200
ffff8803fdc4a780 1443628332 C Ii:3:003:1 0:8 6 = 0878ee11 2c01
ffff8803fdc4a780 1443628361 S Ii:3:003:1 -115:8 6 <
ffff8803fdc4a6c0 1443652679 S Ci:3:003:0 s a1 01 030a 0000 0002 64 <
ffff8803fdc4a6c0 1443652808 C Ci:3:003:0 0 2 = 0af0
ffff8803fdc4a6c0 1443652864 S Ci:3:003:0 s a1 01 030f 0000 0002 64 <
ffff8803fdc4a6c0 1443652984 C Ci:3:003:0 0 2 = 0f77
ffff8803fdc4a6c0 1443653023 S Ci:3:003:0 s a1 01 0312 0000 0002 64 <
ffff8803fdc4a6c0 1443653117 C Ci:3:003:0 0 2 = 1277
ffff8803fdc4a6c0 1443653155 S Ci:3:003:0 s a1 01 0313 0000 0002 64 <
ffff8803fdc4a6c0 1443653242 C Ci:3:003:0 0 2 = 1309
ffff8803fdc4a6c0 1443653265 S Ci:3:003:0 s a1 01 0317 0000 0002 64 <
ffff8803fdc4a6c0 1443653385 C Ci:3:003:0 0 2 = 1700
ffff8803fdc4a6c0 1443653457 S Ci:3:003:0 s a1 01 030b 0000 0002 64 <
ffff8803fdc4a6c0 1443653586 C Ci:3:003:0 0 2 = 0b11
ffff8803fdc4a780 1443692324 C Ii:3:003:1 0:8 2 = 0b11
ffff8803fdc4a780 1443692350 S Ii:3:003:1 -115:8 6 <
ffff8803fdc4a780 1446628334 C Ii:3:003:1 0:8 6 = 08782a12 2c01
ffff8803fdc4a780 1446628362 S Ii:3:003:1 -115:8 6 <
ffff8803fdc4a6c0 1446653742 S Ci:3:003:0 s a1 01 030a 0000 0002 64 <
ffff8803fdc4a6c0 1446653874 C Ci:3:003:0 0 2 = 0af0
ffff8803fdc4a6c0 1446653929 S Ci:3:003:0 s a1 01 030f 0000 0002 64 <
ffff8803fdc4a6c0 1446654019 C Ci:3:003:0 0 2 = 0f77
ffff8803fdc4a6c0 1446654070 S Ci:3:003:0 s a1 01 0312 0000 0002 64 <
ffff8803fdc4a6c0 1446654171 C Ci:3:003:0 0 2 = 1277
ffff8803fdc4a6c0 1446654202 S Ci:3:003:0 s a1 01 0313 0000 0002 64 <
ffff8803fdc4a6c0 1446654333 C Ci:3:003:0 0 2 = 1309
ffff8803fdc4a6c0 1446654384 S Ci:3:003:0 s a1 01 0317 0000 0002 64 <
ffff8803fdc4a6c0 1446654484 C Ci:3:003:0 0 2 = 1700
ffff8803fdc4a6c0 1446654542 S Ci:3:003:0 s a1 01 030b 0000 0002 64 <
ffff8803fdc4a6c0 1446654642 C Ci:3:003:0 0 2 = 0b11
ffff8803fdc4a780 1446692354 C Ii:3:003:1 0:8 2 = 0b11
ffff8803fdc4a780 1446692381 S Ii:3:003:1 -115:8 6 <
ffff8803fdc4a780 1449628387 C Ii:3:003:1 0:8 6 = 08782a12 2c01
ffff8803fdc4a780 1449628417 S Ii:3:003:1 -115:8 6 <
ffff8803fdc4a6c0 1449654794 S Ci:3:003:0 s a1 01 030a 0000 0002 64 <
ffff8803fdc4a6c0 1449654898 C Ci:3:003:0 0 2 = 0af0
ffff8803fdc4a6c0 1449654950 S Ci:3:003:0 s a1 01 030f 0000 0002 64 <
ffff8803fdc4a6c0 1449655077 C Ci:3:003:0 0 2 = 0f77
ffff8803fdc4a6c0 1449655125 S Ci:3:003:0 s a1 01 0312 0000 0002 64 <
ffff8803fdc4a6c0 1449655213 C Ci:3:003:0 0 2 = 1277
ffff8803fdc4a6c0 1449655269 S Ci:3:003:0 s a1 01 0313 0000 0002 64 <
ffff8803fdc4a6c0 1449655391 C Ci:3:003:0 0 2 = 1309
ffff8803fdc4a6c0 1449655457 S Ci:3:003:0 s a1 01 0317 0000 0002 64 <
ffff8803fdc4a6c0 1449655559 C Ci:3:003:0 0 2 = 1700
ffff8803fdc4a6c0 1449655614 S Ci:3:003:0 s a1 01 030b 0000 0002 64 <
ffff8803fdc4a6c0 1449655740 C Ci:3:003:0 0 2 = 0b11
ffff8803fdc4a780 1449692380 C Ii:3:003:1 0:8 2 = 0b11
ffff8803fdc4a780 1449692406 S Ii:3:003:1 -115:8 6 <
ffff8803fdc4a780 1452628416 C Ii:3:003:1 0:8 6 = 08780c12 2c01
ffff8803fdc4a780 1452628445 S Ii:3:003:1 -115:8 6 <
ffff8803fdc4a6c0 1452655888 S Ci:3:003:0 s a1 01 030a 0000 0002 64 <
ffff8803fdc4a6c0 1452656018 C Ci:3:003:0 0 2 = 0af0
ffff8803fdc4a6c0 1452656075 S Ci:3:003:0 s a1 01 030f 0000 0002 64 <
ffff8803fdc4a6c0 1452656163 C Ci:3:003:0 0 2 = 0f77
ffff8803fdc4a6c0 1452656219 S Ci:3:003:0 s a1 01 0312 0000 0002 64 <
ffff8803fdc4a6c0 1452656480 C Ci:3:003:0 0 2 = 1277
ffff8803fdc4a6c0 1452656536 S Ci:3:003:0 s a1 01 0313 0000 0002 64 <
ffff8803fdc4a6c0 1452656630 C Ci:3:003:0 0 2 = 1309
ffff8803fdc4a6c0 1452656679 S Ci:3:003:0 s a1 01 0317 0000 0002 64 <
ffff8803fdc4a6c0 1452656814 C Ci:3:003:0 0 2 = 1700
ffff8803fdc4a6c0 1452656883 S Ci:3:003:0 s a1 01 030b 0000 0002 64 <
ffff8803fdc4a6c0 1452656988 C Ci:3:003:0 0 2 = 0b11
ffff8803fdc4a780 1452692410 C Ii:3:003:1 0:8 2 = 0b11
ffff8803fdc4a780 1452692436 S Ii:3:003:1 -115:8 6 <
ffff8803fdc4a780 1455628442 C Ii:3:003:1 0:8 6 = 08787611 2c01
ffff8803fdc4a780 1455628471 S Ii:3:003:1 -115:8 6 <
ffff8803fdc4a6c0 1455657145 S Ci:3:003:0 s a1 01 030a 0000 0002 64 <
ffff8803fdc4a6c0 1455657248 C Ci:3:003:0 0 2 = 0af0
ffff8803fdc4a6c0 1455657312 S Ci:3:003:0 s a1 01 030f 0000 0002 64 <
ffff8803fdc4a6c0 1455657430 C Ci:3:003:0 0 2 = 0f77
ffff8803fdc4a6c0 1455657487 S Ci:3:003:0 s a1 01 0312 0000 0002 64 <
ffff8803fdc4a6c0 1455657576 C Ci:3:003:0 0 2 = 1277
ffff8803fdc4a6c0 1455657632 S Ci:3:003:0 s a1 01 0313 0000 0002 64 <
ffff8803fdc4a6c0 1455657721 C Ci:3:003:0 0 2 = 1309
ffff8803fdc4a6c0 1455657784 S Ci:3:003:0 s a1 01 0317 0000 0002 64 <
ffff8803fdc4a6c0 1455657885 C Ci:3:003:0 0 2 = 1700
ffff8803fdc4a6c0 1455657921 S Ci:3:003:0 s a1 01 030b 0000 0002 64 <
ffff8803fdc4a6c0 1455658020 C Ci:3:003:0 0 2 = 0b11
ffff8803fdc4a780 1455692430 C Ii:3:003:1 0:8 2 = 0b11
ffff8803fdc4a780 1455692465 S Ii:3:003:1 -115:8 6 <
ffff8803fe0e8f00 1456351502 C Ii:1:005:2 0:8 4 = 01000101
ffff8803fe0e8f00 1456351543 S Ii:1:005:2 -115:8 4 <
ffff8803fe0e8f00 1456415531 C Ii:1:005:2 0:8 4 = 010003ff
ffff8803fe0e8f00 1456415573 S Ii:1:005:2 -115:8 4 <
ffff8803fe0e8f00 1456423501 C Ii:1:005:2 0:8 4 = 010002fe
ffff8803fe0e8f00 1456423532 S Ii:1:005:2 -115:8 4 <
ffff8803fe0e8f00 1456447514 C Ii:1:005:2 0:8 4 = 010004fc
ffff8803fe0e8f00 1456447545 S Ii:1:005:2 -115:8 4 <
ffff8803fe0e8f00 1456455502 C Ii:1:005:2 0:8 4 = 010005fe
ffff8803fe0e8f00 1456455534 S Ii:1:005:2 -115:8 4 <
ffff8803fe0e8f00 1456479528 C Ii:1:005:2 0:8 4 = 01001000
ffff8803fe0e8f00 1456479558 S Ii:1:005:2 -115:8 4 <
ffff8803fe0e8f00 1456495504 C Ii:1:005:2 0:8 4 = 01000c03
ffff8803fe0e8f00 1456495536 S Ii:1:005:2 -115:8 4 <
ffff8803fe0e8f00 1456511526 C Ii:1:005:2 0:8 4 = 01001408
ffff8803fe0e8f00 1456511557 S Ii:1:005:2 -115:8 4 <
ffff8803fe0e8f00 1456543509 C Ii:1:005:2 0:8 4 = 01000100
ffff8803fe0e8f00 1456543540 S Ii:1:005:2 -115:8 4 <
ffff8803fe0e8f00 1456551501 C Ii:1:005:2 0:8 4 = 01000001
ffff8803fe0e8f00 1456551532 S Ii:1:005:2 -115:8 4 <
ffff8803fe0e8f00 1456575502 C Ii:1:005:2 0:8 4 = 01000400
ffff8803fe0e8f00 1456575533 S Ii:1:005:2 -115:8 4 <
ffff8803fe0e8f00 1456583501 C Ii:1:005:2 0:8 4 = 01000401
ffff8803fe0e8f00 1456583533 S Ii:1:005:2 -115:8 4 <
ffff8803fe0e8f00 1456607502 C Ii:1:005:2 0:8 4 = 01001005
ffff8803fe0e8f00 1456607534 S Ii:1:005:2 -115:8 4 <
ffff8803fe0e8f00 1456615505 C Ii:1:005:2 0:8 4 = 01000c04
ffff8803fe0e8f00 1456615535 S Ii:1:005:2 -115:8 4 <
ffff8803fe0e8f00 1456639515 C Ii:1:005:2 0:8 4 = 0100180c
ffff8803fe0e8f00 1456639546 S Ii:1:005:2 -115:8 4 <
ffff8803fe0e8f00 1456647502 C Ii:1:005:2 0:8 4 = 01000a04
ffff8803fe0e8f00 1456647533 S Ii:1:005:2 -115:8 4 <
ffff8803fe0e8f00 1456663503 C Ii:1:005:2 0:8 4 = 01000302
ffff8803fe0e8f00 1456663534 S Ii:1:005:2 -115:8 4 <
ffff8803fe0e8f00 1456679528 C Ii:1:005:2 0:8 4 = 0100fafd
ffff8803fe0e8f00 1456679559 S Ii:1:005:2 -115:8 4 <
ffff8803fe0e8f00 1456695532 C Ii:1:005:2 0:8 4 = 0100fdfd
ffff8803fe0e8f00 1456695563 S Ii:1:005:2 -115:8 4 <
ffff8803fe0e8f00 1456711513 C Ii:1:005:2 0:8 4 = 0100ff02
ffff8803fe0e8f00 1456711544 S Ii:1:005:2 -115:8 4 <
ffff8803fe0e8f00 1456727529 C Ii:1:005:2 0:8 4 = 0100fb04
ffff8803fe0e8f00 1456727560 S Ii:1:005:2 -115:8 4 <
ffff8803fe0e8f00 1456751521 C Ii:1:005:2 0:8 4 = 0100f50a
ffff8803fe0e8f00 1456751552 S Ii:1:005:2 -115:8 4 <
ffff8803fe0e8f00 1456759506 C Ii:1:005:2 0:8 4 = 0100fb05
ffff8803fe0e8f00 1456759537 S Ii:1:005:2 -115:8 4 <
ffff8803fe0e8f00 1456783507 C Ii:1:005:2 0:8 4 = 0100f907
ffff8803fe0e8f00 1456783539 S Ii:1:005:2 -115:8 4 <
ffff8803fe0e8f00 1456791504 C Ii:1:005:2 0:8 4 = 0100fd03
ffff8803fe0e8f00 1456791535 S Ii:1:005:2 -115:8 4 <
ffff8803fe0e8f00 1456807505 C Ii:1:005:2 0:8 4 = 0100fd04
ffff8803fe0e8f00 1456807537 S Ii:1:005:2 -115:8 4 <
ffff8803fe0e8f00 1456823534 C Ii:1:005:2 0:8 4 = 0100fc06
ffff8803fe0e8f00 1456823565 S Ii:1:005:2 -115:8 4 <
ffff8803fe0e8f00 1456839534 C Ii:1:005:2 0:8 4 = 0100fd06
ffff8803fe0e8f00 1456839564 S Ii:1:005:2 -115:8 4 <
ffff8803fe0e8f00 1456855531 C Ii:1:005:2 0:8 4 = 0100fa0b
ffff8803fe0e8f00 1456855560 S Ii:1:005:2 -115:8 4 <
ffff8803fe0e8f00 1456871504 C Ii:1:005:2 0:8 4 = 0100fd06
ffff8803fe0e8f00 1456871535 S Ii:1:005:2 -115:8 4 <
ffff8803fe0e8f00 1456887510 C Ii:1:005:2 0:8 4 = 0100fb09
ffff8803fe0e8f00 1456887541 S Ii:1:005:2 -115:8 4 <
ffff8803fe0e8f00 1456903505 C Ii:1:005:2 0:8 4 = 0100fd04
ffff8803fe0e8f00 1456903538 S Ii:1:005:2 -115:8 4 <
ffff8803fe0e8f00 1456911485 C Ii:1:005:2 0:8 4 = 0100fe03
ffff8803fe0e8f00 1456911513 S Ii:1:005:2 -115:8 4 <
ffff8803fe0e8f00 1456935534 C Ii:1:005:2 0:8 4 = 0100fb05
ffff8803fe0e8f00 1456935564 S Ii:1:005:2 -115:8 4 <
ffff8803fe0e8f00 1456967530 C Ii:1:005:2 0:8 4 = 0100f806
ffff8803fe0e8f00 1456967561 S Ii:1:005:2 -115:8 4 <
ffff8803fe0e8f00 1456975517 C Ii:1:005:2 0:8 4 = 0100fd02
ffff8803fe0e8f00 1456975548 S Ii:1:005:2 -115:8 4 <
ffff8803fe0e8f00 1456999505 C Ii:1:005:2 0:8 4 = 0100f803
ffff8803fe0e8f00 1456999536 S Ii:1:005:2 -115:8 4 <
ffff8803fe0e8f00 1457015498 C Ii:1:005:2 0:8 4 = 0100fc02
ffff8803fe0e8f00 1457015518 S Ii:1:005:2 -115:8 4 <
ffff8803fe0e8f00 1457031534 C Ii:1:005:2 0:8 4 = 0100f605
ffff8803fe0e8f00 1457031566 S Ii:1:005:2 -115:8 4 <
ffff8803fe0e8f00 1457047530 C Ii:1:005:2 0:8 4 = 0100fb03
ffff8803fe0e8f00 1457047560 S Ii:1:005:2 -115:8 4 <
ffff8803fe0e8f00 1457055531 C Ii:1:005:2 0:8 4 = 0100fb02
ffff8803fe0e8f00 1457055561 S Ii:1:005:2 -115:8 4 <
ffff8803fe0e8f00 1457079533 C Ii:1:005:2 0:8 4 = 0100f904
ffff8803fe0e8f00 1457079564 S Ii:1:005:2 -115:8 4 <
ffff8803fe0e8f00 1457087531 C Ii:1:005:2 0:8 4 = 0100fe02
ffff8803fe0e8f00 1457087562 S Ii:1:005:2 -115:8 4 <
ffff8803fe0e8f00 1457111515 C Ii:1:005:2 0:8 4 = 0100fe02
ffff8803fe0e8f00 1457111545 S Ii:1:005:2 -115:8 4 <
ffff8803fe0e8f00 1457263538 C Ii:1:005:2 0:8 4 = 01000200
ffff8803fe0e8f00 1457263574 S Ii:1:005:2 -115:8 4 <
ffff8803fe0e8f00 1457287536 C Ii:1:005:2 0:8 4 = 01000202
ffff8803fe0e8f00 1457287566 S Ii:1:005:2 -115:8 4 <
ffff8803fe0e8f00 1457295536 C Ii:1:005:2 0:8 4 = 01000100
ffff8803fe0e8f00 1457295565 S Ii:1:005:2 -115:8 4 <
ffff8803fe0e8f00 1457311515 C Ii:1:005:2 0:8 4 = 01000202
ffff8803fe0e8f00 1457311546 S Ii:1:005:2 -115:8 4 <
ffff8803fe0e8f00 1457335537 C Ii:1:005:2 0:8 4 = 01000304
ffff8803fe0e8f00 1457335567 S Ii:1:005:2 -115:8 4 <
ffff8803fe0e8f00 1457351535 C Ii:1:005:2 0:8 4 = 01000103
ffff8803fe0e8f00 1457351566 S Ii:1:005:2 -115:8 4 <
ffff8803fe0e8f00 1457359534 C Ii:1:005:2 0:8 4 = 01000202
ffff8803fe0e8f00 1457359564 S Ii:1:005:2 -115:8 4 <
ffff8803fe0e8f00 1457375512 C Ii:1:005:2 0:8 4 = 01000103
ffff8803fe0e8f00 1457375541 S Ii:1:005:2 -115:8 4 <
ffff8803fe0e8f00 1457391535 C Ii:1:005:2 0:8 4 = 01000101
ffff8803fe0e8f00 1457391565 S Ii:1:005:2 -115:8 4 <
ffff8803fe0e8f00 1457415534 C Ii:1:005:2 0:8 4 = 01000202
ffff8803fe0e8f00 1457415566 S Ii:1:005:2 -115:8 4 <
ffff8803fe0e8f00 1457439531 C Ii:1:005:2 0:8 4 = 01000100
ffff8803fe0e8f00 1457439562 S Ii:1:005:2 -115:8 4 <
ffff8803fe0e8f00 1457447509 C Ii:1:005:2 0:8 4 = 0100ff00
ffff8803fe0e8f00 1457447539 S Ii:1:005:2 -115:8 4 <
ffff8803fe0e8f00 1457463536 C Ii:1:005:2 0:8 4 = 01000100
ffff8803fe0e8f00 1457463565 S Ii:1:005:2 -115:8 4 <
ffff8803fe0e8f00 1457583539 C Ii:1:005:2 0:8 4 = 010000ff
ffff8803fe0e8f00 1457583569 S Ii:1:005:2 -115:8 4 <
ffff8803fe0e8f00 1457607490 C Ii:1:005:2 0:8 4 = 010002fe
ffff8803fe0e8f00 1457607519 S Ii:1:005:2 -115:8 4 <
ffff8803fe0e8f00 1457623536 C Ii:1:005:2 0:8 4 = 010001fd
ffff8803fe0e8f00 1457623567 S Ii:1:005:2 -115:8 4 <
ffff8803fe0e8f00 1457647537 C Ii:1:005:2 0:8 4 = 010002fd
ffff8803fe0e8f00 1457647567 S Ii:1:005:2 -115:8 4 <
ffff8803fe0e8f00 1457655538 C Ii:1:005:2 0:8 4 = 010001ff
ffff8803fe0e8f00 1457655569 S Ii:1:005:2 -115:8 4 <
ffff8803fe0e8f00 1457671519 C Ii:1:005:2 0:8 4 = 010000ff
ffff8803fe0e8f00 1457671549 S Ii:1:005:2 -115:8 4 <
ffff8803fe0e8f00 1457687540 C Ii:1:005:2 0:8 4 = 010000ff
ffff8803fe0e8f00 1457687569 S Ii:1:005:2 -115:8 4 <
ffff8803fe0e8f00 1457703542 C Ii:1:005:2 0:8 4 = 010001fe
ffff8803fe0e8f00 1457703572 S Ii:1:005:2 -115:8 4 <
ffff8803fe0e8f00 1457719537 C Ii:1:005:2 0:8 4 = 010001ff
ffff8803fe0e8f00 1457719567 S Ii:1:005:2 -115:8 4 <
ffff8803fe0e8f00 1457735534 C Ii:1:005:2 0:8 4 = 010000ff
ffff8803fe0e8f00 1457735563 S Ii:1:005:2 -115:8 4 <
ffff8803fe0e8f00 1457767520 C Ii:1:005:2 0:8 4 = 01000100
ffff8803fe0e8f00 1457767550 S Ii:1:005:2 -115:8 4 <
ffff8803fe0e8f00 1457799539 C Ii:1:005:2 0:8 4 = 010000ff
ffff8803fe0e8f00 1457799569 S Ii:1:005:2 -115:8 4 <
ffff8803fe0e8f00 1457991515 C Ii:1:005:2 0:8 4 = 01010000
ffff8803fe0e8f00 1457991551 S Ii:1:005:2 -115:8 4 <
ffff8803fe0e8f00 1458095544 C Ii:1:005:2 0:8 4 = 01000000
ffff8803fe0e8f00 1458095587 S Ii:1:005:2 -115:8 4 <
ffff8803fe0e8f00 1458463552 C Ii:1:005:2 0:8 4 = 0100fcfd
ffff8803fe0e8f00 1458463594 S Ii:1:005:2 -115:8 4 <
ffff8803fe0e8f00 1458471518 C Ii:1:005:2 0:8 4 = 0100fafe
ffff8803fe0e8f00 1458471550 S Ii:1:005:2 -115:8 4 <
ffff8803fe0e8f00 1458495546 C Ii:1:005:2 0:8 4 = 0100f6fa
ffff8803fe0e8f00 1458495576 S Ii:1:005:2 -115:8 4 <
ffff8803fe0e8f00 1458503427 C Ii:1:005:2 0:8 4 = 0100fbfd
ffff8803fe0e8f00 1458503458 S Ii:1:005:2 -115:8 4 <
ffff8803fe0e8f00 1458527541 C Ii:1:005:2 0:8 4 = 0100f4f9
ffff8803fe0e8f00 1458527572 S Ii:1:005:2 -115:8 4 <
ffff8803fe0e8f00 1458535545 C Ii:1:005:2 0:8 4 = 0100fafb
ffff8803fe0e8f00 1458535575 S Ii:1:005:2 -115:8 4 <
ffff8803fe0e8f00 1458551546 C Ii:1:005:2 0:8 4 = 0100f9fa
ffff8803fe0e8f00 1458551576 S Ii:1:005:2 -115:8 4 <
ffff8803fe0e8f00 1458567522 C Ii:1:005:2 0:8 4 = 0100f3f2
ffff8803fe0e8f00 1458567553 S Ii:1:005:2 -115:8 4 <
ffff8803fe0e8f00 1458583545 C Ii:1:005:2 0:8 4 = 0100f9f8
ffff8803fe0e8f00 1458583575 S Ii:1:005:2 -115:8 4 <
ffff8803fe0e8f00 1458607497 C Ii:1:005:2 0:8 4 = 0100f3ef
ffff8803fe0e8f00 1458607526 S Ii:1:005:2 -115:8 4 <
ffff8803fe0e8f00 1458615501 C Ii:1:005:2 0:8 4 = 0100faf6
ffff8803fe0e8f00 1458615530 S Ii:1:005:2 -115:8 4 <
ffff8803fdc4a780 1458628471 C Ii:3:003:1 0:8 6 = 0878ee11 2c01
ffff8803fdc4a780 1458628501 S Ii:3:003:1 -115:8 6 <
ffff8803fe0e8f00 1458639521 C Ii:1:005:2 0:8 4 = 0100f6ef
ffff8803fe0e8f00 1458639553 S Ii:1:005:2 -115:8 4 <
ffff8803fe0e8f00 1458647546 C Ii:1:005:2 0:8 4 = 0100fcf8
ffff8803fe0e8f00 1458647576 S Ii:1:005:2 -115:8 4 <
ffff8803fdc4a6c0 1458658146 S Ci:3:003:0 s a1 01 030a 0000 0002 64 <
ffff8803fdc4a6c0 1458658274 C Ci:3:003:0 0 2 = 0af0
ffff8803fdc4a6c0 1458658309 S Ci:3:003:0 s a1 01 030f 0000 0002 64 <
ffff8803fdc4a6c0 1458658481 C Ci:3:003:0 0 2 = 0f77
ffff8803fdc4a6c0 1458658515 S Ci:3:003:0 s a1 01 0312 0000 0002 64 <
ffff8803fdc4a6c0 1458658591 C Ci:3:003:0 0 2 = 1277
ffff8803fdc4a6c0 1458658613 S Ci:3:003:0 s a1 01 0313 0000 0002 64 <
ffff8803fdc4a6c0 1458658710 C Ci:3:003:0 0 2 = 1309
ffff8803fdc4a6c0 1458658730 S Ci:3:003:0 s a1 01 0317 0000 0002 64 <
ffff8803fdc4a6c0 1458658827 C Ci:3:003:0 0 2 = 1700
ffff8803fdc4a6c0 1458658852 S Ci:3:003:0 s a1 01 030b 0000 0002 64 <
ffff8803fdc4a6c0 1458659000 C Ci:3:003:0 0 2 = 0b11
ffff8803fe0e8f00 1458671520 C Ii:1:005:2 0:8 4 = 0100faf3
ffff8803fe0e8f00 1458671551 S Ii:1:005:2 -115:8 4 <
ffff8803fe0e8f00 1458679523 C Ii:1:005:2 0:8 4 = 0100fffd
ffff8803fe0e8f00 1458679554 S Ii:1:005:2 -115:8 4 <
ffff8803fdc4a780 1458692466 C Ii:3:003:1 0:8 2 = 0b11
ffff8803fdc4a780 1458692499 S Ii:3:003:1 -115:8 6 <
ffff8803fe0e8f00 1458695549 C Ii:1:005:2 0:8 4 = 0100fffc
ffff8803fe0e8f00 1458695579 S Ii:1:005:2 -115:8 4 <
ffff8803fe0e8f00 1458711522 C Ii:1:005:2 0:8 4 = 0100fffc
ffff8803fe0e8f00 1458711554 S Ii:1:005:2 -115:8 4 <
ffff8803fe0e8f00 1458727524 C Ii:1:005:2 0:8 4 = 010001fc
ffff8803fe0e8f00 1458727555 S Ii:1:005:2 -115:8 4 <
ffff8803fe0e8f00 1458743531 C Ii:1:005:2 0:8 4 = 010000f5
ffff8803fe0e8f00 1458743562 S Ii:1:005:2 -115:8 4 <
ffff8803fe0e8f00 1458759552 C Ii:1:005:2 0:8 4 = 010001fb
ffff8803fe0e8f00 1458759583 S Ii:1:005:2 -115:8 4 <
ffff8803fe0e8f00 1458775524 C Ii:1:005:2 0:8 4 = 010001f2
ffff8803fe0e8f00 1458775556 S Ii:1:005:2 -115:8 4 <
ffff8803fe0e8f00 1458791538 C Ii:1:005:2 0:8 4 = 010000fd
ffff8803fe0e8f00 1458791568 S Ii:1:005:2 -115:8 4 <
ffff8803fe0e8f00 1458799524 C Ii:1:005:2 0:8 4 = 010001fc
ffff8803fe0e8f00 1458799555 S Ii:1:005:2 -115:8 4 <
ffff8803fe0e8f00 1458823527 C Ii:1:005:2 0:8 4 = 010002f9
ffff8803fe0e8f00 1458823559 S Ii:1:005:2 -115:8 4 <
ffff8803fe0e8f00 1458831521 C Ii:1:005:2 0:8 4 = 010001fb
ffff8803fe0e8f00 1458831553 S Ii:1:005:2 -115:8 4 <
ffff8803fe0e8f00 1458855499 C Ii:1:005:2 0:8 4 = 010002f9
ffff8803fe0e8f00 1458855530 S Ii:1:005:2 -115:8 4 <
ffff8803fe0e8f00 1458871499 C Ii:1:005:2 0:8 4 = 010001fc
ffff8803fe0e8f00 1458871529 S Ii:1:005:2 -115:8 4 <
ffff8803fe0e8f00 1458887530 C Ii:1:005:2 0:8 4 = 010003f8
ffff8803fe0e8f00 1458887561 S Ii:1:005:2 -115:8 4 <
ffff8803fe0e8f00 1459015517 C Ii:1:005:2 0:8 4 = 0100ff01
ffff8803fe0e8f00 1459015557 S Ii:1:005:2 -115:8 4 <
ffff8803fe0e8f00 1459023528 C Ii:1:005:2 0:8 4 = 0100ff01
ffff8803fe0e8f00 1459023559 S Ii:1:005:2 -115:8 4 <
ffff8803fe0e8f00 1459047550 C Ii:1:005:2 0:8 4 = 0100fe04
ffff8803fe0e8f00 1459047581 S Ii:1:005:2 -115:8 4 <
ffff8803fe0e8f00 1459055524 C Ii:1:005:2 0:8 4 = 0100fe02
ffff8803fe0e8f00 1459055555 S Ii:1:005:2 -115:8 4 <
ffff8803fe0e8f00 1459071501 C Ii:1:005:2 0:8 4 = 0100ff02
ffff8803fe0e8f00 1459071530 S Ii:1:005:2 -115:8 4 <
ffff8803fe0e8f00 1459087528 C Ii:1:005:2 0:8 4 = 0100ff03
ffff8803fe0e8f00 1459087560 S Ii:1:005:2 -115:8 4 <
ffff8803fe0e8f00 1459103501 C Ii:1:005:2 0:8 4 = 0100ff02
ffff8803fe0e8f00 1459103531 S Ii:1:005:2 -115:8 4 <
ffff8803fe0e8f00 1459143559 C Ii:1:005:2 0:8 4 = 01000001
ffff8803fe0e8f00 1459143589 S Ii:1:005:2 -115:8 4 <
ffff8803fe0e8f00 1459167504 C Ii:1:005:2 0:8 4 = 0100ff01
ffff8803fe0e8f00 1459167546 S Ii:1:005:2 -115:8 4 <
ffff8803fe0e8f00 1459183552 C Ii:1:005:2 0:8 4 = 0100ff02
ffff8803fe0e8f00 1459183584 S Ii:1:005:2 -115:8 4 <
ffff8803fe0e8f00 1459199533 C Ii:1:005:2 0:8 4 = 0100ff02
ffff8803fe0e8f00 1459199563 S Ii:1:005:2 -115:8 4 <
ffff8803fe0e8f00 1459215526 C Ii:1:005:2 0:8 4 = 0100fd04
ffff8803fe0e8f00 1459215558 S Ii:1:005:2 -115:8 4 <
ffff8803fe0e8f00 1459231533 C Ii:1:005:2 0:8 4 = 0100fc04
ffff8803fe0e8f00 1459231563 S Ii:1:005:2 -115:8 4 <
ffff8803fe0e8f00 1459247525 C Ii:1:005:2 0:8 4 = 0100fc04
ffff8803fe0e8f00 1459247557 S Ii:1:005:2 -115:8 4 <
ffff8803fe0e8f00 1459263525 C Ii:1:005:2 0:8 4 = 0100fd03
ffff8803fe0e8f00 1459263556 S Ii:1:005:2 -115:8 4 <
ffff8803fe0e8f00 1459279528 C Ii:1:005:2 0:8 4 = 0100fc02
ffff8803fe0e8f00 1459279560 S Ii:1:005:2 -115:8 4 <
ffff8803fe0e8f00 1459295556 C Ii:1:005:2 0:8 4 = 0100ff01
ffff8803fe0e8f00 1459295587 S Ii:1:005:2 -115:8 4 <
ffff8803fe0e8f00 1459359528 C Ii:1:005:2 0:8 4 = 0100ffff
ffff8803fe0e8f00 1459359559 S Ii:1:005:2 -115:8 4 <
ffff8803fe0e8f00 1459367531 C Ii:1:005:2 0:8 4 = 0100ff00
ffff8803fe0e8f00 1459367562 S Ii:1:005:2 -115:8 4 <
ffff8803fe0e8f00 1459423559 C Ii:1:005:2 0:8 4 = 0100ffff
ffff8803fe0e8f00 1459423589 S Ii:1:005:2 -115:8 4 <
ffff8803fe0e8f00 1459431558 C Ii:1:005:2 0:8 4 = 0100fe00
ffff8803fe0e8f00 1459431588 S Ii:1:005:2 -115:8 4 <
ffff8803fe0e8f00 1459455558 C Ii:1:005:2 0:8 4 = 0100feff
ffff8803fe0e8f00 1459455589 S Ii:1:005:2 -115:8 4 <
ffff8803fe0e8f00 1459503561 C Ii:1:005:2 0:8 4 = 0100ff00
ffff8803fe0e8f00 1459503591 S Ii:1:005:2 -115:8 4 <
ffff8803fe0e8f00 1459511560 C Ii:1:005:2 0:8 4 = 0100ff00
ffff8803fe0e8f00 1459511591 S Ii:1:005:2 -115:8 4 <
ffff8803fe0e8f00 1459543506 C Ii:1:005:2 0:8 4 = 0100ffff
ffff8803fe0e8f00 1459543537 S Ii:1:005:2 -115:8 4 <
ffff8803fe0e8f00 1459607530 C Ii:1:005:2 0:8 4 = 01010000
ffff8803fe0e8f00 1459607562 S Ii:1:005:2 -115:8 4 <
ffff8803fe0e8f00 1459751559 C Ii:1:005:2 0:8 4 = 01000000
ffff8803fe0e8f00 1459751600 S Ii:1:005:2 -115:8 4 <
ffff8803fe0e8f00 1459919566 C Ii:1:005:2 0:8 4 = 01000001
ffff8803fe0e8f00 1459919601 S Ii:1:005:2 -115:8 4 <
ffff8803fe0e8f00 1459943533 C Ii:1:005:2 0:8 4 = 01000102
ffff8803fe0e8f00 1459943565 S Ii:1:005:2 -115:8 4 <
ffff8803fe0e8f00 1459951563 C Ii:1:005:2 0:8 4 = 01000101
ffff8803fe0e8f00 1459951594 S Ii:1:005:2 -115:8 4 <
ffff8803fe0e8f00 1459975560 C Ii:1:005:2 0:8 4 = 01000104
ffff8803fe0e8f00 1459975591 S Ii:1:005:2 -115:8 4 <
ffff8803fe0e8f00 1459983559 C Ii:1:005:2 0:8 4 = 01000102
ffff8803fe0e8f00 1459983589 S Ii:1:005:2 -115:8 4 <
ffff8803fe0e8f00 1460007512 C Ii:1:005:2 0:8 4 = 01000204
ffff8803fe0e8f00 1460007548 S Ii:1:005:2 -115:8 4 <
ffff8803fe0e8f00 1460015533 C Ii:1:005:2 0:8 4 = 01000101
ffff8803fe0e8f00 1460015565 S Ii:1:005:2 -115:8 4 <
ffff8803fe0e8f00 1460159561 C Ii:1:005:2 0:8 4 = 01000103
ffff8803fe0e8f00 1460159593 S Ii:1:005:2 -115:8 4 <
ffff8803fe0e8f00 1460175535 C Ii:1:005:2 0:8 4 = 01000001
ffff8803fe0e8f00 1460175572 S Ii:1:005:2 -115:8 4 <
ffff8803fe0e8f00 1460191563 C Ii:1:005:2 0:8 4 = 01000105
ffff8803fe0e8f00 1460191594 S Ii:1:005:2 -115:8 4 <
ffff8803fe0e8f00 1460287564 C Ii:1:005:2 0:8 4 = 01000001
ffff8803fe0e8f00 1460287594 S Ii:1:005:2 -115:8 4 <
ffff8803fe0e8f00 1460375513 C Ii:1:005:2 0:8 4 = 01010000
ffff8803fe0e8f00 1460375545 S Ii:1:005:2 -115:8 4 <
ffff8803fe0e8f00 1460495568 C Ii:1:005:2 0:8 4 = 01000000
ffff8803fe0e8f00 1460495600 S Ii:1:005:2 -115:8 4 <
ffff880377ac9600 1460529225 S Co:1:036:0 s 21 09 0300 0000 0008 8 = 55010100 00ff075d
ffff880377ac9600 1460529407 C Co:1:036:0 0 8 >
ffff88037500fb40 1460559681 S Ci:1:036:0 s a1 01 0300 0000 0008 8 <
ffff88037500fb40 1460559768 C Ci:1:036:0 0 8 = aa020000 00f00000
ffff8803d9ba3240 1460592673 S Co:1:036:0 s 21 09 0300 0000 0008 8 = 0b010101 00000e04
ffff8803d9ba3240 1460592771 C Co:1:036:0 0 8 >
ffff880377ac9600 1460607680 S Co:1:036:0 s 21 09 0300 0000 0008 8 = 30aa3aba d6220843
ffff880377ac9600 1460607792 C Co:1:036:0 0 8 >
ffff880377ac9600 1460622724 S Co:1:036:0 s 21 09 0300 0000 0008 8 = 027fb300 192f9101
ffff880377ac9600 1460622921 C Co:1:036:0 0 8 >
ffff88037500fb40 1460637866 S Co:1:036:0 s 21 09 0300 0000 0008 8 = 17966fec 3ddf63ec
ffff88037500fb40 1460638039 C Co:1:036:0 0 8 >
ffff88037500fb40 1460654668 S Co:1:036:0 s 21 09 0300 0000 0008 8 = 4d96bf62 af7e7ffe
ffff88037500fb40 1460654766 C Co:1:036:0 0 8 >
ffff8803663cea80 1460669711 S Co:1:036:0 s 21 09 0300 0000 0008 8 = 6fff6fff dfff6fff
ffff8803663cea80 1460669915 C Co:1:036:0 0 8 >
ffff8803d9ba3240 1460684986 S Co:1:036:0 s 21 09 0300 0000 0008 8 = 5fff8fff 8fffbfff
ffff8803d9ba3240 1460685174 C Co:1:036:0 0 8 >
ffff8803d9ba3240 1460701660 S Co:1:036:0 s 21 09 0300 0000 0008 8 = 4fff1f1c bd048de3
ffff8803d9ba3240 1460701767 C Co:1:036:0 0 8 >
ffff8803d9ba3240 1460716706 S Co:1:036:0 s 21 09 0300 0000 0008 8 = 9feb2f0c bd1c4dff
ffff8803d9ba3240 1460716929 C Co:1:036:0 0 8 >
ffff8803d9ba3240 1460731876 S Co:1:036:0 s 21 09 0300 0000 0008 8 = 5fff1f0c cf0c5d6f
ffff8803d9ba3240 1460732040 C Co:1:036:0 0 8 >
ffff88037500fb40 1460748652 S Co:1:036:0 s 21 09 0300 0000 0008 8 = ad6ffd0f ad9f9fff
ffff88037500fb40 1460748790 C Co:1:036:0 0 8 >
ffff88037500fb40 1460763709 S Co:1:036:0 s 21 09 0300 0000 0008 8 = bfff6f0c 710c11ef
ffff88037500fb40 1460763923 C Co:1:036:0 0 8 >
ffff8803663cea80 1460778720 S Co:1:036:0 s 21 09 0300 0000 0008 8 = 7def6d0c fd1c8fff
ffff8803663cea80 1460778916 C Co:1:036:0 0 8 >
ffff8803663cea80 1460795767 S Co:1:036:0 s 21 09 0300 0000 0008 8 = 5fffcf0c 0f0c4dff
ffff8803663cea80 1460795916 C Co:1:036:0 0 8 >
ffff8803663cea80 1460810676 S Co:1:036:0 s 21 09 0300 0000 0008 8 = 8dff7d0c 110c01ff
ffff8803663cea80 1460810792 C Co:1:036:0 0 8 >
ffff8803663cea80 1460825708 S Co:1:036:0 s 21 09 0300 0000 0008 8 = efff6fef 3defedef
ffff8803663cea80 1460825920 C Co:1:036:0 0 8 >
ffff880377ac9600 1460842784 S Co:1:036:0 s 21 09 0300 0000 0008 8 = dd0c511c 41ff5dff
ffff880377ac9600 1460842906 C Co:1:036:0 0 8 >
ffff880377ac9600 1460857664 S Co:1:036:0 s 21 09 0300 0000 0008 8 = efff4ffd 7dfd6dfd
ffff880377ac9600 1460857793 C Co:1:036:0 0 8 >
ffff880377ac9600 1460872713 S Co:1:036:0 s 21 09 0300 0000 0008 8 = effebf0c cd0cbdff
ffff880377ac9600 1460872935 C Co:1:036:0 0 8 >
ffff880377ac9600 1460889753 S Co:1:036:0 s 21 09 0300 0000 0008 8 = 6fffafef efefdf0c
ffff880377ac9600 1460889893 C Co:1:036:0 0 8 >
ffff880377ac9600 1460904654 S Co:1:036:0 s 21 09 0300 0000 0008 8 = d50c55ef adefedff
ffff880377ac9600 1460904792 C Co:1:036:0 0 8 >
ffff880377ac9600 1460919709 S Co:1:036:0 s 21 09 0300 0000 0008 8 = 9fffaf1d 390c71ee
ffff880377ac9600 1460919916 C Co:1:036:0 0 8 >
ffff880377ac9600 1460936736 S Co:1:036:0 s 21 09 0300 0000 0008 8 = 27ee870c d10c81ff
ffff880377ac9600 1460936918 C Co:1:036:0 0 8 >
ffff880377ac9600 1460951779 S Co:1:036:0 s 21 09 0300 0000 0008 8 = 1fffbfff cfff2fff
ffff880377ac9600 1460951916 C Co:1:036:0 0 8 >
ffff880377ac9600 1460966682 S Co:1:036:0 s 21 09 0300 0000 0008 8 = dfffbfff 5fffbfff
ffff880377ac9600 1460966791 C Co:1:036:0 0 8 >
ffff880377ac9600 1460981768 S Co:1:036:0 s 21 09 0300 0000 0008 8 = 7fff2f1c 9d042de3
ffff880377ac9600 1460981916 C Co:1:036:0 0 8 >
ffff880377ac9600 1460998757 S Co:1:036:0 s 21 09 0300 0000 0008 8 = afeb0f0c cd1c9dff
ffff880377ac9600 1460998894 C Co:1:036:0 0 8 >
ffff88037500fb40 1461013703 S Co:1:036:0 s 21 09 0300 0000 0008 8 = ffff9f1c 5f0c4def
ffff88037500fb40 1461013918 C Co:1:036:0 0 8 >
ffff8803663cea80 1461028697 S Co:1:036:0 s 21 09 0300 0000 0008 8 = 8def6d00 fd00adff
ffff8803663cea80 1461028772 C Co:1:036:0 0 8 >
ffff8803d9ba3240 1461045778 S Co:1:036:0 s 21 09 0300 0000 0008 8 = bfff6f1c 4f0cadef
ffff8803d9ba3240 1461045916 C Co:1:036:0 0 8 >
ffff8803d9ba3240 1461060655 S Co:1:036:0 s 21 09 0300 0000 0008 8 = 3def9d00 4d006dff
ffff8803d9ba3240 1461060793 C Co:1:036:0 0 8 >
ffff8803d9ba3240 1461075684 S Co:1:036:0 s 21 09 0300 0000 0008 8 = 6fff7f0c 4f0cfd6f
ffff8803d9ba3240 1461075800 C Co:1:036:0 0 8 >
ffff8803d9ba3240 1461092739 S Co:1:036:0 s 21 09 0300 0000 0008 8 = bd6f4d0f 3d9fbfff
ffff8803d9ba3240 1461092926 C Co:1:036:0 0 8 >
ffff8803d9ba3240 1461107777 S Co:1:036:0 s 21 09 0300 0000 0008 8 = bfff3f0c 010c41fe
ffff8803d9ba3240 1461107919 C Co:1:036:0 0 8 >
ffff8803d9ba3240 1461122677 S Co:1:036:0 s 21 09 0300 0000 0008 8 = dffedf0c 210c81f4
ffff8803d9ba3240 1461122793 C Co:1:036:0 0 8 >
ffff8803d9ba3240 1461139732 S Co:1:036:0 s 21 09 0300 0000 0008 8 = ef77bdb7 9dd72de4
ffff8803d9ba3240 1461139919 C Co:1:036:0 0 8 >
ffff88037500fb40 1461154761 S Co:1:036:0 s 21 09 0300 0000 0008 8 = 9fff9ff4 4f772db7
ffff88037500fb40 1461154923 C Co:1:036:0 0 8 >
ffff880377ac99c0 1461169670 S Co:1:036:0 s 21 09 0300 0000 0008 8 = 3dd7ade4 0fff9f8c
ffff880377ac99c0 1461169785 C Co:1:036:0 0 8 >
ffff88037500fb40 1461186717 S Co:1:036:0 s 21 09 0300 0000 0008 8 = df77ad77 9df7dded
ffff88037500fb40 1461186919 C Co:1:036:0 0 8 >
ffff88037500fb40 1461201752 S Co:1:036:0 s 21 09 0300 0000 0008 8 = 6fff1f8f 9d771d77
ffff88037500fb40 1461201919 C Co:1:036:0 0 8 >
ffff88037500fb40 1461216652 S Co:1:036:0 s 21 09 0300 0000 0008 8 = 9d77ed6c 4dff7f8c
ffff88037500fb40 1461216794 C Co:1:036:0 0 8 >
ffff88037500fb40 1461231687 S Co:1:036:0 s 21 09 0300 0000 0008 8 = 3f77fd77 8d777d8c
ffff88037500fb40 1461231772 C Co:1:036:0 0 8 >
ffff8803d9ba3240 1461248745 S Co:1:036:0 s 21 09 0300 0000 0008 8 = afff2f8f 1f75ad77
ffff8803d9ba3240 1461248920 C Co:1:036:0 0 8 >
ffff8803d9ba3240 1461263782 S Co:1:036:0 s 21 09 0300 0000 0008 8 = fd777d0c 9fff3f8c
ffff8803d9ba3240 1461263920 C Co:1:036:0 0 8 >
ffff8803d9ba3240 1461278684 S Co:1:036:0 s 21 09 0300 0000 0008 8 = 3f77fd77 edf77ded
ffff8803d9ba3240 1461278798 C Co:1:036:0 0 8 >
ffff8803d9ba3240 1461295724 S Co:1:036:0 s 21 09 0300 0000 0008 8 = dfffbf8c 4f770d77
ffff8803d9ba3240 1461295925 C Co:1:036:0 0 8 >
ffff8803d9ba3240 1461310767 S Co:1:036:0 s 21 09 0300 0000 0008 8 = 2d77bd8c 4f2fce1b
ffff8803d9ba3240 1461310930 C Co:1:036:0 0 8 >
ffff8803d9ba3240 1461325671 S Co:1:036:0 s 21 09 0300 0000 0008 8 = 7b3d80b2 dc3e99ce
ffff8803d9ba3240 1461325795 C Co:1:036:0 0 8 >
ffff8803d9ba3240 1461340743 S Co:1:036:0 s 21 09 0300 0000 0008 8 = 0a833aeb 07309661
ffff8803d9ba3240 1461340921 C Co:1:036:0 0 8 >
ffff8803d9ba3240 1461357754 S Co:1:036:0 s 21 09 0300 0000 0008 8 = 28207c62 3afc2234
ffff8803d9ba3240 1461357920 C Co:1:036:0 0 8 >
ffff88037500fb40 1461372658 S Co:1:036:0 s 21 09 0300 0000 0008 8 = f09633b0 908c1cfc
ffff88037500fb40 1461372773 C Co:1:036:0 0 8 >
ffff88037500fb40 1461387824 S Co:1:036:0 s 21 09 0300 0000 0008 8 = de1a9485 483f6a3f
ffff88037500fb40 1461387897 C Co:1:036:0 0 8 >
ffff88037500fb40 1461404741 S Co:1:036:0 s 21 09 0300 0000 0008 8 = 54139321 486873db
ffff88037500fb40 1461404919 C Co:1:036:0 0 8 >
ffff88037500fb40 1461419784 S Co:1:036:0 s 21 09 0300 0000 0008 8 = 18a06bda 94cea57f
ffff88037500fb40 1461419924 C Co:1:036:0 0 8 >
ffff88037500fb40 1461434672 S Co:1:036:0 s 21 09 0300 0000 0008 8 = d2111c9b da2dee2e
ffff88037500fb40 1461434798 C Co:1:036:0 0 8 >
ffff88037500fb40 1461451733 S Co:1:036:0 s 21 09 0300 0000 0008 8 = 916ae661 e8b245c1
ffff88037500fb40 1461451925 C Co:1:036:0 0 8 >
ffff88037500fb40 1461466758 S Co:1:036:0 s 21 09 0300 0000 0008 8 = 45e6d1be 31802163
ffff88037500fb40 1461466921 C Co:1:036:0 0 8 >
ffff8803d9ba3240 1461481657 S Co:1:036:0 s 21 09 0300 0000 0008 8 = 446f2757 4e2ffe15
ffff8803d9ba3240 1461481796 C Co:1:036:0 0 8 >
ffff8803d9ba3240 1461498662 S Co:1:036:0 s 21 09 0300 0000 0008 8 = c729f668 794add2a
ffff8803d9ba3240 1461498799 C Co:1:036:0 0 8 >
ffff88037500fb40 1461513692 S Co:1:036:0 s 21 09 0300 0000 0008 8 = 6ce6903d 12cfc3ca
ffff88037500fb40 1461513916 C Co:1:036:0 0 8 >
ffff88037500fb40 1461528596 S Co:1:036:0 s 21 09 0300 0000 0008 8 = b3b10db9 1cb13771
ffff88037500fb40 1461528792 C Co:1:036:0 0 8 >
ffff88037500fb40 1461545650 S Co:1:036:0 s 21 09 0300 0000 0008 8 = 8446c6d2 be57c66f
ffff88037500fb40 1461545795 C Co:1:036:0 0 8 >
ffff88037500fb40 1461560749 S Co:1:036:0 s 21 09 0300 0000 0008 8 = a696d910 c51c8168
ffff88037500fb40 1461560920 C Co:1:036:0 0 8 >
ffff88037500fb40 1461575637 S Co:1:036:0 s 21 09 0300 0000 0008 8 = 4745aa13 1fce7bd3
ffff88037500fb40 1461575797 C Co:1:036:0 0 8 >
ffff88037500fb40 1461592693 S Co:1:036:0 s 21 09 0300 0000 0008 8 = 782e5e0c 5f314e7d
ffff88037500fb40 1461592776 C Co:1:036:0 0 8 >
ffff88037500fb40 1461607738 S Co:1:036:0 s 21 09 0300 0000 0008 8 = b0db6041 3e7c9505
ffff88037500fb40 1461607917 C Co:1:036:0 0 8 >
ffff88037500fb40 1461622779 S Co:1:036:0 s 21 09 0300 0000 0008 8 = 4610df8b 16d97160
ffff88037500fb40 1461622928 C Co:1:036:0 0 8 >
ffff8803fdc4a780 1461628521 C Ii:3:003:1 0:8 6 = 0878e010 2c01
ffff8803fdc4a780 1461628553 S Ii:3:003:1 -115:8 6 <
ffff88037500fb40 1461639680 S Co:1:036:0 s 21 09 0300 0000 0008 8 = fa404cd9 67e80654
ffff88037500fb40 1461639775 C Co:1:036:0 0 8 >
ffff88037500fb40 1461654720 S Co:1:036:0 s 21 09 0300 0000 0008 8 = 6b13ddad 543bfdff
ffff88037500fb40 1461654936 C Co:1:036:0 0 8 >
ffff8803fdc4a6c0 1461659142 S Ci:3:003:0 s a1 01 030a 0000 0002 64 <
ffff8803fdc4a6c0 1461659300 C Ci:3:003:0 0 2 = 0af0
ffff8803fdc4a6c0 1461659335 S Ci:3:003:0 s a1 01 030f 0000 0002 64 <
ffff8803fdc4a6c0 1461659499 C Ci:3:003:0 0 2 = 0f77
ffff8803fdc4a6c0 1461659521 S Ci:3:003:0 s a1 01 0312 0000 0002 64 <
ffff8803fdc4a6c0 1461659622 C Ci:3:003:0 0 2 = 1277
ffff8803fdc4a6c0 1461659641 S Ci:3:003:0 s a1 01 0313 0000 0002 64 <
ffff8803fdc4a6c0 1461659762 C Ci:3:003:0 0 2 = 1309
ffff8803fdc4a6c0 1461659779 S Ci:3:003:0 s a1 01 0317 0000 0002 64 <
ffff8803fdc4a6c0 1461659928 C Ci:3:003:0 0 2 = 1700
ffff8803fdc4a6c0 1461659969 S Ci:3:003:0 s a1 01 030b 0000 0002 64 <
ffff8803fdc4a6c0 1461660047 C Ci:3:003:0 0 2 = 0b11
ffff88037500fb40 1461669761 S Co:1:036:0 s 21 09 0300 0000 0008 8 = a0e90f9c 25d8024f
ffff88037500fb40 1461669924 C Co:1:036:0 0 8 >
ffff88037500fb40 1461684692 S Co:1:036:0 s 21 09 0300 0000 0008 8 = 814f1dd1 c4bc4689
ffff88037500fb40 1461684778 C Co:1:036:0 0 8 >
ffff8803fdc4a780 1461692493 C Ii:3:003:1 0:8 2 = 0b11
ffff8803fdc4a780 1461692528 S Ii:3:003:1 -115:8 6 <
ffff88037500fb40 1461701706 S Co:1:036:0 s 21 09 0300 0000 0008 8 = 5d8d8c88 4254fcc5
ffff88037500fb40 1461701929 C Co:1:036:0 0 8 >
ffff8803663ce0c0 1461716750 S Co:1:036:0 s 21 09 0300 0000 0008 8 = 641ba295 5204dd6e
ffff8803663ce0c0 1461716921 C Co:1:036:0 0 8 >
ffff8803663ce0c0 1461731704 S Co:1:036:0 s 21 09 0300 0000 0008 8 = 2c25e8dd cba2a6c5
ffff8803663ce0c0 1461731930 C Co:1:036:0 0 8 >
ffff8803663ce0c0 1461748705 S Co:1:036:0 s 21 09 0300 0000 0008 8 = 2e0caed9 28fa975c
ffff8803663ce0c0 1461748925 C Co:1:036:0 0 8 >
ffff8803663ce0c0 1461763722 S Co:1:036:0 s 21 09 0300 0000 0008 8 = 48e68518 094af49d
ffff8803663ce0c0 1461763935 C Co:1:036:0 0 8 >
ffff8803663ce0c0 1461778766 S Co:1:036:0 s 21 09 0300 0000 0008 8 = 3bfbc4bc b1c68643
ffff8803663ce0c0 1461778927 C Co:1:036:0 0 8 >
ffff8803663ce0c0 1461795703 S Co:1:036:0 s 21 09 0300 0000 0008 8 = 2c4905fa 881318de
ffff8803663ce0c0 1461795778 C Co:1:036:0 0 8 >
ffff8803663ce0c0 1461810722 S Co:1:036:0 s 21 09 0300 0000 0008 8 = 25ffa89d 98cdfd51
ffff8803663ce0c0 1461810937 C Co:1:036:0 0 8 >
ffff8803663ce0c0 1461825775 S Co:1:036:0 s 21 09 0300 0000 0008 8 = 93034d81 12038756
ffff8803663ce0c0 1461825925 C Co:1:036:0 0 8 >
ffff8803663ce0c0 1461842672 S Co:1:036:0 s 21 09 0300 0000 0008 8 = c86d5c1a c9b88ff6
ffff8803663ce0c0 1461842800 C Co:1:036:0 0 8 >
ffff8803663ce0c0 1461857713 S Co:1:036:0 s 21 09 0300 0000 0008 8 = 780c7eec b362f113
ffff8803663ce0c0 1461857933 C Co:1:036:0 0 8 >
ffff8803663ce0c0 1461872745 S Co:1:036:0 s 21 09 0300 0000 0008 8 = 3ede2313 6e6c0fe0
ffff8803663ce0c0 1461872925 C Co:1:036:0 0 8 >
ffff8803d9ba3240 1461889662 S Co:1:036:0 s 21 09 0300 0000 0008 8 = 169afdbb b7b64c66
ffff8803d9ba3240 1461889778 C Co:1:036:0 0 8 >
ffff8803d9ba3240 1461904695 S Co:1:036:0 s 21 09 0300 0000 0008 8 = e32981a6 f21290ff
ffff8803d9ba3240 1461904781 C Co:1:036:0 0 8 >
ffff8803d9ba3240 1461919730 S Co:1:036:0 s 21 09 0300 0000 0008 8 = e9266bab a7c7c9dc
ffff8803d9ba3240 1461919932 C Co:1:036:0 0 8 >
ffff8803d9ba3240 1461936647 S Co:1:036:0 s 21 09 0300 0000 0008 8 = 51633834 00106681
ffff8803d9ba3240 1461936802 C Co:1:036:0 0 8 >
ffff8803d9ba3240 1461951689 S Co:1:036:0 s 21 09 0300 0000 0008 8 = aa65acbd 4e9bdc46
ffff8803d9ba3240 1461951806 C Co:1:036:0 0 8 >
ffff8803d9ba3240 1461966722 S Co:1:036:0 s 21 09 0300 0000 0008 8 = 64e54c5a 840d22d6
ffff8803d9ba3240 1461966934 C Co:1:036:0 0 8 >
ffff8803d9ba3240 1461983771 S Co:1:036:0 s 21 09 0300 0000 0008 8 = 554fe32f b97a37b1
ffff8803d9ba3240 1461983926 C Co:1:036:0 0 8 >
ffff8803d9ba3240 1461998667 S Co:1:036:0 s 21 09 0300 0000 0008 8 = 3645fff7 a8f099ac
ffff8803d9ba3240 1461998802 C Co:1:036:0 0 8 >
ffff8803663ce0c0 1462013708 S Co:1:036:0 s 21 09 0300 0000 0008 8 = 251c7280 31ebce6d
ffff8803663ce0c0 1462013905 C Co:1:036:0 0 8 >
ffff880377ac99c0 1462028775 S Co:1:036:0 s 21 09 0300 0000 0008 8 = 235bd42c d7e0ddf2
ffff880377ac99c0 1462028927 C Co:1:036:0 0 8 >
ffff88037500fb40 1462045663 S Co:1:036:0 s 21 09 0300 0000 0008 8 = 9540fe70 42b4d40a
ffff88037500fb40 1462045802 C Co:1:036:0 0 8 >
ffff88037500fb40 1462060695 S Co:1:036:0 s 21 09 0300 0000 0008 8 = c53d8f56 bc4441d8
ffff88037500fb40 1462060782 C Co:1:036:0 0 8 >
ffff88037500fb40 1462075805 S Co:1:036:0 s 21 09 0300 0000 0008 8 = 617569fc b6ddbb55
ffff88037500fb40 1462075932 C Co:1:036:0 0 8 >
ffff88037500fb40 1462092649 S Co:1:036:0 s 21 09 0300 0000 0008 8 = f8423215 43c359cc
ffff88037500fb40 1462092802 C Co:1:036:0 0 8 >
ffff88037500fb40 1462107684 S Co:1:036:0 s 21 09 0300 0000 0008 8 = 82b1d565 9aac375e
ffff88037500fb40 1462107803 C Co:1:036:0 0 8 >
ffff88037500fb40 1462122731 S Co:1:036:0 s 21 09 0300 0000 0008 8 = d7020147 9644f67e
ffff88037500fb40 1462122942 C Co:1:036:0 0 8 >
ffff88037500fb40 1462137891 S Co:1:036:0 s 21 09 0300 0000 0008 8 = 342aa729 37a93a74
ffff88037500fb40 1462138052 C Co:1:036:0 0 8 >
ffff88037500fb40 1462154669 S Co:1:036:0 s 21 09 0300 0000 0008 8 = bc537d0d 20ee2cdd
ffff88037500fb40 1462154802 C Co:1:036:0 0 8 >
ffff8803708f9240 1462169720 S Co:1:036:0 s 21 09 0300 0000 0008 8 = f2588007 199bf926
ffff8803708f9240 1462169910 C Co:1:036:0 0 8 >
ffff8803708f9240 1462184775 S Co:1:036:0 s 21 09 0300 0000 0008 8 = 424c6cc4 8d294f16
ffff8803708f9240 1462184930 C Co:1:036:0 0 8 >
ffff8803708f9240 1462201602 S Co:1:036:0 s 21 09 0300 0000 0008 8 = 78f244ff 0b88e444
ffff8803708f9240 1462201799 C Co:1:036:0 0 8 >
ffff8803708f9240 1462217883 S Co:1:036:0 s 21 09 0300 0000 0008 8 = 4544cf0b c79af19a
ffff8803708f9240 1462218034 C Co:1:036:0 0 8 >
ffff8803708f9240 1462233979 S Co:1:036:0 s 21 09 0300 0000 0008 8 = bfef164f 18b7b1db
ffff8803708f9240 1462234179 C Co:1:036:0 0 8 >
ffff8803708f9240 1462247019 S Co:1:036:0 s 21 09 0300 0000 0008 8 = dfd3e9c3 f92ae518
ffff8803708f9240 1462247185 C Co:1:036:0 0 8 >
ffff8803708f9240 1462263867 S Co:1:036:0 s 21 09 0300 0000 0008 8 = 03865975 8ab1513b
ffff8803708f9240 1462264049 C Co:1:036:0 0 8 >
ffff8803708f9240 1462278909 S Co:1:036:0 s 21 09 0300 0000 0008 8 = 6ccf3d09 8efe3e7e
ffff8803708f9240 1462279054 C Co:1:036:0 0 8 >
ffff8803708f9240 1462293934 S Co:1:036:0 s 21 09 0300 0000 0008 8 = c02db032 ed3af8f3
ffff8803708f9240 1462294047 C Co:1:036:0 0 8 >
ffff8803708f9240 1462310905 S Co:1:036:0 s 21 09 0300 0000 0008 8 = 87508f3c 327f4ffc
ffff8803708f9240 1462311055 C Co:1:036:0 0 8 >
ffff8803708f9240 1462325953 S Co:1:036:0 s 21 09 0300 0000 0008 8 = af9dfd85 0c5c18d1
ffff8803708f9240 1462326038 C Co:1:036:0 0 8 >
ffff8803708f9240 1462340978 S Co:1:036:0 s 21 09 0300 0000 0008 8 = 0aace1fd cf53ab00
ffff8803708f9240 1462341181 C Co:1:036:0 0 8 >
ffff8803708f9240 1462357892 S Co:1:036:0 s 21 09 0300 0000 0008 8 = cdcb65ab f15c65e6
ffff8803708f9240 1462358055 C Co:1:036:0 0 8 >
ffff8803708f9240 1462372935 S Co:1:036:0 s 21 09 0300 0000 0008 8 = 107a7729 90612639
ffff8803708f9240 1462373062 C Co:1:036:0 0 8 >
ffff8803708f9240 1462387965 S Co:1:036:0 s 21 09 0300 0000 0008 8 = 53ef4925 e9c1d280
ffff8803708f9240 1462388189 C Co:1:036:0 0 8 >
ffff8803708f9240 1462404880 S Co:1:036:0 s 21 09 0300 0000 0008 8 = f692d3e0 e0d0d197
ffff8803708f9240 1462405050 C Co:1:036:0 0 8 >
ffff8803708f9240 1462419935 S Co:1:036:0 s 21 09 0300 0000 0008 8 = bd804eb1 7d53912e
ffff8803708f9240 1462420058 C Co:1:036:0 0 8 >
ffff8803708f9240 1462434981 S Co:1:036:0 s 21 09 0300 0000 0008 8 = 5409b881 6b070148
ffff8803708f9240 1462435193 C Co:1:036:0 0 8 >
ffff8803708f9240 1462451906 S Co:1:036:0 s 21 09 0300 0000 0008 8 = c734554e 791916be
ffff8803708f9240 1462452056 C Co:1:036:0 0 8 >
ffff8803708f9240 1462466903 S Co:1:036:0 s 21 09 0300 0000 0008 8 = 07392aaa 1bad48bc
ffff8803708f9240 1462467057 C Co:1:036:0 0 8 >
ffff8803708f9240 1462481952 S Co:1:036:0 s 21 09 0300 0000 0008 8 = 6a04823b e7591441
ffff8803708f9240 1462482036 C Co:1:036:0 0 8 >
ffff8803708f9240 1462499019 S Co:1:036:0 s 21 09 0300 0000 0008 8 = 2ab66c3b 1ba979a1
ffff8803708f9240 1462499188 C Co:1:036:0 0 8 >
ffff8803708f9240 1462513899 S Co:1:036:0 s 21 09 0300 0000 0008 8 = e32538f7 149b7d05
ffff8803708f9240 1462514057 C Co:1:036:0 0 8 >
ffff8803708f9240 1462528937 S Co:1:036:0 s 21 09 0300 0000 0008 8 = 1759ff52 d622a7e7
ffff8803708f9240 1462529056 C Co:1:036:0 0 8 >
ffff8803708f9240 1462544008 S Co:1:036:0 s 21 09 0300 0000 0008 8 = ab0f1a42 89a68598
ffff8803708f9240 1462544179 C Co:1:036:0 0 8 >
ffff8803708f9240 1462560883 S Co:1:036:0 s 21 09 0300 0000 0008 8 = 6938a850 f88026bc
ffff8803708f9240 1462561057 C Co:1:036:0 0 8 >
ffff8803708f9240 1462575927 S Co:1:036:0 s 21 09 0300 0000 0008 8 = 7f790b1a 12809ecb
ffff8803708f9240 1462576046 C Co:1:036:0 0 8 >
ffff8803708f9240 1462590970 S Co:1:036:0 s 21 09 0300 0000 0008 8 = fdab6ad2 6b688790
ffff8803708f9240 1462591182 C Co:1:036:0 0 8 >
ffff8803708f9240 1462607877 S Co:1:036:0 s 21 09 0300 0000 0008 8 = 585a2ebe ba707dab
ffff8803708f9240 1462608061 C Co:1:036:0 0 8 >
ffff8803708f9240 1462622909 S Co:1:036:0 s 21 09 0300 0000 0008 8 = eb4786b8 5ac39f11
ffff8803708f9240 1462623058 C Co:1:036:0 0 8 >
ffff8803708f9240 1462638040 S Co:1:036:0 s 21 09 0300 0000 0008 8 = 73e8e5ad cbfe1289
ffff8803708f9240 1462638183 C Co:1:036:0 0 8 >
ffff8803708f9240 1462655053 S Co:1:036:0 s 21 09 0300 0000 0008 8 = 90e68220 31b6802e
ffff8803708f9240 1462655185 C Co:1:036:0 0 8 >
ffff8803708f9240 1462669915 S Co:1:036:0 s 21 09 0300 0000 0008 8 = 499cd5a7 d2f193f2
ffff8803708f9240 1462670058 C Co:1:036:0 0 8 >
ffff8803708f9240 1462684929 S Co:1:036:0 s 21 09 0300 0000 0008 8 = 879c1e6a 99aa7c17
ffff8803708f9240 1462685058 C Co:1:036:0 0 8 >
ffff8803708f9240 1462702022 S Co:1:036:0 s 21 09 0300 0000 0008 8 = 972bdfa9 984f71b6
ffff8803708f9240 1462702183 C Co:1:036:0 0 8 >
ffff8803708f9240 1462716891 S Co:1:036:0 s 21 09 0300 0000 0008 8 = aac25f35 7f45283b
ffff8803708f9240 1462717058 C Co:1:036:0 0 8 >
ffff8803708f9240 1462731923 S Co:1:036:0 s 21 09 0300 0000 0008 8 = 568d28f4 286060e5
ffff8803708f9240 1462732037 C Co:1:036:0 0 8 >
ffff8803708f9240 1462748972 S Co:1:036:0 s 21 09 0300 0000 0008 8 = 15ee8760 0e6d5748
ffff8803708f9240 1462749190 C Co:1:036:0 0 8 >
ffff8803708f9240 1462763868 S Co:1:036:0 s 21 09 0300 0000 0008 8 = c3f91106 cfab52cc
ffff8803708f9240 1462764060 C Co:1:036:0 0 8 >
ffff8803708f9240 1462778912 S Co:1:036:0 s 21 09 0300 0000 0008 8 = 22f81a09 af4b1a2d
ffff8803708f9240 1462779059 C Co:1:036:0 0 8 >
ffff8803708f9240 1462795961 S Co:1:036:0 s 21 09 0300 0000 0008 8 = 58e63e9f 16f67bfb
ffff8803708f9240 1462796036 C Co:1:036:0 0 8 >
ffff8803708f9240 1462811019 S Co:1:036:0 s 21 09 0300 0000 0008 8 = 6df5da90 0f45c51a
ffff8803708f9240 1462811183 C Co:1:036:0 0 8 >
ffff8803708f9240 1462825906 S Co:1:036:0 s 21 09 0300 0000 0008 8 = cf0a92bc c9494e41
ffff8803708f9240 1462826059 C Co:1:036:0 0 8 >
ffff8803708f9240 1462840980 S Co:1:036:0 s 21 09 0300 0000 0008 8 = d03ecb94 1802ec7d
ffff8803708f9240 1462841198 C Co:1:036:0 0 8 >
ffff8803708f9240 1462857987 S Co:1:036:0 s 21 09 0300 0000 0008 8 = 255e309e f3ea7dad
ffff8803708f9240 1462858204 C Co:1:036:0 0 8 >
ffff8803708f9240 1462872886 S Co:1:036:0 s 21 09 0300 0000 0008 8 = 676a2ff3 f66a6106
ffff8803708f9240 1462873057 C Co:1:036:0 0 8 >
ffff8803708f9240 1462887995 S Co:1:036:0 s 21 09 0300 0000 0008 8 = 94177ac3 df61fc8e
ffff8803708f9240 1462888187 C Co:1:036:0 0 8 >
ffff8803708f9240 1462904977 S Co:1:036:0 s 21 09 0300 0000 0008 8 = 8c4f89ce 12a237a3
ffff8803708f9240 1462905192 C Co:1:036:0 0 8 >
ffff8803708f9240 1462919890 S Co:1:036:0 s 21 09 0300 0000 0008 8 = 96ad15ea 1774fd73
ffff8803708f9240 1462920061 C Co:1:036:0 0 8 >
ffff8803708f9240 1462934906 S Co:1:036:0 s 21 09 0300 0000 0008 8 = db049d81 1912c183
ffff8803708f9240 1462935060 C Co:1:036:0 0 8 >
ffff8803708f9240 1462951969 S Co:1:036:0 s 21 09 0300 0000 0008 8 = e8d7e312 672bf52b
ffff8803708f9240 1462952191 C Co:1:036:0 0 8 >
ffff8803708f9240 1462967016 S Co:1:036:0 s 21 09 0300 0000 0008 8 = 2ee06dae f5619217
ffff8803708f9240 1462967186 C Co:1:036:0 0 8 >
ffff8803708f9240 1462981897 S Co:1:036:0 s 21 09 0300 0000 0008 8 = 848c067b dacc95c5
ffff8803708f9240 1462982060 C Co:1:036:0 0 8 >
ffff8803708f9240 1462998956 S Co:1:036:0 s 21 09 0300 0000 0008 8 = a17b3c32 d2777d0b
ffff8803708f9240 1462999042 C Co:1:036:0 0 8 >
ffff8803708f9240 1463014000 S Co:1:036:0 s 21 09 0300 0000 0008 8 = a402e2a2 bbdfd090
ffff8803708f9240 1463014165 C Co:1:036:0 0 8 >
ffff8803708f9240 1463028884 S Co:1:036:0 s 21 09 0300 0000 0008 8 = 8eab8e2d 19799650
ffff8803708f9240 1463029061 C Co:1:036:0 0 8 >
ffff8803708f9240 1463045944 S Co:1:036:0 s 21 09 0300 0000 0008 8 = c5b21b48 942bda1b
ffff8803708f9240 1463046039 C Co:1:036:0 0 8 >
ffff8803708f9240 1463060975 S Co:1:036:0 s 21 09 0300 0000 0008 8 = 918726fe 77d02e14
ffff8803708f9240 1463061203 C Co:1:036:0 0 8 >
ffff8803663ce0c0 1463075818 S Co:1:036:0 s 21 09 0300 0000 0008 8 = a151926b 32b62635
ffff8803663ce0c0 1463075930 C Co:1:036:0 0 8 >
ffff8803663ce0c0 1463090911 S Co:1:036:0 s 21 09 0300 0000 0008 8 = 85670543 d722dac7
ffff8803663ce0c0 1463091062 C Co:1:036:0 0 8 >
ffff8803663ce0c0 1463107962 S Co:1:036:0 s 21 09 0300 0000 0008 8 = 33d76b4b 9ec866ec
ffff8803663ce0c0 1463108041 C Co:1:036:0 0 8 >
ffff8803663ce0c0 1463123031 S Co:1:036:0 s 21 09 0300 0000 0008 8 = 84e170dc 62556c18
ffff8803663ce0c0 1463123187 C Co:1:036:0 0 8 >
ffff8803663ce0c0 1463137897 S Co:1:036:0 s 21 09 0300 0000 0008 8 = b57b0865 23e88e91
ffff8803663ce0c0 1463138062 C Co:1:036:0 0 8 >
ffff8803663ce0c0 1463154960 S Co:1:036:0 s 21 09 0300 0000 0008 8 = e9cdeae8 8592f7f4
ffff8803663ce0c0 1463155046 C Co:1:036:0 0 8 >
ffff88021d0af840 1463169987 S Co:1:036:0 s 21 09 0300 0000 0008 8 = a4b40e7a 4edcd1b2
ffff88021d0af840 1463170165 C Co:1:036:0 0 8 >
ffff8803663ce0c0 1463184888 S Co:1:036:0 s 21 09 0300 0000 0008 8 = 504035c5 ea3fce8d
ffff8803663ce0c0 1463185064 C Co:1:036:0 0 8 >
ffff8803663ce0c0 1463201942 S Co:1:036:0 s 21 09 0300 0000 0008 8 = ba385f88 e8aba11d
ffff8803663ce0c0 1463202086 C Co:1:036:0 0 8 >
ffff8803663ce0c0 1463216966 S Co:1:036:0 s 21 09 0300 0000 0008 8 = 93935413 7c03844f
ffff8803663ce0c0 1463217040 C Co:1:036:0 0 8 >
ffff8803663ce0c0 1463231882 S Co:1:036:0 s 21 09 0300 0000 0008 8 = f2ff1dce fd9db2e3
ffff8803663ce0c0 1463232070 C Co:1:036:0 0 8 >
ffff8803663ce0c0 1463248925 S Co:1:036:0 s 21 09 0300 0000 0008 8 = ce5d8ab1 67c5edeb
ffff8803663ce0c0 1463249063 C Co:1:036:0 0 8 >
ffff8803663ce0c0 1463263982 S Co:1:036:0 s 21 09 0300 0000 0008 8 = 8741adcb d839f751
ffff8803663ce0c0 1463264195 C Co:1:036:0 0 8 >
ffff8803663ce0c0 1463279036 S Co:1:036:0 s 21 09 0300 0000 0008 8 = 5c745bbe 15ac1a50
ffff8803663ce0c0 1463279190 C Co:1:036:0 0 8 >
ffff8803663ce0c0 1463293897 S Co:1:036:0 s 21 09 0300 0000 0008 8 = f373b03f 0445a2f8
ffff8803663ce0c0 1463294064 C Co:1:036:0 0 8 >
ffff8803663ce0c0 1463310981 S Co:1:036:0 s 21 09 0300 0000 0008 8 = d7ef8a98 311f60ac
ffff8803663ce0c0 1463311195 C Co:1:036:0 0 8 >
ffff8803663ce0c0 1463325989 S Co:1:036:0 s 21 09 0300 0000 0008 8 = f34c0a28 4bc927a5
ffff8803663ce0c0 1463326204 C Co:1:036:0 0 8 >
ffff8803663ce0c0 1463340884 S Co:1:036:0 s 21 09 0300 0000 0008 8 = 1a2518df a6c6516e
ffff8803663ce0c0 1463341068 C Co:1:036:0 0 8 >
ffff8803663ce0c0 1463357940 S Co:1:036:0 s 21 09 0300 0000 0008 8 = 81c5dec5 b90c3968
ffff8803663ce0c0 1463358068 C Co:1:036:0 0 8 >
ffff8803663ce0c0 1463372972 S Co:1:036:0 s 21 09 0300 0000 0008 8 = 41ae4b72 a086c046
ffff8803663ce0c0 1463373197 C Co:1:036:0 0 8 >
ffff8803663ce0c0 1463387961 S Co:1:036:0 s 21 09 0300 0000 0008 8 = d8148f95 9994ca91
ffff8803663ce0c0 1463388045 C Co:1:036:0 0 8 >
ffff8803663ce0c0 1463404924 S Co:1:036:0 s 21 09 0300 0000 0008 8 = a760a36f 8988c023
ffff8803663ce0c0 1463405055 C Co:1:036:0 0 8 >
ffff8803663ce0c0 1463419969 S Co:1:036:0 s 21 09 0300 0000 0008 8 = 73afc057 76280ead
ffff8803663ce0c0 1463420044 C Co:1:036:0 0 8 >
ffff8803663ce0c0 1463435026 S Co:1:036:0 s 21 09 0300 0000 0008 8 = e652e536 0c31a433
ffff8803663ce0c0 1463435181 C Co:1:036:0 0 8 >
ffff8803663ce0c0 1463451929 S Co:1:036:0 s 21 09 0300 0000 0008 8 = 0d4e540b 1ad1778c
ffff8803663ce0c0 1463452064 C Co:1:036:0 0 8 >
ffff8803663ce0c0 1463466967 S Co:1:036:0 s 21 09 0300 0000 0008 8 = dadc1466 142affe5
ffff8803663ce0c0 1463467045 C Co:1:036:0 0 8 >
ffff8803663ce0c0 1463481998 S Co:1:036:0 s 21 09 0300 0000 0008 8 = a1e86eee 91d3b93d
ffff8803663ce0c0 1463482199 C Co:1:036:0 0 8 >
ffff8803663ce0c0 1463498910 S Co:1:036:0 s 21 09 0300 0000 0008 8 = 9d9471dd cd58a5e9
ffff8803663ce0c0 1463499064 C Co:1:036:0 0 8 >
ffff8803663ce0c0 1463513949 S Co:1:036:0 s 21 09 0300 0000 0008 8 = 6ab47081 26b8c70f
ffff8803663ce0c0 1463514066 C Co:1:036:0 0 8 >
ffff8803663ce0c0 1463528971 S Co:1:036:0 s 21 09 0300 0000 0008 8 = 8a5181bc a1e4a82d
ffff8803663ce0c0 1463529197 C Co:1:036:0 0 8 >
ffff8803663ce0c0 1463545900 S Co:1:036:0 s 21 09 0300 0000 0008 8 = e328ff82 6445d391
ffff8803663ce0c0 1463546045 C Co:1:036:0 0 8 >
ffff8803663ce0c0 1463560965 S Co:1:036:0 s 21 09 0300 0000 0008 8 = 3d2b0760 3b345be1
ffff8803663ce0c0 1463561049 C Co:1:036:0 0 8 >
ffff8803663ce0c0 1463575973 S Co:1:036:0 s 21 09 0300 0000 0008 8 = c7fdfcf1 15815192
ffff8803663ce0c0 1463576199 C Co:1:036:0 0 8 >
ffff8803663ce0c0 1463592891 S Co:1:036:0 s 21 09 0300 0000 0008 8 = 91780568 86ef5173
ffff8803663ce0c0 1463593071 C Co:1:036:0 0 8 >
ffff8803663ce0c0 1463607919 S Co:1:036:0 s 21 09 0300 0000 0008 8 = 11288b0b 46b4f421
ffff8803663ce0c0 1463608067 C Co:1:036:0 0 8 >
ffff8803663ce0c0 1463622983 S Co:1:036:0 s 21 09 0300 0000 0008 8 = a0cfbeb4 aefc5d92
ffff8803663ce0c0 1463623201 C Co:1:036:0 0 8 >
ffff8803663ce0c0 1463638283 S Co:1:036:0 s 21 09 0300 0000 0008 8 = fce10f51 4065ae8d
ffff8803663ce0c0 1463638442 C Co:1:036:0 0 8 >
ffff8803663ce0c0 1463654904 S Co:1:036:0 s 21 09 0300 0000 0008 8 = c608b663 1d82922e
ffff8803663ce0c0 1463655067 C Co:1:036:0 0 8 >
ffff8803663ce0c0 1463669952 S Co:1:036:0 s 21 09 0300 0000 0008 8 = 039f2b81 8e5ab365
ffff8803663ce0c0 1463670071 C Co:1:036:0 0 8 >
ffff8803663ce0c0 1463684976 S Co:1:036:0 s 21 09 0300 0000 0008 8 = 9d39afd4 7ee84376
ffff8803663ce0c0 1463685199 C Co:1:036:0 0 8 >
ffff8803663ce0c0 1463701897 S Co:1:036:0 s 21 09 0300 0000 0008 8 = e119c29a fd9b7678
ffff8803663ce0c0 1463702068 C Co:1:036:0 0 8 >
ffff8803d9ba3240 1463716937 S Co:1:036:0 s 21 09 0300 0000 0008 8 = 01b9aca6 bdd504d8
ffff8803d9ba3240 1463717068 C Co:1:036:0 0 8 >
ffff880377ac99c0 1463731972 S Co:1:036:0 s 21 09 0300 0000 0008 8 = 9146f7dc 966ea9d5
ffff880377ac99c0 1463732066 C Co:1:036:0 0 8 >
ffff880377ac99c0 1463748882 S Co:1:036:0 s 21 09 0300 0000 0008 8 = 0c20f1b7 0431a603
ffff880377ac99c0 1463749068 C Co:1:036:0 0 8 >
ffff880377ac99c0 1463763918 S Co:1:036:0 s 21 09 0300 0000 0008 8 = 4e5c2dc4 a55b40ca
ffff880377ac99c0 1463764057 C Co:1:036:0 0 8 >
ffff88021d0af840 1463778987 S Co:1:036:0 s 21 09 0300 0000 0008 8 = 1a440026 be213ee7
ffff88021d0af840 1463779202 C Co:1:036:0 0 8 >
ffff88021d0af840 1463796007 S Co:1:036:0 s 21 09 0300 0000 0008 8 = 93d30613 b5296ee8
ffff88021d0af840 1463796203 C Co:1:036:0 0 8 >
ffff88021d0af840 1463810910 S Co:1:036:0 s 21 09 0300 0000 0008 8 = c53c9d54 960e1eb2
ffff88021d0af840 1463811068 C Co:1:036:0 0 8 >
ffff88021d0af840 1463825946 S Co:1:036:0 s 21 09 0300 0000 0008 8 = 1b6267c7 91dea5fd
ffff88021d0af840 1463826072 C Co:1:036:0 0 8 >
ffff88021d0af840 1463843016 S Co:1:036:0 s 21 09 0300 0000 0008 8 = e960cade 789dd9d4
ffff88021d0af840 1463843199 C Co:1:036:0 0 8 >
ffff8803663ce0c0 1463857895 S Co:1:036:0 s 21 09 0300 0000 0008 8 = e200711f 43c29917
ffff8803663ce0c0 1463858077 C Co:1:036:0 0 8 >
ffff8803663ce0c0 1463872927 S Co:1:036:0 s 21 09 0300 0000 0008 8 = a045cba4 8eb743fb
ffff8803663ce0c0 1463873068 C Co:1:036:0 0 8 >
ffff8803663ce0c0 1463889984 S Co:1:036:0 s 21 09 0300 0000 0008 8 = 21e4889b 175b3c87
ffff8803663ce0c0 1463890200 C Co:1:036:0 0 8 >
ffff8803d9ba3240 1463904893 S Co:1:036:0 s 21 09 0300 0000 0008 8 = 46c521c5 43816d17
ffff8803d9ba3240 1463905069 C Co:1:036:0 0 8 >
ffff8803d9ba3240 1463919930 S Co:1:036:0 s 21 09 0300 0000 0008 8 = 548550f8 9871c2da
ffff8803d9ba3240 1463920069 C Co:1:036:0 0 8 >
ffff8803d9ba3240 1463934980 S Co:1:036:0 s 21 09 0300 0000 0008 8 = 75f4929f 4264ab56
ffff8803d9ba3240 1463935201 C Co:1:036:0 0 8 >
ffff8803d9ba3240 1463952014 S Co:1:036:0 s 21 09 0300 0000 0008 8 = 3699aa37 910a9ee1
ffff8803d9ba3240 1463952199 C Co:1:036:0 0 8 >
ffff8803d9ba3240 1463966909 S Co:1:036:0 s 21 09 0300 0000 0008 8 = 092b1ed2 77069127
ffff8803d9ba3240 1463967070 C Co:1:036:0 0 8 >
ffff8803d9ba3240 1463981943 S Co:1:036:0 s 21 09 0300 0000 0008 8 = c218ba96 0c6e82a9
ffff8803d9ba3240 1463982070 C Co:1:036:0 0 8 >
ffff8803d9ba3240 1463999010 S Co:1:036:0 s 21 09 0300 0000 0008 8 = 1c010a3d 0c4ef13a
ffff8803d9ba3240 1463999173 C Co:1:036:0 0 8 >
ffff88021d0af840 1464013907 S Co:1:036:0 s 21 09 0300 0000 0008 8 = 3339e294 55246283
ffff88021d0af840 1464014070 C Co:1:036:0 0 8 >
ffff880377ac99c0 1464028929 S Co:1:036:0 s 21 09 0300 0000 0008 8 = 0a4bd8fe 6c63de7e
ffff880377ac99c0 1464029071 C Co:1:036:0 0 8 >
ffff880377ac99c0 1464045986 S Co:1:036:0 s 21 09 0300 0000 0008 8 = 0573c7f1 f7f271fc
ffff880377ac99c0 1464046212 C Co:1:036:0 0 8 >
ffff880377ac99c0 1464060890 S Co:1:036:0 s 21 09 0300 0000 0008 8 = 6d224c75 42acab21
ffff880377ac99c0 1464061077 C Co:1:036:0 0 8 >
ffff88021d0af840 1464075921 S Co:1:036:0 s 21 09 0300 0000 0008 8 = f17d4baa bde021e4
ffff88021d0af840 1464076070 C Co:1:036:0 0 8 >
ffff8803663ce0c0 1464092970 S Co:1:036:0 s 21 09 0300 0000 0008 8 = 21dc6841 7ad0eb92
ffff8803663ce0c0 1464093048 C Co:1:036:0 0 8 >
ffff8803663ce0c0 1464107878 S Co:1:036:0 s 21 09 0300 0000 0008 8 = f34d9000 b134264a
ffff8803663ce0c0 1464108087 C Co:1:036:0 0 8 >
ffff8803663ce0c0 1464122905 S Co:1:036:0 s 21 09 0300 0000 0008 8 = 41117041 3eb77281
ffff8803663ce0c0 1464123071 C Co:1:036:0 0 8 >
ffff8803663ce0c0 1464139968 S Co:1:036:0 s 21 09 0300 0000 0008 8 = 461cfa71 2076727d
ffff8803663ce0c0 1464140049 C Co:1:036:0 0 8 >
ffff8803d9ba3b40 1464155028 S Co:1:036:0 s 21 09 0300 0000 0008 8 = 2697e693 f98651dc
ffff8803d9ba3b40 1464155197 C Co:1:036:0 0 8 >
ffff8803d9ba3b40 1464169902 S Co:1:036:0 s 21 09 0300 0000 0008 8 = 665f2dbc 936d3a0d
ffff8803d9ba3b40 1464170072 C Co:1:036:0 0 8 >
ffff8803d9ba3b40 1464184934 S Co:1:036:0 s 21 09 0300 0000 0008 8 = 6e858d97 57a5ddd3
ffff8803d9ba3b40 1464185071 C Co:1:036:0 0 8 >
ffff8803d9ba3b40 1464201996 S Co:1:036:0 s 21 09 0300 0000 0008 8 = 0cce0ae1 d61fefc7
ffff8803d9ba3b40 1464202209 C Co:1:036:0 0 8 >
ffff8803d9ba3b40 1464216879 S Co:1:036:0 s 21 09 0300 0000 0008 8 = f23369ec 42bca7d4
ffff8803d9ba3b40 1464217079 C Co:1:036:0 0 8 >
ffff88021d0af840 1464231949 S Co:1:036:0 s 21 09 0300 0000 0008 8 = 3460b51d f3d344bb
ffff88021d0af840 1464232050 C Co:1:036:0 0 8 >
ffff88021d0af840 1464246968 S Co:1:036:0 s 21 09 0300 0000 0008 8 = cd36bc70 e5b0848f
ffff88021d0af840 1464247051 C Co:1:036:0 0 8 >
ffff8803663ce0c0 1464264013 S Co:1:036:0 s 21 09 0300 0000 0008 8 = 1a4b91f1 36122d38
ffff8803663ce0c0 1464264189 C Co:1:036:0 0 8 >
ffff8803663ce0c0 1464278914 S Co:1:036:0 s 21 09 0300 0000 0008 8 = 5b680a43 abaa86f2
ffff8803663ce0c0 1464279072 C Co:1:036:0 0 8 >
ffff8803d9ba3b40 1464293944 S Co:1:036:0 s 21 09 0300 0000 0008 8 = 3708411b 2aa0ddcd
ffff8803d9ba3b40 1464294073 C Co:1:036:0 0 8 >
ffff8803d9ba3b40 1464311020 S Co:1:036:0 s 21 09 0300 0000 0008 8 = 37dd14c4 4010012c
ffff8803d9ba3b40 1464311205 C Co:1:036:0 0 8 >
ffff8803d9ba3b40 1464325904 S Co:1:036:0 s 21 09 0300 0000 0008 8 = 474ca79b 9a87c648
ffff8803d9ba3b40 1464326074 C Co:1:036:0 0 8 >
ffff8803d9ba3b40 1464340929 S Co:1:036:0 s 21 09 0300 0000 0008 8 = 3beee091 8e8886ad
ffff8803d9ba3b40 1464341074 C Co:1:036:0 0 8 >
ffff8803d9ba3b40 1464357992 S Co:1:036:0 s 21 09 0300 0000 0008 8 = 460fe8ae 910c9cba
ffff8803d9ba3b40 1464358206 C Co:1:036:0 0 8 >
ffff8803d9ba3b40 1464372878 S Co:1:036:0 s 21 09 0300 0000 0008 8 = 8231ae8a c0fbea24
ffff8803d9ba3b40 1464373051 C Co:1:036:0 0 8 >
ffff8803d9ba3b40 1464387920 S Co:1:036:0 s 21 09 0300 0000 0008 8 = 6d8865d5 59b65271
ffff8803d9ba3b40 1464388074 C Co:1:036:0 0 8 >
ffff8803d9ba3b40 1464404977 S Co:1:036:0 s 21 09 0300 0000 0008 8 = 687e03ce 418f3e7f
ffff8803d9ba3b40 1464405052 C Co:1:036:0 0 8 >
ffff8803d9ba3b40 1464419872 S Co:1:036:0 s 21 09 0300 0000 0008 8 = 392ec3cd 7e4d1afc
ffff8803d9ba3b40 1464420083 C Co:1:036:0 0 8 >
ffff8803d9ba3b40 1464434906 S Co:1:036:0 s 21 09 0300 0000 0008 8 = 88eba2bc bdabd7ed
ffff8803d9ba3b40 1464435075 C Co:1:036:0 0 8 >
ffff8803d9ba3b40 1464451963 S Co:1:036:0 s 21 09 0300 0000 0008 8 = 63b8e398 cbd8682a
ffff8803d9ba3b40 1464452080 C Co:1:036:0 0 8 >
ffff8803d9ba3b40 1464467020 S Co:1:036:0 s 21 09 0300 0000 0008 8 = bccf8df2 1ef647de
ffff8803d9ba3b40 1464467200 C Co:1:036:0 0 8 >
ffff880377ac99c0 1464481905 S Co:1:036:0 s 21 09 0300 0000 0008 8 = e81ce972 4b9def09
ffff880377ac99c0 1464482075 C Co:1:036:0 0 8 >
ffff880377ac99c0 1464496962 S Co:1:036:0 s 21 09 0300 0000 0008 8 = 1fc10750 8f586100
ffff880377ac99c0 1464497079 C Co:1:036:0 0 8 >
ffff88021d0af0c0 1464513992 S Co:1:036:0 s 21 09 0300 0000 0008 8 = 019338db 4824a1ea
ffff88021d0af0c0 1464514216 C Co:1:036:0 0 8 >
ffff88021d0af0c0 1464528884 S Co:1:036:0 s 21 09 0300 0000 0008 8 = 0e9994f5 7bf63843
ffff88021d0af0c0 1464529076 C Co:1:036:0 0 8 >
ffff88021d0af0c0 1464543922 S Co:1:036:0 s 21 09 0300 0000 0008 8 = 2b927393 4f34b25a
ffff88021d0af0c0 1464544075 C Co:1:036:0 0 8 >
ffff8803663ce0c0 1464560973 S Co:1:036:0 s 21 09 0300 0000 0008 8 = 216df63f 8e381fd5
ffff8803663ce0c0 1464561053 C Co:1:036:0 0 8 >
ffff8803663ce0c0 1464575872 S Co:1:036:0 s 21 09 0300 0000 0008 8 = 1fd17d98 29d3952a
ffff8803663ce0c0 1464576082 C Co:1:036:0 0 8 >
ffff8803663ce0c0 1464607076 S Co:1:036:0 s 21 09 0300 0000 0008 8 = 5503efa4 d30bc902
ffff8803663ce0c0 1464607182 C Co:1:036:0 0 8 >
ffff8803fdc4a780 1464628524 C Ii:3:003:1 0:8 6 = 08786612 2c01
ffff8803fdc4a780 1464628555 S Ii:3:003:1 -115:8 6 <
ffff8803663ce0c0 1464637892 S Ci:1:036:0 s a1 01 0300 0000 0008 8 <
ffff8803663ce0c0 1464638111 C Ci:1:036:0 0 8 = aa040000 00f00000
ffff8803fdc4a6c0 1464660188 S Ci:3:003:0 s a1 01 030a 0000 0002 64 <
ffff8803fdc4a6c0 1464660261 C Ci:3:003:0 0 2 = 0af0
ffff8803fdc4a6c0 1464660289 S Ci:3:003:0 s a1 01 030f 0000 0002 64 <
ffff8803fdc4a6c0 1464660373 C Ci:3:003:0 0 2 = 0f77
ffff8803fdc4a6c0 1464660408 S Ci:3:003:0 s a1 01 0312 0000 0002 64 <
ffff8803fdc4a6c0 1464660518 C Ci:3:003:0 0 2 = 1277
ffff8803fdc4a6c0 1464660552 S Ci:3:003:0 s a1 01 0313 0000 0002 64 <
ffff8803fdc4a6c0 1464660640 C Ci:3:003:0 0 2 = 1309
ffff8803fdc4a6c0 1464660675 S Ci:3:003:0 s a1 01 0317 0000 0002 64 <
ffff8803fdc4a6c0 1464660764 C Ci:3:003:0 0 2 = 1700
ffff8803fdc4a6c0 1464660807 S Ci:3:003:0 s a1 01 030b 0000 0002 64 <
ffff8803fdc4a6c0 1464660890 C Ci:3:003:0 0 2 = 0b11
ffff8803fdc4a780 1464692523 C Ii:3:003:1 0:8 2 = 0b11
ffff8803fdc4a780 1464692556 S Ii:3:003:1 -115:8 6 <
ffff8803fe0e8f00 1466967632 C Ii:1:005:2 0:8 4 = 01000003
ffff8803fe0e8f00 1466967672 S Ii:1:005:2 -115:8 4 <
ffff8803fe0e8f00 1466991626 C Ii:1:005:2 0:8 4 = 01000405
ffff8803fe0e8f00 1466991657 S Ii:1:005:2 -115:8 4 <
ffff8803fe0e8f00 1466999624 C Ii:1:005:2 0:8 4 = 01000405
ffff8803fe0e8f00 1466999654 S Ii:1:005:2 -115:8 4 <
ffff8803fe0e8f00 1467023633 C Ii:1:005:2 0:8 4 = 01000505
ffff8803fe0e8f00 1467023672 S Ii:1:005:2 -115:8 4 <
ffff8803fe0e8f00 1467031585 C Ii:1:005:2 0:8 4 = 01000102
ffff8803fe0e8f00 1467031614 S Ii:1:005:2 -115:8 4 <
ffff8803fe0e8f00 1467055599 C Ii:1:005:2 0:8 4 = 01000405
ffff8803fe0e8f00 1467055629 S Ii:1:005:2 -115:8 4 <
ffff8803fe0e8f00 1467071599 C Ii:1:005:2 0:8 4 = 01000405
ffff8803fe0e8f00 1467071629 S Ii:1:005:2 -115:8 4 <
ffff8803fe0e8f00 1467087605 C Ii:1:005:2 0:8 4 = 01000d0e
ffff8803fe0e8f00 1467087636 S Ii:1:005:2 -115:8 4 <
ffff8803fe0e8f00 1467103629 C Ii:1:005:2 0:8 4 = 01000809
ffff8803fe0e8f00 1467103660 S Ii:1:005:2 -115:8 4 <
ffff8803fe0e8f00 1467111614 C Ii:1:005:2 0:8 4 = 0100090a
ffff8803fe0e8f00 1467111645 S Ii:1:005:2 -115:8 4 <
ffff8803fe0e8f00 1467135599 C Ii:1:005:2 0:8 4 = 01001110
ffff8803fe0e8f00 1467135629 S Ii:1:005:2 -115:8 4 <
ffff8803fe0e8f00 1467143576 C Ii:1:005:2 0:8 4 = 01000505
ffff8803fe0e8f00 1467143604 S Ii:1:005:2 -115:8 4 <
ffff8803fe0e8f00 1467167600 C Ii:1:005:2 0:8 4 = 01000b0b
ffff8803fe0e8f00 1467167631 S Ii:1:005:2 -115:8 4 <
ffff8803fe0e8f00 1467175601 C Ii:1:005:2 0:8 4 = 01000505
ffff8803fe0e8f00 1467175630 S Ii:1:005:2 -115:8 4 <
ffff8803fe0e8f00 1467199600 C Ii:1:005:2 0:8 4 = 01000a08
ffff8803fe0e8f00 1467199630 S Ii:1:005:2 -115:8 4 <
ffff8803fe0e8f00 1467207607 C Ii:1:005:2 0:8 4 = 01000304
ffff8803fe0e8f00 1467207637 S Ii:1:005:2 -115:8 4 <
ffff8803fe0e8f00 1467231607 C Ii:1:005:2 0:8 4 = 01000a07
ffff8803fe0e8f00 1467231645 S Ii:1:005:2 -115:8 4 <
ffff8803fe0e8f00 1467239600 C Ii:1:005:2 0:8 4 = 01000202
ffff8803fe0e8f00 1467239631 S Ii:1:005:2 -115:8 4 <
ffff8803fe0e8f00 1467255602 C Ii:1:005:2 0:8 4 = 01000101
ffff8803fe0e8f00 1467255632 S Ii:1:005:2 -115:8 4 <
ffff8803fe0e8f00 1467287578 C Ii:1:005:2 0:8 4 = 01000201
ffff8803fe0e8f00 1467287602 S Ii:1:005:2 -115:8 4 <
ffff8803fe0e8f00 1467319588 C Ii:1:005:2 0:8 4 = 01000001
ffff8803fe0e8f00 1467319625 S Ii:1:005:2 -115:8 4 <
ffff8803fe0e8f00 1467383603 C Ii:1:005:2 0:8 4 = 01000002
ffff8803fe0e8f00 1467383637 S Ii:1:005:2 -115:8 4 <
ffff8803fe0e8f00 1467399631 C Ii:1:005:2 0:8 4 = 01000105
ffff8803fe0e8f00 1467399662 S Ii:1:005:2 -115:8 4 <
ffff8803fe0e8f00 1467415607 C Ii:1:005:2 0:8 4 = 01000003
ffff8803fe0e8f00 1467415637 S Ii:1:005:2 -115:8 4 <
ffff8803fe0e8f00 1467431603 C Ii:1:005:2 0:8 4 = 0100ff0a
ffff8803fe0e8f00 1467431634 S Ii:1:005:2 -115:8 4 <
ffff8803fe0e8f00 1467447610 C Ii:1:005:2 0:8 4 = 0100ff07
ffff8803fe0e8f00 1467447641 S Ii:1:005:2 -115:8 4 <
ffff8803fe0e8f00 1467463604 C Ii:1:005:2 0:8 4 = 0100fe10
ffff8803fe0e8f00 1467463634 S Ii:1:005:2 -115:8 4 <
ffff8803fe0e8f00 1467479635 C Ii:1:005:2 0:8 4 = 0100ff08
ffff8803fe0e8f00 1467479665 S Ii:1:005:2 -115:8 4 <
ffff8803fe0e8f00 1467487603 C Ii:1:005:2 0:8 4 = 0100ff08
ffff8803fe0e8f00 1467487633 S Ii:1:005:2 -115:8 4 <
ffff8803fe0e8f00 1467511606 C Ii:1:005:2 0:8 4 = 01000008
ffff8803fe0e8f00 1467511635 S Ii:1:005:2 -115:8 4 <
ffff8803fe0e8f00 1467519609 C Ii:1:005:2 0:8 4 = 01000004
ffff8803fe0e8f00 1467519638 S Ii:1:005:2 -115:8 4 <
ffff8803fe0e8f00 1467543610 C Ii:1:005:2 0:8 4 = 01000101
ffff8803fe0e8f00 1467543640 S Ii:1:005:2 -115:8 4 <
ffff8803fe0e8f00 1467591629 C Ii:1:005:2 0:8 4 = 01000403
ffff8803fe0e8f00 1467591660 S Ii:1:005:2 -115:8 4 <
ffff8803fdc4a780 1467628554 C Ii:3:003:1 0:8 6 = 0878d011 2c01
ffff8803fdc4a780 1467628583 S Ii:3:003:1 -115:8 6 <
ffff8803fdc4a6c0 1467661030 S Ci:3:003:0 s a1 01 030a 0000 0002 64 <
ffff8803fdc4a6c0 1467661144 C Ci:3:003:0 0 2 = 0af0
ffff8803fdc4a6c0 1467661179 S Ci:3:003:0 s a1 01 030f 0000 0002 64 <
ffff8803fdc4a6c0 1467661298 C Ci:3:003:0 0 2 = 0f77
ffff8803fdc4a6c0 1467661333 S Ci:3:003:0 s a1 01 0312 0000 0002 64 <
ffff8803fdc4a6c0 1467661421 C Ci:3:003:0 0 2 = 1277
ffff8803fdc4a6c0 1467661455 S Ci:3:003:0 s a1 01 0313 0000 0002 64 <
ffff8803fdc4a6c0 1467661549 C Ci:3:003:0 0 2 = 1309
ffff8803fdc4a6c0 1467661583 S Ci:3:003:0 s a1 01 0317 0000 0002 64 <
ffff8803fdc4a6c0 1467661675 C Ci:3:003:0 0 2 = 1700
ffff8803fdc4a6c0 1467661717 S Ci:3:003:0 s a1 01 030b 0000 0002 64 <
ffff8803fdc4a6c0 1467661857 C Ci:3:003:0 0 2 = 0b11
ffff8803fdc4a780 1467692570 C Ii:3:003:1 0:8 2 = 0b11
ffff8803fdc4a780 1467692604 S Ii:3:003:1 -115:8 6 <
ffff8803fe0e8f00 1467775604 C Ii:1:005:2 0:8 4 = 010001ff
ffff8803fe0e8f00 1467775637 S Ii:1:005:2 -115:8 4 <
ffff8803fe0e8f00 1467791632 C Ii:1:005:2 0:8 4 = 010001fd
ffff8803fe0e8f00 1467791663 S Ii:1:005:2 -115:8 4 <
ffff8803fe0e8f00 1467807611 C Ii:1:005:2 0:8 4 = 010001fe
ffff8803fe0e8f00 1467807642 S Ii:1:005:2 -115:8 4 <
ffff8803fe0e8f00 1467823636 C Ii:1:005:2 0:8 4 = 010000ff
ffff8803fe0e8f00 1467823665 S Ii:1:005:2 -115:8 4 <
ffff8803fe0e8f00 1467839606 C Ii:1:005:2 0:8 4 = 010001ff
ffff8803fe0e8f00 1467839637 S Ii:1:005:2 -115:8 4 <
ffff8803fe0e8f00 1467999634 C Ii:1:005:2 0:8 4 = 01010000
ffff8803fe0e8f00 1467999670 S Ii:1:005:2 -115:8 4 <
ffff8803fe0e8f00 1468111620 C Ii:1:005:2 0:8 4 = 01000000
ffff8803fe0e8f00 1468111663 S Ii:1:005:2 -115:8 4 <
ffff8803fe0e8f00 1468295590 C Ii:1:005:2 0:8 4 = 0100ff00
ffff8803fe0e8f00 1468295633 S Ii:1:005:2 -115:8 4 <
ffff8803fe0e8f00 1468319603 C Ii:1:005:2 0:8 4 = 010000ff
ffff8803fe0e8f00 1468319629 S Ii:1:005:2 -115:8 4 <
ffff8803fe0e8f00 1468343618 C Ii:1:005:2 0:8 4 = 0100fdfe
ffff8803fe0e8f00 1468343649 S Ii:1:005:2 -115:8 4 <
ffff8803fe0e8f00 1468359638 C Ii:1:005:2 0:8 4 = 0100fcfe
ffff8803fe0e8f00 1468359669 S Ii:1:005:2 -115:8 4 <
ffff8803fe0e8f00 1468375619 C Ii:1:005:2 0:8 4 = 0100fbfd
ffff8803fe0e8f00 1468375650 S Ii:1:005:2 -115:8 4 <
ffff8803fe0e8f00 1468391609 C Ii:1:005:2 0:8 4 = 0100fbfc
ffff8803fe0e8f00 1468391639 S Ii:1:005:2 -115:8 4 <
ffff8803fe0e8f00 1468415611 C Ii:1:005:2 0:8 4 = 0100f8f8
ffff8803fe0e8f00 1468415641 S Ii:1:005:2 -115:8 4 <
ffff8803fe0e8f00 1468431618 C Ii:1:005:2 0:8 4 = 0100f9f8
ffff8803fe0e8f00 1468431658 S Ii:1:005:2 -115:8 4 <
ffff8803fe0e8f00 1468439637 C Ii:1:005:2 0:8 4 = 0100f9f7
ffff8803fe0e8f00 1468439667 S Ii:1:005:2 -115:8 4 <
ffff8803fe0e8f00 1468455622 C Ii:1:005:2 0:8 4 = 0100f9f7
ffff8803fe0e8f00 1468455652 S Ii:1:005:2 -115:8 4 <
ffff8803fe0e8f00 1468471611 C Ii:1:005:2 0:8 4 = 0100f5ef
ffff8803fe0e8f00 1468471642 S Ii:1:005:2 -115:8 4 <
ffff8803fe0e8f00 1468487641 C Ii:1:005:2 0:8 4 = 0100fcf9
ffff8803fe0e8f00 1468487671 S Ii:1:005:2 -115:8 4 <
ffff8803fe0e8f00 1468495620 C Ii:1:005:2 0:8 4 = 0100fcf9
ffff8803fe0e8f00 1468495651 S Ii:1:005:2 -115:8 4 <
ffff8803fe0e8f00 1468519612 C Ii:1:005:2 0:8 4 = 0100f9f6
ffff8803fe0e8f00 1468519644 S Ii:1:005:2 -115:8 4 <
ffff8803fe0e8f00 1468527642 C Ii:1:005:2 0:8 4 = 0100fbf9
ffff8803fe0e8f00 1468527673 S Ii:1:005:2 -115:8 4 <
ffff8803fe0e8f00 1468551637 C Ii:1:005:2 0:8 4 = 0100faf5
ffff8803fe0e8f00 1468551668 S Ii:1:005:2 -115:8 4 <
ffff8803fe0e8f00 1468559638 C Ii:1:005:2 0:8 4 = 0100fdfd
ffff8803fe0e8f00 1468559668 S Ii:1:005:2 -115:8 4 <
ffff8803fe0e8f00 1468583607 C Ii:1:005:2 0:8 4 = 0100fbf6
ffff8803fe0e8f00 1468583620 S Ii:1:005:2 -115:8 4 <
ffff8803fe0e8f00 1468591613 C Ii:1:005:2 0:8 4 = 0100fefc
ffff8803fe0e8f00 1468591644 S Ii:1:005:2 -115:8 4 <
ffff8803fe0e8f00 1468615638 C Ii:1:005:2 0:8 4 = 0100faf5
ffff8803fe0e8f00 1468615669 S Ii:1:005:2 -115:8 4 <
ffff8803fe0e8f00 1468623612 C Ii:1:005:2 0:8 4 = 0100fefc
ffff8803fe0e8f00 1468623643 S Ii:1:005:2 -115:8 4 <
ffff8803fe0e8f00 1468639639 C Ii:1:005:2 0:8 4 = 0100fefc
ffff8803fe0e8f00 1468639669 S Ii:1:005:2 -115:8 4 <
ffff8803fe0e8f00 1468663648 C Ii:1:005:2 0:8 4 = 0100faf8
ffff8803fe0e8f00 1468663685 S Ii:1:005:2 -115:8 4 <
ffff8803fe0e8f00 1468671590 C Ii:1:005:2 0:8 4 = 0100fefd
ffff8803fe0e8f00 1468671618 S Ii:1:005:2 -115:8 4 <
ffff8803fe0e8f00 1468695640 C Ii:1:005:2 0:8 4 = 0100faf9
ffff8803fe0e8f00 1468695671 S Ii:1:005:2 -115:8 4 <
ffff8803fe0e8f00 1468703659 C Ii:1:005:2 0:8 4 = 010000ff
ffff8803fe0e8f00 1468703687 S Ii:1:005:2 -115:8 4 <
ffff8803fe0e8f00 1468735639 C Ii:1:005:2 0:8 4 = 0100fbfc
ffff8803fe0e8f00 1468735670 S Ii:1:005:2 -115:8 4 <
ffff8803fe0e8f00 1468751614 C Ii:1:005:2 0:8 4 = 0100fdff
ffff8803fe0e8f00 1468751650 S Ii:1:005:2 -115:8 4 <
ffff8803fe0e8f00 1468767642 C Ii:1:005:2 0:8 4 = 0100fbfd
ffff8803fe0e8f00 1468767672 S Ii:1:005:2 -115:8 4 <
ffff8803fe0e8f00 1468783640 C Ii:1:005:2 0:8 4 = 0100feff
ffff8803fe0e8f00 1468783670 S Ii:1:005:2 -115:8 4 <
ffff8803fe0e8f00 1468799640 C Ii:1:005:2 0:8 4 = 0100f9fd
ffff8803fe0e8f00 1468799670 S Ii:1:005:2 -115:8 4 <
ffff8803fe0e8f00 1468815640 C Ii:1:005:2 0:8 4 = 0100fdff
ffff8803fe0e8f00 1468815671 S Ii:1:005:2 -115:8 4 <
ffff8803fe0e8f00 1468831640 C Ii:1:005:2 0:8 4 = 0100f8fb
ffff8803fe0e8f00 1468831670 S Ii:1:005:2 -115:8 4 <
ffff8803fe0e8f00 1468847641 C Ii:1:005:2 0:8 4 = 0100fcfe
ffff8803fe0e8f00 1468847672 S Ii:1:005:2 -115:8 4 <
ffff8803fe0e8f00 1468863641 C Ii:1:005:2 0:8 4 = 0100f9fb
ffff8803fe0e8f00 1468863672 S Ii:1:005:2 -115:8 4 <
ffff8803fe0e8f00 1468879618 C Ii:1:005:2 0:8 4 = 0100fdfd
ffff8803fe0e8f00 1468879649 S Ii:1:005:2 -115:8 4 <
ffff8803fe0e8f00 1468887641 C Ii:1:005:2 0:8 4 = 0100fdfd
ffff8803fe0e8f00 1468887671 S Ii:1:005:2 -115:8 4 <
ffff8803fe0e8f00 1468911642 C Ii:1:005:2 0:8 4 = 0100fbfa
ffff8803fe0e8f00 1468911675 S Ii:1:005:2 -115:8 4 <
ffff8803fe0e8f00 1468927641 C Ii:1:005:2 0:8 4 = 0100fdfc
ffff8803fe0e8f00 1468927672 S Ii:1:005:2 -115:8 4 <
ffff8803fe0e8f00 1468943643 C Ii:1:005:2 0:8 4 = 0100fbf9
ffff8803fe0e8f00 1468943673 S Ii:1:005:2 -115:8 4 <
ffff8803fe0e8f00 1468959646 C Ii:1:005:2 0:8 4 = 0100fefc
ffff8803fe0e8f00 1468959677 S Ii:1:005:2 -115:8 4 <
ffff8803fe0e8f00 1468975642 C Ii:1:005:2 0:8 4 = 0100fdf9
ffff8803fe0e8f00 1468975673 S Ii:1:005:2 -115:8 4 <
ffff8803fe0e8f00 1468991619 C Ii:1:005:2 0:8 4 = 0100ffff
ffff8803fe0e8f00 1468991650 S Ii:1:005:2 -115:8 4 <
ffff8803fe0e8f00 1469023645 C Ii:1:005:2 0:8 4 = 010000ff
ffff8803fe0e8f00 1469023684 S Ii:1:005:2 -115:8 4 <
ffff8803fe0e8f00 1469071594 C Ii:1:005:2 0:8 4 = 010000ff
ffff8803fe0e8f00 1469071623 S Ii:1:005:2 -115:8 4 <
ffff8803fe0e8f00 1469127643 C Ii:1:005:2 0:8 4 = 010001ff
ffff8803fe0e8f00 1469127674 S Ii:1:005:2 -115:8 4 <
ffff8803fe0e8f00 1469143618 C Ii:1:005:2 0:8 4 = 010004fe
ffff8803fe0e8f00 1469143649 S Ii:1:005:2 -115:8 4 <
ffff8803fe0e8f00 1469159646 C Ii:1:005:2 0:8 4 = 010005ff
ffff8803fe0e8f00 1469159677 S Ii:1:005:2 -115:8 4 <
ffff8803fe0e8f00 1469183648 C Ii:1:005:2 0:8 4 = 01000900
ffff8803fe0e8f00 1469183685 S Ii:1:005:2 -115:8 4 <
ffff8803fe0e8f00 1469207648 C Ii:1:005:2 0:8 4 = 01000400
ffff8803fe0e8f00 1469207678 S Ii:1:005:2 -115:8 4 <
ffff8803fe0e8f00 1469231646 C Ii:1:005:2 0:8 4 = 01000800
ffff8803fe0e8f00 1469231675 S Ii:1:005:2 -115:8 4 <
ffff8803fe0e8f00 1469239645 C Ii:1:005:2 0:8 4 = 01000500
ffff8803fe0e8f00 1469239675 S Ii:1:005:2 -115:8 4 <
ffff8803fe0e8f00 1469255644 C Ii:1:005:2 0:8 4 = 010006ff
ffff8803fe0e8f00 1469255675 S Ii:1:005:2 -115:8 4 <
ffff8803fe0e8f00 1469271619 C Ii:1:005:2 0:8 4 = 01000700
ffff8803fe0e8f00 1469271650 S Ii:1:005:2 -115:8 4 <
ffff8803fe0e8f00 1469287645 C Ii:1:005:2 0:8 4 = 01000300
ffff8803fe0e8f00 1469287675 S Ii:1:005:2 -115:8 4 <
ffff8803fe0e8f00 1469391648 C Ii:1:005:2 0:8 4 = 0100ff01
ffff8803fe0e8f00 1469391679 S Ii:1:005:2 -115:8 4 <
ffff8803fe0e8f00 1469415650 C Ii:1:005:2 0:8 4 = 0100ff01
ffff8803fe0e8f00 1469415681 S Ii:1:005:2 -115:8 4 <
ffff8803fe0e8f00 1469431646 C Ii:1:005:2 0:8 4 = 01000001
ffff8803fe0e8f00 1469431675 S Ii:1:005:2 -115:8 4 <
ffff8803fe0e8f00 1469463627 C Ii:1:005:2 0:8 4 = 01000001
ffff8803fe0e8f00 1469463658 S Ii:1:005:2 -115:8 4 <
ffff8803fe0e8f00 1469479647 C Ii:1:005:2 0:8 4 = 0100ff00
ffff8803fe0e8f00 1469479677 S Ii:1:005:2 -115:8 4 <
ffff8803fe0e8f00 1469511647 C Ii:1:005:2 0:8 4 = 01000100
ffff8803fe0e8f00 1469511676 S Ii:1:005:2 -115:8 4 <
ffff8803fe0e8f00 1469583651 C Ii:1:005:2 0:8 4 = 0100fe00
ffff8803fe0e8f00 1469583681 S Ii:1:005:2 -115:8 4 <
ffff8803fe0e8f00 1469607650 C Ii:1:005:2 0:8 4 = 0100ff00
ffff8803fe0e8f00 1469607681 S Ii:1:005:2 -115:8 4 <
ffff8803fe0e8f00 1469615652 C Ii:1:005:2 0:8 4 = 0100fe00
ffff8803fe0e8f00 1469615683 S Ii:1:005:2 -115:8 4 <
ffff8803fe0e8f00 1469647651 C Ii:1:005:2 0:8 4 = 0100ff00
ffff8803fe0e8f00 1469647681 S Ii:1:005:2 -115:8 4 <
ffff8803fe0e8f00 1469695600 C Ii:1:005:2 0:8 4 = 010000ff
ffff8803fe0e8f00 1469695628 S Ii:1:005:2 -115:8 4 <
ffff8803fe0e8f00 1469823656 C Ii:1:005:2 0:8 4 = 0100fd01
ffff8803fe0e8f00 1469823688 S Ii:1:005:2 -115:8 4 <
ffff8803fe0e8f00 1469839624 C Ii:1:005:2 0:8 4 = 0100f801
ffff8803fe0e8f00 1469839656 S Ii:1:005:2 -115:8 4 <
ffff8803fe0e8f00 1469855654 C Ii:1:005:2 0:8 4 = 0100f903
ffff8803fe0e8f00 1469855685 S Ii:1:005:2 -115:8 4 <
ffff8803fe0e8f00 1469863651 C Ii:1:005:2 0:8 4 = 0100f803
ffff8803fe0e8f00 1469863681 S Ii:1:005:2 -115:8 4 <
ffff8803fe0e8f00 1469887632 C Ii:1:005:2 0:8 4 = 0100ec06
ffff8803fe0e8f00 1469887663 S Ii:1:005:2 -115:8 4 <
ffff8803fe0e8f00 1469895602 C Ii:1:005:2 0:8 4 = 0100f204
ffff8803fe0e8f00 1469895633 S Ii:1:005:2 -115:8 4 <
ffff8803fe0e8f00 1469919651 C Ii:1:005:2 0:8 4 = 0100df07
ffff8803fe0e8f00 1469919684 S Ii:1:005:2 -115:8 4 <
ffff8803fe0e8f00 1469927625 C Ii:1:005:2 0:8 4 = 0100ed03
ffff8803fe0e8f00 1469927656 S Ii:1:005:2 -115:8 4 <
ffff8803fe0e8f00 1469951625 C Ii:1:005:2 0:8 4 = 0100d708
ffff8803fe0e8f00 1469951657 S Ii:1:005:2 -115:8 4 <
ffff8803fe0e8f00 1469967635 C Ii:1:005:2 0:8 4 = 0100ec05
ffff8803fe0e8f00 1469967665 S Ii:1:005:2 -115:8 4 <
ffff8803fe0e8f00 1469983632 C Ii:1:005:2 0:8 4 = 0100d80a
ffff8803fe0e8f00 1469983675 S Ii:1:005:2 -115:8 4 <
ffff8803fe0e8f00 1470015630 C Ii:1:005:2 0:8 4 = 0100ec06
ffff8803fe0e8f00 1470015680 S Ii:1:005:2 -115:8 4 <
ffff8803fe0e8f00 1470023656 C Ii:1:005:2 0:8 4 = 0100ec07
ffff8803fe0e8f00 1470023687 S Ii:1:005:2 -115:8 4 <
ffff8803fe0e8f00 1470047654 C Ii:1:005:2 0:8 4 = 0100d50c
ffff8803fe0e8f00 1470047685 S Ii:1:005:2 -115:8 4 <
ffff8803fe0e8f00 1470055629 C Ii:1:005:2 0:8 4 = 0100eb06
ffff8803fe0e8f00 1470055666 S Ii:1:005:2 -115:8 4 <
ffff8803fe0e8f00 1470079634 C Ii:1:005:2 0:8 4 = 0100d40c
ffff8803fe0e8f00 1470079667 S Ii:1:005:2 -115:8 4 <
ffff8803fe0e8f00 1470087625 C Ii:1:005:2 0:8 4 = 0100eb06
ffff8803fe0e8f00 1470087657 S Ii:1:005:2 -115:8 4 <
ffff8803fe0e8f00 1470111603 C Ii:1:005:2 0:8 4 = 0100d50b
ffff8803fe0e8f00 1470111633 S Ii:1:005:2 -115:8 4 <
ffff8803fe0e8f00 1470119657 C Ii:1:005:2 0:8 4 = 0100ec05
ffff8803fe0e8f00 1470119688 S Ii:1:005:2 -115:8 4 <
ffff8803fe0e8f00 1470135655 C Ii:1:005:2 0:8 4 = 0100ec06
ffff8803fe0e8f00 1470135686 S Ii:1:005:2 -115:8 4 <
ffff8803fe0e8f00 1470151633 C Ii:1:005:2 0:8 4 = 0100dc09
ffff8803fe0e8f00 1470151664 S Ii:1:005:2 -115:8 4 <
ffff8803fe0e8f00 1470167656 C Ii:1:005:2 0:8 4 = 0100f303
ffff8803fe0e8f00 1470167694 S Ii:1:005:2 -115:8 4 <
ffff8803fe0e8f00 1470183610 C Ii:1:005:2 0:8 4 = 0100dc07
ffff8803fe0e8f00 1470183657 S Ii:1:005:2 -115:8 4 <
ffff8803fe0e8f00 1470199657 C Ii:1:005:2 0:8 4 = 0100ed04
ffff8803fe0e8f00 1470199689 S Ii:1:005:2 -115:8 4 <
ffff8803fe0e8f00 1470223659 C Ii:1:005:2 0:8 4 = 0100db07
ffff8803fe0e8f00 1470223699 S Ii:1:005:2 -115:8 4 <
ffff8803fe0e8f00 1470231606 C Ii:1:005:2 0:8 4 = 0100ef04
ffff8803fe0e8f00 1470231641 S Ii:1:005:2 -115:8 4 <
ffff8803fe0e8f00 1470247607 C Ii:1:005:2 0:8 4 = 0100ef03
ffff8803fe0e8f00 1470247644 S Ii:1:005:2 -115:8 4 <
ffff8803fe0e8f00 1470263658 C Ii:1:005:2 0:8 4 = 0100e207
ffff8803fe0e8f00 1470263689 S Ii:1:005:2 -115:8 4 <
ffff8803fe0e8f00 1470279619 C Ii:1:005:2 0:8 4 = 0100fb02
ffff8803fe0e8f00 1470279655 S Ii:1:005:2 -115:8 4 <
ffff8803fe0e8f00 1470295658 C Ii:1:005:2 0:8 4 = 0100f502
ffff8803fe0e8f00 1470295689 S Ii:1:005:2 -115:8 4 <
ffff8803fe0e8f00 1470311654 C Ii:1:005:2 0:8 4 = 0100fe00
ffff8803fe0e8f00 1470311684 S Ii:1:005:2 -115:8 4 <
ffff8803fe0e8f00 1470327656 C Ii:1:005:2 0:8 4 = 0100f100
ffff8803fe0e8f00 1470327685 S Ii:1:005:2 -115:8 4 <
ffff8803fe0e8f00 1470343629 C Ii:1:005:2 0:8 4 = 0100f501
ffff8803fe0e8f00 1470343662 S Ii:1:005:2 -115:8 4 <
ffff8803fe0e8f00 1470359626 C Ii:1:005:2 0:8 4 = 0100ed01
ffff8803fe0e8f00 1470359650 S Ii:1:005:2 -115:8 4 <
ffff8803fe0e8f00 1470375658 C Ii:1:005:2 0:8 4 = 0100f801
ffff8803fe0e8f00 1470375701 S Ii:1:005:2 -115:8 4 <
ffff8803fe0e8f00 1470383657 C Ii:1:005:2 0:8 4 = 0100f900
ffff8803fe0e8f00 1470383687 S Ii:1:005:2 -115:8 4 <
ffff8803fe0e8f00 1470407655 C Ii:1:005:2 0:8 4 = 0100f101
ffff8803fe0e8f00 1470407687 S Ii:1:005:2 -115:8 4 <
ffff8803fe0e8f00 1470415656 C Ii:1:005:2 0:8 4 = 0100fc00
ffff8803fe0e8f00 1470415686 S Ii:1:005:2 -115:8 4 <
ffff8803fe0e8f00 1470439656 C Ii:1:005:2 0:8 4 = 0100f9ff
ffff8803fe0e8f00 1470439686 S Ii:1:005:2 -115:8 4 <
ffff8803fe0e8f00 1470463638 C Ii:1:005:2 0:8 4 = 010000ff
ffff8803fe0e8f00 1470463667 S Ii:1:005:2 -115:8 4 <
ffff8803fe0e8f00 1470487630 C Ii:1:005:2 0:8 4 = 0100ff00
ffff8803fe0e8f00 1470487660 S Ii:1:005:2 -115:8 4 <
ffff8803fe0e8f00 1470535666 C Ii:1:005:2 0:8 4 = 0100ffff
ffff8803fe0e8f00 1470535709 S Ii:1:005:2 -115:8 4 <
ffff8803fe0e8f00 1470567661 C Ii:1:005:2 0:8 4 = 0101ff00
ffff8803fe0e8f00 1470567695 S Ii:1:005:2 -115:8 4 <
ffff8803fdc4a780 1470628574 C Ii:3:003:1 0:8 6 = 08782a12 2c01
ffff8803fdc4a780 1470628605 S Ii:3:003:1 -115:8 6 <
ffff8803fdc4a6c0 1470661997 S Ci:3:003:0 s a1 01 030a 0000 0002 64 <
ffff8803fdc4a6c0 1470662068 C Ci:3:003:0 0 2 = 0af0
ffff8803fdc4a6c0 1470662096 S Ci:3:003:0 s a1 01 030f 0000 0002 64 <
ffff8803fdc4a6c0 1470662182 C Ci:3:003:0 0 2 = 0f77
ffff8803fdc4a6c0 1470662217 S Ci:3:003:0 s a1 01 0312 0000 0002 64 <
ffff8803fdc4a6c0 1470662293 C Ci:3:003:0 0 2 = 1277
ffff8803fdc4a6c0 1470662315 S Ci:3:003:0 s a1 01 0313 0000 0002 64 <
ffff8803fdc4a6c0 1470662388 C Ci:3:003:0 0 2 = 1309
ffff8803fdc4a6c0 1470662409 S Ci:3:003:0 s a1 01 0317 0000 0002 64 <
ffff8803fdc4a6c0 1470662507 C Ci:3:003:0 0 2 = 1700
ffff8803fdc4a6c0 1470662533 S Ci:3:003:0 s a1 01 030b 0000 0002 64 <
ffff8803fdc4a6c0 1470662630 C Ci:3:003:0 0 2 = 0b11
ffff8803fdc4a780 1470692577 C Ii:3:003:1 0:8 2 = 0b11
ffff8803fdc4a780 1470692609 S Ii:3:003:1 -115:8 6 <
ffff8803fe0e8f00 1470703659 C Ii:1:005:2 0:8 4 = 01000000
ffff8803fe0e8f00 1470703693 S Ii:1:005:2 -115:8 4 <
ffff8803fdf61a80 1471686672 C Ii:1:005:1 0:8 8 = 00003900 00000000
ffff8803fdf61a80 1471686719 S Ii:1:005:1 -115:8 8 <
ffff8803fdf61a80 1471998671 C Ii:1:005:1 0:8 8 = 00003906 00000000
ffff8803fdf61a80 1471998710 S Ii:1:005:1 -115:8 8 <
