ffff8802ffcc5f00 2313193272 S Co:1:061:0 s 21 09 0300 0000 0008 8 = 55010100 00ff075d
ffff8802ffcc5f00 2313193512 C Co:1:061:0 0 8 >
ffff8803fdd14600 2313237713 S Ci:1:061:0 s a1 01 0300 0000 0008 8 <
ffff8803fdd14600 2313237883 C Ci:1:061:0 0 8 = aa020000 00000000
ffff8803fdd14600 2313256681 S Co:1:061:0 s 21 09 0300 0000 0008 8 = 0b010101 00000e04
ffff8803fdd14600 2313256884 C Co:1:061:0 0 8 >
ffff8801beb05240 2313271580 S Co:1:061:0 s 21 09 0300 0000 0008 8 = 13cc03fb ac127cf3
ffff8801beb05240 2313271738 C Co:1:061:0 0 8 >
ffff8801beb05240 2313287307 S Co:1:061:0 s 21 09 0300 0000 0008 8 = 04809000 21019001
ffff8801beb05240 2313287513 C Co:1:061:0 0 8 >
ffff8801beb05240 2313302602 S Co:1:061:0 s 21 09 0300 0000 0008 8 = 21809001 237f9002
ffff8801beb05240 2313302760 C Co:1:061:0 0 8 >
ffff8801beb05240 2313319388 S Co:1:061:0 s 21 09 0300 0000 0008 8 = 23fbaffb 8ffbbffb
ffff8801beb05240 2313319498 C Co:1:061:0 0 8 >
ffff8801beb05240 2313334303 S Co:1:061:0 s 21 09 0300 0000 0008 8 = 0ffbfffb 9ffb5ffb
ffff8801beb05240 2313334520 C Co:1:061:0 0 8 >
ffff8801beb05240 2313349333 S Co:1:061:0 s 21 09 0300 0000 0008 8 = bffb5ffb affb5ffb
ffff8801beb05240 2313349488 C Co:1:061:0 0 8 >
ffff8801beb05240 2313366372 S Co:1:061:0 s 21 09 0300 0000 0008 8 = 2ffbdffb fffbaffb
ffff8801beb05240 2313366511 C Co:1:061:0 0 8 >
ffff8801beb05240 2313381277 S Co:1:061:0 s 21 09 0300 0000 0008 8 = cffb5ffb 2ffbcffb
ffff8801beb05240 2313381519 C Co:1:061:0 0 8 >
ffff8801beb05240 2313396306 S Co:1:061:0 s 21 09 0300 0000 0008 8 = 4ffb8ffb 4ffbfffb
ffff8801beb05240 2313396519 C Co:1:061:0 0 8 >
ffff8801beb05240 2313413360 S Co:1:061:0 s 21 09 0300 0000 0008 8 = 9ffbcffb 6ffb3ffb
ffff8801beb05240 2313413511 C Co:1:061:0 0 8 >
ffff8801beb05240 2313428268 S Co:1:061:0 s 21 09 0300 0000 0008 8 = bffbeffb cffbfffb
ffff8801beb05240 2313428530 C Co:1:061:0 0 8 >
ffff8801beb05240 2313443369 S Co:1:061:0 s 21 09 0300 0000 0008 8 = cffb4ffb fffb9ffb
ffff8801beb05240 2313443511 C Co:1:061:0 0 8 >
ffff8801beb05240 2313460347 S Co:1:061:0 s 21 09 0300 0000 0008 8 = bffb2ffb 8ffbcffb
ffff8801beb05240 2313460514 C Co:1:061:0 0 8 >
ffff8801beb05240 2313475387 S Co:1:061:0 s 21 09 0300 0000 0008 8 = 9ffb5ffb cffb3ffb
ffff8801beb05240 2313475512 C Co:1:061:0 0 8 >
ffff8801beb05240 2313490284 S Co:1:061:0 s 21 09 0300 0000 0008 8 = dffb0ffb effbcffb
ffff8801beb05240 2313490510 C Co:1:061:0 0 8 >
ffff8801beb05240 2313505987 S Co:1:061:0 s 21 09 0300 0000 0008 8 = 5ffbfffb effb5ffb
ffff8801beb05240 2313506138 C Co:1:061:0 0 8 >
ffff88015e27f3c0 2313522372 S Co:1:061:0 s 21 09 0300 0000 0008 8 = affbaffb dffbdffb
ffff88015e27f3c0 2313522511 C Co:1:061:0 0 8 >
ffff88015e27f3c0 2313537274 S Co:1:061:0 s 21 09 0300 0000 0008 8 = 0ffb1ffb effb6ffb
ffff88015e27f3c0 2313537540 C Co:1:061:0 0 8 >
ffff88015e27f3c0 2313552376 S Co:1:061:0 s 21 09 0300 0000 0008 8 = 0ffbbffb effbeffb
ffff88015e27f3c0 2313552518 C Co:1:061:0 0 8 >
ffff88015e27f3c0 2313569359 S Co:1:061:0 s 21 09 0300 0000 0008 8 = effb2ffb 4ffbbffb
ffff88015e27f3c0 2313569513 C Co:1:061:0 0 8 >
ffff88015e27f3c0 2313584265 S Co:1:061:0 s 21 09 0300 0000 0008 8 = cffb1ffb 0ffb8ffb
ffff88015e27f3c0 2313584541 C Co:1:061:0 0 8 >
ffff88015e27f3c0 2313599284 S Co:1:061:0 s 21 09 0300 0000 0008 8 = affb8ffb 1ffbeffb
ffff88015e27f3c0 2313599513 C Co:1:061:0 0 8 >
ffff88015e27f3c0 2313616355 S Co:1:061:0 s 21 09 0300 0000 0008 8 = 0ffb9ffb bffb4ffb
ffff88015e27f3c0 2313616491 C Co:1:061:0 0 8 >
ffff88015e27f3c0 2313631390 S Co:1:061:0 s 21 09 0300 0000 0008 8 = 4ffbfffb 6ffb6ffb
ffff88015e27f3c0 2313631491 C Co:1:061:0 0 8 >
ffff8803ff398840 2313646299 S Co:1:061:0 s 21 09 0300 0000 0008 8 = effbeffb 0ffb7ffb
ffff8803ff398840 2313646539 C Co:1:061:0 0 8 >
ffff8803ff398840 2313663339 S Co:1:061:0 s 21 09 0300 0000 0008 8 = 5ffb3ffb effb1ffb
ffff8803ff398840 2313663520 C Co:1:061:0 0 8 >
ffff8803ff398840 2313678378 S Co:1:061:0 s 21 09 0300 0000 0008 8 = cffbbffb 7ffb4ffb
ffff8803ff398840 2313678504 C Co:1:061:0 0 8 >
ffff8803ff398840 2313695287 S Co:1:061:0 s 21 09 0300 0000 0008 8 = 8ffb9ffb 1ffb9ffb
ffff8803ff398840 2313695519 C Co:1:061:0 0 8 >
ffff8803ff398840 2313710323 S Co:1:061:0 s 21 09 0300 0000 0008 8 = 1ffbaffb 2ffb9ffb
ffff8803ff398840 2313710520 C Co:1:061:0 0 8 >
ffff8803ff398840 2313725370 S Co:1:061:0 s 21 09 0300 0000 0008 8 = 3ffb2ffb 3ffbcffb
ffff8803ff398840 2313725514 C Co:1:061:0 0 8 >
ffff8803ff398840 2313740273 S Co:1:061:0 s 21 09 0300 0000 0008 8 = 8ffb4ffb 9ffb4ffb
ffff8803ff398840 2313740539 C Co:1:061:0 0 8 >
ffff8802ffcc5f00 2313757316 S Co:1:061:0 s 21 09 0300 0000 0008 8 = fffb8ffb 4ffb7ffb
ffff8802ffcc5f00 2313757532 C Co:1:061:0 0 8 >
ffff8802ffcc5f00 2313772352 S Co:1:061:0 s 21 09 0300 0000 0008 8 = cffb2ffb effbfffb
ffff8802ffcc5f00 2313772514 C Co:1:061:0 0 8 >
ffff8802ffcc5f00 2313787245 S Co:1:061:0 s 21 09 0300 0000 0008 8 = cffb6ffb 0ffbcffb
ffff8802ffcc5f00 2313787390 C Co:1:061:0 0 8 >
ffff8802ffcc5f00 2313804318 S Co:1:061:0 s 21 09 0300 0000 0008 8 = cffbbffb affb1ffb
ffff8802ffcc5f00 2313804532 C Co:1:061:0 0 8 >
ffff8802ffcc5f00 2313819344 S Co:1:061:0 s 21 09 0300 0000 0008 8 = 1f00a1ff 17ffa7ff
ffff8802ffcc5f00 2313819510 C Co:1:061:0 0 8 >
ffff8802ffcc5f00 2313834374 S Co:1:061:0 s 21 09 0300 0000 0008 8 = 87ff77ff 07fff7ff
ffff8802ffcc5f00 2313834514 C Co:1:061:0 0 8 >
ffff8802ffcc5f00 2313851287 S Co:1:061:0 s 21 09 0300 0000 0008 8 = a7ff67ff b7ff57ff
ffff8802ffcc5f00 2313851524 C Co:1:061:0 0 8 >
ffff8802ffcc5f00 2313866336 S Co:1:061:0 s 21 09 0300 0000 0008 8 = 47ffb7ff 87ffb7ff
ffff8802ffcc5f00 2313866519 C Co:1:061:0 0 8 >
ffff8802ffcc5f00 2313881354 S Co:1:061:0 s 21 09 0300 0000 0008 8 = a7fff7ff 07ffe7ff
ffff8802ffcc5f00 2313881516 C Co:1:061:0 0 8 >
ffff8802ffcc5f00 2313896266 S Co:1:061:0 s 21 09 0300 0000 0008 8 = 37fff7ff 87ff37ff
ffff8802ffcc5f00 2313896536 C Co:1:061:0 0 8 >
ffff8802ffcc5f00 2313913323 S Co:1:061:0 s 21 09 0300 0000 0008 8 = c7ffc7ff c7ffd7ff
ffff8802ffcc5f00 2313913535 C Co:1:061:0 0 8 >
ffff8802ffcc5f00 2313928356 S Co:1:061:0 s 21 09 0300 0000 0008 8 = e7ff57ff 77ff57ff
ffff8802ffcc5f00 2313928508 C Co:1:061:0 0 8 >
ffff8802ffcc5f00 2313943392 S Co:1:061:0 s 21 09 0300 0000 0008 8 = d7ffb7ff c7ff57ff
ffff8802ffcc5f00 2313943517 C Co:1:061:0 0 8 >
ffff8802ffcc5f00 2313958321 S Co:1:061:0 s 21 09 0300 0000 0008 8 = e7ff47ff a7ff97ff
ffff8802ffcc5f00 2313958523 C Co:1:061:0 0 8 >
ffff8802ffcc5f00 2313975338 S Co:1:061:0 s 21 09 0300 0000 0008 8 = 57ff87ff 27ff07ff
ffff8802ffcc5f00 2313975519 C Co:1:061:0 0 8 >
ffff8802ffcc5f00 2313990381 S Co:1:061:0 s 21 09 0300 0000 0008 8 = 07ffc7ff c7ff77ff
ffff8802ffcc5f00 2313990517 C Co:1:061:0 0 8 >
ffff8802ffcc5f00 2314005269 S Co:1:061:0 s 21 09 0300 0000 0008 8 = d7ff67ff 47ff47ff
ffff8802ffcc5f00 2314005517 C Co:1:061:0 0 8 >
ffff8802ffcc5f00 2314022327 S Co:1:061:0 s 21 09 0300 0000 0008 8 = f7ff27ff 07ff27ff
ffff8802ffcc5f00 2314022518 C Co:1:061:0 0 8 >
ffff8802ffcc5f00 2314037367 S Co:1:061:0 s 21 09 0300 0000 0008 8 = a7ffa7ff e7ffd7ff
ffff8802ffcc5f00 2314037517 C Co:1:061:0 0 8 >
ffff8802ffcc5f00 2314052422 S Co:1:061:0 s 21 09 0300 0000 0008 8 = 07ff67ff 07ffe7ff
ffff8802ffcc5f00 2314052649 C Co:1:061:0 0 8 >
ffff8802ffcc5f00 2314069317 S Co:1:061:0 s 21 09 0300 0000 0008 8 = 37ffe7ff c7ff37ff
ffff8802ffcc5f00 2314069532 C Co:1:061:0 0 8 >
ffff8802ffcc5f00 2314084358 S Co:1:061:0 s 21 09 0300 0000 0008 8 = 17ffc7ff 47ff67ff
ffff8802ffcc5f00 2314084517 C Co:1:061:0 0 8 >
ffff8802ffcc5f00 2314099284 S Co:1:061:0 s 21 09 0300 0000 0008 8 = 87ffb7ff 37ff67ff
ffff8802ffcc5f00 2314099545 C Co:1:061:0 0 8 >
ffff8802ffcc5f00 2314116319 S Co:1:061:0 s 21 09 0300 0000 0008 8 = a7ff17ff 47ff97ff
ffff8802ffcc5f00 2314116533 C Co:1:061:0 0 8 >
ffff8802ffcc5f00 2314131344 S Co:1:061:0 s 21 09 0300 0000 0008 8 = c7ff27ff a7ff07ff
ffff8802ffcc5f00 2314131516 C Co:1:061:0 0 8 >
ffff8802ffcc5f00 2314146373 S Co:1:061:0 s 21 09 0300 0000 0008 8 = f7ff67ff 77ffe7ff
ffff8802ffcc5f00 2314146518 C Co:1:061:0 0 8 >
ffff8802ffcc5f00 2314163291 S Co:1:061:0 s 21 09 0300 0000 0008 8 = c7ff37ff d7ff37ff
ffff8802ffcc5f00 2314163519 C Co:1:061:0 0 8 >
ffff8802ffcc5f00 2314178329 S Co:1:061:0 s 21 09 0300 0000 0008 8 = e7ffa7ff 87ffd7ff
ffff8802ffcc5f00 2314178496 C Co:1:061:0 0 8 >
ffff8802ffcc5f00 2314193361 S Co:1:061:0 s 21 09 0300 0000 0008 8 = 87ff77ff a7ffb7ff
ffff8802ffcc5f00 2314193496 C Co:1:061:0 0 8 >
ffff8802ffcc5f00 2314210277 S Co:1:061:0 s 21 09 0300 0000 0008 8 = d7ffb7ff d7ff77ff
ffff8802ffcc5f00 2314210545 C Co:1:061:0 0 8 >
ffff8802ffcc5f00 2314225318 S Co:1:061:0 s 21 09 0300 0000 0008 8 = 97ff37ff 77ffd7ff
ffff8802ffcc5f00 2314225530 C Co:1:061:0 0 8 >
ffff8802ffcc5f00 2314240351 S Co:1:061:0 s 21 09 0300 0000 0008 8 = f7ff57ff 27ff07ff
ffff8802ffcc5f00 2314240518 C Co:1:061:0 0 8 >
ffff8802ffcc5f00 2314257264 S Co:1:061:0 s 21 09 0300 0000 0008 8 = c7ff57ff b7ffa7ff
ffff8802ffcc5f00 2314257546 C Co:1:061:0 0 8 >
ffff8803fe1639c0 2314273659 S Co:1:061:0 s 21 09 0300 0000 0008 8 = 07ff77ff f7ff47ff
ffff8803fe1639c0 2314273748 C Co:1:061:0 0 8 >
ffff8803fe1639c0 2314288337 S Co:1:061:0 s 21 09 0300 0000 0008 8 = 77ffb7ff 47ff57ff
ffff8803fe1639c0 2314288529 C Co:1:061:0 0 8 >
ffff8803fe1639c0 2314303379 S Co:1:061:0 s 21 09 0300 0000 0008 8 = 67ffa7ff e7ff07ff
ffff8803fe1639c0 2314303519 C Co:1:061:0 0 8 >
ffff8803fe1639c0 2314318287 S Co:1:061:0 s 21 09 0300 0000 0008 8 = 17ff97ff 07ff4fff
ffff8803fe1639c0 2314318529 C Co:1:061:0 0 8 >
ffff8803fe1639c0 2314333317 S Co:1:061:0 s 21 09 0300 0000 0008 8 = 27ffcfff 87ffbfff
ffff8803fe1639c0 2314333527 C Co:1:061:0 0 8 >
ffff8803fe1639c0 2314350376 S Co:1:061:0 s 21 09 0300 0000 0008 8 = f7ff3fff 77ffefff
ffff8803fe1639c0 2314350520 C Co:1:061:0 0 8 >
ffff8803fe1639c0 2314365275 S Co:1:061:0 s 21 09 0300 0000 0008 8 = d7ff5fff 97ffcfff
ffff8803fe1639c0 2314365544 C Co:1:061:0 0 8 >
ffff8803fe1639c0 2314380304 S Co:1:061:0 s 21 09 0300 0000 0008 8 = 47ff3fff 17ff8fff
ffff8803fe1639c0 2314380517 C Co:1:061:0 0 8 >
ffff8803fe1639c0 2314397356 S Co:1:061:0 s 21 09 0300 0000 0008 8 = 07ff0fff 97ff5fff
ffff8803fe1639c0 2314397520 C Co:1:061:0 0 8 >
ffff8803fe1639c0 2314412263 S Co:1:061:0 s 21 09 0300 0000 0008 8 = 07ff4fff b7ffdfff
ffff8803fe1639c0 2314412544 C Co:1:061:0 0 8 >
ffff8803fe1639c0 2314427335 S Co:1:061:0 s 21 09 0300 0000 0008 8 = 67ff4fff 57ff8fff
ffff8803fe1639c0 2314427522 C Co:1:061:0 0 8 >
ffff8803fe1639c0 2314444346 S Co:1:061:0 s 21 09 0300 0000 0008 8 = 57ff8fff 87ff6fff
ffff8803fe1639c0 2314444523 C Co:1:061:0 0 8 >
ffff8803fe1639c0 2314459392 S Co:1:061:0 s 21 09 0300 0000 0008 8 = b7ffbfff 67ff0fff
ffff8803fe1639c0 2314459524 C Co:1:061:0 0 8 >
ffff8803fe1639c0 2314474279 S Co:1:061:0 s 21 09 0300 0000 0008 8 = d7ffffff d7ffffff
ffff8803fe1639c0 2314474533 C Co:1:061:0 0 8 >
ffff8803fe1639c0 2314491338 S Co:1:061:0 s 21 09 0300 0000 0008 8 = 27ffbfff 97ffbfff
ffff8803fe1639c0 2314491522 C Co:1:061:0 0 8 >
ffff8803fe1639c0 2314506377 S Co:1:061:0 s 21 09 0300 0000 0008 8 = 87ff0fff 47ff3fff
ffff8803fe1639c0 2314506522 C Co:1:061:0 0 8 >
ffff8803fe1639c0 2314521269 S Co:1:061:0 s 21 09 0300 0000 0008 8 = b7ffcfff 77ffffff
ffff8803fe1639c0 2314521546 C Co:1:061:0 0 8 >
ffff8803fe1639c0 2314538324 S Co:1:061:0 s 21 09 0300 0000 0008 8 = d7ff4fff e7ff2fff
ffff8803fe1639c0 2314538521 C Co:1:061:0 0 8 >
ffff8803fe1639c0 2314553366 S Co:1:061:0 s 21 09 0300 0000 0008 8 = b7ff2fff f7ff3fff
ffff8803fe1639c0 2314553522 C Co:1:061:0 0 8 >
ffff8803fe1639c0 2314568264 S Co:1:061:0 s 21 09 0300 0000 0008 8 = 77ff8fff a7ff8fff
ffff8803fe1639c0 2314568550 C Co:1:061:0 0 8 >
ffff8803fe1639c0 2314585317 S Co:1:061:0 s 21 09 0300 0000 0008 8 = 87ff3fff 97ff8fff
ffff8803fe1639c0 2314585529 C Co:1:061:0 0 8 >
ffff8803fe1639c0 2314600352 S Co:1:061:0 s 21 09 0300 0000 0008 8 = b7ffafff 27ff8fff
ffff8803fe1639c0 2314600531 C Co:1:061:0 0 8 >
ffff8803fe1639c0 2314615240 S Co:1:061:0 s 21 09 0300 0000 0008 8 = b7ff3fff 47ffffff
ffff8803fe1639c0 2314615397 C Co:1:061:0 0 8 >
ffff8803fe1639c0 2314632299 S Co:1:061:0 s 21 09 0300 0000 0008 8 = f7ffffff 07ff2fff
ffff8803fe1639c0 2314632500 C Co:1:061:0 0 8 >
ffff8803fe1639c0 2314647340 S Co:1:061:0 s 21 09 0300 0000 0008 8 = f7ff7fff b7ff3fff
ffff8803fe1639c0 2314647534 C Co:1:061:0 0 8 >
ffff8803fe1639c0 2314662383 S Co:1:061:0 s 21 09 0300 0000 0008 8 = 47ffcfff 47ffafff
ffff8803fe1639c0 2314662523 C Co:1:061:0 0 8 >
ffff8803fe1639c0 2314679288 S Co:1:061:0 s 21 09 0300 0000 0008 8 = 37ff0fff c7ff2fff
ffff8803fe1639c0 2314679532 C Co:1:061:0 0 8 >
ffff8803fe1639c0 2314693559 S Co:1:061:0 s 21 09 0300 0000 0008 8 = f7ffbfff 17ff2fff
ffff8803fe1639c0 2314693781 C Co:1:061:0 0 8 >
ffff8803fe1639c0 2314710368 S Co:1:061:0 s 21 09 0300 0000 0008 8 = 47ff1fff 27ff0fff
ffff8803fe1639c0 2314710525 C Co:1:061:0 0 8 >
ffff8803fe1639c0 2314725272 S Co:1:061:0 s 21 09 0300 0000 0008 8 = d7ff8fff 07ff1fff
ffff8803fe1639c0 2314725553 C Co:1:061:0 0 8 >
ffff8803fe1639c0 2314740309 S Co:1:061:0 s 21 09 0300 0000 0008 8 = 67ffafff c7ff5fff
ffff8803fe1639c0 2314740531 C Co:1:061:0 0 8 >
ffff8803fe1639c0 2314757360 S Co:1:061:0 s 21 09 0300 0000 0008 8 = d7ff4fff d7ffcfff
ffff8803fe1639c0 2314757523 C Co:1:061:0 0 8 >
ffff8803fe1639c0 2314772260 S Co:1:061:0 s 21 09 0300 0000 0008 8 = b7ffdfff 57ff0fff
ffff8803fe1639c0 2314772550 C Co:1:061:0 0 8 >
ffff8803fe1639c0 2314787320 S Co:1:061:0 s 21 09 0300 0000 0008 8 = a7ff0fff 87ffdfff
ffff8803fe1639c0 2314787531 C Co:1:061:0 0 8 >
ffff8803fe1639c0 2314804345 S Co:1:061:0 s 21 09 0300 0000 0008 8 = b7ff9fff e7ff3fff
ffff8803fe1639c0 2314804527 C Co:1:061:0 0 8 >
ffff8803fe1639c0 2314819386 S Co:1:061:0 s 21 09 0300 0000 0008 8 = 176664b1 e2ec299c
ffff8803fe1639c0 2314819524 C Co:1:061:0 0 8 >
ffff8803fe1639c0 2314834289 S Co:1:061:0 s 21 09 0300 0000 0008 8 = 8cc71116 f99a1ce1
ffff8803fe1639c0 2314834552 C Co:1:061:0 0 8 >
ffff8803fe1639c0 2314851337 S Co:1:061:0 s 21 09 0300 0000 0008 8 = 8f2245a1 af9c8a5f
ffff8803fe1639c0 2314851525 C Co:1:061:0 0 8 >
ffff8803fe1639c0 2314866374 S Co:1:061:0 s 21 09 0300 0000 0008 8 = 5858383e 199e7c7c
ffff8803fe1639c0 2314866525 C Co:1:061:0 0 8 >
ffff8803fe1639c0 2314881278 S Co:1:061:0 s 21 09 0300 0000 0008 8 = 3dc127ac 3382c132
ffff8803fe1639c0 2314881532 C Co:1:061:0 0 8 >
ffff8803fe1639c0 2314896309 S Co:1:061:0 s 21 09 0300 0000 0008 8 = 3ba7d2ff 57dc6c8e
ffff8803fe1639c0 2314896535 C Co:1:061:0 0 8 >
ffff8803fe1639c0 2314913350 S Co:1:061:0 s 21 09 0300 0000 0008 8 = 71cafd1f c9765333
ffff8803fe1639c0 2314913532 C Co:1:061:0 0 8 >
ffff8803fe1639c0 2314928266 S Co:1:061:0 s 21 09 0300 0000 0008 8 = a2dcf048 2dcb90d7
ffff8803fe1639c0 2314928554 C Co:1:061:0 0 8 >
ffff8803fe1639c0 2314943341 S Co:1:061:0 s 21 09 0300 0000 0008 8 = b603f98b 0d8e03c2
ffff8803fe1639c0 2314943530 C Co:1:061:0 0 8 >
ffff8803fe1639c0 2314960351 S Co:1:061:0 s 21 09 0300 0000 0008 8 = 375ce749 5622cc54
ffff8803fe1639c0 2314960534 C Co:1:061:0 0 8 >
ffff8803fe1639c0 2314975387 S Co:1:061:0 s 21 09 0300 0000 0008 8 = d6748fbd da21d27e
ffff8803fe1639c0 2314975526 C Co:1:061:0 0 8 >
ffff8803fe1639c0 2314990301 S Co:1:061:0 s 21 09 0300 0000 0008 8 = e5cf4971 cdd84146
ffff8803fe1639c0 2314990536 C Co:1:061:0 0 8 >
ffff8803fe1639c0 2315007336 S Co:1:061:0 s 21 09 0300 0000 0008 8 = dd6471c5 4ac70546
ffff8803fe1639c0 2315007544 C Co:1:061:0 0 8 >
ffff8803fe1639c0 2315022382 S Co:1:061:0 s 21 09 0300 0000 0008 8 = d81ce96e cd23532b
ffff8803fe1639c0 2315022526 C Co:1:061:0 0 8 >
ffff8803fe1639c0 2315037267 S Co:1:061:0 s 21 09 0300 0000 0008 8 = 165993f3 b8561f38
ffff8803fe1639c0 2315037504 C Co:1:061:0 0 8 >
ffff8803fe1639c0 2315052304 S Co:1:061:0 s 21 09 0300 0000 0008 8 = 7a6bda2f d17ca5c3
ffff8803fe1639c0 2315052533 C Co:1:061:0 0 8 >
ffff8803fe1639c0 2315069357 S Co:1:061:0 s 21 09 0300 0000 0008 8 = 0c1a28d4 c0e5e2b4
ffff8803fe1639c0 2315069524 C Co:1:061:0 0 8 >
ffff8803fe1639c0 2315084261 S Co:1:061:0 s 21 09 0300 0000 0008 8 = 76216fe4 9498190b
ffff8803fe1639c0 2315084401 C Co:1:061:0 0 8 >
ffff8803fe1639c0 2315099290 S Co:1:061:0 s 21 09 0300 0000 0008 8 = 89afa338 3dcc5159
ffff8803fe1639c0 2315099534 C Co:1:061:0 0 8 >
ffff8803fe1639c0 2315116347 S Co:1:061:0 s 21 09 0300 0000 0008 8 = b8e73cfb 116fd444
ffff8803fe1639c0 2315116529 C Co:1:061:0 0 8 >
ffff8803fe1639c0 2315131385 S Co:1:061:0 s 21 09 0300 0000 0008 8 = 995fb62e 49a1b006
ffff8803fe1639c0 2315131526 C Co:1:061:0 0 8 >
ffff8803fe1639c0 2315146282 S Co:1:061:0 s 21 09 0300 0000 0008 8 = 69a31224 833738ec
ffff8803fe1639c0 2315146552 C Co:1:061:0 0 8 >
ffff8803fe1639c0 2315163338 S Co:1:061:0 s 21 09 0300 0000 0008 8 = 87b15505 3f3b81d9
ffff8803fe1639c0 2315163544 C Co:1:061:0 0 8 >
ffff8803fe1639c0 2315178371 S Co:1:061:0 s 21 09 0300 0000 0008 8 = f67c064d 6569e7c2
ffff8803fe1639c0 2315178528 C Co:1:061:0 0 8 >
ffff8803fe1639c0 2315193268 S Co:1:061:0 s 21 09 0300 0000 0008 8 = de6bb24c bbb28832
ffff8803fe1639c0 2315193557 C Co:1:061:0 0 8 >
ffff8803fe1639c0 2315208349 S Co:1:061:0 s 21 09 0300 0000 0008 8 = 09d86aa6 72bbc5c6
ffff8803fe1639c0 2315208528 C Co:1:061:0 0 8 >
ffff8803fe1639c0 2315225359 S Co:1:061:0 s 21 09 0300 0000 0008 8 = 689441d2 985cc7af
ffff8803fe1639c0 2315225527 C Co:1:061:0 0 8 >
ffff8803fe1639c0 2315240266 S Co:1:061:0 s 21 09 0300 0000 0008 8 = 8e60d19d a523f635
ffff8803fe1639c0 2315240555 C Co:1:061:0 0 8 >
ffff8803fe1639c0 2315255398 S Co:1:061:0 s 21 09 0300 0000 0008 8 = 3274b5a6 f0d08131
ffff8803fe1639c0 2315255528 C Co:1:061:0 0 8 >
ffff8803fe1639c0 2315272365 S Co:1:061:0 s 21 09 0300 0000 0008 8 = affa0ee2 39d9db90
ffff8803fe1639c0 2315272507 C Co:1:061:0 0 8 >
ffff8803fe1639c0 2315288325 S Co:1:061:0 s 21 09 0300 0000 0008 8 = 85920017 1fe63ad5
ffff8803fe1639c0 2315288528 C Co:1:061:0 0 8 >
ffff8803fe1639c0 2315303215 S Co:1:061:0 s 21 09 0300 0000 0008 8 = d7cd3463 a9541895
ffff8803fe1639c0 2315303405 C Co:1:061:0 0 8 >
ffff8803fe1639c0 2315318248 S Co:1:061:0 s 21 09 0300 0000 0008 8 = ecb456b4 bfb4b4fa
ffff8803fe1639c0 2315318404 C Co:1:061:0 0 8 >
ffff8803fe1639c0 2315335306 S Co:1:061:0 s 21 09 0300 0000 0008 8 = b141964f b04b9043
ffff8803fe1639c0 2315335537 C Co:1:061:0 0 8 >
ffff8803fe1639c0 2315350198 S Co:1:061:0 s 21 09 0300 0000 0008 8 = 34e22a4c ac91f241
ffff8803fe1639c0 2315350411 C Co:1:061:0 0 8 >
ffff8803fe1639c0 2315365242 S Co:1:061:0 s 21 09 0300 0000 0008 8 = 28fbc816 49b465d9
ffff8803fe1639c0 2315365403 C Co:1:061:0 0 8 >
ffff8803fe1639c0 2315382295 S Co:1:061:0 s 21 09 0300 0000 0008 8 = 66622eee 00153887
ffff8803fe1639c0 2315382536 C Co:1:061:0 0 8 >
ffff8803fe1639c0 2315397187 S Co:1:061:0 s 21 09 0300 0000 0008 8 = 68e39c66 afc8fcd7
ffff8803fe1639c0 2315397412 C Co:1:061:0 0 8 >
ffff8803fe1639c0 2315412232 S Co:1:061:0 s 21 09 0300 0000 0008 8 = cebc56e8 171608ec
ffff8803fe1639c0 2315412402 C Co:1:061:0 0 8 >
ffff8803fe1639c0 2315429310 S Co:1:061:0 s 21 09 0300 0000 0008 8 = db20242f 5dfcf7fb
ffff8803fe1639c0 2315429537 C Co:1:061:0 0 8 >
ffff8803fe1639c0 2315444177 S Co:1:061:0 s 21 09 0300 0000 0008 8 = f7b7d4cb 8bab26ce
ffff8803fe1639c0 2315444260 C Co:1:061:0 0 8 >
ffff8803fe1639c0 2315459217 S Co:1:061:0 s 21 09 0300 0000 0008 8 = 2d1ab5a0 0e083844
ffff8803fe1639c0 2315459406 C Co:1:061:0 0 8 >
ffff8803fe1639c0 2315474272 S Co:1:061:0 s 21 09 0300 0000 0008 8 = ac591c65 382c94cd
ffff8803fe1639c0 2315474557 C Co:1:061:0 0 8 >
ffff8803fe1639c0 2315491328 S Co:1:061:0 s 21 09 0300 0000 0008 8 = 4776e126 bde3e3f1
ffff8803fe1639c0 2315491538 C Co:1:061:0 0 8 >
ffff8803fe1639c0 2315506207 S Co:1:061:0 s 21 09 0300 0000 0008 8 = f7eae1c4 382f95c8
ffff8803fe1639c0 2315506415 C Co:1:061:0 0 8 >
ffff8803fe1639c0 2315521375 S Co:1:061:0 s 21 09 0300 0000 0008 8 = 561d7c73 a5c45c81
ffff8803fe1639c0 2315521531 C Co:1:061:0 0 8 >
ffff8803fe1639c0 2315538288 S Co:1:061:0 s 21 09 0300 0000 0008 8 = 24f01639 e78badde
ffff8803fe1639c0 2315538508 C Co:1:061:0 0 8 >
ffff8803fe1639c0 2315553202 S Co:1:061:0 s 21 09 0300 0000 0008 8 = c4359773 422144b4
ffff8803fe1639c0 2315553415 C Co:1:061:0 0 8 >
ffff8803fe1639c0 2315568218 S Co:1:061:0 s 21 09 0300 0000 0008 8 = be33ed51 df579e6d
ffff8803fe1639c0 2315568407 C Co:1:061:0 0 8 >
ffff8803fe1639c0 2315585274 S Co:1:061:0 s 21 09 0300 0000 0008 8 = 3d258757 4db37f88
ffff8803fe1639c0 2315585558 C Co:1:061:0 0 8 >
ffff8803fe1639c0 2315600183 S Co:1:061:0 s 21 09 0300 0000 0008 8 = 90b9d9dd fceb6c15
ffff8803fe1639c0 2315600265 C Co:1:061:0 0 8 >
ffff8803fe1639c0 2315615341 S Co:1:061:0 s 21 09 0300 0000 0008 8 = aa93dd8e c26f303c
ffff8803fe1639c0 2315615538 C Co:1:061:0 0 8 >
ffff8803fe1639c0 2315632274 S Co:1:061:0 s 21 09 0300 0000 0008 8 = a4ca8fea 58de59b5
ffff8803fe1639c0 2315632539 C Co:1:061:0 0 8 >
ffff8803fe1639c0 2315647327 S Co:1:061:0 s 21 09 0300 0000 0008 8 = 38686ec6 dc8dba4f
ffff8803fe1639c0 2315647541 C Co:1:061:0 0 8 >
ffff8803fe1639c0 2315662200 S Co:1:061:0 s 21 09 0300 0000 0008 8 = 46ed00c9 4f05e86b
ffff8803fe1639c0 2315662415 C Co:1:061:0 0 8 >
ffff8803fe1639c0 2315679266 S Co:1:061:0 s 21 09 0300 0000 0008 8 = 51ca4cee 1684bf80
ffff8803fe1639c0 2315679407 C Co:1:061:0 0 8 >
ffff8803fe1639c0 2315694296 S Co:1:061:0 s 21 09 0300 0000 0008 8 = 01e85f07 7b79dd98
ffff8803fe1639c0 2315694532 C Co:1:061:0 0 8 >
ffff8803fe1639c0 2315709188 S Co:1:061:0 s 21 09 0300 0000 0008 8 = a120ca36 2c0a24cf
ffff8803fe1639c0 2315709415 C Co:1:061:0 0 8 >
ffff8803fe1639c0 2315726248 S Co:1:061:0 s 21 09 0300 0000 0008 8 = a0c32174 b8903ad8
ffff8803fe1639c0 2315726408 C Co:1:061:0 0 8 >
ffff8803fe1639c0 2315741280 S Co:1:061:0 s 21 09 0300 0000 0008 8 = 12127b0d 17180a7a
ffff8803fe1639c0 2315741560 C Co:1:061:0 0 8 >
ffff8803fe1639c0 2315756184 S Co:1:061:0 s 21 09 0300 0000 0008 8 = 2dc4f61f 21e2430d
ffff8803fe1639c0 2315756260 C Co:1:061:0 0 8 >
ffff8803fe1639c0 2315771218 S Co:1:061:0 s 21 09 0300 0000 0008 8 = cf853320 13e3d600
ffff8803fe1639c0 2315771418 C Co:1:061:0 0 8 >
ffff8803fe1639c0 2315788268 S Co:1:061:0 s 21 09 0300 0000 0008 8 = f573d457 10457a54
ffff8803fe1639c0 2315788560 C Co:1:061:0 0 8 >
ffff8803fe1639c0 2315803302 S Co:1:061:0 s 21 09 0300 0000 0008 8 = 43a10361 9be42920
ffff8803fe1639c0 2315803542 C Co:1:061:0 0 8 >
ffff8803fe1639c0 2315818209 S Co:1:061:0 s 21 09 0300 0000 0008 8 = 8196ecac 20d0a20d
ffff8803fe1639c0 2315818391 C Co:1:061:0 0 8 >
ffff8803fe1639c0 2315835254 S Co:1:061:0 s 21 09 0300 0000 0008 8 = 19ce40fc 6bd0e7da
ffff8803fe1639c0 2315835406 C Co:1:061:0 0 8 >
ffff8803fe1639c0 2315850289 S Co:1:061:0 s 21 09 0300 0000 0008 8 = 9c36b2eb 2ddbbfd7
ffff8803fe1639c0 2315850563 C Co:1:061:0 0 8 >
ffff8803fe1639c0 2315865208 S Co:1:061:0 s 21 09 0300 0000 0008 8 = 3db17c62 7c9e336b
ffff8803fe1639c0 2315865419 C Co:1:061:0 0 8 >
ffff8803fe1639c0 2315880379 S Co:1:061:0 s 21 09 0300 0000 0008 8 = 5397d924 51fc1390
ffff8803fe1639c0 2315880533 C Co:1:061:0 0 8 >
ffff8803fe1639c0 2315897277 S Co:1:061:0 s 21 09 0300 0000 0008 8 = d9338942 0a877054
ffff8803fe1639c0 2315897560 C Co:1:061:0 0 8 >
ffff8803fe1639c0 2315912181 S Co:1:061:0 s 21 09 0300 0000 0008 8 = ef4253a6 e80a2158
ffff8803fe1639c0 2315912265 C Co:1:061:0 0 8 >
ffff8803fe1639c0 2315927491 S Co:1:061:0 s 21 09 0300 0000 0008 8 = 59797d8a 91014153
ffff8803fe1639c0 2315927654 C Co:1:061:0 0 8 >
ffff8803fe1639c0 2315944273 S Co:1:061:0 s 21 09 0300 0000 0008 8 = fcfe5300 8d1cad8e
ffff8803fe1639c0 2315944558 C Co:1:061:0 0 8 >
ffff8803fe1639c0 2315959293 S Co:1:061:0 s 21 09 0300 0000 0008 8 = 66eca86a cac28967
ffff8803fe1639c0 2315959514 C Co:1:061:0 0 8 >
ffff8803fe1639c0 2315974191 S Co:1:061:0 s 21 09 0300 0000 0008 8 = 45d24e00 1a8abad1
ffff8803fe1639c0 2315974388 C Co:1:061:0 0 8 >
ffff8803fe1639c0 2315991255 S Co:1:061:0 s 21 09 0300 0000 0008 8 = ed329e50 b2c26ad0
ffff8803fe1639c0 2315991410 C Co:1:061:0 0 8 >
ffff8803fe1639c0 2316006300 S Co:1:061:0 s 21 09 0300 0000 0008 8 = d504f5b7 aaea89ff
ffff8803fe1639c0 2316006544 C Co:1:061:0 0 8 >
ffff8803fe1639c0 2316021184 S Co:1:061:0 s 21 09 0300 0000 0008 8 = 183233eb 8238490b
ffff8803fe1639c0 2316021267 C Co:1:061:0 0 8 >
ffff8803fe1639c0 2316038247 S Co:1:061:0 s 21 09 0300 0000 0008 8 = f61b3c73 99149f38
ffff8803fe1639c0 2316038411 C Co:1:061:0 0 8 >
ffff8803fe1639c0 2316053275 S Co:1:061:0 s 21 09 0300 0000 0008 8 = 5313782b b69bc7d9
ffff8803fe1639c0 2316053561 C Co:1:061:0 0 8 >
ffff8803fe1639c0 2316068170 S Co:1:061:0 s 21 09 0300 0000 0008 8 = 34df55c3 821ebfda
ffff8803fe1639c0 2316068285 C Co:1:061:0 0 8 >
ffff8803fe1639c0 2316085230 S Co:1:061:0 s 21 09 0300 0000 0008 8 = 473cc23e 0aa2c838
ffff8803fe1639c0 2316085409 C Co:1:061:0 0 8 >
ffff8803fe1639c0 2316100269 S Co:1:061:0 s 21 09 0300 0000 0008 8 = 5a57b476 3f5feb85
ffff8803fe1639c0 2316100410 C Co:1:061:0 0 8 >
ffff8803fe1639c0 2316115247 S Co:1:061:0 s 21 09 0300 0000 0008 8 = e154a394 77437068
ffff8803fe1639c0 2316115410 C Co:1:061:0 0 8 >
ffff8803fe1639c0 2316132216 S Co:1:061:0 s 21 09 0300 0000 0008 8 = 73c90b9a ec6e6618
ffff8803fe1639c0 2316132427 C Co:1:061:0 0 8 >
ffff8803fe1639c0 2316147258 S Co:1:061:0 s 21 09 0300 0000 0008 8 = 4b42eedb 3ab620e6
ffff8803fe1639c0 2316147411 C Co:1:061:0 0 8 >
ffff8803fe1639c0 2316162292 S Co:1:061:0 s 21 09 0300 0000 0008 8 = c9bd4f80 e323b3b2
ffff8803fe1639c0 2316162514 C Co:1:061:0 0 8 >
ffff8803fe1639c0 2316179218 S Co:1:061:0 s 21 09 0300 0000 0008 8 = f12db603 cc727c73
ffff8803fe1639c0 2316179430 C Co:1:061:0 0 8 >
ffff8803fe1639c0 2316194253 S Co:1:061:0 s 21 09 0300 0000 0008 8 = e9f9b1b5 bf9496b1
ffff8803fe1639c0 2316194411 C Co:1:061:0 0 8 >
ffff8803fe1639c0 2316209278 S Co:1:061:0 s 21 09 0300 0000 0008 8 = 7c7d4e3a ea2e660c
ffff8803fe1639c0 2316209563 C Co:1:061:0 0 8 >
ffff8803fe1639c0 2316226192 S Co:1:061:0 s 21 09 0300 0000 0008 8 = 9c86a40a 5d1912b6
ffff8803fe1639c0 2316226265 C Co:1:061:0 0 8 >
ffff8803fe1639c0 2316241232 S Co:1:061:0 s 21 09 0300 0000 0008 8 = d9d74af0 8de103f3
ffff8803fe1639c0 2316241414 C Co:1:061:0 0 8 >
ffff8803fe1639c0 2316256275 S Co:1:061:0 s 21 09 0300 0000 0008 8 = eda8dc8c d548699d
ffff8803fe1639c0 2316256565 C Co:1:061:0 0 8 >
ffff8803fe1639c0 2316274378 S Co:1:061:0 s 21 09 0300 0000 0008 8 = 33247cd3 f2c2b5a4
ffff8803fe1639c0 2316274533 C Co:1:061:0 0 8 >
ffff8803fe1639c0 2316287207 S Co:1:061:0 s 21 09 0300 0000 0008 8 = 29e84c8c 84f81e88
ffff8803fe1639c0 2316287420 C Co:1:061:0 0 8 >
ffff8803fe1639c0 2316304268 S Co:1:061:0 s 21 09 0300 0000 0008 8 = f389f6d2 92471edf
ffff8803fe1639c0 2316304414 C Co:1:061:0 0 8 >
ffff8803fe1639c0 2316319306 S Co:1:061:0 s 21 09 0300 0000 0008 8 = d90d2797 0540f4d4
ffff8803fe1639c0 2316319547 C Co:1:061:0 0 8 >
ffff8803fe1639c0 2316334200 S Co:1:061:0 s 21 09 0300 0000 0008 8 = c66f0d1d 2a2823a4
ffff8803fe1639c0 2316334420 C Co:1:061:0 0 8 >
ffff8803fe1639c0 2316351260 S Co:1:061:0 s 21 09 0300 0000 0008 8 = c91ddf7d 3278ef21
ffff8803fe1639c0 2316351413 C Co:1:061:0 0 8 >
ffff8803fe1639c0 2316366294 S Co:1:061:0 s 21 09 0300 0000 0008 8 = 967c5323 b35de531
ffff8803fe1639c0 2316366566 C Co:1:061:0 0 8 >
ffff8803fe1639c0 2316381189 S Co:1:061:0 s 21 09 0300 0000 0008 8 = 0460274e 2736524e
ffff8803fe1639c0 2316381271 C Co:1:061:0 0 8 >
ffff8803fdd14600 2316398263 S Co:1:061:0 s 21 09 0300 0000 0008 8 = 8e969b92 6a1bc805
ffff8803fdd14600 2316398414 C Co:1:061:0 0 8 >
ffff8803fdd14600 2316413272 S Co:1:061:0 s 21 09 0300 0000 0008 8 = d45df457 3e529e79
ffff8803fdd14600 2316413413 C Co:1:061:0 0 8 >
ffff8803fdd14600 2316428178 S Co:1:061:0 s 21 09 0300 0000 0008 8 = 1ae6f959 c9d96fdf
ffff8803fdd14600 2316428293 C Co:1:061:0 0 8 >
ffff88015e27f6c0 2316443212 S Co:1:061:0 s 21 09 0300 0000 0008 8 = c6da7728 13e29902
ffff88015e27f6c0 2316443412 C Co:1:061:0 0 8 >
ffff88015e27f6c0 2316460270 S Co:1:061:0 s 21 09 0300 0000 0008 8 = e4d2bea8 8a50bdbf
ffff88015e27f6c0 2316460413 C Co:1:061:0 0 8 >
ffff88015e27f6c0 2316475162 S Co:1:061:0 s 21 09 0300 0000 0008 8 = a3de2390 803d4388
ffff88015e27f6c0 2316475306 C Co:1:061:0 0 8 >
ffff88015e27f6c0 2316490193 S Co:1:061:0 s 21 09 0300 0000 0008 8 = d7017fed aa75d5e2
ffff88015e27f6c0 2316490289 C Co:1:061:0 0 8 >
ffff88015e27f6c0 2316507258 S Co:1:061:0 s 21 09 0300 0000 0008 8 = 77b2ad9e a1fae1e9
ffff88015e27f6c0 2316507418 C Co:1:061:0 0 8 >
ffff88015e27f6c0 2316522293 S Co:1:061:0 s 21 09 0300 0000 0008 8 = 1e5a0dd8 63801ac9
ffff88015e27f6c0 2316522565 C Co:1:061:0 0 8 >
ffff88015e27f6c0 2316537208 S Co:1:061:0 s 21 09 0300 0000 0008 8 = 8cda06a1 d0f1f545
ffff88015e27f6c0 2316537442 C Co:1:061:0 0 8 >
ffff8803ff398840 2316552395 S Co:1:061:0 s 21 09 0300 0000 0008 8 = 25057d57 2fe92e32
ffff8803ff398840 2316552540 C Co:1:061:0 0 8 >
ffff8803ff398840 2316569277 S Co:1:061:0 s 21 09 0300 0000 0008 8 = 6f206128 a93843fb
ffff8803ff398840 2316569569 C Co:1:061:0 0 8 >
ffff8803ff398840 2316584182 S Co:1:061:0 s 21 09 0300 0000 0008 8 = 9667219a cb64f61d
ffff8803ff398840 2316584298 C Co:1:061:0 0 8 >
ffff8803ff398840 2316599305 S Co:1:061:0 s 21 09 0300 0000 0008 8 = e9893202 0627cdaa
ffff8803ff398840 2316599549 C Co:1:061:0 0 8 >
ffff8802ffcc5cc0 2316616256 S Co:1:061:0 s 21 09 0300 0000 0008 8 = 5c288d0f 31eb93c7
ffff8802ffcc5cc0 2316616417 C Co:1:061:0 0 8 >
ffff8802ffcc5cc0 2316631311 S Co:1:061:0 s 21 09 0300 0000 0008 8 = 065c2c3e 0353d730
ffff8802ffcc5cc0 2316631549 C Co:1:061:0 0 8 >
ffff8802ffcc5cc0 2316646199 S Co:1:061:0 s 21 09 0300 0000 0008 8 = a2309265 9bb46ab1
ffff8802ffcc5cc0 2316646425 C Co:1:061:0 0 8 >
ffff8802ffcc5cc0 2316663256 S Co:1:061:0 s 21 09 0300 0000 0008 8 = 1121422b fa95e2ad
ffff8802ffcc5cc0 2316663416 C Co:1:061:0 0 8 >
ffff8802ffcc5cc0 2316678300 S Co:1:061:0 s 21 09 0300 0000 0008 8 = d4a4448c 86351c99
ffff8802ffcc5cc0 2316678542 C Co:1:061:0 0 8 >
ffff8802ffcc5cc0 2316695209 S Co:1:061:0 s 21 09 0300 0000 0008 8 = 949fa658 8704b47f
ffff8802ffcc5cc0 2316695422 C Co:1:061:0 0 8 >
ffff8802ffcc5cc0 2316710240 S Co:1:061:0 s 21 09 0300 0000 0008 8 = 9cedf7b2 ac268d7e
ffff8802ffcc5cc0 2316710436 C Co:1:061:0 0 8 >
ffff8802ffcc5cc0 2316725283 S Co:1:061:0 s 21 09 0300 0000 0008 8 = 5bdccc94 85f64d47
ffff8802ffcc5cc0 2316725567 C Co:1:061:0 0 8 >
ffff8802ffcc5cc0 2316740237 S Co:1:061:0 s 21 09 0300 0000 0008 8 = e5b03d47 087ee09f
ffff8802ffcc5cc0 2316740418 C Co:1:061:0 0 8 >
ffff8802ffcc5cc0 2316757241 S Co:1:061:0 s 21 09 0300 0000 0008 8 = 712066ed 0e02f2e2
ffff8802ffcc5cc0 2316757425 C Co:1:061:0 0 8 >
ffff8802ffcc5cc0 2316772272 S Co:1:061:0 s 21 09 0300 0000 0008 8 = dbd6e8fa d474787c
ffff8802ffcc5cc0 2316772417 C Co:1:061:0 0 8 >
ffff8802ffcc5cc0 2316787162 S Co:1:061:0 s 21 09 0300 0000 0008 8 = 21f168b4 7dff266f
ffff8802ffcc5cc0 2316787292 C Co:1:061:0 0 8 >
ffff8802ffcc5cc0 2316804225 S Co:1:061:0 s 21 09 0300 0000 0008 8 = e7850db8 8d7ff7d3
ffff8802ffcc5cc0 2316804435 C Co:1:061:0 0 8 >
ffff8802ffcc5cc0 2316819261 S Co:1:061:0 s 21 09 0300 0000 0008 8 = f5170577 6e05ab4f
ffff8802ffcc5cc0 2316819417 C Co:1:061:0 0 8 >
ffff8802ffcc5cc0 2316834293 S Co:1:061:0 s 21 09 0300 0000 0008 8 = b624ffb3 ed5542a2
ffff8802ffcc5cc0 2316834573 C Co:1:061:0 0 8 >
ffff8802ffcc5cc0 2316851211 S Co:1:061:0 s 21 09 0300 0000 0008 8 = ba99af04 bb6a841f
ffff8802ffcc5cc0 2316851421 C Co:1:061:0 0 8 >
ffff8802ffcc5cc0 2316866247 S Co:1:061:0 s 21 09 0300 0000 0008 8 = 335a4f57 efef7b2b
ffff8802ffcc5cc0 2316866415 C Co:1:061:0 0 8 >
ffff8802ffcc5cc0 2316881281 S Co:1:061:0 s 21 09 0300 0000 0008 8 = 79bd1a6c 80c5f5bf
ffff8802ffcc5cc0 2316881556 C Co:1:061:0 0 8 >
ffff88015e27f480 2316898196 S Co:1:061:0 s 21 09 0300 0000 0008 8 = 870ed155 ce8204ea
ffff88015e27f480 2316898292 C Co:1:061:0 0 8 >
ffff8803ff398840 2316913234 S Co:1:061:0 s 21 09 0300 0000 0008 8 = 7e0b39fc 18ee804d
ffff8803ff398840 2316913419 C Co:1:061:0 0 8 >
ffff8803ff398840 2316928263 S Co:1:061:0 s 21 09 0300 0000 0008 8 = 1f67999c 0486819f
ffff8803ff398840 2316928419 C Co:1:061:0 0 8 >
ffff8803ff398840 2316943308 S Co:1:061:0 s 21 09 0300 0000 0008 8 = 53493e45 1dfbe82a
ffff8803ff398840 2316943543 C Co:1:061:0 0 8 >
ffff8803ff398840 2316958329 S Co:1:061:0 s 21 09 0300 0000 0008 8 = a5ccf95a 4eb2d64a
ffff8803ff398840 2316958552 C Co:1:061:0 0 8 >
ffff8803ff398840 2316975264 S Co:1:061:0 s 21 09 0300 0000 0008 8 = c57f9d14 6a4331f3
ffff8803ff398840 2316975419 C Co:1:061:0 0 8 >
ffff8803ff398840 2316990298 S Co:1:061:0 s 21 09 0300 0000 0008 8 = 05e583ff a6fc2429
ffff8803ff398840 2316990551 C Co:1:061:0 0 8 >
ffff8803ff398840 2317005186 S Co:1:061:0 s 21 09 0300 0000 0008 8 = ddf40879 1b5e9d87
ffff8803ff398840 2317005301 C Co:1:061:0 0 8 >
ffff8803ff398840 2317022244 S Co:1:061:0 s 21 09 0300 0000 0008 8 = 68970c38 479dcfbb
ffff8803ff398840 2317022425 C Co:1:061:0 0 8 >
ffff8803ff398840 2317037277 S Co:1:061:0 s 21 09 0300 0000 0008 8 = e62e74c4 8b22af07
ffff8803ff398840 2317037418 C Co:1:061:0 0 8 >
ffff8803ff398840 2317052325 S Co:1:061:0 s 21 09 0300 0000 0008 8 = 3b0aa7f7 ac0a7ac0
ffff8803ff398840 2317052549 C Co:1:061:0 0 8 >
ffff8803ff398840 2317069235 S Co:1:061:0 s 21 09 0300 0000 0008 8 = 6df41182 54a62bd0
ffff8803ff398840 2317069420 C Co:1:061:0 0 8 >
ffff8803ff398840 2317084275 S Co:1:061:0 s 21 09 0300 0000 0008 8 = 28a6a569 90fb0735
ffff8803ff398840 2317084420 C Co:1:061:0 0 8 >
ffff8803ff398840 2317099198 S Co:1:061:0 s 21 09 0300 0000 0008 8 = 3c4e5583 51421482
ffff8803ff398840 2317099273 C Co:1:061:0 0 8 >
ffff8803ff398840 2317116231 S Co:1:061:0 s 21 09 0300 0000 0008 8 = 1b119afd ee679b5b
ffff8803ff398840 2317116427 C Co:1:061:0 0 8 >
ffff8803ff398840 2317131262 S Co:1:061:0 s 21 09 0300 0000 0008 8 = 5d83f1d6 9f8cabfb
ffff8803ff398840 2317131428 C Co:1:061:0 0 8 >
ffff88015e27f480 2317146448 S Co:1:061:0 s 21 09 0300 0000 0008 8 = 3d315a63 018598b0
ffff88015e27f480 2317146544 C Co:1:061:0 0 8 >
ffff88015e27f480 2317163206 S Co:1:061:0 s 21 09 0300 0000 0008 8 = 1c1ad9ca 965b765b
ffff88015e27f480 2317163420 C Co:1:061:0 0 8 >
ffff88015e27f480 2317178244 S Co:1:061:0 s 21 09 0300 0000 0008 8 = fb2ff689 44cca0f3
ffff88015e27f480 2317178410 C Co:1:061:0 0 8 >
ffff8803ff398c00 2317193288 S Co:1:061:0 s 21 09 0300 0000 0008 8 = 03d83fee d3c73501
ffff8803ff398c00 2317193572 C Co:1:061:0 0 8 >
ffff8803ff398c00 2317210199 S Co:1:061:0 s 21 09 0300 0000 0008 8 = ff71c39f 72f29723
ffff8803ff398c00 2317210428 C Co:1:061:0 0 8 >
ffff8803ff398c00 2317225228 S Co:1:061:0 s 21 09 0300 0000 0008 8 = dfc79711 3126ed8c
ffff8803ff398c00 2317225428 C Co:1:061:0 0 8 >
ffff8803fdd14600 2317240267 S Co:1:061:0 s 21 09 0300 0000 0008 8 = 359e5313 86f0a180
ffff8803fdd14600 2317240422 C Co:1:061:0 0 8 >
ffff8803fdd14600 2317271309 S Co:1:061:0 s 21 09 0300 0000 0008 8 = 5503ad6f 42c27802
ffff8803fdd14600 2317271539 C Co:1:061:0 0 8 >
ffff88015e27f180 2317304307 S Ci:1:061:0 s a1 01 0300 0000 0008 8 <
ffff88015e27f180 2317304555 C Ci:1:061:0 0 8 = aa040000 00000000
ffff8803fdd14600 2329132697 S Co:1:061:0 s 21 09 0300 0000 0008 8 = 55050000 00000000
ffff8803fdd14600 2329132914 C Co:1:061:0 0 8 >
ffff8802ffcc5cc0 2329163635 S Ci:1:061:0 s a1 01 0300 0000 0008 8 <
ffff8802ffcc5cc0 2329163781 C Ci:1:061:0 0 8 = 0b010101 0000000e
ffff8802ffcc5cc0 2329178693 S Ci:1:061:0 s a1 01 0300 0000 0008 8 <
ffff8802ffcc5cc0 2329178884 C Ci:1:061:0 0 8 = 04fa25e0 1200450e
ffff8802ffcc5cc0 2329193787 S Ci:1:061:0 s a1 01 0300 0000 0008 8 <
ffff8802ffcc5cc0 2329193911 C Ci:1:061:0 0 8 = 951a0480 90000021
ffff8802ffcc5cc0 2329208601 S Ci:1:061:0 s a1 01 0300 0000 0008 8 <
ffff8802ffcc5cc0 2329208783 C Ci:1:061:0 0 8 = 01900121 80009001
ffff8802ffcc5cc0 2329225661 S Ci:1:061:0 s a1 01 0300 0000 0008 8 <
ffff8802ffcc5cc0 2329225784 C Ci:1:061:0 0 8 = 237f9002 2300fbaf
ffff8802ffcc5cc0 2329240685 S Ci:1:061:0 s a1 01 0300 0000 0008 8 <
ffff8802ffcc5cc0 2329240761 C Ci:1:061:0 0 8 = fb8ffbbf fb000ffb
ffff8802ffcc5cc0 2329255653 S Ci:1:061:0 s a1 01 0300 0000 0008 8 <
ffff8802ffcc5cc0 2329255781 C Ci:1:061:0 0 8 = fffb9ffb 5f00fbbf
ffff8802ffcc5cc0 2329273701 S Ci:1:061:0 s a1 01 0300 0000 0008 8 <
ffff8802ffcc5cc0 2329273897 C Ci:1:061:0 0 8 = fb5ffbaf fb005ffb
ffff8802ffcc5cc0 2329286745 S Ci:1:061:0 s a1 01 0300 0000 0008 8 <
ffff8802ffcc5cc0 2329286906 C Ci:1:061:0 0 8 = 2ffbdffb ff00fbaf
ffff8803fdd14600 2329303735 S Ci:1:061:0 s a1 01 0300 0000 0008 8 <
ffff8803fdd14600 2329303905 C Ci:1:061:0 0 8 = fbcffb5f fb002ffb
ffff8803fdd14600 2329318635 S Ci:1:061:0 s a1 01 0300 0000 0008 8 <
ffff8803fdd14600 2329318782 C Ci:1:061:0 0 8 = cffb4ffb 8f00fb4f
ffff8803fdd14600 2329333746 S Ci:1:061:0 s a1 01 0300 0000 0008 8 <
ffff8803fdd14600 2329333906 C Ci:1:061:0 0 8 = fbfffb9f fb00cffb
ffff8803fdd14600 2329350708 S Ci:1:061:0 s a1 01 0300 0000 0008 8 <
ffff8803fdd14600 2329350923 C Ci:1:061:0 0 8 = 6ffb3ffb bf00fbef
ffff8803fdd14600 2329365616 S Ci:1:061:0 s a1 01 0300 0000 0008 8 <
ffff8803fdd14600 2329365782 C Ci:1:061:0 0 8 = fbcffbff fb00cffb
ffff8803fdd14600 2329380645 S Ci:1:061:0 s a1 01 0300 0000 0008 8 <
ffff8803fdd14600 2329380782 C Ci:1:061:0 0 8 = 4ffbfffb 9f00fbbf
ffff8803fdd14600 2329397699 S Ci:1:061:0 s a1 01 0300 0000 0008 8 <
ffff8803fdd14600 2329397914 C Ci:1:061:0 0 8 = fb2ffb8f fb00cffb
ffff8801391a8a80 2329412604 S Ci:1:061:0 s a1 01 0300 0000 0008 8 <
ffff8801391a8a80 2329412787 C Ci:1:061:0 0 8 = 9ffb5ffb cf00fb3f
ffff8801391a8a80 2329427634 S Ci:1:061:0 s a1 01 0300 0000 0008 8 <
ffff8801391a8a80 2329427782 C Ci:1:061:0 0 8 = fbdffb0f fb00effb
ffff8801391a8a80 2329444697 S Ci:1:061:0 s a1 01 0300 0000 0008 8 <
ffff8801391a8a80 2329444914 C Ci:1:061:0 0 8 = cffb5ffb ff00fbef
ffff8801391a8a80 2329459727 S Ci:1:061:0 s a1 01 0300 0000 0008 8 <
ffff8801391a8a80 2329459910 C Ci:1:061:0 0 8 = fb5ffbaf fb00affb
ffff8801391a8a80 2329474625 S Ci:1:061:0 s a1 01 0300 0000 0008 8 <
ffff8801391a8a80 2329474781 C Ci:1:061:0 0 8 = dffbdffb 0f00fb1f
ffff8801391a8a80 2329491677 S Ci:1:061:0 s a1 01 0300 0000 0008 8 <
ffff8801391a8a80 2329491907 C Ci:1:061:0 0 8 = fbeffb6f fb000ffb
ffff8803ff398cc0 2329506710 S Ci:1:061:0 s a1 01 0300 0000 0008 8 <
ffff8803ff398cc0 2329506921 C Ci:1:061:0 0 8 = bffbeffb ef00fbef
ffff8803ff398cc0 2329521620 S Ci:1:061:0 s a1 01 0300 0000 0008 8 <
ffff8803ff398cc0 2329521782 C Ci:1:061:0 0 8 = fb2ffb4f fb00bffb
ffff8802ffcc5cc0 2329536692 S Ci:1:061:0 s a1 01 0300 0000 0008 8 <
ffff8802ffcc5cc0 2329536918 C Ci:1:061:0 0 8 = cffb1ffb 0f00fb8f
ffff8802ffcc5cc0 2329553699 S Ci:1:061:0 s a1 01 0300 0000 0008 8 <
ffff8802ffcc5cc0 2329553910 C Ci:1:061:0 0 8 = fbaffb8f fb001ffb
ffff8802ffcc5cc0 2329568606 S Ci:1:061:0 s a1 01 0300 0000 0008 8 <
ffff8802ffcc5cc0 2329568786 C Ci:1:061:0 0 8 = effb0ffb 9f00fbbf
ffff8802ffcc5cc0 2329583635 S Ci:1:061:0 s a1 01 0300 0000 0008 8 <
ffff8802ffcc5cc0 2329583784 C Ci:1:061:0 0 8 = fb4ffb4f fb00fffb
ffff8802ffcc5cc0 2329600704 S Ci:1:061:0 s a1 01 0300 0000 0008 8 <
ffff8802ffcc5cc0 2329600916 C Ci:1:061:0 0 8 = 6ffb6ffb ef00fbef
ffff8802ffcc5cc0 2329615584 S Ci:1:061:0 s a1 01 0300 0000 0008 8 <
ffff8802ffcc5cc0 2329615796 C Ci:1:061:0 0 8 = fb0ffb7f fb005ffb
ffff8802ffcc5cc0 2329630619 S Ci:1:061:0 s a1 01 0300 0000 0008 8 <
ffff8802ffcc5cc0 2329630785 C Ci:1:061:0 0 8 = 3ffbeffb 1f00fbcf
ffff8802ffcc5cc0 2329647685 S Ci:1:061:0 s a1 01 0300 0000 0008 8 <
ffff8802ffcc5cc0 2329647917 C Ci:1:061:0 0 8 = fbbffb7f fb004ffb
ffff8802ffcc5cc0 2329662728 S Ci:1:061:0 s a1 01 0300 0000 0008 8 <
ffff8802ffcc5cc0 2329662929 C Ci:1:061:0 0 8 = 8ffb9ffb 1f00fb9f
ffff8802ffcc5cc0 2329677647 S Ci:1:061:0 s a1 01 0300 0000 0008 8 <
ffff8802ffcc5cc0 2329677784 C Ci:1:061:0 0 8 = fb1ffbaf fb002ffb
ffff8802ffcc5cc0 2329694672 S Ci:1:061:0 s a1 01 0300 0000 0008 8 <
ffff8802ffcc5cc0 2329694789 C Ci:1:061:0 0 8 = 9ffb3ffb 2f00fb3f
ffff8802ffcc5cc0 2329709707 S Ci:1:061:0 s a1 01 0300 0000 0008 8 <
ffff8802ffcc5cc0 2329709920 C Ci:1:061:0 0 8 = fbcffb8f fb004ffb
ffff8802ffcc5cc0 2329724598 S Ci:1:061:0 s a1 01 0300 0000 0008 8 <
ffff8802ffcc5cc0 2329724791 C Ci:1:061:0 0 8 = 9ffb4ffb ff00fb8f
ffff8802ffcc5cc0 2329741656 S Ci:1:061:0 s a1 01 0300 0000 0008 8 <
ffff8802ffcc5cc0 2329741785 C Ci:1:061:0 0 8 = fb4ffb7f fb00cffb
ffff8803fdd14600 2329756690 S Ci:1:061:0 s a1 01 0300 0000 0008 8 <
ffff8803fdd14600 2329756919 C Ci:1:061:0 0 8 = 2ffbeffb ff00fbcf
ffff8803fdd14600 2329771587 S Ci:1:061:0 s a1 01 0300 0000 0008 8 <
ffff8803fdd14600 2329771802 C Ci:1:061:0 0 8 = fb6ffb0f fb00cffb
ffff8803fdd14600 2329786625 S Ci:1:061:0 s a1 01 0300 0000 0008 8 <
ffff8803fdd14600 2329786787 C Ci:1:061:0 0 8 = cffbbffb af00fb1f
ffff8803fdd14600 2329803679 S Ci:1:061:0 s a1 01 0300 0000 0008 8 <
ffff8803fdd14600 2329803911 C Ci:1:061:0 0 8 = fb1f00a1 ff0017ff
ffff8803fdd14600 2329818715 S Ci:1:061:0 s a1 01 0300 0000 0008 8 <
ffff8803fdd14600 2329818931 C Ci:1:061:0 0 8 = a7ff87ff 7700ff07
ffff8803fdd14600 2329833622 S Ci:1:061:0 s a1 01 0300 0000 0008 8 <
ffff8803fdd14600 2329833786 C Ci:1:061:0 0 8 = fff7ffa7 ff0067ff
ffff8803fdd14600 2329850662 S Ci:1:061:0 s a1 01 0300 0000 0008 8 <
ffff8803fdd14600 2329850786 C Ci:1:061:0 0 8 = b7ff57ff 4700ffb7
ffff8803fdd14600 2329865708 S Ci:1:061:0 s a1 01 0300 0000 0008 8 <
ffff8803fdd14600 2329865907 C Ci:1:061:0 0 8 = ff87ffb7 ff00a7ff
ffff8803fdd14600 2329880603 S Ci:1:061:0 s a1 01 0300 0000 0008 8 <
ffff8803fdd14600 2329880788 C Ci:1:061:0 0 8 = f7ff07ff e700ff37
ffff8803fdd14600 2329897658 S Ci:1:061:0 s a1 01 0300 0000 0008 8 <
ffff8803fdd14600 2329897765 C Ci:1:061:0 0 8 = fff7ff87 ff0037ff
ffff8803fdd14600 2329912685 S Ci:1:061:0 s a1 01 0300 0000 0008 8 <
ffff8803fdd14600 2329912767 C Ci:1:061:0 0 8 = c7ffc7ff c700ffd7
ffff8803fdd14600 2329927587 S Ci:1:061:0 s a1 01 0300 0000 0008 8 <
ffff8803fdd14600 2329927797 C Ci:1:061:0 0 8 = ffe7ff57 ff0077ff
ffff8803fdd14600 2329944644 S Ci:1:061:0 s a1 01 0300 0000 0008 8 <
ffff8803fdd14600 2329944787 C Ci:1:061:0 0 8 = 57ffd7ff b700ffc7
ffff8803fdd14600 2329959680 S Ci:1:061:0 s a1 01 0300 0000 0008 8 <
ffff8803fdd14600 2329959801 C Ci:1:061:0 0 8 = ff57ffe7 ff0047ff
ffff8803fdd14600 2329974723 S Ci:1:061:0 s a1 01 0300 0000 0008 8 <
ffff8803fdd14600 2329974927 C Ci:1:061:0 0 8 = a7ff97ff 5700ff87
ffff8803fdd14600 2329989743 S Ci:1:061:0 s a1 01 0300 0000 0008 8 <
ffff8803fdd14600 2329989911 C Ci:1:061:0 0 8 = ff27ff07 ff0007ff
ffff8803fdd14600 2330006665 S Ci:1:061:0 s a1 01 0300 0000 0008 8 <
ffff8803fdd14600 2330006787 C Ci:1:061:0 0 8 = c7ffc7ff 7700ffd7
ffff8803fdd14600 2330021711 S Ci:1:061:0 s a1 01 0300 0000 0008 8 <
ffff8803fdd14600 2330021921 C Ci:1:061:0 0 8 = ff67ff47 ff0047ff
ffff8803fdd14600 2330036598 S Ci:1:061:0 s a1 01 0300 0000 0008 8 <
ffff8803fdd14600 2330036807 C Ci:1:061:0 0 8 = f7ff27ff 0700ff27
ffff8803ff398cc0 2330053657 S Ci:1:061:0 s a1 01 0300 0000 0008 8 <
ffff8803ff398cc0 2330053787 C Ci:1:061:0 0 8 = ffa7ffa7 ff00e7ff
ffff8802ffcc5cc0 2330068706 S Ci:1:061:0 s a1 01 0300 0000 0008 8 <
ffff8802ffcc5cc0 2330068897 C Ci:1:061:0 0 8 = d7ff07ff 6700ff07
ffff8803fdd14600 2330083587 S Ci:1:061:0 s a1 01 0300 0000 0008 8 <
ffff8803fdd14600 2330083797 C Ci:1:061:0 0 8 = ffe7ff37 ff00e7ff
ffff8803fdd14600 2330100644 S Ci:1:061:0 s a1 01 0300 0000 0008 8 <
ffff8803fdd14600 2330100789 C Ci:1:061:0 0 8 = c7ff37ff 1700ffc7
ffff8803fdd14600 2330115682 S Ci:1:061:0 s a1 01 0300 0000 0008 8 <
ffff8803fdd14600 2330115795 C Ci:1:061:0 0 8 = ff47ff67 ff0087ff
ffff8803fdd14600 2330130715 S Ci:1:061:0 s a1 01 0300 0000 0008 8 <
ffff8803fdd14600 2330130928 C Ci:1:061:0 0 8 = b7ff37ff 6700ffa7
ffff8803fdd14600 2330147629 S Ci:1:061:0 s a1 01 0300 0000 0008 8 <
ffff8803fdd14600 2330147789 C Ci:1:061:0 0 8 = ff17ff47 ff0097ff
ffff8803fdd14600 2330162669 S Ci:1:061:0 s a1 01 0300 0000 0008 8 <
ffff8803fdd14600 2330162792 C Ci:1:061:0 0 8 = c7ff27ff a700ff07
ffff8803fdd14600 2330177712 S Ci:1:061:0 s a1 01 0300 0000 0008 8 <
ffff8803fdd14600 2330177925 C Ci:1:061:0 0 8 = fff7ff67 ff0077ff
ffff8803fdd14600 2330194618 S Ci:1:061:0 s a1 01 0300 0000 0008 8 <
ffff8803fdd14600 2330194801 C Ci:1:061:0 0 8 = e7ffc7ff 3700ffd7
ffff8803fdd14600 2330209661 S Ci:1:061:0 s a1 01 0300 0000 0008 8 <
ffff8803fdd14600 2330209789 C Ci:1:061:0 0 8 = ff37ffe7 ff00a7ff
ffff8803fdd14600 2330224707 S Ci:1:061:0 s a1 01 0300 0000 0008 8 <
ffff8803fdd14600 2330224923 C Ci:1:061:0 0 8 = 87ffd7ff 8700ff77
ffff8803fdd14600 2330241618 S Ci:1:061:0 s a1 01 0300 0000 0008 8 <
ffff8803fdd14600 2330241801 C Ci:1:061:0 0 8 = ffa7ffb7 ff00d7ff
ffff8803fdd14600 2330256651 S Ci:1:061:0 s a1 01 0300 0000 0008 8 <
ffff8803fdd14600 2330256790 C Ci:1:061:0 0 8 = b7ffd7ff 7700ff97
ffff8803fdd14600 2330271676 S Ci:1:061:0 s a1 01 0300 0000 0008 8 <
ffff8803fdd14600 2330271771 C Ci:1:061:0 0 8 = ff37ff77 ff00d7ff
ffff8803ff398cc0 2330287761 S Ci:1:061:0 s a1 01 0300 0000 0008 8 <
ffff8803ff398cc0 2330287915 C Ci:1:061:0 0 8 = f7ff57ff 2700ff07
ffff8803ff398cc0 2330302653 S Ci:1:061:0 s a1 01 0300 0000 0008 8 <
ffff8803ff398cc0 2330302780 C Ci:1:061:0 0 8 = ffc7ff57 ff00b7ff
ffff8803ff398cc0 2330319705 S Ci:1:061:0 s a1 01 0300 0000 0008 8 <
ffff8803ff398cc0 2330319920 C Ci:1:061:0 0 8 = a7ff07ff 7700fff7
ffff8803ff398cc0 2330334744 S Ci:1:061:0 s a1 01 0300 0000 0008 8 <
ffff8803ff398cc0 2330334933 C Ci:1:061:0 0 8 = ff47ff77 ff00b7ff
ffff8803ff398cc0 2330349642 S Ci:1:061:0 s a1 01 0300 0000 0008 8 <
ffff8803ff398cc0 2330349790 C Ci:1:061:0 0 8 = 47ff57ff 6700ffa7
ffff8802ffcc5cc0 2330366708 S Ci:1:061:0 s a1 01 0300 0000 0008 8 <
ffff8802ffcc5cc0 2330366924 C Ci:1:061:0 0 8 = ffe7ff07 ff0017ff
ffff8802ffcc5cc0 2330381738 S Ci:1:061:0 s a1 01 0300 0000 0008 8 <
ffff8802ffcc5cc0 2330381917 C Ci:1:061:0 0 8 = 97ff07ff 4f00ff27
ffff8802ffcc5cc0 2330396628 S Ci:1:061:0 s a1 01 0300 0000 0008 8 <
ffff8802ffcc5cc0 2330396793 C Ci:1:061:0 0 8 = ffcfff87 ff00bfff
ffff8803fdd14480 2330411667 S Ci:1:061:0 s a1 01 0300 0000 0008 8 <
ffff8803fdd14480 2330411793 C Ci:1:061:0 0 8 = f7ff3fff 7700ffef
ffff8803fdd14480 2330428719 S Ci:1:061:0 s a1 01 0300 0000 0008 8 <
ffff8803fdd14480 2330428924 C Ci:1:061:0 0 8 = ffd7ff5f ff0097ff
ffff8803fdd14480 2330443760 S Ci:1:061:0 s a1 01 0300 0000 0008 8 <
ffff8803fdd14480 2330443918 C Ci:1:061:0 0 8 = cfff47ff 3f00ff17
ffff8803fdd14480 2330458664 S Ci:1:061:0 s a1 01 0300 0000 0008 8 <
ffff8803fdd14480 2330458792 C Ci:1:061:0 0 8 = ff8fff07 ff000fff
ffff8801391a8b40 2330475710 S Ci:1:061:0 s a1 01 0300 0000 0008 8 <
ffff8801391a8b40 2330475926 C Ci:1:061:0 0 8 = 97ff5fff 0700ff4f
ffff8801391a8b40 2330490744 S Ci:1:061:0 s a1 01 0300 0000 0008 8 <
ffff8801391a8b40 2330490934 C Ci:1:061:0 0 8 = ffb7ffdf ff0067ff
ffff8801391a8b40 2330505649 S Ci:1:061:0 s a1 01 0300 0000 0008 8 <
ffff8801391a8b40 2330505792 C Ci:1:061:0 0 8 = 4fff57ff 8f00ff57
ffff8801391a8b40 2330522700 S Ci:1:061:0 s a1 01 0300 0000 0008 8 <
ffff8801391a8b40 2330522925 C Ci:1:061:0 0 8 = ff8fff87 ff006fff
ffff8801391a8b40 2330537733 S Ci:1:061:0 s a1 01 0300 0000 0008 8 <
ffff8801391a8b40 2330537917 C Ci:1:061:0 0 8 = b7ffbfff 6700ff0f
ffff8801391a8b40 2330552626 S Ci:1:061:0 s a1 01 0300 0000 0008 8 <
ffff8801391a8b40 2330552793 C Ci:1:061:0 0 8 = ffd7ffff ff00d7ff
ffff8801391a8b40 2330569696 S Ci:1:061:0 s a1 01 0300 0000 0008 8 <
ffff8801391a8b40 2330569797 C Ci:1:061:0 0 8 = ffff27ff bf00ff97
ffff8801391a8b40 2330584723 S Ci:1:061:0 s a1 01 0300 0000 0008 8 <
ffff8801391a8b40 2330584934 C Ci:1:061:0 0 8 = ffbfff87 ff000fff
ffff8801391a8b40 2330599633 S Ci:1:061:0 s a1 01 0300 0000 0008 8 <
ffff8801391a8b40 2330599792 C Ci:1:061:0 0 8 = 47ff3fff b700ffcf
ffff8801391a8b40 2330616670 S Ci:1:061:0 s a1 01 0300 0000 0008 8 <
ffff8801391a8b40 2330616794 C Ci:1:061:0 0 8 = ff77ffff ff00d7ff
ffff8803ff398cc0 2330631712 S Ci:1:061:0 s a1 01 0300 0000 0008 8 <
ffff8803ff398cc0 2330631917 C Ci:1:061:0 0 8 = 4fffe7ff 2f00ffb7
ffff8803fdd14180 2330646751 S Ci:1:061:0 s a1 01 0300 0000 0008 8 <
ffff8803fdd14180 2330646918 C Ci:1:061:0 0 8 = ff2ffff7 ff003fff
ffff8803fdd14180 2330663665 S Ci:1:061:0 s a1 01 0300 0000 0008 8 <
ffff8803fdd14180 2330663794 C Ci:1:061:0 0 8 = 77ff8fff a700ff8f
ffff8803fdd14180 2330678702 S Ci:1:061:0 s a1 01 0300 0000 0008 8 <
ffff8803fdd14180 2330678927 C Ci:1:061:0 0 8 = ff87ff3f ff0097ff
ffff8801391a8b40 2330693732 S Ci:1:061:0 s a1 01 0300 0000 0008 8 <
ffff8801391a8b40 2330693920 C Ci:1:061:0 0 8 = 8fffb7ff af00ff27
ffff8801391a8b40 2330710648 S Ci:1:061:0 s a1 01 0300 0000 0008 8 <
ffff8801391a8b40 2330710793 C Ci:1:061:0 0 8 = ff8fffb7 ff003fff
ffff8801391a8b40 2330725683 S Ci:1:061:0 s a1 01 0300 0000 0008 8 <
ffff8801391a8b40 2330725796 C Ci:1:061:0 0 8 = 47ffffff f700ffff
ffff8801391a8b40 2330740732 S Ci:1:061:0 s a1 01 0300 0000 0008 8 <
ffff8801391a8b40 2330740920 C Ci:1:061:0 0 8 = ff07ff2f ff00f7ff
ffff8801391a8b40 2330757636 S Ci:1:061:0 s a1 01 0300 0000 0008 8 <
ffff8801391a8b40 2330757794 C Ci:1:061:0 0 8 = 7fffb7ff 3f00ff47
ffff8801391a8b40 2330770724 S Ci:1:061:0 s a1 01 0300 0000 0008 8 <
ffff8801391a8b40 2330770937 C Ci:1:061:0 0 8 = ffcfff47 ff00afff
ffff8801391a8b40 2330787713 S Ci:1:061:0 s a1 01 0300 0000 0008 8 <
ffff8801391a8b40 2330787924 C Ci:1:061:0 0 8 = 37ff0fff c700ff2f
ffff8801391a8b40 2330802753 S Ci:1:061:0 s a1 01 0300 0000 0008 8 <
ffff8801391a8b40 2330802919 C Ci:1:061:0 0 8 = fff7ffbf ff0017ff
ffff8801391a8b40 2330817679 S Ci:1:061:0 s a1 01 0300 0000 0008 8 <
ffff8801391a8b40 2330817794 C Ci:1:061:0 0 8 = 2fff47ff 1f00ff27
ffff8801391a8b40 2330834699 S Ci:1:061:0 s a1 01 0300 0000 0008 8 <
ffff8801391a8b40 2330834929 C Ci:1:061:0 0 8 = ff0fffd7 ff008fff
ffff8801391a8b40 2330849732 S Ci:1:061:0 s a1 01 0300 0000 0008 8 <
ffff8801391a8b40 2330849929 C Ci:1:061:0 0 8 = 07ff1fff 6700ffaf
ffff8803ff398cc0 2330864764 S Ci:1:061:0 s a1 01 0300 0000 0008 8 <
ffff8803ff398cc0 2330864920 C Ci:1:061:0 0 8 = ffc7ff5f ff00d7ff
ffff8803ff398cc0 2330881687 S Ci:1:061:0 s a1 01 0300 0000 0008 8 <
ffff8803ff398cc0 2330881799 C Ci:1:061:0 0 8 = 4fffd7ff cf00ffb7
ffff8803ff398cc0 2330896723 S Ci:1:061:0 s a1 01 0300 0000 0008 8 <
ffff8803ff398cc0 2330896938 C Ci:1:061:0 0 8 = ffdfff57 ff000fff
ffff8803ff398cc0 2330911670 S Ci:1:061:0 s a1 01 0300 0000 0008 8 <
ffff8803ff398cc0 2330911796 C Ci:1:061:0 0 8 = a7ff0fff 8700ffdf
ffff8803ff398cc0 2330928677 S Ci:1:061:0 s a1 01 0300 0000 0008 8 <
ffff8803ff398cc0 2330928794 C Ci:1:061:0 0 8 = ffb7ff9f ff00e7ff
ffff8803ff398cc0 2330943715 S Ci:1:061:0 s a1 01 0300 0000 0008 8 <
ffff8803ff398cc0 2330943930 C Ci:1:061:0 0 8 = 3fff1766 6400b1e2
ffff8801391a8b40 2330958744 S Ci:1:061:0 s a1 01 0300 0000 0008 8 <
ffff8801391a8b40 2330958898 C Ci:1:061:0 0 8 = ec299c8c c7001116
ffff8801391a8b40 2330975658 S Ci:1:061:0 s a1 01 0300 0000 0008 8 <
ffff8801391a8b40 2330975774 C Ci:1:061:0 0 8 = f99a1ce1 8f002245
ffff8801391a8b40 2330990700 S Ci:1:061:0 s a1 01 0300 0000 0008 8 <
ffff8801391a8b40 2330990921 C Ci:1:061:0 0 8 = a1af9c8a 5f005858
ffff8801391a8b40 2331005732 S Ci:1:061:0 s a1 01 0300 0000 0008 8 <
ffff8801391a8b40 2331005921 C Ci:1:061:0 0 8 = 383e199e 7c007c3d
ffff8801391a8b40 2331022650 S Ci:1:061:0 s a1 01 0300 0000 0008 8 <
ffff8801391a8b40 2331022796 C Ci:1:061:0 0 8 = c127ac33 8200c132
ffff8801391a8b40 2331037693 S Ci:1:061:0 s a1 01 0300 0000 0008 8 <
ffff8801391a8b40 2331037797 C Ci:1:061:0 0 8 = 3ba7d2ff 5700dc6c
ffff8801391a8b40 2331052856 S Ci:1:061:0 s a1 01 0300 0000 0008 8 <
ffff8801391a8b40 2331053048 C Ci:1:061:0 0 8 = 8e71cafd 1f00c976
ffff8801391a8b40 2331069638 S Ci:1:061:0 s a1 01 0300 0000 0008 8 <
ffff8801391a8b40 2331069796 C Ci:1:061:0 0 8 = 5333a2dc f000482d
ffff8801391a8b40 2331084681 S Ci:1:061:0 s a1 01 0300 0000 0008 8 <
ffff8801391a8b40 2331084796 C Ci:1:061:0 0 8 = cb90d7b6 0300f98b
ffff8801391a8b40 2331099721 S Ci:1:061:0 s a1 01 0300 0000 0008 8 <
ffff8801391a8b40 2331099934 C Ci:1:061:0 0 8 = 0d8e03c2 37005ce7
ffff8801391a8b40 2331116626 S Ci:1:061:0 s a1 01 0300 0000 0008 8 <
ffff8801391a8b40 2331116807 C Ci:1:061:0 0 8 = 495622cc 5400d674
ffff8801391a8b40 2331131665 S Ci:1:061:0 s a1 01 0300 0000 0008 8 <
ffff8801391a8b40 2331131798 C Ci:1:061:0 0 8 = 8fbdda21 d2007ee5
ffff8801391a8b40 2331146701 S Ci:1:061:0 s a1 01 0300 0000 0008 8 <
ffff8801391a8b40 2331146933 C Ci:1:061:0 0 8 = cf4971cd d8004146
ffff8802ffcc5cc0 2331163773 S Ci:1:061:0 s a1 01 0300 0000 0008 8 <
ffff8802ffcc5cc0 2331163927 C Ci:1:061:0 0 8 = dd6471c5 4a00c705
ffff8802ffcc5cc0 2331178655 S Ci:1:061:0 s a1 01 0300 0000 0008 8 <
ffff8802ffcc5cc0 2331178799 C Ci:1:061:0 0 8 = 46d81ce9 6e00cd23
ffff8802ffcc5cc0 2331193697 S Ci:1:061:0 s a1 01 0300 0000 0008 8 <
ffff8802ffcc5cc0 2331193779 C Ci:1:061:0 0 8 = 532b1659 9300f3b8
ffff8803fdd14180 2331210753 S Ci:1:061:0 s a1 01 0300 0000 0008 8 <
ffff8803fdd14180 2331210925 C Ci:1:061:0 0 8 = 561f387a 6b00da2f
ffff8803fdd14180 2331225643 S Ci:1:061:0 s a1 01 0300 0000 0008 8 <
ffff8803fdd14180 2331225799 C Ci:1:061:0 0 8 = d17ca5c3 0c001a28
ffff8803fdd14180 2331240681 S Ci:1:061:0 s a1 01 0300 0000 0008 8 <
ffff8803fdd14180 2331240803 C Ci:1:061:0 0 8 = d4c0e5e2 b4007621
ffff8803ff3989c0 2331255706 S Ci:1:061:0 s a1 01 0300 0000 0008 8 <
ffff8803ff3989c0 2331255931 C Ci:1:061:0 0 8 = 6fe49498 19000b89
ffff8803ff3989c0 2331270803 S Ci:1:061:0 s a1 01 0300 0000 0008 8 <
ffff8803ff3989c0 2331270904 C Ci:1:061:0 0 8 = afa3383d cc005159
ffff8803fe1639c0 2331286721 S Ci:1:061:0 s a1 01 0300 0000 0008 8 <
ffff8803fe1639c0 2331286927 C Ci:1:061:0 0 8 = b8e73cfb 11006fd4
ffff8803fe1639c0 2331303780 S Ci:1:061:0 s a1 01 0300 0000 0008 8 <
ffff8803fe1639c0 2331303925 C Ci:1:061:0 0 8 = 44995fb6 2e0049a1
ffff8803fe1639c0 2331318814 S Ci:1:061:0 s a1 01 0300 0000 0008 8 <
ffff8803fe1639c0 2331318931 C Ci:1:061:0 0 8 = b00669a3 12002483
ffff8803fe1639c0 2331333723 S Ci:1:061:0 s a1 01 0300 0000 0008 8 <
ffff8803fe1639c0 2331333936 C Ci:1:061:0 0 8 = 3738ec87 b1005505
ffff8803fe1639c0 2331350766 S Ci:1:061:0 s a1 01 0300 0000 0008 8 <
ffff8803fe1639c0 2331350925 C Ci:1:061:0 0 8 = 3f3b81d9 f6007c06
ffff8803fe1639c0 2331365801 S Ci:1:061:0 s a1 01 0300 0000 0008 8 <
ffff8803fe1639c0 2331365925 C Ci:1:061:0 0 8 = 4d6569e7 c200de6b
ffff8803fe1639c0 2331380713 S Ci:1:061:0 s a1 01 0300 0000 0008 8 <
ffff8803fe1639c0 2331380933 C Ci:1:061:0 0 8 = b24cbbb2 88003209
ffff8803fe1639c0 2331395740 S Ci:1:061:0 s a1 01 0300 0000 0008 8 <
ffff8803fe1639c0 2331395928 C Ci:1:061:0 0 8 = d86aa672 bb00c5c6
ffff8803fe1639c0 2331412789 S Ci:1:061:0 s a1 01 0300 0000 0008 8 <
ffff8803fe1639c0 2331412925 C Ci:1:061:0 0 8 = 689441d2 98005cc7
ffff8803fe1639c0 2331427702 S Ci:1:061:0 s a1 01 0300 0000 0008 8 <
ffff8803fe1639c0 2331427783 C Ci:1:061:0 0 8 = af8e60d1 9d00a523
ffff8803fe1639c0 2331444737 S Ci:1:061:0 s a1 01 0300 0000 0008 8 <
ffff8803fe1639c0 2331444944 C Ci:1:061:0 0 8 = f6353274 b500a6f0
ffff8803fe1639c0 2331459782 S Ci:1:061:0 s a1 01 0300 0000 0008 8 <
ffff8803fe1639c0 2331459926 C Ci:1:061:0 0 8 = d08131af fa000ee2
ffff8803fe1639c0 2331474818 S Ci:1:061:0 s a1 01 0300 0000 0008 8 <
ffff8803fe1639c0 2331474933 C Ci:1:061:0 0 8 = 39d9db90 85009200
ffff8803fe1639c0 2331489921 S Ci:1:061:0 s a1 01 0300 0000 0008 8 <
ffff8803fe1639c0 2331490051 C Ci:1:061:0 0 8 = 171fe63a d500d7cd
ffff8803fe1639c0 2331506766 S Ci:1:061:0 s a1 01 0300 0000 0008 8 <
ffff8803fe1639c0 2331506926 C Ci:1:061:0 0 8 = 3463a954 180095ec
ffff8803fe1639c0 2331521808 S Ci:1:061:0 s a1 01 0300 0000 0008 8 <
ffff8803fe1639c0 2331521930 C Ci:1:061:0 0 8 = b456b4bf b400b4fa
ffff8803fe1639c0 2331536696 S Ci:1:061:0 s a1 01 0300 0000 0008 8 <
ffff8803fe1639c0 2331536812 C Ci:1:061:0 0 8 = b141964f b0004b90
ffff8803fe1639c0 2331553750 S Ci:1:061:0 s a1 01 0300 0000 0008 8 <
ffff8803fe1639c0 2331553936 C Ci:1:061:0 0 8 = 4334e22a 4c00ac91
ffff8803fe1639c0 2331568796 S Ci:1:061:0 s a1 01 0300 0000 0008 8 <
ffff8803fe1639c0 2331568928 C Ci:1:061:0 0 8 = f24128fb c8001649
ffff8803fe1639c0 2331583684 S Ci:1:061:0 s a1 01 0300 0000 0008 8 <
ffff8803fe1639c0 2331583806 C Ci:1:061:0 0 8 = b465d966 62002eee
ffff8803fe1639c0 2331600739 S Ci:1:061:0 s a1 01 0300 0000 0008 8 <
ffff8803fe1639c0 2331600928 C Ci:1:061:0 0 8 = 00153887 6800e39c
ffff8803fe1639c0 2331615783 S Ci:1:061:0 s a1 01 0300 0000 0008 8 <
ffff8803fe1639c0 2331615928 C Ci:1:061:0 0 8 = 66afc8fc d700cebc
ffff8803fe1639c0 2331630810 S Ci:1:061:0 s a1 01 0300 0000 0008 8 <
ffff8803fe1639c0 2331630930 C Ci:1:061:0 0 8 = 56e81716 0800ecdb
ffff8803fe1639c0 2331647733 S Ci:1:061:0 s a1 01 0300 0000 0008 8 <
ffff8803fe1639c0 2331647949 C Ci:1:061:0 0 8 = 20242f5d fc00f7fb
ffff8803fe1639c0 2331662768 S Ci:1:061:0 s a1 01 0300 0000 0008 8 <
ffff8803fe1639c0 2331662907 C Ci:1:061:0 0 8 = f7b7d4cb 8b00ab26
ffff8803fe1639c0 2331677799 S Ci:1:061:0 s a1 01 0300 0000 0008 8 <
ffff8803fe1639c0 2331677928 C Ci:1:061:0 0 8 = ce2d1ab5 a0000e08
ffff8803fe1639c0 2331694719 S Ci:1:061:0 s a1 01 0300 0000 0008 8 <
ffff8803fe1639c0 2331694937 C Ci:1:061:0 0 8 = 3844ac59 1c006538
ffff8803fe1639c0 2331709755 S Ci:1:061:0 s a1 01 0300 0000 0008 8 <
ffff8803fe1639c0 2331709938 C Ci:1:061:0 0 8 = 2c94cd47 7600e126
ffff8803fe1639c0 2331724797 S Ci:1:061:0 s a1 01 0300 0000 0008 8 <
ffff8803fe1639c0 2331724929 C Ci:1:061:0 0 8 = bde3e3f1 f700eae1
ffff8803fe1639c0 2331741718 S Ci:1:061:0 s a1 01 0300 0000 0008 8 <
ffff8803fe1639c0 2331741935 C Ci:1:061:0 0 8 = c4382f95 c800561d
ffff8803fe1639c0 2331756744 S Ci:1:061:0 s a1 01 0300 0000 0008 8 <
ffff8803fe1639c0 2331756930 C Ci:1:061:0 0 8 = 7c73a5c4 5c008124
ffff8803fe1639c0 2331771785 S Ci:1:061:0 s a1 01 0300 0000 0008 8 <
ffff8803fe1639c0 2331771929 C Ci:1:061:0 0 8 = f01639e7 8b00adde
ffff8803fe1639c0 2331788697 S Ci:1:061:0 s a1 01 0300 0000 0008 8 <
ffff8803fe1639c0 2331788812 C Ci:1:061:0 0 8 = c4359773 42002144
ffff8803fe1639c0 2331803733 S Ci:1:061:0 s a1 01 0300 0000 0008 8 <
ffff8803fe1639c0 2331803948 C Ci:1:061:0 0 8 = b4be33ed 5100df57
ffff8803fe1639c0 2331818773 S Ci:1:061:0 s a1 01 0300 0000 0008 8 <
ffff8803fe1639c0 2331818929 C Ci:1:061:0 0 8 = 9e6d3d25 8700574d
ffff8803fe1639c0 2331833861 S Ci:1:061:0 s a1 01 0300 0000 0008 8 <
ffff8803fe1639c0 2331834071 C Ci:1:061:0 0 8 = b37f8890 b900d9dd
ffff8803fe1639c0 2331850721 S Ci:1:061:0 s a1 01 0300 0000 0008 8 <
ffff8803fe1639c0 2331850939 C Ci:1:061:0 0 8 = fceb6c15 aa0093dd
ffff8803fe1639c0 2331865749 S Ci:1:061:0 s a1 01 0300 0000 0008 8 <
ffff8803fe1639c0 2331865931 C Ci:1:061:0 0 8 = 8ec26f30 3c00a4ca
ffff8803fe1639c0 2331880884 S Ci:1:061:0 s a1 01 0300 0000 0008 8 <
ffff8803fe1639c0 2331881053 C Ci:1:061:0 0 8 = 8fea58de 5900b538
ffff8803fe1639c0 2331897723 S Ci:1:061:0 s a1 01 0300 0000 0008 8 <
ffff8803fe1639c0 2331897938 C Ci:1:061:0 0 8 = 686ec6dc 8d00ba4f
ffff8803fe1639c0 2331912748 S Ci:1:061:0 s a1 01 0300 0000 0008 8 <
ffff8803fe1639c0 2331912932 C Ci:1:061:0 0 8 = 46ed00c9 4f0005e8
ffff8803fe1639c0 2331927775 S Ci:1:061:0 s a1 01 0300 0000 0008 8 <
ffff8803fe1639c0 2331927931 C Ci:1:061:0 0 8 = 6b51ca4c ee001684
ffff8803fe1639c0 2331944696 S Ci:1:061:0 s a1 01 0300 0000 0008 8 <
ffff8803fe1639c0 2331944808 C Ci:1:061:0 0 8 = bf8001e8 5f00077b
ffff8803fe1639c0 2331959734 S Ci:1:061:0 s a1 01 0300 0000 0008 8 <
ffff8803fe1639c0 2331959932 C Ci:1:061:0 0 8 = 79dd98a1 2000ca36
ffff8803fe1639c0 2331974765 S Ci:1:061:0 s a1 01 0300 0000 0008 8 <
ffff8803fe1639c0 2331974931 C Ci:1:061:0 0 8 = 2c0a24cf a000c321
ffff8803fe1639c0 2331989799 S Ci:1:061:0 s a1 01 0300 0000 0008 8 <
ffff8803fe1639c0 2331989930 C Ci:1:061:0 0 8 = 74b8903a d8001212
ffff8803fe1639c0 2332006724 S Ci:1:061:0 s a1 01 0300 0000 0008 8 <
ffff8803fe1639c0 2332006943 C Ci:1:061:0 0 8 = 7b0d1718 0a007a2d
ffff8803fe1639c0 2332021760 S Ci:1:061:0 s a1 01 0300 0000 0008 8 <
ffff8803fe1639c0 2332021931 C Ci:1:061:0 0 8 = c4f61f21 e200430d
ffff8803fe1639c0 2332036788 S Ci:1:061:0 s a1 01 0300 0000 0008 8 <
ffff8803fe1639c0 2332036932 C Ci:1:061:0 0 8 = cf853320 1300e3d6
ffff8803fe1639c0 2332053718 S Ci:1:061:0 s a1 01 0300 0000 0008 8 <
ffff8803fe1639c0 2332053940 C Ci:1:061:0 0 8 = 00f573d4 57001045
ffff8803fe1639c0 2332068767 S Ci:1:061:0 s a1 01 0300 0000 0008 8 <
ffff8803fe1639c0 2332068921 C Ci:1:061:0 0 8 = 7a5443a1 0300619b
ffff8803fe1639c0 2332083777 S Ci:1:061:0 s a1 01 0300 0000 0008 8 <
ffff8803fe1639c0 2332083933 C Ci:1:061:0 0 8 = e4292081 9600ecac
ffff8803fe1639c0 2332100693 S Ci:1:061:0 s a1 01 0300 0000 0008 8 <
ffff8803fe1639c0 2332100807 C Ci:1:061:0 0 8 = 20d0a20d 1900ce40
ffff8803fe1639c0 2332115726 S Ci:1:061:0 s a1 01 0300 0000 0008 8 <
ffff8803fe1639c0 2332115951 C Ci:1:061:0 0 8 = fc6bd0e7 da009c36
ffff8803fe1639c0 2332130766 S Ci:1:061:0 s a1 01 0300 0000 0008 8 <
ffff8803fe1639c0 2332130933 C Ci:1:061:0 0 8 = b2eb2ddb bf00d73d
ffff8803fdd143c0 2332147818 S Ci:1:061:0 s a1 01 0300 0000 0008 8 <
ffff8803fdd143c0 2332147933 C Ci:1:061:0 0 8 = b17c627c 9e00336b
ffff8803fdd143c0 2332162724 S Ci:1:061:0 s a1 01 0300 0000 0008 8 <
ffff8803fdd143c0 2332162911 C Ci:1:061:0 0 8 = 5397d924 5100fc13
ffff8803ff3989c0 2332177756 S Ci:1:061:0 s a1 01 0300 0000 0008 8 <
ffff8803ff3989c0 2332177942 C Ci:1:061:0 0 8 = 90d93389 42000a87
ffff8803ff3989c0 2332194803 S Ci:1:061:0 s a1 01 0300 0000 0008 8 <
ffff8803ff3989c0 2332194911 C Ci:1:061:0 0 8 = 7054ef42 5300a6e8
ffff8803ff3989c0 2332209708 S Ci:1:061:0 s a1 01 0300 0000 0008 8 <
ffff8803ff3989c0 2332209940 C Ci:1:061:0 0 8 = 0a215859 79007d8a
ffff8803ff3989c0 2332224753 S Ci:1:061:0 s a1 01 0300 0000 0008 8 <
ffff8803ff3989c0 2332224940 C Ci:1:061:0 0 8 = 91014153 fc00fe53
ffff8803ff3989c0 2332241794 S Ci:1:061:0 s a1 01 0300 0000 0008 8 <
ffff8803ff3989c0 2332241933 C Ci:1:061:0 0 8 = 008d1cad 8e0066ec
ffff8802ffcc5cc0 2332256700 S Ci:1:061:0 s a1 01 0300 0000 0008 8 <
ffff8802ffcc5cc0 2332256813 C Ci:1:061:0 0 8 = a86acac2 89006745
ffff8801391a8b40 2332271731 S Ci:1:061:0 s a1 01 0300 0000 0008 8 <
ffff8801391a8b40 2332271911 C Ci:1:061:0 0 8 = d24e001a 8a00bad1
ffff8801391a8b40 2332287688 S Ci:1:061:0 s a1 01 0300 0000 0008 8 <
ffff8801391a8b40 2332287808 C Ci:1:061:0 0 8 = ed329e50 b200c26a
ffff8801391a8b40 2332302888 S Ci:1:061:0 s a1 01 0300 0000 0008 8 <
ffff8801391a8b40 2332303059 C Ci:1:061:0 0 8 = d0d504f5 b700aaea
ffff8801391a8b40 2332319652 S Ci:1:061:0 s a1 01 0300 0000 0008 8 <
ffff8801391a8b40 2332319808 C Ci:1:061:0 0 8 = 89ff1832 3300eb82
ffff8801391a8b40 2332334688 S Ci:1:061:0 s a1 01 0300 0000 0008 8 <
ffff8801391a8b40 2332334811 C Ci:1:061:0 0 8 = 38490bf6 1b003c73
ffff8803ff3989c0 2332349718 S Ci:1:061:0 s a1 01 0300 0000 0008 8 <
ffff8803ff3989c0 2332349942 C Ci:1:061:0 0 8 = 99149f38 53001378
ffff8803ff3989c0 2332366637 S Ci:1:061:0 s a1 01 0300 0000 0008 8 <
ffff8803ff3989c0 2332366808 C Ci:1:061:0 0 8 = 2bb69bc7 d90034df
ffff8802ffcc5cc0 2332381680 S Ci:1:061:0 s a1 01 0300 0000 0008 8 <
ffff8802ffcc5cc0 2332381809 C Ci:1:061:0 0 8 = 55c3821e bf00da47
ffff8802ffcc5cc0 2332396718 S Ci:1:061:0 s a1 01 0300 0000 0008 8 <
ffff8802ffcc5cc0 2332396943 C Ci:1:061:0 0 8 = 3cc23e0a a200c838
ffff8802ffcc5cc0 2332411602 S Ci:1:061:0 s a1 01 0300 0000 0008 8 <
ffff8802ffcc5cc0 2332411820 C Ci:1:061:0 0 8 = 5a57b476 3f005feb
ffff8803fdd143c0 2332428663 S Ci:1:061:0 s a1 01 0300 0000 0008 8 <
ffff8803fdd143c0 2332428812 C Ci:1:061:0 0 8 = 85e154a3 94007743
ffff8803fdd143c0 2332445720 S Ci:1:061:0 s a1 01 0300 0000 0008 8 <
ffff8803fdd143c0 2332445942 C Ci:1:061:0 0 8 = 706873c9 0b009aec
ffff8803fdd143c0 2332458730 S Ci:1:061:0 s a1 01 0300 0000 0008 8 <
ffff8803fdd143c0 2332458951 C Ci:1:061:0 0 8 = 6e66184b 4200eedb
ffff8803fdd143c0 2332475642 S Ci:1:061:0 s a1 01 0300 0000 0008 8 <
ffff8803fdd143c0 2332475812 C Ci:1:061:0 0 8 = 3ab620e6 c900bd4f
ffff8803fdd143c0 2332490693 S Ci:1:061:0 s a1 01 0300 0000 0008 8 <
ffff8803fdd143c0 2332490819 C Ci:1:061:0 0 8 = 80e323b3 b200f12d
ffff8803fdd143c0 2332505724 S Ci:1:061:0 s a1 01 0300 0000 0008 8 <
ffff8803fdd143c0 2332505945 C Ci:1:061:0 0 8 = b603cc72 7c0073e9
ffff8803fdd143c0 2332522643 S Ci:1:061:0 s a1 01 0300 0000 0008 8 <
ffff8803fdd143c0 2332522808 C Ci:1:061:0 0 8 = f9b1b5bf 940096b1
ffff8803fdd143c0 2332537678 S Ci:1:061:0 s a1 01 0300 0000 0008 8 <
ffff8803fdd143c0 2332537811 C Ci:1:061:0 0 8 = 7c7d4e3a ea002e66
ffff8803fdd143c0 2332552814 S Ci:1:061:0 s a1 01 0300 0000 0008 8 <
ffff8803fdd143c0 2332552941 C Ci:1:061:0 0 8 = 0c9c86a4 0a005d19
ffff8803fdd143c0 2332567607 S Ci:1:061:0 s a1 01 0300 0000 0008 8 <
ffff8803fdd143c0 2332567790 C Ci:1:061:0 0 8 = 12b6d9d7 4a00f08d
ffff8802ffcc5cc0 2332585666 S Ci:1:061:0 s a1 01 0300 0000 0008 8 <
ffff8802ffcc5cc0 2332585788 C Ci:1:061:0 0 8 = e103f3ed a800dc8c
ffff8802ffcc5cc0 2332600727 S Ci:1:061:0 s a1 01 0300 0000 0008 8 <
ffff8802ffcc5cc0 2332600948 C Ci:1:061:0 0 8 = d548699d 3300247c
ffff8802ffcc5cc0 2332615740 S Ci:1:061:0 s a1 01 0300 0000 0008 8 <
ffff8802ffcc5cc0 2332615915 C Ci:1:061:0 0 8 = d3f2c2b5 a40029e8
ffff8802ffcc5cc0 2332630647 S Ci:1:061:0 s a1 01 0300 0000 0008 8 <
ffff8802ffcc5cc0 2332630811 C Ci:1:061:0 0 8 = 4c8c84f8 1e0088f3
ffff8802ffcc5cc0 2332645778 S Ci:1:061:0 s a1 01 0300 0000 0008 8 <
ffff8802ffcc5cc0 2332645937 C Ci:1:061:0 0 8 = 89f6d292 47001edf
ffff8802ffcc5cc0 2332662721 S Ci:1:061:0 s a1 01 0300 0000 0008 8 <
ffff8802ffcc5cc0 2332662938 C Ci:1:061:0 0 8 = d90d2797 050040f4
ffff8802ffcc5cc0 2332677625 S Ci:1:061:0 s a1 01 0300 0000 0008 8 <
ffff8802ffcc5cc0 2332677832 C Ci:1:061:0 0 8 = d4c66f0d 1d002a28
ffff8802ffcc5cc0 2332694681 S Ci:1:061:0 s a1 01 0300 0000 0008 8 <
ffff8802ffcc5cc0 2332694791 C Ci:1:061:0 0 8 = 23a4c91d df007d32
ffff8802ffcc5cc0 2332708708 S Ci:1:061:0 s a1 01 0300 0000 0008 8 <
ffff8802ffcc5cc0 2332708813 C Ci:1:061:0 0 8 = 78ef2196 7c005323
ffff8802ffcc5cc0 2332725625 S Ci:1:061:0 s a1 01 0300 0000 0008 8 <
ffff8802ffcc5cc0 2332725813 C Ci:1:061:0 0 8 = b35de531 04006027
ffff8802ffcc5cc0 2332740667 S Ci:1:061:0 s a1 01 0300 0000 0008 8 <
ffff8802ffcc5cc0 2332740815 C Ci:1:061:0 0 8 = 4e273652 4e008e96
ffff8802ffcc5cc0 2332755713 S Ci:1:061:0 s a1 01 0300 0000 0008 8 <
ffff8802ffcc5cc0 2332755946 C Ci:1:061:0 0 8 = 9b926a1b c80005d4
ffff8802ffcc5cc0 2332772611 S Ci:1:061:0 s a1 01 0300 0000 0008 8 <
ffff8802ffcc5cc0 2332772832 C Ci:1:061:0 0 8 = 5df4573e 52009e79
ffff8803fdd143c0 2332787654 S Ci:1:061:0 s a1 01 0300 0000 0008 8 <
ffff8803fdd143c0 2332787813 C Ci:1:061:0 0 8 = 1ae6f959 c900d96f
ffff8803fdd143c0 2332802693 S Ci:1:061:0 s a1 01 0300 0000 0008 8 <
ffff8803fdd143c0 2332802815 C Ci:1:061:0 0 8 = dfc6da77 280013e2
ffff8803fdd143c0 2332819613 S Ci:1:061:0 s a1 01 0300 0000 0008 8 <
ffff8803fdd143c0 2332819798 C Ci:1:061:0 0 8 = 9902e4d2 be00a88a
ffff8803fdd143c0 2332834639 S Ci:1:061:0 s a1 01 0300 0000 0008 8 <
ffff8803fdd143c0 2332834814 C Ci:1:061:0 0 8 = 50bdbfa3 de002390
ffff8803fdd143c0 2332849666 S Ci:1:061:0 s a1 01 0300 0000 0008 8 <
ffff8803fdd143c0 2332849813 C Ci:1:061:0 0 8 = 803d4388 d700017f
ffff8803fdd143c0 2332866731 S Ci:1:061:0 s a1 01 0300 0000 0008 8 <
ffff8803fdd143c0 2332866948 C Ci:1:061:0 0 8 = edaa75d5 e20077b2
ffff8803fdd143c0 2332881630 S Ci:1:061:0 s a1 01 0300 0000 0008 8 <
ffff8803fdd143c0 2332881817 C Ci:1:061:0 0 8 = ad9ea1fa e100e91e
ffff8803fdd143c0 2332896674 S Ci:1:061:0 s a1 01 0300 0000 0008 8 <
ffff8803fdd143c0 2332896814 C Ci:1:061:0 0 8 = 5a0dd863 80001ac9
ffff8801391a8b40 2332913711 S Ci:1:061:0 s a1 01 0300 0000 0008 8 <
ffff8801391a8b40 2332913818 C Ci:1:061:0 0 8 = 8cda06a1 d000f1f5
ffff8801391a8b40 2332928618 S Ci:1:061:0 s a1 01 0300 0000 0008 8 <
ffff8801391a8b40 2332928813 C Ci:1:061:0 0 8 = 4525057d 57002fe9
ffff8801391a8b40 2332943658 S Ci:1:061:0 s a1 01 0300 0000 0008 8 <
ffff8801391a8b40 2332943814 C Ci:1:061:0 0 8 = 2e326f20 610028a9
ffff8801391a8b40 2332960730 S Ci:1:061:0 s a1 01 0300 0000 0008 8 <
ffff8801391a8b40 2332960945 C Ci:1:061:0 0 8 = 3843fb96 6700219a
ffff8801391a8b40 2332975606 S Ci:1:061:0 s a1 01 0300 0000 0008 8 <
ffff8801391a8b40 2332975820 C Ci:1:061:0 0 8 = cb64f61d e9008932
ffff8801391a8b40 2332990639 S Ci:1:061:0 s a1 01 0300 0000 0008 8 <
ffff8801391a8b40 2332990821 C Ci:1:061:0 0 8 = 020627cd aa005c28
ffff8801391a8b40 2333005705 S Ci:1:061:0 s a1 01 0300 0000 0008 8 <
ffff8801391a8b40 2333005817 C Ci:1:061:0 0 8 = 8d0f31eb 9300c706
ffff8801391a8b40 2333022732 S Ci:1:061:0 s a1 01 0300 0000 0008 8 <
ffff8801391a8b40 2333022947 C Ci:1:061:0 0 8 = 5c2c3e03 5300d730
ffff8801391a8b40 2333039637 S Ci:1:061:0 s a1 01 0300 0000 0008 8 <
ffff8801391a8b40 2333039819 C Ci:1:061:0 0 8 = a2309265 9b00b46a
ffff8803fdd143c0 2333052780 S Ci:1:061:0 s a1 01 0300 0000 0008 8 <
ffff8803fdd143c0 2333052941 C Ci:1:061:0 0 8 = b1112142 2b00fa95
ffff8802ffcc5900 2333068706 S Ci:1:061:0 s a1 01 0300 0000 0008 8 <
ffff8802ffcc5900 2333068821 C Ci:1:061:0 0 8 = e2add4a4 44008c86
ffff8803ff398540 2333084620 S Ci:1:061:0 s a1 01 0300 0000 0008 8 <
ffff8803ff398540 2333084817 C Ci:1:061:0 0 8 = 351c9994 9f00a658
ffff8802ffcc5900 2333099644 S Ci:1:061:0 s a1 01 0300 0000 0008 8 <
ffff8802ffcc5900 2333099816 C Ci:1:061:0 0 8 = 8704b47f 9c00edf7
ffff8803fdd143c0 2333114678 S Ci:1:061:0 s a1 01 0300 0000 0008 8 <
ffff8803fdd143c0 2333114816 C Ci:1:061:0 0 8 = b2ac268d 7e005bdc
ffff8802ffcc5900 2333131601 S Ci:1:061:0 s a1 01 0300 0000 0008 8 <
ffff8802ffcc5900 2333131816 C Ci:1:061:0 0 8 = cc9485f6 4d0047e5
ffff8803fdd143c0 2333146639 S Ci:1:061:0 s a1 01 0300 0000 0008 8 <
ffff8803fdd143c0 2333146795 C Ci:1:061:0 0 8 = b03d4708 7e00e09f
ffff8803fdd143c0 2333161668 S Ci:1:061:0 s a1 01 0300 0000 0008 8 <
ffff8803fdd143c0 2333161816 C Ci:1:061:0 0 8 = 712066ed 0e0002f2
ffff8803fdd143c0 2333177732 S Ci:1:061:0 s a1 01 0300 0000 0008 8 <
ffff8803fdd143c0 2333177940 C Ci:1:061:0 0 8 = e2dbd6e8 fa00d474
ffff8803fdd143c0 2333192712 S Ci:1:061:0 s a1 01 0300 0000 0008 8 <
ffff8803fdd143c0 2333192798 C Ci:1:061:0 0 8 = 787c21f1 6800b47d
ffff8803fdd143c0 2333209672 S Ci:1:061:0 s a1 01 0300 0000 0008 8 <
ffff8803fdd143c0 2333209817 C Ci:1:061:0 0 8 = ff266fe7 85000db8
ffff8803fdd143c0 2333224714 S Ci:1:061:0 s a1 01 0300 0000 0008 8 <
ffff8803fdd143c0 2333224797 C Ci:1:061:0 0 8 = 8d7ff7d3 f5001705
ffff8803fdd143c0 2333241622 S Ci:1:061:0 s a1 01 0300 0000 0008 8 <
ffff8803fdd143c0 2333241835 C Ci:1:061:0 0 8 = 776e05ab 4f00b624
ffff8803fdd143c0 2333256662 S Ci:1:061:0 s a1 01 0300 0000 0008 8 <
ffff8803fdd143c0 2333256818 C Ci:1:061:0 0 8 = ffb3ed55 4200a2ba
ffff8803fdd143c0 2333271690 S Ci:1:061:0 s a1 01 0300 0000 0008 8 <
ffff8803fdd143c0 2333271811 C Ci:1:061:0 0 8 = 99af04bb 6a00841f
ffff8803ff398540 2333287621 S Ci:1:061:0 s a1 01 0300 0000 0008 8 <
ffff8803ff398540 2333287808 C Ci:1:061:0 0 8 = 335a4f57 ef00ef7b
ffff8803ff398540 2333302520 S Ci:1:061:0 s a1 01 0300 0000 0008 8 <
ffff8803ff398540 2333302693 C Ci:1:061:0 0 8 = 2b79bd1a 6c0080c5
ffff8803ff398540 2333319589 S Ci:1:061:0 s a1 01 0300 0000 0008 8 <
ffff8803ff398540 2333319700 C Ci:1:061:0 0 8 = f5bf870e d10055ce
ffff8803ff398540 2333334613 S Ci:1:061:0 s a1 01 0300 0000 0008 8 <
ffff8803ff398540 2333334825 C Ci:1:061:0 0 8 = 8204ea7e 0b0039fc
ffff8803ff398540 2333349509 S Ci:1:061:0 s a1 01 0300 0000 0008 8 <
ffff8803ff398540 2333349729 C Ci:1:061:0 0 8 = 18ee804d 1f006799
ffff8803ff398540 2333365554 S Ci:1:061:0 s a1 01 0300 0000 0008 8 <
ffff8803ff398540 2333365694 C Ci:1:061:0 0 8 = 9c048681 9f005349
ffff8803ff398540 2333380693 S Ci:1:061:0 s a1 01 0300 0000 0008 8 <
ffff8803ff398540 2333380817 C Ci:1:061:0 0 8 = 3e451dfb e8002aa5
ffff8801391a8b40 2333396497 S Ci:1:061:0 s a1 01 0300 0000 0008 8 <
ffff8801391a8b40 2333396720 C Ci:1:061:0 0 8 = ccf95a4e b200d64a
ffff8801391a8b40 2333411536 S Ci:1:061:0 s a1 01 0300 0000 0008 8 <
ffff8801391a8b40 2333411670 C Ci:1:061:0 0 8 = c57f9d14 6a004331
ffff8801391a8b40 2333427576 S Ci:1:061:0 s a1 01 0300 0000 0008 8 <
ffff8801391a8b40 2333427673 C Ci:1:061:0 0 8 = f305e583 ff00a6fc
ffff8801391a8b40 2333444500 S Ci:1:061:0 s a1 01 0300 0000 0008 8 <
ffff8801391a8b40 2333444673 C Ci:1:061:0 0 8 = 2429ddf4 0800791b
ffff8801391a8b40 2333458529 S Ci:1:061:0 s a1 01 0300 0000 0008 8 <
ffff8801391a8b40 2333458694 C Ci:1:061:0 0 8 = 5e9d8768 97000c38
ffff8801391a8b40 2333475608 S Ci:1:061:0 s a1 01 0300 0000 0008 8 <
ffff8801391a8b40 2333475829 C Ci:1:061:0 0 8 = 479dcfbb e6002e74
ffff8801391a8b40 2333490616 S Ci:1:061:0 s a1 01 0300 0000 0008 8 <
ffff8801391a8b40 2333490818 C Ci:1:061:0 0 8 = c48b22af 07003b0a
ffff8801391a8b40 2333505514 S Ci:1:061:0 s a1 01 0300 0000 0008 8 <
ffff8801391a8b40 2333505696 C Ci:1:061:0 0 8 = a7f7ac0a 7a00c06d
ffff8801391a8b40 2333522570 S Ci:1:061:0 s a1 01 0300 0000 0008 8 <
ffff8801391a8b40 2333522694 C Ci:1:061:0 0 8 = f4118254 a6002bd0
ffff8801391a8b40 2333536590 S Ci:1:061:0 s a1 01 0300 0000 0008 8 <
ffff8801391a8b40 2333536697 C Ci:1:061:0 0 8 = 28a6a569 9000fb07
ffff8803ff398540 2333553510 S Ci:1:061:0 s a1 01 0300 0000 0008 8 <
ffff8803ff398540 2333553704 C Ci:1:061:0 0 8 = 353c4e55 83005142
ffff8802ffcc5900 2333568552 S Ci:1:061:0 s a1 01 0300 0000 0008 8 <
ffff8802ffcc5900 2333568697 C Ci:1:061:0 0 8 = 14821b11 9a00fdee
ffff8803fdd143c0 2333583583 S Ci:1:061:0 s a1 01 0300 0000 0008 8 <
ffff8803fdd143c0 2333583697 C Ci:1:061:0 0 8 = 679b5b5d 8300f1d6
ffff8803fdd143c0 2333600500 S Ci:1:061:0 s a1 01 0300 0000 0008 8 <
ffff8803fdd143c0 2333600699 C Ci:1:061:0 0 8 = 9f8cabfb 3d00315a
ffff8803fdd143c0 2333615551 S Ci:1:061:0 s a1 01 0300 0000 0008 8 <
ffff8803fdd143c0 2333615700 C Ci:1:061:0 0 8 = 63018598 b0001c1a
ffff8803fdd143c0 2333630575 S Ci:1:061:0 s a1 01 0300 0000 0008 8 <
ffff8803fdd143c0 2333630697 C Ci:1:061:0 0 8 = d9ca965b 76005bfb
ffff8803fdd143c0 2333646621 S Ci:1:061:0 s a1 01 0300 0000 0008 8 <
ffff8803fdd143c0 2333646847 C Ci:1:061:0 0 8 = 2ff68944 cc00a0f3
ffff8801391a8b40 2333662527 S Ci:1:061:0 s a1 01 0300 0000 0008 8 <
ffff8801391a8b40 2333662695 C Ci:1:061:0 0 8 = 03d83fee d300c735
ffff8801391a8b40 2333677569 S Ci:1:061:0 s a1 01 0300 0000 0008 8 <
ffff8801391a8b40 2333677675 C Ci:1:061:0 0 8 = 01ff71c3 9f0072f2
ffff8801391a8b40 2333693600 S Ci:1:061:0 s a1 01 0300 0000 0008 8 <
ffff8801391a8b40 2333693695 C Ci:1:061:0 0 8 = 9723dfc7 97001131
ffff8802ffcc5900 2333708504 S Ci:1:061:0 s a1 01 0300 0000 0008 8 <
ffff8802ffcc5900 2333708697 C Ci:1:061:0 0 8 = 26ed8c35 9e005313
ffff8803fdd143c0 2333724555 S Ci:1:061:0 s a1 01 0300 0000 0008 8 <
ffff8803fdd143c0 2333724697 C Ci:1:061:0 0 8 = 86f0a180 aa00aaaa
ffff8803fdd143c0 2333740601 S Ci:1:061:0 s a1 01 0300 0000 0008 8 <
ffff8803fdd143c0 2333740848 C Ci:1:061:0 0 8 = aa075ec9 49f0c300
